417601	Here's How Every Burger King Shareholder Can Save On Taxes	http://www.bidnessetc.com/24721-heres-how-every-burger-king-shareholder-can-save-on-taxes/	Bidness ETC	b	dPjRYZE_1e6dSgM971J1Vu6D8rqmM	www.bidnessetc.com	1409159541179
417602	Michelangelo Signorile: Burger King's 'Proud Burger' Is A Tax Evasion Cover-Up	http://www.towleroad.com/2014/08/michelangelo-signorile-burger-kings-proud-burger-is-a-tax-evasion-cover-up.html	Towleroad	b	dPjRYZE_1e6dSgM971J1Vu6D8rqmM	www.towleroad.com	1409159541423
417603	Whopper Reason Shareholders Should Hate Inversions? (Hint, It's Not About  ...	http://www.forbes.com/sites/robertwood/2014/08/27/whopper-reason-shareholders-should-hate-inversions-hint-its-not-about-patriotism/	Forbes	b	dPjRYZE_1e6dSgM971J1Vu6D8rqmM	www.forbes.com	1409159541686
417604	MORICI: Obama's anti-business tax agenda chasing Burger King to Canada	http://www.washingtontimes.com/news/2014/aug/27/morici-obamas-anti-business-tax-agenda-chasing-bur/	Washington Times	b	dPjRYZE_1e6dSgM971J1Vu6D8rqmM	www.washingtontimes.com	1409159542063
417605	Canadians worry: Will Burger King wreck Tim Hortons?	http://www.washingtonpost.com/news/storyline/wp/2014/08/27/canadians-worry-will-burger-king-wreck-tim-hortons/	Washington Post	b	dPjRYZE_1e6dSgM971J1Vu6D8rqmM	www.washingtonpost.com	1409159542346
417606	BK says Tim Hortons' deal isn't a tax dodge	http://www.retailwire.com/news-article/17741/bk-says-tim-hortons-deal-isnt-a-tax-dodge	RetailWire	b	dPjRYZE_1e6dSgM971J1Vu6D8rqmM	www.retailwire.com	1409159542591
417607	Dollars to doughnuts, Burger King-Tim Hortons deal is a good one	http://www.petroliatopic.com/2014/08/26/dollars-to-doughnuts-its-a-good-deal	Petrolia Topic	b	dPjRYZE_1e6dSgM971J1Vu6D8rqmM	www.petroliatopic.com	1409159542979
417608	Buffett's special order doesn't upset Burger King deal	http://www.bizjournals.com/kansascity/blog/morning_call/2014/08/buffett-s-special-order-doesn-t-upset-burger-king.html	Kansas City Business Journal \(blog\)	b	dPjRYZE_1e6dSgM971J1Vu6D8rqmM	www.bizjournals.com	1409159557217
417609	Tim Hortons Downgraded by KeyCorp to “Hold” (THI)	http://sleekmoney.com/tim-hortons-downgraded-by-keycorp-to-hold-thi/7193/	sleekmoney	b	dPjRYZE_1e6dSgM971J1Vu6D8rqmM	sleekmoney.com	1409159557567
417610	Dollars to doughnuts, Burger King-Tim Hortons deal is a good one 0	http://www.clintonnewsrecord.com/2014/08/26/dollars-to-doughnuts-its-a-good-deal	Clinton News Record	b	dPjRYZE_1e6dSgM971J1Vu6D8rqmM	www.clintonnewsrecord.com	1409159557744
417611	Burger King To Buy Canada's Tim Hortons For $11.5 billion	http://gulfbusiness.com/2014/08/burger-king-buy-canadas-tim-hortons/	Gulf Business News	b	dPjRYZE_1e6dSgM971J1Vu6D8rqmM	gulfbusiness.com	1409159558044
417612	Canada Stocks to Watch: Tim Hortons, National Bank, Methanex and more	http://blogs.wsj.com/canadarealtime/2014/08/27/canada-stocks-to-watch-tim-hortons-national-bank-methanex-and-more/	Wall Street Journal \(blog\)	b	dPjRYZE_1e6dSgM971J1Vu6D8rqmM	blogs.wsj.com	1409159558316
417613	Burger King buying Tim Hortons for about $11B	http://www.palltimes.com/business/article_88662532-8a9f-5b67-a3fd-03a8bb9b68db.html	PallTimes.com \(subscription\)	b	dPjRYZE_1e6dSgM971J1Vu6D8rqmM	www.palltimes.com	1409159558571
417614	Canadian dollar benefits from Tim's deal	http://www.stockhouse.com/news/bulletins/2014/08/27/caar-benefits-from-tim-s-deal	Stockhouse	b	dPjRYZE_1e6dSgM971J1Vu6D8rqmM	www.stockhouse.com	1409159558850
417615	Burger King-Tim Hortons combo brings 33-year-old CEO Daniel Schwartz to the  ...	http://business.financialpost.com/2014/08/26/daniel-schwartz-burger-king-tim-hortons/	Financial Post	b	dPjRYZE_1e6dSgM971J1Vu6D8rqmM	business.financialpost.com	1409159559051
417616	Tim Hortons Stock Rating Lowered by KeyCorp (THI)	http://www.wkrb13.com/markets/363317/tim-hortons-stock-rating-lowered-by-keycorp-thi/	WKRB News	b	dPjRYZE_1e6dSgM971J1Vu6D8rqmM	www.wkrb13.com	1409159559272
417617	The Spectator's View: Tim's sale - Maple Glazed strong and free	http://www.thespec.com/opinion-story/4799102-the-spectator-s-view-tim-s-sale-maple-glazed-strong-and-free/	Hamilton Spectator	b	dPjRYZE_1e6dSgM971J1Vu6D8rqmM	www.thespec.com	1409159559796
417618	Burger King latest company to undergo corporate inversion in Tim Hortons deal	http://www.ctvnews.ca/business/burger-king-latest-company-to-undergo-corporate-inversion-in-tim-hortons-deal-1.1978608	CTV News	b	dPjRYZE_1e6dSgM971J1Vu6D8rqmM	www.ctvnews.ca	1409159560047
417619	Burger King buys Tim Hortons: Warren Buffett defends deal against tax inversion  ...	http://www.independent.co.uk/news/business/news/burger-king-buys-tim-hortons-warren-buffett-defends-deal-against-tax-inversion-criticism-9693864.html	The Independent	b	dPjRYZE_1e6dSgM971J1Vu6D8rqmM	www.independent.co.uk	1409159560414
417620	Burger King to buy Canada's Tim Hortons for $11.5B	http://www.prairiebizmag.com/event/article/id/20561/	Prairie Business	b	dPjRYZE_1e6dSgM971J1Vu6D8rqmM	www.prairiebizmag.com	1409159560701
417621	Buffett puts shareholders ahead of patriotism in Canadian deal	http://kelo.com/news/articles/2014/aug/27/buffett-puts-shareholders-ahead-of-patriotism-in-canadian-deal/	KELO AM-FM	b	dPjRYZE_1e6dSgM971J1Vu6D8rqmM	kelo.com	1409159560996
417622	Canadian dollar benefits from Burger King's Tim Horton acquisition	http://www.canada.com/business/Canadian+dollar+benefits+from+Burger+King+Horton+acquisition/10153056/story.html	Canada.com	b	dPjRYZE_1e6dSgM971J1Vu6D8rqmM	www.canada.com	1409159561278
417623	Hands off my timbits: No changes promised but operations likely to change	http://www.timescolonist.com/news/world/hands-off-my-timbits-no-changes-promised-but-operations-likely-to-change-1.1328944	Times Colonist	b	dPjRYZE_1e6dSgM971J1Vu6D8rqmM	www.timescolonist.com	1409159561546
417624	Canadian dollar up, currency benefits from Burger King's Tim Horton acquisition	http://www.news1130.com/2014/08/27/canadian-dollar-up-currency-benefits-from-burger-kings-tim-horton-acquisition/	News1130	b	dPjRYZE_1e6dSgM971J1Vu6D8rqmM	www.news1130.com	1409159561782
417625	10 key facts about corporate inversions	http://politics.suntimes.com/article/washington/10-key-facts-about-corporate-inversions/wed-08272014-810am	Chicago Sun-Times	b	dPjRYZE_1e6dSgM971J1Vu6D8rqmM	politics.suntimes.com	1409159562030
417626	Burger King plans to expand Tim Horton's	http://www.newsday.com/business/burger-king-plans-to-expand-tim-horton-s-1.9161462	Newsday	b	dPjRYZE_1e6dSgM971J1Vu6D8rqmM	www.newsday.com	1409159562244
417627	Controversy Erupts Over Burger King's (BKW) Move	http://abcnews.go.com/blogs/business/2014/08/controversy-erupts-over-burger-kings-bkw-move/	ABC News \(blog\)	b	dPjRYZE_1e6dSgM971J1Vu6D8rqmM	abcnews.go.com	1409159562479
417628	Tim Hortons Stock Rating Lowered by BMO Capital Markets (THI)	http://sleekmoney.com/tim-hortons-stock-rating-lowered-by-bmo-capital-markets-thi/7135/	sleekmoney	b	dPjRYZE_1e6dSgM971J1Vu6D8rqmM	sleekmoney.com	1409159562723
417629	A closer look at 3G Capital, the firm behind the Tim Hortons deal	http://www.ctvnews.ca/business/a-closer-look-at-3g-capital-the-firm-behind-the-tim-hortons-deal-1.1978560	CTV News	b	dPjRYZE_1e6dSgM971J1Vu6D8rqmM	www.ctvnews.ca	1409159562933
417630	Burger King Worldwide Inc (NYSE:BKW) And Tim Hortons Inc. (USA) (NYSE:THI  ...	http://wallstreetpr.com/burger-king-worldwide-inc-nysebkw-and-tim-hortons-inc-usa-nysethi-taking-each-others-support-for-business-expansion-29638	WallStreetPR	b	dPjRYZE_1e6dSgM971J1Vu6D8rqmM	wallstreetpr.com	1409159563334
417631	Canadian dollar rises in wake of Tim Hortons deal	http://www.theglobeandmail.com/report-on-business/economy/currencies/canadian-dollar-rises-in-wake-of-tim-hortons-deal/article20217626/	The Globe and Mail	b	dPjRYZE_1e6dSgM971J1Vu6D8rqmM	www.theglobeandmail.com	1409159563598
417632	Tim Hortons Downgraded by BMO Capital Markets to Market Perform (THI)	http://www.mideasttime.com/tim-hortons-downgraded-by-bmo-capital-markets-to-market-perform-thi/204630/	Mideast Time	b	dPjRYZE_1e6dSgM971J1Vu6D8rqmM	www.mideasttime.com	1409159563821
417633	Burger Kings heads for Canada: 10 things to know about corporate inversions	http://www.hendersondailynews.com/news/burger-kings-heads-for-canada-things-to-know-about-corporate/article_df658348-2dd6-11e4-af8f-0019bb2963f4.html	The Henderson Daily News	b	dPjRYZE_1e6dSgM971J1Vu6D8rqmM	www.hendersondailynews.com	1409159564029
417634	Deals of the Day: Burger King Reaction, Allergan Calls a Meeting	http://blogs.wsj.com/moneybeat/2014/08/27/deals-of-the-day-burger-king-reaction-allergan-calls-a-meeting-brazilian-telecom/	Wall Street Journal \(blog\)	b	dPjRYZE_1e6dSgM971J1Vu6D8rqmM	blogs.wsj.com	1409159564342
417635	Burger King buying Tim Hortons to avoid paying US taxes is legit because it  ...	http://www.nydailynews.com/news/national/americans-reducing-tax-bill-article-1.1918258	New York Daily News	b	dPjRYZE_1e6dSgM971J1Vu6D8rqmM	www.nydailynews.com	1409159564870
417636	Burger King's Purchase Of Tim Hortons Isn't As Great As It Sounds	http://seekingalpha.com/article/2453995-burger-kings-purchase-of-tim-hortons-isnt-as-great-as-it-sounds	Seeking Alpha \(registration\)	b	dPjRYZE_1e6dSgM971J1Vu6D8rqmM	seekingalpha.com	1409159565312
417637	Will Burger King get burned by Canada move?	http://archive.pnj.com/usatoday/article/14608907	Pensacola News Journal	b	dPjRYZE_1e6dSgM971J1Vu6D8rqmM	archive.pnj.com	1409159565505
417638	Record for TSX	http://www.baystreet.ca/articles/MarketUpdates.aspx\?id=19146	Baystreet.ca	b	dPjRYZE_1e6dSgM971J1Vu6D8rqmM	www.baystreet.ca	1409159565766
417639	Regina Tim Hortons customers not concerned by Burger King takeover	http://ckom.com/story/regina-tim-hortons-customers-not-concerned-burger-king-takeover/410357	News Talk 650 CKOM	b	dPjRYZE_1e6dSgM971J1Vu6D8rqmM	ckom.com	1409159565984
417640	What is corporate inversion? 10 things to know	http://www.newsday.com/business/what-is-corporate-inversion-10-things-to-know-1.9161092	Newsday	b	dPjRYZE_1e6dSgM971J1Vu6D8rqmM	www.newsday.com	1409159584848
417641	Buffett to Get 9% on $3 Billion Burger King Investment	http://www.bloomberg.com/news/2014-08-26/buffett-to-help-finance-burger-king-tax-saving-deal.html	Bloomberg	b	dPjRYZE_1e6dSgM971J1Vu6D8rqmM	www.bloomberg.com	1409159608434
417642	[Newsmaker] Burger King merger fans tax dispute	http://www.koreaherald.com/view.php\?ud=20140827000770	The Korea Herald	b	dPjRYZE_1e6dSgM971J1Vu6D8rqmM	www.koreaherald.com	1409159608726
417643	Burger King and Tim Hortons in merger	http://www.belfasttelegraph.co.uk/business/news/burger-king-and-tim-hortons-in-merger-30539394.html	Belfast Telegraph	b	dPjRYZE_1e6dSgM971J1Vu6D8rqmM	www.belfasttelegraph.co.uk	1409159609014
417644	Burger King Worldwide Inc. (NYSE:BKW) Acquiring Tim Hortons Inc. (USA  ...	http://basicsmedia.com/burger-king-worldwide-inc-nysebkw-acquiring-tim-hortons-inc-usa-nysethi-for-expansion-and-not-cost-saving-10686	BasicsMedia	b	dPjRYZE_1e6dSgM971J1Vu6D8rqmM	basicsmedia.com	1409159610408
417645	Burger King Facing Backlash For Moving To Canada	http://www.witn.com/home/headlines/Burger-King-Facing-Backlash-For-Moving-To-Canada-272855761.html	WITN	b	dPjRYZE_1e6dSgM971J1Vu6D8rqmM	www.witn.com	1409159610661
417646	Why the Burger King deal is getting a proverbial shrug in DC	http://www.cnbc.com/id/101947736	CNBC	b	dPjRYZE_1e6dSgM971J1Vu6D8rqmM	www.cnbc.com	1409159610907
417647	Corporate Inversions: 10 Things to Know	http://www.foxbusiness.com/markets/2014/08/27/10-things-to-know-about-corporate-inversions/	Fox Business	b	dPjRYZE_1e6dSgM971J1Vu6D8rqmM	www.foxbusiness.com	1409159611157
417648	McIntyre: Blame Burger King deal on Congress	http://www.wdsu.com/national/mcintyre-blame-burger-king-deal-on-congress/27751394	WDSU New Orleans	b	dPjRYZE_1e6dSgM971J1Vu6D8rqmM	www.wdsu.com	1409159640198
417649	Hands off my timbits	http://www.thetelegram.com/section/2014-08-26/article-3848942/Hands-off-my-timbits/1	The Telegram	b	dPjRYZE_1e6dSgM971J1Vu6D8rqmM	www.thetelegram.com	1409159640560
417650	Chain of Thrones: Burger King and Tim Hortons Stronger After Joining Forces	http://news.morningstar.com/articlenet/article.aspx\?id=663016	Morningstar.com	b	dPjRYZE_1e6dSgM971J1Vu6D8rqmM	news.morningstar.com	1409159640822
417651	Canadians will be politely sad if Burger King takes over Tim Hortons	http://www.vox.com/2014/8/27/6071085/tim-hortons-buger-king-canada-politely-sad	Vox	b	dPjRYZE_1e6dSgM971J1Vu6D8rqmM	www.vox.com	1409159641110
417652	Burger King Boycott Demanded by Critics in Wake of Tim Hortons Merger	http://www.newsmax.com/TheWire/burger-king-boycott-tim-hortons-merger/2014/08/27/id/591122/	Newsmax.com	b	dPjRYZE_1e6dSgM971J1Vu6D8rqmM	www.newsmax.com	1409159641416
417653	Tim Hortons Downgraded by CIBC to Sector Perform (THI)	http://sleekmoney.com/tim-hortons-downgraded-by-cibc-to-sector-perform-thi/7020/	sleekmoney	b	dPjRYZE_1e6dSgM971J1Vu6D8rqmM	sleekmoney.com	1409159641659
417654	Tim Hortons Upgraded to Neutral by Credit Suisse (THI)	http://tickerreport.com/banking-finance/285044/tim-hortons-upgraded-to-neutral-by-credit-suisse-thi/	Ticker Report	b	dPjRYZE_1e6dSgM971J1Vu6D8rqmM	tickerreport.com	1409159641827
417655	Burger King in talks to buy Canada's Tim Hortons	http://www.wkyt.com/home/headlines/Burger-King--272844751.html	WKYT	b	dPjRYZE_1e6dSgM971J1Vu6D8rqmM	www.wkyt.com	1409159654466
417656	Credit Suisse Upgrades Tim Hortons to “Neutral” (THI)	http://sleekmoney.com/credit-suisse-upgrades-tim-hortons-to-neutral-thi/7006/	sleekmoney	b	dPjRYZE_1e6dSgM971J1Vu6D8rqmM	sleekmoney.com	1409159671618
417657	Burger King merger: Do 'tax inversions' really make sense? (+video)	http://www.csmonitor.com/Business/2014/0826/Burger-King-merger-Do-tax-inversions-really-make-sense-video	Christian Science Monitor	b	dPjRYZE_1e6dSgM971J1Vu6D8rqmM	www.csmonitor.com	1409159671891
417658	LORNE GUNTER	http://www.sunnewsnetwork.ca/sunnews/straighttalk/archives/2014/08/20140827-074619.html	Sun News Network	b	dPjRYZE_1e6dSgM971J1Vu6D8rqmM	www.sunnewsnetwork.ca	1409159679378
417659	Tim Hortons Rating Lowered to Market Perform at Raymond James (THI)	http://tickerreport.com/banking-finance/285026/tim-hortons-rating-lowered-to-market-perform-at-raymond-james-thi/	Ticker Report	b	dPjRYZE_1e6dSgM971J1Vu6D8rqmM	tickerreport.com	1409159679622
417660	You may be a hypocrite if: You proposed the Buffett Rule in 2012, but are  ...	http://www.al.com/news/index.ssf/2014/08/you_may_be_a_hypocrite_if_you_1.html	The Huntsville Times - al.com	b	dPjRYZE_1e6dSgM971J1Vu6D8rqmM	www.al.com	1409159679853
417661	Inside the takeover of Tim Hortons	http://www.bnn.ca/News/2014/8/27/Inside-the-takeover-of-Tim-Hortons.aspx	bnn.ca	b	dPjRYZE_1e6dSgM971J1Vu6D8rqmM	www.bnn.ca	1409159680292
417662	A-B InBev's link to the Burger King/Tim Hortons buy	http://www.bizjournals.com/stlouis/morning_call/2014/08/a-b-inbevs-link-to-the-burger-king-tim-hortons-buy.html	St. Louis Business Journal	b	dPjRYZE_1e6dSgM971J1Vu6D8rqmM	www.bizjournals.com	1409159680494
417663	Near record territory... A boost in consumer confidence... Burger King seeks growth	http://www.wtop.com/1459/3689193/Near-record-territory-A-boost-in-consumer-confidence-Burger-King-seeks-growth	WTOP	b	dPjRYZE_1e6dSgM971J1Vu6D8rqmM	www.wtop.com	1409159680842
417664	A look at Tim Hortons	http://www.wtop.com/1459/3689126/A-look-at-Tim-Hortons	WTOP	b	dPjRYZE_1e6dSgM971J1Vu6D8rqmM	www.wtop.com	1409159681355
417665	Burger King's merger plan announced	http://the-japan-news.com/news/article/0001526050	The Japan News	b	dPjRYZE_1e6dSgM971J1Vu6D8rqmM	the-japan-news.com	1409159681552
417666	Tim Hortons has historically struggled in the U.S.	http://www.therecord.com/news-story/4799473-tim-hortons-has-historically-struggled-in-the-u-s-/	Waterloo Record	b	dPjRYZE_1e6dSgM971J1Vu6D8rqmM	www.therecord.com	1409159681794
417667	Is Burger King's Deal with Tim Hortons Going to Affect Its Popularity?	http://topnews.us/content/262082-burger-king-s-deal-tim-hortons-going-affect-its-popularity	TopNews United States	b	dPjRYZE_1e6dSgM971J1Vu6D8rqmM	topnews.us	1409159682253
417668	Warren Buffett to invest $3 bn in Burger King's acquisition of Tim Hortons	http://www.domain-b.com/companies/companies_b/berkshire_hathaway/20140827_burger_king.html	domain-B	b	dPjRYZE_1e6dSgM971J1Vu6D8rqmM	www.domain-b.com	1409159682583
417669	Burger King merger: 10 things to know about corporate inversions	http://www.capecodonline.com/apps/pbcs.dll/article\?AID=/20140827/NEWS11/140829631	Capecodonline	b	dPjRYZE_1e6dSgM971J1Vu6D8rqmM	www.capecodonline.com	1409159685982
417670	The urge to merge for Burger King is a whopper	http://wincountry.com/news/articles/2014/aug/27/the-urge-to-merge-for-burger-king-is-a-whopper/	WNWN-FM	b	dPjRYZE_1e6dSgM971J1Vu6D8rqmM	wincountry.com	1409159707100
417671	Warren Buffett will pay $3B for Burger King to buy Tim Hortons — and avoid US  ...	http://www.nydailynews.com/news/national/warren-buffett-pay-3b-burger-king-buy-tim-hortons-article-1.1918034	New York Daily News	b	dPjRYZE_1e6dSgM971J1Vu6D8rqmM	www.nydailynews.com	1409159707448
417672	910 KINA Coffee Talk: Do you think it's wrong for Burger King to move to Canada  ...	http://salinapost.com/2014/08/27/910-kina-coffee-talk-do-you-think-its-wrong-for-burger-kind-to-move-to-canada-for-lower-taxes/	Salina Post	b	dPjRYZE_1e6dSgM971J1Vu6D8rqmM	salinapost.com	1409159707703
417673	Sale Won't Bring Changes	http://blackburnnews.com/chatham/chatham-news/2014/08/27/sale-wont-bring-changes/	BlackburnNews.com	b	dPjRYZE_1e6dSgM971J1Vu6D8rqmM	blackburnnews.com	1409159707968
417674	Letter: FairTax would keep Burger King from going across the border	http://www.nj.com/opinion/index.ssf/2014/08/letter_fairtax_would_keep_burger_king_from_going_across_the_border.html	The Times, Trenton - NJ.com	b	dPjRYZE_1e6dSgM971J1Vu6D8rqmM	www.nj.com	1409159708190
417675	CTVNews.ca Staff	http://www.ctvnews.ca/canada/5-things-to-know-for-wednesday-august-27-1.1978389	CTV News	b	dPjRYZE_1e6dSgM971J1Vu6D8rqmM	www.ctvnews.ca	1409159708400
417676	Warren Buffett Takes a Bite of the Burger King / Tim Hortons Deal	http://jewishbusinessnews.com/2014/08/27/warren-buffett-takes-a-bite-of-the-burger-king-tim-hortons-deal/	Jewish Business News	b	dPjRYZE_1e6dSgM971J1Vu6D8rqmM	jewishbusinessnews.com	1409159708626
417677	Tim Hortons Inc. (THI) Soared To A New High After Burger King Merger	http://www.rttnews.com/2375163/tim-hortons-inc-thi-soared-to-a-new-high-after-burger-king-merger.aspx\?type=sta	RTT News	b	dPjRYZE_1e6dSgM971J1Vu6D8rqmM	www.rttnews.com	1409159708837
417678	Tim Hortons Downgraded by Longbow Research to "Neutral" (THI)	http://www.mideasttime.com/tim-hortons-downgraded-by-longbow-research-to-neutral-thi/204364/	Mideast Time	b	dPjRYZE_1e6dSgM971J1Vu6D8rqmM	www.mideasttime.com	1409159709088
417679	Tim Hortons: How a brand became part of our national identity	http://www.theglobeandmail.com/news/national/tim-hortons-how-a-brand-became-part-of-our-national-identity/article20217349/	The Globe and Mail	b	dPjRYZE_1e6dSgM971J1Vu6D8rqmM	www.theglobeandmail.com	1409159709285
417680	The Morning Risk Report: Values and Reputation Risk in Fast Food	http://blogs.wsj.com/riskandcompliance/2014/08/27/the-morning-risk-report-values-and-reputation-risk-in-fast-food/	Wall Street Journal \(blog\)	b	dPjRYZE_1e6dSgM971J1Vu6D8rqmM	blogs.wsj.com	1409159709541
417681	The Morning Ledger: CFOs Know What Inversions Are Worth	http://blogs.wsj.com/cfo/2014/08/27/the-morning-ledger-cfos-know-what-inversions-are-worth/	Wall Street Journal \(blog\)	b	dPjRYZE_1e6dSgM971J1Vu6D8rqmM	blogs.wsj.com	1409159709776
417682	Burger King buying Tim Hortons	http://www.nbc-2.com/story/26380619/burger-king-buying-tim-hortons	NBC2 News	b	dPjRYZE_1e6dSgM971J1Vu6D8rqmM	www.nbc-2.com	1409159709977
417683	Buffett plans for Tim Hortons to buoy Burger King	http://nypost.com/2014/08/27/buffett-plans-for-tim-hortons-to-buoy-burger-king/	New York Post	b	dPjRYZE_1e6dSgM971J1Vu6D8rqmM	nypost.com	1409159710316
417684	Burger King to buy Tim Hortons for $11.4 billion; now among world's biggest fast  ...	http://economictimes.indiatimes.com/news/international/business/burger-king-to-buy-tim-hortons-for-11-4-billion-now-among-worlds-biggest-fast-food-operations/articleshow/40997666.cms	Economic Times	b	dPjRYZE_1e6dSgM971J1Vu6D8rqmM	economictimes.indiatimes.com	1409159710581
417685	Tim Hortons Rating Lowered to Hold at Miller Tabak & Co. (THI)	http://www.watchlistnews.com/tim-hortons-rating-lowered-to-hold-at-miller-tabak-co-thi/97569/	Watch List News \(press release\)	b	dPjRYZE_1e6dSgM971J1Vu6D8rqmM	www.watchlistnews.com	1409159710866
417686	Tim Hortons Price Target Raised to C$90.00 (THI)	http://www.watchlistnews.com/tim-hortons-price-target-raised-to-c90-00-thi/97517/	Watch List News \(press release\)	b	dPjRYZE_1e6dSgM971J1Vu6D8rqmM	www.watchlistnews.com	1409159711092
417687	Tim Hortons Given New $90.00 Price Target at KeyCorp (THI)	http://www.watchlistnews.com/tim-hortons-given-new-90-00-price-target-at-keycorp-thi/97567/	Watch List News \(press release\)	b	dPjRYZE_1e6dSgM971J1Vu6D8rqmM	www.watchlistnews.com	1409159711369
417688	Desjardins Lowers Tim Hortons to Hold (THI)	http://www.watchlistnews.com/desjardins-lowers-tim-hortons-to-hold-thi/97573/	Watch List News \(press release\)	b	dPjRYZE_1e6dSgM971J1Vu6D8rqmM	www.watchlistnews.com	1409159711554
417689	Tim Hortons (THI) - Analysts' Weekly Ratings Changes	http://www.watchlistnews.com/tim-hortons-thi-analysts-weekly-ratings-changes/97571/	Watch List News \(press release\)	b	dPjRYZE_1e6dSgM971J1Vu6D8rqmM	www.watchlistnews.com	1409159711739
417690	Plugged In: Burger King faces questions about taxes and patriotism	http://fox8.com/2014/08/27/plugged-in-burger-king-faces-questions-about-taxes-and-patriotism/	fox8.com	b	dPjRYZE_1e6dSgM971J1Vu6D8rqmM	fox8.com	1409159711924
417691	Tim Hortons Rating Lowered to Hold at Miller Tabak (THI)	http://www.intercooleronline.com/stocks/tim-hortons-rating-lowered-to-hold-at-miller-tabak-thi/72067/	Intercooler	b	dPjRYZE_1e6dSgM971J1Vu6D8rqmM	www.intercooleronline.com	1409159712217
417692	Tim Hortons Cut to Hold at Desjardins Capital (THI)	http://tickerreport.com/banking-finance/284863/tim-hortons-cut-to-hold-at-desjardins-capital-thi/	Ticker Report	b	dPjRYZE_1e6dSgM971J1Vu6D8rqmM	tickerreport.com	1409159712377
417693	Buffett takes $3bn bite of Burger King deal	http://www.insuranceinsider.com/buffett-takes-3bn-bite-of-burger-king-deal	The Insurance Insider \(subscription\)	b	dPjRYZE_1e6dSgM971J1Vu6D8rqmM	www.insuranceinsider.com	1409159712568
417694	Burger King in $11.4B deal for Tim Hortons	http://www.telegram.com/article/20140827/NEWS/308269503/1237	Worcester Telegram	b	dPjRYZE_1e6dSgM971J1Vu6D8rqmM	www.telegram.com	1409159712801
417695	Buffett Burger King Funds Flip Obama's Inversion Calculus	http://www.bloomberg.com/news/2014-08-27/buffett-burger-king-funds-flip-obama-s-inversion-calculus.html	Bloomberg	b	dPjRYZE_1e6dSgM971J1Vu6D8rqmM	www.bloomberg.com	1409159713057
417696	Burger King eyes Tim Hortons for tax inversion deal	http://www.wfaa.com/story/money/consumer/2014/08/26/burger-king-eyes-hortons-tax-inversion-deal/14663197/	WFAA	b	dPjRYZE_1e6dSgM971J1Vu6D8rqmM	www.wfaa.com	1409159713379
417697	Tim Hortons Price Target Increased to C$82.00 by Analysts at TD Securities (THI)	http://sleekmoney.com/tim-hortons-price-target-increased-to-c82-00-by-analysts-at-td-securities-thi/6806/	sleekmoney	b	dPjRYZE_1e6dSgM971J1Vu6D8rqmM	sleekmoney.com	1409159713618
417698	Business briefs	http://www.thonline.com/news/business/article_2dc9e7d6-438d-5534-8056-0b2775a201d9.html	Dubuque Telegraph Herald	b	dPjRYZE_1e6dSgM971J1Vu6D8rqmM	www.thonline.com	1409159713795
417699	Tim Hortons PT Raised to C$86.00 at Canaccord Genuity (THI)	http://www.mideasttime.com/tim-hortons-pt-raised-to-c86-00-at-canaccord-genuity-thi/204314/	Mideast Time	b	dPjRYZE_1e6dSgM971J1Vu6D8rqmM	www.mideasttime.com	1409159714052
417700	Tim Hortons Lowered to Hold at Desjardins (THI)	http://tickerreport.com/banking-finance/284819/tim-hortons-lowered-to-hold-at-desjardins-thi/	Ticker Report	b	dPjRYZE_1e6dSgM971J1Vu6D8rqmM	tickerreport.com	1409159714331
