85601	Episode VII is already shooting...	http://www.examiner.com/article/episode-vii-is-already-shooting	Examiner.com	e	dgT6Sh3vXmLzwUMfXmqNR6PMXP4MM	www.examiner.com	1396876984136
85602	Star Wars Episode VII Is Confirmed To Already Be Filming	http://comicbook.com/blog/2014/04/06/star-wars-episode-vii-is-confirmed-to-already-be-filming/	Comicbook.com \(blog\)	e	dgT6Sh3vXmLzwUMfXmqNR6PMXP4MM	comicbook.com	1396876984442
85603	STAR WARS: 'Episode VII' Already Shooting	http://www.bigshinyrobot.com/57269/star-wars-episode-vii-already-shooting/	Big Shiny Robot\!	e	dgT6Sh3vXmLzwUMfXmqNR6PMXP4MM	www.bigshinyrobot.com	1396876984672
85604	Is Star Wars: Episode VII Already Filming?	http://wegotthiscovered.com/movies/star-wars-episode-vii-filming/	We Got This Covered	e	dgT6Sh3vXmLzwUMfXmqNR6PMXP4MM	wegotthiscovered.com	1396876984901
85605	Dominic Monaghan lands Star Wars VII Jedi role?	https://uk.movies.yahoo.com/dominic-monaghan-lands-star-wars-vii-jedi-role-193600217.html	Yahoo Movies UK \(blog\)	e	dgT6Sh3vXmLzwUMfXmqNR6PMXP4MM	uk.movies.yahoo.com	1396876985385
85606	The Big Bang Theory Teams Up With Lucasfilm For Star Wars Episode!	http://moviepilot.com/posts/2014/04/05/the-big-bang-theory-teams-up-with-lucasfilm-for-star-wars-episode-1321493	moviepilot.com	e	dgT6Sh3vXmLzwUMfXmqNR6PMXP4MM	moviepilot.com	1396876985584
85607	Source: Scott Chitwood	http://www.comingsoon.net/news/movienews.php\?id=116779	ComingSoon.net	e	dgT6Sh3vXmLzwUMfXmqNR6PMXP4MM	www.comingsoon.net	1396876985888
85608	Star Wars Episode 7 Plot, News and Rumors: Poster, Filming Release Date  ...	http://www.fashionnstyle.com/articles/18121/20140404/star-wars-episode-7-plot-news-and-rumors-poster-filming-release-date-unveiled-may-14-likely-jj-abrams-crew-details.htm	Fashion \& Style	e	dgT6Sh3vXmLzwUMfXmqNR6PMXP4MM	www.fashionnstyle.com	1396876986368
85609	When and where will Star Wars Episode 7 start filming?	http://metro.co.uk/2014/04/04/when-and-where-will-star-wars-episode-7-start-filming-4688458/	Metro	e	dgT6Sh3vXmLzwUMfXmqNR6PMXP4MM	metro.co.uk	1396876986575
85610	A-list actors distract moviegoers	http://www.collegiatetimes.com/opinion/article_1b74f9ae-bb77-11e3-bdbf-0017a43b2370.html	Virginia Tech Collegiate Times	e	dgT6Sh3vXmLzwUMfXmqNR6PMXP4MM	www.collegiatetimes.com	1396876986792
85611	Star Wars: Episode 7 set to start filming in Morocco in May	http://www.hindustantimes.com/entertainment/hollywood/star-wars-episode-7-set-to-start-filming-in-morocco-in-may/article1-1203808.aspx	Hindustan Times	e	dgT6Sh3vXmLzwUMfXmqNR6PMXP4MM	www.hindustantimes.com	1396876987019
85612	'Star Wars 7' Release Date, Cast & Plot: Film Set Hints on Return to Tatooine	http://www.latinospost.com/articles/35544/20140403/star-wars-7-release-date-cast-plot-film-set-hints-on-return-to-tatooine.htm	Latinos Post	e	dgT6Sh3vXmLzwUMfXmqNR6PMXP4MM	www.latinospost.com	1396876987228
85613	Photo Coverage: THE REALISTIC JONESES Cast Takes Opening Night Bows!	http://www.broadwayworld.com/article/Photo-Coverage-THE-REALISTIC-JONESES-Cast-Takes-Opening-Night-Bows-20140407	Broadway World	e	dqr0n0mB-87geKMbuax699QGy4b8M	www.broadwayworld.com	1396877254896
85614	Toni Collette and Marisa Tomei celebrate The Realistic Joneses' opening night	http://www.dailymail.co.uk/tvshowbiz/article-2598514/Toni-Collette-elegant-black-frock-Marisa-Tomei-opts-masculine-attire-party-celebrating-play-opening-night.html	Daily Mail	e	dqr0n0mB-87geKMbuax699QGy4b8M	www.dailymail.co.uk	1396877255098
85615	'The Realistic Joneses' Theater Review: Michael C. Hall Confronts Eternity and  ...	http://www.thewrap.com/the-realistic-joneses-theater-review	TheWrap	e	dqr0n0mB-87geKMbuax699QGy4b8M	www.thewrap.com	1396877255408
85616	Review: Keeping Up with These "Joneses" Isn't Easy	http://www.nbcnewyork.com/entertainment/the-scene/review-realistic-joneses-254045321.html	NBC New York	e	dqr0n0mB-87geKMbuax699QGy4b8M	www.nbcnewyork.com	1396877255855
85617	The Realistic Joneses, Lyceum Theatre, New York, review	http://www.telegraph.co.uk/culture/theatre/theatre-reviews/10747849/The-Realistic-Joneses-Lyceum-Theatre-New-York-review.html	Telegraph.co.uk	e	dqr0n0mB-87geKMbuax699QGy4b8M	www.telegraph.co.uk	1396877256111
85618	Theater review: 'The Realistic Joneses'	http://www.northjersey.com/arts-and-entertainment/theater/language-expresses-aliveness-in-face-of-death-1.842875	NorthJersey.com	e	dqr0n0mB-87geKMbuax699QGy4b8M	www.northjersey.com	1396877256396
85619	Broadway Review: 'The Realistic Joneses'	http://variety.com/2014/legit/reviews/broadway-review-the-realistic-joneses-1201153252/	Variety	e	dqr0n0mB-87geKMbuax699QGy4b8M	variety.com	1396877256729
85620	Review: Will Eno's Broadway debut 'The Realistic Joneses' is quirky but just too  ...	http://www.newser.com/article/1092e9504a274cc1bbd5ca9ac23b621e/review-will-enos-broadway-debut-the-realistic-joneses-is-quirky-but-just-too-odd.html	Newser	e	dqr0n0mB-87geKMbuax699QGy4b8M	www.newser.com	1396877257032
85621	Theater Review: The Realistic Joneses Are All Talk	http://www.vulture.com/2014/04/theater-review-the-realistic-joneses.html	Vulture	e	dqr0n0mB-87geKMbuax699QGy4b8M	www.vulture.com	1396877257267
85622	Keeping up with 'The Realistic Joneses' a sharp treat	http://www.usatoday.com/story/life/theater/2014/04/06/broadway-review-the-realistic-joneses/7295117/	USA TODAY	e	dqr0n0mB-87geKMbuax699QGy4b8M	www.usatoday.com	1396877257485
85623	The Realistic Joneses	http://www.theatermania.com/new-york-city-theater/reviews/04-2014/the-realistic-joneses_68133.html	TheaterMania.com	e	dqr0n0mB-87geKMbuax699QGy4b8M	www.theatermania.com	1396877257920
85624	The Realistic Joneses: Theater Review	http://www.hollywoodreporter.com/review/theater-review-toni-collette-michael-693966	Hollywood Reporter	e	dqr0n0mB-87geKMbuax699QGy4b8M	www.hollywoodreporter.com	1396877258104
85625	REVIEW: 'The Realistic Joneses' features Michael C. Hall, Marisa Tomei in dark  ...	http://www.hollywoodsoapbox.com/\?p=12159	HollywoodSoapbox.com	e	dqr0n0mB-87geKMbuax699QGy4b8M	www.hollywoodsoapbox.com	1396877258324
85626	STAGE TUBE: MURDER FOR TWO Welcomes THE REALISTIC JONESES to  ...	http://www.broadwayworld.com/article/STAGE-TUBE-MURDER-FOR-TWO-Welcomes-THE-REALISTIC-JONESES-to-Broadway-20140406	Broadway World	e	dqr0n0mB-87geKMbuax699QGy4b8M	www.broadwayworld.com	1396877258572
85627	Joneses Squared! The Realistic Joneses, Starring Michael C. Hall, Toni Collette  ...	http://www.broadway.com/buzz/175330/joneses-squared-the-realistic-joneses-starring-michael-c-hall-toni-collette-marisa-tomei-tracy-letts-opens-on-broadway/	Broadway.com	e	dqr0n0mB-87geKMbuax699QGy4b8M	www.broadway.com	1396877258951
85628	Watch Bruce Springsteen Cover Van Halen's 'Jump' at March Madness Fest	http://www.rollingstone.com/music/videos/watch-bruce-springsteen-cover-van-halens-jump-at-march-madness-fest-20140407	RollingStone.com	e	dGxsYL5Mw74B_BM_xUXG2397j1rTM	www.rollingstone.com	1396877539787
85629	Bruce Springsteen Covers Van Halen's 'Jump' in NCAA Final Four Fest  ...	http://www.fashiontimes.com/articles/4602/20140407/bruce-springsteen-cover-van-halen-s-jump-during-performance-ncaa.htm	Fashion Times	e	dGxsYL5Mw74B_BM_xUXG2397j1rTM	www.fashiontimes.com	1396877540020
85630	Springsteen Rocks Rain-Soaked Crowd In Dallas	http://dfw.cbslocal.com/2014/04/07/springsteen-rocks-out-rain-soaked-reunion-park-crowd/	CBS Local	e	dGxsYL5Mw74B_BM_xUXG2397j1rTM	dfw.cbslocal.com	1396877540223
85631	Bruce Springsteen Covers Van Halen Classic	http://www.antimusic.com/news/14/April/07Bruce_Springsteen_Covers_Van_Halen_Classic.shtml	antiMUSIC.com	e	dGxsYL5Mw74B_BM_xUXG2397j1rTM	www.antimusic.com	1396877540434
85632	Music, As Well As Basketball For Final Four	http://connecticut.cbslocal.com/2014/04/07/music-as-well-as-basketball-for-final-four/	CBS Local	e	dGxsYL5Mw74B_BM_xUXG2397j1rTM	connecticut.cbslocal.com	1396877540652
85633	Bruce Springsteen covers Van Halen's 'Jump' – watch	http://www.nme.com/news/bruce-springsteen/76569	NME.com	e	dGxsYL5Mw74B_BM_xUXG2397j1rTM	www.nme.com	1396877540904
85634	Bruce Springsteen opens Dallas US gig with Van Halen 'Jump' cover	http://www.gigwise.com/videos/89961/bruce-springsteen-opens-dallas-us-gig-with-van-halen-jump-cover	Gigwise	e	dGxsYL5Mw74B_BM_xUXG2397j1rTM	www.gigwise.com	1396877541105
85635	Video: Bruce Springsteen Covers Van Halen's 'Jump' as He Closes Out 'NCAA  ...	http://www.aceshowbiz.com/news/view/00069889.html	AceShowbiz	e	dGxsYL5Mw74B_BM_xUXG2397j1rTM	www.aceshowbiz.com	1396877541332
85636	Bruce Springsteen Covers Van Halen's 'Jump' At Final Four Fest: Watch	http://www.billboard.com/articles/news/6039744/bruce-springsteen-covers-van-halens-jump-at-final-four-fest-watch	Billboard	e	dGxsYL5Mw74B_BM_xUXG2397j1rTM	www.billboard.com	1396877541516
85637	Invision / Photo by Matt Strasen	http://www.sacbee.com/2014/04/05/6299627/springsteen-to-close-out-ncaa.html	Sacramento Bee	e	dGxsYL5Mw74B_BM_xUXG2397j1rTM	www.sacbee.com	1396877541759
85638	Hoping for Best Springsteen Show Ever? You were in luck, Dallas	http://www.dallasnews.com/sports/college-sports/ncaa-tournament/the-scene/20140407-hoping-for-best-springsteen-show-ever-you-were-in-luck-dallas.ece	Dallas Morning News	e	dGxsYL5Mw74B_BM_xUXG2397j1rTM	www.dallasnews.com	1396877542120
85639	Springsteen, fun., Pat Green among those closing out NCAA Final Four music  ...	http://www.tribtown.com/view/story/b4e490820f6a435b9c0b1064ab1b5288/US--Final-Four-Springsteen	The Tribune	e	dGxsYL5Mw74B_BM_xUXG2397j1rTM	www.tribtown.com	1396877542379
85640	Bruce Springsteen Covers Van Halen's 'Jump' (Video)	http://www.hollywoodreporter.com/earshot/bruce-springsteen-covers-van-halens-694042	Hollywood Reporter	e	dGxsYL5Mw74B_BM_xUXG2397j1rTM	www.hollywoodreporter.com	1396877542735
85641	Watch: Bruce Springsteen cover Van Halen's "Jump"	http://consequenceofsound.net/2014/04/watch-bruce-springsteen-cover-van-halens-jump/	Consequence of Sound	e	dGxsYL5Mw74B_BM_xUXG2397j1rTM	consequenceofsound.net	1396877542991
85642	Rain doesn't matter; Bruce Springsteen brings the spirit to Dallas	http://www.dallasnews.com/sports/college-sports/ncaa-tournament/the-scene/20140406-bruce-springsteen-brings-the-spirit-to-dallas-barkley-tells-fans-yall-are-expletive-awesome.ece	Dallas Morning News	e	dGxsYL5Mw74B_BM_xUXG2397j1rTM	www.dallasnews.com	1396877543200
85643	Rain can't stop 'The Boss' at free Dallas concert	http://www.wfaa.com/sports/college/final-four/fest-254129111.html	WFAA	e	dGxsYL5Mw74B_BM_xUXG2397j1rTM	www.wfaa.com	1396877543393
85644	Blog: Fans flock to Dallas for free Springsteen concert	http://www.wfaa.com/entertainment/Blog-Fans-flock-to-Dallas-for-free-Springsteen-concert-254112291.html	WFAA	e	dGxsYL5Mw74B_BM_xUXG2397j1rTM	www.wfaa.com	1396877543630
85645	Springsteen closes out NCAA music festival	http://thegardenisland.com/sports_wire/springsteen-closes-out-ncaa-music-festival/article_6e30eb97-c56b-514d-b2eb-2ea263198cea.html	Thegardenisland.com	e	dGxsYL5Mw74B_BM_xUXG2397j1rTM	thegardenisland.com	1396877543964
85646	Watch: Bruce Springsteen opens with Van Halen's 'Jump' at Dallas show	http://www.nj.com/springsteen/index.ssf/2014/04/bruce_springsteen_opens_with_v.html	The Star-Ledger	e	dGxsYL5Mw74B_BM_xUXG2397j1rTM	www.nj.com	1396877544207
85647	Springsteen 'plays ball' to close out three-day NCAA Final 4 music festival	http://www.ctvnews.ca/entertainment/springsteen-plays-ball-to-close-out-three-day-ncaa-final-4-music-festival-1.1763938	CTV News	e	dGxsYL5Mw74B_BM_xUXG2397j1rTM	www.ctvnews.ca	1396877544417
85648	Springsteen closes out Final Four music festival - KMPH FOX 26 | Central San  ...	http://www.kmph.com/story/25176015/springsteen-closes-out-ncaa-music-festival	KMPH Fox 26	e	dGxsYL5Mw74B_BM_xUXG2397j1rTM	www.kmph.com	1396877544635
85649	Springsteen closes out Final Four music festival - San Diego, California News  ...	http://www.cbs8.com/story/25176015/springsteen-closes-out-ncaa-music-festival	KFMB News 8	e	dGxsYL5Mw74B_BM_xUXG2397j1rTM	www.cbs8.com	1396877545038
85650	Springsteen takes stage in Dallas to close out three-day NCAA Final 4 music  ...	http://lethbridgeherald.com/entertainment/entertainment-news/2014/04/06/springsteen-takes-stage-in-dallas-to-close-out-threeday-ncaa-final-4-music-festival/	Lethbridge Herald	e	dGxsYL5Mw74B_BM_xUXG2397j1rTM	lethbridgeherald.com	1396877545272
85651	Springsteen closes out Final Four music festival - WSFA.com: News Weather  ...	http://www.wsfa.com/story/25176015/springsteen-closes-out-ncaa-music-festival	WSFA	e	dGxsYL5Mw74B_BM_xUXG2397j1rTM	www.wsfa.com	1396877545505
85652	Springsteen to close out NCAA music festival	http://www.sfgate.com/news/texas/article/Springsteen-to-close-out-NCAA-music-festival-5380090.php	SFGate	e	dGxsYL5Mw74B_BM_xUXG2397j1rTM	www.sfgate.com	1396877545700
85653	Springsteen closes out Final Four music festival - WBOC-TV 16, Delmarvas  ...	http://www.wboc.com/story/25176015/springsteen-closes-out-ncaa-music-festival	WBOC TV 16	e	dGxsYL5Mw74B_BM_xUXG2397j1rTM	www.wboc.com	1396877546072
85654	Bruce Springsteen to close out NCAA music festival	http://metronews.ca/scene/995306/bruce-springsteen-to-close-out-ncaa-music-festival/	MetroNews Canada	e	dGxsYL5Mw74B_BM_xUXG2397j1rTM	metronews.ca	1396877546298
85655	NCAA March Madness Music Festival 2014: Bruce Springstreen and E Street  ...	http://www.theepochtimes.com/n3/605425-ncaa-march-madness-music-festival-2014-bruce-springstreen-and-e-street-band-to-close-festival/	The Epoch Times	e	dGxsYL5Mw74B_BM_xUXG2397j1rTM	www.theepochtimes.com	1396877546639
85656	Webcast: Bruce Springsteen at March Madness Festival	http://www.vanyaland.com/2014/04/06/webcast-bruce-springsteen-at-march-madness-festival/	Vanyaland	e	dGxsYL5Mw74B_BM_xUXG2397j1rTM	www.vanyaland.com	1396877546903
85657	Watch: Bruce Springsteen's North American tour kickoff show to be webcast tonight	http://www.soundspike.com/story/27744/watch-bruce-springsteens-north-american-tour-kickoff-show-to-be-webcast-tonight/	SoundSpike	e	dGxsYL5Mw74B_BM_xUXG2397j1rTM	www.soundspike.com	1396877547109
85658	Home»News»Entertainment»Springsteen closes out three-day NCAA Final Four  ...	http://www.570news.com/2014/04/06/springsteen-fun-pat-green-among-those-closing-out-ncaa-final-four-music-festival/	570 News	e	dGxsYL5Mw74B_BM_xUXG2397j1rTM	www.570news.com	1396877547344
85659	Despite wet weather, the bands play on at NCAA music festival	http://www.wfaa.com/entertainment/Despite-wet-weather-the-bands-play-on-at-NCAA-music-festival-254068231.html	WFAA	e	dGxsYL5Mw74B_BM_xUXG2397j1rTM	www.wfaa.com	1396877547553
85660	The Killers At NCAA March Madness Music Festival	http://radioalice.cbslocal.com/photo-galleries/2014/04/06/the-killers-at-ncaa-march-madness-music-festival/	Alice @ 97.3	e	dGxsYL5Mw74B_BM_xUXG2397j1rTM	radioalice.cbslocal.com	1396877547755
85661	March Madness Music Festival set to take place despite rain	http://www.myfoxdfw.com/story/25174534/march-madness-music-festival	FOX 4 News	e	dGxsYL5Mw74B_BM_xUXG2397j1rTM	www.myfoxdfw.com	1396877548173
85662	Here is the latest Texas news from The Associated Press	http://www.krgv.com/news/here-is-the-latest-texas-news-from-the-associated-press-680973	KRGV	e	dGxsYL5Mw74B_BM_xUXG2397j1rTM	www.krgv.com	1396877548383
85663	Photos: March Madness Music Festival Day 1	http://www.wfaa.com/entertainment/slideshows/Photos-march-madness-music-festival-day-1-254028341.html	WFAA	e	dGxsYL5Mw74B_BM_xUXG2397j1rTM	www.wfaa.com	1396877548593
85664	Security on alert after fireworks go missing from March Madness Music Festival	http://www.kvue.com/news/state/254064551.html	KVUE	e	dGxsYL5Mw74B_BM_xUXG2397j1rTM	www.kvue.com	1396877548792
85665	'Bruce Springsteen's High Hopes' premieres tonight on HBO	http://www.musictimes.com/articles/5264/20140404/bruce-springsteens-high-hopes-premieres-tonight-on-hbo.htm	Music Times	e	dGxsYL5Mw74B_BM_xUXG2397j1rTM	www.musictimes.com	1396877549079
85666	Security on alert after fireworks go missing from downtown music festival	http://www.wfaa.com/news/crime/Security-on-alert-after-fireworks-go-missing-from-downtown-music-festival-253988071.html	WFAA	e	dGxsYL5Mw74B_BM_xUXG2397j1rTM	www.wfaa.com	1396877549289
85667	Bag Policy Changes At Dallas Final Four Events Following Pyrotechnics Theft	http://dfw.cbslocal.com/2014/04/05/bag-policy-changes-at-dallas-final-four-events-following-pyrotechnics-theft/	CBS Local	e	dGxsYL5Mw74B_BM_xUXG2397j1rTM	dfw.cbslocal.com	1396877549507
85668	Spectacular evening of music at Final Four festival	http://www.khou.com/entertainment/254041661.html	KHOU	e	dGxsYL5Mw74B_BM_xUXG2397j1rTM	www.khou.com	1396877549809
85669	Security on High Alert at Final Four Events	http://www.kfbk.com/articles/kfbk-news-461777/security-on-high-alert-at-final-12224618/	KFBK	e	dGxsYL5Mw74B_BM_xUXG2397j1rTM	www.kfbk.com	1396877550436
85670	March Madness Music Festival fans told to take purses home or throw them away	http://www.myfoxdfw.com/story/25170758/fans-told-to-take-purses-home-or-throw-them-away-at-music-festival	FOX 4 News	e	dGxsYL5Mw74B_BM_xUXG2397j1rTM	www.myfoxdfw.com	1396877550736
85671	Final Four Dallas concerts feature Springsteen	http://www.bnd.com/2014/04/04/3145538/final-four-dallas-concerts-feature.html\?sp=/99/673/	Belleville News Democrat	e	dGxsYL5Mw74B_BM_xUXG2397j1rTM	www.bnd.com	1396877550932
85672	UK fans enjoy night out in Dallas before Final Four begins	http://www.wkyt.com/news/headlines/UK-fans-enjoy-night-out-in-Dallas-before-Final-Four-begins-253996891.html	WKYT	e	dGxsYL5Mw74B_BM_xUXG2397j1rTM	www.wkyt.com	1396877551142
85673	Pyrotechnics Stolen From March Madness Music Festival	http://www.nbcdfw.com/news/sports/Pyrotechnics-Stolen-From-March-Madness-Music-Festival-253990201.html	NBC 5 Dallas-Fort Worth	e	dGxsYL5Mw74B_BM_xUXG2397j1rTM	www.nbcdfw.com	1396877551359
85674	Bruce Springsteen to close out Final Four festival in Dallas	http://www.knoxville.com/news/2014/apr/04/knoxville-springsteen-final-four-dallas/	Knoxville.com	e	dGxsYL5Mw74B_BM_xUXG2397j1rTM	www.knoxville.com	1396877551739
85675	Working With The Boss: 'High Hopes' Director Thom Zimny Discusses His HBO  ...	http://www.forbes.com/sites/allenstjohn/2014/04/04/working-with-the-boss-high-hopes-director-thom-zimny-discusses-his-hbo-documentary-and-collaborating-with-bruce-springsteen/	Forbes	e	dGxsYL5Mw74B_BM_xUXG2397j1rTM	www.forbes.com	1396877551961
85676	Springsteen, fun., Tim McGraw among performers at 3-day free Final Four music  ...	http://www.foxnews.com/sports/2014/04/04/springsteen-fun-tim-mcgraw-among-performers-at-3-day-free-final-four-music/	Fox News	e	dGxsYL5Mw74B_BM_xUXG2397j1rTM	www.foxnews.com	1396877552177
85677	How 'Game Of Thrones' Producers Convinced HBO To Let Them Make An $8  ...	http://www.businessinsider.in/How-Game-Of-Thrones-Producers-Convinced-HBO-To-Let-Them-Make-An-8-Million-Episode/articleshow/33399864.cms	Businessinsider India	e	dusefXlLYqpjdWM5paSCNLPpycB9M	www.businessinsider.in	1396877838258
85678	'Game of Thrones' manages to up the ante in fourth season	http://www.dailytexanonline.com/life-and-arts/2014/04/07/%E2%80%98game-of-thrones%E2%80%99-manages-to-up-the-ante-in-fourth-season	UT The Daily Texan	e	dusefXlLYqpjdWM5paSCNLPpycB9M	www.dailytexanonline.com	1396877838434
85679	Game of Thrones author: TV network 'makes final decisions'	http://www.bbc.co.uk/news/entertainment-arts-26923282	BBC News	e	dusefXlLYqpjdWM5paSCNLPpycB9M	www.bbc.co.uk	1396877838700
85680	Game of Thrones Season 4 Preview: Sky Atlantic/HBO	http://www.blackmorevale.co.uk/Game-Thrones-Season-4-Preview-Sky-Atlantic-HBO/story-20923513-detail/story.html	Blackmore Vale	e	dusefXlLYqpjdWM5paSCNLPpycB9M	www.blackmorevale.co.uk	1396877838885
85681	COLUMN: 'Game Of Thrones' Is Coming: Embracing The Unexpected In Fourth  ...	http://www.bcheights.com/arts-review/column-game-of-thrones-is-coming-embracing-the-unexpected-in-fourth-season-1.3157546	The Heights \(subscription\)	e	dusefXlLYqpjdWM5paSCNLPpycB9M	www.bcheights.com	1396877839140
85682	A Game Of Numbers: The Business Behind Game of Thrones	http://www.bidnessetc.com/business/hbo-game-of-throne-business-entertainment-the-numbers-game-behind-one-of-the-most-successful-tv-series-of-all-time/	Bidness Etc	e	dusefXlLYqpjdWM5paSCNLPpycB9M	www.bidnessetc.com	1396877839486
85683	Game of Thrones stars do their own 'shipping	http://www.digitalspy.com/tv/s151/game-of-thrones/news/a562722/game-of-thrones-stars-do-their-own-shipping.html	Digital Spy	e	dusefXlLYqpjdWM5paSCNLPpycB9M	www.digitalspy.com	1396877839687
85684	Game of Thrones: Season 4 Preview	http://fusion.net/culture/story/game-thrones-season-preview-566001	Fusion	e	dusefXlLYqpjdWM5paSCNLPpycB9M	fusion.net	1396877839903
85685	5 real-life lessons you can learn from Game of Thrones	http://www.telegraph.co.uk/men/the-filter/10742023/5-real-life-lessons-you-can-learn-from-Game-of-Thrones.html	Telegraph.co.uk	e	dusefXlLYqpjdWM5paSCNLPpycB9M	www.telegraph.co.uk	1396877840063
85686	Game of Thrones season four begins with no end in sight for book series	http://www.newstatesman.com/culture/2014/04/game-thrones-season-four-begins-no-end-sight-book-series	New Statesman	e	dusefXlLYqpjdWM5paSCNLPpycB9M	www.newstatesman.com	1396877840249
85687	There Will Be Dragons 5:47am ET	http://theweek.com/article/index/259459/speedreads-snl-gives-a-spoiler-free-shout-out-to-game-of-thrones-fans	The Week Magazine	e	dusefXlLYqpjdWM5paSCNLPpycB9M	theweek.com	1396877840500
85688	Watch: Every death so far in Game of Thrones (the ultimate spoiler video)	http://entertainment.ie/wtf/Watch-Every-death-so-far-in-Game-of-Thrones-the-ultimate-spoiler-video/250922.htm	Entertainment.ie	e	dusefXlLYqpjdWM5paSCNLPpycB9M	entertainment.ie	1396877840712
85689	Game of Thrones: Stop moaning about Season 4 spoilers, the books were  ...	http://www.belfasttelegraph.co.uk/opinion/news-analysis/game-of-thrones-stop-moaning-about-season-4-spoilers-the-books-were-published-years-ago-30160452.html	Belfast Telegraph	e	dusefXlLYqpjdWM5paSCNLPpycB9M	www.belfasttelegraph.co.uk	1396877840997
85690	Wedding Inspiration Fit For 'Game Of Thrones' Super Fans	http://www.huffingtonpost.com/2014/04/07/game-of-thrones-wedding_n_5086368.html	Huffington Post	e	dusefXlLYqpjdWM5paSCNLPpycB9M	www.huffingtonpost.com	1396877841221
85691	Game of Thrones Season 4 Debut Dominates Social Media Charts	http://www.business2community.com/social-buzz/game-thrones-season-4-debut-dominates-social-media-charts-0836633	Business 2 Community	e	dusefXlLYqpjdWM5paSCNLPpycB9M	www.business2community.com	1396877841552
85692	Game of Thrones Dominates Social Charts With Season 4 Debut	http://socialnewsdaily.com/34458/game-of-thrones-dominates-social-charts-with-season-4-debut/\?utm_source=feedburner&amp;utm_medium=feed&amp;utm_campaign=Feed%3A+SocialNewsDaily+(Social+News+Daily)	Social News Daily	e	dusefXlLYqpjdWM5paSCNLPpycB9M	socialnewsdaily.com	1396877841743
85693	Here are Each of the 5179 On-Screen Deaths in Game of Thrones	http://www.gizmodo.co.uk/2014/04/heres-each-of-the-5179-on-screen-deaths-in-game-of-thrones/	Gizmodo UK	e	dusefXlLYqpjdWM5paSCNLPpycB9M	www.gizmodo.co.uk	1396877841976
85694	Washington has nothing on 'Game of Thrones'	http://www.irishtimes.com/news/world/us/washington-has-nothing-on-game-of-thrones-1.1752208	Irish Times	e	dusefXlLYqpjdWM5paSCNLPpycB9M	www.irishtimes.com	1396877842469
85695	VIDEO: Game Of Thrones Is Finally Back!	http://news.ftcpublications.com/2014/04/video-game-of-thrones-is-finally-back/	FTC Publications	e	dusefXlLYqpjdWM5paSCNLPpycB9M	news.ftcpublications.com	1396877842682
85696	The series that inspired George RR Martin to write Game of Thrones is getting a  ...	http://arts.nationalpost.com/2014/04/06/the-series-that-inspired-george-r-r-martin-to-write-game-of-thrones-is-getting-a-sequel/	National Post	e	dusefXlLYqpjdWM5paSCNLPpycB9M	arts.nationalpost.com	1396877842942
85697	“Winter Is Here”: Awesome Collection Of 'Game Of Thrones' Artwork	http://www.flicksandbits.com/2014/04/06/winter-is-here-awesome-collection-of-game-of-thrones-artwork/68242/	Flicks and bits	e	dusefXlLYqpjdWM5paSCNLPpycB9M	www.flicksandbits.com	1396877843169
85698	George RR Martin Swings by SNL to Talk About His Writer's Block	http://io9.com/george-r-r-martin-swings-by-snl-to-talk-about-his-writ-1559449406	io9	e	dusefXlLYqpjdWM5paSCNLPpycB9M	io9.com	1396877843445
85699	'Long Story Short': A Brief History Of How HBO's 'Game of Thrones' Came To Be  ...	http://www.geeksofdoom.com/2014/04/06/long-story-short-a-brief-history-of-how-hbos-game-of-thrones-came-to-be-video	Geeks of Doom	e	dusefXlLYqpjdWM5paSCNLPpycB9M	www.geeksofdoom.com	1396877843638
85700	The Game is afoot!	http://www.winnipegfreepress.com/opinion/columnists/the-game-is-afoot-254004621.html	Winnipeg Free Press	e	dusefXlLYqpjdWM5paSCNLPpycB9M	www.winnipegfreepress.com	1396877843896
