257501	Video: Bill Murray crashes bachelor party, gives speech	http://www.3news.co.nz/Video-Bill-Murray-crashes-bachelor-party-gives-speech/tabid/418/articleID/346091/Default.aspx	3News NZ	e	dnJ8lnsGE-p-CmM0toIlcAaEfMLJM	www.3news.co.nz	1401234632210
257502	Bill Murray gives surprise bachelor party speech at downtown steakhouse	http://www.wncn.com/story/25621184/bill-murray-gives-surprise-bachelor-party-speech-at-downtown-steakhouse	WNCN	e	dnJ8lnsGE-p-CmM0toIlcAaEfMLJM	www.wncn.com	1401234632448
257503	Bill Murray Crashes Bachelor Party! See His Awesome Speech	http://www.extratv.com/2014/05/27/bill-murray-crashes-bachelor-party-see-his-awesome-speech-video/	Extra	e	dnJ8lnsGE-p-CmM0toIlcAaEfMLJM	www.extratv.com	1401234632698
257504	Bill Murray gives surprise bachelor party speech at downtown ste - CBS 3  ...	http://www.cbs3springfield.com/story/25621184/bill-murray-gives-surprise-bachelor-party-speech-at-downtown-steakhouse	WSHM-TV	e	dnJ8lnsGE-p-CmM0toIlcAaEfMLJM	www.cbs3springfield.com	1401234633110
257505	Bill Murray crashes bachelor party	http://www.castanet.net/edition/news-story-116014-8-.htm	Castanet.net	e	dnJ8lnsGE-p-CmM0toIlcAaEfMLJM	www.castanet.net	1401234633310
257506	Bill Murray - Bill Murray Crashes Bachelor Party To Make Travelling Speech	http://www.contactmusic.com/story/bill-murray-crashes-bachelor-party-to-make-travelling-speech_4216727	Contactmusic.com	e	dnJ8lnsGE-p-CmM0toIlcAaEfMLJM	www.contactmusic.com	1401234633862
257507	Bill Murray crashes bucks party, gives marriage advice	http://www.smh.com.au/lifestyle/celebrity/ls-celebrity-news/bill-murray-crashes-bucks-party-gives-marriage-advice-20140528-zrqac.html	Sydney Morning Herald	e	dnJ8lnsGE-p-CmM0toIlcAaEfMLJM	www.smh.com.au	1401234634140
257508	Bill Murray crashes bachelor party to make travelling speech	http://www.hollywood.com/news/brief/57067440/bill-murray-crashes-bachelor-party-to-make-travelling-speech	Hollywood.com	e	dnJ8lnsGE-p-CmM0toIlcAaEfMLJM	www.hollywood.com	1401234634357
257509	Bill Murray's offers marriage advice at man's bachelor party	http://www.straitstimes.com/lifestyle/movies/story/bill-murrays-offers-marriage-advice-mans-bachelor-party-20140528	Straits Times	e	dnJ8lnsGE-p-CmM0toIlcAaEfMLJM	www.straitstimes.com	1401234634588
257510	Video: Bill Murray Crashes Bachelor Party, Gives Groom Sage Advice	http://www.toofab.com/2014/05/27/bill-murray-crashes-bachelor-party-video/	TooFab.com	e	dnJ8lnsGE-p-CmM0toIlcAaEfMLJM	www.toofab.com	1401234634785
257511	Bill Murray Crashes Bachelor Party And Gives Incredible Speech — Watch	http://hollywoodlife.com/2014/05/27/bill-murray-crashes-bachelor-party-gives-speech-video-watch/	Hollywood Life	e	dnJ8lnsGE-p-CmM0toIlcAaEfMLJM	hollywoodlife.com	1401234635159
257512	Bill Murray Invades Bachelor Party, Surprises and Delights Complete Strangers	http://news.moviefone.com/2014/05/27/bill-murray-bachelor-party/	Moviefone	e	dnJ8lnsGE-p-CmM0toIlcAaEfMLJM	news.moviefone.com	1401234635361
257513	Bill Murray's deadpan marriage advice	http://news.ph.msn.com/weird-news/bill-murrays-deadpan-marriage-advice-1	MSN Philippines News	e	dnJ8lnsGE-p-CmM0toIlcAaEfMLJM	news.ph.msn.com	1401234635698
257514	Must-See: Bill Murray Crashes A Bachelor Party	http://www.etcanada.com/blogs/etc_98080/must-see-bill-murray-crashes-a-bachelor-party/celebs/	ETCanada.com \(blog\)	e	dnJ8lnsGE-p-CmM0toIlcAaEfMLJM	www.etcanada.com	1401234635991
257515	Bill Murray Crashed Some Bro's Bachelor Party and Gave an Epic Speech	http://www.celebuzz.com/2014-05-27/bill-murray-crashed-some-bros-bachelor-party-and-gave-an-epic-speech/	Celebuzz	e	dnJ8lnsGE-p-CmM0toIlcAaEfMLJM	www.celebuzz.com	1401234636182
257516	Famous Funny Man Makes Surprise Appearance at Bachelor Party — His  ...	http://www.theblaze.com/stories/2014/05/27/famous-funny-man-makes-surprise-appearance-at-bachelor-party-his-advice-on-marrying-the-one-is-not-to-be-missed/	TheBlaze.com	e	dnJ8lnsGE-p-CmM0toIlcAaEfMLJM	www.theblaze.com	1401234636394
257517	Bill Murray's advice to a groom-to-be	http://blog.sfgate.com/relationships/2014/05/27/bill-murrays-advice-to-a-groom-to-be/	SFGate \(blog\)	e	dnJ8lnsGE-p-CmM0toIlcAaEfMLJM	blog.sfgate.com	1401234636614
257518	Bill Murray crashes bachelor party, proves he's still awesome	http://fox4kc.com/2014/05/27/bill-murray-crashes-bachelor-party-proves-hes-still-awesome/	fox4kc.com	e	dnJ8lnsGE-p-CmM0toIlcAaEfMLJM	fox4kc.com	1401234636854
257519	Bill Murray Crashes Bachelor Party, Gives Inspiring Speech on Love	http://abc13.com/news/bill-murray-crashes-bachelor-party-gives-inspiring-speech-on-love/80297/	KTRK-TV	e	dnJ8lnsGE-p-CmM0toIlcAaEfMLJM	abc13.com	1401234637399
257520	Bill Murray Offers Marriage Advice at Bachelor Party	http://abcnews.go.com/GMA/video/bill-murray-offers-marriage-advice-bachelor-party-23887573	ABC News	e	dnJ8lnsGE-p-CmM0toIlcAaEfMLJM	abcnews.go.com	1401234637643
257521	Bill Murray Crashes Random Bachelor Party & Doles Out Awesome Advice	http://thestir.cafemom.com/entertainment/172902/bill_murray_crashes_random_bachelor	The Stir	e	dnJ8lnsGE-p-CmM0toIlcAaEfMLJM	thestir.cafemom.com	1401234637850
257522	Bill Murray Offers Bachelor Party Advice On Love And Life	http://www.wuft.org/nation-world/2014/05/27/bill-murray-offers-bachelor-party-advice-on-love-and-life/	WUFT	e	dnJ8lnsGE-p-CmM0toIlcAaEfMLJM	www.wuft.org	1401234638068
257523	Bill Murray 'Crashes' Bachelor Party	http://abcnews.go.com/GMA/video/bill-murray-crashes-bachelor-party-23887305	ABC News	e	dnJ8lnsGE-p-CmM0toIlcAaEfMLJM	abcnews.go.com	1401234638319
257524	After Bill Murray crashes stag do: More celebrities surprising strangers at parties  ...	http://www.mirror.co.uk/3am/celebrity-news/after-bill-murray-crashes-stag-3614498	Mirror.co.uk	e	dnJ8lnsGE-p-CmM0toIlcAaEfMLJM	www.mirror.co.uk	1401234638587
257525	Video: Bill Murray crashes Boston College alumnus' bachelor party, gives  ...	http://www.masslive.com/news/boston/index.ssf/2014/05/video_bill_murray_crashes_bost.html	MassLive.com	e	dnJ8lnsGE-p-CmM0toIlcAaEfMLJM	www.masslive.com	1401234638873
257526	Bill Murray crashes bachelor party; 'True Detective' season 2; Steve Perry returns  ...	http://www.syracuse.com/entertainment/index.ssf/2014/05/bill_murray_bachelor_party_true_detective_season_2_steve_perry_eels.html	The Post-Standard	e	dnJ8lnsGE-p-CmM0toIlcAaEfMLJM	www.syracuse.com	1401234639118
257527	Bill Murray crashes bachelor party, gives advice	http://www.kgw.com/news/Bill-Murray-crashes-bachelor-party-gives-advice-260820831.html	kgw.com	e	dnJ8lnsGE-p-CmM0toIlcAaEfMLJM	www.kgw.com	1401234639326
257528	Bill Murray Crashes a Bachelor Party, Gives Groom and Groomsmen Advice	http://www.usmagazine.com/celebrity-news/news/bill-murray-crashes-a-bachelor-party-gives-groom-advice-watch-2014275	Us Magazine	e	dnJ8lnsGE-p-CmM0toIlcAaEfMLJM	www.usmagazine.com	1401234639594
257529	Bill Murray offers marriage advice that every person should hear: Watch	http://www.zap2it.com/blogs/bill_murray_bachelor_party_viral_video-2014-05	Zap2it.com \(blog\)	e	dnJ8lnsGE-p-CmM0toIlcAaEfMLJM	www.zap2it.com	1401234639820
257530	VIRAL VIDEO: Bill Murray crashes bachelor party -gives awesome advice	http://fox43.com/2014/05/27/viral-video-bill-murray-crashes-bachelor-party-gives-awesome-advice/	FOX43.com	e	dnJ8lnsGE-p-CmM0toIlcAaEfMLJM	fox43.com	1401234640047
257531	Bill Murray Crashes Bachelor Party, Gives Epic Marriage Advice to Groomsmen  ...	http://www.christianpost.com/news/bill-murray-crashes-bachelor-party-gives-epic-marriage-advice-to-groomsmen-video-120445/	Christian Post	e	dnJ8lnsGE-p-CmM0toIlcAaEfMLJM	www.christianpost.com	1401234640288
257532	Twice-divorced Bill Murray crashes bachelor party and gives marriage advice  ...	http://www.dailymail.co.uk/tvshowbiz/article-2640920/Twice-divorced-Bill-Murray-crashes-bachelors-party-gives-marriage-advice-hoisting-groom-shoulder.html	Daily Mail	e	dnJ8lnsGE-p-CmM0toIlcAaEfMLJM	www.dailymail.co.uk	1401234640660
257533	Watch Bill Murray Give a Speech to a Bunch of Bros Having a Bachelor Party	http://splitsider.com/2014/05/watch-bill-murray-give-a-drunken-bachelor-party-speech/	Splitsider	e	dnJ8lnsGE-p-CmM0toIlcAaEfMLJM	splitsider.com	1401234640945
257534	Bill Murray Gave A Bunch Of Bros At A Bachelor Party Some Advice [VIDEO]	http://dailycaller.com/2014/05/27/bill-murray-gave-a-bunch-of-bros-at-a-bachelor-party-some-advice-video/	Daily Caller	e	dnJ8lnsGE-p-CmM0toIlcAaEfMLJM	dailycaller.com	1401234641438
257535	Bill Murray Crashed a Boston College Bro's Bachelor Party	http://bostinno.streetwise.co/2014/05/27/bill-murray-crashed-a-boston-college-bros-bachelor-party/	BostInno	e	dnJ8lnsGE-p-CmM0toIlcAaEfMLJM	bostinno.streetwise.co	1401234641786
257536	Bill Murray crashes bachelor party, offers wise advice	http://www.azcentral.com/story/entertainment/people/2014/05/27/bill-murray-bachelor-pary-advice/9637281/	azcentral.com	e	dnJ8lnsGE-p-CmM0toIlcAaEfMLJM	www.azcentral.com	1401234642015
257537	Bill Murray Crashes Bachelor Party, Gives Inspiring Love Speech	http://abcnews.go.com/Entertainment/bill-murray-crashes-bachelor-party-inspiring-love-speech/story\?id=23886337	ABC News	e	dnJ8lnsGE-p-CmM0toIlcAaEfMLJM	abcnews.go.com	1401234642256
257538	Bill Murray Crashes Bachelor Party to Dispense Ghostbustin'-Ass Wisdom	http://www.pastemagazine.com/articles/2014/05/bill-murray-crashes-bachelor-party-to-dispense-gho.html	Paste Magazine	e	dnJ8lnsGE-p-CmM0toIlcAaEfMLJM	www.pastemagazine.com	1401234642711
257539	Watch Bill Murray crash a stag do and give hilarious speech on how to find 'The  ...	http://www.irishmirror.ie/showbiz/watch-bill-murray-crash-stag-3614168	Irish Mirror	e	dnJ8lnsGE-p-CmM0toIlcAaEfMLJM	www.irishmirror.ie	1401234642953
257540	VIDEO: Actor Bill Murray offers advice to bachelor party	http://www.wptv.com/news/local-news/water-cooler/video-actor-bill-murray-offers-advice-to-bachelor-party	WPTV	e	dnJ8lnsGE-p-CmM0toIlcAaEfMLJM	www.wptv.com	1401234643204
257541	5 reasons to invite Bill Murray to your bachelor party	http://www.salon.com/2014/05/27/5_reasons_to_invite_bill_murray_to_your_bachelor_party/	Salon	e	dnJ8lnsGE-p-CmM0toIlcAaEfMLJM	www.salon.com	1401234643455
257542	Bill Murray crashes bachelor party, gives awesome advice	http://www.wkkj.com/articles/entertainment-news-104651/bill-murray-crashes-bachelor-party-gives-12395816	94Country WKKJ	e	dnJ8lnsGE-p-CmM0toIlcAaEfMLJM	www.wkkj.com	1401234643780
257543	Bill Murray gives love, marriage advice to bachelor party visiting Charleston	http://www.postandcourier.com/article/20140527/PC0313/140529430	Charleston Post Courier	e	dnJ8lnsGE-p-CmM0toIlcAaEfMLJM	www.postandcourier.com	1401234643978
257544	Actor Bill Murray crashes bachelor party	http://wqad.com/2014/05/27/actor-bill-murray-crashes-bachelor-party/	WQAD.com -- Quad Cities News \& Weather from WQAD	e	dnJ8lnsGE-p-CmM0toIlcAaEfMLJM	wqad.com	1401234644656
257545	Bill Murray Makes Surprise Appearance At Bachelor Party, And More Of 'What's  ...	http://detroit.cbslocal.com/2014/05/27/bill-murray-makes-surprise-appearance-at-bachelor-party-and-more-of-whats-trending-today-with-zahra/	CBS Local	e	dnJ8lnsGE-p-CmM0toIlcAaEfMLJM	detroit.cbslocal.com	1401234644872
257546	7 Signs Bill Murray Might Crash Your Party	https://uk.celebrity.yahoo.com/gossip/celeb-news/7-signs-bill-murray-might-crash-your-party-183549206.html	Yahoo Celebrity UK	e	dnJ8lnsGE-p-CmM0toIlcAaEfMLJM	uk.celebrity.yahoo.com	1401234645137
257547	Bill Murray Offers Words of Wisdom To A Bachelor Party	http://www.andpop.com/2014/05/27/bill-murray-offers-words-wisdom-bachelor-party/	andPOP	e	dnJ8lnsGE-p-CmM0toIlcAaEfMLJM	www.andpop.com	1401234645398
257548	Bill Murray Crashes Bachelor Party, Gives A Speech [Video]	http://socialnewsdaily.com/38980/bill-murray-crashes-bachelor-party-gives-a-speech-video/	Social News Daily	e	dnJ8lnsGE-p-CmM0toIlcAaEfMLJM	socialnewsdaily.com	1401234645759
257549	Bill Murray gives love advice	https://ph.celebrity.yahoo.com/news/bill-murray-gives-love-advice-120000741.html	Yahoo Philippines News	e	dnJ8lnsGE-p-CmM0toIlcAaEfMLJM	ph.celebrity.yahoo.com	1401234645995
257550	Bill Murray Crashes Bachelor Party Over Memorial Day Weekend, Gives A  ...	http://www.business2community.com/social-buzz/bill-murray-crashes-bachelor-party-memorial-day-weekend-gives-speech-video-0895472	Business 2 Community	e	dnJ8lnsGE-p-CmM0toIlcAaEfMLJM	www.business2community.com	1401234646304
257551	VIDEO: Bill Murray crashes bachelor party & gives epic advice	http://www.sheknows.com/entertainment/articles/1038497/video-bill-murray-crashes-bachelor-party-and-gives-epic-advice	SheKnows.com	e	dnJ8lnsGE-p-CmM0toIlcAaEfMLJM	www.sheknows.com	1401234646695
257552	Viral Video: Bill Murray's bachelor party marriage advice	http://www.nj.com/entertainment/index.ssf/2014/05/bill_murray_bachelor_party_speech.html	The Star-Ledger	e	dnJ8lnsGE-p-CmM0toIlcAaEfMLJM	www.nj.com	1401234646875
257553	Bill Murray Surprises Bachelor Party with Impromptu Speech	http://www.rollingstone.com/movies/news/bill-murray-surprises-bachelor-party-with-impromptu-speech-20140527	RollingStone.com	e	dnJ8lnsGE-p-CmM0toIlcAaEfMLJM	www.rollingstone.com	1401234647091
257554	Bill Murray gives surprise bachelor party speech at downtown ste - WFSB 3  ...	http://www.wfsb.com/story/25621184/bill-murray-gives-surprise-bachelor-party-speech-at-downtown-steakhouse	WFSB	e	dnJ8lnsGE-p-CmM0toIlcAaEfMLJM	www.wfsb.com	1401234647406
257555	Bill Murray - Bill Murray crashes bachelor party	http://www.contactmusic.com/story/bill-murray-crashes-bachelor-party_4216565	Contactmusic.com	e	dnJ8lnsGE-p-CmM0toIlcAaEfMLJM	www.contactmusic.com	1401234647884
257556	WATCH: Bill Murray Crashed A Bachelor Party And Gave A Great Speech [VIDEO]	http://www.mstarz.com/articles/31159/20140527/watch-bill-murray-crashed-bachelor-party-gave-great-speech-video.htm	Mstarz	e	dnJ8lnsGE-p-CmM0toIlcAaEfMLJM	www.mstarz.com	1401234648107
257557	Bill Murray crashes bachelor party, advises engaged couples to skip the  ...	http://www.laughspin.com/2014/05/27/bill-murray-crashes-bachelor-party-advises-engaged-couples-to-skip-the-wedding-video/	Laughspin	e	dnJ8lnsGE-p-CmM0toIlcAaEfMLJM	www.laughspin.com	1401234648309
257558	Must-See: Bill Murray crashes bachelor party	http://wonderwall.msn.com/movies/must-see-bill-murray-crashes-bachelor-party-1816478.story	Wonderwall	e	dnJ8lnsGE-p-CmM0toIlcAaEfMLJM	wonderwall.msn.com	1401234648709
257559	Bill Murray crashed a bachelor party, gave an amazing speech on marriage  ...	http://arts.nationalpost.com/2014/05/27/bill-murray-crashed-a-bachelor-party-gave-an-amazing-speech-on-marriage-watch-it-here/	National Post	e	dnJ8lnsGE-p-CmM0toIlcAaEfMLJM	arts.nationalpost.com	1401234648973
257560	Bill Murray crashes bachelor party, shares wisdom	http://nypost.com/2014/05/27/bill-murray-gives-sage-advice-after-crashing-bachelor-party/	New York Post	e	dnJ8lnsGE-p-CmM0toIlcAaEfMLJM	nypost.com	1401234649256
257561	Bill Murray gives surprise bachelor party speech at downtown ste - KCTV5	http://www.kctv5.com/story/25621184/bill-murray-gives-surprise-bachelor-party-speech-at-downtown-steakhouse	KCTV Kansas City	e	dnJ8lnsGE-p-CmM0toIlcAaEfMLJM	www.kctv5.com	1401234649440
257562	Bill Murray gives impromptu speech at Charleston bachelor party	http://realitytvworld.com/news/bill-murray-gives-impromptu-speech-at-charleston-bachelor-party-50129302.php	Reality TV World	e	dnJ8lnsGE-p-CmM0toIlcAaEfMLJM	realitytvworld.com	1401234649658
257563	Bill Murray crashes Boston College buddies' bachelor party	http://www.wcvb.com/news/bill-murray-crashes-boston-college-buddies-bachelor-party/26189582	WCVB Boston	e	dnJ8lnsGE-p-CmM0toIlcAaEfMLJM	www.wcvb.com	1401234649885
257564	Video: Bill Murray crashes bachelor party, offers sage love advice	http://fox13now.com/2014/05/27/video-bill-murray-crashes-bachelor-party-offers-sage-love-advice/	fox13now.com	e	dnJ8lnsGE-p-CmM0toIlcAaEfMLJM	fox13now.com	1401234650436
257565	VIDEO: Bill Murray crashes bachelor party and offers advice	http://wgntv.com/2014/05/27/bill-murray-crashes-bachelor-party-and-offers-advice/	WGNtv.com	e	dnJ8lnsGE-p-CmM0toIlcAaEfMLJM	wgntv.com	1401234650663
257566	Bill Murray Crashes Bachelor Party, Gives Hilarious Advice [VIDEO]	http://rumorfix.com/2014/05/bill-murray-crashes-bachelor-party-gives-hilarious-advice-video/	RumorFix	e	dnJ8lnsGE-p-CmM0toIlcAaEfMLJM	rumorfix.com	1401234650912
257567	Bill Murray crashed a bachelor party, dispensed love advice (Video)	http://thecelebritycafe.com/feature/2014/05/bill-murray-crashed-bachelor-party-dispensed-love-advice-video	TheCelebrityCafe.com	e	dnJ8lnsGE-p-CmM0toIlcAaEfMLJM	thecelebritycafe.com	1401234651412
257568	Bill Murray imparts wisdom and thrills at random bachelor party -- VIDEO	http://popwatch.ew.com/2014/05/27/bill-murray-bachelor-party-video/	Entertainment Weekly	e	dnJ8lnsGE-p-CmM0toIlcAaEfMLJM	popwatch.ew.com	1401234651585
257569	Cool Videos: Bill Murray crashes bachelor party; delivers sage-like advice	http://www.joblo.com/movie-news/cool-videos-bill-murray-crashes-bachelor-party-delivers-sage-like-advice-698	JoBlo.com	e	dnJ8lnsGE-p-CmM0toIlcAaEfMLJM	www.joblo.com	1401234651779
257570	Bill Murray crashes guy's bachelor party, gives him awesome advice	http://pix11.com/2014/05/27/bill-murray-crashes-guys-bachelor-party-gives-him-awesome-advice/	New York's PIX11 \/ WPIX-TV	e	dnJ8lnsGE-p-CmM0toIlcAaEfMLJM	pix11.com	1401234652449
257571	Bill Murray Crashes Bachelor Party, Offers Solid Advice for Finding 'The One'	http://firsttoknow.com/bill-murray-crashes-bachelor-party-offers-solid-advice-finding-one/	First to Know	e	dnJ8lnsGE-p-CmM0toIlcAaEfMLJM	firsttoknow.com	1401234652680
257572	Bill Murray crashes bachelor party, delivers epic speech because he's Bill F  ...	http://www.dose.ca/2014/05/27/bill-murray-crashes-bachelor-party-delivers-epic-speech-because-hes-bill-fcking-murray-video	Dose.ca	e	dnJ8lnsGE-p-CmM0toIlcAaEfMLJM	www.dose.ca	1401234652955
257573	Bill Murray bumps into stag party and offers groom sage advice	http://www.independent.ie/incoming/bill-murray-bumps-into-stag-party-and-offers-groom-sage-advice-30309206.html	Irish Independent	e	dnJ8lnsGE-p-CmM0toIlcAaEfMLJM	www.independent.ie	1401234653289
257574	Bill Murray Crashes Wedding While Offering Some Much Needed Wisdom	http://www.designntrend.com/articles/14527/20140527/bill-murray-crashes-wedding-offering-much-needed-wisdom.htm	Design \& Trend	e	dnJ8lnsGE-p-CmM0toIlcAaEfMLJM	www.designntrend.com	1401234653519
257575	Bill Murray Crashed A Bachelor Party And Gave Out Advice, Because That's  ...	http://www.crushable.com/2014/05/27/entertainment/bill-murray-bachelor-party-video/	Crushable	e	dnJ8lnsGE-p-CmM0toIlcAaEfMLJM	www.crushable.com	1401234653719
257576	Bill Murray crashes bachelor party, offers advice	http://www.kare11.com/story/entertainment/movies/2014/05/27/bill-murray-crashes-bachelor-party-offers-advice/9629775/	KARE	e	dnJ8lnsGE-p-CmM0toIlcAaEfMLJM	www.kare11.com	1401234654093
257577	Bill Murray Crashes Bachelor Party, Gives Amazing Speech (WATCH)	http://www.entertainmentwise.com/news/150267/Bill-Murray-Crashes-Bachelor-Party-Gives-Amazing-Speech-WATCH	Entertainmentwise	e	dnJ8lnsGE-p-CmM0toIlcAaEfMLJM	www.entertainmentwise.com	1401234654338
257578	Bill Murray Crashed a Bachelor Party and Dropped Some Wisdom This Weekend	http://www.mediaite.com/online/bill-murray-crashed-a-bachelor-party-and-dropped-some-wisdom-this-weekend/	Mediaite	e	dnJ8lnsGE-p-CmM0toIlcAaEfMLJM	www.mediaite.com	1401234654531
257579	WATCH: Bill Murray crashes bachelor party, offers advice in life and love	http://www.philly.com/philly/blogs/entertainment/WATCH-Bill-Murray-crashes-bachelor-party-offers-advice-in-life-and-love.html	Philly.com \(blog\)	e	dnJ8lnsGE-p-CmM0toIlcAaEfMLJM	www.philly.com	1401234654723
257580	Bill Murray crashes bachelor party, gives epic speech	http://kwgn.com/2014/05/27/bill-murray-crashes-bachelor-party-gives-epic-speech/	kwgn.com	e	dnJ8lnsGE-p-CmM0toIlcAaEfMLJM	kwgn.com	1401234655109
257581	Bill Murray Crashes Bachelor Party, Offers Advice to Single Men	http://www.thehollywoodgossip.com/2014/05/bill-murray-crashes-bachelor-party-offers-advice-to-single-men/	The Hollywood Gossip	e	dnJ8lnsGE-p-CmM0toIlcAaEfMLJM	www.thehollywoodgossip.com	1401234655335
257582	Bill Murray	http://www.zimbio.com/How+to+Have+a+Happy+Marriage,+According+to+Celebs/articles/nCa75biT-20/Bill+Murray	Zimbio	e	dnJ8lnsGE-p-CmM0toIlcAaEfMLJM	www.zimbio.com	1401234655532
257583	That time Bill Murray crashed a some bro's bachelor party in Charleston	http://www.charlestoncitypaper.com/Eat/archives/2014/05/27/that-time-bill-murray-crashed-a-some-bros-bachelor-party-in-charleston	Charleston City Paper	e	dnJ8lnsGE-p-CmM0toIlcAaEfMLJM	www.charlestoncitypaper.com	1401234655744
257584	Bill Murray crashes South Carolina bachelor party, doles out advice	http://www.nydailynews.com/entertainment/gossip/bill-murray-crashes-charleston-bachelor-party-article-1.1806836	New York Daily News	e	dnJ8lnsGE-p-CmM0toIlcAaEfMLJM	www.nydailynews.com	1401234656116
257585	Bill Murray crashes bachelor party, because of course, and offers wise advice	http://entertainthis.usatoday.com/2014/05/27/bill-murray-crashes-bachelor-party-advice-speech/	USA TODAY	e	dnJ8lnsGE-p-CmM0toIlcAaEfMLJM	entertainthis.usatoday.com	1401234656357
257586	Watch Bill Murray Give An Epic Speech At A Random Dude's Bachelor Party	http://www.cinemablend.com/pop/Watch-Bill-Murray-Give-An-Epic-Speech-Random-Dude-Bachelor-Party-64318.html	Cinema Blend	e	dnJ8lnsGE-p-CmM0toIlcAaEfMLJM	www.cinemablend.com	1401234656567
257587	Bill Murray gatecrashes a bachelor party and delivers an awesome speech	http://www.radiotimes.com/news/2014-05-27/bill-murray-gatecrashes-a-bachelor-party-and-delivers-an-awesome-speech	Radio Times	e	dnJ8lnsGE-p-CmM0toIlcAaEfMLJM	www.radiotimes.com	1401234656796
257588	Bill Murray crashed some guy's bachelor party and gave a speech	http://www.salon.com/2014/05/27/bill_murray_crashed_some_guys_bachelor_party_and_gave_a_speech/	Salon	e	dnJ8lnsGE-p-CmM0toIlcAaEfMLJM	www.salon.com	1401234657157
257589	Bill Murray Crashes Random Bachelor Party, Gives Great Marriage Advice	http://www.cosmopolitan.com/celebrity/news/bill-murray-marriage-advice	Cosmopolitan	e	dnJ8lnsGE-p-CmM0toIlcAaEfMLJM	www.cosmopolitan.com	1401234657419
257590	Bill Murray Gatecrashes Stag Party, Gives Awesome Speech (VIDEO)	http://www.huffingtonpost.co.uk/2014/05/27/bill-murray-gatecrashes-bachelor-party_n_5398119.html	Huffington Post UK	e	dnJ8lnsGE-p-CmM0toIlcAaEfMLJM	www.huffingtonpost.co.uk	1401234658255
257591	VIDEO: Bill Murray crashes guy's bachelor party, offers words of wisdom	http://wtvr.com/2014/05/27/bill-murray-bachelor-party/	wtvr.com	e	dnJ8lnsGE-p-CmM0toIlcAaEfMLJM	wtvr.com	1401234658670
257592	Bill Murray lends further credence to Bill Murray stories by crashing a bachelor  ...	http://www.avclub.com/article/bill-murray-lends-further-credence-bill-murray-sto-205058	A.V. Club \(blog\)	e	dnJ8lnsGE-p-CmM0toIlcAaEfMLJM	www.avclub.com	1401234658887
257593	Bill Murray Crashes Bachelor Party, Offers Marriage Advice - WATCH VIDEO	http://www.gossipcop.com/bill-murray-bachelor-party-video-marriage-advice/	GossipCop	e	dnJ8lnsGE-p-CmM0toIlcAaEfMLJM	www.gossipcop.com	1401234659111
257594	Watch Bill Murray crash a random bachelor party and give a great speech	http://fox2now.com/2014/05/27/watch-bill-murray-crash-a-random-bachelor-party-and-give-a-great-speech/	fox2now.com	e	dnJ8lnsGE-p-CmM0toIlcAaEfMLJM	fox2now.com	1401234659317
257595	Bill Murray bachelor party crash is the Bill Murray-ist thing you'll see today	http://guyism.com/humor/bill-murray-bachelor-party-video.html	Guyism	e	dnJ8lnsGE-p-CmM0toIlcAaEfMLJM	guyism.com	1401234659551
257596	Viral Vid: Bill Murray at a Stag Party	http://www.thedailybeast.com/articles/2014/05/27/viral-video-of-the-day-bill-murray-crashes-bachelor-party.html	Daily Beast	e	dnJ8lnsGE-p-CmM0toIlcAaEfMLJM	www.thedailybeast.com	1401234659904
257597	Bill Murray crashes random guy's bachelor party in Charleston, gives a great  ...	http://myfox8.com/2014/05/27/bill-murray-crashes-random-guys-bachelor-party-in-charleston-gives-great-speech/	myfox8.com	e	dnJ8lnsGE-p-CmM0toIlcAaEfMLJM	myfox8.com	1401234660278
257598	Bill Murray Crashes a Bachelor Party and Proves He's Still Awesome	http://screencrush.com/bill-murray-bachelor-party/	ScreenCrush	e	dnJ8lnsGE-p-CmM0toIlcAaEfMLJM	screencrush.com	1401234660516
257599	Bill Murray crashes bachelor party, offers sage advice to guests	http://www.today.com/entertainment/bill-murray-crashes-bachelor-party-offers-sage-advice-guests-2D79719747	Today.com	e	dnJ8lnsGE-p-CmM0toIlcAaEfMLJM	www.today.com	1401234660860
257600	EXCLUSIVE: The Manus Island meeting that set off a riot	http://media.brisbanetimes.com.au/news/national-news/exclusive-the-manus-island-meeting-that-set-off-a-riot-5461798.html	Brisbane Times	e	dnJ8lnsGE-p-CmM0toIlcAaEfMLJM	media.brisbanetimes.com.au	1401234661107
