20301	Saturated fat and heart disease may not be linked after all, according to  ...	http://www.cambridge-news.co.uk/News/Saturated-fat-and-heart-disease-may-not-be-linked-after-all-according-to-Cambridge-University-research-20140318073045.htm	Cambridge News	m	dCyB4k1dt-nTeKMd97jX9Bl8Da0UM	www.cambridge-news.co.uk	1395168458143
20302	Meta-analysis questions fatty acids and heart disease link	http://www.upi.com/Health_News/2014/03/17/Meta-analysis-questions-fatty-acids-and-heart-disease-link/UPI-45731395109432/	UPI.com	m	dCyB4k1dt-nTeKMd97jX9Bl8Da0UM	www.upi.com	1395168458345
20303	Review questions the effects of dietary fats on heart disease	http://www.jamestownsun.com/content/review-questions-effects-dietary-fats-heart-disease	Jamestown Sun	m	dCyB4k1dt-nTeKMd97jX9Bl8Da0UM	www.jamestownsun.com	1395168458522
20304	Saturated fat may not cause heart disease after all	http://www.health24.com/Medical/Heart/News/Saturated-fat-may-not-cause-heart-disease-after-all-20140318	Health24.com	m	dCyB4k1dt-nTeKMd97jX9Bl8Da0UM	www.health24.com	1395168458699
20305	Saturated Fat Not So Dangerous	http://www.thedailybeast.com/cheats/2014/03/18/sat-fat-won-t-cause-heart-attack.html	Daily Beast	m	dCyB4k1dt-nTeKMd97jX9Bl8Da0UM	www.thedailybeast.com	1395168458908
20306	Advice on saturated fat 'unclear'	http://www.healthcare-today.co.uk/news/advice-on-saturated-fat-unclear/25283/	Healthcare Today	m	dCyB4k1dt-nTeKMd97jX9Bl8Da0UM	www.healthcare-today.co.uk	1395168459076
20307	Link between saturated fats and heart disease under scanner	http://www.utahpeoplespost.com/2014/03/link-between-saturated-fats-and-heart-disease-under-scanner/	The Utah People's Post	m	dCyB4k1dt-nTeKMd97jX9Bl8Da0UM	www.utahpeoplespost.com	1395168459330
20308	Review questions effects of saturated fats on heart disease	http://www.foxnews.com/health/2014/03/18/review-questions-effects-saturated-fats-on-heart-disease/	Fox News	m	dCyB4k1dt-nTeKMd97jX9Bl8Da0UM	www.foxnews.com	1395168459513
20309	Was all that we knew about the link between fat and heart disease wrong?	http://health.india.com/diseases-conditions/was-all-that-we-knew-about-the-link-between-fat-and-heart-disease-wrong/	India.Com Health	m	dCyB4k1dt-nTeKMd97jX9Bl8Da0UM	health.india.com	1395168459706
20310	Doctor Disputes Benefits of Fish, Corn and Sunflower Oils	http://www.kmbz.com/Doctor-Disputes-Benefits-of-Fish-Corn-and-Sunflowe/18613211	KMBZ	m	dCyB4k1dt-nTeKMd97jX9Bl8Da0UM	www.kmbz.com	1395168459909
20311	Link Between Saturated Fat and Heart Disease Unclear	http://www.natureworldnews.com/articles/6370/20140318/link-between-saturated-fat-heart-disease-unclear.htm	Nature World News	m	dCyB4k1dt-nTeKMd97jX9Bl8Da0UM	www.natureworldnews.com	1395168460294
20312	Saturated Fats Alone Doesn't Cause Heart Disease Risk: Omega-3s May Have  ...	http://www.foodworldnews.com/articles/5436/20140318/saturated-fats-alone-doesnt-cause-heart-disease-risk-omega-3s.htm	Food World News	m	dCyB4k1dt-nTeKMd97jX9Bl8Da0UM	www.foodworldnews.com	1395168460478
20313	Researchers Question Guidelines Linking Saturated Fats and Increased Cardiac  ...	http://www.universityherald.com/articles/8192/20140318/researchers-question-guidelines-links-saturated-fat-increased-cardiac-events.htm	University Herald	m	dCyB4k1dt-nTeKMd97jX9Bl8Da0UM	www.universityherald.com	1395168460656
20314	Saturated fats do not cause heart diseases, study finds	http://zeenews.india.com/news/health/diseases/saturated-fats-do-not-cause-heart-diseases-study-finds_27166.html	Zee News	m	dCyB4k1dt-nTeKMd97jX9Bl8Da0UM	zeenews.india.com	1395168460833
20315	Are saturated fats enough to cause a cardiac arrest or heart ailments?	http://www.thealmagest.com/are-saturated-fats-enough-to-cause-a-cardiac-arrest-or-heart-ailments/11328	The Almagest	m	dCyB4k1dt-nTeKMd97jX9Bl8Da0UM	www.thealmagest.com	1395168461026
20316	Saturated fat alone doesn't predict heart disease risk	http://www.cbc.ca/news/health/saturated-fat-alone-doesn-t-predict-heart-disease-risk-1.2576252	CBC.ca	m	dCyB4k1dt-nTeKMd97jX9Bl8Da0UM	www.cbc.ca	1395168461302
20317	Curbing saturated fats alone may not reduce risk to heart	http://post.jagran.com/curbing-saturated-fats-alone-may-not-reduce-risk-to-heart-1395136650	Jagran Post	m	dCyB4k1dt-nTeKMd97jX9Bl8Da0UM	post.jagran.com	1395168461620
20318	Studies: Foods rich in fish oils don't reduce heart attack risk	http://www.pressherald.com/news/Foods_rich_in_fish_oils_don_t_reduce_heart_attack_risk_.html	Press Herald	m	dCyB4k1dt-nTeKMd97jX9Bl8Da0UM	www.pressherald.com	1395168461863
20319	Omega-3 Fatty Acids: Studies Don't Support Heart Benefit	http://www.medpagetoday.com/Cardiology/Prevention/44803	MedPage Today	m	dCyB4k1dt-nTeKMd97jX9Bl8Da0UM	www.medpagetoday.com	1395168462040
20320	Study doubts saturated fat's link to heart disease	http://www.telegram.com/article/20140318/NEWS/303189960/1052	Worcester Telegram	m	dCyB4k1dt-nTeKMd97jX9Bl8Da0UM	www.telegram.com	1395168462258
20321	Research queries advice on 'unhealthy' fat	http://au.news.yahoo.com/thewest/world/a/22043002/research-queries-advice-on-unhealthy-fat/	The West Australian	m	dCyB4k1dt-nTeKMd97jX9Bl8Da0UM	au.news.yahoo.com	1395168462477
20322	Saturated fats aren't necessarily bad for you, new research shows	http://www.heraldscotland.com/news/health/saturated-fats-arent-necessarily-bad-for-you-new-research-shows.1395128587	Herald Scotland	m	dCyB4k1dt-nTeKMd97jX9Bl8Da0UM	www.heraldscotland.com	1395168462737
20323	Omega-3 Supplements Do Little To Protect You From Heart Diseases, Study	http://www.hngn.com/articles/26752/20140318/omega-3-supplements-little-protect-heart-diseases-study.htm	Headlines \& Global News	m	dCyB4k1dt-nTeKMd97jX9Bl8Da0UM	www.hngn.com	1395168463023
20324	Scientists question link between saturated fat and heart disease	http://www.breakingnews.ie/world/scientists-question-link-between-saturated-fat-and-heart-disease-625315.html	BreakingNews.ie	m	dCyB4k1dt-nTeKMd97jX9Bl8Da0UM	www.breakingnews.ie	1395168463224
20325	Call over saturated fats guidance	http://www.eveningtelegraph.co.uk/news/uk-world/call-over-saturated-fats-guidance-1.273937	Evening Telegraph	m	dCyB4k1dt-nTeKMd97jX9Bl8Da0UM	www.eveningtelegraph.co.uk	1395168463433
20326	Researchers analyze existing cohort studies and randomized trials on coronary  ...	http://www.news-medical.net/news/20140318/Researchers-analyze-existing-cohort-studies-and-randomized-trials-on-coronary-risk-and-fatty-acid-intake.aspx	News-Medical.net	m	dCyB4k1dt-nTeKMd97jX9Bl8Da0UM	www.news-medical.net	1395168463752
20327	No link found between saturated fat and heart disease	http://www.telegraph.co.uk/journalists/sarah-knapton/10703970/No-link-found-between-saturated-fat-and-heart-disease.html	Telegraph.co.uk	m	dCyB4k1dt-nTeKMd97jX9Bl8Da0UM	www.telegraph.co.uk	1395168463961
20328	Saturated fats may not be as bad for heart as we thought	http://www.healthnewsline.net/saturated-fats-may-bad-heart-thought/2533226/	Health Newsline	m	dCyB4k1dt-nTeKMd97jX9Bl8Da0UM	www.healthnewsline.net	1395168464155
20329	Fats and heart disease: Guidelines questioned	http://www.webmd.boots.com/heart-disease/news/20140318/fats-heart-disease-questioned	WebMD.Boots.com	m	dCyB4k1dt-nTeKMd97jX9Bl8Da0UM	www.webmd.boots.com	1395168464356
20330	Fat not to blame for heart disease - study	http://voiceofrussia.com/2014_03_18/Fat-not-to-blame-for-heart-disease-study-2372/	The Voice of Russia	m	dCyB4k1dt-nTeKMd97jX9Bl8Da0UM	voiceofrussia.com	1395168464700
20331	Cambridge: Fatty Foods May Not Cause Heart Disease	http://www.heart.co.uk/cambridge/news/local/fatty-foods-may-not-cause-heart-disease/	Heart	m	dCyB4k1dt-nTeKMd97jX9Bl8Da0UM	www.heart.co.uk	1395168464950
20332	Saturated Fats May Not Be Our Enemy	http://www.thealmagest.com/saturated-fats-may-not-be-our-enemy/11313	The Almagest	m	dCyB4k1dt-nTeKMd97jX9Bl8Da0UM	www.thealmagest.com	1395168465127
20333	Foods Rich in Omega-3 May Not Benefit the Heart, Study Suggests	http://www.sfgate.com/business/bloomberg/article/Foods-Rich-in-Omega-3-May-Not-Benefit-the-Heart-5326309.php	San Francisco Chronicle	m	dCyB4k1dt-nTeKMd97jX9Bl8Da0UM	www.sfgate.com	1395168465295
20334	Foods rich in fish oils don't reduce heart attack risk	http://www.pressherald.com/news/nationworld/Foods_rich_in_fish_oils_don_t_reduce_heart_attack_risk_.html	Press Herald	m	dCyB4k1dt-nTeKMd97jX9Bl8Da0UM	www.pressherald.com	1395168465480
20335	Saturated fat may not be the bad guy of heart health	http://www.techtimes.com/articles/4501/20140317/saturated-fat-may-not-be-the-bad-guy-of-heart-health.htm	Tech Times	m	dCyB4k1dt-nTeKMd97jX9Bl8Da0UM	www.techtimes.com	1395168465748
20336	Saturated fats may not cause heart attacks, study finds	http://thecelebritycafe.com/feature/2014/03/saturated-fats-may-not-cause-heart-attacks-study-finds	TheCelebrityCafe.com	m	dCyB4k1dt-nTeKMd97jX9Bl8Da0UM	thecelebritycafe.com	1395168465933
20337	Foods rich in omega-3 may not help the heart, analysis finds	http://www.chicagotribune.com/news/sns-wp-blm-news-bc-heart-study17-20140317,0,1181922.story	Chicago Tribune	m	dCyB4k1dt-nTeKMd97jX9Bl8Da0UM	www.chicagotribune.com	1395168466101
20338	Saturated Fatty Acid Not Associated with Coronary Artery Disease?	http://medicalresearch.com/heart-disease/saturated_fatty_acid_and_coronary_artery_disease/4184/	Medical Research News and Interviews_ MedicalResearch.com	m	dCyB4k1dt-nTeKMd97jX9Bl8Da0UM	medicalresearch.com	1395168466294
20339	Saturated fat role in heart disease again questioned: What diet works?	http://www.emaxhealth.com/1020/saturated-fat-role-heart-disease-again-questioned-what-diet-best-then	eMaxHealth	m	dCyB4k1dt-nTeKMd97jX9Bl8Da0UM	www.emaxhealth.com	1395168466454
20340	'Butter may be no worse for your heart than using 'healthy' low-fat alternative'	http://www.mirror.co.uk/news/uk-news/butter-no-worse-your-heart-3254784	Mirror.co.uk	m	dCyB4k1dt-nTeKMd97jX9Bl8Da0UM	www.mirror.co.uk	1395168466731
20341	Do Saturated Fats Really Cause Heart Disease?	http://www.science20.com/news_articles/do_saturated_fats_really_cause_heart_disease-131862	Science 2.0	m	dCyB4k1dt-nTeKMd97jX9Bl8Da0UM	www.science20.com	1395168466933
20342	Daily Fish Oil Supplement May Not Help Your Heart	http://www.webmd.com/vitamins-and-supplements/news/20140317/daily-fish-oil-supplement-may-not-help-your-heart-studies	WebMD	m	dCyB4k1dt-nTeKMd97jX9Bl8Da0UM	www.webmd.com	1395168467126
20343	Uh Oh, Unsaturated Fats May Not Be As 'Good' As We Thought or ?	http://guide2derby.com/health-5/uh-oh-unsaturated-fats-may-not-be-as-good-as-we-thought-or-444.html	Guide2Derby	m	dCyB4k1dt-nTeKMd97jX9Bl8Da0UM	guide2derby.com	1395168467302
20344	Should I avoid saturated fat?	http://www.bbc.co.uk/news/health-26622399	BBC News	m	dCyB4k1dt-nTeKMd97jX9Bl8Da0UM	www.bbc.co.uk	1395168467479
20345	Uh Oh, Unsaturated Fats May Not Be As 'Good' As We Thought	http://time.com/27588/unsaturated-fats-may-not-be-as-good-as-we-thought/	TIME	m	dCyB4k1dt-nTeKMd97jX9Bl8Da0UM	time.com	1395168467780
20346	Foods Rich in Omega-3 May Not Protect Heart, Study Finds	http://www.bloomberg.com/news/2014-03-17/foods-rich-in-omega-3-may-not-protect-heart-study-finds.html	Bloomberg	m	dCyB4k1dt-nTeKMd97jX9Bl8Da0UM	www.bloomberg.com	1395168467982
20347	Bad News About Good Fats? Here's Why You Should Still Eat Fish	http://news.health.com/2014/03/17/bad-news-about-good-fats-heres-why-you-should-still-eat-fish/	Health.com	m	dCyB4k1dt-nTeKMd97jX9Bl8Da0UM	news.health.com	1395168468175
20348	Omega-3 Supplements Don't Seem To Protect Against Heart Disease: Study	http://www.huffingtonpost.com/2014/03/17/omega-3-heart-disease-_n_4981230.html	Huffington Post	m	dCyB4k1dt-nTeKMd97jX9Bl8Da0UM	www.huffingtonpost.com	1395168468360
20349	Are Saturated Fats as Bad as We Have Been Led to Believe?	http://www.theepochtimes.com/n3/565484-are-saturated-fats-as-bad-as-we-have-been-led-to-believe/	The Epoch Times	m	dCyB4k1dt-nTeKMd97jX9Bl8Da0UM	www.theepochtimes.com	1395168468837
20350	Brain Scans Cost US $1 Billion Per Year; Most Are Unnecessary	http://www.hngn.com/articles/26814/20140318/brain-scans-cost-u-s-1-billion-per-year-most-are-unnecessary.htm	Headlines \& Global News	m	d7M1KiDEOuccuDMH4HPVVC1z9pPOM	www.hngn.com	1395168636894
20351	Unnecessary Brain Scans Are A Headache For Everyone	http://www.redorbit.com/news/health/1113097809/headaches-result-in-unnecessary-brain-scans-031814/	RedOrbit	m	d7M1KiDEOuccuDMH4HPVVC1z9pPOM	www.redorbit.com	1395168637094
20352	Overuse of brain scans for headaches persists, despite guidelines	http://www.modernhealthcare.com/article/20140317/NEWS/303179968/overuse-of-brain-scans-for-headaches-persists-despite-guidelines\?utm_source=home&amp;utm_medium=web&amp;utm_campaign=most-popular-box	ModernHealthcare.com	m	d7M1KiDEOuccuDMH4HPVVC1z9pPOM	www.modernhealthcare.com	1395168637270
20353	$1 billion worth of brain scans ordered for headache sufferers in US each year	http://www.upi.com/Health_News/2014/03/17/1-billion-worth-of-brain-scans-ordered-for-headache-sufferers-in-US-each-year/1831395091595/\?spt=sec&amp;or=hn	UPI.com	m	d7M1KiDEOuccuDMH4HPVVC1z9pPOM	www.upi.com	1395168637456
20354	Study: Headaches leading to unnecessary brain scans	http://www.kctv5.com/story/25005132/study-headaches-leading-to-unnecessary-brain-scans	KCTV Kansas City	m	d7M1KiDEOuccuDMH4HPVVC1z9pPOM	www.kctv5.com	1395168637639
20355	Too many patients are getting unnecessary brain scans	http://med.news.am/eng/news/1191/too-many-patients-are-getting-unnecessary-brain-scans.html	Information-Analytic Agency NEWS.am	m	d7M1KiDEOuccuDMH4HPVVC1z9pPOM	med.news.am	1395168637825
20356	Headaches and Additional Testing: $1 Billion Spent Annually on Brain Scans	http://www.scienceworldreport.com/articles/13524/20140317/headaches-and-additional-testing-1-billion-spent-annually-on-brain-scans.htm	Science World Report	m	d7M1KiDEOuccuDMH4HPVVC1z9pPOM	www.scienceworldreport.com	1395168638080
20357	Overuse of brain scans for headaches persist, despite guidelines	http://www.modernhealthcare.com/article/20140317/NEWS/303179968/overuse-of-brain-scans-for-headaches-persists-despite-guidelines\?utm_source=frontpage&amp;utm_medium=newsitem309&amp;utm_campaign=carousel-traffic	ModernHealthcare.com	m	d7M1KiDEOuccuDMH4HPVVC1z9pPOM	www.modernhealthcare.com	1395168638429
20358	Americans with Headaches get Excessive Brain Scans, Spending $1 Billion  ...	http://www.natureworldnews.com/articles/6368/20140317/americans-with-headaches-get-excessive-brain-scans-spending-1-billion-annually-study-finds.htm	Nature World News	m	d7M1KiDEOuccuDMH4HPVVC1z9pPOM	www.natureworldnews.com	1395168638637
20359	Headache-Related Brain Scans Cost $1B A Year, But 99% May Be Unnecessary	http://www.medicaldaily.com/headache-related-brain-scans-cost-1b-year-99-may-be-unnecessary-271399	Medical Daily	m	d7M1KiDEOuccuDMH4HPVVC1z9pPOM	www.medicaldaily.com	1395168638857
20360	Baby Gorilla Born By C-Section In San Diego Zoo With Collapsed Lung Is Now  ...	http://www.hngn.com/articles/26816/20140318/baby-gorilla-born-c-section-san-diego-zoo-collapsed-lung.htm	Headlines \& Global News	m	dfoVFS5gk_BlfcMWV5XfjoxlveiZM	www.hngn.com	1395168706149
20361	Baby gorilla born at San Diego Zoo's Safari Park remains in critical condition	http://www.10news.com/news/baby-gorilla-born-at-san-diego-zoos-safari-park-remains-in-critical-condition-031714	10News	m	dfoVFS5gk_BlfcMWV5XfjoxlveiZM	www.10news.com	1395168706318
20362	Baby gorilla remains in critical condition	http://www.10news.com/news/baby-gorilla-born-at-san-diego-zoos-safari-park-remains-in-critical-condition-031714\?autoplay=true	10News	m	dfoVFS5gk_BlfcMWV5XfjoxlveiZM	www.10news.com	1395168706620
20363	Zoo 'doing everything within our power to save' baby gorilla	http://www.utsandiego.com/news/2014/mar/18/baby-gorilla-san-diego-zoo-safari-park-video/	U-T San Diego	m	dfoVFS5gk_BlfcMWV5XfjoxlveiZM	www.utsandiego.com	1395168706830
20364	Baby gorilla critical with pneumonia in US	http://www.itn.co.uk/And%20Finally/98112/baby-gorilla-critical-with-pneumonia-in-us	ITN	m	dfoVFS5gk_BlfcMWV5XfjoxlveiZM	www.itn.co.uk	1395168707031
20365	San Diego Zoo's new baby gorilla has pneumonia	http://www.gillettenewsrecord.com/news/national_world/article_74652a9a-aeb4-11e3-8140-001a4bcf6878.html	Gillette News Record	m	dfoVFS5gk_BlfcMWV5XfjoxlveiZM	www.gillettenewsrecord.com	1395168707328
20366	Baby gorilla delivered by C-section under close watch	http://www.mnn.com/earth-matters/animals/videos/baby-gorilla-delivered-by-c-section-under-close-watch	Mother Nature Network	m	dfoVFS5gk_BlfcMWV5XfjoxlveiZM	www.mnn.com	1395168707501
20367	Naval Academy sexual assault case to begin Tuesday	http://www.kfoxtv.com/template/inews_wire/wires.national/2ce93f49-www.kfoxtv.com.shtml	KFOX El Paso	m	dfoVFS5gk_BlfcMWV5XfjoxlveiZM	www.kfoxtv.com	1395168707694
20368	Baby gorilla delivered by emergency cesarean section is sick	http://www.ctvnews.ca/sci-tech/baby-gorilla-delivered-by-emergency-cesarean-section-is-sick-1.1734197	CTV News	m	dfoVFS5gk_BlfcMWV5XfjoxlveiZM	www.ctvnews.ca	1395168707962
20369	First Baby Gorilla Born in San Diego Zoo	http://austriantribune.com/informationen/143264-first-baby-gorilla-born-san-diego-zoo	Austrian Tribune	m	dfoVFS5gk_BlfcMWV5XfjoxlveiZM	austriantribune.com	1395168708289
20370	It's A Girl! San Diego Zoo Welcomes Its First C-Section Gorilla	http://www.thealmagest.com/its-a-girl-san-diego-zoo-welcomes-its-first-c-section-gorilla/11320	The Almagest	m	dfoVFS5gk_BlfcMWV5XfjoxlveiZM	www.thealmagest.com	1395168708490
20371	Putin notifies Russian officials of Crimea's bid	http://www.wics.com/template/inews_wire/wires.international/34e934ba-wics.com.shtml	WICS-TV	m	dfoVFS5gk_BlfcMWV5XfjoxlveiZM	www.wics.com	1395168708683
20372	Baby Gorilla Born Last Week Has Pneumonia, Expected to Recover	http://www.ntd.tv/en/news/life/20140318/113149-baby-gorilla-born-last-week-has-pneumonia-expected-to-recover.html	New Tang Dynasty Television	m	dfoVFS5gk_BlfcMWV5XfjoxlveiZM	www.ntd.tv	1395168708843
20373	Baby gorilla being treated for pneumonia	http://www.cbs8.com/story/25000534/baby-gorilla-being-treated-for-pneumonia	KFMB News 8	m	dfoVFS5gk_BlfcMWV5XfjoxlveiZM	www.cbs8.com	1395168709020
20374	Baby Gorilla Delivered Via C-Section Treated for Pneumonia	http://www.nbcsandiego.com/news/local/Baby-Gorilla-Delivered-Via-C-Section-Treated-for-Pneumonia-250716331.html	NBC 7 San Diego	m	dfoVFS5gk_BlfcMWV5XfjoxlveiZM	www.nbcsandiego.com	1395168709313
20375	San Diego Zoo Safari Park's Baby Gorilla Receiving Around-the-Clock Care	http://www.imperialvalleynews.com/index.php/news/latest-news/7657-san-diego-zoo-safari-park-s-baby-gorilla-receiving-around-the-clock-care.html	Imperial Valley News	m	dfoVFS5gk_BlfcMWV5XfjoxlveiZM	www.imperialvalleynews.com	1395168709506
20376	Newborn gorilla fights for her life	http://fox5sandiego.com/2014/03/17/newborn-gorilla-fights-for-her-life/	fox5sandiego.com	m	dfoVFS5gk_BlfcMWV5XfjoxlveiZM	fox5sandiego.com	1395168709681
20377	Baby gorilla at San Diego Zoo Safari Park battling pneumonia	http://www.latimes.com/local/lanow/la-me-ln-gorilla-sick20140317,0,5487833.story	Los Angeles Times	m	dfoVFS5gk_BlfcMWV5XfjoxlveiZM	www.latimes.com	1395168709899
20378	Baby gorilla battling pneumonia	http://www.utsandiego.com/news/2014/mar/17/environment-safari-park-baby-gorilla-pneumonia/	U-T San Diego	m	dfoVFS5gk_BlfcMWV5XfjoxlveiZM	www.utsandiego.com	1395168710287
20379	The Popularity of the C-Section, Even Gorillas are Getting Them!	http://www.modvive.com/2014/03/17/popularity-c-section-even-gorillas-getting/	ModVive	m	dfoVFS5gk_BlfcMWV5XfjoxlveiZM	www.modvive.com	1395168710478
20380	HEARTWARMING: Baby gorilla delivered via rare emergency C-section	http://wtvr.com/2014/03/17/baby-gorilla-born-via-c-section-at-san-diego-zoo/	wtvr.com	m	dfoVFS5gk_BlfcMWV5XfjoxlveiZM	wtvr.com	1395168710706
20381	Baby gorilla born via C-section is both cute and freaky-looking	http://grist.org/living/baby-gorilla-born-via-c-section-is-both-cute-and-freaky-looking/	Grist	m	dfoVFS5gk_BlfcMWV5XfjoxlveiZM	grist.org	1395168711016
20382	San Diego zoo baby goril caesarean section was born	http://guide2derby.com/health-5/san-diego-zoo-baby-goril-caesarean-section-was-born-420.html	Guide2Derby	m	dfoVFS5gk_BlfcMWV5XfjoxlveiZM	guide2derby.com	1395168711257
20383	Zoo performs rare C-section on gorilla	http://www.iol.co.za/scitech/science/environment/zoo-performs-rare-c-section-on-gorilla-1.1662246	Independent Online	m	dfoVFS5gk_BlfcMWV5XfjoxlveiZM	www.iol.co.za	1395168711437
20384	San Diego zoo welcomes cute baby gorilla via C-section	http://www.techtimes.com/articles/4454/20140317/san-diego-zoo-welcomes-cute-baby-gorilla-via-c-section.htm	Tech Times	m	dfoVFS5gk_BlfcMWV5XfjoxlveiZM	www.techtimes.com	1395168711620
20385	Baby Gorilla Born in Rare C-section	http://www.tuscaloosanews.com/article/20140316/MULTIMEDIA/140319680\?Title=Baby-Gorilla-Born-in-Rare-C-section	Tuscaloosa News \(subscription\)	m	dfoVFS5gk_BlfcMWV5XfjoxlveiZM	www.tuscaloosanews.com	1395168711815
20386	VIDEO: San Diego Zoo veterinarians performs rare C-section on gorilla	http://www.thespec.com/news-story/4414529-video-san-diego-zoo-veterinarians-performs-rare-c-section-on-gorilla/	Hamilton Spectator	m	dfoVFS5gk_BlfcMWV5XfjoxlveiZM	www.thespec.com	1395168712116
20387	Baby gorilla born via C-section in San Diego had collapsed lung (VIDEO)	http://www.nydailynews.com/news/national/baby-gorilla-born-c-section-collapsed-lung-article-1.1722861	New York Daily News	m	dfoVFS5gk_BlfcMWV5XfjoxlveiZM	www.nydailynews.com	1395168712384
20388	San Diego Zoo vets deliver baby gorilla by C-section	http://www.thestar.com/photos/the_daily_beast_by_wanda_goodwin/2014/03/san_diego_zoo_vets_deliver_baby_gorilla_by_c_section.html	Toronto Star	m	dfoVFS5gk_BlfcMWV5XfjoxlveiZM	www.thestar.com	1395168712576
20389	US zoo performs rare C-section on gorilla	http://the-japan-news.com/news/article/0001126917	The Japan News	m	dfoVFS5gk_BlfcMWV5XfjoxlveiZM	the-japan-news.com	1395168712769
20390	In a first San Diego Zoo gets baby gorilla through Cesarean Section	http://nvonews.com/2014/03/16/in-a-first-san-diego-zoo-gets-baby-gorilla-through-cesarean-section/	Northern Voices Online	m	dfoVFS5gk_BlfcMWV5XfjoxlveiZM	nvonews.com	1395168712996
20391	Gorilla delivers by emergency C-section	http://newsfixnow.com/2014/03/16/gorilla-delivers-by-emergency-c-section/	CW39 NewsFix	m	dfoVFS5gk_BlfcMWV5XfjoxlveiZM	newsfixnow.com	1395168713206
20392	San Diego Zoo performs rare caesarean section on gorilla	http://www.indiatvnews.com/news/world/san-diego-zoo-performs-rare-caesarean-section-on-gorilla-16519.html	indiatvnews.com	m	dfoVFS5gk_BlfcMWV5XfjoxlveiZM	www.indiatvnews.com	1395168713451
20393	Rare C-section performed on Gorilla	http://newspoint.co.za/story/414/5533-rare-c-section-performed-gorilla	NewsPoint Africa	m	dfoVFS5gk_BlfcMWV5XfjoxlveiZM	newspoint.co.za	1395168713719
20394	Vet staff performs rare C-section on gorilla	http://www.kltv.com/story/24982256/vet-staff-performs-rare	KLTV	m	dfoVFS5gk_BlfcMWV5XfjoxlveiZM	www.kltv.com	1395168713870
20395	Baby Gorilla 1	http://mdjonline.com/bookmark/24768203-Baby-Gorilla-1	Marietta Daily Journal	m	dfoVFS5gk_BlfcMWV5XfjoxlveiZM	mdjonline.com	1395168714070
20396	San Diego Zoo performs rare C-section on gorilla	http://wavy.com/2014/03/15/san-diego-zoo-performs-rare-c-section-on-gorilla/	WAVY-TV	m	dfoVFS5gk_BlfcMWV5XfjoxlveiZM	wavy.com	1395168714315
20397	Rare Gorilla Caesarean Birth Captured On Video	http://www.huffingtonpost.com/2014/03/14/gorilla-caesarean-video_n_4965144.html\?ir=Green	Huffington Post	m	dfoVFS5gk_BlfcMWV5XfjoxlveiZM	www.huffingtonpost.com	1395168714517
20398	Baby gorilla recovering at SD Zoo Safari Park	http://www.cbs8.com/story/24984805/baby-gorilla-recovering-at-sd-zoo-safari-park	KFMB News 8	m	dfoVFS5gk_BlfcMWV5XfjoxlveiZM	www.cbs8.com	1395168714752
20399	Baby Gorilla Delivered Via Rare Cesarean Section	http://americanlivewire.com/2014-03-15-san-diego-zoo-safari-park-welcomes-baby-gorilla-via-c-section/	American Live Wire	m	dfoVFS5gk_BlfcMWV5XfjoxlveiZM	americanlivewire.com	1395168714945
20400	San Diego Zoo veterinarians perform rare C-section on gorilla; baby suffering  ...	http://www.vancouversun.com/health/Diego+veterinarians+perform+rare+section+gorilla+baby+suffering+breathing+problems/9622287/story.html	Vancouver Sun	m	dfoVFS5gk_BlfcMWV5XfjoxlveiZM	www.vancouversun.com	1395168715130
