375901	Daily Mail apologises to Clooney	http://www.3news.co.nz/Daily-Mail-apologises-to-Clooney/tabid/418/articleID/352140/Default.aspx	3News NZ	e	d-8MyxykhnG98yMM55pOEPA7TH01M	www.3news.co.nz	1404981393426
375902	George Clooney slams the Mail Online	http://home.bt.com/news/showbiznews/george-clooney-slams-the-mail-online-11363918441491	BT.com	e	d-8MyxykhnG98yMM55pOEPA7TH01M	home.bt.com	1404981393795
375903	Website apologizes for story about George Clooney's future mother-in-law	http://www.wcpo.com/entertainment/george-clooney-daily-mail-baria-alamuddin-story-website-apologizes-for-clooney-mother-in-law-story	WCPO	e	d-8MyxykhnG98yMM55pOEPA7TH01M	www.wcpo.com	1404981394157
375904	Daily Mail apologizes to George Clooney for story on Amal Alamuddin's mother	http://thecelebritycafe.com/feature/2014/07/daily-mail-apologizes-george-clooney-story-amal-alamuddin-s-mother	TheCelebrityCafe.com	e	d-8MyxykhnG98yMM55pOEPA7TH01M	thecelebritycafe.com	1404981394454
375905	In London, a play satirizing British tabloids can make you feel George Clooney's  ...	http://www.washingtonpost.com/entertainment/theater_dance/george-clooney-in-synch-with-british-play/2014/07/09/ba2c3a20-07a9-11e4-9ae6-0519a2bd5dfa_story.html\?tid=hpModule_ef3e52c4-8691-11e2-9d71-f0feafdd1394	Washington Post	e	d-8MyxykhnG98yMM55pOEPA7TH01M	www.washingtonpost.com	1404981395039
375906	George Clooney wins apology over false marriage claims	http://www.express.co.uk/news/showbiz/487816/George-Clooney-wins-apology-over-false-marriage-claims	Express.co.uk	e	d-8MyxykhnG98yMM55pOEPA7TH01M	www.express.co.uk	1404981395318
375907	George Clooney Slams 'Daily Mail' & 'New York Daily News' Over Report  ...	http://radaronline.com/exclusives/2014/07/george-clooney-amal-baria-alamuddin-druze-daily-mail-online/	Radar Online	e	d-8MyxykhnG98yMM55pOEPA7TH01M	radaronline.com	1404981395946
375908	George Clooney slams Daily Mail in op-ed	http://www.dailylife.com.au/dl-people/dl-entertainment/george-clooney-slams-daily-mail-in-oped-20140710-3bnt6.html	Daily Life	e	d-8MyxykhnG98yMM55pOEPA7TH01M	www.dailylife.com.au	1404981396256
375909	UK paper apologises to George Clooney	http://www.asianage.com/newsmakers/uk-paper-apologises-george-clooney-067	The Asian Age	e	d-8MyxykhnG98yMM55pOEPA7TH01M	www.asianage.com	1404981396776
375910	Daily Mail apologises to George Clooney over 'completely fabricated' story	http://tvnz.co.nz/entertainment-news/daily-mail-apologises-george-clooney-over-completely-fabricated-story-6023777	TVNZ	e	d-8MyxykhnG98yMM55pOEPA7TH01M	tvnz.co.nz	1404981397054
375911	George Clooney slams tabloid for 'criminal' report	http://www.stuff.co.nz/entertainment/celebrities/10252137/George-Clooney-slams-tabloid-for-criminal-report	Stuff.co.nz	e	d-8MyxykhnG98yMM55pOEPA7TH01M	www.stuff.co.nz	1404981397316
375912	Clooney gets apology over false tale	http://voices.suntimes.com/arts-entertainment/the-daily-sizzle/clooney-gets-apology-over-false-tale/	Voices	e	d-8MyxykhnG98yMM55pOEPA7TH01M	voices.suntimes.com	1404981397543
375913	George Clooney: A correction and an apology	http://www.dailymail.co.uk/home/article-2686658/George-Clooney-A-correction-apology.html\?ITO=1490&amp;ns_mchannel=rss&amp;ns_campaign=1490	Daily Mail	e	d-8MyxykhnG98yMM55pOEPA7TH01M	www.dailymail.co.uk	1404981398001
375914	George Clooney proves why shaming the tabloids is more effective than suing  ...	http://www.washingtonpost.com/blogs/style-blog/wp/2014/07/09/george-clooney-proves-why-shaming-the-tabloids-is-more-effective-than-suing-them/	Washington Post \(blog\)	e	d-8MyxykhnG98yMM55pOEPA7TH01M	www.washingtonpost.com	1404981398273
375915	George Clooney Slams "Dangerous" New Report About His Love Life	http://www.popsugar.com.au/celebrity/George-Clooney-Slams-Daily-Mail-35199392	PopSugar Australia	e	d-8MyxykhnG98yMM55pOEPA7TH01M	www.popsugar.com.au	1404981398481
375916	Three very important things we learned from George Clooney vs. the Daily Mail	http://www.washingtonpost.com/blogs/reliable-source/wp/2014/07/09/three-very-important-things-we-learned-from-george-clooney-vs-the-daily-mail/	Washington Post \(blog\)	e	d-8MyxykhnG98yMM55pOEPA7TH01M	www.washingtonpost.com	1404981399031
375917	Daily Mail apologizes after George Clooney slams 'fabricated' mother-in-law story	http://www.windsorstar.com/entertainment/George+Clooney+slams+Daily+Mail+over+claim+fiancees+mother/10013897/story.html	Windsor Star	e	d-8MyxykhnG98yMM55pOEPA7TH01M	www.windsorstar.com	1404981399480
375918	Daily Mail retracts 'dangerous' George Clooney story after actor speaks out	http://www.zap2it.com/blogs/daily_mail_removes_george_clooney_story_after_actor_speaks_out_amal_alamuddin-2014-07	Zap2it.com \(blog\)	e	d-8MyxykhnG98yMM55pOEPA7TH01M	www.zap2it.com	1404981399759
375919	Website apologizes for Clooney mother-in-law story	http://www.aikenstandard.com/article/20140709/AIK0401/140709367/1031/website-apologizes-for-clooney-mother-in-law-story	Aiken Standard	e	d-8MyxykhnG98yMM55pOEPA7TH01M	www.aikenstandard.com	1404981400047
375920	George Clooney slams the Daily Mail for 'criminal' report	http://www.stuff.co.nz/entertainment/celebrities/10252137/George-Clooney-slams-the-Daily-Mail-for-criminal-report	Stuff.co.nz	e	d-8MyxykhnG98yMM55pOEPA7TH01M	www.stuff.co.nz	1404981400289
375921	Clooney slams 'fabricated' story on fiancée's mom	http://www.punemirror.in/entertainment/hollywood/Clooney-slams-fabricated-story-on-fiances-mom/articleshow/38091075.cms	Pune Mirror	e	d-8MyxykhnG98yMM55pOEPA7TH01M	www.punemirror.in	1404981400728
375922	George Clooney's Outrage	http://archive.firstcoastnews.com/video/default.aspx\?bctid=3666737840001	First Coast News	e	d-8MyxykhnG98yMM55pOEPA7TH01M	archive.firstcoastnews.com	1404981400963
375923	George Clooney slams reports that Amal Alamuddin's mother opposes their  ...	http://www.realitytvworld.com/news/george-clooney-slams-reports-that-amal-alamuddin-mother-opposes-their-marriage-50130624.php	Reality TV World	e	d-8MyxykhnG98yMM55pOEPA7TH01M	www.realitytvworld.com	1404981401703
375924	George Clooney denies rumors that Amal Alamuddin's mother opposes their  ...	http://www.bignewsnetwork.com/index.php/sid/223650513	Big News Network.com	e	d-8MyxykhnG98yMM55pOEPA7TH01M	www.bignewsnetwork.com	1404981401949
375925	George Clooney leads class of celebs taking on tabloids	http://www.today.com/entertainment/george-clooney-leads-class-celebs-taking-tabloids-1D79903432	Today.com	e	d-8MyxykhnG98yMM55pOEPA7TH01M	www.today.com	1404981402253
375926	MailOnline apologises to George Clooney for fiancée story	http://www.digitalspy.co.uk/showbiz/news/a583091/mailonline-apologises-to-george-clooney-for-fiancee-story.html	Digital Spy UK	e	d-8MyxykhnG98yMM55pOEPA7TH01M	www.digitalspy.co.uk	1404981402508
375927	George Clooney Shames Daily Mail Into Apologizing Over False Story	http://www.huffingtonpost.com/2014/07/09/daily-mail-george-clooney-apology_n_5570133.html\?ir=Media	Huffington Post	e	d-8MyxykhnG98yMM55pOEPA7TH01M	www.huffingtonpost.com	1404981402882
375928	Daily Mail apologises to Clooney for wrong report	http://www.gulf-times.com/uk-europe/183/details/399807/daily-mail-apologises-to-clooney-for-wrong-report	Gulf Times	e	d-8MyxykhnG98yMM55pOEPA7TH01M	www.gulf-times.com	1404981403122
375929	MailOnline apologizes to George Clooney for fiancée story	http://www.digitalspy.com/celebrity/news/a583091/mailonline-apologizes-to-george-clooney-for-fiancee-story.html	Digital Spy	e	d-8MyxykhnG98yMM55pOEPA7TH01M	www.digitalspy.com	1404981403375
375930	George Clooney rips British news outlet	http://www.contracostatimes.com/news/ci_26117998/george-clooney-rips-british-news-outlet	Contra Costa Times	e	d-8MyxykhnG98yMM55pOEPA7TH01M	www.contracostatimes.com	1404981403896
375931	George Clooney To Wed Amal Alamuddin	http://www.spyghana.com/george-clooney-wed-amal-alamuddin/	spyghana.com	e	d-8MyxykhnG98yMM55pOEPA7TH01M	www.spyghana.com	1404981404162
375932	George Clooney Slams Amal Alamuddin In-Law Rift Story; Gets Apology	http://global.christianpost.com/news/george-clooney-slams-amal-alamuddin-in-law-rift-story-gets-apology-123029/	Christian Post	e	d-8MyxykhnG98yMM55pOEPA7TH01M	global.christianpost.com	1404981404429
375933	Why George Clooney gave the Daily Mail the smackdown	http://www.csmonitor.com/The-Culture/2014/0709/Why-George-Clooney-gave-the-Daily-Mail-the-smackdown	Christian Science Monitor	e	d-8MyxykhnG98yMM55pOEPA7TH01M	www.csmonitor.com	1404981404780
375934	Tom Cruise "Determined" To Get Invited To George Clooney's Wedding?	http://www.gossipcop.com/tom-cruise-george-clooney-wedding-invite/	GossipCop	e	d-8MyxykhnG98yMM55pOEPA7TH01M	www.gossipcop.com	1404981405072
375935	George Clooney slams Daily Mail over claim fiancee's mother disapproves of the  ...	http://www.theprovince.com/entertainment/movie-guide/George+Clooney+slams+Daily+Mail+over+claim+fiancees+mother/10013897/story.html	The Province	e	d-8MyxykhnG98yMM55pOEPA7TH01M	www.theprovince.com	1404981405352
375936	Newspaper says sorry after Clooney slams story	http://www.bdtonline.com/entertainment/x1667065670/Newspaper-says-sorry-after-Clooney-slams-story	Bluefield Daily Telegraph	e	d-8MyxykhnG98yMM55pOEPA7TH01M	www.bdtonline.com	1404981405724
375937	George Clooney Rips Daily Mail for False Story About His Fiancee, Says It  ...	https://za.celebrity.yahoo.com/news/george-clooney-rips-daily-mail-false-story-fiancee-124400231.html	Yahoo South Africa	e	d-8MyxykhnG98yMM55pOEPA7TH01M	za.celebrity.yahoo.com	1404981406011
375938	George Clooney Is FURIOUS! The Protective Hubby-To-Be Is Bashing Daily Mail  ...	http://perezhilton.com/2014-07-09-george-clooney-angry-amal-alamuddin-mom-daily-mail-false-report	PerezHilton.com	e	d-8MyxykhnG98yMM55pOEPA7TH01M	perezhilton.com	1404981406367
375939	Daily Mail apologizes to George Clooney over article about his future mother-in  ...	http://www.sheknows.com/entertainment/articles/1043337/george-clooney-responds-to-daily-mail-article-about-his-future-mother-in-law	SheKnows.com	e	d-8MyxykhnG98yMM55pOEPA7TH01M	www.sheknows.com	1404981406903
375940	Mail Online Apologizes to George Clooney Over Mother-in-Law Story	http://www.techsonia.com/mail-online-apologizes-to-george-clooney-over-mother-in-law-story/1917009/	Techsonia	e	d-8MyxykhnG98yMM55pOEPA7TH01M	www.techsonia.com	1404981407166
375941	George Clooney Blasts Daily Mail for Publishing "Dangerous" Lies About  ...	http://www.chillicothenews.com/article/ZZ/20140709/NEWS/307099994/10063/ENTERTAINMENT	Chillicothe Constitution Tribune	e	d-8MyxykhnG98yMM55pOEPA7TH01M	www.chillicothenews.com	1404981407395
375942	George Clooney Engagement News: Star Speaks Up Against Druze Claims  ...	http://www.latinpost.com/articles/16796/20140709/george-clooney-engagement-news-star-speaks-up-against-druze-claims.htm	Latin Post	e	d-8MyxykhnG98yMM55pOEPA7TH01M	www.latinpost.com	1404981407778
375943	George Clooney Calls “Daily Mail” Report 'Fabricated' and Irresponsible	http://www.eastidahonews.com/2014/07/george-clooney-calls-daily-mail-report-fabricated-and-irresponsible/	East Idaho News	e	d-8MyxykhnG98yMM55pOEPA7TH01M	www.eastidahonews.com	1404981408039
375944	George Clooney slams story of in-law rift over religion	http://ncronline.org/news/people/george-clooney-slams-story-law-rift-over-religion	National Catholic Reporter	e	d-8MyxykhnG98yMM55pOEPA7TH01M	ncronline.org	1404981408340
375945	UPDATE 2-Actor George Clooney slams UK story about his future marriage	http://in.reuters.com/article/2014/07/09/people-georgeclooney-idINL2N0PK17O20140709	Reuters	e	d-8MyxykhnG98yMM55pOEPA7TH01M	in.reuters.com	1404981408688
375946	Five things you need to know Wednesday	http://www.kens5.com/story/news/nation-now/2014/07/09/5-things-to-know-wednesday/12396633/	KENS 5 TV	e	d-8MyxykhnG98yMM55pOEPA7TH01M	www.kens5.com	1404981408926
375947	Daily Mail sorry for Clooney wedding story	http://news.ninemsn.com.au/entertainment/2014/07/10/04/48/daily-mail-sorry-for-clooney-wedding-story	Ninemsn	e	d-8MyxykhnG98yMM55pOEPA7TH01M	news.ninemsn.com.au	1404981409644
375948	George Clooney Slams British Newspaper for Article About Future Mother-in-Law	https://ca.celebrity.yahoo.com/blogs/celeb-news/george-clooney-slams-british-newspaper-for-article-about-future-mother-in-law-130356431.html	OMG\! Canada \(blog\)	e	d-8MyxykhnG98yMM55pOEPA7TH01M	ca.celebrity.yahoo.com	1404981410201
375949	Clooney slams UK tabloid report	http://ewn.co.za/2014/07/09/George-Clooney-slams-story-about-his-marriage	Eyewitness News	e	d-8MyxykhnG98yMM55pOEPA7TH01M	ewn.co.za	1404981410526
375950	Clooney slams newspaper over mother-in-law report	http://www.kmov.com/entertainment/Clooney-slams-newspaper-over-mother-in-law-report-266467471.html	KMOV.com	e	d-8MyxykhnG98yMM55pOEPA7TH01M	www.kmov.com	1404981410813
375951	George Clooney Slams The Daily Mail As Irresponsible	http://allieiswired.com/archives/2014/07/george-clooney-slams-the-daily-mail-as-irresponsible/	Allie Is Wired	e	d-8MyxykhnG98yMM55pOEPA7TH01M	allieiswired.com	1404981411081
375952	George Clooney accuses Daily Mail of inciting violence	http://www.tribute.ca/news/index.php/daily-mail-accused-of-inciting-violence-by-george-clooney/2014/07/09/	Tribute.ca	e	d-8MyxykhnG98yMM55pOEPA7TH01M	www.tribute.ca	1404981411410
375953	Mail Online apologises to George Clooney for story on forthcoming marriage	http://www.independent.ie/style/mail-online-apologises-to-george-clooney-for-story-on-forthcoming-marriage-30419438.html	Irish Independent	e	d-8MyxykhnG98yMM55pOEPA7TH01M	www.independent.ie	1404981411621
375954	George Clooney slams false marriage reports	http://www.new-magazine.co.uk/latestnews/view/62085/George-Clooney-slams-false-marriage-reports/	New Magazine	e	d-8MyxykhnG98yMM55pOEPA7TH01M	www.new-magazine.co.uk	1404981411838
375955	George Clooney Slams Website for 'Fabricated' Story about Fiancée	http://www.extratv.com/2014/07/09/george-clooney-slams-website-for-fabricated-story-about-fiancee/\?utm_source=feedburner&amp;utm_medium=feed&amp;utm_campaign=Feed%3A+ExtraTV+(Extra+-+Atom)	Extra	e	d-8MyxykhnG98yMM55pOEPA7TH01M	www.extratv.com	1404981412086
375956	Clooney slams claims about future marriage	http://wnax.com/news/030030-george-clooney-slams-papers-claims-about-future-marriage/	WNAX	e	d-8MyxykhnG98yMM55pOEPA7TH01M	wnax.com	1404981412488
375957	UK newspaper says sorry after Clooney slams story	http://www.komonews.com/news/entertainment/UK-newspaper-says-sorry-after-Clooney-slams-story-266431751.html	KOMO News	e	d-8MyxykhnG98yMM55pOEPA7TH01M	www.komonews.com	1404981412723
375958	George Clooney Calls Daily Mail Report “Fabricated” and Irresponsible	http://mycentraloregon.com/2014/07/09/george-clooney-calls-daily-mail-report-fabricated-and-irresponsible/	myCentralOregon.com	e	d-8MyxykhnG98yMM55pOEPA7TH01M	mycentraloregon.com	1404981413406
375959	George Clooney Slams Daily Mail for Publishing 'Fabricated' Story about Amal  ...	http://www.hngn.com/articles/35666/20140709/george-clooney-slams-daily-mail-publishing-fabricated-story-amal-alamuddin.htm	Headlines \& Global News	e	d-8MyxykhnG98yMM55pOEPA7TH01M	www.hngn.com	1404981413689
375960	George Clooney sets the record straight	http://archive.firstcoastnews.com/video/default.aspx\?bctid=3666332014001	First Coast News	e	d-8MyxykhnG98yMM55pOEPA7TH01M	archive.firstcoastnews.com	1404981413928
375961	Doug Camilli: George Clooney incinerates the Daily Mail	http://www.montrealgazette.com/entertainment/movie-guide/Doug+Camilli+George+Clooney+incinerates+Daily+Mail/10014299/story.html	Montreal Gazette	e	d-8MyxykhnG98yMM55pOEPA7TH01M	www.montrealgazette.com	1404981414345
375962	George Clooney Knows How to Get Things Done	http://www.celebuzz.com/2014-07-09/george-clooney-apology-from-daily-mail/	Celebuzz	e	d-8MyxykhnG98yMM55pOEPA7TH01M	www.celebuzz.com	1404981414643
375963	British website apologizes for story on George Clooney marriage	http://www.delcotimes.com/arts-and-entertainment/20140709/british-website-apologizes-for-story-on-george-clooney-marriage	Delaware County Daily Times	e	d-8MyxykhnG98yMM55pOEPA7TH01M	www.delcotimes.com	1404981414896
375964	Britain's Daily Mail sorry after Clooney slams story	http://www.azcentral.com/story/entertainment/people/2014/07/09/britains-daily-mail-sorry-after-clooney-slams-story/12412195/	azcentral.com	e	d-8MyxykhnG98yMM55pOEPA7TH01M	www.azcentral.com	1404981415124
375965	George Clooney slams Daily Mail over report fiancee's mother disapproves  ...	http://metronews.ca/scene/1090513/george-clooney-slams-daily-mail-for-dangerous-report-on-mother-in-law/	MetroNews Canada	e	d-8MyxykhnG98yMM55pOEPA7TH01M	metronews.ca	1404981415481
375966	Daily Mail Apologises to George Clooney Over False Mother-In-Law Report	http://www.ibtimes.co.uk/daily-mail-apologises-george-clooney-over-false-mother-law-report-1455985	International Business Times UK	e	d-8MyxykhnG98yMM55pOEPA7TH01M	www.ibtimes.co.uk	1404981415712
375967	Clooney slams paper over comments	http://www.indianagazette.com/news/entertainment/clooney-slams-paper-over-comments,20204872/	Indiana Gazette	e	d-8MyxykhnG98yMM55pOEPA7TH01M	www.indianagazette.com	1404981415922
375968	Clooney responds to Daily Mail about "fabricated story" on future mother-in-law	http://gantdaily.com/2014/07/09/clooney-responds-to-daily-mail-about-fabricated-story-on-future-mother-in-law/	Gant Daily	e	d-8MyxykhnG98yMM55pOEPA7TH01M	gantdaily.com	1404981416178
375969	'Daily Mail' apologizes to George Clooney	http://www.khou.com/entertainment/Daily-Mail-apologizes-to-George-Clooney-266455101.html	KHOU	e	d-8MyxykhnG98yMM55pOEPA7TH01M	www.khou.com	1404981416527
375970	Mail Online apologizes to George Clooney	http://www.goupstate.com/article/20140709/ENT/140709675\?Title=Mail-Online-apologizes-to-George-Clooney	Spartanburg Herald Journal	e	d-8MyxykhnG98yMM55pOEPA7TH01M	www.goupstate.com	1404981416776
375971	George Clooney responds to rumors about his future marriage to Amal Alamuddin	http://www.inrumor.com/in/hollywood/george-clooney-responds-to-rumors-about-his-future-marriage-to-amal-alamuddin/	Inrumor	e	d-8MyxykhnG98yMM55pOEPA7TH01M	www.inrumor.com	1404981417009
375972	Clooney Calls Out Tabloid, But What About His Press Past?	http://archive.firstcoastnews.com/video/default.aspx\?bctid=3666277999001	First Coast News	e	d-8MyxykhnG98yMM55pOEPA7TH01M	archive.firstcoastnews.com	1404981417511
375973	George Clooney attacks Daily Mail for 'dangerous' claim his fiancée risks being  ...	http://arts.nationalpost.com/2014/07/09/george-clooney-attacks-daily-mail-for-dangerous-claim-his-fiancee-risks-being-disowned-by-family-for-religious-reasons-over-marriage-to-actor/	National Post	e	d-8MyxykhnG98yMM55pOEPA7TH01M	arts.nationalpost.com	1404981417703
375974	George Clooney Blasts Daily Mail	http://www.mediabistro.com/fishbowlny/george-clooney-blasts-daily-mail_b219331	mediabistro.com	e	d-8MyxykhnG98yMM55pOEPA7TH01M	www.mediabistro.com	1404981417945
375975	George Clooney wins apology over false story about fiancee	http://www.torontosun.com/2014/07/09/george-clooney-wins-apology-over-false-fiancee-story	Toronto Sun	e	d-8MyxykhnG98yMM55pOEPA7TH01M	www.torontosun.com	1404981418186
375976	George Clooney, Amal Alamuddin's mom slam rumors	http://www.azcentral.com/story/entertainment/people/2014/07/09/george-clooney-amal-alamuddins-mom-slam-rumors/12395983/	azcentral.com	e	d-8MyxykhnG98yMM55pOEPA7TH01M	www.azcentral.com	1404981418567
375977	Op-Ed: George Clooney's future in-laws tied to Druze; Shia	http://www.digitaljournal.com/a-and-e/entertainment/george-clooney-s-future-mother-in-law-already-fuming/article/389002	DigitalJournal.com	e	d-8MyxykhnG98yMM55pOEPA7TH01M	www.digitaljournal.com	1404981418760
375978	George Clooney slams Daily Mail story about his future marriage	http://www.amny.com/entertainment/george-clooney-slams-daily-mail-story-about-his-future-marriage-1.8741687	amNY	e	d-8MyxykhnG98yMM55pOEPA7TH01M	www.amny.com	1404981419038
375979	George Clooney Slams The Daily Mail for 'Fabricated' Report Suggesting Future  ...	http://www.hngn.com/articles/35647/20140709/george-clooney-slams-the-daily-mail-for-fabricated-report-suggesting-future-mother-in-law-opposed-upcoming-wedding.htm	Headlines \& Global News	e	d-8MyxykhnG98yMM55pOEPA7TH01M	www.hngn.com	1404981419417
375980	Website apologizes for George Clooney mother-in-law story	http://onlineathens.com/entertainment/2014-07-09/clooney-slams-newspaper-over-mother-law-report	Online Athens	e	d-8MyxykhnG98yMM55pOEPA7TH01M	onlineathens.com	1404981419658
375981	The article requested cannot be found! Please refresh your browser or go back  ...	http://www.neagle.com/article/ZZ/20140709/NEWS/307099994/12860/ENTERTAINMENT	NEagle	e	d-8MyxykhnG98yMM55pOEPA7TH01M	www.neagle.com	1404981419910
375982	George Clooney accuses the Daily Mail of 'inventing' stories about partner, Amal  ...	http://www.nme.com/filmandtv/news/george-clooney-accuses-the-daily-mail-of-inventing/343389	NME.com	e	d-8MyxykhnG98yMM55pOEPA7TH01M	www.nme.com	1404981420128
375983	George Clooney Slams Tabloid Report About Future Mother-in-Law: 'Amal's  ...	http://www.capitalgazette.com/parade/entertainment/george-clooney-slams-tabloid-report-about-future-mother-in-law/article_e10b2017-09db-58e7-bb41-406ba09823ff.html	CapitalGazette.com	e	d-8MyxykhnG98yMM55pOEPA7TH01M	www.capitalgazette.com	1404981420910
375984	George Clooney Calls Out 'The Daily Mail' For Claiming His Mother-In-Law  ...	http://www.fashionnstyle.com/articles/22232/20140709/george-clooney-calls-out-daily-mail-claiming-mother-law-opposed.htm	Fashion \& Style	e	d-8MyxykhnG98yMM55pOEPA7TH01M	www.fashionnstyle.com	1404981421149
375985	George Clooney Slams Daily Mail Reports About Family With Op-Ed For USA  ...	http://www.rttnews.com/2347267/george-clooney-slams-daily-mail-reports-about-family-with-op-ed-for-usa-today.aspx\?type=ets	RTT News	e	d-8MyxykhnG98yMM55pOEPA7TH01M	www.rttnews.com	1404981421413
375986	Daily Mail Apologise For Story Surrounding George Clooney's Marriage	http://www.contactmusic.com/article/george-clooney-fiance-daily-mail-apology_4277673	Contactmusic.com	e	d-8MyxykhnG98yMM55pOEPA7TH01M	www.contactmusic.com	1404981422120
375987	George Clooney Calls "Daily Mail" Report 'Fabricated' and Irresponsible	http://www.610kvnu.com/entertainment/9436ee7806e82087bef0040c585694be	610kvnu	e	d-8MyxykhnG98yMM55pOEPA7TH01M	www.610kvnu.com	1404981422346
375988	Newspaper apologizes for Clooney story	http://www.knoe.com/story/25976701/newspaper-apologizes-for-clooney-story	Knoe.com	e	d-8MyxykhnG98yMM55pOEPA7TH01M	www.knoe.com	1404981422558
375989	George Clooney Slams 'Criminal' Wedding Story	http://www.klfm967.co.uk/news/showbiz-news/1336986/george-clooney-slams-criminal-wedding-story/	KL.FM 96.7	e	d-8MyxykhnG98yMM55pOEPA7TH01M	www.klfm967.co.uk	1404981422790
375990	Newspaper apologizes after actor George Clooney slams story	http://abc13.com/entertainment/newspaper-apologizes-after-clooney-slams-story/171575/	KTRK-TV	e	d-8MyxykhnG98yMM55pOEPA7TH01M	abc13.com	1404981423380
375991	George Clooney, Harry Potter declare open season on tabloids	http://blogs.marketwatch.com/themargin/2014/07/09/george-clooney-harry-potter-declare-open-season-on-tabloids/	MarketWatch \(blog\)	e	d-8MyxykhnG98yMM55pOEPA7TH01M	blogs.marketwatch.com	1404981423658
375992	George Clooney Pens Epic Take-Down of Tabloid: "They Put My Family and My  ...	http://stylecaster.com/george-clooney-daily-mail-editorial/	StyleCaster	e	d-8MyxykhnG98yMM55pOEPA7TH01M	stylecaster.com	1404981423930
375993	UK Mail Online apologizes to George Clooney for 'fabricated' fiancée family story	http://www.csmonitor.com/The-Culture/Latest-News-Wires/2014/0709/UK-Mail-Online-apologizes-to-George-Clooney-for-fabricated-fiancee-family-story	Christian Science Monitor	e	d-8MyxykhnG98yMM55pOEPA7TH01M	www.csmonitor.com	1404981424756
375994	Exclusive: Clooney responds to 'Daily Mail' report	http://www.kgw.com/news/266442251.html	kgw.com	e	d-8MyxykhnG98yMM55pOEPA7TH01M	www.kgw.com	1404981425406
375995	Celebrity Wedding Updated- George Clooney Goes After Tabloid Claiming That  ...	http://www.mstarz.com/articles/33340/20140709/celebrity-wedding-updated-george-clooney-goes-after-tabloid-after-claiming-that-amal-alamuddins-mother-opposes-the-nuptials-on-religious-ground.htm	Mstarz	e	d-8MyxykhnG98yMM55pOEPA7TH01M	www.mstarz.com	1404981425684
375996	George Clooney Defends His Engagement With Shockingly Frank Words	http://thestir.cafemom.com/entertainment/174568/george_clooney_defends_his_engagement	The Stir	e	d-8MyxykhnG98yMM55pOEPA7TH01M	thestir.cafemom.com	1404981426097
375997	George Clooney Calls Daily Mail Report "Fabricated" and Irresponsible	http://www.kmbz.com/George-Clooney-Calls-Daily-Mail-Report-Fabricated-/19375088	KMBZ	e	d-8MyxykhnG98yMM55pOEPA7TH01M	www.kmbz.com	1404981426357
375998	Clooney slams UK story about his marriage	http://www.buenosairesherald.com/article/164175/clooney-slams-uk-story-about-his-marriage	Buenos Aires Herald	e	d-8MyxykhnG98yMM55pOEPA7TH01M	www.buenosairesherald.com	1404981426625
375999	George Clooney gets apology from British tabloid site for mother-in-law story	http://www.oregonlive.com/celebrity-news/index.ssf/2014/07/george_clooney_gets_apology_fr.html	The Oregonian	e	d-8MyxykhnG98yMM55pOEPA7TH01M	www.oregonlive.com	1404981426877
376000	George Clooney miffed at false marriage report	http://www.bollywoodlife.com/news/george-clooney-miffed-at-false-marriage-report/	Bollywood Life	e	d-8MyxykhnG98yMM55pOEPA7TH01M	www.bollywoodlife.com	1404981427257
