365301	Taylor Swift Threw A Star-Studded Fourth Of July Bash At Her Rhode Island Home	http://www.fashionnstyle.com/articles/22086/20140707/taylor-swift-threw-star-studded-fourth-july-bash-rhode-island.htm	Fashion \& Style	e	dT7ciJeyu2SlYlMAj_hLbWpD8xZ9M	www.fashionnstyle.com	1404762375505
365302	It's Official! Taylor Swift Has the Coolest Celebrity Friends (PHOTOS)	http://thestir.cafemom.com/entertainment/174459/its_official_taylor_swift_has	The Stir	e	dT7ciJeyu2SlYlMAj_hLbWpD8xZ9M	thestir.cafemom.com	1404762375771
365303	Taylor Swift had a way better weekend than all of us	http://www.sheknows.ca/entertainment/articles/962137/taylor-swift-had-a-way-better-weekend-than-all-of-us	SheKnows Canada	e	dT7ciJeyu2SlYlMAj_hLbWpD8xZ9M	www.sheknows.ca	1404762376109
365304	Inside Taylor Swift's Star-Studded July 4th Weekend	http://newsok.com/inside-taylor-swifts-star-studded-july-4th-weekend/article/feed/708300	NewsOK.com	e	dT7ciJeyu2SlYlMAj_hLbWpD8xZ9M	newsok.com	1404762376368
365305	Lena Dunham Just RUINED Taylor Swift&#146;s Family Photo	http://www.cosmopolitan.com/celebrity/news/lena-dunham-ruins-tswift-photo	Cosmopolitan	e	dT7ciJeyu2SlYlMAj_hLbWpD8xZ9M	www.cosmopolitan.com	1404762376750
365306	Taylor Swift Hosts Fame-Filled 4th of July Party: See the Photos!	http://www.thehollywoodgossip.com/2014/07/taylor-swift-hosts-fame-filled-4th-of-july-party-see-the-photos/	The Hollywood Gossip	e	dT7ciJeyu2SlYlMAj_hLbWpD8xZ9M	www.thehollywoodgossip.com	1404762377247
365307	Taylor Swift Hosts Star-Studded Fourth of July Party; Selena Gomez Not Invited  ...	http://www.christianpost.com/news/taylor-swift-hosts-star-studded-fourth-of-july-party-selena-gomez-not-invited-photo-122830/	Christian Post	e	dT7ciJeyu2SlYlMAj_hLbWpD8xZ9M	www.christianpost.com	1404762377444
365308	See Taylor Swift's 4th of July 'Family Portrait'	http://www.vulture.com/2014/07/see-taylor-swifts-4th-of-july-family-portrait.html	Vulture	e	dT7ciJeyu2SlYlMAj_hLbWpD8xZ9M	www.vulture.com	1404762377840
365309	Taylor Swiftâ€™s Mansion Was The Place To Be This July 4th: Ask Emma Stone  ...	http://www.contactmusic.com/article/taylo-swift-independence-day-party-photos-instagram-lena-dunham-emma-stone-andrew-garfield-jessica-szohr_4275515	Contactmusic.com	e	dT7ciJeyu2SlYlMAj_hLbWpD8xZ9M	www.contactmusic.com	1404762378148
365310	Taylor Swift Celebrates Fourth of July With Lena Dunham and Emma Stone  ...	http://www.wetpaint.com/taylor-swift/articles/2014-07-07-celebrates-fourth-july-lena-dunham	Wetpaint	e	dT7ciJeyu2SlYlMAj_hLbWpD8xZ9M	www.wetpaint.com	1404762378367
365311	Taylor Swift 'repeats' Fourth holiday in Watch Hill	http://www.turnto10.com/story/25952950/taylor-swift-repeats-fourth-holiday-in-watch-hill	Turn to 10	e	dT7ciJeyu2SlYlMAj_hLbWpD8xZ9M	www.turnto10.com	1404762378571
365312	Taylor Swift's ridiculously celeb-filled party	http://www.cosmopolitan.co.uk/celebs/celebrity-gossip/taylor-swift-celebrity-friends-instagram	Cosmopolitan UK	e	dT7ciJeyu2SlYlMAj_hLbWpD8xZ9M	www.cosmopolitan.co.uk	1404762378788
365313	Taylor Swift's star-studded 4th of July party - see pics 10:41AM	http://www.glamourmagazine.co.uk/news/celebrity/2014/07/07/taylor-swift-4-july-party	Glamour.com	e	dT7ciJeyu2SlYlMAj_hLbWpD8xZ9M	www.glamourmagazine.co.uk	1404762379117
365314	Taylor Swift Shares 'Family Portrait' with Lena Dunham, Emma Stone	http://www.fashiontimes.com/articles/9436/20140707/taylor-swift-shares-family-portrait-lena-dunham-emma-stone.htm	Fashion Times	e	dT7ciJeyu2SlYlMAj_hLbWpD8xZ9M	www.fashiontimes.com	1404762379576
365315	Taylor Swift has star-studded Fourth of July weekend	http://thecelebritycafe.com/feature/2014/07/taylor-swift-has-star-studded-fourth-july-weekend	TheCelebrityCafe.com	e	dT7ciJeyu2SlYlMAj_hLbWpD8xZ9M	thecelebritycafe.com	1404762379771
365316	Taylor Swift's A-List Instagram	https://au.news.yahoo.com/thewest/a/24404104/taylor-swifts-a-list-instagram/	The West Australian	e	dT7ciJeyu2SlYlMAj_hLbWpD8xZ9M	au.news.yahoo.com	1404762380102
365317	Emma Stone & Andrew Garfield Take a Boat Ride with Taylor Swift!	http://www.justjaredjr.com/2014/07/06/emma-stone-andrew-garfield-take-a-boat-ride-with-taylor-swift/	Just Jared Jr.	e	dT7ciJeyu2SlYlMAj_hLbWpD8xZ9M	www.justjaredjr.com	1404762380438
365318	Swift shares "family portrait" with celeb friends	http://www.rte.ie/ten/news/2014/0707/629003-swift-shares-family-portrait-with-celeb-friends/	RTE.ie	e	dT7ciJeyu2SlYlMAj_hLbWpD8xZ9M	www.rte.ie	1404762380882
365319	Taylor Swift hosts star-studded party	http://indiatoday.intoday.in/story/taylor-swift-hosts-fancy-star-studded-party-emma-stone-andrew-garfield/1/370187.html	India Today	e	dT7ciJeyu2SlYlMAj_hLbWpD8xZ9M	indiatoday.intoday.in	1404762381172
365320	Taylor Swift Celebrates Fourth of July With Emma Stone and Lena Dunham	http://www.aceshowbiz.com/news/view/00072576.html	AceShowbiz	e	dT7ciJeyu2SlYlMAj_hLbWpD8xZ9M	www.aceshowbiz.com	1404762381466
365321	Our celebrity best friends are hanging out together	http://www.examiner.com/article/our-celebrity-best-friends-are-hanging-out-together	Examiner.com	e	dT7ciJeyu2SlYlMAj_hLbWpD8xZ9M	www.examiner.com	1404762381746
365322	CELEB GOSS: Inside Taylor Swift's A-List 4th of July	http://www.illawarramercury.com.au/story/2400219/celeb-goss-inside-taylor-swifts-a-list-4th-of-july/\?cs=298	Illawarra Mercury	e	dT7ciJeyu2SlYlMAj_hLbWpD8xZ9M	www.illawarramercury.com.au	1404762382139
365323	Taylor Swift: Hangs Out With Friends Like Emma Stone, Excluding Selena Gomez	http://hollywoodlife.com/2014/07/06/taylor-swift-emma-stone-vacation-without-selena-gomez/	Hollywood Life	e	dT7ciJeyu2SlYlMAj_hLbWpD8xZ9M	hollywoodlife.com	1404762382944
365324	Taylor Swift Celebrates Fourth With Celeb Pals Emma Stone, Lena Dunham and  ...	http://www.intouchweekly.com/posts/taylor-swift-celebrates-fourth-with-celeb-pals-emma-stone-lena-dunham-and-more-40149	In Touch Weekly	e	dT7ciJeyu2SlYlMAj_hLbWpD8xZ9M	www.intouchweekly.com	1404762383274
365325	Try And Name Every Taylor Swift BFF In This Photo	http://www.mtv.com/news/1861808/taylor-swif-bff-4th-of-july/\?utm_source=feedburner&amp;utm_medium=feed&amp;utm_campaign=Feed%3A+MTVNewsLatest+(MTV+News+Latest+Headlines)	MTV.com	e	dT7ciJeyu2SlYlMAj_hLbWpD8xZ9M	www.mtv.com	1404762383568
365326	Taylor Swift Shares Fourth of July Photos	http://www.fanlala.com/news/taylor-swift-shares-4th-july-photos	Fanlala	e	dT7ciJeyu2SlYlMAj_hLbWpD8xZ9M	www.fanlala.com	1404762383914
365327	Taylor Swift Celebrates the 4th of July with Odeya Rush, Emma Stone, Lena  ...	http://teendaily.net/2014/07/taylor-swift-celebrates-the-4th-of-july-with-odeya-rush-emma-stone-lena-dunham-more/	Teen Daily	e	dT7ciJeyu2SlYlMAj_hLbWpD8xZ9M	teendaily.net	1404762384162
365328	Taylor Swift Featured In Video Posted By Jaime King	http://www.rttnews.com/2345681/taylor-swift-featured-in-video-posted-by-jaime-king.aspx\?type=cnt	RTT News	e	dT7ciJeyu2SlYlMAj_hLbWpD8xZ9M	www.rttnews.com	1404762384371
365329	Solange Knowles Addresses Her Elevator Fight With Jay Z	http://www.hollywoodreporter.com/news/solange-knowles-addresses-her-elevator-716979	Hollywood Reporter	e	d-sfKz1s-j_DkRMA5T3fFqISM_mLM	www.hollywoodreporter.com	1404762995241
365330	Solange predictably plays down Jay Z elevator fight in new interview	http://www.washingtonpost.com/blogs/style-blog/wp/2014/07/07/solange-predictably-plays-down-jay-z-elevator-fight-in-new-interview/	Washington Post \(blog\)	e	d-sfKz1s-j_DkRMA5T3fFqISM_mLM	www.washingtonpost.com	1404762995511
365331	Solange talks about 'that thing' in the elevator	http://newsok.com/solange-talks-about-that-thing-in-the-elevator/article/4986360	NewsOK.com	e	d-sfKz1s-j_DkRMA5T3fFqISM_mLM	newsok.com	1404762995898
365332	Solange Knowles Finally Opens Up About the Infamous Elevator Fight with Jay Z  ...	http://www.latinopost.com/articles/6596/20140707/solange-knowles-finally-opens-up-about-the-infamous-elevator-fight-with-jay-z-beyonce.htm	Latino Post	e	d-sfKz1s-j_DkRMA5T3fFqISM_mLM	www.latinopost.com	1404762996209
365333	Solange Knowles talks elevator fight, new album and New Orleans in Lucky  ...	http://www.nola.com/music/index.ssf/2014/07/solange_knowles_talks_elevator.html	The Times-Picayune	e	d-sfKz1s-j_DkRMA5T3fFqISM_mLM	www.nola.com	1404762996601
365334	Solange Knowles 'at peace' over elevator bust-up	http://www.philly.com/philly/blogs/entertainment/celebrities_gossip/20140707_WENN_Solange_Knowles__at_peace__over_elevator_bust_up.html	Philly.com \(blog\)	e	d-sfKz1s-j_DkRMA5T3fFqISM_mLM	www.philly.com	1404762996950
365335	Solange and Jay Z fight no clearer after magazine interview	http://www.handbag.com/day-bag/news/a582687/solange-and-jay-z-fight-no-clearer-after-magazine-interview.html	handbag.com	e	d-sfKz1s-j_DkRMA5T3fFqISM_mLM	www.handbag.com	1404762997641
365336	Archive: Beyonce leaves with Solange after she attacks Jay Z	http://www.dailymail.co.uk/video/news/video-1103932/Archive-Beyonce-leaves-Solange-attacks-Jay-Z.html	Daily Mail	e	d-sfKz1s-j_DkRMA5T3fFqISM_mLM	www.dailymail.co.uk	1404762997966
365337	Solange Knowles talks Jay Z elevator fight, says family is 'all good'	http://thegrio.com/2014/07/07/solange-knowles-elevator-fight-interview/	The Grio	e	d-sfKz1s-j_DkRMA5T3fFqISM_mLM	thegrio.com	1404762998390
365338	Solange Knowles Breaks Silence on That Elevator Incident	http://www.extratv.com/2014/07/07/solange-knowles-breaks-silence-on-that-elevator-incident/	Extra	e	d-sfKz1s-j_DkRMA5T3fFqISM_mLM	www.extratv.com	1404762998725
365339	Solange Opens Up About Elevator Fight With Jay Z in Lucky Magazine Cover Story	http://theboombox.com/solange-elevator-fight-jay-z-lucky-magazine-cover/	The BoomBox	e	d-sfKz1s-j_DkRMA5T3fFqISM_mLM	theboombox.com	1404762999065
365340	Solange Knowles: 'My Family And I Are All Good' Following Jay Z Attack	http://rumorfix.com/2014/07/146204/	RumorFix	e	d-sfKz1s-j_DkRMA5T3fFqISM_mLM	rumorfix.com	1404762999431
365341	Solange Addresses Elevator Fight, Talks New Album: 'I Want You to Hear Me'	http://v103.cbslocal.com/2014/07/07/solange-addresses-elevator-fight-talks-new-album-i-want-you-to-hear-me/	V-103 - The People's Station	e	d-sfKz1s-j_DkRMA5T3fFqISM_mLM	v103.cbslocal.com	1404762999761
365342	Solange Opens Up About The Infamous Elevator Fight!	http://hiphollywood.com/2014/07/solange-opens-up-about-the-infamous-elevator-fight/	HipHollywood.com	e	d-sfKz1s-j_DkRMA5T3fFqISM_mLM	hiphollywood.com	1404763000131
365343	Solange breaks silence on lift incident	http://www.cosmopolitan.co.uk/celebs/celebrity-gossip/solange-breaks-silence-lift-incident-jay-z	Cosmopolitan UK	e	d-sfKz1s-j_DkRMA5T3fFqISM_mLM	www.cosmopolitan.co.uk	1404763000436
365344	'That thing' is no longer a thing	http://www.thespec.com/whatson-story/4619093--that-thing-is-no-longer-a-thing/	Hamilton Spectator	e	d-sfKz1s-j_DkRMA5T3fFqISM_mLM	www.thespec.com	1404763000712
365345	#ICYMI: Solange Knowles Breakes Silence on Jay-Z Elevator Incident	http://clizbeats.com/icymisolange-knowles-breakes-silence-on-jay-z-elev-6146/	Clizbeats.com	e	d-sfKz1s-j_DkRMA5T3fFqISM_mLM	clizbeats.com	1404763001047
365346	Solange Knowles says tantalizingly little about elevator fight	http://www.latimes.com/entertainment/gossip/la-et-mg-solange-knowles-elevator-fight-jay-z-beyonce-20140707-story.html	Los Angeles Times	e	d-sfKz1s-j_DkRMA5T3fFqISM_mLM	www.latimes.com	1404763001426
365347	Solange Talks Elevator Fight with Jay Z in Lucky Magazine; Burberry Investors  ...	http://www.thedailybeast.com/articles/2014/07/07/solange-in-lucky-on-elevator-fight-with-jay-z-burberry-investors-question-ceo-s-perks.html	Daily Beast	e	d-sfKz1s-j_DkRMA5T3fFqISM_mLM	www.thedailybeast.com	1404763001711
365348	Solange Knowles Finally Talks About That Elevator Brawl With Jay Z	http://thestir.cafemom.com/entertainment/174487/solange_knowles_finally_talks_about	The Stir	e	d-sfKz1s-j_DkRMA5T3fFqISM_mLM	thestir.cafemom.com	1404763002176
365349	Solange Knowles addresses Jay Z lift attack for first time and we were all really  ...	http://metro.co.uk/2014/07/07/solange-knowles-addresses-jay-z-lift-attack-for-first-time-and-we-were-all-really-excited-until-we-read-what-she-said-4790144/	Metro	e	d-sfKz1s-j_DkRMA5T3fFqISM_mLM	metro.co.uk	1404763002680
365350	Solange Talks Elevator Fight W/ Jay Z, Backup Dancing For Destiny's Child +  ...	http://allhiphop.com/2014/07/07/solange-talks-elevator-fight-w-jay-z-backup-dancing-for-destinys-child-more/	AllHipHop	e	d-sfKz1s-j_DkRMA5T3fFqISM_mLM	allhiphop.com	1404763003005
365351	'We are at peace' Karate kicking Solange opens up about Jay Z fight	http://www.dailystar.co.uk/showbiz/387711/Solange-interviewed-after-attacking-Beyonc-s-husband-Jay-Z	Daily Star	e	d-sfKz1s-j_DkRMA5T3fFqISM_mLM	www.dailystar.co.uk	1404763003397
365352	First Dibs: Solange Finally Addresses the Infamous Elevator Incident	http://www.vh1.com/music/tuner/2014-07-07/first-dibs-solange-finally-addresses-the-infamous-elevator-incident/	VH1	e	d-sfKz1s-j_DkRMA5T3fFqISM_mLM	www.vh1.com	1404763003644
365353	Solange Knowles (kinda) Addresses Elevator Scuffle with Jay Z	http://www.bellanaija.com/2014/07/07/solange-knowles-sort-of-addresses-elevator-scuffle-with-jay-z/	Bella Naija	e	d-sfKz1s-j_DkRMA5T3fFqISM_mLM	www.bellanaija.com	1404763003907
365354	Solange Knowles is 'at peace' over Jay Z row	http://dalje.com/en-celebrities/solange-knowles-is-at-peace-over-jay-z-row/514297	Dalje.com	e	d-sfKz1s-j_DkRMA5T3fFqISM_mLM	dalje.com	1404763004125
365355	Solange Covers Lucky Magazine And Talks Infamous Elevator Fight With Jay Z  ...	http://www.huffingtonpost.com/2014/07/07/solange-lucky-august-2014_n_5563333.html\?utm_hp_ref=style&amp;ir=Style	Huffington Post	e	d-sfKz1s-j_DkRMA5T3fFqISM_mLM	www.huffingtonpost.com	1404763004489
365356	Solance 'at peace' over Jay-Z elevator bust-up	http://blog.chron.com/celebritybuzz/2014/07/solance-at-peace-over-jay-z-elevator-bust-up/	Chron.com \(blog\)	e	d-sfKz1s-j_DkRMA5T3fFqISM_mLM	blog.chron.com	1404763004772
365357	Solange Knowles and Jay Z at peace over elevator scuffle	http://jam.canoe.ca/Celebrities/2014/07/07/21789556.html	CANOE	e	d-sfKz1s-j_DkRMA5T3fFqISM_mLM	jam.canoe.ca	1404763005053
365358	Solange speaks on elevator fight with Jay-Z	http://s2smagazine.com/2014/07/07/solange-speaks-on-elevator-fight-with-jay-z/	S2Smagazine.com	e	d-sfKz1s-j_DkRMA5T3fFqISM_mLM	s2smagazine.com	1404763005423
365359	Solange Knowles has spoken about being "at peace" following her altercation  ...	http://www.irishmirror.ie/showbiz/solange-knowles-spoken-being-at-3824303	Irish Mirror	e	d-sfKz1s-j_DkRMA5T3fFqISM_mLM	www.irishmirror.ie	1404763005850
365360	Solange Knowles Barely Addresses Elevator Incident in New Interview	http://www.mediaite.com/online/solange-knowles-barely-addresses-elevator-incident-in-new-interview/	Mediaite	e	d-sfKz1s-j_DkRMA5T3fFqISM_mLM	www.mediaite.com	1404763006302
365361	Solange Speaks On Jay Z Elevator Incident	http://www.xxlmag.com/news/2014/07/solange-speaks-jay-z-elevator-incident/	XXLMAG.COM	e	d-sfKz1s-j_DkRMA5T3fFqISM_mLM	www.xxlmag.com	1404763006589
365362	Solange Knowles speaks out about Jay-Z elevator fight	http://www.examiner.com/article/solange-knowles-speaks-out-about-jay-z-elevator-fight	Examiner.com	e	d-sfKz1s-j_DkRMA5T3fFqISM_mLM	www.examiner.com	1404763006958
365363	Solange Knowles Addresses Elevator Spat in Lucky Magazine	http://www.bet.com/news/fashion-and-beauty/2014/07/07/solange-knowles-addresses-elevator-spat-in-lucky-magazine.html	BET	e	d-sfKz1s-j_DkRMA5T3fFqISM_mLM	www.bet.com	1404763007222
365364	Solange Finally Opened Up About 'That Thing' With Jay Z At The Met Gala	http://uproxx.com/webculture/2014/07/solange-finally-opened-up-about-that-thing-with-jay-z-at-the-met-gala/	Uproxx	e	d-sfKz1s-j_DkRMA5T3fFqISM_mLM	uproxx.com	1404763007511
365365	Solange Gets Lucky With A Mag Cover After Her Infamous Elevator Brawl! Think  ...	http://perezhilton.com/cocoperez/2014-07-07-solange-knowles-lucky-magazine-august-2014-cover-spread	PerezHilton.com	e	d-sfKz1s-j_DkRMA5T3fFqISM_mLM	perezhilton.com	1404763007747
365366	Solange Knowles opens up on Met Gala incident	http://www.hellomagazine.com/celebrities/2014070719787/solange-knowles-opens-up-on-lift-incident/	hellomagazine.com	e	d-sfKz1s-j_DkRMA5T3fFqISM_mLM	www.hellomagazine.com	1404763008100
365367	Solange Knowles breaks silence on Jay Z elevator fight	http://www.azcentral.com/story/entertainment/people/2014/07/07/solange-knowles-is-at-peace-over-jay-z-row/12286905/	azcentral.com	e	d-sfKz1s-j_DkRMA5T3fFqISM_mLM	www.azcentral.com	1404763008366
365368	Solange Speaks about Elevator Fight	http://www.ebony.com/black-listed/entertainment-culture/solange-speaks-about-elevator-fight-981	EBONY.com	e	d-sfKz1s-j_DkRMA5T3fFqISM_mLM	www.ebony.com	1404763008632
365369	Solange Knowles 'Feels at Peace' with Elevator Incident	http://www.people.com/article/solange-knowles-elevator-fight-JayZ-lucky-cover	People Magazine	e	d-sfKz1s-j_DkRMA5T3fFqISM_mLM	www.people.com	1404763009034
365370	Solange Opens Up About Infamous Elevator Fight: 'My Family And I Are All Good'	http://www.ibtimes.com/solange-opens-about-infamous-elevator-fight-my-family-i-are-all-good-1620932	International Business Times	e	d-sfKz1s-j_DkRMA5T3fFqISM_mLM	www.ibtimes.com	1404763009357
365371	Solange Covers Lucky Magazine & Talks 'That Thing' That Happened On The  ...	http://chicagodefender.com/2014/07/07/solange-covers-lucky-magazine-talks-that-thing-that-happened-on-the-elevator/	Chicago Defender	e	d-sfKz1s-j_DkRMA5T3fFqISM_mLM	chicagodefender.com	1404763009624
365372	Solange Brushes Off Jay Z Elevator Fight As 'That Thing'	http://www.mtv.com/news/1862314/solange-jay-z-elevator-fight-response/	MTV.com	e	d-sfKz1s-j_DkRMA5T3fFqISM_mLM	www.mtv.com	1404763010063
365373	Solange Knowles Opens Up About Elevator Fight With Jay Z	http://www.x17online.com/2014/07/solange_knowles_elevator_attack_interview_070714	X17 Online	e	d-sfKz1s-j_DkRMA5T3fFqISM_mLM	www.x17online.com	1404763010288
365374	Solange Knowles Talks About Jay-Z, Beyoncé Elevator Fight: Despite Divorce  ...	http://www.mstarz.com/articles/33200/20140707/solange-knowles-talks-jay-z-beyonc%C3%A9-elevator-fight-despite-divorce-rumors-cheating-scandal-singer.htm	Mstarz	e	d-sfKz1s-j_DkRMA5T3fFqISM_mLM	www.mstarz.com	1404763010539
365375	Solange talks about 'that thing' with Jay Z in elevator	http://www.freep.com/article/20140707/ENT07/307070113/Solange-Knowles-Jay-Z-elevator	Detroit Free Press	e	d-sfKz1s-j_DkRMA5T3fFqISM_mLM	www.freep.com	1404763010950
365376	Solange Briefly Addresses Jay Z Elevator Attack	http://www.hotnewhiphop.com/solange-briefly-addresses-jay-z-elevator-attack-news.11195.html	HotNewHipHop	e	d-sfKz1s-j_DkRMA5T3fFqISM_mLM	www.hotnewhiphop.com	1404763011207
365377	For Solange Knowles, 'that thing' with Jay-Z in the elevator? We don't need to  ...	http://arts.nationalpost.com/2014/07/07/for-solange-knowles-that-thing-with-jay-z-in-the-elevator-we-dont-need-to-talk-about-it-and-everything-is-all-good/	National Post	e	d-sfKz1s-j_DkRMA5T3fFqISM_mLM	arts.nationalpost.com	1404763011472
365378	Solange Lands Lucky Cover; Addresses Elevator Fight For the First Time	http://uptownmagazine.com/2014/07/solange-addresses-elevator-fight-covers-lucky-magazine-august/	UPTOWN Magazine	e	d-sfKz1s-j_DkRMA5T3fFqISM_mLM	uptownmagazine.com	1404763012142
365379	Solange Knowles Breaks Her Silence on Jay Z Elevator Fight	http://news92fm.com/453828/solange-knowles-breaks-her-silence-on-jay-z-elevator-fight/	News 92 FM	e	d-sfKz1s-j_DkRMA5T3fFqISM_mLM	news92fm.com	1404763012413
365380	Solange Knowles Speaks Out On Jay Z Elevator Fight	http://hiphopwired.com/2014/07/07/solange-knowles-speaks-on-jay-z-elevator-fight/	Hip-Hop Wired	e	d-sfKz1s-j_DkRMA5T3fFqISM_mLM	hiphopwired.com	1404763012684
365381	Solange addresses Jay Z elevator scuffle	http://www.nydailynews.com/entertainment/gossip/solange-addresses-jay-z-elevator-scuffle-article-1.1857283	New York Daily News	e	d-sfKz1s-j_DkRMA5T3fFqISM_mLM	www.nydailynews.com	1404763013141
365382	Solange Knowles finally addresses elevator controversy, says all is well	http://www.holymoly.com/celebrity/news/solange-knowles-finally-addresses-elevator-controversy-says-all-well69920	Holy Moly\!	e	d-sfKz1s-j_DkRMA5T3fFqISM_mLM	www.holymoly.com	1404763013350
365383	Solange Knowles Opens Up About Jay Z Elevator Fight, Says She is 'All Good  ...	http://www.hngn.com/articles/35440/20140707/solange-knowles-opens-up-about-jay-z-elevator-fight-says-she-is-all-good-with-her-family.htm	Headlines \& Global News	e	d-sfKz1s-j_DkRMA5T3fFqISM_mLM	www.hngn.com	1404763013688
365384	Solange Lightly Acknowledges 'That Thing' In New Issue Of 'Lucky'	http://www.etcanada.com/blogs/etc_103010/solange-lightly-acknowledges-that-thing-in-the-new-issue-of-lucky/music/	ETCanada.com \(blog\)	e	d-sfKz1s-j_DkRMA5T3fFqISM_mLM	www.etcanada.com	1404763014064
365385	Solange Speaks Up on Jay Z Elevator Scuffle	http://www.your-story.org/solange-speaks-up-on-jay-z-elevator-scuffle/19424238/	Your-Story.org	e	d-sfKz1s-j_DkRMA5T3fFqISM_mLM	www.your-story.org	1404763014330
365386	Solange Knowles: 'My Family and I Are All Good' After...	http://abcnews.go.com/Entertainment/solange-knowles-breaks-silence-jay-fight-family-good/story\?id=24451231	ABC News	e	d-sfKz1s-j_DkRMA5T3fFqISM_mLM	abcnews.go.com	1404763014630
365387	Solange Knowles Talks Jay Z/Beyoncé 'Elevator Attack' Video In New Interview  ...	http://www.huffingtonpost.co.uk/2014/07/07/solange-knowles-jay-z-lift-attack-beyonce_n_5564009.html	Huffington Post UK	e	d-sfKz1s-j_DkRMA5T3fFqISM_mLM	www.huffingtonpost.co.uk	1404763015360
365388	Solange Covers Lucky Magazine, Dodges Questions About Elevator Fight	http://cocoafab.com/solange-covers-lucky-magazine-dodges-questions-about-elevator-fight/	Cocoafab	e	d-sfKz1s-j_DkRMA5T3fFqISM_mLM	cocoafab.com	1404763015674
365389	Solange Breaks Her Silence On Met Gala Fight With Jay Z: "My Family And I Are  ...	http://www.wetpaint.com/beyonce/articles/2014-07-07-solange-breaks-silence-met-gala	Wetpaint	e	d-sfKz1s-j_DkRMA5T3fFqISM_mLM	www.wetpaint.com	1404763016230
365390	Solange Knowles Elevator Fight with Jay-Z: Beyonce's Sister Graces Cover of  ...	http://www.latinpost.com/articles/16633/20140707/solange-knowles-graces-cover-of-lucky-talks-about-jay-z-elevator-altercation.htm	Latin Post	e	d-sfKz1s-j_DkRMA5T3fFqISM_mLM	www.latinpost.com	1404763016628
365391	Solange Frustratingly Quiet About Jay Z Elevator Scuffle	http://gawker.com/solange-still-says-nothing-about-elevator-scuffle-1601113490	Gawker	e	d-sfKz1s-j_DkRMA5T3fFqISM_mLM	gawker.com	1404763016892
365392	Solange on Jay Z lift attack: 'We're at peace with it now'	http://www.voice-online.co.uk/article/solange-jay-z-lift-attack-were-peace-it-now	The Voice Online	e	d-sfKz1s-j_DkRMA5T3fFqISM_mLM	www.voice-online.co.uk	1404763017171
365393	Solange Knowles Finally Addresses Elevator Altercation with Jay Z	http://www.celebuzz.com/2014-07-07/solange-knowles-finally-addresses-elevator-altercation-with-jay-z/	Celebuzz	e	d-sfKz1s-j_DkRMA5T3fFqISM_mLM	www.celebuzz.com	1404763017435
365394	Solange Knowles: 'My Family & I Are All Good'	http://www.accesshollywood.com/solange-knowles-addresses-elevator-fight-my-family-and-i-are-all-good_article_96241	Access Hollywood	e	d-sfKz1s-j_DkRMA5T3fFqISM_mLM	www.accesshollywood.com	1404763017946
365395	Solange Knowles 'All Good' with Jay Z After Lift Attack	http://www.ibtimes.co.uk/solange-knowles-all-good-jay-z-after-lift-attack-1455688	International Business Times UK	e	d-sfKz1s-j_DkRMA5T3fFqISM_mLM	www.ibtimes.co.uk	1404763018198
365396	Solange Addresses Jay Z Elevator Incident For The First Time	http://www.huffingtonpost.com/2014/07/07/solange-jay-z-beyonce-elevator_n_5563771.html\?utm_hp_ref=entertainment&amp;ir=Entertainment	Huffington Post	e	d-sfKz1s-j_DkRMA5T3fFqISM_mLM	www.huffingtonpost.com	1404763018398
365397	Solange Finally Just Gave Her First Statement About That Whole Elevator Thing	http://www.crushable.com/2014/07/07/entertainment/solange-elevator-attack-response-lucky-magazine-interview-august-2014/	Crushable	e	d-sfKz1s-j_DkRMA5T3fFqISM_mLM	www.crushable.com	1404763019025
365398	Solange Knowles addresses elevator incident in Lucky magazine interview	http://www.bignewsnetwork.com/index.php/sid/223564903	Big News Network.com	e	d-sfKz1s-j_DkRMA5T3fFqISM_mLM	www.bignewsnetwork.com	1404763019272
365399	Solange 'at peace' over Jay Z bust-up	http://www.u.tv/entertainment/Solange-at-peace-over-Jay-Z-bust-up/c5b524c8-3016-4beb-9d4f-a18910b84d05	U.TV	e	d-sfKz1s-j_DkRMA5T3fFqISM_mLM	www.u.tv	1404763019775
365400	Jay Z, Beyonce, Solange Knowles are "at peace"	http://www.accessatlanta.com/weblogs/buzz/2014/jul/07/solange-knowles-were-peace/	Access Atlanta \(blog\)	e	d-sfKz1s-j_DkRMA5T3fFqISM_mLM	www.accessatlanta.com	1404763020071
