8101	Sign-ups for health care may miss goal	http://www.vindy.com/news/2014/mar/12/sign-ups-for-health-care-may-miss-goal/	Youngstown Vindicator	m	dlj-alsMdBxXIIMI7z4Fzu_nN18SM	www.vindy.com	1394625871433
8102	Steadier health-care sign-ups may miss goal	http://www.dailyinterlake.com/news/national_world/article_a811a8c4-a977-11e3-9814-001a4bcf887a.html	Daily Inter Lake	m	dlj-alsMdBxXIIMI7z4Fzu_nN18SM	www.dailyinterlake.com	1394625871594
8103	Steady health care sign-ups may miss goal of 6M	http://www.wwmt.com/shared/news/features/national/stories/wwmt_steady-health-care-signups-may-miss-goal-6m-7063.shtml	WWMT-TV	m	dlj-alsMdBxXIIMI7z4Fzu_nN18SM	www.wwmt.com	1394625871779
8104	Health care signups progress, but unlikely to meet goal	http://www.sfgate.com/health/article/Health-care-signups-progress-but-unlikely-to-5308661.php	San Francisco Chronicle	m	dlj-alsMdBxXIIMI7z4Fzu_nN18SM	www.sfgate.com	1394625872305
8105	February health coverage sign-ups fall below target	http://www.jsonline.com/news/usandworld/february-health-coverage-sign-ups-fall-below-target-b99223542z1-249649861.html	Milwaukee Journal Sentinel	m	dlj-alsMdBxXIIMI7z4Fzu_nN18SM	www.jsonline.com	1394625872531
8106	Health care sign-ups steady in February, but Obama may miss scaled-down goal  ...	http://lethbridgeherald.com/business/2014/03/11/health-care-signups-steady-in-february-but-obama-may-miss-scaleddown-goal-by-march-31/	Lethbridge Herald	m	dlj-alsMdBxXIIMI7z4Fzu_nN18SM	lethbridgeherald.com	1394625872742
8107	A look at sign-ups by state for February	http://www.washingtonpost.com/national/a-look-at-sign-ups-by-state-for-february/2014/03/11/cee1cb52-a961-11e3-8a7b-c1c684e2671f_story.html	Washington Post	m	dlj-alsMdBxXIIMI7z4Fzu_nN18SM	www.washingtonpost.com	1394625872918
8108	Obamacare Sign-Ups Steady, Still Likely To Miss Goal	http://washington.cbslocal.com/2014/03/11/obamacare-sign-ups-steady-still-likely-to-miss-goal/	CBS Local	m	dlj-alsMdBxXIIMI7z4Fzu_nN18SM	washington.cbslocal.com	1394625873178
8109	ObamaCare Sign-Ups Hit 4.2M	http://www.newser.com/story/183611/obamacare-sign-ups-hit-42m.html	Newser	m	dlj-alsMdBxXIIMI7z4Fzu_nN18SM	www.newser.com	1394625873371
8110	Nationally, steady health care sign-ups may miss goal	http://www.providencejournal.com/news/health/20140311-nationally-steady-health-care-sign-ups-may-miss-goal1.ece	The Providence Journal	m	dlj-alsMdBxXIIMI7z4Fzu_nN18SM	www.providencejournal.com	1394625873598
8111	Health care sign-ups steady nationally but may miss goal	http://www.jconline.com/viewart/20140311/NEWS11/303110012/Health-care-sign-ups-steady-nationally-may-miss-goal	Journal and Courier	m	dlj-alsMdBxXIIMI7z4Fzu_nN18SM	www.jconline.com	1394625873835
8112	Illinois health insurance signups lag behind goals	http://www.sj-r.com/article/20140311/LIFESTYLE/140319837/10298/LIFESTYLE	The State Journal-Register	m	dlj-alsMdBxXIIMI7z4Fzu_nN18SM	www.sj-r.com	1394625874093
8113	Justice Dept.: At Least 35% Of People Eligible For Obamacare's Medicaid  ...	http://www.forbes.com/sites/theapothecary/2014/03/11/justice-dept-at-least-35-of-people-eligible-for-obamacares-medicaid-expansion-are-ex-convicts/	Forbes	m	dLdvF08pDNu8UJM8JZQxj4SNRyr3M	www.forbes.com	1394625933656
8114	Hey, We've Got Hostages	http://www.dailyprogress.com/newsvirginian/opinion/guest_columnists/hey-we-ve-got-hostages/article_ddab8b52-a98c-11e3-b9cd-0017a43b2370.html	The Daily Progress	m	dLdvF08pDNu8UJM8JZQxj4SNRyr3M	www.dailyprogress.com	1394625933838
8115	A doctor's response to the healthcare issues	http://www.dailyprogress.com/starexponent/opinion/columnists/a-doctor-s-response-to-the-healthcare-issues/article_b055111a-a9d1-11e3-8bb0-0017a43b2370.html	The Daily Progress	m	dLdvF08pDNu8UJM8JZQxj4SNRyr3M	www.dailyprogress.com	1394625934039
8116	Bill Nemitz: Senator's health-care suggestion may hurt those who listen	http://www.kjonline.com/politics/Bill_Nemitz__Senator_s_suggestion_could_come_back_to_bite_Affordable_Care_Act_applicants_.html	Kennebec Journal	m	dLdvF08pDNu8UJM8JZQxj4SNRyr3M	www.kjonline.com	1394625934232
8117	In battle to avoid Medicaid expansion, Maine Republicans embrace health care  ...	http://www.greenfieldreporter.com/view/story/69251f6ff0b24657a7609b939bedeb21/ME-XGR-Medicaid-Expansion	Greenfield Daily Reporter	m	dLdvF08pDNu8UJM8JZQxj4SNRyr3M	www.greenfieldreporter.com	1394625934417
8118	Wash. Medicaid enrollment surpasses reform goals	http://www.theolympian.com/2014/03/11/3028202/wash-medicaid-enrollment-surpasses.html	The Olympian	m	dLdvF08pDNu8UJM8JZQxj4SNRyr3M	www.theolympian.com	1394625934617
8119	In Medicaid fight, GOP embraces ACA exchange in Maine	http://www.seacoastonline.com/articles/20140312-NEWS-403120355	Seacoastonline.com	m	dLdvF08pDNu8UJM8JZQxj4SNRyr3M	www.seacoastonline.com	1394625934854
8120	NH health plan sign-ups surpass targets	http://www.seacoastonline.com/articles/20140312-NEWS-403120354	Seacoastonline.com	m	dLdvF08pDNu8UJM8JZQxj4SNRyr3M	www.seacoastonline.com	1394625935029
8121	Five strong voices	http://fortmyers.floridaweekly.com/news/2014-03-12/Top_News/Five_strong_voices.html	Florida Weekly	m	dLdvF08pDNu8UJM8JZQxj4SNRyr3M	fortmyers.floridaweekly.com	1394625935232
8122	Medicaid expansion	http://fortmyers.floridaweekly.com/news/2014-03-12/Top_News/Medicaid_expansion.html	Florida Weekly	m	dLdvF08pDNu8UJM8JZQxj4SNRyr3M	fortmyers.floridaweekly.com	1394625935383
8123	Republicans offer option to growing MaineCare	http://www.pressherald.com/news/Republicans_offer_option_to_growing_MaineCare.html	Press Herald	m	dLdvF08pDNu8UJM8JZQxj4SNRyr3M	www.pressherald.com	1394625935584
8124	In reversal, Maine GOP embraces part of health law	http://tbo.com/health/in-reversal-maine-gop-embraces-part-of-health-law-ap_health69251f6ff0b24657a7609b939bedeb21	Tbo.com	m	dLdvF08pDNu8UJM8JZQxj4SNRyr3M	tbo.com	1394625935870
8125	We should teach children to value lives of all people	http://www.onlinesentinel.com/opinion/letters/We_should_teach_children_to_value_lives_of_all_people.html	Morning Sentinel	m	dLdvF08pDNu8UJM8JZQxj4SNRyr3M	www.onlinesentinel.com	1394625936056
8126	More dependency or opportunity: What's at stake in Maine's Medicaid expansion  ...	http://bangordailynews.com/2014/03/11/opinion/more-dependency-or-opportunity-whats-at-stake-in-maines-medicaid-expansion-debate/\?ref=OpinionBox	Bangor Daily News	m	dLdvF08pDNu8UJM8JZQxj4SNRyr3M	bangordailynews.com	1394625936214
8127	'Some progress' made on Medicaid expansion, governor says	http://www.wkrn.com/story/24948556/some-progress-made-on-medicaid-expansion-says-governor	WKRN	m	dLdvF08pDNu8UJM8JZQxj4SNRyr3M	www.wkrn.com	1394625936391
8128	Washington Medicaid enrollment since expansion surpasses health reform goals	http://www.therepublic.com/w/WA--Health-Overhaul-Medicaid	The Republic	m	dLdvF08pDNu8UJM8JZQxj4SNRyr3M	www.therepublic.com	1394625936560
8129	The cost of Kansas' Medicaid expansion	http://www.kansascity.com/2014/03/11/4882286/steve-anderson-counting-the-cost.html	Kansas City Star	m	dLdvF08pDNu8UJM8JZQxj4SNRyr3M	www.kansascity.com	1394625937052
8130	Maine beats Affordable Care Act enrollment target	http://insurancenewsnet.com/oarticle/2014/03/11/maine-beats-affordable-care-act-enrollment-target-a-472665.html	Insurance News Net \(press release\)	m	dLdvF08pDNu8UJM8JZQxj4SNRyr3M	insurancenewsnet.com	1394625937297
8131	Op-ed: Flexible, Utah-specific solution best for Medicaid	http://www.sltrib.com/sltrib/opinion/57665462-82/health-utah-care-solution.html.csp	Salt Lake Tribune	m	dLdvF08pDNu8UJM8JZQxj4SNRyr3M	www.sltrib.com	1394625937682
8132	Thanks to Obamacare, there are many ways to get health coverage	http://www.kansascity.com/2014/03/11/4882104/many-ways-to-get-health-coverage.html	Kansas City Star	m	dLdvF08pDNu8UJM8JZQxj4SNRyr3M	www.kansascity.com	1394625937909
8133	Reform Update: Health advocates seek clarity on how ACA affects pregnant  ...	http://www.modernhealthcare.com/article/20140311/NEWS/303119970/reform-update-health-advocates-seek-clarity-on-how-aca-affects	ModernHealthcare.com	m	dLdvF08pDNu8UJM8JZQxj4SNRyr3M	www.modernhealthcare.com	1394625938110
8134	More than 25000 Mainers picked ACA exchange plans	http://www.seacoastonline.com/articles/20140311-NEWS-140319927	Seacoastonline.com	m	dLdvF08pDNu8UJM8JZQxj4SNRyr3M	www.seacoastonline.com	1394625938337
8135	Uninsured Floridians put pressure on lawmakers over Medicaid expansion	http://www.baynews9.com/content/news/baynews9/news/article.html/content/news/articles/bn9/2014/3/11/uninsured_floridians.html	Bay News 9	m	dLdvF08pDNu8UJM8JZQxj4SNRyr3M	www.baynews9.com	1394625938530
8136	More than 25000 Mainers have picked plans on ACA exchange, surpassing  ...	http://www.tribtown.com/view/story/30649e786e284a59b39d60e6feba63fe/ME--Health-Overhaul-Maine	The Tribune	m	dLdvF08pDNu8UJM8JZQxj4SNRyr3M	www.tribtown.com	1394625938699
8137	In Medicaid fight, Maine GOP Embrace ACA Exchange	http://560wgan.com/news/074470-in-medicaid-fight-maine-gop-embrace-aca-exchange/	WGAN News	m	dLdvF08pDNu8UJM8JZQxj4SNRyr3M	560wgan.com	1394625938950
8138	In Medicaid expansion battle, Maine Republicans embracing health care  ...	http://www.tribtown.com/view/story/69251f6ff0b24657a7609b939bedeb21/ME-XGR--Medicaid-Expansion	The Tribune	m	dLdvF08pDNu8UJM8JZQxj4SNRyr3M	www.tribtown.com	1394625939134
8139	GOP Questions Medicaid Enrollment Estimates	http://www.healthitoutcomes.com/doc/gop-questions-medicaid-enrollment-estimates-0001	Health IT Outcomes \(press release\)	m	dLdvF08pDNu8UJM8JZQxj4SNRyr3M	www.healthitoutcomes.com	1394625939310
8140	Will Obamacare Sink Dems? - Health Care Edge: Brought to you by Coalition for  ...	http://www.nationaljournal.com/health-care-edge/will-obamacare-sink-dems-health-care-edge-brought-to-you-by-coalition-for-medicare-choices-20140311	National Journal	m	dLdvF08pDNu8UJM8JZQxj4SNRyr3M	www.nationaljournal.com	1394625939496
8141	Legal Concerns Raised Over Making Medicaid Recipients Work In Missouri	http://host.madison.com/special-section/health-fitness/legal-concerns-raised-over-making-medicaid-recipients-work-in-missouri/article_1a18b7e3-8200-5519-ba50-61b0ad79e43c.html	Madison.com	m	dLdvF08pDNu8UJM8JZQxj4SNRyr3M	host.madison.com	1394625939957
8142	Medicaid Expansion: Health Care For Poor Floridians	http://www.theledger.com/article/20140311/EDIT01/140319917/1021/LIFE\?Title=Medicaid-Expansion-Health-Care-For-Poor-Floridians	The Ledger	m	dLdvF08pDNu8UJM8JZQxj4SNRyr3M	www.theledger.com	1394625940158
8143	Maine to consider Medicaid expansion again	http://www.seacoastonline.com/apps/pbcs.dll/article\?AID=/20140310/NEWS/140319991/-1/NEWSMAP	Seacoastonline.com	m	dLdvF08pDNu8UJM8JZQxj4SNRyr3M	www.seacoastonline.com	1394625940350
8144	Health care reform and the 60 day repayment rule	http://idahobusinessreview.com/2014/03/10/health-care-reform-and-the-60-day-repayment-rule/	Idaho Business Review	m	dLdvF08pDNu8UJM8JZQxj4SNRyr3M	idahobusinessreview.com	1394625940536
8145	Maine Legislature to Consider Medicaid Expansion Again	http://www.mpbn.net/Home/tabid/36/ctl/ViewItem/mid/5347/ItemId/32621/Default.aspx	MPBN News	m	dLdvF08pDNu8UJM8JZQxj4SNRyr3M	www.mpbn.net	1394625940696
8146	Possible Medicaid Expansion Vote This Week	http://wabi.tv/2014/03/10/possible-medicaid-expansion-vote-week/	WABI	m	dLdvF08pDNu8UJM8JZQxj4SNRyr3M	wabi.tv	1394625940923
8147	State House Notebook: As Medicaid vote looms, speculation shifts to campaign  ...	http://www.pressherald.com/news/State_House_Notebook__As_Medicaid_vote_looms__speculation_shifts_to_campaign_advantage_.html	Press Herald	m	dLdvF08pDNu8UJM8JZQxj4SNRyr3M	www.pressherald.com	1394625941091
8148	Koster Calls On Democrats To Fight For Medicaid Expansion, Blasts GOP's  ...	http://news.stlpublicradio.org/post/koster-calls-democrats-fight-medicaid-expansion-blasts-gops-angry-stubbornness	St. Louis Public Radio	m	dLdvF08pDNu8UJM8JZQxj4SNRyr3M	news.stlpublicradio.org	1394625941435
8149	In Hannibal, Koster critical of GOP opposition to Medicaid expansion	http://politicmo.com/2014/03/08/in-hannibal-koster-critical-of-gop-opposition-to-medicaid-expansion/	PoliticMo	m	dLdvF08pDNu8UJM8JZQxj4SNRyr3M	politicmo.com	1394625941619
8150	Stem Cell Shakedown Cruise	http://pipeline.corante.com/archives/2014/03/12/stem_cell_shakedown_cruise.php	Corante	m	d9bc8RAo3Q2yAKM7_UciU5-WfbkdM	pipeline.corante.com	1394626004665
8151	STAP stem cell study questioned and criticized	http://www.thealmagest.com/stap-stem-cell-study-questioned-and-criticized/11014	The Almagest	m	d9bc8RAo3Q2yAKM7_UciU5-WfbkdM	www.thealmagest.com	1394626004838
8152	Doubts raised about STAP cell scientist's doctoral dissertation	http://ajw.asahi.com/article/behind_news/social_affairs/AJ201403120055	Asahi Shimbun	m	d9bc8RAo3Q2yAKM7_UciU5-WfbkdM	ajw.asahi.com	1394626005006
8153	Skepticism grows over STAP cell reports in scientific circles	http://ajw.asahi.com/article/behind_news/AJ201403120033	Asahi Shimbun	m	d9bc8RAo3Q2yAKM7_UciU5-WfbkdM	ajw.asahi.com	1394626005147
8154	Five Allegations Against Riken Stem-Cell Researcher in Japan	http://blogs.wsj.com/japanrealtime/2014/03/12/five-allegations-against-riken-stem-cell-researcher-in-japan/	Wall Street Journal \(blog\)	m	d9bc8RAo3Q2yAKM7_UciU5-WfbkdM	blogs.wsj.com	1394626005324
8155	Japan lab weighing retraction of stem cell paper	http://seattletimes.com/html/nationworld/2023099396_apxjapanstemcells.html	The Seattle Times	m	d9bc8RAo3Q2yAKM7_UciU5-WfbkdM	seattletimes.com	1394626005553
8156	Japanese laboratory may retract research paper about turning ordinary cells into  ...	http://www.newser.com/article/3ccc5d0a812546bea758b54439c94680/japanese-laboratory-may-retract-research-paper-about-turning-ordinary-cells-into-stem-cells.html	Newser	m	d9bc8RAo3Q2yAKM7_UciU5-WfbkdM	www.newser.com	1394626005797
8157	Japanese government asks lab to look into STAP call study error	http://japandailypress.com/japanese-government-asks-lab-to-look-into-stap-call-study-error-1245638/	The Japan Daily Press	m	d9bc8RAo3Q2yAKM7_UciU5-WfbkdM	japandailypress.com	1394626006012
8158	Prof. wants STAP findings withdrawn	http://the-japan-news.com/news/article/0001109178	The Japan News	m	d9bc8RAo3Q2yAKM7_UciU5-WfbkdM	the-japan-news.com	1394626006164
8159	Japanese scientist calls for own ground-breaking stem cell study to be retracted	http://rt.com/news/stem-cell-study-retraction-070/	RT	m	d9bc8RAo3Q2yAKM7_UciU5-WfbkdM	rt.com	1394626006357
8160	Unanswered questions	http://www.omantribune.com/index.php\?page=leisure_details&amp;id=11387&amp;heading=Special%20Features%20in%20Details	Oman Tribune	m	d9bc8RAo3Q2yAKM7_UciU5-WfbkdM	www.omantribune.com	1394626006552
8161	Scientist who created STAP stem cells says studies should be withdrawn	http://www.latimes.com/science/sciencenow/la-sci-sn-stap-stem-cell-study-nature-controversy-wakayama-20140311,0,4688880.story	Los Angeles Times	m	d9bc8RAo3Q2yAKM7_UciU5-WfbkdM	www.latimes.com	1394626006821
8162	Japan stem cell scientist calls for retraction of study	http://thepeninsulaqatar.com/news/asia/275752/japan-stem-cell-scientist-calls-for-retraction-of-study	Peninsula On-line	m	d9bc8RAo3Q2yAKM7_UciU5-WfbkdM	thepeninsulaqatar.com	1394626007023
8163	'Breakthrough' stem cell research may have been erroneous	http://www.todayonline.com/daily-focus/health/breakthrough-stem-cell-research-may-have-been-erroneous	TODAYonline	m	d9bc8RAo3Q2yAKM7_UciU5-WfbkdM	www.todayonline.com	1394626007206
8164	Co-author of stem-cell study 'loses faith' in paper	http://io9.com/co-author-of-stem-cell-study-loses-faith-in-paper-1541329779	io9	m	d9bc8RAo3Q2yAKM7_UciU5-WfbkdM	io9.com	1394626007660
8165	Japan Lab Mulls Retraction of Stem Cell Paper	http://www.kolotv.com/news/healthbytes/headlines/Japan-Lab-Mulls-Retraction-of-Stem-Cell-Paper-249564521.html	KOLO	m	d9bc8RAo3Q2yAKM7_UciU5-WfbkdM	www.kolotv.com	1394626007869
8166	Japan stem cell scientist calls for study retraction	http://www.chinapost.com.tw/asia/japan/2014/03/12/402625/Japan-stem.htm	China Post	m	d9bc8RAo3Q2yAKM7_UciU5-WfbkdM	www.chinapost.com.tw	1394626008063
8167	The challenges of reporting on academic papers	http://www.rte.ie/blogs/business/2014/03/11/the-challenges-of-reporting-on-academic-papers/	RTE.ie \(blog\)	m	d9bc8RAo3Q2yAKM7_UciU5-WfbkdM	www.rte.ie	1394626008248
8168	Riken considers retracting two stem-cell studies	http://www.chicagotribune.com/news/sns-wp-blm-news-bc-japan-stemcells-bg11-20140311,0,2542080.story	Chicago Tribune	m	d9bc8RAo3Q2yAKM7_UciU5-WfbkdM	www.chicagotribune.com	1394626008441
8169	Harvard set to investigate stemcell studies	http://www.chicagotribune.com/news/sns-wp-yomiuri--bc-japan-stemcells11-20140311,0,1431449.story	Chicago Tribune	m	d9bc8RAo3Q2yAKM7_UciU5-WfbkdM	www.chicagotribune.com	1394626008641
8170	Stem cell scientist calls for retraction of study	http://www.digitaljournal.com/life/health/stem-cell-scientist-calls-for-retraction-of-study/article/375637	DigitalJournal.com	m	d9bc8RAo3Q2yAKM7_UciU5-WfbkdM	www.digitaljournal.com	1394626008878
8171	Japan's Riken Research Center Considers Options to Retract Two Stem-Cell  ...	http://newstonight.co.za/content/japan-s-riken-research-center-considers-options-retract-two-stem-cell-studies	News Tonight Africa	m	d9bc8RAo3Q2yAKM7_UciU5-WfbkdM	newstonight.co.za	1394626009095
8172	Stem Cell Researcher Calls for Retraction of His Own Work	http://time.com/20082/stem-cell-researcher-calls-for-retraction-of-his-own-work/	TIME	m	d9bc8RAo3Q2yAKM7_UciU5-WfbkdM	time.com	1394626009255
8173	Riken may call on researchers to retract stem cell study	http://www.globalpost.com/dispatch/news/kyodo-news-international/140311/riken-may-call-researchers-retract-stem-cell-study	GlobalPost	m	d9bc8RAo3Q2yAKM7_UciU5-WfbkdM	www.globalpost.com	1394626009450
8174	Lab Weighs Retraction of Stem Cell Paper	http://www.laboratoryequipment.com/news/2014/03/lab-weighs-retraction-stem-cell-paper	Laboratory Equipment	m	d9bc8RAo3Q2yAKM7_UciU5-WfbkdM	www.laboratoryequipment.com	1394626009852
8175	Japanese scientist withdraws 'groundbreaking' stem cell research	http://truthdive.com/2014/03/11/Japanese-scientist-withdraws-groundbreaking-stem-cell-research.html	TruthDive	m	d9bc8RAo3Q2yAKM7_UciU5-WfbkdM	truthdive.com	1394626010043
8176	Japanese scientist calls for his stem cell 'breakthrough' to be withdrawn	http://www.scmp.com/news/asia/article/1446630/japanese-scientist-calls-his-stem-cell-breakthrough-be-withdrawn	South China Morning Post	m	d9bc8RAo3Q2yAKM7_UciU5-WfbkdM	www.scmp.com	1394626010337
8177	Laboratory in Japan weighs retraction of stem cell paper	http://www.rdmag.com/news/2014/03/laboratory-japan-weighs-retraction-stem-cell-paper	R \& D Magazine	m	d9bc8RAo3Q2yAKM7_UciU5-WfbkdM	www.rdmag.com	1394626010523
8178	Japanese lab considers retracting paper about turning ordinary cells into stem  ...	http://www.theglobeandmail.com/life/health-and-fitness/health/japanese-lab-considers-retracting-paper-about-turning-ordinary-cells-into-stem-cells/article17423359/	The Globe and Mail	m	d9bc8RAo3Q2yAKM7_UciU5-WfbkdM	www.theglobeandmail.com	1394626010707
8179	Acid-Induced Stem Cell Paper Questioned by Author	http://www.bio-itworld.com/els/2014/3/11/acid-induced-stem-cell-paper-questioned-by-author.html	Bio-IT World	m	d9bc8RAo3Q2yAKM7_UciU5-WfbkdM	www.bio-itworld.com	1394626010984
8180	Japanese scientist calls for stem cell studies to be withdrawn	http://www.boston.com/news/science/blogs/science-in-mind/2014/03/10/prominent-japanese-scientist-calls-for-controversial-stem-cell-studies-withdrawn/iM3Ea0tLbePnSZIEPUfl9K/blog.html	Boston.com \(blog\)	m	d9bc8RAo3Q2yAKM7_UciU5-WfbkdM	www.boston.com	1394626011168
8181	Japanese Institute Regroups After Studies Are Questioned	http://online.wsj.com/article/BT-CO-20140311-705009.html	Wall Street Journal	m	d9bc8RAo3Q2yAKM7_UciU5-WfbkdM	online.wsj.com	1394626011353
8182	Japaese lab may retract paper on new stem cell technique after doubts	http://www.ctvnews.ca/health/japaese-lab-may-retract-paper-on-new-stem-cell-technique-after-doubts-1.1723545	CTV News	m	d9bc8RAo3Q2yAKM7_UciU5-WfbkdM	www.ctvnews.ca	1394626011541
8183	RIKEN must unveil investigation results early	http://the-japan-news.com/news/article/0001109770	The Japan News	m	d9bc8RAo3Q2yAKM7_UciU5-WfbkdM	the-japan-news.com	1394626011801
8184	Harvard set to investigate STAP cell publications	http://the-japan-news.com/news/article/0001110054	The Japan News	m	d9bc8RAo3Q2yAKM7_UciU5-WfbkdM	the-japan-news.com	1394626011975
8185	Two Stem-Cell Studies Face Retraction on Researcher Doubt	http://www.businessweek.com/news/2014-03-11/riken-considers-retracting-two-stem-cell-studies-in-nature	Businessweek	m	d9bc8RAo3Q2yAKM7_UciU5-WfbkdM	www.businessweek.com	1394626012261
8186	Acid-bath stem cell creation method: hoax or hiatus?	http://www.phgfoundation.org/news/15693/	PHG Foundation	m	d9bc8RAo3Q2yAKM7_UciU5-WfbkdM	www.phgfoundation.org	1394626012446
8187	Japanese scientist withdraws own 'breakthrough research' on stem cell study	http://japandailypress.com/japanese-scientist-withdraws-own-breakthrough-research-on-stem-cell-study-1145609/	The Japan Daily Press	m	d9bc8RAo3Q2yAKM7_UciU5-WfbkdM	japandailypress.com	1394626012606
8188	Riken considers withdrawal of breakthrough STAP cell reports	http://ajw.asahi.com/article/behind_news/AJ201403110060	Asahi Shimbun	m	d9bc8RAo3Q2yAKM7_UciU5-WfbkdM	ajw.asahi.com	1394626012833
8189	Japanese stem cell scientist calls for retraction of study	http://www.channelnewsasia.com/news/health/japanese-stem-cell/1028550.html	Channel News Asia	m	d9bc8RAo3Q2yAKM7_UciU5-WfbkdM	www.channelnewsasia.com	1394626013018
8190	Japan scientist calls for study retraction	http://www.sbs.com.au/news/article/2014/03/11/japan-scientist-calls-study-retraction	SBS	m	d9bc8RAo3Q2yAKM7_UciU5-WfbkdM	www.sbs.com.au	1394626013311
8191	Japan stem cell scientist calls for retraction of study (Update)	http://phys.org/news/2014-03-stem-cell-scientist-retraction.html	Phys.Org	m	d9bc8RAo3Q2yAKM7_UciU5-WfbkdM	phys.org	1394626013496
8192	Japanese scientist withdraws `groundbreaking` stem cell research	http://freepressjournal.in/japanese-scientist-withdraws-groundbreaking-stem-cell-research/	Free Press Journal	m	d9bc8RAo3Q2yAKM7_UciU5-WfbkdM	freepressjournal.in	1394626013882
8193	Retract stem cell study - co-author	http://www.iol.co.za/scitech/science/news/retract-stem-cell-study-co-author-1.1659268	Independent Online	m	d9bc8RAo3Q2yAKM7_UciU5-WfbkdM	www.iol.co.za	1394626014025
8194	Shorts (right)	http://tech.mit.edu/V134/N11/shorts2.html	The MIT Tech	m	d9bc8RAo3Q2yAKM7_UciU5-WfbkdM	tech.mit.edu	1394626014201
8195	Stem cell scientist wants report pulled	http://www.bangkokpost.com/news/world/399312/stem-cell-scientist-calls-for-retraction-of-study	Bangkok Post	m	d9bc8RAo3Q2yAKM7_UciU5-WfbkdM	www.bangkokpost.com	1394626014344
8196	Japanese stem cell study tainted with dodgy data	http://www.thestandard.com.hk/breaking_news_detail.asp\?id=47225&amp;icid=a&amp;d_str=	Hong Kong Standard	m	d9bc8RAo3Q2yAKM7_UciU5-WfbkdM	www.thestandard.com.hk	1394626014513
8197	Japan gov't urges laboratory to probe STAP cell paper	http://www.globalpost.com/dispatch/news/kyodo-news-international/140311/japan-govt-urges-laboratory-probe-stap-cell-paper	GlobalPost	m	d9bc8RAo3Q2yAKM7_UciU5-WfbkdM	www.globalpost.com	1394626014721
8198	Japanese scientist urges withdrawal of own 'breakthrough' stem cell research	http://www.interaksyon.com/article/82452/japanese-scientist-urges-withdrawal-of-own-breakthrough-stem-cell-research	InterAksyon	m	d9bc8RAo3Q2yAKM7_UciU5-WfbkdM	www.interaksyon.com	1394626015143
8199	Stem cell researcher now doubts his 'breakthrough' study	http://www.nydailynews.com/life-style/health/stem-cell-researcher-doubts-breakthrough-study-article-1.1716889	New York Daily News	m	d9bc8RAo3Q2yAKM7_UciU5-WfbkdM	www.nydailynews.com	1394626015328
8200	Scientist Backtracks On Stem Cell 'Breakthrough'	http://www.huffingtonpost.com/2014/03/10/stem-cell-researcher-breakthrough-findings-withdrawn_n_4935460.html	Huffington Post	m	d9bc8RAo3Q2yAKM7_UciU5-WfbkdM	www.huffingtonpost.com	1394626015533
