402201	Microsoft to launch Xbox One in China on Sept. 23 for $599	http://venturebeat.com/2014/07/30/microsoft-to-launch-xbox-one-in-china-on-sept-23-for-599/\?utm_source=feedburner&amp;utm_medium=feed&amp;utm_campaign=Feed:Venturebeat(VentureBeat)	VentureBeat	t	dbiqwmupWq9ifvMVYDhySlUaxf2iM	venturebeat.com	1406786569546
402202	China Conducts Anti-Trust Investigation Against Microsoft	http://www.ntd.tv/en/programs/news-politics/china-forbidden-news/20140730/181073--china-conducts-antitrust-investigation-against-microsoft.html	New Tang Dynasty Television	t	dbiqwmupWq9ifvMVYDhySlUaxf2iM	www.ntd.tv	1406786569744
402203	Microsoft's China woes increase	http://www.foxnews.com/tech/2014/07/30/microsofts-china-woes-increase/	Fox News	t	dbiqwmupWq9ifvMVYDhySlUaxf2iM	www.foxnews.com	1406786570131
402204	Microsoft's Xbox One to launch in China on Sept. 23	http://www.timminspress.com/2014/07/30/microsofts-xbox-one-to-launch-in-china-on-sept-23	Timmins Press	t	dbiqwmupWq9ifvMVYDhySlUaxf2iM	www.timminspress.com	1406786570344
402205	Microsoft's Xbox One will launch in China for $599 on September 23	http://thenextweb.com/asia/2014/07/30/microsofts-xbox-one-will-launch-china-599-september-23/\?utm_source=social&amp;utm_medium=feed&amp;utm_campaign=profeed	The Next Web	t	dbiqwmupWq9ifvMVYDhySlUaxf2iM	thenextweb.com	1406786570611
402206	Xbox One to launch in China on 23rd September	http://www.eurogamer.net/articles/2014-07-30-xbox-one-to-launch-in-china-on-23rd-september	Eurogamer.net	t	dbiqwmupWq9ifvMVYDhySlUaxf2iM	www.eurogamer.net	1406786571101
402207	Microsoft in the dock following antitrust claims by Chinese government	http://www.techradar.com/news/software/operating-systems/microsoft-in-the-docks-after-antitrust-claims-by-chinese-government-1259606	TechRadar UK	t	dbiqwmupWq9ifvMVYDhySlUaxf2iM	www.techradar.com	1406786571710
402208	Xbox One China launch date and price confirmed	http://www.computerandvideogames.com/472766/xbox-one-china-launch-date-and-price-confirmed/	Computerandvideogames.com	t	dbiqwmupWq9ifvMVYDhySlUaxf2iM	www.computerandvideogames.com	1406786571964
402209	Xbox One Lands In China 23rd September	http://www.geeky-gadgets.com/xbox-one-lands-in-china-23rd-september-30-07-2014/	Geeky gadgets	t	dbiqwmupWq9ifvMVYDhySlUaxf2iM	www.geeky-gadgets.com	1406786572241
402210	Xbox One gets Chinese launch date and games	http://www.vg247.com/2014/07/30/xbox-one-gets-chinese-launch-date/	VG247	t	dbiqwmupWq9ifvMVYDhySlUaxf2iM	www.vg247.com	1406786572468
402211	Microsoft Under Scrutiny By The Chinese Government, Faces Antitrust Probe	http://www.industryleadersmagazine.com/microsoft-under-scrutiny-by-the-chinese-government-faces-antitrust-probe/	Industry Leaders Magazine	t	dbiqwmupWq9ifvMVYDhySlUaxf2iM	www.industryleadersmagazine.com	1406786573152
402212	Microsoft unveils Xbox One in China amid government probe over business  ...	http://www.straitstimes.com/digital-life/gaming/story/microsoft-unveils-xbox-china-amid-govt-probe-over-business-practices-20140	The Straits Times	t	dbiqwmupWq9ifvMVYDhySlUaxf2iM	www.straitstimes.com	1406786573409
402213	UPDATE 2-Microsoft Xbox One to launch in China on Sept. 23	http://www.reuters.com/article/2014/07/30/microsoft-china-xbox-idUSL4N0Q53OT20140730	Reuters	t	dbiqwmupWq9ifvMVYDhySlUaxf2iM	www.reuters.com	1406786573682
402214	China launches 'anti-monopoly probe' into Microsoft	http://www.business-standard.com/article/news-ani/china-launches-anti-monopoly-probe-into-microsoft-114073001033_1.html	Business Standard	t	dbiqwmupWq9ifvMVYDhySlUaxf2iM	www.business-standard.com	1406786574118
402215	Microsoft says complies with law in China amid probe	http://www.bgr.in/news/microsoft-says-complies-with-law-in-china-amidprobe/	BGR India	t	dbiqwmupWq9ifvMVYDhySlUaxf2iM	www.bgr.in	1406786574367
402216	Xbox One Arrives In China On September 23	http://www.gameinformer.com/b/news/archive/2014/07/30/6920789.aspx	Game Informer	t	dbiqwmupWq9ifvMVYDhySlUaxf2iM	www.gameinformer.com	1406786574603
402217	Xbox One Launches in China in Late-September	http://www.xboxachievements.com/news/news-18818-Xbox-One-Launches-in-China-in-Late-September.html	XboxAchievements	t	dbiqwmupWq9ifvMVYDhySlUaxf2iM	www.xboxachievements.com	1406786575066
402218	Xbox One will launch in China with two free games, free Xbox Gold till March 2015	http://www.totalxbox.com/79860/xbox-one-will-launch-in-china-with-two-free-games-free-xbox-gold-till-march-2015/	Total Xbox	t	dbiqwmupWq9ifvMVYDhySlUaxf2iM	www.totalxbox.com	1406786575293
402219	Microsoft Xbox One to launch in China Sept 23	http://www.businesstimes.com.sg/breaking-news/technology/microsoft-xbox-one-launch-china-sept-23-20140730	THE BUSINESS TIMES \(subscription\)	t	dbiqwmupWq9ifvMVYDhySlUaxf2iM	www.businesstimes.com.sg	1406786575541
402220	Microsoft to Launch Xbox One in China on September 23	http://profit.ndtv.com/news/corporates/article-microsoft-to-launch-xbox-one-in-china-on-september-23-596277	NDTV	t	dbiqwmupWq9ifvMVYDhySlUaxf2iM	profit.ndtv.com	1406786576110
402221	Microsoft Xbox One to be launched in China on September 23	http://ibnlive.in.com/news/microsoft-xbox-one-to-be-launched-in-china-on-september-23/489246-11.html	IBNLive	t	dbiqwmupWq9ifvMVYDhySlUaxf2iM	ibnlive.in.com	1406786576425
402222	Microsoft Xbox One to launch in China September 23	http://economictimes.indiatimes.com/tech/hardware/microsoft-xbox-one-to-launch-in-china-september-23/articleshow/39297858.cms	Economic Times	t	dbiqwmupWq9ifvMVYDhySlUaxf2iM	economictimes.indiatimes.com	1406786576646
402223	Microsoft Xbox One to Launch in China on 23 September	http://gadgets.ndtv.com/games/news/microsoft-xbox-one-to-launch-in-china-on-23-september-567854	NDTV	t	dbiqwmupWq9ifvMVYDhySlUaxf2iM	gadgets.ndtv.com	1406786577098
402224	Microsoft's Ties with Gov't on Rocks as Offices in Four Cities Raided	http://english.caixin.com/2014-07-30/100710968.html	Caixin Media	t	dbiqwmupWq9ifvMVYDhySlUaxf2iM	english.caixin.com	1406786577340
402225	Microsoft in the docks after antitrust claims by Chinese government	http://www.techradar.com/news/software/operating-systems/microsoft-in-the-docks-after-antitrust-claims-by-chinese-government-1259606\?src=rss&amp;attr=all	TechRadar UK	t	dbiqwmupWq9ifvMVYDhySlUaxf2iM	www.techradar.com	1406786578005
402226	Microsoft under monopoly investigation in China	http://www.bit-tech.net/news/bits/2014/07/30/ms-monopoly-china/1	bit-tech.net	t	dbiqwmupWq9ifvMVYDhySlUaxf2iM	www.bit-tech.net	1406786578208
402227	China in MONOPOLY PROBE into Microsoft: Do not pass GO, do not collect 200  ...	http://www.theregister.co.uk/2014/07/29/china_microsoft_monopoly_probe/	Register	t	dbiqwmupWq9ifvMVYDhySlUaxf2iM	www.theregister.co.uk	1406786578462
402228	Microsoft to comply with China amid probePublish Date: Jul 30, 2014	http://www.newvision.co.ug/news/658171-microsoft-to-comply-with-china-amid-probe.html	New Vision	t	dbiqwmupWq9ifvMVYDhySlUaxf2iM	www.newvision.co.ug	1406786578861
402229	Microsoft says it complies with law in China amid probe	http://gulftoday.ae/portal/5915bb6c-4a5d-471d-a7ad-8eaa0f4ca1a0.aspx	Gulf Today	t	dbiqwmupWq9ifvMVYDhySlUaxf2iM	gulftoday.ae	1406786579105
402230	MS anti-monopoly investigation confirmed	http://www.itweb.co.za/index.php\?option=com_content&amp;view=article&amp;id=136531:MS-anti-monopoly-investigation-confirmed&amp;catid=86	ITWeb	t	dbiqwmupWq9ifvMVYDhySlUaxf2iM	www.itweb.co.za	1406786579438
402231	Microsoft anti-monopoly probe in China confirmed	http://www.ecns.cn/2014/07-30/126967.shtml	ecns	t	dbiqwmupWq9ifvMVYDhySlUaxf2iM	www.ecns.cn	1406786579918
402232	Microsoft: Our business practices comply with law in China	http://www.thehindubusinessline.com/news/international/microsoft-our-business-practices-comply-with-law-in-china/article6263736.ece	Hindu Business Line	t	dbiqwmupWq9ifvMVYDhySlUaxf2iM	www.thehindubusinessline.com	1406786580145
402233	China officially opens Microsoft anti-monopoly probe	http://www.itnews.com.au/News/390485,china-officially-opens-microsoft-anti-monopoly-probe.aspx	iT News	t	dbiqwmupWq9ifvMVYDhySlUaxf2iM	www.itnews.com.au	1406786580418
402234	Microsoft Says Complies With Law in China Amidst Probe	http://gadgets.ndtv.com/others/news/microsoft-says-complies-with-law-in-china-amidst-probe-567708	NDTV	t	dbiqwmupWq9ifvMVYDhySlUaxf2iM	gadgets.ndtv.com	1406786580861
402235	Microsoft says it complies with Chinese law amid probe	http://www.channelnewsasia.com/news/business/international/microsoft-says-it/1288930.html	Channel News Asia	t	dbiqwmupWq9ifvMVYDhySlUaxf2iM	www.channelnewsasia.com	1406786581103
402236	In China, suspicion falls on Microsoft	http://www.journalgazette.net/article/20140730/BIZ/307309991/1031	Fort Wayne Journal Gazette	t	dbiqwmupWq9ifvMVYDhySlUaxf2iM	www.journalgazette.net	1406786581352
402237	China Probes Microsoft	http://www.bernama.com.my/bernama/v7/bu/newsbusiness.php\?id=1056989	Bernama	t	dbiqwmupWq9ifvMVYDhySlUaxf2iM	www.bernama.com.my	1406786581608
402238	King & Wood Mallesons acts for Microsoft on China anti-monopoly probe	http://www.legalweek.com/legal-week/news/2357830/king-wood-mallesons-acts-for-microsoft-on-china-anti-monopoly-probe	Legal Week	t	dbiqwmupWq9ifvMVYDhySlUaxf2iM	www.legalweek.com	1406786581977
402239	China accuses Microsoft of failing to disclose information	http://www.iol.co.za/business/international/china-accuses-microsoft-of-failing-to-disclose-information-1.1727617	Independent Online	t	dbiqwmupWq9ifvMVYDhySlUaxf2iM	www.iol.co.za	1406786582507
402240	China confirms Microsoft probe for 'monopoly' actions	http://www.globalpost.com/dispatch/news/afp/140730/china-confirms-microsoft-probe-monopoly-actions	GlobalPost	t	dbiqwmupWq9ifvMVYDhySlUaxf2iM	www.globalpost.com	1406786582789
402241	Chinese Government Raids Microsoft Offices in Four Cities	http://blogs.wsj.com/chinarealtime/2014/07/30/chinese-government-raids-microsoft-offices-in-four-cities/	Wall Street Journal \(blog\)	t	dbiqwmupWq9ifvMVYDhySlUaxf2iM	blogs.wsj.com	1406786583687
402242	Xbox One missing features will come to Australia, eventually	http://www.theage.com.au/digital-life/games/xbox-one-missing-features-will-come-to-australia-eventually-20140730-zyieu.html	The Age	t	dbiqwmupWq9ifvMVYDhySlUaxf2iM	www.theage.com.au	1406786583902
402243	China regulator announces anti-monopoly probe of Microsoft	http://www.themalaymailonline.com/money/article/china-regulator-announces-anti-monopoly-probe-of-microsoft	The Malay Mail Online	t	dbiqwmupWq9ifvMVYDhySlUaxf2iM	www.themalaymailonline.com	1406786584148
402244	Chinese regulators swarm Microsoft offices over antitrust concerns: Another  ...	http://www.techtimes.com/articles/11479/20140729/chinese-regulators-swarm-microsoft-offices-over-antitrust-concerns-another-move-to-erode-u-s-tech-firms-influence-in-china.htm	Tech Times	t	dbiqwmupWq9ifvMVYDhySlUaxf2iM	www.techtimes.com	1406786584393
402245	China may start Microsoft monopoly probe	http://english.cntv.cn/2014/07/29/VIDE1406623564147850.shtml	CCTV	t	dbiqwmupWq9ifvMVYDhySlUaxf2iM	english.cntv.cn	1406786584785
402246	Microsoft offices raided by Chinese authorities	http://www.independent.ie/business/world/microsoft-offices-raided-by-chinese-authorities-30468766.html	Irish Independent	t	dbiqwmupWq9ifvMVYDhySlUaxf2iM	www.independent.ie	1406786585020
402247	How China became Microsoft's latest headache	http://www.afr.com/p/technology/how_china_became_microsoft_latest_T7eSPrYBz5IkvYn2z0pIuK	The Australian Financial Review	t	dbiqwmupWq9ifvMVYDhySlUaxf2iM	www.afr.com	1406786585835
402248	China investigating Microsoft for monopoly	http://www.columbian.com/news/2014/jul/29/china-investigating-microsoft-for-monopoly/	The Columbian	t	dbiqwmupWq9ifvMVYDhySlUaxf2iM	www.columbian.com	1406786586065
402249	Chinese Government Investigates Microsoft For Anti-Monopoly Activities	http://www.ubergizmo.com/2014/07/chinese-government-investigates-microsoft-for-anti-monopoly-activities/	Ubergizmo	t	dbiqwmupWq9ifvMVYDhySlUaxf2iM	www.ubergizmo.com	1406786586321
402250	Microsoft faces anti-monopoly probe in China	http://www.ecns.cn/business/2014/07-30/126789.shtml	ecns	t	dbiqwmupWq9ifvMVYDhySlUaxf2iM	www.ecns.cn	1406786586544
402251	Chinese Antitrust Watchdog Raids Microsoft Offices	http://www.law360.com/technology/articles/561905/chinese-antitrust-watchdog-raids-microsoft-offices	Law360 \(subscription\)	t	dbiqwmupWq9ifvMVYDhySlUaxf2iM	www.law360.com	1406786587027
402252	073014-dec-biz-briefs	http://herald-review.com/print-specific/herald-review/briefs/dec-biz-briefs/article_4a199907-31e5-506a-a582-8e3e0d268dc3.html	Herald \& Review	t	dbiqwmupWq9ifvMVYDhySlUaxf2iM	herald-review.com	1406786587230
402253	China Trumps Up Anti-Monopoly Charges Against Microsoft	http://www.ecommercetimes.com/story/80808.html	E-Commerce Times	t	dbiqwmupWq9ifvMVYDhySlUaxf2iM	www.ecommercetimes.com	1406786587461
402254	Why the Chinese Government Raided Microsoft Offices	http://www.bloomberg.com/video/why-the-chinese-government-raided-microsoft-offices-E73_tzLPT6qCc~l5lHrIDA.html	Bloomberg	t	dbiqwmupWq9ifvMVYDhySlUaxf2iM	www.bloomberg.com	1406786587760
402255	China regulator probing Microsoft	http://www.moneyweb.co.za/moneyweb-international/china-regulator-probing-microsoft	Moneyweb.co.za	t	dbiqwmupWq9ifvMVYDhySlUaxf2iM	www.moneyweb.co.za	1406786587984
402256	Microsoft faces anti-monopoly probe in China over Windows, Office	http://www.pcworld.com/article/2459160/microsoft-faces-antimonopoly-probe-in-china-over-windows-office.html	PCWorld	t	dbiqwmupWq9ifvMVYDhySlUaxf2iM	www.pcworld.com	1406786588298
402257	Xbox One preorders begin in China under Tencent's banner	http://venturebeat.com/2014/07/29/tencent-will-microsoft-presell-xbox-ones-in-china/	VentureBeat	t	dbiqwmupWq9ifvMVYDhySlUaxf2iM	venturebeat.com	1406786588565
402258	Chinese officials seize Microsoft PCs, emails, financial info in antitrust probe	http://www.cfoworld.com/technology/92025/chinese-officials-seize-microsoft-pcs-emails-financial-info-antitrust-probe	CFOworld	t	dbiqwmupWq9ifvMVYDhySlUaxf2iM	www.cfoworld.com	1406786588912
402259	Microsoft Anti-Monopoly Investigation Opened by Chinese Regulators	http://www.autoworldnews.com/articles/8406/20140729/microsoft-anti-monopoly-investigation-opened-by-chinese-regulators.htm	Auto World News	t	dbiqwmupWq9ifvMVYDhySlUaxf2iM	www.autoworldnews.com	1406786589164
402260	China probes Microsoft monopoly	http://thepeninsulaqatar.com/business/international-business/293546/china-probes-microsoft-monopoly	Peninsula On-line	t	dbiqwmupWq9ifvMVYDhySlUaxf2iM	thepeninsulaqatar.com	1406786589381
402261	Xbox One vs PS4: How Microsoft's Console is Getting Better and Better Than  ...	https://uk.news.yahoo.com/xbox-one-vs-ps4-microsofts-console-getting-better-093502212.html	Yahoo News UK	t	dbiqwmupWq9ifvMVYDhySlUaxf2iM	uk.news.yahoo.com	1406786589726
402262	China probes Microsoft's 'monopoly' actions	http://www.businesstimes.com.sg/premium/top-stories/china-probes-microsofts-monopoly-actions-20140730	THE BUSINESS TIMES \(subscription\)	t	dbiqwmupWq9ifvMVYDhySlUaxf2iM	www.businesstimes.com.sg	1406786589954
402263	Possible Chinese antitrust investigation targets Microsoft	http://www.technologytell.com/gadgets/148897/possible-chinese-antitrust-investigation-targets-microsoft/	TechnologyTell	t	dbiqwmupWq9ifvMVYDhySlUaxf2iM	www.technologytell.com	1406786590193
402264	Microsoft hit by monopoly probe	http://www.thestandard.com.hk/news_detail.asp\?we_cat=3&amp;art_id=147834&amp;sid=42708717&amp;con_type=1&amp;d_str=20140730&amp;fc=2	Hong Kong Standard	t	dbiqwmupWq9ifvMVYDhySlUaxf2iM	www.thestandard.com.hk	1406786590485
402265	China investigates Microsoft for monopoly in growing tech regulation	http://www.contracostatimes.com/news/ci_26236984/china-investigates-microsoft-monopoly-growing-tech-regulation	Contra Costa Times	t	dbiqwmupWq9ifvMVYDhySlUaxf2iM	www.contracostatimes.com	1406786590808
402266	Microsoft Office Raided by China Officials	http://www.theepochtimes.com/n3/823198-microsoft-office-raided-by-china-officials/	The Epoch Times	t	dbiqwmupWq9ifvMVYDhySlUaxf2iM	www.theepochtimes.com	1406786591053
402267	Microsoft Aspirations in China Meets Perilous Climate	http://www.businessweek.com/news/2014-07-29/microsoft-latest-company-finding-china-climate-arduous	Businessweek	t	dbiqwmupWq9ifvMVYDhySlUaxf2iM	www.businessweek.com	1406786591376
402268	With Microsoft in sights, China starts to squeeze US tech firms	http://www.business-standard.com/article/international/with-microsoft-in-sights-china-starts-to-squeeze-us-tech-firms-114073000213_1.html	Business Standard	t	dbiqwmupWq9ifvMVYDhySlUaxf2iM	www.business-standard.com	1406786591814
402269	Microsoft Aspirations in China Meet Perilous Climate	http://www.bloomberg.com/news/2014-07-29/microsoft-latest-company-finding-china-climate-arduous.html	Bloomberg	t	dbiqwmupWq9ifvMVYDhySlUaxf2iM	www.bloomberg.com	1406786592031
402270	Microsoft Faces a New Anti-Trust Probe, in China This Time	http://www.hawaiireporter.com/microsoft-faces-a-new-anti-trust-probe-in-china-this-time/123	Hawaii Reporter	t	dbiqwmupWq9ifvMVYDhySlUaxf2iM	www.hawaiireporter.com	1406786592243
402271	Microsoft under China anti-monopoly probe	http://www.financialexpress.com/news/Microsoft-under-China-anti-monopoly-probe/1274979	Financial Express	t	dbiqwmupWq9ifvMVYDhySlUaxf2iM	www.financialexpress.com	1406786592581
402272	Microsoft Offices In China Raided In Antitrust Investigation	http://www.fastcompany.com/3033707/fast-feed/microsoft-offices-in-china-raided-in-antitrust-investigation	Fast Company	t	dbiqwmupWq9ifvMVYDhySlUaxf2iM	www.fastcompany.com	1406786593433
402273	China Confirms Targeting Microsoft for Anti-Trust Scrutiny - Reports	http://en.ria.ru/business/20140729/191451326/China-Confirms-Targeting-Microsoft-for-Anti-Trust-Scrutiny--.html	RIA Novosti	t	dbiqwmupWq9ifvMVYDhySlUaxf2iM	en.ria.ru	1406786593660
402274	Xbox One Pre-Orders Now Available In China	http://www.cinemablend.com/games/Xbox-One-Pre-Orders-Now-Available-China-66490.html	Cinema Blend	t	dbiqwmupWq9ifvMVYDhySlUaxf2iM	www.cinemablend.com	1406786593869
402275	China Opens Microsoft Anti-Monopoly Probe	http://mashable.com/2014/07/29/china-microsoft-anti-monopoly-probe/	Mashable	t	dbiqwmupWq9ifvMVYDhySlUaxf2iM	mashable.com	1406786594058
402276	Destiny Graphical Comparison: Xbox One/360 vs PS4/PS3	http://blog.games.com/2014/07/29/destiny-graphical-comparison-xbox-one-360-vs-ps4-ps3/	Games.com News \(blog\)	t	dbiqwmupWq9ifvMVYDhySlUaxf2iM	blog.games.com	1406786594287
402277	China to investigate Microsoft for 'monopolistic behavior'	http://wraltechwire.com/china-to-investigate-microsoft-for-monopolistic-behavior-/13849815/	WRAL Tech Wire	t	dbiqwmupWq9ifvMVYDhySlUaxf2iM	wraltechwire.com	1406786594898
402278	China opens anti-monopoly investigation into Microsoft over Windows, Office	http://www.winnipegfreepress.com/business/china-opens-anti-monopoly-investigation-into-microsoft-over-windows-office-269029321.html	Winnipeg Free Press	t	dbiqwmupWq9ifvMVYDhySlUaxf2iM	www.winnipegfreepress.com	1406786595165
402279	Microsoft's Chinese offices allegedly raided over antitrust allegations	http://www.cnet.com/news/microsofts-chinese-offices-were-raided-over-antitrust-allegations/	CNET	t	dbiqwmupWq9ifvMVYDhySlUaxf2iM	www.cnet.com	1406786595486
402280	China Stepping up Efforts to Regulate Foreign Devices	http://www.designntrend.com/articles/17337/20140729/china-stepping-up-efforts-to-regulate-foreign-devices.htm	Design \& Trend	t	dbiqwmupWq9ifvMVYDhySlUaxf2iM	www.designntrend.com	1406786595843
402281	China probes Microsoft for operating system monopoly	http://main.omanobserver.om/\?p=98840	Oman Daily Observer	t	dbiqwmupWq9ifvMVYDhySlUaxf2iM	main.omanobserver.om	1406786596126
402282	Will Microsoft's Deals with China Telecom and JD.com Boost Xbox One Sales?	http://www.fool.com/investing/general/2014/07/29/will-microsofts-deals-with-china-telecom-and-jdcom.aspx	Motley Fool	t	dbiqwmupWq9ifvMVYDhySlUaxf2iM	www.fool.com	1406786596376
402283	China investigates Microsoft for being a monopoly -- is the company guilty?	http://betanews.com/2014/07/29/china-investigates-microsoft-for-being-a-monopoly-is-the-company-guilty/	BetaNews	t	dbiqwmupWq9ifvMVYDhySlUaxf2iM	betanews.com	1406786596803
402284	China puts Microsoft under official investigation	http://www.king5.com/news/China-puts-Microsoft-under-official-investigation-269065701.html	KING5.com	t	dbiqwmupWq9ifvMVYDhySlUaxf2iM	www.king5.com	1406786597046
402285	China confirms probe into Microsoft over antitrust concerns	http://venturebeat.com/2014/07/29/china-confirms-probe-into-microsoft-over-antitrust-concerns/	VentureBeat	t	dbiqwmupWq9ifvMVYDhySlUaxf2iM	venturebeat.com	1406786597274
402286	Microsoft Hits Roadblock in China	http://en.kioskea.net/news/25157-microsoft-hits-roadblock-in-china	Kioskea	t	dbiqwmupWq9ifvMVYDhySlUaxf2iM	en.kioskea.net	1406786597476
402287	China Raids Microsoft Offices, Confiscates Possible Evidence for Antimonopoly  ...	http://www.hngn.com/articles/37406/20140729/china-raids-microsoft-offices-confiscates-possible-evidence-for-antimonopoly-case.htm	Headlines \& Global News	t	dbiqwmupWq9ifvMVYDhySlUaxf2iM	www.hngn.com	1406786597816
402288	Microsoft Corp facing anti-monopoly probe in China as officials raid offices	http://business.financialpost.com/2014/07/29/microsoft-corp-facing-anti-monopoly-probe-in-china-as-officials-raid-offices/\?__lsa=b699-403f	Financial Post	t	dbiqwmupWq9ifvMVYDhySlUaxf2iM	business.financialpost.com	1406786598063
402289	China targets Microsoft, other tech firms	http://www.taipeitimes.com/News/biz/archives/2014/07/30/2003596218	Taipei Times	t	dbiqwmupWq9ifvMVYDhySlUaxf2iM	www.taipeitimes.com	1406786598327
402290	Microsoft operating system comes under fire in China	https://my.news.yahoo.com/microsoft-operating-system-comes-under-144254832.html	Yahoo Malaysia News	t	dbiqwmupWq9ifvMVYDhySlUaxf2iM	my.news.yahoo.com	1406786598845
402291	China Raids Microsoft Offices in Anti-Monopoly Investigation	http://adage.com/article/global-news/china-raids-microsoft-offices-anti-monopoly-investigation/294370/	AdAge.com	t	dbiqwmupWq9ifvMVYDhySlUaxf2iM	adage.com	1406786599100
402292	China regulator to invest Microsoft	http://www.cityindex.co.uk/market-analysis/financial-news/us-stock-market-news/32780482014/china-regulator-to-invest-microsoft/	City Index	t	dbiqwmupWq9ifvMVYDhySlUaxf2iM	www.cityindex.co.uk	1406786599317
402293	China investigates Microsoft over monopoly worries	http://www.engadget.com/2014/07/29/china-investigates-microsoft/	Engadget	t	dbiqwmupWq9ifvMVYDhySlUaxf2iM	www.engadget.com	1406786599936
402294	Microsoft latest victim in China's spy-spooked probes	http://rt.com/business/176420-microsoft-china-probe-technology/	RT	t	dbiqwmupWq9ifvMVYDhySlUaxf2iM	rt.com	1406786600219
402295	China Pursues Monopoly Investigation of Microsoft	http://www.wirelessweek.com/news/2014/07/china-pursues-monopoly-investigation-microsoft	Wireless Week	t	dbiqwmupWq9ifvMVYDhySlUaxf2iM	www.wirelessweek.com	1406786600502
402296	China affirms Microsoft under scrutiny for rupture of antitrust regulations	http://www.pc-tablet.com/2014/07/29/33503/china-affirms-microsoft-scrutiny-rupture-antitrust-regulations/	PC-Tablet	t	dbiqwmupWq9ifvMVYDhySlUaxf2iM	www.pc-tablet.com	1406786601105
402297	Microsoft Feels Heat from China Regulators Over Antitrust Issues	http://www.newsledge.com/microsoft-feels-heat-china-regulators-antitrust-issues-8162	The News Ledge	t	dbiqwmupWq9ifvMVYDhySlUaxf2iM	www.newsledge.com	1406786601403
402298	China Launches Anti-monopoly Probe of Microsoft	http://www.moneynews.com/Markets/China-Anti-monopoly-Probe-Microsoft/2014/07/29/id/585472/	Moneynews	t	dbiqwmupWq9ifvMVYDhySlUaxf2iM	www.moneynews.com	1406786601742
402299	Microsoft Spotlights Rise Of JD, Anti-Trust Probes	http://www.forbes.com/sites/dougyoung/2014/07/29/microsoft-spotlights-rise-of-jd-anti-trust-probes/	Forbes	t	dbiqwmupWq9ifvMVYDhySlUaxf2iM	www.forbes.com	1406786601984
402300	Chinese regulator announces anti-monopoly probe of Microsoft	http://www.bdlive.co.za/world/asia/2014/07/29/chinese-regulator-announces-anti-monopoly-probe-of-microsoft	BDlive	t	dbiqwmupWq9ifvMVYDhySlUaxf2iM	www.bdlive.co.za	1406786602245
