181901	Foursquare offers users with new Swarm app for sharing intimate locations	http://www.utahpeoplespost.com/2014/05/foursquare-offers-users-with-new-swarm-app-for-sharing-intimate-locations/	The Utah People's Post	t	dP0wH9zFhfR90RMxPg7tDgNd6SwZM	www.utahpeoplespost.com	1399377075154
181902	Foursquare splits the two: New social sharing app Swarm to join legacy location	http://www.inferse.com/14855/foursquare-splits-two-new-social-sharing-app-swarm-join-legacy-location/	Inferse	t	dP0wH9zFhfR90RMxPg7tDgNd6SwZM	www.inferse.com	1399377075373
181903	FCC must preserve net neutrality	http://www.sentinelandenterprise.com/editorial/ci_25704960/fcc-must-preserve-net-neutrality	Sentinel and Enterprise	t	d0GXsuuicQNeUFMeLS6lz5JQ3G_mM	www.sentinelandenterprise.com	1399377309181
181904	Mozilla lobbies FCC to reform net neutrality	http://www.theinquirer.net/inquirer/news/2343171/mozilla-lobbies-fcc-to-reform-net-neutrality	Inquirer	t	d0GXsuuicQNeUFMeLS6lz5JQ3G_mM	www.theinquirer.net	1399377309395
181905	Mozilla joins Netflix in calling for stronger net neutrality	http://www.washingtonpost.com/blogs/the-switch/wp/2014/05/05/mozilla-joins-netflix-in-calling-for-stronger-net-neutrality/	Washington Post \(blog\)	t	d0GXsuuicQNeUFMeLS6lz5JQ3G_mM	www.washingtonpost.com	1399377309616
181906	Net neutrality (postscript): the US Federal Communications Commission (FCC  ...	http://www.mondaq.com/australia/x/311328/IT+internet/Net+neutrality+postscript+the+US+Federal+Communications+Commission+FCC+twists+and+turns	Mondaq News Alerts \(registration\)	t	d0GXsuuicQNeUFMeLS6lz5JQ3G_mM	www.mondaq.com	1399377309814
181907	Mozilla to FCC: Let us help you keep from screwing up net neutrality	http://venturebeat.com/2014/05/05/mozilla-to-fcc-let-us-help-you-keep-from-screwing-up-net-neutrality/	VentureBeat	t	d0GXsuuicQNeUFMeLS6lz5JQ3G_mM	venturebeat.com	1399377310080
181908	Journal Times editorial: Net neutrality is worth fighting to preserve	http://journaltimes.com/news/opinion/editorial/journal-times-editorial-net-neutrality-is-worth-fighting-to-preserve/article_9f705c2e-d4b0-11e3-876f-001a4bcf887a.html\?comment_form=true	Journal Times	t	d0GXsuuicQNeUFMeLS6lz5JQ3G_mM	journaltimes.com	1399377310368
181909	Ced Kurtz's Techman Texts: Netflix upgrades fight for net neutrality	http://www.post-gazette.com/business/technology/2014/05/06/techman0506/stories/201405060015	Pittsburgh Post-Gazette	t	d0GXsuuicQNeUFMeLS6lz5JQ3G_mM	www.post-gazette.com	1399377310680
181910	Net Neutrality Protest? Proposed FCC Rules Spark Some Criticism, But  ...	http://www.ibtimes.com/net-neutrality-protest-proposed-fcc-rules-spark-some-criticism-widespread-sopa-style-1580282	International Business Times	t	d0GXsuuicQNeUFMeLS6lz5JQ3G_mM	www.ibtimes.com	1399377310967
181911	Net Neutrality: What's in It for Online Sellers?	http://www.ecommercebytes.com/cab/abn/y14/m05/i06/s04	EcommerceBytes	t	d0GXsuuicQNeUFMeLS6lz5JQ3G_mM	www.ecommercebytes.com	1399377311228
181912	FCC: What a future with a closed Internet could look like	http://blogs.seattletimes.com/northwestvoices/2014/05/05/fcc-what-a-future-with-a-closed-internet-could-look-like/	The Seattle Times \(blog\)	t	d0GXsuuicQNeUFMeLS6lz5JQ3G_mM	blogs.seattletimes.com	1399377311566
181913	Mozilla asks the FCC to rethink net neutrality with content providers in mind	http://www.allmediany.com/news/22062-mozilla-asks-the-fcc-to-rethink-net-neutrality-with-content-providers-in-mind	AllMediaNY	t	d0GXsuuicQNeUFMeLS6lz5JQ3G_mM	www.allmediany.com	1399377311788
181914	Mozilla Proposes New Plan To Preserve Net Neutrality	http://www.mediapost.com/publications/article/225177/mozilla-proposes-new-plan-to-preserve-net-neutrali.html	MediaPost Communications	t	d0GXsuuicQNeUFMeLS6lz5JQ3G_mM	www.mediapost.com	1399377312008
181915	Editorial: FCC Chair's top priority should be preserving net neutrality	http://www.thereporter.com/editorials/ci_25702987/editorial-fcc-chairs-top-priority-should-be-preserving	The Reporter	t	d0GXsuuicQNeUFMeLS6lz5JQ3G_mM	www.thereporter.com	1399377312277
181916	Mozilla Finesses Title II Pitch To FCC	http://www.multichannel.com/mozilla-finesses-title-ii-pitch-fcc/374363	Multichannel News	t	d0GXsuuicQNeUFMeLS6lz5JQ3G_mM	www.multichannel.com	1399377312547
181917	Tech: Mozilla Calls for Stricter Net…	http://www.adweek.com/news/technology/mozilla-calls-stricter-net-neutrality-rules-157487	Adweek	t	d0GXsuuicQNeUFMeLS6lz5JQ3G_mM	www.adweek.com	1399377312795
181918	Net Neutrality 101 and What's at Stake With the FCC Ruling	http://wesa.fm/post/net-neutrality-101-and-whats-stake-fcc-ruling	90.5 WESA	t	d0GXsuuicQNeUFMeLS6lz5JQ3G_mM	wesa.fm	1399377313131
181919	Mozilla Asks FCC To Nix 'Fast Lane' Net Neutrality Rules	http://www.law360.com/articles/534495/mozilla-asks-fcc-to-nix-fast-lane-net-neutrality-rules	Law360 \(subscription\)	t	d0GXsuuicQNeUFMeLS6lz5JQ3G_mM	www.law360.com	1399377313483
181920	Net Neutrality Ruling 2014: As Mozilla Petitions The FCC For Better Consumer  ...	http://www.idigitaltimes.com/articles/22925/20140505/net-neutrality-ruling-2014-mozilla-petitions-fcc.htm	iDigitalTimes.com	t	d0GXsuuicQNeUFMeLS6lz5JQ3G_mM	www.idigitaltimes.com	1399377313826
181921	Mozilla proposes new version of net neutrality rules	http://www.computerworlduk.com/news/it-business/3514891/mozilla-proposes-new-version-of-net-neutrality-rules/	ComputerworldUK	t	d0GXsuuicQNeUFMeLS6lz5JQ3G_mM	www.computerworlduk.com	1399377314053
181922	Op-Ed: Get involved in the debate on net neutrality	http://digitaljournal.com/technology/op-ed-get-involved-in-the-debate-on-net-neutrality/article/382997	DigitalJournal.com	t	d0GXsuuicQNeUFMeLS6lz5JQ3G_mM	digitaljournal.com	1399377314330
181923	Mozilla Has a Plan to Save Net Neutrality	http://www.nextgov.com/emerging-tech/2014/05/mozilla-has-plan-save-net-neutrality/83803/	Nextgov	t	d0GXsuuicQNeUFMeLS6lz5JQ3G_mM	www.nextgov.com	1399377314548
181924	Mozilla Petitions the FCC with a Net Neutrality Plan of its Own	http://www.slyck.com/story2419_Mozilla_Petitions_the_FCC_with_a_Net_Neutrality_Plan_of_its_Own	Slyck	t	d0GXsuuicQNeUFMeLS6lz5JQ3G_mM	www.slyck.com	1399377314784
181925	Mozilla suggests new version of net neutrality rules	http://www.computerworld.com/s/article/9248121/Mozilla_suggests_new_version_of_net_neutrality_rules	Computerworld	t	d0GXsuuicQNeUFMeLS6lz5JQ3G_mM	www.computerworld.com	1399377315035
181926	Mozilla asks FCC to unleash the nuclear option on net neutrality	http://www.theregister.co.uk/2014/05/05/mozilla_asks_fcc_to_take_the_nuclear_option_on_net_neutrality/	Register	t	d0GXsuuicQNeUFMeLS6lz5JQ3G_mM	www.theregister.co.uk	1399377315240
181927	Can Net Neutrality Ensure Social Justice for All?	http://www.truth-out.org/opinion/item/23507-can-net-neutrality-ensure-social-justice-for-all	Truth-Out	t	d0GXsuuicQNeUFMeLS6lz5JQ3G_mM	www.truth-out.org	1399377315631
181928	Mozilla: We have a fix for Net neutrality	http://www.cnet.com/news/mozilla-says-it-has-a-fix-for-net-neutrality/	CNET	t	d0GXsuuicQNeUFMeLS6lz5JQ3G_mM	www.cnet.com	1399377315840
181929	Mozilla offers FCC a fresh take on net neutrality	http://www.slashgear.com/mozilla-offers-fcc-a-fresh-take-on-net-neutrality-05327680/	SlashGear	t	d0GXsuuicQNeUFMeLS6lz5JQ3G_mM	www.slashgear.com	1399377316042
181930	Save the Internet!	http://www.truthdig.com/report/item/save_the_internet_20140505	Truthdig	t	d0GXsuuicQNeUFMeLS6lz5JQ3G_mM	www.truthdig.com	1399377316292
181931	Net Neutrality III is Huge Government Heinous	http://news.heartland.org/editorial/2014/05/06/net-neutrality-iii-huge-government-heinous	Budget \& Tax News	t	d0GXsuuicQNeUFMeLS6lz5JQ3G_mM	news.heartland.org	1399377316519
181932	Net Neutrality: A Light At The End Of The Pipe?	http://dailycaller.com/2014/05/05/net-neutrality-a-light-at-the-end-of-the-pipe/	Daily Caller	t	d0GXsuuicQNeUFMeLS6lz5JQ3G_mM	dailycaller.com	1399377316719
181933	A Net Neutrality Solution	http://bismarcktribune.com/news/columnists/keith-darnay/a-net-neutrality-solution/article_e37057ae-d22f-11e3-b57a-0019bb2963f4.html	Bismarck Tribune	t	d0GXsuuicQNeUFMeLS6lz5JQ3G_mM	bismarcktribune.com	1399377316966
181934	Why Was There Such A Huge Outcry Against SOPA And PIPA But Not Against  ...	http://www.forbes.com/sites/quora/2014/05/05/why-was-there-such-a-huge-outcry-against-sopa-and-pipa-but-not-against-the-fccs-proposed-rules-against-net-neutrality/	Forbes	t	d0GXsuuicQNeUFMeLS6lz5JQ3G_mM	www.forbes.com	1399377317281
181935	Mozilla tells the FCC to grow a spine, reclassify ISPs as common carriers	http://bgr.com/2014/05/05/fcc-net-neutrality-plan-mozilla/	BGR	t	d0GXsuuicQNeUFMeLS6lz5JQ3G_mM	bgr.com	1399377317488
181936	The FCC is Hell-Bent to Regulate the Internet	http://electronicdesign.com/blog/fcc-hell-bent-regulate-internet	Electronic Design \(blog\)	t	d0GXsuuicQNeUFMeLS6lz5JQ3G_mM	electronicdesign.com	1399377317745
181937	Don't Let Net Neutrality Become Another Broken Promise	http://www.huffingtonpost.com/bill-moyers/dont-let-net-neutrality-b_b_5266929.html\?utm_hp_ref=green	Huffington Post	t	d0GXsuuicQNeUFMeLS6lz5JQ3G_mM	www.huffingtonpost.com	1399377317950
181938	Bloomberg via Getty Images	http://www.huffingtonpost.com/bill-moyers/dont-let-net-neutrality-b_b_5266929.html\?utm_hp_ref=yahoo&amp;ir=Yahoo	Huffington Post	t	d0GXsuuicQNeUFMeLS6lz5JQ3G_mM	www.huffingtonpost.com	1399377318184
181939	Mozilla offers FCC a net neutrality plan—with a twist	http://arstechnica.com/tech-policy/2014/05/mozilla-offers-fcc-a-net-neutrality-plan-with-a-twist/	Ars Technica	t	d0GXsuuicQNeUFMeLS6lz5JQ3G_mM	arstechnica.com	1399377318483
181940	Mozilla rejects plan for Internet 'fast lanes'	http://thehill.com/policy/technology/205190-mozilla-fights-back-against-internet-fast-lanes	The Hill \(blog\)	t	d0GXsuuicQNeUFMeLS6lz5JQ3G_mM	thehill.com	1399377318885
181941	Mozilla Offers an Idea for Solving Net Neutrality Problem	http://recode.net/2014/05/05/mozilla-offers-idea-for-solving-net-neutrality-problem/	Re\/code	t	d0GXsuuicQNeUFMeLS6lz5JQ3G_mM	recode.net	1399377319143
181942	Mozilla's crazy plan to fix net neutrality and turn broadband into a utility - and  ...	http://gigaom.com/2014/05/05/mozillas-crazy-plan-to-fix-net-neutrality-and-turn-broadband-into-a-utility-and-why-it-could-work/	GigaOM	t	d0GXsuuicQNeUFMeLS6lz5JQ3G_mM	gigaom.com	1399377319779
181943	Who's fighting to save the internet now?	http://www.theverge.com/2014/5/5/5683080/net-neutrality-supporters-gear-up-to-take-on-the-fcc	The Verge	t	d0GXsuuicQNeUFMeLS6lz5JQ3G_mM	www.theverge.com	1399377320140
181944	OPINION: Please Take Action to Save Our Open Internet	http://www.pagosadailypost.com/news/25681/OPINION:_Please_Take_Action_to_Save_Our_Open_Internet/	Pagosa Daily Post	t	d0GXsuuicQNeUFMeLS6lz5JQ3G_mM	www.pagosadailypost.com	1399377320434
181945	Let's Stop Giving The FCC Free Rein To Regulate The Internet	http://www.forbes.com/sites/realspin/2014/05/05/lets-stop-giving-the-fcc-free-rein-to-regulate-the-internet/	Forbes	t	d0GXsuuicQNeUFMeLS6lz5JQ3G_mM	www.forbes.com	1399377320654
181946	Netflix, Inc. (NASDAQ:NFLX): Fighting For Internet Neutrality	http://ustradevoice.com/netflix-inc-nasdaqnflx-fighting-for-internet-neutrality-4967.html	USTrade Voice	t	d0GXsuuicQNeUFMeLS6lz5JQ3G_mM	ustradevoice.com	1399377320854
181947	Letter: Hoeven should back Net neutrality	http://www.inforum.com/event/article/id/433862/group/Opinion/	In-Forum	t	d0GXsuuicQNeUFMeLS6lz5JQ3G_mM	www.inforum.com	1399377321164
181948	Thanks to Tom Wheeler, the end of the open Internet is nigh	http://www.infoworld.com/d/data-center/thanks-tom-wheeler-the-end-of-the-open-internet-nigh-241774	InfoWorld	t	d0GXsuuicQNeUFMeLS6lz5JQ3G_mM	www.infoworld.com	1399377321407
181949	FCC Chairman Wheeler to the Communications Industry: Father Knows Best?	http://www.forbes.com/sites/larrydownes/2014/05/05/fcc-chairman-wheeler-to-the-communications-industry-father-knows-best/	Forbes	t	d0GXsuuicQNeUFMeLS6lz5JQ3G_mM	www.forbes.com	1399377321621
181950	How US telcos bought their own watchdog	http://www.fudzilla.com/home/item/34664-how-us-telcos-bought-their-own-watchdog	Fudzilla	t	d0GXsuuicQNeUFMeLS6lz5JQ3G_mM	www.fudzilla.com	1399377321972
181951	On Net neutrality	http://www.nbr.co.nz/article/net-neutrality-dc-155400	National Business Review \(subscription\)	t	d0GXsuuicQNeUFMeLS6lz5JQ3G_mM	www.nbr.co.nz	1399377322276
181952	Net Neutrality: Netflix Goes Directly to the FCC as Google, Yahoo, and Others  ...	http://www.latinpost.com/articles/11698/20140503/net-neutrality-netflix-goes-directly-to-the-fcc-as-google-yahoo-and-other-may-launch-a-sopa-style-protest.htm	Latin Post	t	d0GXsuuicQNeUFMeLS6lz5JQ3G_mM	www.latinpost.com	1399377322522
181953	Reality Check on the Electoral Politics of Net Neutrality	http://news.heartland.org/editorial/2014/05/06/reality-check-electoral-politics-net-neutrality	Budget \& Tax News	t	d0GXsuuicQNeUFMeLS6lz5JQ3G_mM	news.heartland.org	1399377322751
181954	The War on 'Net' Neutrality	https://www.youtube.com/watch\?v=Md1bOCZAI-4&amp;list=UUznk5ru166gqEznWjcnJB0g	KELOLAND TV	t	d0GXsuuicQNeUFMeLS6lz5JQ3G_mM	www.youtube.com	1399377322962
181955	Wheeler Says FCC Won't Allow Internet 'Slow Lane'	http://www.toptechnews.com/story.xhtml\?story_id=0120013WPBLO	Top Tech News	t	d0GXsuuicQNeUFMeLS6lz5JQ3G_mM	www.toptechnews.com	1399377323281
181956	The FCC's New Net Neutrality Rules Will Be the Opposite of Net Neutrality  ...	http://www.latinpost.com/articles/11661/20140503/fccs-new-net-neutrality-rules-will-opposite-opinion.htm	Latin Post	t	d0GXsuuicQNeUFMeLS6lz5JQ3G_mM	www.latinpost.com	1399377323579
181957	FCC chairman Tom Wheeler: Net neutrality is not dead, Internet 'fast lanes' are  ...	http://www.techtimes.com/articles/6372/20140504/fcc-chairman-tom-wheeler-net-neutrality-is-not-dead-internet-fast-lanes-are-myth.htm	Tech Times	t	d0GXsuuicQNeUFMeLS6lz5JQ3G_mM	www.techtimes.com	1399377323805
181958	Nancy Kaffer: Why you should be worried about net neutrality	http://www.freep.com/article/20140504/COL43/305040057/net-neutrality-FCC-internet-web-rules-cable-providers-netflix-ISPs	Detroit Free Press	t	d0GXsuuicQNeUFMeLS6lz5JQ3G_mM	www.freep.com	1399377324067
181959	Why net neutrality matters to the little guy	http://seattletimes.com/html/businesstechnology/2023508165_biztaltoncol05xml.html	The Seattle Times	t	d0GXsuuicQNeUFMeLS6lz5JQ3G_mM	seattletimes.com	1399377324384
181960	The End Of Net Neutrality Means The Death Of Your Internet.	http://www.inquisitr.com/1236934/the-end-of-net-neutrality-means-the-death-of-your-internet/	The Inquisitr	t	d0GXsuuicQNeUFMeLS6lz5JQ3G_mM	www.inquisitr.com	1399377324650
181961	Contra Costa Times editorial: FCC chair's top priority should be preserving net  ...	http://www.contracostatimes.com/editorial/ci_25686054/contra-costa-times-editorial-fcc-chairs-top-priority	Contra Costa Times	t	d0GXsuuicQNeUFMeLS6lz5JQ3G_mM	www.contracostatimes.com	1399377324904
181962	The FCC Chairman's Lame Excuses for Slaying Net Neutrality	http://www.slate.com/articles/technology/future_tense/2014/05/fcc_chairman_tom_wheeler_s_lame_excuses_for_his_net_neutrality_proposal.html	Slate Magazine	t	d0GXsuuicQNeUFMeLS6lz5JQ3G_mM	www.slate.com	1399377325489
181963	FCC chair's top priority should be preserving net neutrality	http://www.mercurynews.com/opinion/ci_25686010/mercury-news-editorial-fcc-chairs-top-priority-should.html	San Jose Mercury News	t	d0GXsuuicQNeUFMeLS6lz5JQ3G_mM	www.mercurynews.com	1399377325730
181964	The Avengers Are Assembling — Google and Netflix Join Forces to Fight the  ...	http://www.policymic.com/articles/88795/the-avengers-are-assembling-google-and-netflix-join-forces-to-fight-the-government	PolicyMic	t	d0GXsuuicQNeUFMeLS6lz5JQ3G_mM	www.policymic.com	1399377326359
181965	Netflix takes leading role in DC	http://www.politico.com/story/2014/05/netflix-dc-106297.html	Politico	t	d0GXsuuicQNeUFMeLS6lz5JQ3G_mM	www.politico.com	1399377326667
181966	The FCC, Net Neutrality and You	http://billmoyers.com/2014/05/02/the-fcc-net-neutrality-and-you/	BillMoyers.com	t	d0GXsuuicQNeUFMeLS6lz5JQ3G_mM	billmoyers.com	1399377326883
181967	Netflix brings net neutrality concerns to US regulators	http://www.malaysiasun.com/index.php/sid/221608289/scat/d805653303cbbba8	Malaysia Sun	t	d0GXsuuicQNeUFMeLS6lz5JQ3G_mM	www.malaysiasun.com	1399377327230
181968	Netflix Takes Net Neutrality Fight Straight To The Top	http://www.huffingtonpost.com/2014/05/02/netflix-net-neutrality_n_5250257.html\?ir=Technology	Huffington Post	t	d0GXsuuicQNeUFMeLS6lz5JQ3G_mM	www.huffingtonpost.com	1399377327446
181969	Web access under assault: Killing net neutrality would be a blow to consumers	http://www.thenewstribune.com/2014/05/04/3178888/web-access-under-assault-killing.html\?sp=/99/447/	TheNewsTribune.com	t	d0GXsuuicQNeUFMeLS6lz5JQ3G_mM	www.thenewstribune.com	1399377327675
181970	Sunday's letters: Keep Internet open, accessible	http://www.tampabay.com/opinion/letters/sundays-letters/2178060	Tampabay.com	t	d0GXsuuicQNeUFMeLS6lz5JQ3G_mM	www.tampabay.com	1399377327918
181971	The FCC's Flimsy Defense of Fake Net Neutrality	http://www.prwatch.org/news/2014/05/12466/fccs-flimsy-defense-fake-net-neutrality	PR Watch	t	d0GXsuuicQNeUFMeLS6lz5JQ3G_mM	www.prwatch.org	1399377328333
181972	Intro to Internet neutrality	http://www.carrollcountytimes.com/news/local/intro-to-internet-neutrality/article_93715313-6cb9-5468-8e94-ff60acea6117.html	Carroll County Times	t	d0GXsuuicQNeUFMeLS6lz5JQ3G_mM	www.carrollcountytimes.com	1399377328570
181973	Fight for free, open Internet renewed as FCC considers new regulations	http://www.baltimoresun.com/business/technology/blog/bs-bz-net-neutrality-20140501,0,3786305.story	Baltimore Sun \(blog\)	t	d0GXsuuicQNeUFMeLS6lz5JQ3G_mM	www.baltimoresun.com	1399377328986
181974	The weekly poll	http://www.sfgate.com/opinion/article/The-weekly-poll-5449662.php	SFGate	t	d0GXsuuicQNeUFMeLS6lz5JQ3G_mM	www.sfgate.com	1399377329500
181975	Bill Moyers blisters Obama for abandoning his net neutrality promises	http://www.rawstory.com/rs/2014/05/02/bill-moyers-blisters-obama-for-abandoning-his-net-neutrality-promises/	Raw Story	t	d0GXsuuicQNeUFMeLS6lz5JQ3G_mM	www.rawstory.com	1399377329798
181976	Netflix turns up the heat on FCC's controversial net neutrality plan	http://bgr.com/2014/05/02/netflix-fcc-net-neutrality/\?utm_source=feedburner&amp;utm_medium=feed&amp;utm_campaign=Feed%3A+TheBoyGeniusReport+(BGR+%7C+Boy+Genius+Report)	BGR	t	d0GXsuuicQNeUFMeLS6lz5JQ3G_mM	bgr.com	1399377330602
181977	Famous Game Creators Are Fighting For Internet Freedom	http://tmi.kotaku.com/famous-game-creators-are-fighting-for-internet-freedom-1570445799	Kotaku	t	d0GXsuuicQNeUFMeLS6lz5JQ3G_mM	tmi.kotaku.com	1399377331035
181978	Net Neutrality and the Future of the Internet	http://www.huffingtonpost.com/nathan-white/net-neutrality_b_5256423.html	Huffington Post	t	d0GXsuuicQNeUFMeLS6lz5JQ3G_mM	www.huffingtonpost.com	1399377331282
181979	Mercury News editorial: FCC chair's top priority should be preserving net neutrality	http://www.mercurynews.com/opinion/ci_25686010/mercury-news-editorial-fcc-chairs-top-priority-should	San Jose Mercury News	t	d0GXsuuicQNeUFMeLS6lz5JQ3G_mM	www.mercurynews.com	1399377331549
181980	Elizabeth Warren and the Internet “Regulators”	http://www.unitedliberty.org/articles/17478-elizabeth-warren-and-the-internet-regulators	United Liberty	t	d0GXsuuicQNeUFMeLS6lz5JQ3G_mM	www.unitedliberty.org	1399377331795
181981	Tech Startups May Be The Last Line Of Defense For Net Neutrality	http://www.huffingtonpost.com/2014/05/02/net-neutrality-tech-startups_n_5247506.html	Huffington Post	t	d0GXsuuicQNeUFMeLS6lz5JQ3G_mM	www.huffingtonpost.com	1399377332095
181982	Netflix, Inc. (NASDAQ:NFLX) Opposed to Net Neutrality Fees	https://ustrademedia.com/netflix-inc-nasdaqnflx-opposed-to-net-neutrality-fees-5034.html	US Trade Media	t	d0GXsuuicQNeUFMeLS6lz5JQ3G_mM	ustrademedia.com	1399377332339
181983	Blog: So long open broadband internet, you'll be missed	http://pvtrib.com/main.asp\?SectionID=109&amp;SubSectionID=415&amp;ArticleID=60831	Prescott Valley Tribune	t	d0GXsuuicQNeUFMeLS6lz5JQ3G_mM	pvtrib.com	1399377332547
181984	Policing the Wild, Wild Internet with the 3rd Version of Net Neutrality	http://www.telecomreseller.com/2014/05/02/policing-the-wild-wild-internet-with-the-3rd-version-of-net-neutrality/	Telecom Reseller \(press release\)	t	d0GXsuuicQNeUFMeLS6lz5JQ3G_mM	www.telecomreseller.com	1399377333074
181985	Should the Internet Be Re-Classified as a Communications Service? | Part 1	http://www.sys-con.com/node/3079141	SYS-CON Media \(press release\)	t	d0GXsuuicQNeUFMeLS6lz5JQ3G_mM	www.sys-con.com	1399377333315
181986	Does the FCC's New Net Neutrality Plan Ignore Net Neutrality?	http://www.care2.com/causes/does-the-fccs-new-net-neutrality-plan-ignore-net-neutrality.html	Care2.com	t	d0GXsuuicQNeUFMeLS6lz5JQ3G_mM	www.care2.com	1399377333567
181987	Opposition to FCC's Net Neutrality Rule Grows	http://www.thefiscaltimes.com/Articles/2014/05/02/Opposition-FCC-s-Net-Neutrality-Rule-Grows	The Fiscal Times	t	d0GXsuuicQNeUFMeLS6lz5JQ3G_mM	www.thefiscaltimes.com	1399377333998
181988	What net neutrality means for independent film	http://www.washingtonpost.com/news/act-four/wp/2014/05/02/what-net-neutrality-means-for-independent-film/\?tid=hpModule_6c539b02-b270-11e2-bbf2-a6f9e9d79e19	Washington Post	t	d0GXsuuicQNeUFMeLS6lz5JQ3G_mM	www.washingtonpost.com	1399377334257
181989	FCC's backyard will have a billboard with anti-net neutrality proposal message  ...	http://thenextdigit.com/6079/fccs-backyard-billboard-anti-net-neutrality-proposal-message-soon/	The Next Digit	t	d0GXsuuicQNeUFMeLS6lz5JQ3G_mM	thenextdigit.com	1399377334469
181990	A Primer: Just What Is Net Neutrality — and Why All the Fuss?	http://billmoyers.com/2014/05/02/a-primer-just-what-is-net-neutrality-and-why-all-the-fuss/	BillMoyers.com	t	d0GXsuuicQNeUFMeLS6lz5JQ3G_mM	billmoyers.com	1399377334679
181991	Reddit cofounder's crowdfund campaign wants net neutrality billboard in FCC  ...	http://www.techhive.com/article/2151020/crowdfunding-campaign-wants-net-neutrality-billboard-where-us-regulator-cant-miss-it.html	TechHive	t	d0GXsuuicQNeUFMeLS6lz5JQ3G_mM	www.techhive.com	1399377334992
181992	Crowdfunding campaign wants net neutrality billboard where US regulator can't  ...	http://www.pcadvisor.co.uk/news/internet/3514772/crowdfunding-campaign-wants-net-neutrality-billboard-where-us-regulator-cant-miss-it/	PC Advisor	t	d0GXsuuicQNeUFMeLS6lz5JQ3G_mM	www.pcadvisor.co.uk	1399377335247
181993	Crowdfunding Campaign Wants Net Neutrality Billboard Where US Regulator  ...	http://www.cio.com/article/752320/Crowdfunding_Campaign_Wants_Net_Neutrality_Billboard_Where_US_Regulator_Can_39_t_Miss_it	CIO	t	d0GXsuuicQNeUFMeLS6lz5JQ3G_mM	www.cio.com	1399377335493
181994	Obama in 2007 Video: 'I am a Strong Supporter of Net Neutrality'	http://mashable.com/2014/05/02/obama-net-neutrality-2007-video/	Mashable	t	d0GXsuuicQNeUFMeLS6lz5JQ3G_mM	mashable.com	1399377335677
181995	Could the Loss of Net Neutrality Damage the Environmental Movement?	http://www.care2.com/greenliving/could-the-loss-of-net-neutrality-damage-the-environmental-movement.html	Care2.com	t	d0GXsuuicQNeUFMeLS6lz5JQ3G_mM	www.care2.com	1399377336013
181996	Content Insider #336 - Power Words	http://www.consumerelectronicsnet.com/article/Content-Insider-336---Power-Words-3229434	Consumer Electronics Net	t	d0GXsuuicQNeUFMeLS6lz5JQ3G_mM	www.consumerelectronicsnet.com	1399377336206
181997	Beyond net neutrality: The new battle for the future of the internet	http://www.vox.com/2014/5/2/5665890/beyond-net-neutrality-the-new-battle-for-the-future-of-the-internet	Vox	t	d0GXsuuicQNeUFMeLS6lz5JQ3G_mM	www.vox.com	1399377336408
181998	Will New FCC Internet Regulations Strengthen Monopoly Control?	http://therealnews.com/t2/index.php\?option=com_content&amp;task=view&amp;id=31&amp;Itemid=74&amp;jumival=11791&amp;updaterx=2014-04-30+16%3A28%3A05	The Real News Network	t	d0GXsuuicQNeUFMeLS6lz5JQ3G_mM	therealnews.com	1399377336660
181999	Release the Kraken? Wheeler Warns Cable to Play Nice on Broadband	http://www.cablefax.com/cfp/just_in/Release-the-Kraken-Wheeler-Warns-Cable-to-Play-Nice-on-Broadband_63026.html	CableFAX	t	d0GXsuuicQNeUFMeLS6lz5JQ3G_mM	www.cablefax.com	1399377337034
182000	Microsoft launches Office 365 Personal in India, targeting 25 million new  ...	http://www.wpcentral.com/comment/897300	Daniel Rubino	t	dk5rMEJBM5WwqKMzmNLComXndaRqM	www.wpcentral.com	1399377735056
