398801	WRAPUP 1-Fed seen trimming bond buys, could offer vague rate clues	http://www.reuters.com/article/2014/07/30/usa-fed-idUSL4N0Q450D20140730	Reuters	b	dPXi3AbnENS4GEMEHRIN5gUcbexYM	www.reuters.com	1406717885163
398802	Gold Is Dangling	http://www.fxempire.com/news/commodities-news/gold-is-dangling/	FX Empire	b	dPXi3AbnENS4GEMEHRIN5gUcbexYM	www.fxempire.com	1406717885611
398803	US Economy Improves; Federal Reserve Expected to Continue Tapering	http://www.indonesia-investments.com/news/todays-headlines/us-economy-improves-federal-reserve-expected-to-continue-tapering/item2267	Indonesia Investments	b	dPXi3AbnENS4GEMEHRIN5gUcbexYM	www.indonesia-investments.com	1406717885895
398804	Fed widely expected to make sixth reduction in bond purchases at this week's  ...	http://www.foxbusiness.com/markets/2014/07/30/fed-widely-expected-to-make-sixth-reduction-in-bond-purchases-at-this-week/\?utm_source=feedburner&amp;utm_medium=feed&amp;utm_campaign=Feed%3A+foxbusiness%2Fgovernment+(Internal+-+Government+-+Text)	Fox Business	b	dPXi3AbnENS4GEMEHRIN5gUcbexYM	www.foxbusiness.com	1406717886281
398805	Fed Decision-Day Guide: QE Tapering to Inflation Debate	http://www.businessweek.com/news/2014-07-30/fed-decision-day-guide-qe-tapering-to-inflation-debate	Businessweek	b	dPXi3AbnENS4GEMEHRIN5gUcbexYM	www.businessweek.com	1406717886654
398806	Fed to keep cards close to the vest	http://triblive.com/business/headlines/6525205-74/fed-rates-rate	Tribune-Review	b	dPXi3AbnENS4GEMEHRIN5gUcbexYM	triblive.com	1406717887020
398807	Asian Equities Higher Again before Fed	http://www.marketpulse.com/20140729/asian-equities-higher-fed/	MarketPulse \(blog\)	b	dPXi3AbnENS4GEMEHRIN5gUcbexYM	www.marketpulse.com	1406717887391
398808	US Economy Sprinting To The 2014 Finish Line While Fed Tries To Catch Up	http://www.actionforex.com/analysis/daily-forex-fundamentals/us-economy-sprinting-to-the-2014-finish-line-while-fed-tries-to-catch-up-20140730221270/	Action Forex	b	dPXi3AbnENS4GEMEHRIN5gUcbexYM	www.actionforex.com	1406717887707
398809	Fed weighing key issues but may reveal little	http://www.statesman.com/news/business/fed-weighing-key-issues-but-may-reveal-little/ngqkM/	Austin American-Statesman	b	dPXi3AbnENS4GEMEHRIN5gUcbexYM	www.statesman.com	1406717887995
398810	Liberals the 'One Percent'	http://stream.wsj.com/story/latest-headlines/SS-2-63399/SS-2-592333/	Wall Street Journal	b	dPXi3AbnENS4GEMEHRIN5gUcbexYM	stream.wsj.com	1406717888454
398811	FOMC Preview: Here's What To Expect From The Meeting	http://www.businessinsider.in/FOMC-Preview-Heres-What-To-Expect-From-The-Meeting/articleshow/39261597.cms	Businessinsider India	b	dPXi3AbnENS4GEMEHRIN5gUcbexYM	www.businessinsider.in	1406717888792
398812	Fed meets amid calls for tighter policy	http://www.menafn.com/1093893810/Fed-meets-amid-calls-for-tighter-policy	MENAFN.COM	b	dPXi3AbnENS4GEMEHRIN5gUcbexYM	www.menafn.com	1406717889048
398813	Fed Weighs Key Issues But May Reveal Little	http://www.memphisdailynews.com/news/2014/jul/30/fed-weighs-key-issues-but-may-reveal-little/\?utm_source=feedburner&amp;utm_medium=feed&amp;utm_campaign=Feed%3A+memphisdailynews%2Fbbde+(The+Memphis+Daily+News)	Memphis Daily News	b	dPXi3AbnENS4GEMEHRIN5gUcbexYM	www.memphisdailynews.com	1406717889349
398814	CNBC Fed Survey: CNBC's Steve Liesman: Wall Street Worries Fed's Easing  ...	http://www.cnbc.com/id/101875020	CNBC	b	dPXi3AbnENS4GEMEHRIN5gUcbexYM	www.cnbc.com	1406717889692
398815	Did Yellen slay the 'tech bubble' dragon?	http://fortune.com/2014/07/29/did-yellen-slay-the-tech-bubble-dragon/	Fortune	b	dPXi3AbnENS4GEMEHRIN5gUcbexYM	fortune.com	1406717889964
398816	Fed's easing will likely lead to inflation: Economist	http://www.cnbc.com/id/101876667\?trknav=homestack:topnews:8	CNBC	b	dPXi3AbnENS4GEMEHRIN5gUcbexYM	www.cnbc.com	1406717890366
398817	Fed exit will end badly: Economist	http://www.cnbc.com/id/101876667	CNBC	b	dPXi3AbnENS4GEMEHRIN5gUcbexYM	www.cnbc.com	1406717890776
398818	Janet Yellen Policies Still Hurting Savers	http://www.valuewalk.com/2014/07/janet-yellen-policies-still-hurting-savers/	ValueWalk	b	dPXi3AbnENS4GEMEHRIN5gUcbexYM	www.valuewalk.com	1406717891211
398819	Fed Delivers Warning To Investors	http://seekingalpha.com/article/2353895-fed-delivers-warning-to-investors\?source=cc	Seeking Alpha \(registration\)	b	dPXi3AbnENS4GEMEHRIN5gUcbexYM	seekingalpha.com	1406717891485
398820	Janet Yellen doesn't want you to get too big a raise	http://www.vox.com/2014/7/29/5948155/janet-yellen-doesnt-want-you-to-get-too-big-a-raise	Vox	b	dPXi3AbnENS4GEMEHRIN5gUcbexYM	www.vox.com	1406717891730
398821	Fed weighing key issues but revealing little	http://libn.com/2014/07/29/fed-weighing-key-issues-but-revealing-little/	Long Island Business News	b	dPXi3AbnENS4GEMEHRIN5gUcbexYM	libn.com	1406717892158
398822	Fed weighs key questions this week on reversing its low-rate policies but may  ...	http://www.foxbusiness.com/markets/2014/07/29/fed-weighs-key-questions-this-week-on-reversing-its-low-rate-policies-but-may/	Fox Business	b	dPXi3AbnENS4GEMEHRIN5gUcbexYM	www.foxbusiness.com	1406717892383
398823	Forward Guidance: What to Watch at This Week's Fed Meeting	http://blogs.wsj.com/economics/2014/07/29/forward-guidance-what-to-watch-at-this-weeks-fed-meeting/	Wall Street Journal \(blog\)	b	dPXi3AbnENS4GEMEHRIN5gUcbexYM	blogs.wsj.com	1406717892741
398824	Federal Reserve is weighing key issues but may reveal little	http://www.deseretnews.com/article/765657553/Fed-is-weighing-key-issues-but-may-reveal-little.html	Deseret News	b	dPXi3AbnENS4GEMEHRIN5gUcbexYM	www.deseretnews.com	1406717893112
398825	Fed Delivers Warning To Investors [Dow Jones Industrial Average, SPDR S&P  ...	http://etfdailynews.com/2014/07/29/fed-delivers-warning-to-investors/	ETF Daily News	b	dPXi3AbnENS4GEMEHRIN5gUcbexYM	etfdailynews.com	1406717893394
398826	US Federal Reserve meets amid calls for tighter policy	http://economictimes.indiatimes.com/news/international/business/us-federal-reserve-meets-amid-calls-for-tighter-policy/articleshow/39249862.cms	Economic Times	b	dPXi3AbnENS4GEMEHRIN5gUcbexYM	economictimes.indiatimes.com	1406717893652
398827	Wall Street Fears Fed Tightening Will Not Work	http://www.marketpulse.com/20140729/wall-street-fears-fed-tightening-will-work/	MarketPulse \(blog\)	b	dPXi3AbnENS4GEMEHRIN5gUcbexYM	www.marketpulse.com	1406717893880
398828	Fed meeting may give clues on interest rates	http://www.usatoday.com/story/money/business/2014/07/29/fed-meeting-july/13242019/\?utm_source=feedblitz&amp;utm_medium=FeedBlitzRss&amp;utm_campaign=usatodaycommoney-topstories	USA TODAY	b	dPXi3AbnENS4GEMEHRIN5gUcbexYM	www.usatoday.com	1406717894165
398829	Rate Hike Debate to Dominate Fed Meeting	http://www.foxbusiness.com/economy-policy/2014/07/28/rate-hike-debate-to-dominate-fed-meeting/	Fox Business	b	dPXi3AbnENS4GEMEHRIN5gUcbexYM	www.foxbusiness.com	1406717894771
398830	Euro Hangs In The Balance As Fed Meeting Gets Underway	http://www.benzinga.com/news/14/07/4736104/euro-hangs-in-the-balance-as-fed-meeting-gets-underway	Benzinga	b	dPXi3AbnENS4GEMEHRIN5gUcbexYM	www.benzinga.com	1406717895170
398831	Quantitative Easing: Federal Reserve actions could create an unexpected risk  ...	http://blog.al.com/acre/2014/07/quantitative_easing_federal_re.html	al.com \(blog\)	b	dPXi3AbnENS4GEMEHRIN5gUcbexYM	blog.al.com	1406717895524
398832	FOMC Likely To Continue Tapering But Otherwise Not Change Policy Statement  ...	http://www.forbes.com/sites/kitconews/2014/07/29/fomc-likely-to-continue-tapering-but-otherwise-not-change-policy-statement-materially/	Forbes	b	dPXi3AbnENS4GEMEHRIN5gUcbexYM	www.forbes.com	1406717895821
398833	Hopes for monetary policy guidance from Federal Reserve meeting	http://euronews.com/2014/07/29/hopes-for-monetary-policy-guidance-from-federal-reserve-meeting/	euronews	b	dPXi3AbnENS4GEMEHRIN5gUcbexYM	euronews.com	1406717896440
398834	Will The Fed Exit With A Blue Pill?	http://www.investing.com/analysis/will-the-fed-exit-with-a-blue-pill-220950	Investing.com	b	dPXi3AbnENS4GEMEHRIN5gUcbexYM	www.investing.com	1406717896808
398835	FOMC Preview Ahead of GDP and Unemployment	http://247wallst.com/economy/2014/07/29/fomc-preview-ahead-of-gdp-and-unemployment/	24\/7 Wall St.	b	dPXi3AbnENS4GEMEHRIN5gUcbexYM	247wallst.com	1406717897232
398836	Is The Fed Exit a Blue Pill?	http://www.valuewalk.com/2014/07/fed-qe-zirp/	ValueWalk	b	dPXi3AbnENS4GEMEHRIN5gUcbexYM	www.valuewalk.com	1406717897588
398837	Wall Street worries Fed's easing will 'end badly'	http://www.cnbc.com/id/101873329	CNBC	b	dPXi3AbnENS4GEMEHRIN5gUcbexYM	www.cnbc.com	1406717897804
398838	Grand Central: Tame Inflation Expectations a Trump Card for Fed's Doves	http://blogs.wsj.com/economics/2014/07/29/grand-central-tame-inflation-expectations-a-trump-card-for-feds-doves/	Wall Street Journal \(blog\)	b	dPXi3AbnENS4GEMEHRIN5gUcbexYM	blogs.wsj.com	1406717898129
398839	EUR/USD Fundamental Analysis July 30, 2014 Forecast	http://www.fxempire.com/fundamental/fundamental-analysis-reports/eurusd-fundamental-analysis-july-30-2014-forecast/	FX Empire	b	dPXi3AbnENS4GEMEHRIN5gUcbexYM	www.fxempire.com	1406717898344
398840	A premature rise in US interest rates will endanger the national real estate market	http://invezz.com/contributed/by_region/12279-A-premature-rise-in-US-interest-rates-will-endanger-the-national-real-estate-market-	iNVEZZ	b	dPXi3AbnENS4GEMEHRIN5gUcbexYM	invezz.com	1406717898622
398841	Investors' fears intensify over US rate hike talk	http://www.afr.com/p/business/companies/investors_fears_intensify_over_us_s24qiIvdDTUVBQFKBz9gXP	The Australian Financial Review	b	dPXi3AbnENS4GEMEHRIN5gUcbexYM	www.afr.com	1406717898914
398842	Euro edges up against dollar	http://dunyanews.tv/index.php/en/Business/230728-Euro-edges-up-against-dollar	dunyanews.tv	b	dPXi3AbnENS4GEMEHRIN5gUcbexYM	dunyanews.tv	1406717899344
398843	Euro edges up against US dollar	http://www.skynews.com.au/business/business/market/2014/07/29/euro-edges-up-against-us-dollar.html	Sky News Australia	b	dPXi3AbnENS4GEMEHRIN5gUcbexYM	www.skynews.com.au	1406717899629
398844	Evening Wrap: S&P Inches Higher, Eyes On Fed	http://blogs.barrons.com/stockstowatchtoday/2014/07/28/evening-wrap-sp-inches-higher-eyes-on-fed/	Barron's \(blog\)	b	dPXi3AbnENS4GEMEHRIN5gUcbexYM	blogs.barrons.com	1406717900324
398845	Why the Fed could raise rates sooner than you think	http://www.cnbc.com/id/101872957	CNBC.com	b	dPXi3AbnENS4GEMEHRIN5gUcbexYM	www.cnbc.com	1406717900552
398846	Fed up? Yellen facing challenges from within	https://au.finance.yahoo.com/news/fed-yellen-facing-challenges-within-172956701.html	Yahoo\!7 News	b	dPXi3AbnENS4GEMEHRIN5gUcbexYM	au.finance.yahoo.com	1406717900896
398847	Life after QE	http://www.livemint.com/Opinion/dZUfJejQeU9kmzzH8WkbwK/Life-after-QE.html	Livemint	b	dPXi3AbnENS4GEMEHRIN5gUcbexYM	www.livemint.com	1406717901492
398848	What to do When the Market Doesn't Believe the Fed	http://news.investors.com/investing/072814-710614-what-to-do-when-the-market-doesnand8217t-believe-the-fed.htm	Investor's Business Daily	b	dPXi3AbnENS4GEMEHRIN5gUcbexYM	news.investors.com	1406717901779
398849	Fed to study broad range of indicators in search of inflation	http://www.columbusceo.com/content/stories/apexchange/2014/07/28/fed-to-study-broad-range-of-indicators-in-search-of-inflation.html	Columbus CEO	b	dPXi3AbnENS4GEMEHRIN5gUcbexYM	www.columbusceo.com	1406717902072
398850	The Threat of Rising Rates	http://www.forexfactory.com/news.php\?do=news&amp;id=496721	Forex Factory	b	dPXi3AbnENS4GEMEHRIN5gUcbexYM	www.forexfactory.com	1406717902307
398851	Is The Fed Finally Beginning To See The Problems With IT?	http://seekingalpha.com/article/2348025-is-the-fed-finally-beginning-to-see-the-problems-with-it	Seeking Alpha \(registration\)	b	dPXi3AbnENS4GEMEHRIN5gUcbexYM	seekingalpha.com	1406717902579
398852	Bair And Reserves For All	http://seekingalpha.com/article/2347885-bair-and-reserves-for-all	Seeking Alpha \(registration\)	b	dPXi3AbnENS4GEMEHRIN5gUcbexYM	seekingalpha.com	1406717902907
398853	The Fed's five (not so) easy steps back to normal	http://www.washingtonpost.com/blogs/wonkblog/wp/2014/07/28/the-feds-five-not-so-easy-steps-back-to-normal/	Washington Post \(blog\)	b	dPXi3AbnENS4GEMEHRIN5gUcbexYM	www.washingtonpost.com	1406717903132
398854	Yellen Watching What She Eats Would Help Track Prices: Economy	http://www.businessweek.com/news/2014-07-28/yellen-watching-what-she-eats-would-help-fed-tracking-inflation	Businessweek	b	dPXi3AbnENS4GEMEHRIN5gUcbexYM	www.businessweek.com	1406717903359
398855	You Can't Taper a Ponzi Scheme: Time to Reboot	http://www.truth-out.org/news/item/25201-you-cant-taper-a-ponzi-scheme-time-to-reboot\?utm_source=feedburner&amp;utm_medium=feed&amp;utm_campaign=Feed%3A+TRUTHOUT+(t+r+u+t+h+o+u+t+%7C+News+Politics)	Truth-Out	b	dPXi3AbnENS4GEMEHRIN5gUcbexYM	www.truth-out.org	1406717904173
398856	Workers could see wages increase this year	http://www.19actionnews.com/story/26102800/workers-could-see-wages-increase-this-year	19 Action News	b	dPXi3AbnENS4GEMEHRIN5gUcbexYM	www.19actionnews.com	1406717904447
398857	Grand Central: Time to Take Measure of Fuzzy US Growth Accounting	http://blogs.wsj.com/economics/2014/07/28/grand-central-time-to-take-measure-of-fuzzy-u-s-growth-accounting/	Wall Street Journal \(blog\)	b	dPXi3AbnENS4GEMEHRIN5gUcbexYM	blogs.wsj.com	1406717904931
398858	The $1 Trillion Tax On Cash	http://seekingalpha.com/article/2346265-the-1-trillion-tax-on-cash	Seeking Alpha \(registration\)	b	dPXi3AbnENS4GEMEHRIN5gUcbexYM	seekingalpha.com	1406717905200
398859	Here's what may matter more than jobs and earnings	http://www.cnbc.com/id/101860887	CNBC.com	b	dPXi3AbnENS4GEMEHRIN5gUcbexYM	www.cnbc.com	1406717905448
398860	Big Week Ahead with Eyes on Fed	http://www.marketpulse.com/20140727/big-week-ahead-eyes-fed/	MarketPulse \(blog\)	b	dPXi3AbnENS4GEMEHRIN5gUcbexYM	www.marketpulse.com	1406717905828
398861	ORTEL: Note to Janet Yellen: The American bubble is popping	http://www.washingtontimes.com/news/2014/jul/27/ortel-note-to-janet-yellen-the-american-bubble-is-/	Washington Times	b	dPXi3AbnENS4GEMEHRIN5gUcbexYM	www.washingtontimes.com	1406717906049
398862	The Danger of Too Loose, Too Long	http://stream.wsj.com/story/latest-headlines/SS-2-63399/SS-2-590469/	Wall Street Journal	b	dPXi3AbnENS4GEMEHRIN5gUcbexYM	stream.wsj.com	1406717906277
398863	US Federal Reserve vs. Congress: Battle over accountability and transparency	http://www.thehimalayantimes.com/fullNews.php\?headline=US+Federal+Reserve+vs.+Congress%3A+Battle+over+accountability+and+transparency&amp;NewsID=422444	Himalayan Times	b	dPXi3AbnENS4GEMEHRIN5gUcbexYM	www.thehimalayantimes.com	1406717906897
398864	It's a ticking time bomb "Ready to go kablooey when the next panic	http://www.skyvalleychronicle.com/FEATURE-NEWS/THE-SHADOW-BANKING-SYSTEM-BR-Nobody-can-stop-it-nobody-can-regulate-it-br-i-It-s-a-ticking-time-bomb-ready-to-go-kablooey-when-the-next-panic-comes-around-i-1807987	Sky Valley Chronicle	b	dPXi3AbnENS4GEMEHRIN5gUcbexYM	www.skyvalleychronicle.com	1406717907121
398865	UCLA wades through damages from pipe flooding	http://www.maysville-online.com/news/national/ucla-wades-through-damages-from-pipe-flooding/article_66d63506-db62-5d79-a3cb-2614aac86e79.html	Ledger Independent	b	d_Q-p40aZkiaA0MhlOffmSW_I6BtM	www.maysville-online.com	1406718951263
398866	UCLA, Sunset Boulevard flooded after enormous water main break	http://theweek.com/speedreads/index/265533/speedreads-ucla-sunset-boulevard-flooded-after-enormous-water-main-break	The Week Magazine	b	d_Q-p40aZkiaA0MhlOffmSW_I6BtM	theweek.com	1406718951680
398867	Pauley Pavilion Damaged After Water Main Break Floods UCLA Campus	http://www.nbclosangeles.com/news/local/UCLA-Pauley-Pavilion-Damaged-After-Water-Main-Break-Floods-Campus-269188211.html	NBC Southern California	b	d_Q-p40aZkiaA0MhlOffmSW_I6BtM	www.nbclosangeles.com	1406718952055
398868	Massive water main breaks floods UCLA campus	http://www.ksat.com/content/pns/ksat/news/2014/07/30/california-ucla-water-main-break.html	KSAT San Antonio	b	d_Q-p40aZkiaA0MhlOffmSW_I6BtM	www.ksat.com	1406718952516
398869	Broken water main floods UCLA; 5 people rescued	http://www.timesleaderonline.com/page/content.detail/id/552271/Broken-water-main-floods-UCLA--5-people-rescued.html\?isap=1&amp;nav=5021	Martins Ferry Times Leader	b	d_Q-p40aZkiaA0MhlOffmSW_I6BtM	www.timesleaderonline.com	1406718952892
398870	Water Main Break Dumps 10 Million Gallons Of Water, Flooding UCLA	http://www.npr.org/blogs/thetwo-way/2014/07/30/336492218/water-main-break-dumps-10-million-gallons-of-water-flooding-ucla	NPR \(blog\)	b	d_Q-p40aZkiaA0MhlOffmSW_I6BtM	www.npr.org	1406718953215
398871	Sunset Boulevard floods as burst water pipe in LA causes water to shoot 20 feet  ...	http://www.independent.co.uk/news/world/americas/sunset-boulevard-floods-as-burst-water-pipe-in-la-causes-water-to-shoot-20-feet-into-the-air-9636730.html	The Independent	b	d_Q-p40aZkiaA0MhlOffmSW_I6BtM	www.independent.co.uk	1406718953616
398872	Water main break floods UCLA campus	http://www.usatoday.com/story/news/nation/2014/07/29/water-main-break-ucla/13342473/	USA TODAY	b	d_Q-p40aZkiaA0MhlOffmSW_I6BtM	www.usatoday.com	1406718953942
398873	Broken water pipe causes flooding at UCLA campus	http://www.cleveland.com/nation/index.ssf/2014/07/broken_water_pipe_causes_flood.html	The Plain Dealer	b	d_Q-p40aZkiaA0MhlOffmSW_I6BtM	www.cleveland.com	1406718954240
398874	Water main breaks, floods UCLA campus	http://www.firstcoastnews.com/story/news/nation/2014/07/29/ucla-water-main-break/13339425/	First Coast News	b	d_Q-p40aZkiaA0MhlOffmSW_I6BtM	www.firstcoastnews.com	1406718954607
398875	UCLA campus flooded after huge water main break	http://fox59.com/2014/07/30/ucla-campus-flooded-after-huge-water-main-break/	Fox 59	b	d_Q-p40aZkiaA0MhlOffmSW_I6BtM	fox59.com	1406718955016
398876	Water main break floods UCLA, Sunset Blvd.	http://www.ky3.com/news/nation/water-main-break-floods-parts-of-sunset-blvd/21049024_27217190	KY3	b	d_Q-p40aZkiaA0MhlOffmSW_I6BtM	www.ky3.com	1406718955422
398877	Sunset Boulevard and UCLA Flooded in Massive Water Main Break	http://time.com/3056044/ucla-los-angeles-flood-i/	TIME	b	d_Q-p40aZkiaA0MhlOffmSW_I6BtM	time.com	1406718955738
398878	Los Angeles water main break floods Sunset Boulevard, UCLA campus	http://www.ketknbc.com/news/los-angeles-water-main-break-floods-sunset-bouleva	KETK	b	d_Q-p40aZkiaA0MhlOffmSW_I6BtM	www.ketknbc.com	1406718956006
398879	WATCH: Water main break near UCLA, floods parts of campus; 5 people rescued	http://www.cjad.com/cjad-news/2014/07/30/watch-water-main-break-near-ucla-floods-parts-of-campus-5-people-rescued	CJAD	b	d_Q-p40aZkiaA0MhlOffmSW_I6BtM	www.cjad.com	1406718956396
398880	Broken Water Main Floods UCLA	http://www.wbal.com/article/108881/21/broken-water-main-floods-ucla	WBAL Radio	b	d_Q-p40aZkiaA0MhlOffmSW_I6BtM	www.wbal.com	1406718956823
398881	Photos: Water Main Break Causes Huge Geyser And Massive Flooding At UCLA	http://laist.com/2014/07/29/photos_water_main_break_causes_huge.php	LAist	b	d_Q-p40aZkiaA0MhlOffmSW_I6BtM	laist.com	1406718957115
398882	VIDEO: Sunset Boulevard descends into chaos as burst water main floods iconic  ...	http://www.irishmirror.ie/news/world-news/video-sunset-boulevard-descends-chaos-3934109	Irish Mirror	b	d_Q-p40aZkiaA0MhlOffmSW_I6BtM	www.irishmirror.ie	1406718957474
398883	5 Things to Know This Morning	http://abcnews.go.com/US/things-morning/story\?id=24768808	ABC News	b	d_Q-p40aZkiaA0MhlOffmSW_I6BtM	abcnews.go.com	1406718957789
398884	Water main break, geyser flood UCLA campus, strand motorists	https://au.news.yahoo.com/thewest/offbeat/a/24589510/water-main-break-geyser-flood-ucla-campus-strand-motorists/	The West Australian	b	d_Q-p40aZkiaA0MhlOffmSW_I6BtM	au.news.yahoo.com	1406718958063
398885	Boogie boards and inflatable boats on Sunset Boulevard after water main bursts	http://www.washingtonpost.com/news/morning-mix/wp/2014/07/30/millions-of-gallons-of-water-flood-ucla/	Washington Post	b	d_Q-p40aZkiaA0MhlOffmSW_I6BtM	www.washingtonpost.com	1406718958427
398886	Water-Main Break Floods UCLA With a Muddy Mess	http://chronicle.com/blogs/ticker/water-main-break-floods-ucla-with-a-muddy-mess/82903	Chronicle of Higher Education \(subscription\) \(blog\)	b	d_Q-p40aZkiaA0MhlOffmSW_I6BtM	chronicle.com	1406718958769
398887	Burst pipe in Los Angeles floods Sunset Boulevard	http://www.bbc.co.uk/news/world-us-canada-28562586	BBC News	b	d_Q-p40aZkiaA0MhlOffmSW_I6BtM	www.bbc.co.uk	1406718959119
398888	Massive Flooding at UCLA After Water Main Bursts	http://www.boston.com/news/nation/2014/07/30/massive-flooding-ucla-after-water-main-bursts/XRShf1kINqsxfYa8tflVxM/story.html	Boston.com	b	d_Q-p40aZkiaA0MhlOffmSW_I6BtM	www.boston.com	1406718959440
398889	100-yr old water main breaks open at UCLA	http://economictimes.indiatimes.com/slideshows/nation-world/100-yr-old-water-main-breaks-open-at-ucla-california/slideshow/39286335.cms	Economic Times	b	d_Q-p40aZkiaA0MhlOffmSW_I6BtM	economictimes.indiatimes.com	1406718959773
398890	Pipe break spews 8 million gallons of water at UCLA	http://hamptonroads.com/2014/07/pipe-break-spews-8-million-gallons-water-ucla	The Virginian-Pilot	b	d_Q-p40aZkiaA0MhlOffmSW_I6BtM	hamptonroads.com	1406718960173
398891	Drivers stranded after water main break in Los Angeles	http://www.wafb.com/story/26146495/drivers-stranded-after-water-main-break-in-los-angeles	WBXH	b	d_Q-p40aZkiaA0MhlOffmSW_I6BtM	www.wafb.com	1406718960609
398892	Sunset Boulevard in Los Angeles turned into a dangerous river	http://www.eturbonews.com/48545/sunset-boulevard-los-angeles-turned-dangerous-river	eTurboNews	b	d_Q-p40aZkiaA0MhlOffmSW_I6BtM	www.eturbonews.com	1406718960914
398893	Sunset Boulevard submerged as burst water pipe sends 30ft geyser flying into  ...	http://www.standard.co.uk/news/world/sunset-boulevard-submerged-as-burst-water-pipe-sends-30ft-geyser-flying-into-the-air-9636923.html	Evening Standard	b	d_Q-p40aZkiaA0MhlOffmSW_I6BtM	www.standard.co.uk	1406718961249
398894	Landslide hits Indian village, 150 may be trapped	http://www.kswo.com/story/26147111/landslide-hits-indian-village-150-may-be-trapped	KSWO	b	d_Q-p40aZkiaA0MhlOffmSW_I6BtM	www.kswo.com	1406718961740
398895	Water Main Break Floods UCLA	http://www.wfmynews2.com/story/news/weird/2014/07/29/water-main-break-floods-ucla/13347197/	WFMY News 2	b	d_Q-p40aZkiaA0MhlOffmSW_I6BtM	www.wfmynews2.com	1406718962302
398896	Water Main Break Floods Parts Of UCLA Campus	http://www.10tv.com/content/stories/2014/07/30/cbs-ucla-water-main-break.html	10TV	b	d_Q-p40aZkiaA0MhlOffmSW_I6BtM	www.10tv.com	1406718962736
398897	The 10 Most Important Things In The World Right Now	http://www.businessinsider.in/The-10-Most-Important-Things-In-The-World-Right-Now/articleshow/39289696.cms	Businessinsider India	b	d_Q-p40aZkiaA0MhlOffmSW_I6BtM	www.businessinsider.in	1406718963122
398898	Libyan official: Assailants abduct, free lawmaker	http://www.kswo.com/story/26147501/libyan-official-assailants-abduct-free-lawmaker	KSWO	b	d_Q-p40aZkiaA0MhlOffmSW_I6BtM	www.kswo.com	1406718963500
398899	Flooding in UCLA	http://www.thestandard.com.hk/breaking_news_detail.asp\?id=52288&amp;icid=a&amp;d_str=	Hong Kong Standard	b	d_Q-p40aZkiaA0MhlOffmSW_I6BtM	www.thestandard.com.hk	1406718963767
398900	Westwood Broken Water Main Shut Off; Sunset Blvd Remains Closed	http://www.myfoxchicago.com/story/26145045/water-main-break-in-westwood-causing-flooding-in-the-area-now-shut-off-ucla	MyFox Chicago	b	d_Q-p40aZkiaA0MhlOffmSW_I6BtM	www.myfoxchicago.com	1406718964107
