98001	Heartbleed Will Go On Even After The Updates	http://www.insurancetech.com/security/heartbleed-will-go-on-even-after-the-upd/240167008	Insurance \& Technology	t	dpgoV2Jk4L0oFIM1M5Sj7PHn9yq2M	www.insurancetech.com	1397236033777
98002	Heartbleed Bug Puts Servers and Personal Information At Risk	http://www.wsav.com/story/25218562/heartbleed-bug-puts-servers-and-personal-information-at-risk	WSAV-TV	t	dpgoV2Jk4L0oFIM1M5Sj7PHn9yq2M	www.wsav.com	1397236033994
98003	'Heartbleed' Bug: What You Can Do to Protect Yourself	http://www.wdio.com/article/stories/S3396008.shtml\?cat=10335	WDIO-TV	t	dpgoV2Jk4L0oFIM1M5Sj7PHn9yq2M	www.wdio.com	1397236034338
98004	Heartbleed internet breach wider than anticipated	http://enca.com/technology/heartbleed-internet-breach-wider-anticipated	eNCA	t	dpgoV2Jk4L0oFIM1M5Sj7PHn9yq2M	enca.com	1397236034662
98005	What is the Heartbleed bug threatening Internet users everywhere?	http://www.gmanetwork.com/news/story/356499/scitech/technology/what-is-the-heartbleed-bug-threatening-internet-users-everywhere	GMA News	t	dpgoV2Jk4L0oFIM1M5Sj7PHn9yq2M	www.gmanetwork.com	1397236034913
98006	'That little gold lock has been picked'	http://thecorknews.ie/articles/little-gold-lock-has-been-picked-14323	Cork News	t	dpgoV2Jk4L0oFIM1M5Sj7PHn9yq2M	thecorknews.ie	1397236035155
98007	Heartbleed bug a 'major threat'	http://www.thestar.co.uk/news/business/heartbleed-bug-a-major-threat-1-6555089	The Star	t	dpgoV2Jk4L0oFIM1M5Sj7PHn9yq2M	www.thestar.co.uk	1397236035426
98008	Heartbleed security bug: what can you do?	http://www.smh.com.au/it-pro/security-it/heartbleed-security-bug-what-can-you-do-20140411-zqtff.html	Sydney Morning Herald	t	dpgoV2Jk4L0oFIM1M5Sj7PHn9yq2M	www.smh.com.au	1397236035660
98009	HeartBleed Bug - What should I do?	http://www.coolage.in/2014/04/11/heartbleed-bug-what-should-i-do/	AOL	t	dpgoV2Jk4L0oFIM1M5Sj7PHn9yq2M	www.coolage.in	1397236036380
98010	Heartbleed bug affects Internet security	http://www.dailytoreador.com/news/article_b9c14472-c127-11e3-afd3-001a4bcf6878.html	The Daily Toreador \(registration\)	t	dpgoV2Jk4L0oFIM1M5Sj7PHn9yq2M	www.dailytoreador.com	1397236036712
98011	Security bug Heartbleed takes over Internet	http://www.channel3000.com/news/security-bug-heartbleed-takes-over-internet/25425832	WISC Madison	t	dpgoV2Jk4L0oFIM1M5Sj7PHn9yq2M	www.channel3000.com	1397236036961
98012	Heartbleed Bug: 368 Cloud Services Are Still Dangerous But This Simple Trick  ...	http://www.businessinsider.in/Heartbleed-Bug-368-Cloud-Services-Are-Still-Dangerous-But-This-Simple-Trick-Will-Protect-You/articleshow/33568783.cms	Businessinsider India	t	dpgoV2Jk4L0oFIM1M5Sj7PHn9yq2M	www.businessinsider.in	1397236037464
98013	Heartbleed: What You Need to Know About the Security Fiasco in 3 Minutes or  ...	http://www.cio.com/article/751366/Heartbleed_What_You_Need_to_Know_About_the_Security_Fiasco_in_3_Minutes_or_Less	CIO	t	dpgoV2Jk4L0oFIM1M5Sj7PHn9yq2M	www.cio.com	1397236037670
98014	Apple claims its was not affected by Heartbleed security bug	http://news.en.softonic.com/apple-not-affected-by-heartbleed-bug	Softonic EN	t	dpgoV2Jk4L0oFIM1M5Sj7PHn9yq2M	news.en.softonic.com	1397236037901
98015	Man who introduced serious 'Heartbleed' security flaw denies he inserted it  ...	http://www.smh.com.au/it-pro/security-it/man-who-introduced-serious-heartbleed-security-flaw-denies-he-inserted-it-deliberately-20140410-zqta1.html	Sydney Morning Herald	t	dpgoV2Jk4L0oFIM1M5Sj7PHn9yq2M	www.smh.com.au	1397236038414
98016	Networking Equipment Makers Scramble to Patch Heartbleed	http://mashable.com/2014/04/10/heartbleed-networking-routers/	Mashable	t	dpgoV2Jk4L0oFIM1M5Sj7PHn9yq2M	mashable.com	1397236038774
98017	Heartbleed Bug Won't Kill The Internet	http://www.ibtimes.com/heartbleed-bug-wont-kill-internet-1570365	International Business Times	t	dpgoV2Jk4L0oFIM1M5Sj7PHn9yq2M	www.ibtimes.com	1397236038960
98018	Heartbleed live chat replay: Q & A	http://www.kgw.com/news/Heartbleed-live-chat-Your-questions-answered-254804661.html	kgw.com	t	dpgoV2Jk4L0oFIM1M5Sj7PHn9yq2M	www.kgw.com	1397236039187
98019	Facebook Unfriends In-App Mobile Messaging	http://www.informationweek.com/software/social/facebook-unfriends-in-app-mobile-messaging/d/d-id/1204379	InformationWeek	t	dS32ZXYU2ZNEzRME0TpbqdqPexgLM	www.informationweek.com	1397236343130
98020	FTC Officially Approves Facebook's Acquisition Of WhatsApp, With Stern Warning	http://allfacebook.com/ftc-officially-approves-whatsapp-acquisition_b130803	AllFacebook	t	dS32ZXYU2ZNEzRME0TpbqdqPexgLM	allfacebook.com	1397236343365
98021	Why Facebook Wants To Separate Messaging From Its Mobile App	http://www.trefis.com/stock/fb/articles/234165/marywhy-facebook-wants-to-separate-messaging-from-its-mobile-app/2014-04-11	Trefis	t	dS32ZXYU2ZNEzRME0TpbqdqPexgLM	www.trefis.com	1397236343642
98022	Facebook WhatsApp Acquisition Approved By FTC With Privacy Warning	http://www.redorbit.com/news/technology/1113119271/facebook-whatsapp-purchase-given-the-ok-by-ftc-041114/	RedOrbit	t	dS32ZXYU2ZNEzRME0TpbqdqPexgLM	www.redorbit.com	1397236343850
98023	FTC Warns Facebook Not To Violate WhatsApp Users' Privacy	http://www.autoworldnews.com/articles/6982/20140411/ftc-warns-facebook-not-to-violate-whatsapp-users-privacy.htm	Auto World News	t	dS32ZXYU2ZNEzRME0TpbqdqPexgLM	www.autoworldnews.com	1397236344028
98024	Social Media Today: FTC OKs Facebook Acquisition, New Twitter Alerts	http://philadelphia.cbslocal.com/2014/04/11/social-media-today-ftc-oks-facebook-acquisition-new-twitter-alerts/	CBS Local	t	dS32ZXYU2ZNEzRME0TpbqdqPexgLM	philadelphia.cbslocal.com	1397236344313
98025	Facebook to pull Messages from app	http://www.ksdk.com/story/news/nation/2014/04/11/facebook-messenger-app/7593481/	KSDK	t	dS32ZXYU2ZNEzRME0TpbqdqPexgLM	www.ksdk.com	1397236344556
98026	FTC Gives The Go-Ahead To Facebook Inc (FB), WhatsApp Merger	http://www.valuewalk.com/2014/04/facebook-inc-fb-whatsapp-merger-ftc/	ValueWalk	t	dS32ZXYU2ZNEzRME0TpbqdqPexgLM	www.valuewalk.com	1397236344774
98027	Facebook's dodgy privacy record prompts FTC warning over WhatsApp buy	http://www.fiercemobileit.com/story/facebooks-dodgy-privacy-record-prompts-extraordinary-ftc-warning-over-whats/2014-04-11	FierceMobileIT	t	dS32ZXYU2ZNEzRME0TpbqdqPexgLM	www.fiercemobileit.com	1397236344959
98028	FTC OKs Facebook-WhatsApp deal, warns both to honor privacy promises	http://www.upi.com/Business_News/2014/04/11/FTC-OKs-Facebook-WhatsApp-deal-warns-both-to-honor-privacy-promises/4431397225756/\?spt=hts&amp;or=7	UPI.com	t	dS32ZXYU2ZNEzRME0TpbqdqPexgLM	www.upi.com	1397236345173
98029	Federal Trade Commission clears Facebook's WhatsApp deal, but demands  ...	http://www.cbronline.com/news/social/ftc-clears-facebooks-whatsapp-deal-warns-on-user-privacy-breaches-110414-4212971	Computer Business Review	t	dS32ZXYU2ZNEzRME0TpbqdqPexgLM	www.cbronline.com	1397236345445
98030	US warns Facebook on privacy in WhatsApp mega deal	http://economictimes.indiatimes.com/news/international/business/us-warns-facebook-on-privacy-in-whatsapp-mega-deal/articleshow/33581889.cms	Economic Times	t	dS32ZXYU2ZNEzRME0TpbqdqPexgLM	economictimes.indiatimes.com	1397236345653
98031	Facebook Pulling Messages From its Main App	http://www.fool.com/investing/general/2014/04/11/facebook-pulling-messages-from-its-main-app.aspx	Motley Fool	t	dS32ZXYU2ZNEzRME0TpbqdqPexgLM	www.fool.com	1397236345873
98032	Facebook to remove chat features from app, use Messenger instead	http://www.dnaindia.com/scitech/report-facebook-to-remove-chat-features-from-app-use-messenger-instead-1977440	Daily News \& Analysis	t	dS32ZXYU2ZNEzRME0TpbqdqPexgLM	www.dnaindia.com	1397236346082
98033	Regulators clear Facebook, WhatsApp deal with privacy caveat	http://www.bizjournals.com/sanjose/news/2014/04/11/regulators-clear-facebook-whatsapp-deal-with.html	Silicon Valley Business Journal	t	dS32ZXYU2ZNEzRME0TpbqdqPexgLM	www.bizjournals.com	1397236346334
98034	US will force Facebook to protect WhatsApp user privacy	http://www.engadget.com/2014/04/11/ftc-facebook-whatsapp-privacy/	Engadget	t	dS32ZXYU2ZNEzRME0TpbqdqPexgLM	www.engadget.com	1397236346526
98035	Facebook kills app messaging in Europe to push standalone Messenger	http://www.telecoms.com/246012/facebook-kills-app-messaging-in-europe-to-push-standalone-messenger/	Telecoms.com	t	dS32ZXYU2ZNEzRME0TpbqdqPexgLM	www.telecoms.com	1397236346713
98036	FTC Reminds Facebook to Honor WhatsApp Privacy Pledges	http://www.thestreet.com/story/12666795/1/ftc-reminds-facebook-to-honor-whatsapp-privacy-pledges.html	TheStreet.com	t	dS32ZXYU2ZNEzRME0TpbqdqPexgLM	www.thestreet.com	1397236346946
98037	Facebook To Strip Mobile of Chat, Plans Standalone App	http://www.cruxialcio.com/facebook-strip-mobile-chat-plans-standalone-app-6316	CruxialCIO	t	dS32ZXYU2ZNEzRME0TpbqdqPexgLM	www.cruxialcio.com	1397236347149
98038	FTC warns Facebook, WhatsApp to respect users' privacy	http://www.totaltele.com/view.aspx\?ID=486089	Total Telecom	t	dS32ZXYU2ZNEzRME0TpbqdqPexgLM	www.totaltele.com	1397236347418
98039	FTC Clears Facebook Inc (NASDAQ:FB) WhatsApp Acquisition	http://ustrademedia.com/ftc-clears-facebook-inc-nasdaqfb-whatsapp-acquisition-3854.html	US Trade Media	t	dS32ZXYU2ZNEzRME0TpbqdqPexgLM	ustrademedia.com	1397236347660
98040	FTC Conditional Fine With Facebook Inc (NASDAQ:FB) Acquiring WhatsApp	http://www.financialstrend.com/ftc-conditional-fine-with-facebook-inc-nasdaqfb-acquiring-whatsapp-17265.html	FinancialsTrend	t	dS32ZXYU2ZNEzRME0TpbqdqPexgLM	www.financialstrend.com	1397236347879
98041	FTC approval of Facebook's WhatsApp acquisition comes with a privacy warning	http://www.techspot.com/news/56354-ftc-approval-of-facebooks-whatsapp-acquisition-comes-with-a-privacy-warning.html	TechSpot	t	dS32ZXYU2ZNEzRME0TpbqdqPexgLM	www.techspot.com	1397236348097
98042	Facebook: WhatsApp deal cleared by regulators	http://nypost.com/2014/04/11/facebook-whatsapp-deal-cleared-by-regulators/	New York Post	t	dS32ZXYU2ZNEzRME0TpbqdqPexgLM	nypost.com	1397236348348
98043	FTC Warns Facebook, WhatsApp to Honor Privacy Promises	http://www.pcmag.com/article2/0,2817,2456395,00.asp	PC Magazine	t	dS32ZXYU2ZNEzRME0TpbqdqPexgLM	www.pcmag.com	1397236348566
98044	Regulators warn Facebook, WhatsApp to keep privacy promises	http://www.abplive.in/gadget/2014/04/11/article293234.ece/Regulators-warn-Facebook-WhatsApp-to-keep-privacy-promises	ABP News	t	dS32ZXYU2ZNEzRME0TpbqdqPexgLM	www.abplive.in	1397236348777
98045	FTC Okays Facebook's Acquisition Of WhatsApp, But Warns Companies To  ...	http://www.mediapost.com/publications/article/223438/ftc-okays-facebooks-acquisition-of-whatsapp-but.html	MediaPost Communications	t	dS32ZXYU2ZNEzRME0TpbqdqPexgLM	www.mediapost.com	1397236349010
98046	Facebook and WhatsApp told to stand by commitments on privacy	http://www.ciol.com/ciol/news/212875/facebook-whatsapp-told-stand-commitments-privacy	CIOL	t	dS32ZXYU2ZNEzRME0TpbqdqPexgLM	www.ciol.com	1397236349346
98047	Tech Five: FTC clears Facebook deal for WhatsApp; Amazon's acquisition	http://americasmarkets.usatoday.com/2014/04/11/tech-five-ftc-clears-facebook-deal-for-whatsapp-amazons-acquisition/	USA TODAY	t	dS32ZXYU2ZNEzRME0TpbqdqPexgLM	americasmarkets.usatoday.com	1397236349573
98048	US Regulators Warn Facebook, WhatsApp to Keep Privacy Promises	http://www.siliconindia.com/news/technology/US-Regulators-Warn-Facebook-WhatsApp-to-Keep-Privacy-Promises-nid-165064-cid-2.html	Siliconindia.com	t	dS32ZXYU2ZNEzRME0TpbqdqPexgLM	www.siliconindia.com	1397236349790
98049	Why we do (and don't) like Facebook's Messenger app	http://features.en.softonic.com/why-we-do-and-dont-like-facebooks-messenger-app	Softonic EN	t	dS32ZXYU2ZNEzRME0TpbqdqPexgLM	features.en.softonic.com	1397236350001
98050	FTC warns Facebook, Whatsapp against privacy violations post acquisition	http://www.aninews.in/newsdetail3/story163658/ftc-warns-facebook-whatsapp-against-privacy-violations-post-acquisition.html	ANINEWS	t	dS32ZXYU2ZNEzRME0TpbqdqPexgLM	www.aninews.in	1397236350197
98051	Facebook says WhatsApp deal cleared	http://www.itweb.co.za/index.php\?option=com_content&amp;view=article&amp;id=111732:Facebook-says-WhatsApp-deal-cleared	ITWeb	t	dS32ZXYU2ZNEzRME0TpbqdqPexgLM	www.itweb.co.za	1397236350521
98052	FTC: OK Facebook, swallow WhatsApp – but NO selling people's data without  ...	http://www.theregister.co.uk/2014/04/11/facebook_whatsapp_ftc_approval/	Register	t	dS32ZXYU2ZNEzRME0TpbqdqPexgLM	www.theregister.co.uk	1397236350713
98053	US regulators warn Facebook, WhatsApp to keep privacy promise	http://www.livemint.com/Companies/LEAkredAUu3il1FamCLkfK/US-regulators-warn-Facebook-WhatsApp-to-keep-privacy-promis.html	Livemint	t	dS32ZXYU2ZNEzRME0TpbqdqPexgLM	www.livemint.com	1397236350899
98054	WhatsApp and Facebook's Deal confirmed by FTC	http://www.techsonian.com/whatsapp-and-facebooks-deal-confirmed-by-ftc/12163877/	Techsonian \(press release\)	t	dS32ZXYU2ZNEzRME0TpbqdqPexgLM	www.techsonian.com	1397236351134
98055	Is Facebook making it easier on users with new messaging app requirement?	http://www.techtimes.com/articles/5431/20140411/is-facebook-making-it-easier-on-users-with-new-messaging-app-requirement.htm	Tech Times	t	dS32ZXYU2ZNEzRME0TpbqdqPexgLM	www.techtimes.com	1397236351409
98056	Facebook, WhatsApp warned against privacy violations post acquisition	http://www.bgr.in/news/facebook-whatsapp-warned-against-privacy-violations-post-acquisition/	BGR India	t	dS32ZXYU2ZNEzRME0TpbqdqPexgLM	www.bgr.in	1397236351602
98057	Facebook share price: FTC clears WhatsApp acquisition	http://invezz.com/news/equities/10307-facebook-share-price-ftc-clears-whatsapp-acquisition	iNVEZZ	t	dS32ZXYU2ZNEzRME0TpbqdqPexgLM	invezz.com	1397236351834
98058	Facebook to push Messenger by cutting chat from core app	http://www.cable.co.uk/news/facebook-to-push-messenger-by-cutting-chat-from-core-app-801711857/	Cable.co.uk	t	dS32ZXYU2ZNEzRME0TpbqdqPexgLM	www.cable.co.uk	1397236352071
98059	Why can't I send Facebook messages from my phone? Site confirms separate  ...	http://metro.co.uk/2014/04/11/facebook-confirms-it-will-be-rolling-out-separate-messaging-app-4695784/	Metro	t	dS32ZXYU2ZNEzRME0TpbqdqPexgLM	metro.co.uk	1397236352390
98060	US regulators approve Facebook's acquisition of Whatsapp	http://pctechmag.com/2014/04/us-regulators-approve-facebooks-acquisition-of-whatsapp/	PC Tech Magazine	t	dS32ZXYU2ZNEzRME0TpbqdqPexgLM	pctechmag.com	1397236352625
98061	US regulators warn FB, WhatsApp privacy promises	http://www.ptinews.com/news/4598086_US-regulators-warn-FB--WhatsApp-privacy-promises-.html	Press Trust of India	t	dS32ZXYU2ZNEzRME0TpbqdqPexgLM	www.ptinews.com	1397236352860
98062	US regulators approve Facebook's WhatsApp acquisition	http://www.humanipo.com/news/42591/us-regulators-approve-facebooks-whatsapp-acquisition/	HumanIPO	t	dS32ZXYU2ZNEzRME0TpbqdqPexgLM	www.humanipo.com	1397236353045
98063	Facebook to turn off mobile chat feature	http://money.aol.co.uk/2014/04/11/facebook-to-turn-off-mobile-chat-feature/	Aol Money	t	dS32ZXYU2ZNEzRME0TpbqdqPexgLM	money.aol.co.uk	1397236353406
98064	Regulators greenlight Facebook-WhatsApp deal	http://businesstech.co.za/news/internet/55586/regulators-greenlight-facebook-whatsapp-deal/	BusinessTech	t	dS32ZXYU2ZNEzRME0TpbqdqPexgLM	businesstech.co.za	1397236353765
98065	Facebook says WhatsApp deal cleared by FTC	http://profit.ndtv.com/news/corporates/article-facebook-says-whatsapp-deal-cleared-by-ftc-385276	NDTV	t	dS32ZXYU2ZNEzRME0TpbqdqPexgLM	profit.ndtv.com	1397236354008
98066	US warns Facebook on privacy in WhatsApp deal	http://www.emirates247.com/news/us-warns-facebook-on-privacy-in-whatsapp-deal-2014-04-11-1.545195	Emirates 24\/7	t	dS32ZXYU2ZNEzRME0TpbqdqPexgLM	www.emirates247.com	1397236354293
98067	US warns Facebook on WhatsApp privacy	http://www.news24.com/Technology/News/US-warns-Facebook-on-WhatsApp-privacy-20140410	News24	t	dS32ZXYU2ZNEzRME0TpbqdqPexgLM	www.news24.com	1397236354561
98068	Facebook:Users are encouraged to install Messenger app by removing chat	http://thefadaily.com/technology-22/facebook-users-are-encouraged-to-install-messenger-app-by-removing-chat-693.html	The FA Daily	t	dS32ZXYU2ZNEzRME0TpbqdqPexgLM	thefadaily.com	1397236354858
98069	Facebook to delink messenger from iOS and Android apps	http://www.emirates247.com/business/facebook-to-delink-messenger-from-ios-and-android-apps-2014-04-11-1.545186	Emirates 24\/7	t	dS32ZXYU2ZNEzRME0TpbqdqPexgLM	www.emirates247.com	1397236355035
98070	Facebook Messenger update adds free VoIP calling on Android and iOS  ...	http://thefadaily.com/technology-22/facebook-messenger-update-adds-free-voip-calling-on-android-and-ios-everywhere-684.html	The FA Daily	t	dS32ZXYU2ZNEzRME0TpbqdqPexgLM	thefadaily.com	1397236355233
98071	WhatsApp Must Keep Privacy Promise to Users, FTC Warns	http://www.technobuffalo.com/2014/04/10/whatsapp-must-keep-privacy-promise-to-users-ftc-warns/	TechnoBuffalo	t	dS32ZXYU2ZNEzRME0TpbqdqPexgLM	www.technobuffalo.com	1397236355426
98072	FTC Warns Facebook, WhatsApp On User Privacy	http://www.rttnews.com/2300657/ftc-warns-facebook-whatsapp-on-user-privacy.aspx\?type=bn	RTT News	t	dS32ZXYU2ZNEzRME0TpbqdqPexgLM	www.rttnews.com	1397236355627
98073	Feds to Facebook: Hands Off WhatsApp Data	http://www.nextgov.com/mobile/2014/04/feds-facebook-hands-whatsapp-data/82312/\?oref=ng-HPriver	Nextgov	t	dS32ZXYU2ZNEzRME0TpbqdqPexgLM	www.nextgov.com	1397236355896
98074	Feds to Facebook: Hands Off WhatsApp Data // April 10, 2014	http://www.nextgov.com/mobile/2014/04/feds-facebook-hands-whatsapp-data/82312/\?oref=ng-dropdown	Nextgov	t	dS32ZXYU2ZNEzRME0TpbqdqPexgLM	www.nextgov.com	1397236356138
98075	US authorities makes strict privacy ruling on FB's WhatsApp deal	http://www.marketing-interactive.com/us-authorities-makes-strict-privacy-ruling-fbs-whatsapp-deal/	Marketing Interactive	t	dS32ZXYU2ZNEzRME0TpbqdqPexgLM	www.marketing-interactive.com	1397236356330
98076	Facebook's purchase of WhatsApp gets US approval - and a warning	http://gadgets.ndtv.com/apps/news/facebooks-purchase-of-whatsapp-gets-us-approval-and-a-warning-507068	NDTV	t	dS32ZXYU2ZNEzRME0TpbqdqPexgLM	gadgets.ndtv.com	1397236356533
98077	Facebook plans to strip messaging from its mobile apps; forces you to install  ...	http://thefadaily.com/technology-22/facebook-plans-to-strip-messaging-from-its-mobile-apps-forces-you-to-install-facebook-messenger-683.html	The FA Daily	t	dS32ZXYU2ZNEzRME0TpbqdqPexgLM	thefadaily.com	1397236356830
98078	FTC Notifies Facebook, WhatsApp of Privacy Obligations	http://www.newsroomamerica.com/story/416601/ftc_notifies_facebook_whatsapp_of_privacy_obligations_.html	Newsroom America	t	dS32ZXYU2ZNEzRME0TpbqdqPexgLM	www.newsroomamerica.com	1397236357032
98079	WhatsApp deal cleared by Federal Trade Commission says Facebook	http://post.jagran.com/whatsapp-deal-cleared-by-federal-trade-commission-says-facebook-1397188250	Jagran Post	t	dS32ZXYU2ZNEzRME0TpbqdqPexgLM	post.jagran.com	1397236357296
98080	FTC Clears Facebook-WhatsApp Deal, With a Caveat	https://blogs.wsj.com/digits/2014/04/10/ftc-clears-facebook-whatsapp-deal-with-a-caveat/	Wall Street Journal \(blog\)	t	dS32ZXYU2ZNEzRME0TpbqdqPexgLM	blogs.wsj.com	1397236357506
98081	US warns Facebook on changing its privacy policy in WhatsApp mega deal	http://www.mid-day.com/articles/us-warns-facebook-on-changing-its-privacy-policy-in-whatsapp-mega-deal/15223062	Mid-Day	t	dS32ZXYU2ZNEzRME0TpbqdqPexgLM	www.mid-day.com	1397236357920
98082	Facebook 'forces' its users to install Messenger app	http://economictimes.indiatimes.com/panache/facebook-forces-its-users-to-install-messenger-app/articleshow/33589451.cms	Economic Times	t	dS32ZXYU2ZNEzRME0TpbqdqPexgLM	economictimes.indiatimes.com	1397236358135
98083	Facebook will make its Messenger app mandatory for mobile chat (+video)	http://www.csmonitor.com/Innovation/Horizons/2014/0410/Facebook-will-make-its-Messenger-app-mandatory-for-mobile-chat-video	Christian Science Monitor	t	dS32ZXYU2ZNEzRME0TpbqdqPexgLM	www.csmonitor.com	1397236358334
98084	FTC warns Facebook to maintain WhatsApp privacy standards - Sir, yes sir!	http://www.techtimes.com/articles/5445/20140410/ftc-warns-facebook-to-maintain-whatsapp-privacy-standards-sir-yes-sir.htm	Tech Times	t	dS32ZXYU2ZNEzRME0TpbqdqPexgLM	www.techtimes.com	1397236358555
98085	FTC warns Facebook and WhatsApp over privacy concerns	http://www.itwire.com/government-tech-news/technology-regulation/63718-us-warns-facebook-and-whatsapp-over-privacy-concerns	iTWire	t	dS32ZXYU2ZNEzRME0TpbqdqPexgLM	www.itwire.com	1397236358884
98086	Facebook Inc (FB) Receives FTC Approval to Acquire WhatsApp	http://www.opptrends.com/2014/04/facebook-inc-fb-receives-ftc-approval-to-acquire-whatsapp/	Opptrends	t	dS32ZXYU2ZNEzRME0TpbqdqPexgLM	www.opptrends.com	1397236359136
98087	FTC to Facebook: Stick to your promises after buying WhatsApp	http://www.fierceenterprisecommunications.com/story/ftc-facebook-stick-your-promises-after-buying-whatsapp/2014-04-10	FierceEnterpriseCommunications	t	dS32ZXYU2ZNEzRME0TpbqdqPexgLM	www.fierceenterprisecommunications.com	1397236359351
98088	Facebook-WhatsApp deal cleared by FTC	http://www.businessspectator.com.au/news/2014/4/11/technology/facebook-whatsapp-deal-cleared-ftc	Business Spectator	t	dS32ZXYU2ZNEzRME0TpbqdqPexgLM	www.businessspectator.com.au	1397236359519
98089	Facebook Inc (FB): FTC approves of $19B WhatsApp acquisition	http://pulse2.com/2014/04/10/facebook-inc-fb-ftc-approves-of-19b-whatsapp-acquisition-107376/	Pulse 2.0	t	dS32ZXYU2ZNEzRME0TpbqdqPexgLM	pulse2.com	1397236359907
98090	Facebook gets FTC approval and privacy warning for WhatsApp deal	http://www.afr.com/p/technology/facebook_gets_ftc_approval_and_privacy_iiEPwse2BLwT63ei3fOAyH	The Australian Financial Review	t	dS32ZXYU2ZNEzRME0TpbqdqPexgLM	www.afr.com	1397236360117
98091	FTC staff to Facebook and WhatsApp: Privacy promises prevail	http://www.yumanewsnow.com/index.php/news/latest/5946-ftc-staff-to-facebook-and-whatsapp-privacy-promises-prevail	Yumanewsnow	t	dS32ZXYU2ZNEzRME0TpbqdqPexgLM	www.yumanewsnow.com	1397236360310
98092	FTC Notifies Facebook, WhatsApp of Privacy Obligations in Light of Proposed  ...	http://www.imperialvalleynews.com/index.php/news/latest-news/8071-ftc-notifies-facebook-whatsapp-of-privacy-obligations-in-light-of-proposed-acquisition.html	Imperial Valley News	t	dS32ZXYU2ZNEzRME0TpbqdqPexgLM	www.imperialvalleynews.com	1397236360503
98093	US warns Facebook on privacy changes	http://www.skynews.com.au/tech/article.aspx\?id=966504	Sky News Australia	t	dS32ZXYU2ZNEzRME0TpbqdqPexgLM	www.skynews.com.au	1397236360680
98094	FTC clears Facebook's WhatsApp deal, but warns on data collection	http://www.pcworld.com/article/2142520/ftc-implores-whatsapp-to-keep-its-promises-on-privacy-in-facebook-deal.html	PCWorld	t	dS32ZXYU2ZNEzRME0TpbqdqPexgLM	www.pcworld.com	1397236361048
98095	FTC approves $19B Facebook-WhatsApp deal — with a caveat	http://www.insidefacebook.com/2014/04/10/ftc-approves-19b-facebook-whatsapp-deal-with-a-caveat/	Inside Facebook	t	dS32ZXYU2ZNEzRME0TpbqdqPexgLM	www.insidefacebook.com	1397236361255
98096	Facebook's WhatsApp deal approved by US despite privacy concerns	http://mybroadband.co.za/news/business/100470-facebooks-whatsapp-deal-approved-by-us-despite-privacy-concerns.html	MyBroadband	t	dS32ZXYU2ZNEzRME0TpbqdqPexgLM	mybroadband.co.za	1397236361426
98097	FTC Says Facebook Will Need Permission From WhatsAppers To Use Their Data	http://techcrunch.com/2014/04/10/whatsapp-privacy/	TechCrunch	t	dS32ZXYU2ZNEzRME0TpbqdqPexgLM	techcrunch.com	1397236361650
98098	Facebook Told Not To Mess With WhatsApp Privacy Settings	http://www.huffingtonpost.com/2014/04/10/facebook-whatsapp-privacy_n_5127608.html\?utm_hp_ref=technology	Huffington Post	t	dS32ZXYU2ZNEzRME0TpbqdqPexgLM	www.huffingtonpost.com	1397236361983
98099	FTC to Facebook: Don't Screw with User Privacy After WhatsApp Acquisition	http://www.webpronews.com/ftc-to-facebook-dont-screw-with-user-privacy-after-whatsapp-acquisition-2014-04	WebProNews	t	dS32ZXYU2ZNEzRME0TpbqdqPexgLM	www.webpronews.com	1397236362219
98100	FTC Implores Whatsapp to Keep its Promises on Privacy in Facebook Deal	http://www.cio.com/article/751360/FTC_Implores_Whatsapp_to_Keep_its_Promises_on_Privacy_in_Facebook_Deal	CIO	t	dS32ZXYU2ZNEzRME0TpbqdqPexgLM	www.cio.com	1397236362925
