159801	Mark April 24 as national mourning day: rights activists	http://www.thedailystar.net/mark-april-24-as-national-mourning-day-rights-activists-21165	The Daily Star	b	dVSyQTtV6UtRCTMcxhoiVo9jFnNdM	www.thedailystar.net	1398396068378
159802	Compensation for Bangladesh garment factory victims	http://www.enca.com/world/compensation-bangladesh-garment-factory-victims	eNCA	b	dVSyQTtV6UtRCTMcxhoiVo9jFnNdM	www.enca.com	1398396068561
159803	Bangladesh Factory Victims Get Money Ahead of Anniversary	http://www.industryweek.com/compensation-strategies/bangladesh-factory-victims-get-money-ahead-anniversary	IndustryWeek	b	dVSyQTtV6UtRCTMcxhoiVo9jFnNdM	www.industryweek.com	1398396068881
159804	Bangladesh: One Year After Rana Plaza, Problems Linger	http://thediplomat.com/2014/04/bangladesh-one-year-after-rana-plaza-problems-linger/	the Diplomat	b	dVSyQTtV6UtRCTMcxhoiVo9jFnNdM	thediplomat.com	1398396069105
159805	Bangladesh factory collapse victims get compensation ahead of anniversary	http://www.abc.net.au/news/2014-04-23/an-bangladesh-factory-collapse-compensation/5405244	ABC Online	b	dVSyQTtV6UtRCTMcxhoiVo9jFnNdM	www.abc.net.au	1398396069312
159806	Fatema holds a picture of her son Nurul Karim as she poses for a photograph in  ...	http://www.trust.org/item/20140422102927-1hb5e/\?source=hptop	TrustLaw	b	dVSyQTtV6UtRCTMcxhoiVo9jFnNdM	www.trust.org	1398396069503
159807	One Year After the Rana Plaza Catastrophe : Slow Progress and Insufficient  ...	http://www.fidh.org/en/globalisation-human-rights/15179-one-year-after-the-rana-plaza-catastrophe-slow-progress-and-insufficient	FIDH	b	dVSyQTtV6UtRCTMcxhoiVo9jFnNdM	www.fidh.org	1398396069845
159808	Prospects and challenges of garment industry	http://www.thedailystar.net/prospects-and-challenges-of-garment-industry-21008	The Daily Star	b	dVSyQTtV6UtRCTMcxhoiVo9jFnNdM	www.thedailystar.net	1398396070056
159809	The Fashion Industry Commemorates One-Year Anniversary of the Rana Plaza  ...	http://www.virtualpressoffice.com/publicsiteContentFileAccess\?fileContentId=1583910&amp;fromOtherPageToDisableHistory=Y&amp;menuName=News&amp;sId=&amp;sInfo=	Virtual Press Office \(press release\)	b	dVSyQTtV6UtRCTMcxhoiVo9jFnNdM	www.virtualpressoffice.com	1398396070264
159810	ILO Deputy Director-General Gilbert Houngbou arrives in Dhaka	http://bdnews24.com/bangladesh/2014/04/22/ilo-official-in-dhaka	Bangladesh News 24 hours	b	dVSyQTtV6UtRCTMcxhoiVo9jFnNdM	bdnews24.com	1398396070516
159811	US concerned over labour rights and workplace safety in Bangladesh	http://zeenews.india.com/news/world/us-concerned-over-labour-rights-and-workplace-safety-in-b-desh_926271.html	Zee News	b	dVSyQTtV6UtRCTMcxhoiVo9jFnNdM	zeenews.india.com	1398396070963
159812	One year on, 'Rana Plaza disaster' survivors struggle to rebuild lives Apr 22, 8:30  ...	http://www.aninews.in/videogallery9/22602-one-year-on-039-rana-plaza-disaster-039-survivors-struggle-to-rebuild-lives.html	ANINEWS	b	dVSyQTtV6UtRCTMcxhoiVo9jFnNdM	www.aninews.in	1398396071231
159813	US: Safety lacking after Bangladesh factory disaster	http://www.themalaymailonline.com/world/article/us-safety-lacking-after-bangladesh-factory-disaster	The Malay Mail Online	b	dVSyQTtV6UtRCTMcxhoiVo9jFnNdM	www.themalaymailonline.com	1398396071727
159814	The manufacturing of overseas free trade goods are the main cause of global  ...	http://spartandaily.com/120751/manufacturing-overseas-free-trade-goods-main-cause-global-labor-violation	Spartan Daily	b	dVSyQTtV6UtRCTMcxhoiVo9jFnNdM	spartandaily.com	1398396072148
159815	Most Bangladesh factory survivors too sick to work: survey	http://www.business-standard.com/article/pti-stories/most-bangladesh-factory-survivors-too-sick-to-work-survey-114042101039_1.html	Business Standard	b	dVSyQTtV6UtRCTMcxhoiVo9jFnNdM	www.business-standard.com	1398396072376
159816	Bangladesh to mark first anniversary of worst-ever garment factory disaster in  ...	http://www.aninews.in/videogallery9/22593-bangladesh-to-mark-first-anniversary-of-worst-ever-garment-factory-disaster-in-039-rana-plaza-039.html	ANINEWS	b	dVSyQTtV6UtRCTMcxhoiVo9jFnNdM	www.aninews.in	1398396072577
159817	Survivors of Bangladesh deadliest industrial tragedy suffer one year after man  ...	http://www.shanghaidaily.com/article/article_xinhua.aspx\?id=213857	Shanghai Daily \(subscription\)	b	dVSyQTtV6UtRCTMcxhoiVo9jFnNdM	www.shanghaidaily.com	1398396072767
159818	31pc initiatives implemented: TIB	http://www.thedailystar.net/31pc-initiatives-implemented-tib-20976	The Daily Star	b	dVSyQTtV6UtRCTMcxhoiVo9jFnNdM	www.thedailystar.net	1398396072963
159819	TIB lauds post-Rana Plaza efforts	http://bdnews24.com/bangladesh/2014/04/21/tib-lauds-post-rana-plaza-efforts	Bangladesh News 24 hours	b	dVSyQTtV6UtRCTMcxhoiVo9jFnNdM	bdnews24.com	1398396073262
159820	Living with loss from the Bangladesh factory disaster	http://www.themalaymailonline.com/features/article/living-with-loss-from-the-bangladesh-factory-disaster	The Malay Mail Online	b	dVSyQTtV6UtRCTMcxhoiVo9jFnNdM	www.themalaymailonline.com	1398396073486
159821	Rana Plaza a year on: did fast-fashion brands learn any lessons at all?	http://www.theguardian.com/world/2014/apr/20/rana-plaza-bangladesh-disaster-anniversary	The Guardian	b	dVSyQTtV6UtRCTMcxhoiVo9jFnNdM	www.theguardian.com	1398396073701
159822	Rana Plaza survivors left in desperate straits	http://bd.thedailystar.net/bytes/tech-bits-20866	The Daily Star	b	dVSyQTtV6UtRCTMcxhoiVo9jFnNdM	bd.thedailystar.net	1398396074386
159823	Motlaugh: After the Bangladesh factory collapse	http://www.roanoke.com/opinion/commentary/motlaugh-after-the-bangladesh-factory-collapse/article_69f36640-c763-11e3-bac8-001a4bcf6878.html	Roanoke Times	b	dVSyQTtV6UtRCTMcxhoiVo9jFnNdM	www.roanoke.com	1398396074580
159824	No compensation for Rana Plaza widow, one year on	http://www.independent.co.uk/news/world/asia/no-compensation-for-rana-plaza-widow-one-year-on-9271467.html	The Independent	b	dVSyQTtV6UtRCTMcxhoiVo9jFnNdM	www.independent.co.uk	1398396074965
159825	Global buyers not raising prices despite compliance: BGMEA	http://www.thefinancialexpress-bd.com/2014/04/20/29806	Financial Express Bangladesh	b	dVSyQTtV6UtRCTMcxhoiVo9jFnNdM	www.thefinancialexpress-bd.com	1398396075344
159826	Sohel Rana living in luxury: Khaleda	http://bdnews24.com/bangladesh/2014/04/19/sohel-rana-living-in-luxury-khaleda	Bangladesh News 24 hours	b	dVSyQTtV6UtRCTMcxhoiVo9jFnNdM	bdnews24.com	1398396075617
159827	What hasn't changed since the Bangladesh factory collapse	http://www.thenewstribune.com/2014/04/19/3155551/what-hasnt-changed-since-the-bangladesh.html\?sp=/99/447/	TheNewsTribune.com	b	dVSyQTtV6UtRCTMcxhoiVo9jFnNdM	www.thenewstribune.com	1398396075833
159828	Opinion: Globalization responsible for factory tragedy	http://www.dw.de/opinion-globalization-responsible-for-factory-tragedy/a-17577277	Deutsche Welle	b	dVSyQTtV6UtRCTMcxhoiVo9jFnNdM	www.dw.de	1398396076216
159829	VIDEO: How Many Lives Did the Shirt You're Wearing Cost?	http://www.ryot.org/cost-of-fashion-bangladesh/646117	RYOT	b	dVSyQTtV6UtRCTMcxhoiVo9jFnNdM	www.ryot.org	1398396076426
159830	Bangladesh seizes properties of owner of collapsed factory	http://www.business-standard.com/article/pti-stories/bangladesh-seizes-properties-of-owner-of-collapsed-factory-114041701445_1.html	Business Standard	b	dVSyQTtV6UtRCTMcxhoiVo9jFnNdM	www.business-standard.com	1398396076677
159831	Exports on way to hitting targets	http://www.thedailystar.net/exports-on-way-to-hitting-targets-20499	The Daily Star	b	dVSyQTtV6UtRCTMcxhoiVo9jFnNdM	www.thedailystar.net	1398396076929
159832	General Motors Stock up as Recalls sent Profits down	http://www.jdjournal.com/2014/04/24/general-motors-stock-up-as-recalls-sent-profits-down/	JDJournal.com	b	deMqeq3FTE_SERMIK4QZTSzA4gHcM	www.jdjournal.com	1398397379875
159833	Recall Woes Push Along GM's Cultural Reinvention	http://www.northcountrypublicradio.org/news/npr/306531838/recall-woes-push-along-gm-s-cultural-reinvention	North Country Public Radio	b	deMqeq3FTE_SERMIK4QZTSzA4gHcM	www.northcountrypublicradio.org	1398397380137
159834	Demand For Its Cars Helping GM Rebound From Black Eye Of Recalls	http://www.itbusinessnet.com/article/Demand-For-Its-Cars-Helping-GM-Rebound-From-Black-Eye-Of-Recalls-3210770	IT Business Net	b	deMqeq3FTE_SERMIK4QZTSzA4gHcM	www.itbusinessnet.com	1398397380389
159835	Business update: GM profit sinks; CEO sees no recall hit to sales	http://www.devilslakejournal.com/article/20140424/NEWS/140429189/-1/opinion	Devil's Lake Daily Journal	b	deMqeq3FTE_SERMIK4QZTSzA4gHcM	www.devilslakejournal.com	1398397380750
159836	GM Confirms DOJ, SEC Investigating It	http://www.kcentv.com/story/25336738/gm-confirms-doj-sec-investigating-it	KCEN-TV	b	deMqeq3FTE_SERMIK4QZTSzA4gHcM	www.kcentv.com	1398397381059
159837	GM's Profits Tumble After Recall	http://www.forexminute.com/business-news/gms-profits-tumble-after-recall-30067	ForexMinute.com	b	deMqeq3FTE_SERMIK4QZTSzA4gHcM	www.forexminute.com	1398397381308
159838	General Motors Facing Five Government Probes	http://gmauthority.com/blog/2014/04/general-motors-facing-five-government-probes/	GM Authority \(blog\)	b	deMqeq3FTE_SERMIK4QZTSzA4gHcM	gmauthority.com	1398397381553
159839	First quarter profit of GM hit by massive recall	http://www.malaysiasun.com/index.php/sid/221403477/scat/3a8a80d6f705f8cc/ht/First-quarter-profit-of-GM-hit-by-massive-recall	Malaysia Sun	b	deMqeq3FTE_SERMIK4QZTSzA4gHcM	www.malaysiasun.com	1398397381841
159840	Recalls take chunk out of GM profit	http://www.houstonchronicle.com/business/economy/article/Recalls-take-chunk-out-of-GM-profit-5428267.php	Houston Chronicle	b	deMqeq3FTE_SERMIK4QZTSzA4gHcM	www.houstonchronicle.com	1398397382159
159841	General Motors profit down by 85-percent	http://wkzo.com/news/articles/2014/apr/25/general-motors-profit-down-by-85-percent/	WKZO	b	deMqeq3FTE_SERMIK4QZTSzA4gHcM	wkzo.com	1398397382448
159842	General Motors sends replacement parts to dealers in recall	http://whtc.com/news/articles/2014/apr/25/general-motors-sends-replacement-parts-to-dealers-in-recall/	WHTC	b	deMqeq3FTE_SERMIK4QZTSzA4gHcM	whtc.com	1398397382631
159843	GM says federal securities regulators are probing recall	http://www.lansingstatejournal.com/viewart/20140424/NEWS01/304240061/GM-says-federal-securities-regulators-probing-recall	Lansing State Journal	b	deMqeq3FTE_SERMIK4QZTSzA4gHcM	www.lansingstatejournal.com	1398397382930
159844	GM's 1st-quarter profit plunges after massive recall	http://www.globaltimes.cn/content/856789.shtml	Global Times	b	deMqeq3FTE_SERMIK4QZTSzA4gHcM	www.globaltimes.cn	1398397383226
159845	Recall wipes out GM profits	http://wwlp.com/2014/04/24/recall-wipes-out-gm-profits/	WWLP 22News	b	deMqeq3FTE_SERMIK4QZTSzA4gHcM	wwlp.com	1398397383582
159846	Securities regulators probe GM recall	http://news.theage.com.au/breaking-news-business/securities-regulators-probe-gm-recall-20140425-377wc.html	The Age	b	deMqeq3FTE_SERMIK4QZTSzA4gHcM	news.theage.com.au	1398397383889
159847	GM Q1 results worst since 2009 due to recall costs	http://www.orangeville.com/news-story/4484098-gm-q1-results-worst-since-2009-due-to-recall-costs/	Orangeville Banner	b	deMqeq3FTE_SERMIK4QZTSzA4gHcM	www.orangeville.com	1398397384199
159848	GM's profit dragged down by recalls	http://www.washingtonpost.com/business/economy/gms-1q-profit-dragged-down-by-recalls/2014/04/24/aa4b49b4-cb01-11e3-a75e-463587891b57_story.html	Washington Post	b	deMqeq3FTE_SERMIK4QZTSzA4gHcM	www.washingtonpost.com	1398397384488
159849	GM Buyers Ask NY Judge For Recall Info After Calif. Dismissal	http://www.law360.com/articles/531665/gm-buyers-ask-ny-judge-for-recall-info-after-calif-dismissal	Law360 \(subscription\)	b	deMqeq3FTE_SERMIK4QZTSzA4gHcM	www.law360.com	1398397384760
159850	General Motors 1Q profit fells 86 percent due to series of recalls	http://www.wxyz.com/money/business-news/general-motors-1q-profit-fells-86-percent-due-to-series-of-recalls	WXYZ	b	deMqeq3FTE_SERMIK4QZTSzA4gHcM	www.wxyz.com	1398397385130
159851	GM says securities regulators are probing recall	http://www.wwmt.com/news/features/business/stories/gm-says-securities-regulators-probing-recall-1054.shtml	WWMT-TV	b	deMqeq3FTE_SERMIK4QZTSzA4gHcM	www.wwmt.com	1398397385401
159852	GM's first-quarter profit tumbles 86% due to recalls	http://www.buffalonews.com/business/gms-first-quarter-profit-tumbles-86-due-to-recalls-20140424	Buffalo News	b	deMqeq3FTE_SERMIK4QZTSzA4gHcM	www.buffalonews.com	1398397385645
159853	GM Discloses SEC's, Other Authorities' Probes Over Recall	http://www.law360.com/articles/531658/gm-discloses-sec-s-other-authorities-probes-over-recall	Law360 \(subscription\)	b	deMqeq3FTE_SERMIK4QZTSzA4gHcM	www.law360.com	1398397386220
159854	GM facing multiple probes into recent recalls	http://www.businesstimes.com.sg/breaking-news/transport/gm-facing-multiple-probes-recent-recalls-20140425	Business Times \(subscription\)	b	deMqeq3FTE_SERMIK4QZTSzA4gHcM	www.businesstimes.com.sg	1398397386407
159855	Recall Squeezes GM Profit	http://news.investors.com/042414-698392-recall-squeezes-gm-profit.htm	Investor's Business Daily	b	deMqeq3FTE_SERMIK4QZTSzA4gHcM	news.investors.com	1398397386641
159856	Massive recall expenses slash General Motors' first-quarter profit	http://www.latimes.com/business/autos/la-fi-hy-gm-first-quarter-profit-recall-20140424,0,5391166.story	Los Angeles Times	b	deMqeq3FTE_SERMIK4QZTSzA4gHcM	www.latimes.com	1398397387010
159857	US securities regulators are looking into GM recall case, company says in  ...	http://www.brandonsun.com/lifestyles/breaking-news/us-securities-regulators-are-looking-into-gm-recall-case-company-says-in-quarterly-report-256577991.html\?thx=y	Brandon Sun	b	deMqeq3FTE_SERMIK4QZTSzA4gHcM	www.brandonsun.com	1398397387247
159858	GM 1Q profit dragged down by recalls	http://www.sltrib.com/sltrib/money/57860248-79/million-percent-ago-recalls.html.csp	Salt Lake Tribune	b	deMqeq3FTE_SERMIK4QZTSzA4gHcM	www.sltrib.com	1398397387495
159859	UPDATE 3-GM says facing multiple probes into recent recalls	http://in.reuters.com/article/2014/04/24/gm-recall-investigation-idINL2N0NG21G20140424	Reuters	b	deMqeq3FTE_SERMIK4QZTSzA4gHcM	in.reuters.com	1398397387745
159860	General Motors: SEC among authorities looking into ignition-switch recall	http://www.theguardian.com/business/2014/apr/24/general-motors-sec-ignition-switch-recall	The Guardian	b	deMqeq3FTE_SERMIK4QZTSzA4gHcM	www.theguardian.com	1398397388082
159861	GM ekes out $125M profit in 1Q amid crisis	http://www.freep.com/article/20140424/BUSINESS0101/304230200/GM-General-Motors-first-quarter-earnings-profit-ignition-switch-recall	Detroit Free Press	b	deMqeq3FTE_SERMIK4QZTSzA4gHcM	www.freep.com	1398397388362
159862	General Motors Being Investigated By SEC, NHTSA, And More	http://www.valuewalk.com/2014/04/general-motors-being-investigated-by-sec-nhtsa/	ValueWalk	b	deMqeq3FTE_SERMIK4QZTSzA4gHcM	www.valuewalk.com	1398397388619
159863	Recall Costs Hurt GM Profits	http://www.ttnews.com/articles/lmtbase.aspx\?storyid=2796&amp;t=Recall-Costs-Hurt-GM-1Q-Profit	Transport Topics Online	b	deMqeq3FTE_SERMIK4QZTSzA4gHcM	www.ttnews.com	1398397388936
159864	SEC opens probe over GM ignition switch recall	http://www.marshfieldnewsherald.com/usatoday/article/8112469	Marshfield News-Herald	b	deMqeq3FTE_SERMIK4QZTSzA4gHcM	www.marshfieldnewsherald.com	1398397389166
159865	General Motors Loss is Gain for Dealers	http://www.wilx.com/home/headlines/General-Motors-Loss-256597661.html\?ref=661	WILX-TV	b	deMqeq3FTE_SERMIK4QZTSzA4gHcM	www.wilx.com	1398397389490
159866	GM Confirms It's Being Probed On Multiple Fronts Over Ignition Recall	http://consumerist.com/2014/04/24/gm-confirms-its-being-probed-on-multiple-fronts-over-ignition-recall/	The Consumerist	b	deMqeq3FTE_SERMIK4QZTSzA4gHcM	consumerist.com	1398397389776
159867	GM Profit Report Further Clouds Spotlight on CEO Mary Barra	http://wardsauto.com/blog/gm-profit-report-further-clouds-spotlight-ceo-mary-barra	Ward's Auto \(subscription\) \(blog\)	b	deMqeq3FTE_SERMIK4QZTSzA4gHcM	wardsauto.com	1398397390119
159868	GM Confirms Several Government Investigations Into Recalls	http://mashable.com/2014/04/24/gm-recall-earnings/	Mashable	b	deMqeq3FTE_SERMIK4QZTSzA4gHcM	mashable.com	1398397390487
159869	Recall costs slam brakes on GM profit	https://au.finance.yahoo.com/news/recall-costs-slam-brakes-gm-055854579.html	Yahoo\!7 News	b	deMqeq3FTE_SERMIK4QZTSzA4gHcM	au.finance.yahoo.com	1398397390721
159870	Securities regulators probing GM recall	http://www.cbsnews.com/news/securities-regulators-probing-gm-recall/	CBS News	b	deMqeq3FTE_SERMIK4QZTSzA4gHcM	www.cbsnews.com	1398397391165
159871	General Motors Says It's Facing Multiple Probes Into Recent Recalls	http://www.ibtimes.com/general-motors-says-its-facing-multiple-probes-recent-recalls-1576057	International Business Times	b	deMqeq3FTE_SERMIK4QZTSzA4gHcM	www.ibtimes.com	1398397391387
159872	Securities Regulators Are Probing Recall, Says GM	http://www.pddnet.com/news/2014/04/securities-regulators-are-probing-recall-says-gm	Product Design \& Development	b	deMqeq3FTE_SERMIK4QZTSzA4gHcM	www.pddnet.com	1398397391677
159873	GM Recall Is Being Probed By The DOJ, SEC	http://www.huffingtonpost.com/2014/04/24/gm-probe-doj-sec_n_5207888.html\?utm_hp_ref=business	Huffington Post	b	deMqeq3FTE_SERMIK4QZTSzA4gHcM	www.huffingtonpost.com	1398397391885
159874	General Motors' first quarter profit dragged down by recalls	http://www.kpvi.com/business/story/General-Motors-first-quarter-profit-dragged-down/ZA7pyS-qTEq8nod7ar0zUg.cspx	KPVI News 6	b	deMqeq3FTE_SERMIK4QZTSzA4gHcM	www.kpvi.com	1398397392107
159875	Security regulators probe GM recall	http://www.clickondetroit.com/money/automotive/security-regulators-probe-gm-recall/25643840	WDIV Detroit	b	deMqeq3FTE_SERMIK4QZTSzA4gHcM	www.clickondetroit.com	1398397392341
159876	GM Stock: 3 Reasons You Shouldn't Cheer Just Yet	http://investorplace.com/2014/04/3-reasons-gm-stock-earnings/	Investorplace.com	b	deMqeq3FTE_SERMIK4QZTSzA4gHcM	investorplace.com	1398397392769
159877	GM says securities regulators are probing ignition switch recall	http://www.wxyz.com/money/auto-news/gm-says-securities-regulators-are-probing-recall	WXYZ	b	deMqeq3FTE_SERMIK4QZTSzA4gHcM	www.wxyz.com	1398397393025
159878	GM Confirms Investigations Under Way	http://blogs.wsj.com/law/2014/04/24/gm-confirms-investigations-under-way/	Wall Street Journal \(blog\)	b	deMqeq3FTE_SERMIK4QZTSzA4gHcM	blogs.wsj.com	1398397393272
159879	New York U.S. Attorney, SEC probe GM recalls	http://www.detroitnews.com/article/20140424/AUTO0103/304240097/New-York-U-S-Attorney-SEC-probe-GM-recalls	The Detroit News	b	deMqeq3FTE_SERMIK4QZTSzA4gHcM	www.detroitnews.com	1398397393665
159880	General Motors Co. profit in Q1 falls 82 percent due to recall-related costs	http://www.gantdaily.com/2014/04/24/general-motors-co-profit-in-q1-falls-82-percent-due-to-recall-related-costs/	Gant Daily	b	deMqeq3FTE_SERMIK4QZTSzA4gHcM	www.gantdaily.com	1398397393934
159881	NY US Attorney, SEC, investigate GM recalls	http://www.detroitnews.com/article/20140424/AUTO0103/304240097/NY-U-S-Attorney-SEC-investigate-GM-recalls	The Detroit News	b	deMqeq3FTE_SERMIK4QZTSzA4gHcM	www.detroitnews.com	1398397394160
159882	SEC opens investigation over GM ignition switch recall	http://www.freep.com/article/20140424/BUSINESS0101/304240148/General-Motors-Securities-and-Exchange-Commission-SEC-GM-ignition-switch-recall	Detroit Free Press	b	deMqeq3FTE_SERMIK4QZTSzA4gHcM	www.freep.com	1398397394358
159883	UPDATE 5-GM posts lower profit after recall; outlook for rest of year trimmed	http://in.reuters.com/article/2014/04/24/gm-results-idINL2N0NG0KC20140424	Reuters	b	deMqeq3FTE_SERMIK4QZTSzA4gHcM	in.reuters.com	1398397394896
159884	General Motors 1Q results worst since 2009 due to recall costs; CEO says sales  ...	http://www.newser.com/article/32ca2bf00e9d48ecb1c4c6a65fe6e865/general-motors-1q-results-worst-since-2009-due-to-recall-costs-ceo-says-sales-holding-up.html	Newser	b	deMqeq3FTE_SERMIK4QZTSzA4gHcM	www.newser.com	1398397395190
159885	GM Profit Sinks; CEO Sees No Hit to Sales from Recall	http://www.dailyfinance.com/2014/04/24/general-motors-earnings/	DailyFinance	b	deMqeq3FTE_SERMIK4QZTSzA4gHcM	www.dailyfinance.com	1398397395419
159886	General Motors' first quarter profits plunge after major product recall	http://www.theguardian.com/business/2014/apr/24/general-motors-first-quarter-profits-plunge-product-recall	The Guardian	b	deMqeq3FTE_SERMIK4QZTSzA4gHcM	www.theguardian.com	1398397395804
159887	GM Profits $0.1 Billion in First Quarter Despite Recalls	http://wot.motortrend.com/1404_gm_profits_0_1_billion_in_first_quarter_despite_recalls.html	MotorTrend Magazine	b	deMqeq3FTE_SERMIK4QZTSzA4gHcM	wot.motortrend.com	1398397396005
159888	News Summary: GM 1Q profit dragged down by recalls	http://www.charlotteobserver.com/2014/04/24/4862593/news-summary-gm-1q-profit-dragged.html	Charlotte Observer	b	deMqeq3FTE_SERMIK4QZTSzA4gHcM	www.charlotteobserver.com	1398397396631
159889	GM Logs Over 80% Drop in Q1 Profit after Ignition-Switch Recalls	http://www.ibtimes.co.uk/gm-logs-over-80-drop-q1-profit-after-ignition-switch-recalls-1445934	International Business Times UK	b	deMqeq3FTE_SERMIK4QZTSzA4gHcM	www.ibtimes.co.uk	1398397396991
159890	GM's $1.3 Billion Recall Cost Wipes Out Profit	http://www.wibw.com/home/headlines/GMs-13-Billion-Recall-Cost-Wipes-Out-Profit-256556881.html	WIBW	b	deMqeq3FTE_SERMIK4QZTSzA4gHcM	www.wibw.com	1398397397228
159891	GM 1Q profit dragged down	http://www.abqjournal.com/388742/biz/gm-1q-profit-dragged-down-by-recalls.html	Albuquerque Journal	b	deMqeq3FTE_SERMIK4QZTSzA4gHcM	www.abqjournal.com	1398397397551
159892	GM Recall: New Ignition Parts Are Heading to Dealers	http://www.autoworldnews.com/articles/7142/20140424/gm-recall-new-ignition-parts-are-heading-to-dealers.htm	Auto World News	b	deMqeq3FTE_SERMIK4QZTSzA4gHcM	www.autoworldnews.com	1398397397865
159893	GM profit plunges after recall costs	http://zeenews.india.com/business/news/international/gm-profit-plunges-after-recall-costs_98353.html/gm-profit-plunges-after-recall-costs_98353.html	Zee News	b	deMqeq3FTE_SERMIK4QZTSzA4gHcM	zeenews.india.com	1398397398281
159894	Beyond GM's Recall Pain, a Boost From Bland Buicks	http://www.businessweek.com/articles/2014-04-24/beyond-gms-recall-pain-a-boost-from-bland-buicks	Businessweek \(blog\)	b	deMqeq3FTE_SERMIK4QZTSzA4gHcM	www.businessweek.com	1398397398477
159895	GM Posts Lower Q1 Earnings On Recalls, But Core Outlook On-Track	http://www.ibtimes.com/gm-posts-lower-q1-earnings-recalls-core-outlook-track-1575917	International Business Times	b	deMqeq3FTE_SERMIK4QZTSzA4gHcM	www.ibtimes.com	1398397398746
159896	GM Customers Press Judge for Information on Recalled Cars	http://www.bloomberg.com/news/2014-04-24/gm-customers-press-judge-for-information-on-recalled-cars.html	Bloomberg	b	deMqeq3FTE_SERMIK4QZTSzA4gHcM	www.bloomberg.com	1398397398981
159897	GM Profit Sinks But CEO Sees No Recall Hit To Sales	http://www.manufacturing.net/news/2014/04/gm-profit-sinks-but-ceo-sees-no-recall-hit-to-sales	Manufacturing.net	b	deMqeq3FTE_SERMIK4QZTSzA4gHcM	www.manufacturing.net	1398397399299
159898	GM posts huge profit drop driven by ignition switch crisis	http://finance.fortune.cnn.com/2014/04/24/gm-posts-huge-profit-drop-driven-by-ignition-switch-crisis/\?section=magazines_fortune	Fortune	b	deMqeq3FTE_SERMIK4QZTSzA4gHcM	finance.fortune.cnn.com	1398397399599
159899	GM Posts $125 Million Profit	http://www.autoworldnews.com/articles/7151/20140424/gm-posts-125-million-profit-in-spite-of-recall-costs.htm	Auto World News	b	deMqeq3FTE_SERMIK4QZTSzA4gHcM	www.autoworldnews.com	1398397399825
159900	General Motors 1Q Profit Dragged Down By Recalls	http://www.10tv.com/content/stories/2014/04/24/us--earns-general-motors.html	10TV	b	deMqeq3FTE_SERMIK4QZTSzA4gHcM	www.10tv.com	1398397400160
