87001	Miley Cyrus Tearfully Sings to Floyd's Giant Blowup on Her Knees, Still Grieving  ...	http://www.fashiontimes.com/articles/4571/20140406/miley-cyrus-tearfully-sings-floyds-giant-blowup-knees-still-grieving.htm	Fashion Times	e	dL97eP0cros4UhMTjhr9flcjxpTCM	www.fashiontimes.com	1396884719803
87002	New pup can't heal Miley Cyrus' heartbreak after coyote kills her beloved dog  ...	http://www.news.com.au/entertainment/celebrity-life/new-pup-cant-heal-miley-cyrus-heartbreak-after-coyote-kills-her-beloved-dog-floyd/story-fn907478-1226876266171	NEWS.com.au	e	dL97eP0cros4UhMTjhr9flcjxpTCM	www.news.com.au	1396884720084
87003	Miley Cyrus Photo, Lyrics, Twitter & Instagram: 'Wrecking Ball' Star Mourns Dog  ...	http://www.latinpost.com/articles/10116/20140406/miley-cyrus-photo-lyrics-twitter-instagram-wrecking-ball-star-mourns.htm	Latin Post	e	dL97eP0cros4UhMTjhr9flcjxpTCM	www.latinpost.com	1396884720260
87004	Miley Cyrus pours heart out on Twitter after mother buys her puppy to replace  ...	http://www.dailymail.co.uk/tvshowbiz/article-2597868/Distraught-Miley-Cyrus-pours-heart-Twitter-mother-buys-cute-puppy-replace-beloved-dog-Floyd.html	Daily Mail	e	dL97eP0cros4UhMTjhr9flcjxpTCM	www.dailymail.co.uk	1396884720446
87005	Miley Cyrus Opens Up: I "Don't Know If I'm Ready to Love Again" (PHOTOS)	http://www.gossipcop.com/miley-cyrus-floyd-death-tweets-new-dog-moonie-photos-pics/	GossipCop	e	dL97eP0cros4UhMTjhr9flcjxpTCM	www.gossipcop.com	1396884720689
87006	San Antonio Tested Cancer Drug Unveiled for Metastatic Breast Cancer	http://www.woai.com/articles/woai-local-news-sponsored-by-five-star-cleaners-119078/san-antonio-tested-cancer-drug-unveiled-12225907	WOAI.com	m	dhverHBv1VepjdMXgQPPCfZJB9SfM	www.woai.com	1396884971163
87007	Pfizer reports promising results for cancer drug	http://www.biosciencetechnology.com/news/2014/04/pfizer-reports-promising-results-cancer-drug	Bioscience Technology	m	dhverHBv1VepjdMXgQPPCfZJB9SfM	www.biosciencetechnology.com	1396884971380
87008	Two New Drugs Could be Effective for Advanced Breast Cancer	http://www.counselheal.com/articles/9256/20140407/two-new-drugs-could-be-effective-for-advanced-breast-cancer.htm	Counsel \& Heal	m	dhverHBv1VepjdMXgQPPCfZJB9SfM	www.counselheal.com	1396884971606
87009	Palbociclib Dramatically Improves PFS But Not OS in Updated Findings	http://www.onclive.com/conference-coverage/aacr-2014/Palbociclib-Dramatically-Improves-PFS-But-Not-OS-in-Updated-Findings	OncLive	m	dhverHBv1VepjdMXgQPPCfZJB9SfM	www.onclive.com	1396884972067
87010	Promising Results For Pfizer's Cancer Drug	http://www.pharmpro.com/news/2014/04/promising-results-pfizers-cancer-drug	Pharmaceutical Processing	m	dhverHBv1VepjdMXgQPPCfZJB9SfM	www.pharmpro.com	1396884972361
87011	Pfizer's Breast Cancer Drug Palbociclib could Change Treatment Options	http://www.scienceworldreport.com/articles/13889/20140407/pfizers-breast-cancer-drug-palbociclib-could-change-treatment-options.htm	Science World Report	m	dhverHBv1VepjdMXgQPPCfZJB9SfM	www.scienceworldreport.com	1396884972607
87012	Palbociclib + Letrozole Prolongs PFS in Advanced Breast Cancer Study	http://www.empr.com/palbociclib-letrozole-prolongs-pfs-in-advanced-breast-cancer-study/article/341564/	Monthly Prescribing Reference	m	dhverHBv1VepjdMXgQPPCfZJB9SfM	www.empr.com	1396884972830
87013	Is Palbociclib Promising? Or Not?	http://pipeline.corante.com/archives/2014/04/07/is_palbociclib_promising_or_not.php	Corante	m	dhverHBv1VepjdMXgQPPCfZJB9SfM	pipeline.corante.com	1396884973048
87014	Pfizer's New Breast Cancer Drug Shows Promise	http://www.dddmag.com/news/2014/04/pfizers-new-breast-cancer-drug-shows-promise	Drug Discovery \& Development	m	dhverHBv1VepjdMXgQPPCfZJB9SfM	www.dddmag.com	1396884973333
87015	Guarded optimism after breast cancer drug shows promising results	http://www.thespec.com/news-story/4451544-guarded-optimism-after-breast-cancer-drug-shows-promising-results/	Hamilton Spectator	m	dhverHBv1VepjdMXgQPPCfZJB9SfM	www.thespec.com	1396884973560
87016	Pfizer breast cancer drug shows promise	http://www.foxnews.com/health/2014/04/07/pfizer-breast-cancer-drug-shows-promise/	Fox News	m	dhverHBv1VepjdMXgQPPCfZJB9SfM	www.foxnews.com	1396884973845
87017	Palbociclib plus letrozole extended PFS in metastatic breast cancer	http://www.healio.com/hematology-oncology/breast-cancer/news/online/%7B0e153a03-190d-4f43-8679-d015c1876e44%7D/palbociclib-plus-letrozole-extended-pfs-in-metastatic-breast-cancer	Healio	m	dhverHBv1VepjdMXgQPPCfZJB9SfM	www.healio.com	1396884974063
87018	Pfizer's breast cancer drug Palbociclib slows down tumor growth, shows hope for  ...	http://www.techtimes.com/articles/5282/20140407/pfizers-breast-cancer-drug-palbociclib-slows-down-tumor-growth-shows-hope-for-advanced-cases.htm	Tech Times	m	dhverHBv1VepjdMXgQPPCfZJB9SfM	www.techtimes.com	1396884974340
87019	New breast cancer drug may change treatment of disease	http://www.youtube.com/watch\?v=hyYCl8IncOw	CBS News	m	dhverHBv1VepjdMXgQPPCfZJB9SfM	www.youtube.com	1396884974558
87020	New Drug to Significantly Stop Progression of Breast Cancer	http://austriantribune.com/informationen/143356-new-drug-significantly-stop-progression-breast-cancer	Austrian Tribune	m	dhverHBv1VepjdMXgQPPCfZJB9SfM	austriantribune.com	1396884974775
87021	UPDATED: Pfizer's flagship palbociclib stymies cancer progression but falls  ...	http://www.fiercebiotech.com/story/pfizer-s-flagship-palbociclib-stymies-cancer-progression-falls-short-surviv/2014-04-06	FierceBiotech	m	dhverHBv1VepjdMXgQPPCfZJB9SfM	www.fiercebiotech.com	1396884975020
87022	Pfizer says experimental drug shows promising results treating advanced breast  ...	http://www.greenfieldreporter.com/view/story/d3858f0675754cf99bbcaaf7350b2ca8/US--Pfizer-Breast-Cancer-Drug	Greenfield Daily Reporter	m	dhverHBv1VepjdMXgQPPCfZJB9SfM	www.greenfieldreporter.com	1396884975422
87023	'Groundbreaking' Drug Stalls Breast Cancer	http://www.newser.com/story/184924/groundbreaking-drug-stalls-breast-cancer.html	Newser	m	dhverHBv1VepjdMXgQPPCfZJB9SfM	www.newser.com	1396884975619
87024	Sector Update: Healthcare Shares Mixed Pre-Market; Pfizer Sinks 3% on Results  ...	http://www.nasdaq.com/article/sector-update-healthcare-shares-mixed-pre-market-pfizer-sinks-3-on-results-of-breast-cancer-treatment-study-cm341750	NASDAQ	m	dhverHBv1VepjdMXgQPPCfZJB9SfM	www.nasdaq.com	1396884975852
87025	New drug may help prevent advanced breast cancer from progressing	http://www.business-standard.com/article/news-ani/new-drug-may-help-prevent-advanced-breast-cancer-from-progressing-114040700763_1.html	Business Standard	m	dhverHBv1VepjdMXgQPPCfZJB9SfM	www.business-standard.com	1396884976068
87026	Experimental Breast Cancer Drug Seems Safe, Effective for Advanced Disease	http://www.philly.com/philly/health/topics/HealthDay686546_20140407_Experimental_Breast_Cancer_Drug_Seems_Safe__Effective__for_Advanced_Disease.html	Philly.com	m	dhverHBv1VepjdMXgQPPCfZJB9SfM	www.philly.com	1396884976320
87027	Debate rages over new drug for breast cancer	http://www.delhidailynews.com/news/Debate-rages-over-new-drug-for-breast-cancer-1396871705/	Delhi Daily News	m	dhverHBv1VepjdMXgQPPCfZJB9SfM	www.delhidailynews.com	1396884976521
87028	NEW DRUG SHOWS GREAT PROMISE IN FIGHTING BREAST CANCER	http://www.skyvalleychronicle.com/BREAKING-NEWS/NEW-DRUG-SHOWS-GREAT-PROMISE-IN-FIGHTING-BREAST-CANCER-1691879	Sky Valley Chronicle	m	dhverHBv1VepjdMXgQPPCfZJB9SfM	www.skyvalleychronicle.com	1396884976748
87029	Palbociclib shows promising results in patients with hormone receptor-positive  ...	http://medicalxpress.com/news/2014-04-palbociclib-results-patients-hormone-receptor-positive.html	Medical Xpress	m	dhverHBv1VepjdMXgQPPCfZJB9SfM	medicalxpress.com	1396884976991
87030	Pfizer drug increases breast cancer survival time	http://www.health24.com/Medical/Breast/News/Pfizer-drug-increases-breast-cancer-survival-time-20140406	Health24.com	m	dhverHBv1VepjdMXgQPPCfZJB9SfM	www.health24.com	1396884977322
87031	Pfizer's breast cancer drug palbociclib extends survival	http://www.pmlive.com/pharma_news/pfizers_breast_cancer_drug_palbociclib_extends_survival_558508	PMLiVE	m	dhverHBv1VepjdMXgQPPCfZJB9SfM	www.pmlive.com	1396884977523
87032	Pfizer's Palbociclib Slows Tumor Growth in Breast Cancer Patients	http://www.natureworldnews.com/articles/6541/20140407/pfizers-palbociclib-slows-tumor-growth-breast-cancer-patients.htm	Nature World News	m	dhverHBv1VepjdMXgQPPCfZJB9SfM	www.natureworldnews.com	1396884977945
87033	San Antonio Developed Cancer Drug Unveiled for Metastatic Breast Cancer	http://www.woai.com/articles/woai-local-news-sponsored-by-five-star-cleaners-119078/san-antonio-developed-cancer-drug-unveiled-12225907	1200 WOAI	m	dhverHBv1VepjdMXgQPPCfZJB9SfM	www.woai.com	1396884978165
87034	New Drug Demonstrates Early Promise in Metastatic Breast Cancer	http://www.healthcanal.com/cancers/breast-cancer/49513-new-drug-demonstrates-early-promise-in-metastatic-breast-cancer.html	HealthCanal.com	m	dhverHBv1VepjdMXgQPPCfZJB9SfM	www.healthcanal.com	1396884978424
87035	Pfizer's palbociclib impresses in breast cancer trial	http://www.pharmatimes.com/Article/14-04-06/Pfizer_s_palbociclib_impresses_in_breast_cancer_trial.aspx	PharmaTimes	m	dhverHBv1VepjdMXgQPPCfZJB9SfM	www.pharmatimes.com	1396884978634
87036	Drug shows 'groundbreaking' results	http://www.news-journal.com/features/health/drug-shows-groundbreaking-results/article_763d7ac2-1c3e-5244-8b74-33476addb61e.html	Longview News-Journal	m	dhverHBv1VepjdMXgQPPCfZJB9SfM	www.news-journal.com	1396884978852
87037	Pfizer trial shows experimental drug doubles time until breast cancer tumours  ...	http://www.scmp.com/news/world/article/1467035/pfizer-trial-shows-experimental-drug-doubles-time-until-breast-cancer	South China Morning Post	m	dhverHBv1VepjdMXgQPPCfZJB9SfM	www.scmp.com	1396884979054
87038	Experimental cancer drug shows promise	http://www.todayonline.com/daily-focus/health/experimental-cancer-drug-shows-promise	TODAYonline	m	dhverHBv1VepjdMXgQPPCfZJB9SfM	www.todayonline.com	1396884979539
87039	New Breast Cancer Drug Raises Hopes Among Patients With 'Promising Results'	http://www.inquisitr.com/1203594/new-breast-cancer-drug-palbociclib-pfizer/	The Inquisitr	m	dhverHBv1VepjdMXgQPPCfZJB9SfM	www.inquisitr.com	1396884979753
87040	Experimental breast cancer drug shows promising results, Pfizer says	http://timesofindia.indiatimes.com/home/science/Experimental-breast-cancer-drug-shows-promising-results-Pfizer-says/articleshow/33382560.cms	Times of India	m	dhverHBv1VepjdMXgQPPCfZJB9SfM	timesofindia.indiatimes.com	1396884980080
87041	Pfizer drug helps stop progression of breast cancer	http://seekingalpha.com/news/1662043-pfizer-drug-helps-stop-progression-of-breast-cancer	Seeking Alpha	m	dhverHBv1VepjdMXgQPPCfZJB9SfM	seekingalpha.com	1396884980353
87042	Drug shows promise battling breast cancer	http://www.bostonglobe.com/business/2014/04/06/breast-cancer-drug-shows-groundbreaking-results/giiT981vsei3gZfBFRufcO/story.html	Boston Globe	m	dhverHBv1VepjdMXgQPPCfZJB9SfM	www.bostonglobe.com	1396884980554
87043	Pfizer's Palbociclib Delays Breast Cancer Progression By Nearly Two Years	http://www.hngn.com/articles/28247/20140407/pfizers-palbociclib-delays-breast-cancer-progression-nearly-two-years.htm	Headlines \& Global News	m	dhverHBv1VepjdMXgQPPCfZJB9SfM	www.hngn.com	1396884980788
87044	Pfizer, Lilly drugs slow advanced breast cancer in studies	http://www.journalgazette.net/article/20140407/NEWS10/304079957/1005/NEWS10	Fort Wayne Journal Gazette	m	dhverHBv1VepjdMXgQPPCfZJB9SfM	www.journalgazette.net	1396884980974
87045	New breast cancer drug shows promising results	http://www.post-gazette.com/news/health/2014/04/07/New-breast-cancer-drug-shows-promising-results/stories/201404070057	Pittsburgh Post-Gazette	m	dhverHBv1VepjdMXgQPPCfZJB9SfM	www.post-gazette.com	1396884981626
87046	Pfizer Experimental Drug Shows Promising Results in Phase II Study	http://newstonight.co.za/content/pfizer-experimental-drug-shows-promising-results-phase-ii-study	News Tonight Africa	m	dhverHBv1VepjdMXgQPPCfZJB9SfM	newstonight.co.za	1396884981911
87047	Promising Results Pertaining To Pfizers' Cancer Drug	http://yottafire.com/2014/04/promising-results-pertaining-to-pfizers-cancer-drug/	YottaFire	m	dhverHBv1VepjdMXgQPPCfZJB9SfM	yottafire.com	1396884982113
87048	Pfizer reports promising results for new breast cancer drug	http://www.japantimes.co.jp/news/2014/04/07/world/pfizer-reports-promising-results-for-new-breast-cancer-drug/	The Japan Times	m	dhverHBv1VepjdMXgQPPCfZJB9SfM	www.japantimes.co.jp	1396884982311
87049	New drug used to treat breast cancer heralded as 'quite groundbreaking'	http://www.catholic.org/news/health/story.php\?id=54839	Catholic Online	m	dhverHBv1VepjdMXgQPPCfZJB9SfM	www.catholic.org	1396884982533
87050	Breast cancer drug shows promising results	http://www.theglobeandmail.com/life/health-and-fitness/health/breast-cancer-drug-shows-promising-results/article17850632/	The Globe and Mail	m	dhverHBv1VepjdMXgQPPCfZJB9SfM	www.theglobeandmail.com	1396884982969
87051	AACR 2014: Phase II data for palbociclib striking; biomarker mysteries remain	http://www.bioworld.com/content/aacr-2014-phase-ii-data-palbociclib-striking-biomarker-mysteries-remain-0	BioWorld Online	m	dhverHBv1VepjdMXgQPPCfZJB9SfM	www.bioworld.com	1396884983170
87052	Pfizer reports promising results for cancer-fighting drug	http://www.wcpo.com/news/health/healthy-living/pfizer-pfe-reports-promising-results-of-cancer-fighting-drug	WCPO	m	dhverHBv1VepjdMXgQPPCfZJB9SfM	www.wcpo.com	1396884983320
87053	Two new breast-cancer drugs slowed, shrank tumors	http://www.pressherald.com/news/Two_new_breast-cancer_drugs_slowed__shrank_tumors_.html	Press Herald	m	dhverHBv1VepjdMXgQPPCfZJB9SfM	www.pressherald.com	1396884983545
87054	Pfizer Breast Cancer Drug Helps Revive Discarded Strategy	http://www.businessweek.com/news/2014-04-06/pfizer-breast-cancer-drug-helps-revive-discarded-strategy	Businessweek	m	dhverHBv1VepjdMXgQPPCfZJB9SfM	www.businessweek.com	1396884983750
87055	Pfizer says drug shows promises in treating advanced breast cancer	http://www.ctvnews.ca/health/pfizer-says-drug-shows-promises-in-treating-advanced-breast-cancer-1.1763839	CTV News	m	dhverHBv1VepjdMXgQPPCfZJB9SfM	www.ctvnews.ca	1396884984064
87056	Experimental breast cancer drug undergoes encouraging trial	http://tvnz.co.nz/world-news/experimental-breast-cancer-drug-undergoes-encouraging-trial-5888599	TVNZ	m	dhverHBv1VepjdMXgQPPCfZJB9SfM	tvnz.co.nz	1396884984249
87057	New hope in the fight against breast cancer	http://www.dailylife.com.au/world/new-hope-in-the-fight-against-breast-cancer-20140407-zqrm5.html	Daily Life	m	dhverHBv1VepjdMXgQPPCfZJB9SfM	www.dailylife.com.au	1396884984480
87058	New drug doubles time to breast cancer tumor growth in trial	http://www.samaa.tv/health/07-Apr-2014/new-drug-doubles-time-to-breast-cancer-tumor-growth-in-trial	SAMAA TV	m	dhverHBv1VepjdMXgQPPCfZJB9SfM	www.samaa.tv	1396884984681
87059	'Breakthrough' Breast Cancer Drug, Palbociclib, Doubles Time Of Tumor Growth  ...	http://www.medicaldaily.com/breakthrough-breast-cancer-drug-palbociclib-doubles-time-tumor-growth-should-fda-fast-track-pfizers	Medical Daily	m	dhverHBv1VepjdMXgQPPCfZJB9SfM	www.medicaldaily.com	1396884984967
87060	CDK4/6 Inhibitors Hinder Breast Cancer Progress	http://www.medpagetoday.com/MeetingCoverage/AACR/45128	MedPage Today	m	dhverHBv1VepjdMXgQPPCfZJB9SfM	www.medpagetoday.com	1396884985202
87061	Breast cancer drug shows 'groundbreaking' results	http://www.peninsuladailynews.com/article/20140406/NEWS/140409982/breast-cancer-drug-shows-groundbreaking-results	Peninsula Daily	m	dhverHBv1VepjdMXgQPPCfZJB9SfM	www.peninsuladailynews.com	1396884985468
87062	Pfizer's Novel CDK 4/6 Inhibitor Palbociclib plus Letrozole Significantly  ...	http://www.fortmilltimes.com/2014/04/06/3398584/pfizers-novel-cdk-46-inhibitor.html	Fort Mills Times	m	dhverHBv1VepjdMXgQPPCfZJB9SfM	www.fortmilltimes.com	1396884985679
87063	Childhood obesity costs $19000 per child	http://www.statecolumn.com/2014/04/childhood-obesity-costs-19000-per-child/	State Column	m	dSCzUZ641hki0tM8Wdcf5xL_VXMhM	www.statecolumn.com	1396885162706
87064	STUDY: Obese children add up $6000 more in medical bills	http://www.wxyz.com/news/study-obese-children-add-up-6000-more-in-medical-bills	WXYZ	m	dSCzUZ641hki0tM8Wdcf5xL_VXMhM	www.wxyz.com	1396885162885
87065	Childhood Obesity Adds Nearly $20K to Lifetime Medical Costs: Study	http://www.doctorslounge.com/index.php/news/hd/45761	Doctors Lounge	m	dSCzUZ641hki0tM8Wdcf5xL_VXMhM	www.doctorslounge.com	1396885163437
87066	Obesity is expensive, US study finds	http://www.sunnewsnetwork.ca/sunnews/lifestyle/archives/2014/04/20140407-094831.html	Sun News Network	m	dSCzUZ641hki0tM8Wdcf5xL_VXMhM	www.sunnewsnetwork.ca	1396885163688
87067	Obese children cost an additional $19K in medical expenses	http://www.bizjournals.com/triangle/blog/2014/04/obese-children-cost-an-additional-19k-in-medical.html	Triangle Business Journal \(blog\)	m	dSCzUZ641hki0tM8Wdcf5xL_VXMhM	www.bizjournals.com	1396885163889
87068	Over a lifetime, childhood obesity costs $19000 per child	http://scienceblog.com/71516/over-a-lifetime-childhood-obesity-costs-19000-per-child/	ScienceBlog.com \(blog\)	m	dSCzUZ641hki0tM8Wdcf5xL_VXMhM	scienceblog.com	1396885164192
87069	Childhood Obesity Costs $19000 Over Lifetime	http://www.laboratoryequipment.com/news/2014/04/childhood-obesity-costs-19000-over-lifetime	Laboratory Equipment	m	dSCzUZ641hki0tM8Wdcf5xL_VXMhM	www.laboratoryequipment.com	1396885164476
87070	Lifetime Medical Cost Of Childhood Obesity is $19000 Per Child	http://www.hngn.com/articles/28251/20140407/lifetime-medical-cost-childhood-obesity-19-000-per-child.htm	Headlines \& Global News	m	dSCzUZ641hki0tM8Wdcf5xL_VXMhM	www.hngn.com	1396885164720
87071	Medical costs of childhood obesity: $19K per kid	http://triblive.com/usworld/nation/5900009-74/costs-obesity-health	Tribune-Review	m	dSCzUZ641hki0tM8Wdcf5xL_VXMhM	triblive.com	1396885164913
87072	This Is How Much Childhood Obesity Costs Over a Lifetime	http://time.com/50986/this-is-how-much-childhood-obesity-costs-over-a-lifetime/	TIME	m	dSCzUZ641hki0tM8Wdcf5xL_VXMhM	time.com	1396885165264
87073	Routine Blood Test May Detect Cancer	http://www.physiciansnews.com/2014/04/07/routine-blood-test-may-detect-cancer/	Physicians News Digest	m	dsbCP8LhzcOb2VM-3_5hSV8mu696M	www.physiciansnews.com	1396885369566
87074	A simple blood test to detect 'solid' cancers?	http://main.omanobserver.om/\?p=70964	Oman Daily Observer	m	dsbCP8LhzcOb2VM-3_5hSV8mu696M	main.omanobserver.om	1396885369940
87075	Blood Test for Cancer Would Be More Accurate and Able to Detect Multiple  ...	http://www.universityherald.com/articles/8648/20140407/blood-test-for-cancer-would-be-more-accurate-and-able-to-detect-multiple-types-stanford-researchers-find.htm	University Herald	m	dsbCP8LhzcOb2VM-3_5hSV8mu696M	www.universityherald.com	1396885370162
87076	Blood test can spot cancer DNA, could lead to early, life-saving detection	http://www.techtimes.com/articles/5295/20140407/blood-test-can-spot-cancer-dna-could-lead-to-early-life-saving-detection.htm	Tech Times	m	dsbCP8LhzcOb2VM-3_5hSV8mu696M	www.techtimes.com	1396885370385
87077	Simple Blood Test To Spot Early Lung Cancer Getting Closer	http://www.npr.org/blogs/health/2014/04/06/299179255/simple-blood-test-to-spot-early-lung-cancer-getting-closer	NPR \(blog\)	m	dsbCP8LhzcOb2VM-3_5hSV8mu696M	www.npr.org	1396885370582
87078	Simple blood test could help detect cancer	http://www.healthcentral.com/dailydose/cf/2014/04/7/simple_blood_test_could_help_detect_cancer	HealthCentral.com	m	dsbCP8LhzcOb2VM-3_5hSV8mu696M	www.healthcentral.com	1396885370841
87079	A blood test to detect a wide range of cancers	http://www.west-info.eu/lung-cancer-cancer-blood-test/	West - Welfare Society Territory	m	dsbCP8LhzcOb2VM-3_5hSV8mu696M	www.west-info.eu	1396885371164
87080	Blood will tell: In Stanford study, tiny bits of circulating tumor DNA betray hidden  ...	http://scopeblog.stanford.edu/2014/04/07/blood-will-tell-in-stanford-study-tiny-bits-of-circulating-tumor-dna-betray-hidden-cancers/	Scope \(blog\)	m	dsbCP8LhzcOb2VM-3_5hSV8mu696M	scopeblog.stanford.edu	1396885371369
87081	Could a Simple Blood Test Detect 'Solid' Cancers?	http://www.scienceworldreport.com/articles/13885/20140407/could-a-simple-blood-test-detect-solid-cancers.htm	Science World Report	m	dsbCP8LhzcOb2VM-3_5hSV8mu696M	www.scienceworldreport.com	1396885371584
87082	Blood Test Devised to Detect Solid Cancers in a Clinical Setting	http://www.genengnews.com/gen-news-highlights/blood-test-devised-to-detect-solid-cancers-in-a-clinical-setting/81249714/	Genetic Engineering News	m	dsbCP8LhzcOb2VM-3_5hSV8mu696M	www.genengnews.com	1396885371772
87083	Blood test could provide rapid, accurate method of detecting solid cancers	http://scienceblog.com/71525/blood-test-could-provide-rapid-accurate-method-of-detecting-solid-cancers/	ScienceBlog.com \(blog\)	m	dsbCP8LhzcOb2VM-3_5hSV8mu696M	scienceblog.com	1396885372008
87084	Blood Test Could Detect Signs of Lung Cancer	http://www.counselheal.com/articles/9254/20140407/blood-test-could-detect-signs-of-lung-cancer.htm	Counsel \& Heal	m	dsbCP8LhzcOb2VM-3_5hSV8mu696M	www.counselheal.com	1396885372192
87085	Blood test to accurately detect cancers and how advanced disease is	http://www.financialexpress.com/news/soon-blood-test-to-accurately-detect-cancers/1238842	Financial Express	m	dsbCP8LhzcOb2VM-3_5hSV8mu696M	www.financialexpress.com	1396885372375
87086	Simple blood test could detect cancers	http://www.foxnews.com/health/2014/04/07/simple-blood-test-could-detect-cancers/	Fox News	m	dsbCP8LhzcOb2VM-3_5hSV8mu696M	www.foxnews.com	1396885372704
87087	Simple Blood Test could Diagnose Cancer	http://austriantribune.com/informationen/143357-simple-blood-test-could-diagnose-cancer	Austrian Tribune	m	dsbCP8LhzcOb2VM-3_5hSV8mu696M	austriantribune.com	1396885372888
87088	Simple Blood Test to Detect Solid Cancers	http://americanlivewire.com/2014-04-07-simple-blood-test-detect-solid-cancers/	American Live Wire	m	dsbCP8LhzcOb2VM-3_5hSV8mu696M	americanlivewire.com	1396885373073
87089	Could blood test unlock cancer diagnosis, treatment options?	http://fox59.com/2014/04/07/could-blood-test-unlock-cancer-diagnosis-treatment-options/	Fox 59	m	dsbCP8LhzcOb2VM-3_5hSV8mu696M	fox59.com	1396885373425
87090	Soon a blood test to detect solid cancers	http://www.delhidailynews.com/news/Blood-test-to-detect-solid-cancers-coming-soon-1396871000/	Delhi Daily News	m	dsbCP8LhzcOb2VM-3_5hSV8mu696M	www.delhidailynews.com	1396885373736
87091	Quick and Easy Blood Test to Diagnose Cancer and its Stage	http://www.onlymyhealth.com/soon-a-quick-and-easy-blood-test-will-diagnose-cancer-and-its-stage-1396866647	Onlymyhealth	m	dsbCP8LhzcOb2VM-3_5hSV8mu696M	www.onlymyhealth.com	1396885373930
87092	Quick and Simple Blood Test to Detect Cancer	http://newstonight.co.za/content/quick-and-simple-blood-test-detect-cancer	News Tonight Africa	m	dsbCP8LhzcOb2VM-3_5hSV8mu696M	newstonight.co.za	1396885374189
87093	Soon blood test to accurately detect cancers	http://post.jagran.com/soon-blood-test-to-accurately-detect-cancers-1396866344	Jagran Post	m	dsbCP8LhzcOb2VM-3_5hSV8mu696M	post.jagran.com	1396885374416
87094	A simple blood test could help detect 'solid' cancers	http://health.india.com/news/a-simple-blood-test-can-help-detect-solid-cancers/	India.Com Health	m	dsbCP8LhzcOb2VM-3_5hSV8mu696M	health.india.com	1396885374667
87095	Quick, simple blood test for solid cancers looks feasible	http://www.medicalnewstoday.com/articles/275146.php	Medical News Today	m	dsbCP8LhzcOb2VM-3_5hSV8mu696M	www.medicalnewstoday.com	1396885374877
87096	Soon blood test to detect many types of solid cancers	http://www.business-standard.com/article/news-ani/soon-blood-test-to-detect-many-types-of-solid-cancers-114040700540_1.html	Business Standard	m	dsbCP8LhzcOb2VM-3_5hSV8mu696M	www.business-standard.com	1396885375120
87097	Blood test could provide rapid, accurate method of detecting solid cancers, study  ...	http://www.healthcanal.com/cancers/49514-blood-test-could-provide-rapid-accurate-method-of-detecting-solid-cancers-study-finds.html	HealthCanal.com	m	dsbCP8LhzcOb2VM-3_5hSV8mu696M	www.healthcanal.com	1396885375314
87098	Simple Blood Test Could Diagnose Cancer and Determine How Advanced the  ...	http://www.ibtimes.co.uk/simple-blood-test-could-diagnose-cancer-determine-how-advanced-disease-1443649	International Business Times UK	m	dsbCP8LhzcOb2VM-3_5hSV8mu696M	www.ibtimes.co.uk	1396885375668
87099	Blood sample could diagnose many types of solid cancers	http://www.news-medical.net/news/20140407/Blood-sample-could-diagnose-many-types-of-solid-cancers.aspx	News-Medical.net	m	dsbCP8LhzcOb2VM-3_5hSV8mu696M	www.news-medical.net	1396885375959
87100	Could a blood test diagnose cancer?	http://americanlivewire.com/2014-04-06-blood-test-diagnose-cancer/	American Live Wire	m	dsbCP8LhzcOb2VM-3_5hSV8mu696M	americanlivewire.com	1396885376219
