409201	Teen raped at Keith Urban concert, dozens more arrested and hospitalized	http://www.dose.ca/2014/07/31/teen-raped-keith-urban-concert-dozens-more-arrested-and-hospitalized	Dose.ca	e	dpqPmPLTLs7FHZMZjd1B_8M56sLFM	www.dose.ca	1406878983520
409202	Police: Teen girl raped during Keith Urban concert while crowd watched	http://starcasm.net/archives/282082	Starcasm.net	e	dpqPmPLTLs7FHZMZjd1B_8M56sLFM	starcasm.net	1406878984007
409203	Keith Urban News: Country Singer's Concert Declared 'Mass Casualty Incident  ...	http://www.enstarz.com/articles/42780/20140731/keith-urban-news-country-singers-concert-declared-mass-casualty-incident-by-police-following-rape-accusation-alcohol-poisoning-video.htm	Enstarz	e	dpqPmPLTLs7FHZMZjd1B_8M56sLFM	www.enstarz.com	1406878984262
409204	Cops Say Teen Was Raped In Front of Crowd at a Keith Urban Concert	http://www.intouchweekly.com/posts/cops-say-teen-was-raped-in-front-of-crowd-at-a-keith-urban-concert-41125	In Touch Weekly	e	dpqPmPLTLs7FHZMZjd1B_8M56sLFM	www.intouchweekly.com	1406878984600
409205	17-Year Old Girl Raped At Keith Urban Concert (2014)	http://www.beautyworldnews.com/articles/10730/20140731/17-year-old-girl-raped-at-keith-urban-concert-2014.htm	Beauty World News	e	dpqPmPLTLs7FHZMZjd1B_8M56sLFM	www.beautyworldnews.com	1406878984880
409206	Man arrested for raping teen at Keith Urban concert	http://www.wfsb.com/story/26157323/man-arrested-for-raping-teen-at-keith-urban-concert	WFSB	e	dpqPmPLTLs7FHZMZjd1B_8M56sLFM	www.wfsb.com	1406878985229
409207	Teen 'raped' girl in front of boozy Keith Urban crowd	http://nypost.com/2014/07/31/teen-accused-of-raping-woman-at-keith-urban-concert/	New York Post	e	dpqPmPLTLs7FHZMZjd1B_8M56sLFM	nypost.com	1406878985556
409208	A Teen Girl Was Allegedly Raped At A Keith Urban Concert While Bystanders  ...	http://www.businessinsider.com/teen-girl-raped-at-massachusetts-keith-urban-concert-2014-7	Business Insider	e	dpqPmPLTLs7FHZMZjd1B_8M56sLFM	www.businessinsider.com	1406878985838
409209	SO OVER: Let's hope Keith Urban fans aren't as badly behaved in St. Louis	http://www.stltoday.com/entertainment/music/so-over-let-s-hope-keith-urban-fans-aren-t/article_7cf9b56f-11ed-5807-80f6-c36c9882f0ce.html	STLtoday.com	e	dpqPmPLTLs7FHZMZjd1B_8M56sLFM	www.stltoday.com	1406878986185
409210	Did a concert crowd record a rape?	http://www.salon.com/2014/07/31/did_a_concert_crowd_record_a_rape/	Salon	e	dpqPmPLTLs7FHZMZjd1B_8M56sLFM	www.salon.com	1406878986522
409211	Teen raped on lawn at Keith Urban show police say - KCTV5	http://www.kctv5.com/story/26154878/teen-raped-on-lawn-at-keith-urban-show-police-say	KCTV Kansas City	e	dpqPmPLTLs7FHZMZjd1B_8M56sLFM	www.kctv5.com	1406878986832
409212	Teen raped on lawn at Keith Urban show police say - WFSB 3 Connecticut	http://www.wfsb.com/story/26154878/teen-raped-on-lawn-at-keith-urban-show-police-say	WFSB	e	dpqPmPLTLs7FHZMZjd1B_8M56sLFM	www.wfsb.com	1406878987246
409213	Boston man charged with raping teen at Keith Urban concert	http://www.kmov.com/entertainment/Boston-man-charged-with-rape-at-Urban-concert-269383061.html	KMOV.com	e	dpqPmPLTLs7FHZMZjd1B_8M56sLFM	www.kmov.com	1406878987462
409214	Rape alleged at Keith Urban concert	http://www.thestar.com/entertainment/music/2014/07/31/rape_alleged_at_keith_urban_concert.html	Toronto Star	e	dpqPmPLTLs7FHZMZjd1B_8M56sLFM	www.thestar.com	1406878987790
409215	Cops: Teen Girl Raped in Front of Huge Crowd at Keith Urban Show	http://gawker.com/cops-teen-girl-raped-in-front-of-huge-crowd-at-keith-u-1613889133	Gawker	e	dpqPmPLTLs7FHZMZjd1B_8M56sLFM	gawker.com	1406878988267
409216	Teen Raped At Keith Urban Concert In Front Of Hundreds Of Fans	http://www.thefrisky.com/2014-07-31/teen-raped-at-keith-urban-concert-in-front-of-hundreds-of-fans/	The Frisky	e	dpqPmPLTLs7FHZMZjd1B_8M56sLFM	www.thefrisky.com	1406878988639
409217	Keith Urban Concert Update: 17-Year-Old Girl Allegedly Raped	http://www.hngn.com/articles/37622/20140731/keith-urban-concert-update-17-year-old-girl-allegedly-raped.htm	Headlines \& Global News	e	dpqPmPLTLs7FHZMZjd1B_8M56sLFM	www.hngn.com	1406878989072
409218	Man allegedly raped girl at Keith Urban concert while onlookers took cellphone  ...	http://www.syracuse.com/news/index.ssf/2014/07/man_allegedly_raped_girl_at_keith_urban_concert_while_onlookers_took_cellphone_v.html	The Post-Standard	e	dpqPmPLTLs7FHZMZjd1B_8M56sLFM	www.syracuse.com	1406878989692
409219	17-Year-Old Girl Allegedly Raped At Keith Urban Concert	http://www.antimusic.com/news/14/July/3117-Year-Old_Girl_Allegedly_Raped_At_Keith_Urban_Concert.shtml	antiMUSIC.com	e	dpqPmPLTLs7FHZMZjd1B_8M56sLFM	www.antimusic.com	1406878989996
409220	Boston man charged with rape at weekend Keith Urban concert after bystanders  ...	http://www.mysask.com/portal/site/main/template.MAXIMIZE/\?javax.portlet.tpst=482f4aa4b0013921802ac01060315ae8_ws_MX&amp;javax.portlet.prp_482f4aa4b0013921802ac01060315ae8_viewID=story&amp;javax.portlet.prp_482f4aa4b0013921802ac01060315ae8_topic_display_name=World%20News&amp;javax.portlet.prp_482f4aa4b0013921802ac01060315ae8_topic_name=World&amp;javax.portlet.prp_482f4aa4b0013921802ac01060315ae8_news_item_id_key=29326671&amp;javax.portlet.begCacheTok=com.vignette.cachetoken&amp;javax.portlet.endCacheTok=com.vignette.cachetoken	mysask.com	e	dpqPmPLTLs7FHZMZjd1B_8M56sLFM	www.mysask.com	1406878990324
409221	Alleged sexual assault at concert	http://kansasfirstnews.com/2014/07/30/alleged-sexual-assault-at-concert/	Kansas First News	e	dpqPmPLTLs7FHZMZjd1B_8M56sLFM	kansasfirstnews.com	1406878990867
409222	Mass. man accused of raping 17-year-old at country music show	http://www.cbsnews.com/news/massachusetts-man-accused-of-raping-17-year-old-at-country-music-show/	CBS News	e	dpqPmPLTLs7FHZMZjd1B_8M56sLFM	www.cbsnews.com	1406878991501
409223	Mansfield police ask for help in concert rape case	http://bostonherald.com/news_opinion/local_coverage/herald_bulldog/2014/07/mansfield_police_ask_for_help_in_concert_rape\?utm_source=feedburner&amp;utm_medium=feed&amp;utm_campaign=Feed%3A+bostonherald%2Fnews%2Fregional+(Local+%2F+Regional+-+News+%26+Opinion+-+BostonHerald.com)	Boston Herald	e	dpqPmPLTLs7FHZMZjd1B_8M56sLFM	bostonherald.com	1406878992151
409224	Man charged with raping 17-year-old girl at Keith Urban concert	http://consequenceofsound.net/2014/07/man-charged-with-raping-17-year-old-girl-at-keith-urban-concert/	Consequence of Sound	e	dpqPmPLTLs7FHZMZjd1B_8M56sLFM	consequenceofsound.net	1406878992414
409225	Rape charge at Xfinity Center rocks Mansfield	http://bostonherald.com/news_opinion/local_coverage/2014/07/rape_charge_at_xfinity_center_rocks_mansfield	Boston Herald	e	dpqPmPLTLs7FHZMZjd1B_8M56sLFM	bostonherald.com	1406878993351
409226	Man accused of raping a woman during a concert	http://wwlp.com/2014/07/29/man-accused-of-raping-a-woman-during-a-concert/	wwlp.com	e	dpqPmPLTLs7FHZMZjd1B_8M56sLFM	wwlp.com	1406878993583
409227	Rape alleged at Keith Urban concert while onlookers videotaped	http://www.wggb.com/2014/07/29/rape-alleged-at-keith-urban-concert-while-onlookers-videotaped/	abc40	e	dpqPmPLTLs7FHZMZjd1B_8M56sLFM	www.wggb.com	1406878993916
409228	Man arrested in connection with alleged concert rape	http://www.whdh.com/story/26145762/man-arrested-in-connection-with-alleged-concert-rape	WHDH-TV	e	dpqPmPLTLs7FHZMZjd1B_8M56sLFM	www.whdh.com	1406878994182
409229	Rape Alleged at Boston Area Keith Urban Concert	http://www.rollingstone.com/music/news/rape-alleged-at-boston-area-keith-urban-concert-20140729	RollingStone.com	e	dpqPmPLTLs7FHZMZjd1B_8M56sLFM	www.rollingstone.com	1406878994432
409230	Man accused of raping girl at Xfinity Center concert	http://www.turnto10.com/story/26143441/man-accused-of-raping-girl-at-xfinity-center-concert	Turn to 10	e	dpqPmPLTLs7FHZMZjd1B_8M56sLFM	www.turnto10.com	1406878994698
409231	Keith Urban Show Results In Many Alcohol Related Illnesses	http://www.rttnews.com/2358509/keith-urban-show-results-in-many-alcohol-related-illnesses.aspx\?type=ent	RTT News	e	dpqPmPLTLs7FHZMZjd1B_8M56sLFM	www.rttnews.com	1406878995034
409232	Keith Urban Show Results In Many Alcohol Related Illness	http://www.rttnews.com/2358504/keith-urban-show-results-in-many-alcohol-related-illness.aspx\?type=ent	RTT News	e	dpqPmPLTLs7FHZMZjd1B_8M56sLFM	www.rttnews.com	1406878995252
409233	Keller @ Large: Binge-Drinking Storm Batters Bay State	http://boston.cbslocal.com/2014/07/29/keller-large-binge-drinking-storm-batters-bay-state/	CBS Local	e	dpqPmPLTLs7FHZMZjd1B_8M56sLFM	boston.cbslocal.com	1406878995456
409234	Rape alleged at Xfinity Center concert as onlookers take cellphone video	http://www.wcvb.com/news/rape-alleged-at-xfinity-center-concert-as-onlookers-take-cellphone-video/27203066	WCVB Boston	e	dpqPmPLTLs7FHZMZjd1B_8M56sLFM	www.wcvb.com	1406878995690
409235	See-through mice reveal details of inner anatomy	http://www.heraldnet.com/article/20140801/NEWS02/140809931	HeraldNet	m	dpDCzUmrOyOe1yMkT6VpwDhYF1kpM	www.heraldnet.com	1406879267460
409236	See-through mice reveal details of their inner anatomy	http://www.messenger-inquirer.com/news/national/see-through-mice-reveal-details-of-their-inner-anatomy/article_8d8b83c8-9cd3-5551-b6e2-5b5ca7965166.html	messenger-inquirer	m	dpDCzUmrOyOe1yMkT6VpwDhYF1kpM	www.messenger-inquirer.com	1406879267791
409237	See-through mice created by scientists look creepy, but could lead to medical  ...	http://theweek.com/speedreads/index/265669/speedreads-see-through-mice-created-by-scientists-look-creepy-but-could-lead-to-medical-breakthroughs	The Week Magazine	m	dpDCzUmrOyOe1yMkT6VpwDhYF1kpM	theweek.com	1406879268156
409238	Transparent rodents reveal details of inner anatomy	http://www.news-journal.com/news/nation/transparent-rodents-reveal-details-of-inner-anatomy/article_96ea18d6-4f83-5f3e-8e5d-bdacffc46f0f.html	Longview News-Journal	m	dpDCzUmrOyOe1yMkT6VpwDhYF1kpM	www.news-journal.com	1406879268580
409239	Researchers Make Whole See-Through Mice	http://www.latinpost.com/articles/18380/20140801/researchers-make-whole-see-through-mice.htm	Latin Post	m	dpDCzUmrOyOe1yMkT6VpwDhYF1kpM	www.latinpost.com	1406879268881
409240	Why a see-through mouse is a big deal for scientists	http://www.stwnewspress.com/ourworld/x1027615776/Why-a-see-through-mouse-is-a-big-deal-for-scientists	Stillwater News Press	m	dpDCzUmrOyOe1yMkT6VpwDhYF1kpM	www.stwnewspress.com	1406879269266
409241	Scientists create see-through mouse and rat bodies	http://www.latimes.com/science/sciencenow/la-sci-sn-tissue-clearing-20140731-story.html	Los Angeles Times	m	dpDCzUmrOyOe1yMkT6VpwDhYF1kpM	www.latimes.com	1406879269806
409242	Researchers make entire mouse transparent, for science	http://www.techtimes.com/articles/11800/20140731/scientists-make-entire-mouse-transparent-because-science.htm	Tech Times	m	dpDCzUmrOyOe1yMkT6VpwDhYF1kpM	www.techtimes.com	1406879270064
409243	Scientists create see-through mice	http://www.wtsp.com/story/news/weird/2014/07/31/science-mice/13425909/	WTSP 10 News	m	dpDCzUmrOyOe1yMkT6VpwDhYF1kpM	www.wtsp.com	1406879270281
409244	See-through mice reveal details of inner anatomy, researchers say	http://www.poconorecord.com/apps/pbcs.dll/article\?AID=/20140731/NEWS90/140739957/-1/NEWS	Pocono Record	m	dpDCzUmrOyOe1yMkT6VpwDhYF1kpM	www.poconorecord.com	1406879270607
409245	Transparent Bodies: Mice Go See-Through For Science	http://www.livescience.com/47150-transparent-whole-mouse-body.html	LiveScience.com	m	dpDCzUmrOyOe1yMkT6VpwDhYF1kpM	www.livescience.com	1406879270878
409246	Scientists develop see-through mice	http://www.news.com.au/technology/science/scientists-develop-seethrough-mice/story-fnjwkt0b-1227009753935	NEWS.com.au	m	dpDCzUmrOyOe1yMkT6VpwDhYF1kpM	www.news.com.au	1406879271134
409247	Caltech researchers' see-through mouse has important neuroscience applications	http://www.thestar.com/news/world/2014/07/31/caltech_researchers_seethrough_mouse_has_important_neuroscience_applications.html	Toronto Star	m	dpDCzUmrOyOe1yMkT6VpwDhYF1kpM	www.thestar.com	1406879271401
409248	Scientists Made This Entire Mouse Transparent Using Detergent	http://www.gizmodo.in/Science/Scientists-Made-This-Entire-Mouse-Transparent-Using-Detergent/articleshow/39382727.cms	Gizmodo India	m	dpDCzUmrOyOe1yMkT6VpwDhYF1kpM	www.gizmodo.in	1406879271750
409249	Let's clear this up: Scientists create see-through mice to get detailed look at inner  ...	http://www.newser.com/article/0ef5a946cc694613b21d4290bddd46fb/lets-clear-this-up-scientists-create-see-through-mice-to-get-detailed-look-at-inner-anatomy.html	Newser	m	dpDCzUmrOyOe1yMkT6VpwDhYF1kpM	www.newser.com	1406879272111
409250	See-through mice a reality	http://www.stuff.co.nz/science/10336470/See-through-mice-a-reality	Stuff.co.nz	m	dpDCzUmrOyOe1yMkT6VpwDhYF1kpM	www.stuff.co.nz	1406879272400
409251	US scientists create see-through mice to get detailed look at inner anatomy	http://www.mysask.com/portal/site/main/template.MAXIMIZE/\?javax.portlet.tpst=635b2ff202604ea181fa421740315ae8_ws_MX&amp;javax.portlet.prp_635b2ff202604ea181fa421740315ae8_viewID=story&amp;javax.portlet.prp_635b2ff202604ea181fa421740315ae8_topic_display_name=World%20News&amp;javax.portlet.prp_635b2ff202604ea181fa421740315ae8_topic_name=World&amp;javax.portlet.prp_635b2ff202604ea181fa421740315ae8_news_item_id_key=29334156&amp;javax.portlet.begCacheTok=com.vignette.cachetoken&amp;javax.portlet.endCacheTok=com.vignette.cachetoken	mysask.com	m	dpDCzUmrOyOe1yMkT6VpwDhYF1kpM	www.mysask.com	1406879272698
409252	See-through Mice Map Nervous System, Cancer Spread	http://www.laboratoryequipment.com/news/2014/08/see-through-mice-map-nervous-system-cancer-spread	Laboratory Equipment	m	dpDCzUmrOyOe1yMkT6VpwDhYF1kpM	www.laboratoryequipment.com	1406879272980
409253	Scientists Create Creepy-Looking Transparent Mice	http://gawker.com/scientists-create-creepy-looking-transparent-mice-1614097870	Gawker	m	dpDCzUmrOyOe1yMkT6VpwDhYF1kpM	gawker.com	1406879273481
409254	Amazing 'See-Through' Mice Seen As Aid To Study Of Anatomy	http://www.huffingtonpost.com/2014/07/31/see-through-mice_n_5638882.html	Huffington Post	m	dpDCzUmrOyOe1yMkT6VpwDhYF1kpM	www.huffingtonpost.com	1406879273817
409255	Scientists create transparent mouse to take look at creature's anatomy	http://www.theglobeandmail.com/technology/science/scientists-create-transparent-mouse-to-take-look-at-creatures-anatomy/article19876718/	The Globe and Mail	m	dpDCzUmrOyOe1yMkT6VpwDhYF1kpM	www.theglobeandmail.com	1406879274039
409256	Scientific breakthrough with first fully transparent mouse	http://tvnz.co.nz/world-news/scientific-breakthrough-first-fully-transparent-mouse-6043272	TVNZ	m	dpDCzUmrOyOe1yMkT6VpwDhYF1kpM	tvnz.co.nz	1406879274397
409257	See-Through Mice: Disgusting to Us, Probably Useful to Scientists	http://mashable.com/2014/07/31/see-through-mice-mouse/	Mashable	m	dpDCzUmrOyOe1yMkT6VpwDhYF1kpM	mashable.com	1406879274757
409258	See-through mice reveal details of anatomy	http://www.journalgazette.net/article/20140731/NEWS12/140739879	Fort Wayne Journal Gazette	m	dpDCzUmrOyOe1yMkT6VpwDhYF1kpM	www.journalgazette.net	1406879274977
409259	See-through mouse created to let researchers study insides	http://www.contracostatimes.com/news/ci_26251435/see-through-mouse-created-let-researchers-study-insides	Contra Costa Times	m	dpDCzUmrOyOe1yMkT6VpwDhYF1kpM	www.contracostatimes.com	1406879275222
409260	Researchers Create See-Through Mice	http://www.wowt.com/home/headlines/Researchers-Create-See-Through-Mice-269411261.html	WOWT	m	dpDCzUmrOyOe1yMkT6VpwDhYF1kpM	www.wowt.com	1406879275473
409261	See-through mice reveal inner secrets	http://www.detroitnews.com/article/20140731/SCIENCE/307310099/1361/See-through-mice-reveal-details-of-inner-anatomy	The Detroit News	m	dpDCzUmrOyOe1yMkT6VpwDhYF1kpM	www.detroitnews.com	1406879275889
409262	The bizarre see-through mice that could let researchers watch the spread of cancer	http://www.dailymail.co.uk/sciencetech/article-2712272/See-mice-reveal-details-inner-anatomy.html	Daily Mail	m	dpDCzUmrOyOe1yMkT6VpwDhYF1kpM	www.dailymail.co.uk	1406879276163
409263	Detergent treatment turns a mouse see-through	http://www.newscientist.com/article/dn25983-detergent-treatment-turns-a-mouse-seethrough.html	New Scientist	m	dpDCzUmrOyOe1yMkT6VpwDhYF1kpM	www.newscientist.com	1406879276617
409264	US scientists create see-through mice to get detailed look at inner anatomy	http://www.mysask.com/portal/site/main/template.MAXIMIZE/\?javax.portlet.tpst=635b2ff202604ea181fa421740315ae8_ws_MX&amp;javax.portlet.prp_635b2ff202604ea181fa421740315ae8_viewID=story&amp;javax.portlet.prp_635b2ff202604ea181fa421740315ae8_topic_display_name=World%20News&amp;javax.portlet.prp_635b2ff202604ea181fa421740315ae8_topic_name=World&amp;javax.portlet.prp_635b2ff202604ea181fa421740315ae8_news_item_id_key=29334156&amp;javax.portlet.begCacheTok=com.vignette.cachetoken&amp;javax.portlet.endCacheTok=com.vignette.cachetoken	mysask.com	m	dpDCzUmrOyOe1yMkT6VpwDhYF1kpM	www.mysask.com	1406879276965
409265	FDA approves Striverdi Respimat for COPD, includes asthma warning	http://www.healio.com/allergy-immunology/asthma-lower-airway-diseases/news/online/%7B1edc1739-00e8-47d0-a6f7-794db43aeec7%7D/fda-approves-striverdi-respimat-for-copd-includes-asthma-warning	Healio	m	dYAZ7-v__MKHUIMdZrvwo2R-oLtyM	www.healio.com	1406879520273
409266	Once-Daily Inhaler Approved for COPD	http://www.philly.com/philly/health/topics/HealthDay690326_20140731_Once-Daily_Inhaler_Approved_for_COPD.html	Philly.com	m	dYAZ7-v__MKHUIMdZrvwo2R-oLtyM	www.philly.com	1406879520517
409267	FDA approves Boehringer's once-a-day inhaler drug	http://washingtonexaminer.com/fda-approves-boehringers-once-a-day-inhaler-drug/article/feed/2153471	Washington Examiner	m	dYAZ7-v__MKHUIMdZrvwo2R-oLtyM	washingtonexaminer.com	1406879520845
409268	Once-A-Day Inhaler For Lung Disease Approved	http://www.kwtx.com/news/health/headlines/-Once-A-Day-Inhaler-For-Lung-Disease-Approved-269437131.html	KWTX	m	dYAZ7-v__MKHUIMdZrvwo2R-oLtyM	www.kwtx.com	1406879521235
409269	FDA approves once-a-day inhaler drug for patients with chronic lung disease  ...	http://www.tribtown.com/view/story/31b8ccebbeb5413993c2252d203bbca7/US--Inhaler-Drug-Boehringer	The Tribune	m	dYAZ7-v__MKHUIMdZrvwo2R-oLtyM	www.tribtown.com	1406879521524
409270	FDA approves Striverdi Respimat to treat chronic obstructive pulmonary disease	http://www.einnews.com/pr_news/216450486/fda-approves-striverdi-respimat-to-treat-chronic-obstructive-pulmonary-disease	EIN News \(press release\)	m	dYAZ7-v__MKHUIMdZrvwo2R-oLtyM	www.einnews.com	1406879521859
409271	COPD drug, Striverdi Respimat, receives FDA approval	http://www.theglobaldispatch.com/copd-drug-striverdi-respimat-receives-fda-approval-29907/	The Global Dispatch	m	dYAZ7-v__MKHUIMdZrvwo2R-oLtyM	www.theglobaldispatch.com	1406879522262
409272	FDA approves Boehringer Ingelheim lung disease drug	http://www.globalpost.com/dispatch/news/thomson-reuters/140731/fda-approves-boehringer-ingelheim-lung-disease-drug	GlobalPost	m	dYAZ7-v__MKHUIMdZrvwo2R-oLtyM	www.globalpost.com	1406879522519
409273	BRIEF-FDA approves Boehringer's long-acting COPD drug	http://www.reuters.com/article/2014/07/31/fda-brief-idUSL4N0Q67LP20140731	Reuters	m	dYAZ7-v__MKHUIMdZrvwo2R-oLtyM	www.reuters.com	1406879522759
409274	Memory warning for middle-aged drinkers	http://www.irishhealth.com/article.html\?id=23909	Irish Health	m	dHltZcI1y3t8UBMOqqHPelxnq_KyM	www.irishhealth.com	1406879607896
409275	Middle Aged Excessive Boozers May Be Doubling Their Risk Of Future Memory  ...	http://perezhilton.com/fitperez/2014-07-31-memory-loss-increased-twofold-middle-aged-adults-who-drink-a-lot	PerezHilton.com	m	dHltZcI1y3t8UBMOqqHPelxnq_KyM	perezhilton.com	1406879608134
409276	Problem Drinking In Midlife Linked To Memory Trouble Later	http://www.npr.org/blogs/health/2014/07/30/336536259/problem-drinking-in-midlife-linked-to-memory-trouble-later	NPR \(blog\)	m	dHltZcI1y3t8UBMOqqHPelxnq_KyM	www.npr.org	1406879608408
409277	Memory Impairment Could Be Another Side-Effect of Problem Drinking	http://www.610kvnu.com/health/4f4a9fb04fac3b8850b6b1a272fc3e21	610kvnu	m	dHltZcI1y3t8UBMOqqHPelxnq_KyM	www.610kvnu.com	1406879608679
409278	Excessive drinking could lead to memory loss	http://fox2now.com/2014/07/31/excessive-drinking-could-lead-to-memory-loss/	fox2now.com	m	dHltZcI1y3t8UBMOqqHPelxnq_KyM	fox2now.com	1406879609028
409279	Middle-Age Adults With Drinking Problems At Higher Risk of Memory Impairment	http://www.hngn.com/articles/37613/20140731/middle-age-adults-drinking-problems-higher-risk-memory-impairment.htm	Headlines \& Global News	m	dHltZcI1y3t8UBMOqqHPelxnq_KyM	www.hngn.com	1406879609273
409280	Mid-life Drinking Problem Doubles Later Memory Issues	http://www.laboratoryequipment.com/news/2014/07/mid-life-drinking-problem-doubles-later-memory-issues	Laboratory Equipment	m	dHltZcI1y3t8UBMOqqHPelxnq_KyM	www.laboratoryequipment.com	1406879609504
409281	Middle-aged heavy drinking leads to memory loss in old age	http://www.techtimes.com/articles/11623/20140731/middle-age-heavy-drinking-leads-to-memory-loss-in-old-age.htm	Tech Times	m	dHltZcI1y3t8UBMOqqHPelxnq_KyM	www.techtimes.com	1406879609830
409282	Middle-age drinking 'hits memory'	http://www.westernmorningnews.co.uk/Middle-age-drinking-hits-memory/story-22018299-detail/story.html	Western Morning News	m	dHltZcI1y3t8UBMOqqHPelxnq_KyM	www.westernmorningnews.co.uk	1406879610156
409283	Drinking alcohol, even in 'safe' amounts, doubles the risk of severe memory loss  ...	http://news.nationalpost.com/2014/07/30/drinking-alcohol-even-in-safe-amounts-doubles-the-risk-of-severe-memory-loss-study-suggests/	National Post	m	dHltZcI1y3t8UBMOqqHPelxnq_KyM	news.nationalpost.com	1406879610423
409284	Middle-Aged Drinkers Twice As Likely To Experience Memory Impairment In Old  ...	http://www.hngn.com/articles/37564/20140730/middle-aged-drinkers-twice-as-likely-to-experience-memory-impairment-in-old-age.htm	Headlines \& Global News	m	dHltZcI1y3t8UBMOqqHPelxnq_KyM	www.hngn.com	1406879610665
409285	Midlife Drinking Problems Could Spell Memory Loss In Later Life	http://www.huffingtonpost.com/2014/07/30/drinking-memory-loss-_n_5634108.html	Huffington Post	m	dHltZcI1y3t8UBMOqqHPelxnq_KyM	www.huffingtonpost.com	1406879610860
409286	Adults Who've Abused Alcohol May Be at Risk for Memory Problems	http://www.philly.com/philly/health/mental-health/HealthDay690209_20140730_Adults_Who_ve_Abused_Alcohol_May_Be_at_Risk_for_Memory_Problems.html	Philly.com	m	dHltZcI1y3t8UBMOqqHPelxnq_KyM	www.philly.com	1406879611150
409287	Heavy Drinking Can Lead to Late-in-Life Memory Problems: Study	http://www.newsmaxhealth.com/Anti-Aging/alcohol-abuse-memory-dementia/2014/07/30/id/585805/	Newsmax Health	m	dHltZcI1y3t8UBMOqqHPelxnq_KyM	www.newsmaxhealth.com	1406879611344
409288	Midlife Problem Drinking Doubles Chance of Memory Issues	http://www.biosciencetechnology.com/news/2014/07/midlife-problem-drinking-doubles-chance-memory-issues	Bioscience Technology	m	dHltZcI1y3t8UBMOqqHPelxnq_KyM	www.biosciencetechnology.com	1406879611598
409289	Problem Drinking in Midlife Increases Risk of Dementia Later in Life	http://www.natureworldnews.com/articles/8314/20140730/problem-drinking-increases-risk-dementia-later-life.htm	Nature World News	m	dHltZcI1y3t8UBMOqqHPelxnq_KyM	www.natureworldnews.com	1406879611873
409290	A Single Daily Drink Can Lead to Later Life Memory Impairment, New Research  ...	http://www.highlightpress.com/a-single-daily-drink-can-lead-to-later-life-memory-impairment-new-research-suggests/19048/mhoster	Highlight Press	m	dHltZcI1y3t8UBMOqqHPelxnq_KyM	www.highlightpress.com	1406879612299
409291	Drinking in middle age can make you 'twice as likely to have severe memory  ...	http://www.independent.co.uk/news/science/drinking-in-middle-age-can-make-you-twice-as-likely-to-have-severe-memory-problems-9636989.html	The Independent	m	dHltZcI1y3t8UBMOqqHPelxnq_KyM	www.independent.co.uk	1406879612578
409292	Midlife Problem Drinking Leads to Severe Memory Impairment in Later Life	http://www.scienceworldreport.com/articles/16324/20140730/midlife-problem-drinking-leads-to-severe-memory-impairment.htm	Science World Report	m	dHltZcI1y3t8UBMOqqHPelxnq_KyM	www.scienceworldreport.com	1406879612811
409293	Alcohol linked to memory loss: study	http://www.belfasttelegraph.co.uk/news/health/alcohol-linked-to-memory-loss-study-30469225.html	Belfast Telegraph	m	dHltZcI1y3t8UBMOqqHPelxnq_KyM	www.belfasttelegraph.co.uk	1406879613188
409294	Exeter research shows middle aged problem drinkers twice as likely to forget	http://www.exeterexpressandecho.co.uk/Exeter-research-shows-middle-aged-problem/story-22017685-detail/story.html	Exeter Express and Echo	m	dHltZcI1y3t8UBMOqqHPelxnq_KyM	www.exeterexpressandecho.co.uk	1406879613523
409295	Booze warning to middle age drinkers	http://home.bt.com/lifestyle/wellbeing/booze-warning-to-middle-age-drinkers-11363923240993	BT.com	m	dHltZcI1y3t8UBMOqqHPelxnq_KyM	home.bt.com	1406879613736
409296	Just one or two alcoholic drinks a day may trigger memory problems in old age  ...	http://www.telegraph.co.uk/health/healthnews/10997629/Just-one-or-two-alcoholic-drinks-a-day-may-trigger-memory-problems-in-old-age-researcher.html	Telegraph.co.uk	m	dHltZcI1y3t8UBMOqqHPelxnq_KyM	www.telegraph.co.uk	1406879614133
409297	Drinking in middle age doubles memory impairment risks	http://www.business-standard.com/article/news-ani/drinking-in-middle-age-doubles-memory-impairment-risks-114073000360_1.html	Business Standard	m	dHltZcI1y3t8UBMOqqHPelxnq_KyM	www.business-standard.com	1406879614357
409298	Middle aged drinkers 'risk memory loss in later life'	http://www.yorkshirepost.co.uk/news/main-topics/general-news/middle-aged-drinkers-risk-memory-loss-in-later-life-1-6756535	Yorkshire Post	m	dHltZcI1y3t8UBMOqqHPelxnq_KyM	www.yorkshirepost.co.uk	1406879614582
409299	FDA to start regulating lab-developed tests	http://www.modbee.com/2014/07/31/3466858/fda-to-start-regulating-lab-developed.html	Modesto Bee	m	dqO-0-DmUz3HqcM8n_vOxdnKPoiWM	www.modbee.com	1406879820988
