370101	Kim Kardashian, Katie Couric pose together	http://www.ptinews.com/news/4890930_Kim-Kardashian--Katie-Couric-pose-together.html	Press Trust of India	e	dovniZRHMGJhJSM3s26YGHLbmdrgM	www.ptinews.com	1404844313364
370102	Kim and Khloe get down and dirty as they mud wrestle during adventurous  ...	http://www.dailymail.co.uk/tvshowbiz/article-2682864/Kim-Khloe-dirty-mud-wrestle-adventurous-workout-run-Keeping-Up-With-The-Kardashians.html	Daily Mail	e	dovniZRHMGJhJSM3s26YGHLbmdrgM	www.dailymail.co.uk	1404844313596
370103	Watch: Kim Kardashian busts out of sports bra in latest KUWTK episode	http://www.yourtv.com.au/blog.aspx\?blogentryid=1202883&amp;showcomments=true	yourTV.com.au	e	dovniZRHMGJhJSM3s26YGHLbmdrgM	www.yourtv.com.au	1404844313887
370104	Keeping Up With The Kardashians LIVE Recap: Season 9 Episode 12 “Playing  ...	http://www.celebdirtylaundry.com/2014/keeping-up-with-the-kardashians-recap-7614-season-9-episode-12-playing-dirty/	Celebrity Dirty Laundry	e	dovniZRHMGJhJSM3s26YGHLbmdrgM	www.celebdirtylaundry.com	1404844314291
370105	Kim Kardashian and Kanye West "Refused to Pay" For Honeymoon?	http://www.gossipcop.com/kim-kardashian-kanye-west-honeymoon-bill/\?utm_source=rss&amp;utm_medium=rss&amp;utm_campaign=kim-kardashian-kanye-west-honeymoon-bill	GossipCop	e	dovniZRHMGJhJSM3s26YGHLbmdrgM	www.gossipcop.com	1404844314510
370106	Kim Kardashian takes helicopter 'to Instagram'	http://www.3news.co.nz/Kim-Kardashian-takes-helicopter-to-Instagram/tabid/418/articleID/351738/Default.aspx	3News NZ	e	dovniZRHMGJhJSM3s26YGHLbmdrgM	www.3news.co.nz	1404844314716
370107	Kim and Kanye 'refused to pay for honeymoon'	http://entertainment.msn.co.nz/article.aspx\?id=8870698	MSN NZ News	e	dovniZRHMGJhJSM3s26YGHLbmdrgM	entertainment.msn.co.nz	1404844315013
370108	Kim and Khloe Get Competitive, Kris Meddles in Kourtney + Scott's Finances on  ...	http://www.gossipcop.com/keeping-up-with-the-kardashians-recap-kim-khloe-kardashian-compete-mud-run-scott-disick-helicopter-kuwtk/	GossipCop	e	dovniZRHMGJhJSM3s26YGHLbmdrgM	www.gossipcop.com	1404844315603
370109	Kanye West has revealed he first proposed to Kim Kardashian seven years ago	http://home.nzcity.co.nz/news/article.aspx\?id=189660&amp;cat=985&amp;fm=newsmain%2Cnarts	NZ City	e	dovniZRHMGJhJSM3s26YGHLbmdrgM	home.nzcity.co.nz	1404844315806
370110	Kimye Refuse To Pay Honeymoon Bill?	http://www.2dayfm.com.au/scoopla/blog/2014/7/kimye-refuse-to-pay-honeymoon-bill-/	2DayFM \(blog\)	e	dovniZRHMGJhJSM3s26YGHLbmdrgM	www.2dayfm.com.au	1404844316214
370111	Pregnant Kourtney Kardashian displays her maternity style in striped T-shirt  ...	http://www.dailymail.co.uk/tvshowbiz/article-2682669/Kourtney-Kardashian-displays-maternity-style-striped-T-shirt-dress-touch-NYC-sister-Kim.html	Daily Mail	e	dovniZRHMGJhJSM3s26YGHLbmdrgM	www.dailymail.co.uk	1404844316477
370112	Kanye West rants for THIRD time at Wireless Birmingham but this one lasts just 5  ...	http://www.mirror.co.uk/3am/celebrity-news/kanye-west-rants-third-time-3822264	Mirror.co.uk	e	dovniZRHMGJhJSM3s26YGHLbmdrgM	www.mirror.co.uk	1404844316800
370113	'KUWTK' Brody Jenner Talks Kimye Wedding Absence, Kim Kardashian and  ...	http://www.classicalite.com/articles/9611/20140706/kuwtk-brody-jenner-kimye-wedding-absence-kim-kardashian-kanye-west-feud.htm	Classicalite	e	dovniZRHMGJhJSM3s26YGHLbmdrgM	www.classicalite.com	1404844317064
370114	Kim Kardashian and Kanye West DID pay honeymoon bill: Castle Olivier denies  ...	http://www.mirror.co.uk/3am/celebrity-news/kim-kardashian-kanye-west-pay-3820581	Mirror.co.uk	e	dovniZRHMGJhJSM3s26YGHLbmdrgM	www.mirror.co.uk	1404844317414
370115	Ending their feud? Kim Kardashian enjoys a night out with 'fake friend' Katie  ...	http://www.dailymail.co.uk/tvshowbiz/article-2682048/Kim-Kardashian-enjoys-night-fake-friend-Katie-Couric-perfects-pout-Christie-Brinkley.html	Daily Mail	e	dovniZRHMGJhJSM3s26YGHLbmdrgM	www.dailymail.co.uk	1404844317620
370116	Kanye West compares paparazzi invasion to	http://www.standardmedia.co.ke/entertainment/article/2000127201/kanye-west-compares-paparazzi-invasion-to	The Standard Digital News	e	dovniZRHMGJhJSM3s26YGHLbmdrgM	www.standardmedia.co.ke	1404844318669
370117	'Keeping Up With The Kardashians' Season 9, Episode 12	http://atlantablackstar.com/2014/07/06/keeping-kardashians-season-9-episode-12/	Atlanta Black Star	e	dovniZRHMGJhJSM3s26YGHLbmdrgM	atlantablackstar.com	1404844318927
370118	Kim K 'nervous about hitting the road'	http://www.belfasttelegraph.co.uk/entertainment/news/kim-k-nervous-about-hitting-the-road-30409906.html	Belfast Telegraph	e	dovniZRHMGJhJSM3s26YGHLbmdrgM	www.belfasttelegraph.co.uk	1404844319370
370119	Kim Kardashian Allegedly Skipped Out On Her Honeymoon Bill, So It Looks Like  ...	http://www.thegloss.com/2014/07/06/fashion/kim-kardashian-honeymoon-castle-oliver-ireland-bill/	TheGloss	e	dovniZRHMGJhJSM3s26YGHLbmdrgM	www.thegloss.com	1404844319738
370120	Kim Kardashian And Katie Couric Bury The Hatchet After Year Long Feud	http://www.inquisitr.com/1337428/kim-kardashian-and-katie-couric-bury-the-hatchet-after-year-long-feud/	The Inquisitr	e	dovniZRHMGJhJSM3s26YGHLbmdrgM	www.inquisitr.com	1404844320029
370121	Kim & Kourtney Kardashian Enjoy Boat Trip With Mason in the Hamptons	http://www.lifeandstylemag.com/posts/kim-kourtney-kardashian-enjoy-boat-trip-with-mason-in-the-hamptons-40146	Life \& Style Weekly	e	dovniZRHMGJhJSM3s26YGHLbmdrgM	www.lifeandstylemag.com	1404844320261
370122	Kim Kardashian - Kim Kardashian parties with Katie Couric	http://www.contactmusic.com/story/kim-kardashian-parties-with-katie-couric_4274350	Contactmusic.com	e	dovniZRHMGJhJSM3s26YGHLbmdrgM	www.contactmusic.com	1404844320752
370123	Kim Kardashian posts a lip gloss selfie after Kanye West goes on controversial  ...	http://www.irishmirror.ie/showbiz/celebrity-news/kim-kardashian-posts-lip-gloss-3821207	Irish Mirror	e	dovniZRHMGJhJSM3s26YGHLbmdrgM	www.irishmirror.ie	1404844320976
370124	Kim Kardashian Suggests Khloe Kardashian Needs Sperm Donor [WATCH  ...	http://www.movienewsguide.com/kim-kardashian-suggests-khloe-kardashian-needs-sperm-donor-watch-video/21668	Movie News Guide	e	dovniZRHMGJhJSM3s26YGHLbmdrgM	www.movienewsguide.com	1404844321198
370125	Kimye Dined And Dashed Their Irish Honeymoon Because Castles Are The Worst	http://www.crushable.com/2014/07/06/entertainment/kimye-irish-honeymoon-castle-oliver-refund/	Crushable	e	dovniZRHMGJhJSM3s26YGHLbmdrgM	www.crushable.com	1404844321780
370126	Kim Kardashian can't resist taking a selfie on a speed boat	http://www.ok.co.uk/celebrity-news/kim-kardashian-takes-selfie-on-moving-speed-boat	OK\! Magazine	e	dovniZRHMGJhJSM3s26YGHLbmdrgM	www.ok.co.uk	1404844321961
370127	Kim Kardashian Wakes Up, Shows Off ENORMOUS Engagement Ring	http://www.thehollywoodgossip.com/2014/07/kim-kardashian-wakes-up-shows-off-enormous-engagement-ring/	The Hollywood Gossip	e	dovniZRHMGJhJSM3s26YGHLbmdrgM	www.thehollywoodgossip.com	1404844322138
370128	Kanye West compares having his picture taken to RAPE in shocking sick on  ...	http://www.mirror.co.uk/3am/celebrity-news/kanye-west-compares-having-picture-3819854	Mirror.co.uk	e	dovniZRHMGJhJSM3s26YGHLbmdrgM	www.mirror.co.uk	1404844322339
370129	Kanye West reveals he first told Kim Kardashian he'd marry her 7 years ago	http://www.sugarscape.com/node/1050593	Sugarscape	e	dovniZRHMGJhJSM3s26YGHLbmdrgM	www.sugarscape.com	1404844322603
370130	Kim Kardashian Concerned Kanye West Is Putting Career Before Family?	http://www.entertainmentwise.com/news/154066/1/Kim-Kardashian-Concerned-Kanye-West-Is-Putting-Career-Before-Family	Entertainmentwise	e	dovniZRHMGJhJSM3s26YGHLbmdrgM	www.entertainmentwise.com	1404844322922
370131	Kim Kardashian takes a selfie on a moving BOAT- we hope she gets water in her  ...	http://www.irishmirror.ie/showbiz/celebrity-news/kim-kardashian-takes-selfie-moving-3819534	Irish Mirror	e	dovniZRHMGJhJSM3s26YGHLbmdrgM	www.irishmirror.ie	1404844323135
370132	EXCLUSIVE: Kim Kardashian and Kanye West left Irish honeymoon with unpaid  ...	http://www.dailystar.co.uk/news/latest-news/387512/EXCLUSIVE-Kim-Kardashian-Kanye-West-Irish-honeymoon-unpaid-25k-bill	Daily Star	e	dovniZRHMGJhJSM3s26YGHLbmdrgM	www.dailystar.co.uk	1404844323328
370133	Kim K 'nervous about hitting the road' with Kanye	http://www.themalaymailonline.com/showbiz/article/kim-k-nervous-about-hitting-the-road-with-kanye	The Malay Mail Online	e	dovniZRHMGJhJSM3s26YGHLbmdrgM	www.themalaymailonline.com	1404844323603
370134	Kim Kardashian and Kanye West: Selling Their $11M Bel Air Estate? [WATCH  ...	http://www.movienewsguide.com/why-kim-kardashian-and-kanye-west-selling-11m-bel-air-estate-watch-video/21515	Movie News Guide	e	dovniZRHMGJhJSM3s26YGHLbmdrgM	www.movienewsguide.com	1404844323989
370135	Kanye West proposed Kim Kardashian seven years ago	http://www.deccanchronicle.com/140706/entertainment-hollywood/article/kanye-west-proposed-kim-kardashian-seven-years-ago	Deccan Chronicle	e	dovniZRHMGJhJSM3s26YGHLbmdrgM	www.deccanchronicle.com	1404844324171
370136	Kanye West first proposed to Kim seven years ago	http://www.indiatvnews.com/entertainment/hollywood/kanye-west-proposed-kim-kardashian-seven-years-ago-8362.html	indiatvnews.com	e	dovniZRHMGJhJSM3s26YGHLbmdrgM	www.indiatvnews.com	1404844324420
370137	Kim Kardashian Looks Elegant In Pencil Skirt	http://www.boldsky.com/insync/life/2014/kim-kardashian-looks-elegant-in-pencil-skirt-041841.html	BoldSky	e	dovniZRHMGJhJSM3s26YGHLbmdrgM	www.boldsky.com	1404844324773
370138	Kanye West proposed Kim Kardashian 7 years ago	http://www.ptinews.com/news/4889138_Kanye-West-proposed-Kim-Kardashian-nbsp-7-years-ago-.html	Press Trust of India	e	dovniZRHMGJhJSM3s26YGHLbmdrgM	www.ptinews.com	1404844325010
370139	All aboard! Kim Kardashian dons clinging black dress for boat ride with Kourtney  ...	http://www.dailymail.co.uk/tvshowbiz/article-2681870/Kim-Kardashian-dons-clinging-black-dress-boat-ride-Kourtney-Mason-film-Hamptons-reality-show.html	Daily Mail	e	dovniZRHMGJhJSM3s26YGHLbmdrgM	www.dailymail.co.uk	1404844325203
370140	Kanye first proposed to Kim seven years ago	http://www.desimartini.com/news/hollywood/kanye-first-proposed-to-kim-seven-years-ago/article11754.htm	Desimartini	e	dovniZRHMGJhJSM3s26YGHLbmdrgM	www.desimartini.com	1404844325873
370141	Kanye West proposed to Kim Kardashian 7 years ago while dating other people	http://timesofindia.indiatimes.com/entertainment/english/music/news-and-interviews/Kanye-West-proposed-to-Kim-Kardashian-7-years-ago-while-dating-other-people/articleshow/37890117.cms	Times of India	e	dovniZRHMGJhJSM3s26YGHLbmdrgM	timesofindia.indiatimes.com	1404844326258
370142	Kanye West had first proposed to Kim Kardashian seven years ago	http://ibnlive.in.com/news/kanye-west-had-first-proposed-to-kim-kardashian-seven-years-ago/484040-45-75.html	IBNLive	e	dovniZRHMGJhJSM3s26YGHLbmdrgM	ibnlive.in.com	1404844326466
370143	Our bijou big day: Why weddings should be less about lavish gestures and more  ...	http://www.dailymail.co.uk/home/you/article-2679306/Our-bijou-big-day-Why-weddings-lavish-gestures-good-old-fashioned-romance.html	Daily Mail	e	dovniZRHMGJhJSM3s26YGHLbmdrgM	www.dailymail.co.uk	1404844326876
370144	Kanye West Reveals His Seven-Year-Long Obsession With Kim Kardashian  ...	http://www.celebdirtylaundry.com/2014/kanye-west-kim-kardashian-marriage-seven-year-long-obsession-creepy-or-romantic/	Celebrity Dirty Laundry	e	dovniZRHMGJhJSM3s26YGHLbmdrgM	www.celebdirtylaundry.com	1404844327170
370145	Kanye West proposed to Kim Kardashian seven years ago	http://indiatoday.intoday.in/story/kanye-west-proposed-to-kim-kardashian-years-ago/1/370042.html	India Today	e	dovniZRHMGJhJSM3s26YGHLbmdrgM	indiatoday.intoday.in	1404844327397
370146	Kanye West: "I told Kim I'd marry her SEVEN years ago!"	http://www.reveal.co.uk/showbiz-celeb-gossip/news/a582329/kanye-west-i-told-kim-id-marry-her-seven-years-ago.html	Reveal	e	dovniZRHMGJhJSM3s26YGHLbmdrgM	www.reveal.co.uk	1404844327590
370147	Kanye West - Kanye West proposed to Kim Kardashian years ago	http://www.contactmusic.com/story/kanye-west-proposed-to-kim-kardashian-years-ago_4272435	Contactmusic.com	e	dovniZRHMGJhJSM3s26YGHLbmdrgM	www.contactmusic.com	1404844327969
370148	Kim Kardashian Throws It All The Way Back As Rob Kardashian Finally  ...	http://globalgrind.com/2014/07/04/kim-kardashian-throws-it-all-the-way-back-as-rob-kardashian-finally-resurfaces-on-kuwtk-photos-x-videos/	Global Grind	e	dovniZRHMGJhJSM3s26YGHLbmdrgM	globalgrind.com	1404844328261
370149	Kanye: I told Kim I would marry her	http://www.iol.co.za/tonight/kanye-i-told-kim-i-would-marry-her-1.1714829	Independent Online	e	dovniZRHMGJhJSM3s26YGHLbmdrgM	www.iol.co.za	1404844328492
370150	Katie Holmes - Katie Holmes Goes Topless For Glamour Magazine Shoot	http://www.contactmusic.com/story/katie-holmes-goes-topless-for-glamour-magazine-shoot_4276694	Contactmusic.com	e	dNDOqZzCSjgggTMsONn5AbFtm5nLM	www.contactmusic.com	1404846732232
370151	Katie Holmes Poses Topless for Glamour	http://www.agjournalonline.com/article/ZZ/20140708/NEWS/307089988/10085/ENTERTAINMENT	Ag Journal	e	dNDOqZzCSjgggTMsONn5AbFtm5nLM	www.agjournalonline.com	1404846732590
370152	Celebrity Buzz: Topless Katie Holmes in Glamour; Kristen Stewart whacked	http://www.wjla.com/articles/2014/07/celebrity-buzz-topless-katie-holmes-in-glamour-kristen-stewart-whacked-104885.html	WJLA	e	dNDOqZzCSjgggTMsONn5AbFtm5nLM	www.wjla.com	1404846733064
370153	Katie Holmes ditches denim for topless Glamour shot	http://www.today.com/entertainment/katie-holmes-ditches-denim-topless-glamour-shot-1D79899209	Today.com	e	dNDOqZzCSjgggTMsONn5AbFtm5nLM	www.today.com	1404846733446
370154	Katie Holmes poses topless for Glamour, talks dating	http://www.upi.com/Entertainment_News/2014/07/08/Katie-Holmes-poses-topless-for-Glamour-talks-dating/9441404833282/	UPI.com	e	dNDOqZzCSjgggTMsONn5AbFtm5nLM	www.upi.com	1404846733747
370155	Katie Holmes Poses Topless For Glamour Magazine	http://www.huffingtonpost.com/2014/07/08/katie-holmes-topless-glamour_n_5566988.html	Huffington Post	e	dNDOqZzCSjgggTMsONn5AbFtm5nLM	www.huffingtonpost.com	1404846734069
370156	Katie Holmes poses topless, avoids questions about her dating life	http://www.foxnews.com/entertainment/2014/07/08/katie-holmes-poses-topless-avoids-questions-about-her-dating-life/	Fox News	e	dNDOqZzCSjgggTMsONn5AbFtm5nLM	www.foxnews.com	1404846734450
370157	Katie Holmes Goes Topless For 'Glamour,' Denies There Are Any Men in Her Life	http://www.intouchweekly.com/posts/katie-holmes-goes-topless-for-glamour-denies-there-are-any-men-in-her-life-40223	In Touch Weekly	e	dNDOqZzCSjgggTMsONn5AbFtm5nLM	www.intouchweekly.com	1404846734722
370158	Katie Holmes Topless: Actress Shows Tom Cruise What He Is Misssing	http://www.ibtimes.co.uk/katie-holmes-topless-actress-shows-tom-cruise-what-he-misssing-1455843	International Business Times UK	e	dNDOqZzCSjgggTMsONn5AbFtm5nLM	www.ibtimes.co.uk	1404846734948
370159	Katie Holmes - Katie Holmes in awe of 'spectacular' daughter	http://www.contactmusic.com/story/katie-holmes-in-awe-of-spectacular-daughter_4276630	Contactmusic.com	e	dNDOqZzCSjgggTMsONn5AbFtm5nLM	www.contactmusic.com	1404846735167
370160	Katie Holmes: "Motherhood Is The Greatest Gift"	http://www.mtv.co.uk/katie-holmes/news/katie-holmes-motherhood-is-the-greatest-gift\?utm_source=feedburner&amp;utm_medium=feed&amp;utm_campaign=Feed%3A+mtvuk%2Fnews+(MTV+UK+-+News)	MTV UK	e	dNDOqZzCSjgggTMsONn5AbFtm5nLM	www.mtv.co.uk	1404846735468
370161	Katie Holmes in awe of 'spectacular' daughter	http://dalje.com/en-celebrities/katie-holmes-in-awe-of-spectacular-daughter/514406	Dalje.com	e	dNDOqZzCSjgggTMsONn5AbFtm5nLM	dalje.com	1404846735856
370162	Katie Holmes Goes Topless, Reveals Relationship Status	https://uk.celebrity.yahoo.com/gossip/celeb-news/katie-holmes-goes-topless--reveals-relationship-status-162220753.html	Yahoo Celebrity UK	e	dNDOqZzCSjgggTMsONn5AbFtm5nLM	uk.celebrity.yahoo.com	1404846736189
370163	Katie Holmes Is A Fashionable Flier In A Fedora	http://www.x17online.com/2014/07/katie_holmes_fedora_lax_photos_070814	X17 Online	e	dNDOqZzCSjgggTMsONn5AbFtm5nLM	www.x17online.com	1404846736598
370164	Katie Holmes Photos: 'The Giver' Star Goes Topless For Photo Shoot, Calls  ...	http://www.enstarz.com/articles/40980/20140708/katie-holmes-photos-the-giver-star-goes-topless-for-photo-shoot-calls-motherhood-overwhelming-and-spectacular-video.htm	Enstarz	e	dNDOqZzCSjgggTMsONn5AbFtm5nLM	www.enstarz.com	1404846737150
370165	Katie Holmes Poses Topless, Talks Dating	http://abcnews.go.com/Entertainment/katie-holmes-poses-topless-talks-dating/story\?id=24467528	ABC News	e	dNDOqZzCSjgggTMsONn5AbFtm5nLM	abcnews.go.com	1404846737477
370166	Katie Holmes Poses Topless In Mom Jeans, Making For A Very Confusing Image	http://www.crushable.com/2014/07/08/entertainment/katie-holmes-topless-photo-glamour/	Crushable	e	dNDOqZzCSjgggTMsONn5AbFtm5nLM	www.crushable.com	1404846737757
370167	Katie Holmes Poses Topless for Glamour, Talks Dating After Tom Cruise Split	http://www.toofab.com/2014/07/08/katie-holmes-poses-topless-for-glamour-photos/	TooFab.com	e	dNDOqZzCSjgggTMsONn5AbFtm5nLM	www.toofab.com	1404846737995
370168	Get the Most Popular Beauty World News Stories in a Weekly Newsletter	http://www.beautyworldnews.com/articles/10281/20140708/katie-holmes-topless-photo-tom-cruise-the-giver-cast-member-ex-wife-talks-dating-life-following-divorce-with-daughter-suri-cruise-twitter-fan-reveals-what-is-crucial-to-her-outlook-on-life.htm	Beauty World News	e	dNDOqZzCSjgggTMsONn5AbFtm5nLM	www.beautyworldnews.com	1404846738409
370169	Katie Holmes strips topless in sizzling Glamour shoot and discusses life after  ...	http://www.mirror.co.uk/3am/celebrity-news/katie-holmes-strips-topless-sizzling-3828122	Mirror.co.uk	e	dNDOqZzCSjgggTMsONn5AbFtm5nLM	www.mirror.co.uk	1404846738876
370170	Katie Holmes Makes Going Topless In Mom Jeans Look Cool In This Month's  ...	http://www.thegloss.com/2014/07/08/fashion/katie-holmes-topless-glamour-august-2014-photos/	TheGloss	e	dNDOqZzCSjgggTMsONn5AbFtm5nLM	www.thegloss.com	1404846739203
370171	Katie Holmes Poses Topless for Glamour, Opens Up About Being Single Mom	http://www.gossipcop.com/katie-holmes-topless-glamour/	GossipCop	e	dNDOqZzCSjgggTMsONn5AbFtm5nLM	www.gossipcop.com	1404846739625
370172	Katie Holmes: Motherhood comes first	https://ph.celebrity.yahoo.com/news/katie-holmes-motherhood-comes-first-070000383.html	Yahoo Philippines News	e	dNDOqZzCSjgggTMsONn5AbFtm5nLM	ph.celebrity.yahoo.com	1404846739874
370173	Katie Holmes Poses Topless for Glamour, Talks Dating After Tom Cruise Split  ...	http://www.usmagazine.com/celebrity-style/news/katie-holmes-topless-for-glamour-mag-talks-dating-after-tom-cruise-201487	Us Magazine	e	dNDOqZzCSjgggTMsONn5AbFtm5nLM	www.usmagazine.com	1404846740137
370174	Katie Holmes poses topless but is 'focused on motherhood'	http://pagesix.com/2014/07/08/katie-holmes-poses-topless-but-is-focused-on-motherhood/	Page Six	e	dNDOqZzCSjgggTMsONn5AbFtm5nLM	pagesix.com	1404846740515
370175	'Danger' zone: Potato salad fundraiser hits $40K	http://www.fox19.com/story/25967772/danger-zone-potato-salad-fundraiser-hits-40k	WXIX	e	d3xTvJLENlqUXGMZPcHSPW7YHj2_M	www.fox19.com	1404847294145
370176	How Much for Potato Salad? The Story Behind the Bizarre Kickstarter Campaign	http://www.wilx.com/news/haveyouseenthis/headlines/How-much-for-potato-salad-The-story-behind-the-bizarre-Kickstarter-Campaign-266274971.html	WILX-TV	e	d3xTvJLENlqUXGMZPcHSPW7YHj2_M	www.wilx.com	1404847294547
370177	Ohio man's online potato salad effort takes off	http://www.newsandsentinel.com/page/content.detail/id/541664/Ohio-man-s-online-potato-salad-effort-takes-off.html\?isap=1&amp;nav=5072	Parkersburg News	e	d3xTvJLENlqUXGMZPcHSPW7YHj2_M	www.newsandsentinel.com	1404847294920
370178	'Danger' zone: Potato salad fundraiser hits $40K - WSFA.com: News Weather  ...	http://www.wsfa.com/story/25967772/danger-zone-potato-salad-fundraiser-hits-40k	WSFA	e	d3xTvJLENlqUXGMZPcHSPW7YHj2_M	www.wsfa.com	1404847295267
370179	Potato salad Kickstarter rakes in $37K	http://metronews.ca/food/1089800/ohio-mans-online-potato-salad-effort-takes-off/	MetroNews Canada	e	d3xTvJLENlqUXGMZPcHSPW7YHj2_M	metronews.ca	1404847295618
370180	Potato Salad Kickstarter Campaign Raises Over $62000	http://www.forbes.com/sites/johngreathouse/2014/07/08/potato-salad-kickstarter-campaign-raises-over-41000/	Forbes	e	d3xTvJLENlqUXGMZPcHSPW7YHj2_M	www.forbes.com	1404847295902
370181	Ohio Man Raises $40000 (and Counting) in Viral Kickstarter Campaign	http://www.nbcbayarea.com/news/tech/Ohio-Man-Raises-40000-in-Viral-Kickstarter-Campaign-266264771.html	NBC Bay Area	e	d3xTvJLENlqUXGMZPcHSPW7YHj2_M	www.nbcbayarea.com	1404847296303
370182	The $40K Potato Salad on Kickstarter Is Evil	http://www.newser.com/story/190630/the-40k-potato-salad-on-kickstarter-is-evil.html	Newser	e	d3xTvJLENlqUXGMZPcHSPW7YHj2_M	www.newser.com	1404847296549
370183	On Kickstartered potato salad	http://boingboing.net/2014/07/08/on-kickstartered-potato-salad.html	Boing Boing	e	d3xTvJLENlqUXGMZPcHSPW7YHj2_M	boingboing.net	1404847296884
370184	Ohio man raises more than $37000 in Internet crowdfunding effort - to make  ...	http://www.winnipegfreepress.com/business/ohio-man-raises-more-than-37000-in-internet-crowdfunding-effort-----to-make-potato-salad-266218801.html	Winnipeg Free Press	e	d3xTvJLENlqUXGMZPcHSPW7YHj2_M	www.winnipegfreepress.com	1404847297471
370185	Potato Salad Kickstarter Raises Over $50000, So Here's How To Spend Those  ...	http://www.mtv.com/news/1863192/potato-salad-kickstarter-how-to-spend-money/	MTV.com	e	d3xTvJLENlqUXGMZPcHSPW7YHj2_M	www.mtv.com	1404847297786
370186	Kickstarter campaign for potato salad tops $40000	http://www.ksdk.com/story/news/nation/2014/07/08/potato-salad-kickstarter-campaign-10000/12349253/	KSDK	e	d3xTvJLENlqUXGMZPcHSPW7YHj2_M	www.ksdk.com	1404847298102
370187	The Internet Paid This Hot Guy $40000 To Do WHAT?! We'll Give You A Hint: It's  ...	http://perezhilton.com/fitperez/2014-07-08-kickstarter-campaign-40k-raised-for-guy-to-make-potato-salad-video	PerezHilton.com	e	d3xTvJLENlqUXGMZPcHSPW7YHj2_M	perezhilton.com	1404847298401
370188	Online Potato Salad Petition Takes Off	http://www.kolotv.com/news/oddnews/headlines/Online-Potato-Salad-Petition-Takes-Off-266268761.html	KOLO	e	d3xTvJLENlqUXGMZPcHSPW7YHj2_M	www.kolotv.com	1404847298677
370189	Opinion: Self-proclaimed potato salad novice a modern day Johnny Appleseed	http://thelantern.com/2014/07/opinion-self-proclaimed-potato-salad-novice-a-modern-day-johnny-appleseed/	OSU - The Lantern	e	d3xTvJLENlqUXGMZPcHSPW7YHj2_M	thelantern.com	1404847298951
370190	This Kickstarter needs your help more than the potato salad one	http://www.columbusalive.com/content/blogs/thelatest/2014/07/potato-salad-kickstarter-commissary.html	Columbus Alive \(blog\)	e	d3xTvJLENlqUXGMZPcHSPW7YHj2_M	www.columbusalive.com	1404847299401
370191	Zack Brown's potato salad Kickstarter reaches $40000, is 'really honored' by  ...	http://thecelebritycafe.com/feature/2014/07/zack-browns-potato-salad-kickstarter-reaches-40000-really-honored-internets-response	TheCelebrityCafe.com	e	d3xTvJLENlqUXGMZPcHSPW7YHj2_M	thecelebritycafe.com	1404847299786
370192	Be the Potato Salad	http://copyfight.corante.com/archives/2014/07/08/be_the_potato_salad.php	Corante	e	d3xTvJLENlqUXGMZPcHSPW7YHj2_M	copyfight.corante.com	1404847300044
370193	Man's online potato-salad effort takes off	http://www.azcentral.com/story/news/weird/2014/07/08/potato-salad-crowdfunding/12358233/	azcentral.com	e	d3xTvJLENlqUXGMZPcHSPW7YHj2_M	www.azcentral.com	1404847300359
370194	Man aspiring to make bowl of potato salad raises more than $35000 on Kickstarter	http://www.turnto23.com/news/man-aspiring-to-make-bowl-of-potato-salad-raises-more-than-35000-on-kickstarter	KERO-TV 23	e	d3xTvJLENlqUXGMZPcHSPW7YHj2_M	www.turnto23.com	1404847300653
370195	One $10 request delivers a $40000 yield	http://www.firstcoastnews.com/story/news/nation/2014/07/08/kickstarter-campaign-potato-salad/12349835/	First Coast News	e	d3xTvJLENlqUXGMZPcHSPW7YHj2_M	www.firstcoastnews.com	1404847300994
370196	Ohio maverick raises more than $40K on Kickstarter — for potato salad	http://theweek.com/speedreads/index/264400/speedreads-ohio-maverick-raises-more-than-40k-on-kickstarter--for-potato-salad	The Week Magazine	e	d3xTvJLENlqUXGMZPcHSPW7YHj2_M	theweek.com	1404847301261
370197	VIDEO: Potato Salad Campaign On Kickstarter Takes Internet By Storm	http://www.tele-management.ca/2014/07/video-potato-salad-campaign-on-kickstarter-takes-internet-by-storm/	Telemanagement	e	d3xTvJLENlqUXGMZPcHSPW7YHj2_M	www.tele-management.ca	1404847301535
370198	Share this on:	http://eatocracy.cnn.com/2014/07/06/crowdfunding-kicks-up-potato-salad-passions/comment-page-1/	CNN	e	d3xTvJLENlqUXGMZPcHSPW7YHj2_M	eatocracy.cnn.com	1404847301876
370199	Potato salad Kickstarter: The guy should give the money to charity.	http://www.slate.com/blogs/moneybox/2014/07/08/potato_salad_kickstarter_the_guy_should_give_the_money_to_charity.html	Slate Magazine \(blog\)	e	d3xTvJLENlqUXGMZPcHSPW7YHj2_M	www.slate.com	1404847302146
370200	#BBCtrending: Potato salad Kickstarter stokes internet ire	http://www.bbc.co.uk/news/blogs-trending-28216299	BBC News	e	d3xTvJLENlqUXGMZPcHSPW7YHj2_M	www.bbc.co.uk	1404847302501
