181401	Famous Meteor Shower to Set Up a Show Tonight	http://newsmaine.net/19213-famous-meteor-shower-set-show-tonight	Maine News	t	dLr_WPc-KDgM5iMWCNfEM5V0LwZWM	newsmaine.net	1399375183047
181402	Eta Aquarids meteor shower peaks	http://www.cbc.ca/news/technology/eta-aquarids-meteor-shower-peaks-1.2632489	CBC.ca	t	dLr_WPc-KDgM5iMWCNfEM5V0LwZWM	www.cbc.ca	1399375183324
181403	LIVE: Catch a Glimpse of Halley's Comet Debris	http://spacecoastdaily.com/2014/05/live-catch-a-glimpse-of-halleys-comet-debris/	SpaceCoastDaily.com	t	dLr_WPc-KDgM5iMWCNfEM5V0LwZWM	spacecoastdaily.com	1399375183544
181404	See bits of Comet Halley: Eta Aquarid meteor shower peaks early Tuesday  ...	http://www.washingtonpost.com/blogs/capital-weather-gang/wp/2014/05/05/see-bits-of-comet-halley-eta-aquarid-meteors-peak-early-tuesday-morning/	Washington Post \(blog\)	t	dLr_WPc-KDgM5iMWCNfEM5V0LwZWM	www.washingtonpost.com	1399375183845
181405	Comet 209P/LINEAR's Debris Likely to Cast Firework This May	http://yottafire.com/2014/05/comet-209plinears-debris-likely-to-cast-firework-this-may/	YottaFire	t	dLr_WPc-KDgM5iMWCNfEM5V0LwZWM	yottafire.com	1399375184074
181406	Meteor showers tonight!	http://www.masslive.com/weather/index.ssf/2014/05/meteor_showers_tonight_2.html	MassLive.com	t	dLr_WPc-KDgM5iMWCNfEM5V0LwZWM	www.masslive.com	1399375184300
181407	WATCH LIVE: Eta Aquarid meteor shower	http://wtvr.com/2014/05/06/eta-aquarid-meteor-shower-happening-now/	wtvr.com	t	dLr_WPc-KDgM5iMWCNfEM5V0LwZWM	wtvr.com	1399375184680
181408	How to watch Eta Aquarid meteor shower 2014: Earth to pass through space  ...	http://news.nationalpost.com/2014/05/05/how-to-watch-eta-aquarid-meteor-shower-2014-earth-to-pass-through-space-debris-from-halleys-comet/	National Post	t	dLr_WPc-KDgM5iMWCNfEM5V0LwZWM	news.nationalpost.com	1399375184900
181409	Eyes On the Sky! Catch Meteor Shower Late Tonight	http://fox8.com/2014/05/05/eyes-on-the-sky-catch-meteor-shower-late-tonight/	fox8.com	t	dLr_WPc-KDgM5iMWCNfEM5V0LwZWM	fox8.com	1399375185169
181410	Watch Live: Chunks of Halley's Comet Turn Into Spectacular Meteor Shower	http://www.wired.com/2014/05/live-slooh-eta-aquarid-meteors/	Wired	t	dLr_WPc-KDgM5iMWCNfEM5V0LwZWM	www.wired.com	1399375185556
181411	Eta Aquarid Meteor Shower 2014 Live Stream: Best Time To Catch Comet  ...	http://www.ibtimes.com/eta-aquarid-meteor-shower-2014-live-stream-best-time-catch-comet-halleys-stellar-1580183	International Business Times	t	dLr_WPc-KDgM5iMWCNfEM5V0LwZWM	www.ibtimes.com	1399375185806
181412	How to see the next Eta Aquarid meteor shower	http://thespacereporter.com/2014/05/how-to-see-the-next-eta-aquarid-meteor-shower/	The Space Reporter	t	dLr_WPc-KDgM5iMWCNfEM5V0LwZWM	thespacereporter.com	1399375186128
181413	Meteor shower tonight should be visible; Here are the details	http://www.mlive.com/weather/index.ssf/2014/05/meteor_shower_tonight_should_b.html	The Kalamazoo Gazette	t	dLr_WPc-KDgM5iMWCNfEM5V0LwZWM	www.mlive.com	1399375186405
181414	Look for a Meteor Shower Early Tuesday Morning	http://www.ozarksfirst.com/story/d/story/look-for-a-meteor-shower-early-tuesday-morning/39552/V1iGdEYrjUSNrLQ7SNI51Q	OzarksFirst.com	t	dLr_WPc-KDgM5iMWCNfEM5V0LwZWM	www.ozarksfirst.com	1399375186715
181415	May meteors: Shooting stars light up southern US tonight	http://www.fdlreporter.com/viewart/20140505/FON0102/305050447/May-meteors-Shooting-stars-light-up-southern-US-tonight	Fond du Lac Reporter	t	dLr_WPc-KDgM5iMWCNfEM5V0LwZWM	www.fdlreporter.com	1399375186968
181416	Eta Aquarid Meteor Shower 2014 To Peak Early Tuesday Morning  ...	http://www.huffingtonpost.com/2014/05/05/eta-aquarid-meteor-shower_n_5268584.html\?ir=Science	Huffington Post	t	dLr_WPc-KDgM5iMWCNfEM5V0LwZWM	www.huffingtonpost.com	1399375187232
181417	Guide to Watching Aquarids Meteor Shower Tonight	http://newswatch.nationalgeographic.com/2014/05/05/guide-to-watching-aquarids-meteor-shower-tonight/	National Geographic	t	dLr_WPc-KDgM5iMWCNfEM5V0LwZWM	newswatch.nationalgeographic.com	1399375187522
181418	A spectacle: Eta Aquarids meteor shower to peak early Tuesday	http://www.sciencerecorder.com/news/a-spectacle-eta-aquarids-meteor-shower-to-peak-early-tuesday/	Science Recorder	t	dLr_WPc-KDgM5iMWCNfEM5V0LwZWM	www.sciencerecorder.com	1399375187831
181419	Meteor shower: How to view the Eta Aquarids	http://www.alaskadispatch.com/article/20140505/meteor-shower-how-view-eta-aquarids	Alaska Dispatch	t	dLr_WPc-KDgM5iMWCNfEM5V0LwZWM	www.alaskadispatch.com	1399375188071
181420	How to watch the Eta Aquariid meteor shower	http://www.theweathernetwork.com/news/articles/how-to-watch-the-eta-aquariid-meteor-shower/26631/	The Weather Network	t	dLr_WPc-KDgM5iMWCNfEM5V0LwZWM	www.theweathernetwork.com	1399375188301
181421	Cosmic lightshow: Shooting stars to blaze across skies tonight	http://www.ctvnews.ca/sci-tech/cosmic-lightshow-shooting-stars-to-blaze-across-skies-tonight-1.1807612	CTV News	t	dLr_WPc-KDgM5iMWCNfEM5V0LwZWM	www.ctvnews.ca	1399375188746
181422	Plenty of sun before showers return late week	http://www.masslive.com/weather/index.ssf/2014/05/plenty_of_sun_before_showers_r.html	MassLive.com	t	dLr_WPc-KDgM5iMWCNfEM5V0LwZWM	www.masslive.com	1399375188974
181423	Watch Halley's children light up the planet tonight	http://www.dailymail.co.uk/sciencetech/article-2620744/Watch-Halleys-children-light-planet-tonight-Up-40-meteors-hour-expected-streak-sky.html	Daily Mail	t	dLr_WPc-KDgM5iMWCNfEM5V0LwZWM	www.dailymail.co.uk	1399375189162
181424	Meteor Shower Should Peak Just Before Dawn Tuesday Morning	http://frenchtribune.com/teneur/1422454-meteor-shower-should-peak-just-dawn-tuesday-morning	French Tribune	t	dLr_WPc-KDgM5iMWCNfEM5V0LwZWM	frenchtribune.com	1399375189388
181425	Halley's Comet debris trail sets the sky aglitter tonight	http://infotel.ca/newsitem/halley%E2%80%99s-comet-debris-trail-sets-the-sky-aglitter-tonight/it9815	InfoTel News Ltd	t	dLr_WPc-KDgM5iMWCNfEM5V0LwZWM	infotel.ca	1399375189697
181426	New 'Meteor Storm' from Comet May Light Up Night Sky This Month	http://www.space.com/25768-new-meteor-shower-comet-linear.html	Space.com	t	dLr_WPc-KDgM5iMWCNfEM5V0LwZWM	www.space.com	1399375189883
181427	Eta Aquarid Meteor Shower 2014 [Live Stream] How to Watch Halley  ...	http://crossmap.christianpost.com/news/eta-aquarid-meteor-shower-2014-live-stream-how-to-watch-halley-comets-spectacle-at-its-peak-time-tonight-10218	Crossmap	t	dLr_WPc-KDgM5iMWCNfEM5V0LwZWM	crossmap.christianpost.com	1399375190115
181428	Forecast: Meteor shower tonight!	http://www.clickondetroit.com/weather/forecast-meteor-shower-tonight/25821488	WDIV Detroit	t	dLr_WPc-KDgM5iMWCNfEM5V0LwZWM	www.clickondetroit.com	1399375190361
181429	Get up early to see meteor showers	http://courier-tribune.com/news/get-early-see-meteor-showers	Asheboro Courier Tribune	t	dLr_WPc-KDgM5iMWCNfEM5V0LwZWM	courier-tribune.com	1399375190744
181430	Meteor Shower Most Visible Early Tuesday Morning	http://news92fm.com/434930/meteor-shower-most-visible-early-tuesday-morning/	News 92 FM	t	dLr_WPc-KDgM5iMWCNfEM5V0LwZWM	news92fm.com	1399375190973
181431	METEOR SHOWER MAY 2014 [FREE ONLINE STREAM]: WATCH THE  ...	http://www.travelerstoday.com/articles/9736/20140505/meteor-shower-2014-free-online-stream-watch-annual-eta-aquarids.htm	TravelersToday	t	dLr_WPc-KDgM5iMWCNfEM5V0LwZWM	www.travelerstoday.com	1399375191191
181432	Watch This Meteor Shower As It Peaks Tonight	http://blogs.sfweekly.com/thesnitch/2014/05/_eta_aquarids_meteor_shower.php	SF Weekly \(blog\)	t	dLr_WPc-KDgM5iMWCNfEM5V0LwZWM	blogs.sfweekly.com	1399375191455
181433	Eta Aquarid Meteor Shower Peaks Tuesday Morning	http://blogs.wpri.com/2014/05/05/eta-aquarid-meteor-shower-peaks-tue-morning/	WPRI-TV 12 \(blog\)	t	dLr_WPc-KDgM5iMWCNfEM5V0LwZWM	blogs.wpri.com	1399375191803
181434	Eta Aquarids Meteor Shower Made By Halley's Comet Set To Peak Tonight, Live  ...	http://www.hngn.com/articles/30530/20140505/eta-aquarids-meteor-shower-made-halleys-comet-set-peak-tonight.htm	Headlines \& Global News	t	dLr_WPc-KDgM5iMWCNfEM5V0LwZWM	www.hngn.com	1399375192055
181435	Meteor shower will be visible this week	http://www.wral.com/meteor-shower-will-be-visible-this-week/13619896/	WRAL.com	t	dLr_WPc-KDgM5iMWCNfEM5V0LwZWM	www.wral.com	1399375192264
181436	Eta Aquarid meteor shower to peak tonight	http://www.upi.com/Science_News/2014/05/05/Eta-Aquarid-meteor-shower-to-peak-tonight/8191399315910/	UPI.com	t	dLr_WPc-KDgM5iMWCNfEM5V0LwZWM	www.upi.com	1399375192599
181437	Meteor shower tonight: time, date & how to watch online?	http://nvonews.com/meteor-shower-tonight-time-date-how-to-watch-online/	Northern Voices Online	t	dLr_WPc-KDgM5iMWCNfEM5V0LwZWM	nvonews.com	1399375193084
181438	Meteor shower will peak over the North Olympic Peninsula tonight and Tuesday  ...	http://www.peninsuladailynews.com/article/20140505/NEWS/140509992/meteor-shower-will-peak-over-the-north-olympic-peninsula-tonight-and	Peninsula Daily	t	dLr_WPc-KDgM5iMWCNfEM5V0LwZWM	www.peninsuladailynews.com	1399375193307
181439	Meteor shower peaks this week courtesy of Halley's comet "litter"	http://www.popherald.com/news/2014/5/5/halleys-comet-meteor-shower-peak-this-week	PopHerald.com	t	dLr_WPc-KDgM5iMWCNfEM5V0LwZWM	www.popherald.com	1399375193563
181440	The sky is falling! Watch debris from Halley's Comet fall in a stunning meteor  ...	http://www.salon.com/2014/05/05/the_sky_is_falling_watch_debris_from_halleys_comet_fall_in_a_stunning_meteor_shower/	Salon	t	dLr_WPc-KDgM5iMWCNfEM5V0LwZWM	www.salon.com	1399375193851
181441	Meteor Shower Will Peak Tuesday Morning	http://www.webpronews.com/meteor-shower-will-peak-tuesday-morning-2014-05	WebProNews	t	dLr_WPc-KDgM5iMWCNfEM5V0LwZWM	www.webpronews.com	1399375194272
181442	Eta Aquarid Meteor Shower: Will Clouds Obstruct Your View?	http://www.livescience.com/45360-eta-aquarid-meteor-shower.html\?utm_source=feedburner&amp;utm_medium=feed&amp;utm_campaign=Feed%3A+Livesciencecom+(LiveScience.com+Science+Headline+Feed)	LiveScience.com	t	dLr_WPc-KDgM5iMWCNfEM5V0LwZWM	www.livescience.com	1399375194468
181443	Eta Aquarid meteor shower to peak this week: Will weather obstruct your view?	http://www.examiner.com/article/eta-aquarid-meteor-shower-to-peak-this-week-will-weather-obstruct-your-view	Examiner.com	t	dLr_WPc-KDgM5iMWCNfEM5V0LwZWM	www.examiner.com	1399375194703
181444	Backyard Universe: A few meteors tonight	http://www.fayobserver.com/blogs/features/backyard_universe/article_813ae6c2-d481-11e3-8db1-0017a43b2370.html	Fayetteville Observer \(blog\)	t	dLr_WPc-KDgM5iMWCNfEM5V0LwZWM	www.fayobserver.com	1399375194907
181445	SA to experience meteor shower	http://www.sabc.co.za/news/a/5825c10043e31a0f9abf9a8e5b194ed0/SA-to-experience-meteor-shower	South African Broadcasting Corporation	t	dLr_WPc-KDgM5iMWCNfEM5V0LwZWM	www.sabc.co.za	1399375195277
181446	How To Watch The Meteor Shower Created By Halley's Comet Tonight	http://www.businessinsider.in/science/How-To-Watch-The-Meteor-Shower-Created-By-Halleys-Comet-Tonight/articleshow/34697610.cms	Businessinsider India	t	dLr_WPc-KDgM5iMWCNfEM5V0LwZWM	www.businessinsider.in	1399375195542
181447	Eta Aquariid Meteors in 2014	http://www.skyandtelescope.com/astronomy-news/observing-news/eta-aquariid-meteors-2014/	Sky \& Telescope	t	dLr_WPc-KDgM5iMWCNfEM5V0LwZWM	www.skyandtelescope.com	1399375195925
181448	Astronomically Speaking: Eta Aquarid Meteor Shower	http://www.diamondbackonline.com/blogs/article_05a3f268-d145-11e3-a636-0017a43b2370.html	Diamondback Online \(blog\)	t	dLr_WPc-KDgM5iMWCNfEM5V0LwZWM	www.diamondbackonline.com	1399375196274
181449	Antivirus chap Johnny Mac's back in non-crap crypto-chat app flap	http://www.theregister.co.uk/2014/05/05/john_mcafee_chadder/	Register	t	d4ZF843-azdAvuMC9Jo-g2GQyEtDM	www.theregister.co.uk	1399375407771
181450	Paranoid? Enough to place your privacy in the hands of John McAfee?	http://betanews.com/2014/05/06/paranoid-enough-to-place-your-privacy-in-the-hands-of-john-mcafee/	BetaNews	t	d4ZF843-azdAvuMC9Jo-g2GQyEtDM	betanews.com	1399375407997
181451	John McAfee Launches Encrypted Messaging App Called Chadder	http://www.geeky-gadgets.com/john-mcafee-launches-encrypted-messaging-app-called-chadder-06-05-2014/	Geeky gadgets	t	d4ZF843-azdAvuMC9Jo-g2GQyEtDM	www.geeky-gadgets.com	1399375408313
181452	John McAfee's Chadder: Bloggers point and laugh	http://blogs.computerworld.com/encryption/23871/john-mcafees-chadder-bloggers-point-and-laugh-itbwcw	Computerworld \(blog\)	t	d4ZF843-azdAvuMC9Jo-g2GQyEtDM	blogs.computerworld.com	1399375408531
181453	Dubious Claims Cloud John McAfee's Chadder Message App	http://www.tomsguide.com/us/chadder-private-messaging-mcafee,news-18731.html	Tom's Guide	t	d4ZF843-azdAvuMC9Jo-g2GQyEtDM	www.tomsguide.com	1399375408771
181454	'Chadder' – a new private social messaging app for mobile devices	http://newstonight.co.za/content/chadder-new-private-social-messaging-app-mobile-devices	News Tonight Africa	t	d4ZF843-azdAvuMC9Jo-g2GQyEtDM	newstonight.co.za	1399375409075
181455	John McAfee launches Chadder, encrypted messaging app	http://www.siliconrepublic.com/new-media/item/36759-john-mcafee-launches/	Siliconrepublic.com	t	d4ZF843-azdAvuMC9Jo-g2GQyEtDM	www.siliconrepublic.com	1399375409402
181456	John McAfee Introduces 'Chadder' Security-Focused Messaging App	http://gadgets.ndtv.com/apps/news/john-mcafee-introduces-chadder-security-focused-messaging-app-519182	NDTV	t	d4ZF843-azdAvuMC9Jo-g2GQyEtDM	gadgets.ndtv.com	1399375409667
181457	John McAfee Launches Chadder - A Privacy App For Young People	http://www.ibtimes.co.uk/john-mcafee-launches-chadder-privacy-app-young-people-1447326	International Business Times UK	t	d4ZF843-azdAvuMC9Jo-g2GQyEtDM	www.ibtimes.co.uk	1399375409947
181458	'Chadder' Joins the Secure Messaging World	http://www.cio-today.com/story.xhtml\?story_id=011001CEO5GO	CIO Today	t	d4ZF843-azdAvuMC9Jo-g2GQyEtDM	www.cio-today.com	1399375410171
181459	Chadder: John McAfee launches encrypted messaging app; available for  ...	http://ibnlive.in.com/news/chadder-john-mcafee-launches-encrypted-messaging-app-available-for-android-windows-phone/469903-11.html	IBNLive	t	d4ZF843-azdAvuMC9Jo-g2GQyEtDM	ibnlive.in.com	1399375410399
181460	Former fugitive John McAfee returns with a messaging app?	http://www.cnet.com/news/former-fugitive-john-mcafee-returns-with-a-messaging-app/	CNET	t	d4ZF843-azdAvuMC9Jo-g2GQyEtDM	www.cnet.com	1399375410635
181461	John McAfee Releases CHADDER, Secure Messaging App	http://www.ubergizmo.com/2014/05/john-mcafee-releases-chadder-secure-messaging-app/	Ubergizmo	t	d4ZF843-azdAvuMC9Jo-g2GQyEtDM	www.ubergizmo.com	1399375411040
181462	John McAfee's software company launches secure messaging app Chadder	http://www.techspot.com/news/56648-john-mcafees-software-company-launches-secure-messaging-app-chadder.html	TechSpot	t	d4ZF843-azdAvuMC9Jo-g2GQyEtDM	www.techspot.com	1399375411218
181463	John McAfee releases secure messaging app	http://www.net-security.org/secworld.php\?id=16800	Help Net Security	t	d4ZF843-azdAvuMC9Jo-g2GQyEtDM	www.net-security.org	1399375411415
181464	New encrypted messaging app Chadder from McAfee	http://www.tgdaily.com/social/100261-new-encrypted-messaging-app-chadder-from-mcafee	TG Daily	t	d4ZF843-azdAvuMC9Jo-g2GQyEtDM	www.tgdaily.com	1399375411642
181465	Chadder is a secure messaging app with a dubious John McAfee endorsement	https://gigaom.com/2014/05/05/chadder-is-a-secure-messaging-app-with-a-dubious-john-mcafee-endorsement/	GigaOM	t	d4ZF843-azdAvuMC9Jo-g2GQyEtDM	gigaom.com	1399375412092
181466	John McAfee promotes 'private' messaging app	http://www.infoworld.com/d/mobile-technology/john-mcafee-promotes-private-messaging-app-241890	InfoWorld	t	d4ZF843-azdAvuMC9Jo-g2GQyEtDM	www.infoworld.com	1399375412319
181467	Chadder: John McAfee slaps name on 'private' messaging app	http://www.pcworld.com/article/2150988/chadder-john-mcafee-slaps-name-on-private-messaging-app.html	PCWorld \(blog\)	t	d4ZF843-azdAvuMC9Jo-g2GQyEtDM	www.pcworld.com	1399375412564
181468	John McAfee's Chadder aims to keep your messages private, lands on Windows  ...	http://www.wpcentral.com/comment/896073	Daniel Rubino	t	d4ZF843-azdAvuMC9Jo-g2GQyEtDM	www.wpcentral.com	1399375412826
181469	John McAfee's latest project is yet another secure messaging app	http://www.engadget.com/2014/05/05/john-mcafee-secure-chat-app/	Engadget	t	d4ZF843-azdAvuMC9Jo-g2GQyEtDM	www.engadget.com	1399375413152
181470	Noted crazyman John McAfee launches 'secure messaging app' for folks who  ...	http://boingboing.net/2014/05/05/noted-crazyman-john-mcafee-lau.html	Boing Boing	t	d4ZF843-azdAvuMC9Jo-g2GQyEtDM	boingboing.net	1399375413369
181471	Here Is John McAfee's New Anti-Surveillance Private Messaging App	http://www.businessinsider.com/chadder-mcafee-anti-surveillance-app-2014-5	Business Insider	t	d4ZF843-azdAvuMC9Jo-g2GQyEtDM	www.businessinsider.com	1399375413622
181472	New Android and Windows app, Chadder, sends messages encrypted on the  ...	http://www.talkingnewmedia.com/2014/05/05/new-android-and-windows-app-chadder-sends-messages-encrypted-on-the-users-side/	Talking New Media	t	d4ZF843-azdAvuMC9Jo-g2GQyEtDM	www.talkingnewmedia.com	1399375413943
181473	Chadder arrives as latest encrypted private messaging app	http://androidcommunity.com/chadder-arrives-as-latest-encrypted-private-messaging-app-20140505/	Android Community	t	d4ZF843-azdAvuMC9Jo-g2GQyEtDM	androidcommunity.com	1399375414218
181474	John McAfee launches Chadder, a new encrypted private messaging app	http://thenextweb.com/apps/2014/05/05/john-mcafee-launches-chadder-new-encrypted-private-messaging-app/	The Next Web	t	d4ZF843-azdAvuMC9Jo-g2GQyEtDM	thenextweb.com	1399375414466
181475	NSA posts encrypted tweet to recruit code breakers	http://rt.com/news/157040-nsa-encoded-tweets-jobs/	RT	t	d3IyogNPXhkchHMmGrbgBXaJSZzlM	rt.com	1399375520437
181476	National Security Agency sends out coded tweet to recruit personnel	http://www.irishexaminer.com/world/national-security-agency-sends-out-coded-tweet-to-recruit-personnel-267663.html	Irish Examiner	t	d3IyogNPXhkchHMmGrbgBXaJSZzlM	www.irishexaminer.com	1399375520662
181477	NSA looks to appeal to young cryptographers through coded ads	http://www.theinquirer.net/inquirer/news/2343137/nsa-looks-to-appeal-to-young-cryptographers-through-coded-ads	Inquirer	t	d3IyogNPXhkchHMmGrbgBXaJSZzlM	www.theinquirer.net	1399375520939
181478	The NSA tweeted a mysterious coded message - here's why they did it and what  ...	http://www.independent.co.uk/life-style/gadgets-and-tech/the-nsa-tweeted-a-mysterious-coded-message--heres-why-they-did-it-and-what-it-means-9325316.html	The Independent	t	d3IyogNPXhkchHMmGrbgBXaJSZzlM	www.independent.co.uk	1399375521344
181479	Crack Coded Tweets For A Job At The NSA	http://www.citytalk.fm/news/uk-and-world/20140506-crack-coded-tweets-for-a-job-at-the-nsa/	City Talk 105.9	t	d3IyogNPXhkchHMmGrbgBXaJSZzlM	www.citytalk.fm	1399375521598
181480	NSA Seeks to Hire Code Breakers Via Encrypted Tweets	http://en.ria.ru/world/20140506/189610047/NSA-Seeks-to-Hire-Code-Breakers-Via-Encrypted-Tweets.html	RIA Novosti	t	d3IyogNPXhkchHMmGrbgBXaJSZzlM	en.ria.ru	1399375521992
181481	NSA hires cryptographers via mysterious tweet	http://voiceofrussia.com/news/2014_05_06/NSA-hires-cryptographers-via-mysterious-tweet-0814/	The Voice of Russia	t	d3IyogNPXhkchHMmGrbgBXaJSZzlM	voiceofrussia.com	1399375522226
181482	NSA Seeks Codebreakers Via Cryptic Tweets	http://www.newser.com/story/186417/nsa-seeks-codebreakers-via-cryptic-tweets.html	Newser	t	d3IyogNPXhkchHMmGrbgBXaJSZzlM	www.newser.com	1399375522480
181483	The NSA sent a mysterious coded tweet. Here's the decrypted message.	http://www.washingtonpost.com/news/the-intersect/wp/2014/05/05/the-nsa-sent-a-mysterious-coded-tweet-heres-the-decrypted-message/	Washington Post	t	d3IyogNPXhkchHMmGrbgBXaJSZzlM	www.washingtonpost.com	1399375522715
181484	NSA's Encrypted Tweet: We're Hiring Code Breakers	http://wwno.org/post/nsas-encrypted-tweet-were-hiring-code-breakers	WWNO	t	d3IyogNPXhkchHMmGrbgBXaJSZzlM	wwno.org	1399375522970
181485	Samsung found guilty of infringing Apple patents	http://www.expertreviews.co.uk/smartphones/1308064/samsung-found-guilty-of-infringing-apple-patents	Expert Reviews	t	dI0WdI1QDP37VmMGu_iK7ghNPJ0lM	www.expertreviews.co.uk	1399375787702
181486	Samsung ordered to pay Apple $119.6m	http://www.totaltele.com/view.aspx\?ID=486272	Total Telecom	t	dI0WdI1QDP37VmMGu_iK7ghNPJ0lM	www.totaltele.com	1399375787905
181487	Samsung Galaxy S5 mini With 4.4-Inch Screen Spotted in India	http://www.gizbot.com/mobile/samsung-galaxy-s5-mini-with-4-4-inch-screen-spotted-india-017032.html	Gizbot	t	dI0WdI1QDP37VmMGu_iK7ghNPJ0lM	www.gizbot.com	1399375788170
181488	Inverted world as jury finishes Samsung versus Apple case	http://news.techeye.net/business/inverted-world-as-jury-finishes-samsung-versus-apple-case	TechEye	t	dI0WdI1QDP37VmMGu_iK7ghNPJ0lM	news.techeye.net	1399375788424
181489	Apple awarded $119 million, but who's winning the war?	http://timesofindia.indiatimes.com/tech/tech-news/Apple-awarded-119-million-but-whos-winning-the-war/articleshow/34734220.cms	Times of India	t	dI0WdI1QDP37VmMGu_iK7ghNPJ0lM	timesofindia.indiatimes.com	1399375788675
181490	Samsung Galaxy Tab S 'to feature AMOLED display, fingerprint scanner'	http://www.digitalspy.com/tech/news/a568876/samsung-galaxy-tab-s-to-feature-amoled-display-fingerprint-scanner.html	Digital Spy	t	dI0WdI1QDP37VmMGu_iK7ghNPJ0lM	www.digitalspy.com	1399375788899
181491	High price for Samsung Galaxy K Zoom comes into focus	http://www.techradar.com/news/phone-and-communications/mobile-phones/high-price-for-samsung-galaxy-k-zoom-comes-into-focus-1247089\?src=rss&amp;attr=all	TechRadar UK	t	dI0WdI1QDP37VmMGu_iK7ghNPJ0lM	www.techradar.com	1399375789099
181492	Jury Corrects Verdict Form, Apple Inc Still Gets Only $119.5M From Samsung	http://www.opptrends.com/2014/05/jury-corrects-verdict-form-apple-still-gets-only-119-5m-from-samsung/	Opptrends	t	dI0WdI1QDP37VmMGu_iK7ghNPJ0lM	www.opptrends.com	1399375789361
181493	Samsung Flagship Galaxy S5 Mini Models Lands in India for Testing; to Feature  ...	http://www.ibtimes.co.in/articles/551362/20140506/samsung-galaxys5-mini-india-4-47-display.htm	International Business Times, India Edition	t	dI0WdI1QDP37VmMGu_iK7ghNPJ0lM	www.ibtimes.co.in	1399375789883
181494	Pink and Red Galaxy Note 3 Neo Officially Revealed	http://www.android.gs/pink-and-red-galaxy-note-3-neo-officially-revealed/	Android Geeks	t	dI0WdI1QDP37VmMGu_iK7ghNPJ0lM	www.android.gs	1399375790107
181495	Samsung Galaxy K Zoom price and release theory	http://www.product-reviews.net/2014/05/06/samsung-galaxy-k-zoom-price-and-release-theory/	Product Reviews	t	dI0WdI1QDP37VmMGu_iK7ghNPJ0lM	www.product-reviews.net	1399375790318
181496	Apple awarded $119M, but who's winning the fight? | Malaysia Sun	http://www.malaysiasun.com/index.php/sid/221717203/scat/d805653303cbbba8	Malaysia Sun	t	dI0WdI1QDP37VmMGu_iK7ghNPJ0lM	www.malaysiasun.com	1399375790546
181497	Jury: Samsung must pay Apple 119.6m in damages	http://www.malaysiasun.com/index.php/sid/221727881/scat/d805653303cbbba8	Malaysia Sun	t	dI0WdI1QDP37VmMGu_iK7ghNPJ0lM	www.malaysiasun.com	1399375790856
181498	Samsung's Upcoming GALAXY Tab S To Feature The World's First 2560×1600  ...	http://www.techtree.com/content/news/6124/samsung-s-upcoming-galaxy-tab-s-feature-world-s-first-2560-1600-pixel-amoled	Techtree.com	t	dI0WdI1QDP37VmMGu_iK7ghNPJ0lM	www.techtree.com	1399375791044
181499	Apple awarded $119M, but who's winning the fight?	http://news.msn.com/science-technology/apple-awarded-dollar119m-but-whos-winning-the-fight	MSN News	t	dI0WdI1QDP37VmMGu_iK7ghNPJ0lM	news.msn.com	1399375791259
181500	Samsung Galaxy S5 mini to reportedly boast a 4.47-inch display	http://www.bgr.in/manufacturers/samsung/samsung-galaxy-s5-mini-to-reportedly-boast-a-4-47-inch-display/	BGR India	t	dI0WdI1QDP37VmMGu_iK7ghNPJ0lM	www.bgr.in	1399375791503
