294101	Judge rules JC Penney interfered with Macy's pact with Stewart	http://www.houstonchronicle.com/business/retail/article/Judge-rules-J-C-Penney-interfered-with-Macy-s-5557269.php	Houston Chronicle	b	dUFzm97F6tYCy0M2bR8K-NosE_2OM	www.houstonchronicle.com	1403001032793
294102	Judge rules against J.C. Penney in Martha Stewart case	http://www.ketknbc.com/news/judge-rules-against-jc-penney-in-martha-stewart-ca	KETK	b	dUFzm97F6tYCy0M2bR8K-NosE_2OM	www.ketknbc.com	1403001033087
294103	JCPenney's behavior 'childish,' 'sophomoric' in Martha deal	http://nypost.com/2014/06/16/jcpenneys-behavior-childish-sophomoric-in-martha-deal/	New York Post	b	dUFzm97F6tYCy0M2bR8K-NosE_2OM	nypost.com	1403001033355
294104	Judge Skewers JC Penney For 'Colossal And Abject' Failure	http://www.huffingtonpost.com/2014/06/16/jcpenney-ruling_n_5500936.html\?ir=Business	Huffington Post	b	dUFzm97F6tYCy0M2bR8K-NosE_2OM	www.huffingtonpost.com	1403001033633
294105	Judge rules in favor of Macy's in dispute with JC Penney over Martha Stewart	http://www.dallasnews.com/business/retail/20140616-judge-rules-in-favor-of-macys-in-dispute-with-j.c.-penney-over-martha-stewart.ece	Dallas Morning News	b	dUFzm97F6tYCy0M2bR8K-NosE_2OM	www.dallasnews.com	1403001033987
294106	Penney-Martha Stewart Deal Violated Contract With Macy's: Court	http://www.rttnews.com/2337576/penney-martha-stewart-deal-violated-contract-with-macy-s-court.aspx	RTT News	b	dUFzm97F6tYCy0M2bR8K-NosE_2OM	www.rttnews.com	1403001034224
294107	JC Penney interfered with Macy's pact, judge says	http://www.kpvi.com/business/story/JC-Penney-interfered-with-Macys-pact-judge-says/9vtZhEIdZkOrk_Egu_29Hw.cspx	KPVI News 6	b	dUFzm97F6tYCy0M2bR8K-NosE_2OM	www.kpvi.com	1403001034435
294108	UPDATE 2-JC Penney interfered with Macy's deal with Martha Stewart-judge	http://in.reuters.com/article/2014/06/16/macys-jc-penney-idINL2N0OX17I20140616	Reuters	b	dUFzm97F6tYCy0M2bR8K-NosE_2OM	in.reuters.com	1403001034658
294109	Penney Interfered in Macy's, Martha Stewart Deal: Judge	http://www.foxbusiness.com/economy-policy/2014/06/16/jc-penney-interfered-with-macy-deal-with-martha-stewart-judge/	Fox Business	b	dUFzm97F6tYCy0M2bR8K-NosE_2OM	www.foxbusiness.com	1403001035049
294110	Judge: JCPenney Interfered With Macy's Martha Stewart Contract	http://consumerist.com/2014/06/16/judge-jcpenney-interfered-with-macys-martha-stewart-contract/	The Consumerist	b	dUFzm97F6tYCy0M2bR8K-NosE_2OM	consumerist.com	1403001035329
294111	How Will This Court Ruling Affect J.C. Penney (JCP) Stock?	http://www.thestreet.com/story/12746065/1/how-will-this-court-ruling-affect-jc-penney-jcp-stock.html	TheStreet.com	b	dUFzm97F6tYCy0M2bR8K-NosE_2OM	www.thestreet.com	1403001035556
294112	Judge rules JCPenney interfered in Martha Stewart deal with Macy's	http://www.bizjournals.com/albany/news/2014/06/16/judge-rules-jcpenney-interfered-in-martha-stewart.html	Albany Business Review	b	dUFzm97F6tYCy0M2bR8K-NosE_2OM	www.bizjournals.com	1403001035989
294113	Judge: Penney interfered with Macy's pact	http://mtstandard.com/business/judge-penney-interfered-with-macy-s-pact/article_ce3e83e8-ae0f-56fb-972a-7585232e7aa6.html	Montana Standard	b	dUFzm97F6tYCy0M2bR8K-NosE_2OM	mtstandard.com	1403001036242
294114	Judge rules that JC Penney interfered with Macy's pact with Martha Stewart | The  ...	http://www.tribtown.com/view/story/27f4c7e324b14193b296e599c14b1d89/US--Macys-JC-Penney-Suit	The Tribune	b	dUFzm97F6tYCy0M2bR8K-NosE_2OM	www.tribtown.com	1403001036481
294115	Judge: JCPenney interfered with Macy's Martha Stewart pact	http://www.wcpo.com/money/local-business-news/judge-penney-interfered-with-macys-pact	WCPO	b	dUFzm97F6tYCy0M2bR8K-NosE_2OM	www.wcpo.com	1403001036682
294116	Judge Says J.C. Penney Interfered With Macy's/Martha Stewart Omnimedia  ...	http://www.benzinga.com/news/14/06/4636200/judge-says-j-c-penney-interfered-with-macysmartha-stewart-omnimedia-agreement	Benzinga	b	dUFzm97F6tYCy0M2bR8K-NosE_2OM	www.benzinga.com	1403001037070
294117	Judge Favors Macy's Over JC Penney in Martha Stewart Conflict	http://247wallst.com/retail/2014/06/16/judge-favors-macys-over-j-c-penney-in-martha-stewart-conflict/	24\/7 Wall St.	b	dUFzm97F6tYCy0M2bR8K-NosE_2OM	247wallst.com	1403001037357
294118	JC Penney Liable For Meddling In Macy's-Martha Stewart Deal	http://www.law360.com/commercialcontracts/articles/548461/jc-penney-liable-for-meddling-in-macy-s-martha-stewart-deal	Law360 \(subscription\)	b	dUFzm97F6tYCy0M2bR8K-NosE_2OM	www.law360.com	1403001037646
294119	Judge rules J.C. Penney interfered with Macy's, Martha Stewart agreement	http://www.bizjournals.com/dallas/news/2014/06/16/judge-rulesj-c-penney-interfered-with-macys-martha.html	Dallas Business Journal	b	dUFzm97F6tYCy0M2bR8K-NosE_2OM	www.bizjournals.com	1403001037891
294120	Judge rules that Penney interfered with Macy's pact with Martha Stewart	http://www.newser.com/article/29323ba4dd8643d887ecb523833113e8/judge-rules-that-penney-interfered-with-macys-pact-with-martha-stewart.html	Newser	b	dUFzm97F6tYCy0M2bR8K-NosE_2OM	www.newser.com	1403001038331
294121	Factory output rebounded in May	http://www.htrnews.com/viewart/20140617/MAN03/306170097/Factory-output-rebounded-May	Herald Times Reporter	b	dv_iUEpHl5R9fkMRvT1oqGzba9_yM	www.htrnews.com	1403001537437
294122	Factories boost output as builders gain confidence	http://www.sunherald.com/2014/06/16/5653384/factories-boost-output-as-builders.html	SunHerald.com	b	dv_iUEpHl5R9fkMRvT1oqGzba9_yM	www.sunherald.com	1403001537785
294123	US factory output rebounded in May	http://www.news-journal.com/business/u-s-factory-output-rebounded-in-may/article_863538da-f3fa-59a4-ae82-ae0c61ce5a15.html	Longview News-Journal	b	dv_iUEpHl5R9fkMRvT1oqGzba9_yM	www.news-journal.com	1403001538042
294124	Factory output rebounds in May	http://www.rockymounttelegram.com/business/factory-output-rebounds-may-2510191	Rocky Mount Telegram	b	dv_iUEpHl5R9fkMRvT1oqGzba9_yM	www.rockymounttelegram.com	1403001538285
294125	US reports slight rise in industrial production in May	http://www.shanghaidaily.com/article/article_xinhua.aspx\?id=224765	Shanghai Daily \(subscription\)	b	dv_iUEpHl5R9fkMRvT1oqGzba9_yM	www.shanghaidaily.com	1403001538631
294126	Posted by Imaduddin	http://www.brecorder.com/world/global-business-a-economy/179205.html	Business Recorder	b	dv_iUEpHl5R9fkMRvT1oqGzba9_yM	www.brecorder.com	1403001538952
294127	IMF lowers estimate of U.S economic growth in 2014	http://www.statesman.com/news/business/imf-lowers-estimate-of-us-economic-growth-in-2014/ngMNS/	Austin American-Statesman	b	dv_iUEpHl5R9fkMRvT1oqGzba9_yM	www.statesman.com	1403001539174
294128	US Industrial Production Rebounds In May	http://www.economonitor.com/blog/2014/06/u-s-industrial-production-rebounds-in-may/	EconoMonitor \(blog\)	b	dv_iUEpHl5R9fkMRvT1oqGzba9_yM	www.economonitor.com	1403001539451
294129	Factory Production Heats Up In Sign Of 2nd-Quarter Economic Rebound	http://personalliberty.com/factory-production-heats-sign-2nd-quarter-economic-rebound/	Personal Liberty Digest	b	dv_iUEpHl5R9fkMRvT1oqGzba9_yM	personalliberty.com	1403001539801
294130	IMF cuts US growth outlook, says full employment years off	http://www.gulf-times.com/eco.-bus.%20news/256/details/396538/imf-cuts-us-growth-outlook,-says-full-employment-years-off	Gulf Times	b	dv_iUEpHl5R9fkMRvT1oqGzba9_yM	www.gulf-times.com	1403001540074
294131	Factory output rises in May after slow first quarter	http://www.newsday.com/business/factory-output-rises-in-may-after-slow-first-quarter-1.8463637	Newsday	b	dv_iUEpHl5R9fkMRvT1oqGzba9_yM	www.newsday.com	1403001540421
294132	US factory output rebounded in May, latest evidence that manufacturing is  ...	http://www.kelownadailycourier.ca/business_news/national_business/article_96936509-5e37-5b77-b1ab-d9eec968411f.html	The Daily Courier \(subscription\)	b	dv_iUEpHl5R9fkMRvT1oqGzba9_yM	www.kelownadailycourier.ca	1403001540738
294133	Factory Output Rebounds In May, MAPI Weighs In	http://www.mbtmag.com/news/2014/06/factory-output-rebounds-may-mapi-weighs	Manufacturing Business Technology	b	dv_iUEpHl5R9fkMRvT1oqGzba9_yM	www.mbtmag.com	1403001541092
294134	Solid US factory output bolsters economy	http://www.cbsnews.com/news/solid-u-s-factory-output-bolsters-economy/	CBS News	b	dv_iUEpHl5R9fkMRvT1oqGzba9_yM	www.cbsnews.com	1403001541652
294135	US Factories Increase Production by 0.6% in May	http://www.industryweek.com/global-economy/us-factories-increase-production-06-may	IndustryWeek	b	dv_iUEpHl5R9fkMRvT1oqGzba9_yM	www.industryweek.com	1403001542203
294136	US industrial output rises in May	http://zeenews.india.com/business/news/international/us-industrial-output-rises-in-may_101947.html	Zee News	b	dv_iUEpHl5R9fkMRvT1oqGzba9_yM	zeenews.india.com	1403001542782
294137	MAPI: Factory Output Numbers Show 'Solid Footing'	http://www.manufacturing.net/news/2014/06/mapi-factory-output-numbers-show-solid-footing	Manufacturing.net	b	dv_iUEpHl5R9fkMRvT1oqGzba9_yM	www.manufacturing.net	1403001543125
294138	US Manufacturing Rises in May	http://www.marketpulse.com/20140616/us-manufacturing-rises-may/	MarketPulse \(blog\)	b	dv_iUEpHl5R9fkMRvT1oqGzba9_yM	www.marketpulse.com	1403001543506
294139	Stocks open mixed; Deal news lifts Covidien	http://www.ivpressonline.com/business/stocks-open-mixed-deal-news-lifts-covidien/article_825c412f-bcb3-59b3-a74a-cfc5d672ab00.html	Imperial Valley Press	b	dv_iUEpHl5R9fkMRvT1oqGzba9_yM	www.ivpressonline.com	1403001544038
294140	Factory output rebounded in May after April dip	http://www.observer-reporter.com/article/20140616/NEWS08/140619635	Washington Observer Reporter	b	dv_iUEpHl5R9fkMRvT1oqGzba9_yM	www.observer-reporter.com	1403001544717
294141	Foundation Commends Corbett for Signing New Bay Agreement	http://gantdaily.com/2014/06/17/foundation-commends-corbett-for-signing-new-bay-agreement/	Gant Daily	b	dlJe0wRmLsD-JYMnd5oo3AgdOHxPM	gantdaily.com	1403001631372
294142	Leaders of Chesapeake Bay states and the District sign new pact to improve  ...	http://www.washingtonpost.com/national/health-science/leaders-of-chesapeake-bay-states-and-the-district-sign-new-pact-to-improve-bays-health/2014/06/16/a51d1572-f576-11e3-a3a5-42be35962a52_story.html	Washington Post	b	dlJe0wRmLsD-JYMnd5oo3AgdOHxPM	www.washingtonpost.com	1403001631625
294143	Chesapeake Bay panel signs agreement	http://www.times-news.com/local/x1396891937/Chesapeake-Bay-panel-signs-agreement	Cumberland Times-News	b	dlJe0wRmLsD-JYMnd5oo3AgdOHxPM	www.times-news.com	1403001631883
294144	Chesapeake Bay Council signs new agreement	http://www.lewistownsentinel.com/page/content.detail/id/531201/Chesapeake-Bay-Council-signs-new-agreement.html\?isap=1&amp;nav=5013	Lewistown Sentinel	b	dlJe0wRmLsD-JYMnd5oo3AgdOHxPM	www.lewistownsentinel.com	1403001632143
294145	4 states, District of Columbia reach Chesapeake Bay pollution agreement	http://triblive.com/usworld/nation/6295327-74/bay-states-goals	Tribune-Review	b	dlJe0wRmLsD-JYMnd5oo3AgdOHxPM	triblive.com	1403001632470
294146	Maintaining the Chesapeake Bay Watershed	http://www.wearecentralpa.com/story/d/story/maintaining-the-chesapeake-bay-watershed/39607/dRrqtP7ceESTCoRr2umGIQ	WTAJ	b	dlJe0wRmLsD-JYMnd5oo3AgdOHxPM	www.wearecentralpa.com	1403001632702
294147	Landmark Agreement Signed to Restore and Protect Chesapeake Bay Watershed	http://www.enewspf.com/latest-news/science/science-a-environmental/53722-landmark-agreement-signed-to-restore-and-protect-chesapeake-bay-watershed.html	eNews Park Forest	b	dlJe0wRmLsD-JYMnd5oo3AgdOHxPM	www.enewspf.com	1403001632964
294148	Our View: Chesapeake Bay health affects us	http://cumberlink.com/news/opinion/editorial/our-view-chesapeake-bay-health-affects-us/article_51c0cd3e-f5ac-11e3-adcd-001a4bcf887a.html\?comment_form=true	The Sentinel	b	dlJe0wRmLsD-JYMnd5oo3AgdOHxPM	cumberlink.com	1403001633255
294149	Chesapeake Bay Council Agree to Submit Plans to Fight Pollution	http://www.csnwashington.com/article/chesapeake-bay-council-agree-submit-plans-fight-pollution	Comcast SportsNet Washington	b	dlJe0wRmLsD-JYMnd5oo3AgdOHxPM	www.csnwashington.com	1403001633662
294150	Corbett Signs Historic Chesapeake Bay Agreement	http://www.yourerie.com/news/news-article/d/story/corbett-signs-historic-chesapeake-bay-agreement/26458/nmZ4o8zAdUCz4P74Ei4H-w	YourErie	b	dlJe0wRmLsD-JYMnd5oo3AgdOHxPM	www.yourerie.com	1403001633985
294151	U.S. states sign regional pact to restore Chesapeake Bay	http://www.globalpost.com/dispatch/news/thomson-reuters/140616/regional-us-accord-signed-protect-struggling-chesapeake-bay	GlobalPost	b	dlJe0wRmLsD-JYMnd5oo3AgdOHxPM	www.globalpost.com	1403001634376
294152	Chesapeake Bay Council of governors from Md., Va., Pa., Del. and DC sign new  ...	http://www.tribtown.com/view/story/8d28b77a633848808dda447acb319c07/MD--Chesapeake-Bay-Council	The Tribune	b	dlJe0wRmLsD-JYMnd5oo3AgdOHxPM	www.tribtown.com	1403001634631
294153	Chesapeake Bay states sign onto new bay agreement	http://www.dailypress.com/news/science/dp-nws-new-watershed-agreement-20140616,0,2045555.story	Daily Press	b	dlJe0wRmLsD-JYMnd5oo3AgdOHxPM	www.dailypress.com	1403001634835
294154	New Chesapeake Bay Watershed Agreement signed	http://www.capitalgazette.com/maryland_gazette/news/environment/new-chesapeake-bay-watershed-agreement-signed/article_7f41fabc-4a41-5bbf-aa91-e9315ae6ac47.html	CapitalGazette.com	b	dlJe0wRmLsD-JYMnd5oo3AgdOHxPM	www.capitalgazette.com	1403001635117
294155	Govs. sign new Bay pact	http://www.stardem.com/ap/state/article_76301988-1d95-530e-8893-b9c34bf9964d.html	The Star Democrat	b	dlJe0wRmLsD-JYMnd5oo3AgdOHxPM	www.stardem.com	1403001635436
294156	Six states sign agreement to work together to restore Chesapeake Bay	http://www.rawstory.com/rs/2014/06/16/six-states-sign-agreement-to-work-together-to-restore-chesapeake-bay/	Raw Story	b	dlJe0wRmLsD-JYMnd5oo3AgdOHxPM	www.rawstory.com	1403001635815
294157	Six States Sign Regional Pact to Restore Chesapeake Bay	http://www.newsmax.com/us/chesapeake-bay-restoration/2014/06/16/id/577372/	Newsmax.com	b	dlJe0wRmLsD-JYMnd5oo3AgdOHxPM	www.newsmax.com	1403001636088
294158	UPDATE 1-US states sign regional pact to restore Chesapeake Bay	http://in.reuters.com/article/2014/06/16/usa-environment-chesapeake-idINL2N0OX1ND20140616	Reuters	b	dlJe0wRmLsD-JYMnd5oo3AgdOHxPM	in.reuters.com	1403001636428
294159	New bay restoration pact signed	http://www.baltimoresun.com/features/green/blog/bs-md-bay-agreement-20140616,0,7963269.story	Baltimore Sun \(blog\)	b	dlJe0wRmLsD-JYMnd5oo3AgdOHxPM	www.baltimoresun.com	1403001636669
294160	McAuliffe marks signing of new Chesapeake Bay Watershed Agreement	http://augustafreepress.com/mcauliffe-marks-signing-new-chesapeake-bay-watershed-agreement/	Augusta Free Press	b	dlJe0wRmLsD-JYMnd5oo3AgdOHxPM	augustafreepress.com	1403001637035
294161	Chesapeake Bay regional council meets in Annapolis	http://wesm913.org/post/chesapeake-bay-regional-council-meets-annapolis	WESM	b	dlJe0wRmLsD-JYMnd5oo3AgdOHxPM	wesm913.org	1403001637300
294162	Corbett signs regional pact to address Chesapeake Bay health	http://www.philly.com/philly/blogs/harrisburg_politics/Corbett-signs-regional-pact-to-address-health-of-Chesapeake-Bay-.html	Philly.com \(blog\)	b	dlJe0wRmLsD-JYMnd5oo3AgdOHxPM	www.philly.com	1403001637697
294163	Gov. McAuliffe Celebrates Signing of New Chesapeake Bay Watershe - NBC29  ...	http://www.nbc29.com/story/25789523/gov-mcauliffe-celebrates-signing-of-new-chesapeake-bay-watershed-agreement	NBC 29 News	b	dlJe0wRmLsD-JYMnd5oo3AgdOHxPM	www.nbc29.com	1403001637910
294164	Regional U.S. accord signed to protect struggling Chesapeake Bay	http://www.businessinsider.com/r-regional-us-accord-signed-to-protect-struggling-chesapeake-bay-2014-16	Business Insider	b	dlJe0wRmLsD-JYMnd5oo3AgdOHxPM	www.businessinsider.com	1403001638155
294165	W.Va. joins in Chesapeake agreement	http://www.hampshirereview.com/blog/2014/06/16/w-va-joins-in-chesapeake-agreement/	Hampshire Review \(blog\)	b	dlJe0wRmLsD-JYMnd5oo3AgdOHxPM	www.hampshirereview.com	1403001638440
294166	Markell attends Chesapeake Bay watershed agreement signing	http://www.wdel.com/story.php\?id=60219	WDEL 1150AM	b	dlJe0wRmLsD-JYMnd5oo3AgdOHxPM	www.wdel.com	1403001638711
294167	Philly trains roll again after one-day strike	http://www.abc27.com/story/25785839/philly-trains-roll-again-after-one-day-strike	abc27	b	dlJe0wRmLsD-JYMnd5oo3AgdOHxPM	www.abc27.com	1403001638939
294168	Region's Governors Meet on Cleaning Up the Bay	http://delmarvapublicradio.net/post/regions-governors-meet-cleaning-bay	Delmarva Public Radio	b	dlJe0wRmLsD-JYMnd5oo3AgdOHxPM	delmarvapublicradio.net	1403001639205
294169	Pennsylvania is doing its part to clean up Chesapeake Bay: PennLive letters	http://www.pennlive.com/opinion/2014/06/pennsylvania_is_doing_its_part.html	The Patriot-News	b	dlJe0wRmLsD-JYMnd5oo3AgdOHxPM	www.pennlive.com	1403001639683
294170	Toddler hit by car in Charles County, Md.	http://www.abc27.com/story/25782363/toddler-hit-by-car-in-charles-county-md	abc27	b	dlJe0wRmLsD-JYMnd5oo3AgdOHxPM	www.abc27.com	1403001639924
294171	Phosphorus reduction in bay losing steam in places	http://www.baltimoresun.com/news/maryland/sun-investigates/bs-md-bay-phosphorus-20140608,0,5398157.story	Baltimore Sun	b	dlJe0wRmLsD-JYMnd5oo3AgdOHxPM	www.baltimoresun.com	1403001640415
294172	BG Group says sells stake in North Sea pipeline	http://www.globalpost.com/dispatch/news/afp/140617/bg-group-says-sells-stake-north-sea-pipeline	GlobalPost	b	dYrWSMXxl9gR6ZMJsKtpnZ-YTqcoM	www.globalpost.com	1403001725374
294173	BG Sells Stake in North Sea Pipe Network for $954 Million	http://www.businessweek.com/news/2014-06-17/bg-sells-stake-in-north-sea-pipeline-network-for-954-million	Businessweek	b	dYrWSMXxl9gR6ZMJsKtpnZ-YTqcoM	www.businessweek.com	1403001725577
294174	UPDATE 1-BG sells UK CATS gas pipeline stake to infrastructure fund	http://in.reuters.com/article/2014/06/17/bggroup-brief-idINL5N0OY1LJ20140617	Reuters	b	dYrWSMXxl9gR6ZMJsKtpnZ-YTqcoM	in.reuters.com	1403001725794
294175	BG to sell its stake in CATS pipeline in North Sea	http://www.marketwatch.com/story/bg-to-sell-its-stake-in-cats-pipeline-in-north-sea-2014-06-17\?link=MW_home_latest_news	MarketWatch	b	dYrWSMXxl9gR6ZMJsKtpnZ-YTqcoM	www.marketwatch.com	1403001726003
294176	BG sells interest in CATS pipeline and associated infrastructure	http://www.energyglobal.com/news/pipelines/articles/BG_sells_interest_in_CATS_pipeline_and_associated_infrastructure.aspx	Energy Global	b	dYrWSMXxl9gR6ZMJsKtpnZ-YTqcoM	www.energyglobal.com	1403001726266
294177	BG Group to sells stake in North Sea pipeline	http://economictimes.indiatimes.com/news/international/business/bg-group-to-sells-stake-in-north-sea-pipeline/articleshow/36706361.cms	Economic Times	b	dYrWSMXxl9gR6ZMJsKtpnZ-YTqcoM	economictimes.indiatimes.com	1403001726654
294178	BG Group To Sell 62.78% Stake In CATS Gas Pipeline For $954 Mln - Update	http://www.nasdaq.com/article/bg-group-to-sell-6278-stake-in-cats-gas-pipeline-for-954-mln--update-20140617-00060	NASDAQ	b	dYrWSMXxl9gR6ZMJsKtpnZ-YTqcoM	www.nasdaq.com	1403001726978
294179	BG Group to sell stake in CATS North Sea gas pipeline	http://www.ifamagazine.com/news/bg-group-to-sell-stake-in-cats-north-sea-gas-pipeline-300903	IFA Magazine	b	dYrWSMXxl9gR6ZMJsKtpnZ-YTqcoM	www.ifamagazine.com	1403001727239
294180	BG Group to sell interest in CATS pipeline & infrastructure for £562 mln	http://www.rttnews.com/2337710/bg-group-to-sell-interest-in-cats-pipeline-infrastructure-for-562-mln.aspx\?type=qf&amp;utm_source=google&amp;utm_campaign=sitemap	RTT News	b	dYrWSMXxl9gR6ZMJsKtpnZ-YTqcoM	www.rttnews.com	1403001727682
294181	Tyson Foods' Acquisition of Hillshire Takes Step Forward	http://www.thepoultrysite.com/poultrynews/32490/tyson-foods-acquisition-of-hillshire-takes-step-forward	ThePoultrySite.com	b	dz1WXm7JU9QAfGMV0LZJbPbNDgJBM	www.thepoultrysite.com	1403001796979
294182	US: Hillshire Brands Withdraws Recommendation For Pinnacle Deal	http://www.kamcity.com/namnews/asp/newsarticle.asp\?newsid=75693	Namnews	b	dz1WXm7JU9QAfGMV0LZJbPbNDgJBM	www.kamcity.com	1403001797218
294183	Pinnacle Foods Provides Attractive Alternative To Hillshire Brands For Pilgrim's  ...	http://seekingalpha.com/article/2271723-pinnacle-foods-provides-attractive-alternative-to-hillshire-brands-for-pilgrims-pride	Seeking Alpha	b	dz1WXm7JU9QAfGMV0LZJbPbNDgJBM	seekingalpha.com	1403001797530
294184	Business digest,	http://www.omaha.com/money/business-digest/article_f76d529a-012f-5775-a822-150f35c87d22.html	Omaha World-Herald	b	dz1WXm7JU9QAfGMV0LZJbPbNDgJBM	www.omaha.com	1403001797724
294185	Hillshire takes Tyson deal, drops its own bid for Pinnacle Foods	http://www.latimes.com/business/la-fi-hillshire-tyson-20140616-story.html	Los Angeles Times	b	dz1WXm7JU9QAfGMV0LZJbPbNDgJBM	www.latimes.com	1403001797985
294186	Benzinga's M&A Chatter for Monday June 16, 2014	http://www.benzinga.com/news/14/06/4637284/benzingas-m-a-chatter-for-monday-june-16-2014	Benzinga	b	dz1WXm7JU9QAfGMV0LZJbPbNDgJBM	www.benzinga.com	1403001798316
294187	Hillshire Brands withdraws supports for merger with Pinnacle; favors Tyson	http://www.buffalonews.com/business/hillshire-brands-withdraws-supports-for-merger-with-pinnacle-favors-tyson-20140616	Buffalo News	b	dz1WXm7JU9QAfGMV0LZJbPbNDgJBM	www.buffalonews.com	1403001798576
294188	Tyson Foods is one step closer to owning Hillshire	http://www.thecitywire.com/node/33501	The City Wire	b	dz1WXm7JU9QAfGMV0LZJbPbNDgJBM	www.thecitywire.com	1403001798854
294189	Hillshire seeks to end Pinnacle buyout offer	http://www.menafn.com/1093862289/Hillshire-seeks-to-end-Pinnacle-buyout-offer	MENAFN.COM	b	dz1WXm7JU9QAfGMV0LZJbPbNDgJBM	www.menafn.com	1403001799189
294190	Hillshire backs away from Pinnacle Foods	http://journalstar.com/ap/business/hillshire-backs-away-from-pinnacle-foods/article_4e84faae-fbb6-5d35-9f0a-5bb63a08ae64.html	Lincoln Journal Star	b	dz1WXm7JU9QAfGMV0LZJbPbNDgJBM	journalstar.com	1403001799652
294191	Did Tyson Really Win The Hillshire Takeover Battle?	http://www.benzinga.com/news/14/06/4636808/did-tyson-really-win-the-hillshire-takeover-battle	Benzinga	b	dz1WXm7JU9QAfGMV0LZJbPbNDgJBM	www.benzinga.com	1403001799931
294192	Pinnacle Foods No Longer at the Top of Hillshire's To-Do List	http://www.fool.com/investing/general/2014/06/16/pinnacle-foods-no-longer-at-the-top-of-hillshires.aspx	Motley Fool	b	dz1WXm7JU9QAfGMV0LZJbPbNDgJBM	www.fool.com	1403001800243
294193	Pinnacle fuels food brands with R&D partnership	http://www.foodproductiondaily.com/Processing/Pinnacle-Foods-joins-with-Rutgers-on-food-R-D-project	FoodProductionDaily.com	b	dz1WXm7JU9QAfGMV0LZJbPbNDgJBM	www.foodproductiondaily.com	1403001800476
294194	Hillshire Board Loses Appetite For $6.6B Pinnacle Takeover	http://www.law360.com/articles/548242/hillshire-board-loses-appetite-for-6-6b-pinnacle-takeover	Law360 \(subscription\)	b	dz1WXm7JU9QAfGMV0LZJbPbNDgJBM	www.law360.com	1403001800776
294195	Hillshire Moves To Terminate Pinnacle Deal	http://www.rttnews.com/2337421/hillshire-moves-to-terminate-pinnacle-deal.aspx\?type=bn	RTT News	b	dz1WXm7JU9QAfGMV0LZJbPbNDgJBM	www.rttnews.com	1403001800978
294196	Hillshire backs away from Pinnacle Foods offer	http://www.wthr.com/story/25787888/2014/06/16/hillshire-backs-away-from-pinnacle-foods-offer	WTHR	b	dz1WXm7JU9QAfGMV0LZJbPbNDgJBM	www.wthr.com	1403001801313
294197	Hillshire Says Takeover by Tyson Better Than Buying Pinnacle	http://www.agweb.com/article/hillshire_says_takeover_by_tyson_better_than_buying_pinnacle_BLMG/	AgWeb	b	dz1WXm7JU9QAfGMV0LZJbPbNDgJBM	www.agweb.com	1403001801657
294198	Hillshire Brands dumps Pinnacle for Tyson deal	http://www.csmonitor.com/Business/The-Bite/2014/0616/Hillshire-Brands-dumps-Pinnacle-for-Tyson-deal	Christian Science Monitor	b	dz1WXm7JU9QAfGMV0LZJbPbNDgJBM	www.csmonitor.com	1403001801925
294199	Newscast: Hillshire wants to move Tyson deal along	http://www.marketwatch.com/story/newscast-hillshire-wants-to-move-tyson-deal-along-2014-06-16\?reflink=MW_news_stmp	MarketWatch	b	dz1WXm7JU9QAfGMV0LZJbPbNDgJBM	www.marketwatch.com	1403001802251
294200	Hillshire advises shareholders to vote against Pinnacle bid	http://www.chicagotribune.com/business/breaking/chi-hillshire-tells-shareholders-to-vote-against-pinnacle-bid-20140616,0,1733665.story	Chicago Tribune	b	dz1WXm7JU9QAfGMV0LZJbPbNDgJBM	www.chicagotribune.com	1403001802485
