12001	Face rebuilt using 3D-printed parts	http://www.radionz.co.nz/news/world/238751/face-rebuilt-using-3d-printed-parts	Radio New Zealand	m	dLXY-AgP3lX2FfMrrjyfR8StpP1xM	www.radionz.co.nz	1394722050227
12002	Mishap survivor's face reshaped using 3D printed parts	http://timesofindia.indiatimes.com/home/science/Mishap-survivors-face-reshaped-using-3D-printed-parts/articleshow/31915502.cms	Times of India	m	dLXY-AgP3lX2FfMrrjyfR8StpP1xM	timesofindia.indiatimes.com	1394722050371
12003	The News Matrix: Thursday 13 March 2014	http://www.independent.co.uk/i/matrix/the-news-matrix-thursday-13-march-2014-9188197.html	The Independent	m	dLXY-AgP3lX2FfMrrjyfR8StpP1xM	www.independent.co.uk	1394722050580
12004	Pioneering 3D printing used to rebuild British man's face	http://www.independent.co.uk/life-style/gadgets-and-tech/news/pioneering-3d-printing-used-to-rebuild-british-mans-face-9188285.html	The Independent	m	dLXY-AgP3lX2FfMrrjyfR8StpP1xM	www.independent.co.uk	1394722050782
12005	3D-Printed Skull Restores Crash Victim Stephen Power's Face	http://www.ibtimes.com/3d-printed-skull-restores-crash-victim-stephen-powers-face-1561095	International Business Times	m	dLXY-AgP3lX2FfMrrjyfR8StpP1xM	www.ibtimes.com	1394722051175
12006	Doctors Rebuild Motorcycle Accident Victim's Face With 3D Printer (PICS)	http://www.huffingtonpost.co.uk/2014/03/12/3d-printer-new-face_n_4948410.html	Huffington Post UK	m	dLXY-AgP3lX2FfMrrjyfR8StpP1xM	www.huffingtonpost.co.uk	1394722051435
12007	Man's face rebuilt with 3D printing	http://www.3news.co.nz/Mans-face-rebuilt-with-3D-printing/tabid/412/articleID/335737/Default.aspx	3News NZ	m	dLXY-AgP3lX2FfMrrjyfR8StpP1xM	www.3news.co.nz	1394722051662
12008	Facial surgery using 3D printed parts 'totally life-changing' for British bike crash  ...	http://www.abc.net.au/news/2014-03-13/mans-life-transformed-by-facial-surgery-using-3d-printing/5317076	ABC Online	m	dLXY-AgP3lX2FfMrrjyfR8StpP1xM	www.abc.net.au	1394722051855
12009	Man's life transformed after 3D face printed	http://www.news24.com/Technology/News/Mans-life-transformed-after-3D-face-printed-20140312	News24	m	dLXY-AgP3lX2FfMrrjyfR8StpP1xM	www.news24.com	1394722052240
12010	Surgeons use 3D printed parts to rebuild Stephen Powers's face after  ...	http://www.news.com.au/world/surgeons-use-3d-printed-parts-to-rebuild-stephen-powerss-face-after-motorcyling-accident/story-fndir2ev-1226853145236	NEWS.com.au	m	dLXY-AgP3lX2FfMrrjyfR8StpP1xM	www.news.com.au	1394722052501
12011	Man Gets 3D-Printed Skull	http://news.discovery.com/tech/biotechnology/man-gets-3d-printed-skull-140312.htm	Discovery News	m	dLXY-AgP3lX2FfMrrjyfR8StpP1xM	news.discovery.com	1394722052811
12012	3D printing used to rebuild man's face after motorcycle crash	http://descrier.co.uk/science/2014/03/3d-printing-used-rebuild-mans-face-motorcycle-crash/\?utm_source=rss&amp;utm_medium=rss&amp;utm_campaign=3d-printing-used-rebuild-mans-face-motorcycle-crash	Descrier	m	dLXY-AgP3lX2FfMrrjyfR8StpP1xM	descrier.co.uk	1394722053032
12013	How British doctors printed a new face!	http://www.khaleejtimes.com/kt-article-display-1.asp\?xfile=data/international/2014/March/international_March312.xml&amp;section=international	Khaleej Times	m	dLXY-AgP3lX2FfMrrjyfR8StpP1xM	www.khaleejtimes.com	1394722053334
12014	Before and After Pictures Show How 3D Printer Rebuilt Motorbike Crash Victim's  ...	http://www.ibtimes.co.uk/before-after-pictures-show-how-3d-printer-rebuilt-motorbike-crash-victims-face-1440021	International Business Times UK	m	dLXY-AgP3lX2FfMrrjyfR8StpP1xM	www.ibtimes.co.uk	1394722053486
12015	3D printed parts used to rebuild man's face	http://www.rte.ie/news/special-reports/2014/0312/601836-3d-printed-parts-used-to-rebuild-mans-face/	RTE.ie	m	dLXY-AgP3lX2FfMrrjyfR8StpP1xM	www.rte.ie	1394722053679
12016	Pioneering 3D printing reshapes UK patient's face	http://zeenews.india.com/news/science/pioneering-3d-printing-reshapes-uk-patient-s-face_917555.html	Zee News	m	dLXY-AgP3lX2FfMrrjyfR8StpP1xM	zeenews.india.com	1394722053905
12017	3D Printing: Biker's Face Is Reconstructed	http://www.key103.co.uk/news/stangenews/20140312-3d-printing-biker-s-face-is-reconstructed/	Key 103 Manchester	m	dLXY-AgP3lX2FfMrrjyfR8StpP1xM	www.key103.co.uk	1394722054106
12018	Surgeons use 3D printer to fix man's face	http://news.msn.co.nz/worldnews/8813364/surgeons-use-3d-printer-to-fix-mans-face	MSN NZ News	m	dLXY-AgP3lX2FfMrrjyfR8StpP1xM	news.msn.co.nz	1394722054434
12019	3D Printing Helps Rebuild Motorcyclist's Crushed Face	http://www.gizmodo.co.uk/2014/03/3d-printing-helps-rebuild-motorcyclists-crushed-face/	Gizmodo UK	m	dLXY-AgP3lX2FfMrrjyfR8StpP1xM	www.gizmodo.co.uk	1394722054618
12020	British Man's Face Rebuilt With 3D Printed Parts	http://time.com/21223/british-mans-face-rebuilt-with-3d-printed-parts/	TIME	m	dLXY-AgP3lX2FfMrrjyfR8StpP1xM	time.com	1394722054828
12021	3D printing leader reshapes the face of patients in Wales	http://periscopepost.com/health-5/3d-printing-leader-reshapes-the-face-of-patients-in-wales-6939.html	The Periscope Post	m	dLXY-AgP3lX2FfMrrjyfR8StpP1xM	periscopepost.com	1394722055138
12022	Man's face reconstructed with 3D printed parts	http://www.healthcentral.com/dailydose/cf/2014/03/12/man_s_face_reconstructed_with_3d_printed_parts	HealthCentral.com	m	dLXY-AgP3lX2FfMrrjyfR8StpP1xM	www.healthcentral.com	1394722055351
12023	UK surgeons use 3D printing to reconstruct face of motorbike accident victim	http://voiceofrussia.com/news/2014_03_12/UK-surgeons-use-3D-printing-to-reconstruct-face-of-motorbike-accident-victim-4160/	The Voice of Russia	m	dLXY-AgP3lX2FfMrrjyfR8StpP1xM	voiceofrussia.com	1394722055534
12024	'Surgeons printed me an entire new skull': Father makes surgical history using  ...	http://www.dailymail.co.uk/health/article-2579035/Surgeons-printed-entire-new-skull-Father-makes-surgical-history-using-3D-technology-motorbike-accident.html	Daily Mail	m	dLXY-AgP3lX2FfMrrjyfR8StpP1xM	www.dailymail.co.uk	1394722055828
12025	3D printing helps reconstruct motorcyclist's shattered face	http://metro.co.uk/2014/03/12/3d-printing-helps-reconstruct-motorcyclists-shattered-face-4540571/	Metro	m	dLXY-AgP3lX2FfMrrjyfR8StpP1xM	metro.co.uk	1394722056079
12026	Motorbike accident victim has face reconstructed using 3D printed parts	http://www.pocket-lint.com/news/127838-motorbike-accident-victim-has-face-reconstructed-using-3d-printed-parts	Pocket-lint.com	m	dLXY-AgP3lX2FfMrrjyfR8StpP1xM	www.pocket-lint.com	1394722056264
12027	3D printing technology used to rebuild crash victim's face	http://www.theweek.co.uk/health-science/57677/3d-printing-technology-used-rebuild-crash-victims-face	The Week UK	m	dLXY-AgP3lX2FfMrrjyfR8StpP1xM	www.theweek.co.uk	1394722056506
12028	Man makes surgical history after having his shattered face rebuilt using 3D  ...	http://www.telegraph.co.uk/health/10691753/Man-makes-surgical-history-after-having-his-shattered-face-rebuilt-using-3D-printed-parts.html	Telegraph.co.uk	m	dLXY-AgP3lX2FfMrrjyfR8StpP1xM	www.telegraph.co.uk	1394722056707
12029	Cardiff dad's face rebuilt using 3D printing technology	http://www.itv.com/news/wales/2014-03-12/dads-face-rebuilt-using-3d-technology/	ITV News	m	dLXY-AgP3lX2FfMrrjyfR8StpP1xM	www.itv.com	1394722056909
12030	Print me a cheek: Biker has face reconstructed in historic 3D surgery	http://www.mirror.co.uk/news/technology-science/technology/3d-printing-surgery-motorbike-crash-3232148	Mirror.co.uk	m	dLXY-AgP3lX2FfMrrjyfR8StpP1xM	www.mirror.co.uk	1394722057186
12031	South Wales dad has 3D facial reconstruction surgery at Swansea's Morriston  ...	http://www.southwales-eveningpost.co.uk/South-Wales-dad-3D-facial-reconstruction-surgery/story-20793933-detail/story.html	Southwales Evening Post	m	dLXY-AgP3lX2FfMrrjyfR8StpP1xM	www.southwales-eveningpost.co.uk	1394722057448
12032	New colorectal cancer data to be released | American Cancer Society	http://www.blscourierherald.com/news/249926391.html	Bonney Lake and Sumner Courier-Herald	m	dCAlr6DjfkFfL6MoIPGTT8vmavAyM	www.blscourierherald.com	1394722241928
12033	Your Health: Colon Cancer Awareness Month, Screening Rates Still Low	http://www.wcjb.com/your-health-local-news-health/2014/03/your-health-colon-cancer-awareness-month-screening-rates-still	WCJB	m	dCAlr6DjfkFfL6MoIPGTT8vmavAyM	www.wcjb.com	1394722242069
12034	March is Colon Cancer Prevention Month	http://www.dolphin-news.com/articles/2014/03/13/life/doc53207462735bd512567986.txt	Dolphin	m	dCAlr6DjfkFfL6MoIPGTT8vmavAyM	www.dolphin-news.com	1394722242220
12035	Europe is Falling Behind America in the Fight Against Colorectal Cancer Due to  ...	http://www.sys-con.com/node/3011125	SYS-CON Media \(press release\)	m	dCAlr6DjfkFfL6MoIPGTT8vmavAyM	www.sys-con.com	1394722242380
12036	Giant, inflatable colon at West Clinic to promote awareness	http://www.bizjournals.com/memphis/blog/morning_call/2014/03/giant-inflatable-colon-at-west-clinic-to-promote.html	Memphis Business Journal \(blog\)	m	dCAlr6DjfkFfL6MoIPGTT8vmavAyM	www.bizjournals.com	1394722242589
12037	Colon Cancer Awareness	http://www.pahomepage.com/story/d/story/colon-cancer-awareness/75828/eMf5uMtSlky4cccvtHnnZQ	PA home page	m	dCAlr6DjfkFfL6MoIPGTT8vmavAyM	www.pahomepage.com	1394722242782
12038	Achieving personal harmony and balance during Colon Cancer Awareness Month	http://www.idahostatejournal.com/vac/how_to/achieving-personal-harmony-and-balance-during-colon-cancer-awareness-month/article_864cdbe6-4363-52f8-9a4e-7e8bf7ae3df4.html	Idaho State Journal	m	dCAlr6DjfkFfL6MoIPGTT8vmavAyM	www.idahostatejournal.com	1394722242933
12039	Prevention, early detection key during colorectal cancer awareness month	http://www.lcsun-news.com/las_cruces-community/ci_25320812/prevention-early-detection-key-during-colorectal-cancer-awareness	Las Cruces Sun-News	m	dCAlr6DjfkFfL6MoIPGTT8vmavAyM	www.lcsun-news.com	1394722243187
12040	Giant inflatable colon helps raise cancer awareness	http://www.wxyz.com/news/giant-inflatable-colon-helps-raise-cancer-awareness	WXYZ	m	dCAlr6DjfkFfL6MoIPGTT8vmavAyM	www.wxyz.com	1394722243379
12041	Screening saves lives from colorectal cancer	http://www.mysanfordherald.com/view/full_story/24728341/article-Screening-saves-lives-from-colorectal-cancer\?instance=home_news_bullets	Mysanfordherald	m	dCAlr6DjfkFfL6MoIPGTT8vmavAyM	www.mysanfordherald.com	1394722243597
12042	Houston Methodist San Jacinto goes blue to knock out Colon Cancer	http://www.thevindicator.com/community/article_d4e62732-aa1f-11e3-94e8-0019bb2963f4.html	Liberty Vindicator	m	dCAlr6DjfkFfL6MoIPGTT8vmavAyM	www.thevindicator.com	1394722243741
12043	“Spring into Good Health” with a fun-filled event Saturday, March 15, at Glass  ...	http://www.gilmermirror.com/view/full_story/24707909/article--Spring-into-Good-Health--with-a-fun-filled-event-Saturday--March-15--at-Glass-Recreation-Center\?instance=special_coverage_bullets_right_column	Gilmer Mirror	m	dCAlr6DjfkFfL6MoIPGTT8vmavAyM	www.gilmermirror.com	1394722243917
12044	READER SUBMITTED: ASAP Urgent Care Offers Colon Cancer Risk Assessment	http://www.courant.com/community/hamden/hcrs-86548-hamden-20140311,0,4442536.story	Hartford Courant	m	dCAlr6DjfkFfL6MoIPGTT8vmavAyM	www.courant.com	1394722244201
12045	Happy Colorectal Cancer Awareness Month! What Does and Doesn't Prevent  ...	http://www.slate.com/articles/health_and_science/medical_examiner/2014/03/exercise_prevents_colorectal_cancer_but_vitamins_do_not_advice_from_an_m.html\?wpisrc=burger_bar	Slate Magazine	m	dCAlr6DjfkFfL6MoIPGTT8vmavAyM	www.slate.com	1394722244413
12046	Event supports colon cancer awareness	http://www.hickoryrecord.com/news/article_4b3737d8-a9f7-11e3-8ae6-001a4bcf6878.html	Hickory Daily Record	m	dCAlr6DjfkFfL6MoIPGTT8vmavAyM	www.hickoryrecord.com	1394722244614
12047	Why am I live-tweeting my colonoscopy?	http://www.whas11.com/community/blogs/political-blog/Why-am-I-live-tweeting-my-colonoscopy-249306191.html	WHAS 11.com \(subscription\) \(blog\)	m	dCAlr6DjfkFfL6MoIPGTT8vmavAyM	www.whas11.com	1394722244907
12048	Bowel Cancer 'Kills One European Adult Every Three Minutes' - How To Spot  ...	http://www.huffingtonpost.co.uk/2014/03/12/bowel-cancer-europe-kills-adult-every-three-minutes-spot-symptoms_n_4947891.html	Huffington Post UK	m	dCAlr6DjfkFfL6MoIPGTT8vmavAyM	www.huffingtonpost.co.uk	1394722245251
12049	Urging Utahns to be screened for colorectal cancer	http://www.cachevalleydaily.com/news/article_26fcd8f4-a9ad-11e3-9852-0017a43b2370.html	Cache Valley Daily	m	dCAlr6DjfkFfL6MoIPGTT8vmavAyM	www.cachevalleydaily.com	1394722245477
12050	Narconon Freedom Center Observes Colorectal Cancer Awareness Month	http://www.ourmidland.com/prweb/narconon-freedom-center-observes-colorectal-cancer-awareness-month/article_d6649086-b5da-5b54-aa0e-313bb8fb2f7e.html	Midland Daily News	m	dCAlr6DjfkFfL6MoIPGTT8vmavAyM	www.ourmidland.com	1394722245670
12051	NRHS offers free at-home colorectal cancer screening	http://www.mooreamerican.com/local/x1387860003/NRHS-offers-free-at-home-colorectal-cancer-screening	Moore American	m	dCAlr6DjfkFfL6MoIPGTT8vmavAyM	www.mooreamerican.com	1394722245863
12052	Free cancer screenings through UMC	http://www.telluridenews.com/articles/2014/03/12/norwood_post/news/doc531e2f9b34ed6132115483.txt	The Daily Planet	m	dCAlr6DjfkFfL6MoIPGTT8vmavAyM	www.telluridenews.com	1394722246115
12053	Jacksonville Beach Surgery Center debuts new technology in the fight against  ...	http://www.bizjournals.com/jacksonville/blog/morning-edition/2014/03/jacksonville-beach-surgery-center-debuts-new.html	Business Journal \(blog\)	m	dCAlr6DjfkFfL6MoIPGTT8vmavAyM	www.bizjournals.com	1394722246408
12054	Jacksonville Beach Surgery Center First In The State To Offer New Colon  ...	http://www.consumerelectronicsnet.com/article/Jacksonville-Beach-Surgery-Center-First-In-The-State-To-Offer-New-Colon-Cancer-Screening-Technology-3111802	Consumer Electronics Net	m	dCAlr6DjfkFfL6MoIPGTT8vmavAyM	www.consumerelectronicsnet.com	1394722246602
12055	Statewide colorectal cancer prevention study is screening patients, relatives for  ...	http://www.cleveland.com/healthfit/index.ssf/2014/03/statewide_colorectal_cancer_prevention_study_is_screening_patients_relatives_for_lynch_syndrome.html	The Plain Dealer	m	dCAlr6DjfkFfL6MoIPGTT8vmavAyM	www.cleveland.com	1394722246803
12056	Researchers seek 400 treatment-naïve colon participants to measure non  ...	http://www.news-medical.net/news/20140312/Researchers-seek-400-treatment-naive-colon-participants-to-measure-non-invasive-blood-test.aspx	News-Medical.net	m	dCAlr6DjfkFfL6MoIPGTT8vmavAyM	www.news-medical.net	1394722247046
12057	Awareness Campaign Urges Nevadans To Be Screened For Colorectal Cancer	http://www.publicnewsservice.org/2014-03-11/health-issues/awareness-campaign-urges-nevadans-to-be-screened-for-colorectal-cancer/a38068-1	Public News Service	m	dCAlr6DjfkFfL6MoIPGTT8vmavAyM	www.publicnewsservice.org	1394722247248
12058	Health Matters 03/12/14	http://www.leadertelegram.com/features/health/article_bc5aab61-d94d-5b66-a890-129aaff049a3.html	Leader-Telegram	m	dCAlr6DjfkFfL6MoIPGTT8vmavAyM	www.leadertelegram.com	1394722247415
12059	Giant inflatable colon helps with cancer prevention	http://la.wcsh6.com/news/news/1108813-giant-inflatable-colon-helps-cancer-prevention	WCSH-TV	m	dCAlr6DjfkFfL6MoIPGTT8vmavAyM	la.wcsh6.com	1394722247625
12060	Time to march in for early colorectal screening	http://www.utsandiego.com/news/2014/mar/11/early-colorectal-screening-diet/	U-T San Diego	m	dCAlr6DjfkFfL6MoIPGTT8vmavAyM	www.utsandiego.com	1394722247802
12061	Strollin' Colon raises colon cancer awareness	http://www.wgme.com/news/features/top-stories/stories/strollin-colon-raises-colon-cancer-awareness-21443.shtml	WGME	m	dCAlr6DjfkFfL6MoIPGTT8vmavAyM	www.wgme.com	1394722248058
12062	'Strollin' Colon' gives close-up view of health risks	http://www.wmtw.com/news/strollin-colon-gives-closeup-view-of-health-risks/24923776	WMTW Portland	m	dCAlr6DjfkFfL6MoIPGTT8vmavAyM	www.wmtw.com	1394722248323
12063	Giant colon inflates in East Memphis for cancer awareness	http://www.commercialappeal.com/news/2014/mar/11/giant-colon-inflates-in-east-memphis-for-cancer/	Memphis Commercial Appeal	m	dCAlr6DjfkFfL6MoIPGTT8vmavAyM	www.commercialappeal.com	1394722248508
12064	Cancer Coalition helping thousands get colon screenings	http://www.walb.com/story/24947766/cancer-coalition-helping-thousands-get-colon-screenings	WALB-TV	m	dCAlr6DjfkFfL6MoIPGTT8vmavAyM	www.walb.com	1394722248676
12065	Baylor Seeks Volunteers in Need of Colonoscopies	http://www.newswise.com/articles/baylor-seeks-volunteers-in-need-of-colonoscopies	Newswise \(press release\)	m	dCAlr6DjfkFfL6MoIPGTT8vmavAyM	www.newswise.com	1394722248835
12066	March Marks Colorectal Awareness Month	http://www.kmot.com/story/24946564/march-marks-colorectal-awareness-month	KMOT	m	dCAlr6DjfkFfL6MoIPGTT8vmavAyM	www.kmot.com	1394722249187
12067	Colon Cancer Screenings	http://independent.com/events/2014/mar/23/33983/	Santa Barbara Independent	m	dCAlr6DjfkFfL6MoIPGTT8vmavAyM	independent.com	1394722249346
12068	Colon exhibit rescheduled for March 20 at Paducah hospital	http://www.kfvs12.com/story/24946174/colon-exhibit-rescheduled-for-march-20-at-paducah-hospital	KFVS	m	dCAlr6DjfkFfL6MoIPGTT8vmavAyM	www.kfvs12.com	1394722249514
12069	Don't ignore colon cancer dangers	http://www.standard.net/stories/2014/03/11/dont-ignore-colon-cancer-dangers	Standard-Examiner	m	dCAlr6DjfkFfL6MoIPGTT8vmavAyM	www.standard.net	1394722249758
12070	Enger Tower is going blue for 'Building Blue Bridges' for colorectal (colon) cancer	http://www.northlandsnewscenter.com/news/local/Enger-Tower-is-going-blue-for-Building-Blue-Bridges-for-colorectal-colon-cancer-249521011.html	Northland's NewsCenter	m	dCAlr6DjfkFfL6MoIPGTT8vmavAyM	www.northlandsnewscenter.com	1394722250227
12071	March is National Colorectal Cancer Awareness Month	http://www.brownwoodtx.com/news/community/article_029f4c0e-a94d-11e3-a915-001a4bcf887a.html	Brownwood Bulletin	m	dCAlr6DjfkFfL6MoIPGTT8vmavAyM	www.brownwoodtx.com	1394722250378
12072	Lake Regional offers free test kits during Colorectal Cancer Awareness Month	http://lakeexpo.com/news/lake_news/article_63b90bc6-a94b-11e3-9fd5-001a4bcf887a.html	Lake Expo	m	dCAlr6DjfkFfL6MoIPGTT8vmavAyM	lakeexpo.com	1394722250563
12073	Let symptoms – not age – influence treatment	http://scopeblog.stanford.edu/2014/03/11/let-symptoms-not-age-influence-treatment/	Scope \(blog\)	m	dCAlr6DjfkFfL6MoIPGTT8vmavAyM	scopeblog.stanford.edu	1394722250739
12074	Dearborn Co. has one of the highest colorectal cancer incidence rates in state	http://www.thedcregister.com/index.php\?option=com_content&amp;view=article&amp;id=13999:dearborn-co-has-one-of-the-highest-colorectal-cancer-incidence-rates-in-state&amp;catid=1:latest-news&amp;Itemid=44	Dearborn Country Register	m	dCAlr6DjfkFfL6MoIPGTT8vmavAyM	www.thedcregister.com	1394722250941
12075	2014 Colorectal Cancer Awareness Month	http://www.wfmd.com/pages/localnews2.html\?feed=119935&amp;article=12144115	WFMD	m	dCAlr6DjfkFfL6MoIPGTT8vmavAyM	www.wfmd.com	1394722251325
12076	American Cancer Society Urges Increased Colon Cancer Screening to Save Lives	http://www.bremertonpatriot.com/news/249469811.html	Bremerton Patriot	m	dCAlr6DjfkFfL6MoIPGTT8vmavAyM	www.bremertonpatriot.com	1394722251493
12077	Early Detection Can Be Key To Treatment Of Colorectal Cancer, Local Doctor Says	http://www.stegenherald.com/community/article_e699bc8c-a92f-11e3-bf3b-001a4bcf887a.html	Ste. Genevieve Herald	m	dCAlr6DjfkFfL6MoIPGTT8vmavAyM	www.stegenherald.com	1394722251662
12078	American Cancer Society urges increased colon cancer screening	http://columbustelegram.com/banner-press/news/american-cancer-society-urges-increased-colon-cancer-screening/article_2fbcdefc-eb37-56b6-90a1-112668000281.html	Columbus Telegram	m	dCAlr6DjfkFfL6MoIPGTT8vmavAyM	columbustelegram.com	1394722251931
12079	Family Health Matters: National Colorectal Cancer Awareness Month: Know the  ...	http://www.tcpalm.com/news/2014/mar/11/family-health-matters-national-colorectal-cancer-a/	TCPalm	m	dCAlr6DjfkFfL6MoIPGTT8vmavAyM	www.tcpalm.com	1394722252316
12080	Exercise is secret weapon against cancer	http://em.gmnews.com/news/2014-03-13/Columns/Exercise_is_secret_weapon_against_cancer.html	Edison Sentinel	m	dCAlr6DjfkFfL6MoIPGTT8vmavAyM	em.gmnews.com	1394722252510
12081	University Hospitals: Screenings Save Pledge	http://fox8.com/2014/03/11/university-hospitals-screenings-save-pledge/	fox8.com	m	dCAlr6DjfkFfL6MoIPGTT8vmavAyM	fox8.com	1394722252676
12082	GF man advocates for cancer screening	http://www.jamestownsun.com/content/gf-man-advocates-cancer-screening	Jamestown Sun	m	dCAlr6DjfkFfL6MoIPGTT8vmavAyM	www.jamestownsun.com	1394722252971
12083	March is Colorectal Cancer Awareness Month	http://www.wtvm.com/story/24938962/march-is-colorectal-cancer-awareness-month	WTVM	m	dCAlr6DjfkFfL6MoIPGTT8vmavAyM	www.wtvm.com	1394722253156
12084	Giant inflatable colon on display at Metro Detroit hospital for cancer awareness	http://www.mlive.com/news/detroit/index.ssf/2014/03/giant_inflatable_colon_on_disp.html	MLive.com	m	dCAlr6DjfkFfL6MoIPGTT8vmavAyM	www.mlive.com	1394722253391
12085	Dress in Blue on Friday for colon cancer awareness	http://www.11alive.com/story/news/local/2014/03/10/2011374/	WXIA-TV	m	dCAlr6DjfkFfL6MoIPGTT8vmavAyM	www.11alive.com	1394722253701
12086	Get screened, Humboldt March is National Colorectal Cancer Awareness Month	http://www.tricityweekly.com/communitynews/ci_25317450/get-screened-humboldt-march-is-national-colorectal-cancer	Tri-City Weekly	m	dCAlr6DjfkFfL6MoIPGTT8vmavAyM	www.tricityweekly.com	1394722253851
12087	SCCA experts develop helpful tool to simplify colon cancer prevention  ...	http://www.news-medical.net/news/20140311/SCCA-experts-develop-helpful-tool-to-simplify-colon-cancer-prevention-screening-guidelines.aspx	News-Medical.net	m	dCAlr6DjfkFfL6MoIPGTT8vmavAyM	www.news-medical.net	1394722254011
12088	Colon cancer prevention efforts expanding in SC	http://insurancenewsnet.com/oarticle/2014/03/11/colon-cancer-prevention-efforts-expanding-in-sc-a-472213.html	Insurance News Net \(press release\)	m	dCAlr6DjfkFfL6MoIPGTT8vmavAyM	insurancenewsnet.com	1394722254204
12089	Hospital, hockey leagues push cancer testing	http://www.thesudburystar.com/2014/03/10/hospital-hockey-leagues-push-cancer-testing	The Sudbury Star	m	dCAlr6DjfkFfL6MoIPGTT8vmavAyM	www.thesudburystar.com	1394722254498
12090	Motel mix up may have led to theft	http://www.walb.com/story/24937410/motel-mixup-may-have-led-to-theft	WALB-TV	m	dCAlr6DjfkFfL6MoIPGTT8vmavAyM	www.walb.com	1394722254841
12091	Colonoscopy can prevent Colorectal cancer	http://www.walb.com/story/24936903/colonoscopy-can-prevent-colo	WALB-TV	m	dCAlr6DjfkFfL6MoIPGTT8vmavAyM	www.walb.com	1394722255018
12092	UCLA Offers Tips to Lower the Risk of Colorectal Cancer	http://www.endonurse.com/news/2014/03/ucla-offers-tips-to-lower-the-risk-of-colorectal.aspx	EndoNurse	m	dCAlr6DjfkFfL6MoIPGTT8vmavAyM	www.endonurse.com	1394722255303
12093	03/10 Cochran show hour three: Colon cancer awareness with Dr. Kevin Most  ...	http://wgnradio.com/2014/03/10/0310-cochran-show-hour-three-colon-cancer-awareness-with-dr-kevin-most-survivor-tom-grell/	WGN Radio	m	dCAlr6DjfkFfL6MoIPGTT8vmavAyM	wgnradio.com	1394722255513
12094	Screening Can Prevent More Than 90 Percent of Colon Cancer Cases. So Why  ...	http://www.newswise.com/articles/screening-can-prevent-more-than-90-percent-of-colon-cancer-cases-so-why-are-only-63-percent-of-americans-having-colonoscopies	Newswise \(press release\)	m	dCAlr6DjfkFfL6MoIPGTT8vmavAyM	www.newswise.com	1394722255756
12095	Learn the importance of colonoscopies at NCH Medical Group's free seminar	http://www.chicagotribune.com/news/local/suburbs/arlington_heights/community/chi-ugc-article-learn-the-importance-of-colonoscopies-at-nch-2014-03-10,0,6042288.story	Chicago Tribune	m	dCAlr6DjfkFfL6MoIPGTT8vmavAyM	www.chicagotribune.com	1394722255924
12096	Drowned teenager identified	http://www.walb.com/story/24930992/teenager-drowns-while-fishing	WALB-TV	m	dCAlr6DjfkFfL6MoIPGTT8vmavAyM	www.walb.com	1394722256135
12097	Colon cancer survivor highlights importance of screenings	http://www.news8000.com/news/colon-cancer-survivor-highlights-importance-of-screenings/24889808	WKBT La Crosse	m	dCAlr6DjfkFfL6MoIPGTT8vmavAyM	www.news8000.com	1394722256387
12098	FDA proposes overhaul of nutrition facts labeling	http://www.lexology.com/library/detail.aspx\?g=a8bde955-b3d3-4ed4-b163-74114bd9b38a	Lexology \(registration\)	m	d1xVObAg0VYDETMJQ0tDfcaHGzj9M	www.lexology.com	1394722334984
12099	FDA to Change Food Labels for First Time in 20 Years	http://www.foodworldnews.com/articles/5406/20140313/fda-change-food-labels-first-time-20-years-american-diet.htm	Food World News	m	d1xVObAg0VYDETMJQ0tDfcaHGzj9M	www.foodworldnews.com	1394722335158
12100	FDA Feels Need of Changing Food Labels	http://topnews.net.nz/content/232612-fda-feels-need-changing-food-labels	TopNews New Zealand	m	d1xVObAg0VYDETMJQ0tDfcaHGzj9M	topnews.net.nz	1394722335602
