264001	Malaysia Airlines Missing Plane: Searchers Complete Underwater Mission In  ...	http://www.huffingtonpost.com/2014/05/29/malaysia-airlines-missing-plane-search_n_5408474.html	Huffington Post	b	d4TYDTjL_fICshM9X6RHSiRf9kzqM	www.huffingtonpost.com	1401355578878
264002	US Navy reveals acoustic pings did not come from MH 370's black boxes	http://freepressjournal.in/us-navy-reveals-acoustic-pings-did-not-come-from-mh-370s-black-boxes/	Free Press Journal	b	d4TYDTjL_fICshM9X6RHSiRf9kzqM	freepressjournal.in	1401355579253
264003	Search area for MH370 can now be 'discounted'	http://www.kcra.com/national/search-area-for-mh370-complete-can-now-be-discounted/26221220	KCRA Sacramento	b	d4TYDTjL_fICshM9X6RHSiRf9kzqM	www.kcra.com	1401355579562
264004	No plane wreckage found where 'pings' were heard	http://www.rte.ie/news/2014/0529/620314-malaysia-airlines-missing-plane/	RTE.ie	b	d4TYDTjL_fICshM9X6RHSiRf9kzqM	www.rte.ie	1401355579930
264005	Missing Plane MH370: Aircraft did not Crash in Ocean Area where Pings were  ...	http://www.ibtimes.co.in/missing-plane-mh370-aircraft-did-not-crash-ocean-area-where-pings-were-detected-says-search-team-601199	International Business Times, India Edition	b	d4TYDTjL_fICshM9X6RHSiRf9kzqM	www.ibtimes.co.in	1401355580217
264006	'Pings driving missing plane hunt not likely from black box'	http://freepressjournal.in/pings-driving-missing-plane-hunt-not-likely-from-black-box/	Free Press Journal	b	d4TYDTjL_fICshM9X6RHSiRf9kzqM	freepressjournal.in	1401355580450
264007	Shocker: 'Pings driving missing Malaysia Airlines plane hunt not likely from black  ...	http://www.financialexpress.com/news/shocker-pings-driving-missing-malaysia-airlines-plane-hunt-not-likely-from-black-box/1255370	Financial Express	b	d4TYDTjL_fICshM9X6RHSiRf9kzqM	www.financialexpress.com	1401355580928
264008	Pings driving MH370 hunt not likely from black box	http://www.saharasamay.com/world-news/676554051/pings-driving-missing-plane-hunt-not-likely-from-black-box-.html	Sahara Samay	b	d4TYDTjL_fICshM9X6RHSiRf9kzqM	www.saharasamay.com	1401355581312
264009	Australia says missing Malaysia plane not where 'pings' were heard	http://www.gmanetwork.com/news/story/363157/news/world/australia-says-missing-malaysia-plane-not-where-pings-were-heard	GMA News	b	d4TYDTjL_fICshM9X6RHSiRf9kzqM	www.gmanetwork.com	1401355581548
264010	Missing MH370 not where 'pings' heard	http://gulftoday.ae/portal/e9d886a9-ee3d-4218-bf38-bbfe4c6efc20.aspx	Gulf Today	b	d4TYDTjL_fICshM9X6RHSiRf9kzqM	gulftoday.ae	1401355581795
264011	(Flight MH370) Searchers confirm missing plane not into targetted area	http://www.thestandard.com.hk/breaking_news_detail.asp\?id=50012&amp;icid=4&amp;d_str=	Hong Kong Standard	b	d4TYDTjL_fICshM9X6RHSiRf9kzqM	www.thestandard.com.hk	1401355582023
264012	US navy official: underwater pings not from MH370 black boxes	http://www.theguardian.com/world/2014/may/29/acoustic-pings-no-longer-thought-related-to-mh370	The Guardian	b	d4TYDTjL_fICshM9X6RHSiRf9kzqM	www.theguardian.com	1401355582383
264013	Ocean area where pings detected not MH370 crash zone: JACC	http://news.malaysia.msn.com/business/ocean-area-where-pings-detected-not-mh370-crash-zone-jacc-7	MSN Malaysia News	b	d4TYDTjL_fICshM9X6RHSiRf9kzqM	news.malaysia.msn.com	1401355582580
264014	Answers to key questions on the MH370 mystery	http://news.malaysia.msn.com/tmi/answers-to-key-questions-on-the-mh370-mystery	MSN Malaysia News	b	d4TYDTjL_fICshM9X6RHSiRf9kzqM	news.malaysia.msn.com	1401355582757
264015	Malaysia Airlines Flight MH370: US Navy Considers Report Claiming Radar  ...	http://www.ibtimes.com/malaysia-airlines-flight-mh370-us-navy-considers-report-claiming-radar-pings-may-not-be-1591709	International Business Times	b	d4TYDTjL_fICshM9X6RHSiRf9kzqM	www.ibtimes.com	1401355582942
264016	AP Top News at 1:47 a.m. EDT	http://insurancenewsnet.com/oarticle/2014/05/29/ap-top-news-at-147-am-edt-a-510484.html	Insurance News Net	b	d4TYDTjL_fICshM9X6RHSiRf9kzqM	insurancenewsnet.com	1401355583152
264017	US Navy denies jet 'pings' claim	http://news.uk.msn.com/us-navy-denies-jet-pings-claim-1	MSN UK	b	d4TYDTjL_fICshM9X6RHSiRf9kzqM	news.uk.msn.com	1401355583493
264018	Microsoft reveals Skype Translate: a real time voice interpreter	http://memeburn.com/2014/05/microsoft-reveals-skype-translate-a-multilingual-voice-interpreter/	Memeburn	t	dO0hB6VEfATYqCMIMu0J9n9uyD2sM	memeburn.com	1401356476580
264019	Microsoft unveils Skype Translator to break down language barriers	http://www.gizmag.com/microsoft-skype-translator-language/32304/	Gizmag	t	dO0hB6VEfATYqCMIMu0J9n9uyD2sM	www.gizmag.com	1401356476896
264020	Microsoft's Skype Translator removes language barrier in video chats	http://www.penki.lt/IT-News/Microsofts-Skype-Translator-removes-lang.im\?id=345631	penki.lt	t	dO0hB6VEfATYqCMIMu0J9n9uyD2sM	www.penki.lt	1401356477253
264021	Skype to Get Real-Time Translator by Year-End	http://profit.ndtv.com/news/corporates/article-skype-to-get-real-time-translator-by-year-end-389818	NDTV	t	dO0hB6VEfATYqCMIMu0J9n9uyD2sM	profit.ndtv.com	1401356477619
264022	Satya Nadella reveals new vision for Microsoft at Code Conference	http://daily.bhaskar.com/article/GAD-from-skype-translator-to-xbox-check-out-microsoft-s-new-vision-under-satya-nadel-4629391-NOR.html	Daily Bhaskar	t	dO0hB6VEfATYqCMIMu0J9n9uyD2sM	daily.bhaskar.com	1401356477952
264023	Microsoft shows off real-time translator	http://usa.chinadaily.com.cn/world/2014-05/29/content_17550705.htm	Chinadaily USA	t	dO0hB6VEfATYqCMIMu0J9n9uyD2sM	usa.chinadaily.com.cn	1401356478196
264024	From Skype Translator to Xbox: Check out Microsoft's new vision under Satya  ...	http://daily.bhaskar.com/article-hf/GAD-from-skype-translator-to-xbox-check-out-microsoft-s-new-vision-under-satya-nadel-4629391-NOR.html	Daily Bhaskar	t	dO0hB6VEfATYqCMIMu0J9n9uyD2sM	daily.bhaskar.com	1401356478434
264025	Soon, Skype to translate multi-lingual voice calls in 'near real-time': Report	http://www.business-standard.com/article/news-ani/soon-skype-to-translate-multi-lingual-voice-calls-in-near-real-time-report-114052900872_1.html	Business Standard	t	dO0hB6VEfATYqCMIMu0J9n9uyD2sM	www.business-standard.com	1401356478692
264026	Skype to get 'real-time' translator by year end	http://www.business-standard.com/article/current-affairs/skype-to-get-real-time-translator-by-year-end-114052900850_1.html	Business Standard	t	dO0hB6VEfATYqCMIMu0J9n9uyD2sM	www.business-standard.com	1401356479014
264027	Microsoft's 'Star Trek' voice translator available before the end 2014	http://hereisthecity.com/en-gb/2014/05/29/microsofts-star-trek-voice-translator-available-before-the-end-2/	HITC	t	dO0hB6VEfATYqCMIMu0J9n9uyD2sM	hereisthecity.com	1401356479271
264028	Skype Will Bring Real Time Translations While You Chat!	http://www.thebitbag.com/skype-will-bring-real-time-translations-while-you-chat/77838	Bitbag	t	dO0hB6VEfATYqCMIMu0J9n9uyD2sM	www.thebitbag.com	1401356479527
264029	Microsoft claims breakthrough in real-time translationPublish Date: May 29, 2014	http://www.newvision.co.ug/news/656074-microsoft-claims-breakthrough-in-real-time-translation.html	New Vision	t	dO0hB6VEfATYqCMIMu0J9n9uyD2sM	www.newvision.co.ug	1401356479870
264030	Microsoft Unveils Real-Time Skype Universal Translator	http://www.toptechnews.com/article/index.php\?story_id=131009VI9B60	Top Tech News	t	dO0hB6VEfATYqCMIMu0J9n9uyD2sM	www.toptechnews.com	1401356480090
264031	MICROSOFT/WINDOWS Microsoft Unveils Real-Time Skype Universal Translator	http://www.toptechnews.com/article/index.php\?story_id=13100A8I80NC	Top Tech News	t	dO0hB6VEfATYqCMIMu0J9n9uyD2sM	www.toptechnews.com	1401356480342
264032	Microsoft's Real-Time Skype Translator To Be Available Before 2015	http://www.crazyengineers.com/threads/microsofts-real-time-skype-translator-to-be-available-before-2015.75007/	CrazyEngineers	t	dO0hB6VEfATYqCMIMu0J9n9uyD2sM	www.crazyengineers.com	1401356480679
264033	Microsoft shows off Skype translator Lookout 'thefties' nab selfies of smartphone	http://www.arabtimesonline.com/NewsDetails/tabid/96/smid/414/ArticleID/206440/reftab/73/t/Microsoft-shows-off-Skype-translator/Default.aspx	Arab Times Kuwait English Daily	t	dO0hB6VEfATYqCMIMu0J9n9uyD2sM	www.arabtimesonline.com	1401356480906
264034	Skype Translator Means Never Having To Learn Another Language Again	http://www.huffingtonpost.com/2014/05/28/microsoft-skype-translator_n_5405904.html	Huffington Post	t	dO0hB6VEfATYqCMIMu0J9n9uyD2sM	www.huffingtonpost.com	1401356481166
264035	Microsoft: Multilingual translation beta Skype will be released later this year	http://phillysportsreport.com/technology-22/microsoft-multilingual-translation-beta-skype-will-be-released-later-this-year-213.html	Philly Sports Report	t	dO0hB6VEfATYqCMIMu0J9n9uyD2sM	phillysportsreport.com	1401356481500
264036	Microsoft demos real-time Skype language Translator tool, beta coming this year	http://www.pcworld.in/news/microsoft-demos-real-time-skype-language-translator-tool-beta-coming-year	PC World India	t	dO0hB6VEfATYqCMIMu0J9n9uyD2sM	www.pcworld.in	1401356481829
264037	Nadella talks about Bing, Xbox and Microsoft future at first CODE conference	http://tech.firstpost.com/news-analysis/nadella-talks-about-bing-xbox-and-microsoft-future-at-first-code-conference-224576.html\?utm_source=top_stories	Firstpost	t	dO0hB6VEfATYqCMIMu0J9n9uyD2sM	tech.firstpost.com	1401356482032
264038	Microsoft's real-time Skype language translator could be its first real  ...	http://theweek.com/article/index/262312/microsofts-real-time-skype-language-translator-could-be-its-first-real-breakthrough-in-a-decade	The Week Magazine	t	dO0hB6VEfATYqCMIMu0J9n9uyD2sM	theweek.com	1401356482303
264039	Microsoft's new Skype Translator eliminates language barriers	http://indianexpress.com/article/technology/technology-others/microsofts-new-skype-translator-eliminates-language-barriers/	Indian Express	t	dO0hB6VEfATYqCMIMu0J9n9uyD2sM	indianexpress.com	1401356482572
264040	Microsoft Shows Skype Translator App With Real-Time Speech Translation	http://www.gizbot.com/apps-software/microsoft-shows-skype-translator-app-with-real-time-speech-translation-news-017443.html	Gizbot	t	dO0hB6VEfATYqCMIMu0J9n9uyD2sM	www.gizbot.com	1401356483043
264041	Star Trek's universal translator is here	http://www.bdlive.co.za/world/americas/2014/05/29/star-treks-universal-translator-is-here	BDlive	t	dO0hB6VEfATYqCMIMu0J9n9uyD2sM	www.bdlive.co.za	1401356483318
264042	Microsoft-Skype to launch Star Trek like translator	https://www.mywealth.commbank.com.au/companies/microsoft-skype-translator-to-launch-by-year-end-news20140529	CommBank MyWealth	t	dO0hB6VEfATYqCMIMu0J9n9uyD2sM	www.mywealth.commbank.com.au	1401356483813
264043	Microsoft Previews Skype Real-Time Translation Tech	http://www.eweek.com/cloud/microsoft-previews-skype-real-time-translation-tech.html	eWeek	t	dO0hB6VEfATYqCMIMu0J9n9uyD2sM	www.eweek.com	1401356484068
264044	Microsoft Corporation's Satya Nadella shows off real-time translator for Skype	http://www.financialexpress.com/news/microsoft-shows-off-realtime-translator-for-skype/1255325	Financial Express	t	dO0hB6VEfATYqCMIMu0J9n9uyD2sM	www.financialexpress.com	1401356484299
264045	Microsoft's Nadella: We're In 'Post-Post' PC Era	http://www.informationweek.com/messages.asp\?piddl_msgthreadid=13773&amp;piddl_msgid=220144&amp;piddl_msgtocontent=yes	InformationWeek	t	dO0hB6VEfATYqCMIMu0J9n9uyD2sM	www.informationweek.com	1401356484931
264046	Microsoft CEO: We are keeping Bing, Xbox	http://www.afterdawn.com/news/article.cfm/2014/05/29/microsoft_ceo_we_are_keeping_bing_xbox	Afterdawn.com	t	dO0hB6VEfATYqCMIMu0J9n9uyD2sM	www.afterdawn.com	1401356485192
264047	MS shows off Skype translator	http://www.asianage.com/technology/ms-shows-skype-translator-182	The Asian Age	t	dO0hB6VEfATYqCMIMu0J9n9uyD2sM	www.asianage.com	1401356485423
264048	Microsoft shows off real-time Skype translator	http://www.dawn.com/news/1109249/microsoft-shows-off-real-time-skype-translator	DAWN.com	t	dO0hB6VEfATYqCMIMu0J9n9uyD2sM	www.dawn.com	1401356485741
264049	Skype translator	http://www.independent.ie/business/world/skype-translator-30312894.html	Irish Independent	t	dO0hB6VEfATYqCMIMu0J9n9uyD2sM	www.independent.ie	1401356486015
264050	Microsoft adding real-time cross-language voice translation capabilities to Skype	http://www.smartcompany.com.au/technology/42166-microsoft-adding-real-time-cross-language-voice-translation-capabilities-to-skype.html	SmartCompany.com.au	t	dO0hB6VEfATYqCMIMu0J9n9uyD2sM	www.smartcompany.com.au	1401356486265
264051	Microsoft and Skype have built a universal translator	http://pulse2.com/2014/05/28/microsoft-and-skype-have-built-a-universal-translator-109479/	Pulse 2.0	t	dO0hB6VEfATYqCMIMu0J9n9uyD2sM	pulse2.com	1401356486517
264052	Microsoft to launch real-time translation for Skype by year end	http://www.omantribune.com/index.php\?page=news&amp;id=168576&amp;heading=Business	Oman Tribune	t	dO0hB6VEfATYqCMIMu0J9n9uyD2sM	www.omantribune.com	1401356486901
264053	Skype Now Comes with Real-time Translation	http://www.indiatimes.com/technology/internet/skype-now-comes-with-realtime-translation-151213.html	Indiatimes.com	t	dO0hB6VEfATYqCMIMu0J9n9uyD2sM	www.indiatimes.com	1401356487302
264054	Microsoft Demonstrates Real-Time Speech Translation for Skype	http://atlantablackstar.com/2014/05/28/new-skype-will-real-time-speech-translation/	Atlanta Black Star	t	dO0hB6VEfATYqCMIMu0J9n9uyD2sM	atlantablackstar.com	1401356487601
264055	Microsoft develops 'universal translator'	http://www.3news.co.nz/Microsoft-develops-universal-translator/tabid/412/articleID/346294/Default.aspx	3News NZ	t	dO0hB6VEfATYqCMIMu0J9n9uyD2sM	www.3news.co.nz	1401356487817
264056	Microsoft Demos Live Voice Translation In Skype, Coming First To Windows 8  ...	http://www.androidpolice.com/2014/05/28/microsoft-demos-live-voice-translation-in-skype-coming-first-to-windows-8/	Android Police	t	dO0hB6VEfATYqCMIMu0J9n9uyD2sM	www.androidpolice.com	1401356488093
264057	Skype's Star Trek-like universal translator is amazing whether it works or not	http://www.smh.com.au/digital-life/digital-life-news/skypes-star-treklike-universal-translator-is-amazing-whether-it-works-or-not-20140528-zrrco.html	Sydney Morning Herald	t	dO0hB6VEfATYqCMIMu0J9n9uyD2sM	www.smh.com.au	1401356488446
264058	Microsoft's Futuristic New Tool Translates Skype Calls in Real Time	http://www.wired.com/2014/05/microsoft-skype-translate/	Wired	t	dO0hB6VEfATYqCMIMu0J9n9uyD2sM	www.wired.com	1401356488712
264059	Skype to Get Real-Time Speech Translation by End of 2014	http://www.techlicious.com/blog/microsoft-skype-translate-real-time/	Techlicious \(blog\)	t	dO0hB6VEfATYqCMIMu0J9n9uyD2sM	www.techlicious.com	1401356488993
264060	Microsoft showcases real-time Skype Language Translator	http://phillysportsreport.com/technology-22/microsoft-showcases-real-time-skype-language-translator-181.html	Philly Sports Report	t	dO0hB6VEfATYqCMIMu0J9n9uyD2sM	phillysportsreport.com	1401356489246
264061	Skype to break language barriers with translator tool	http://www.ketknbc.com/news/skype-to-break-language-barriers-with-translator-t-0	KETK	t	dO0hB6VEfATYqCMIMu0J9n9uyD2sM	www.ketknbc.com	1401356489525
264062	Microsoft CEO unveils Skype Translation	http://www.stuff.co.nz/southland-times/technology/60081683/Microsoft-CEO-unveils-Skype-Translation	The Southland Times	t	dO0hB6VEfATYqCMIMu0J9n9uyD2sM	www.stuff.co.nz	1401356489798
264063	Can Skype Translator Bust the Language Barrier?	http://www.cmswire.com/cms/social-business/can-skype-translator-bust-the-language-barrier-025347.php	CMSWire	t	dO0hB6VEfATYqCMIMu0J9n9uyD2sM	www.cmswire.com	1401356490036
264064	Skype Will Translate Multilingual Conversations by Next Year	http://spectrum.ieee.org/tech-talk/computing/software/skype-will-translate-multilingual-conversations-by-next-year	IEEE Spectrum	t	dO0hB6VEfATYqCMIMu0J9n9uyD2sM	spectrum.ieee.org	1401356490311
264065	Microsoft's Nadella Talks 'Post-Post-PC Era'	http://forwardthinking.pcmag.com/none/324023-microsoft-s-nadella-talks-post-post-pc-era	PC Magazine	t	dO0hB6VEfATYqCMIMu0J9n9uyD2sM	forwardthinking.pcmag.com	1401356490602
264066	Microsoft making Skype live-translation tool	http://www.nydailynews.com/news/national/project-development-skype-beta-release-expected-2014-starting-exchanges-german-english-article-1.1808941	New York Daily News	t	dO0hB6VEfATYqCMIMu0J9n9uyD2sM	www.nydailynews.com	1401356490859
264067	Skype Translator breaks language barrier	http://www.kgns.tv/news/national/headlines/Skype-Translator-breaks-language-barrier-260994981.html	KGNS.tv	t	dO0hB6VEfATYqCMIMu0J9n9uyD2sM	www.kgns.tv	1401356491307
264068	Microsoft CEO Satya Nadella has no plans to change Xbox business	http://www.gamedynamo.com/article/showarticle/7893/en/microsoft_ceo_satya_nadella_has_no_plans_to_change_xbox_business	GameDynamo	t	dO0hB6VEfATYqCMIMu0J9n9uyD2sM	www.gamedynamo.com	1401356491570
264069	Skype to feature real-time language translator in next major update	http://www.thewestsidestory.net/2014/05/28/11531/skype-feature-real-time-language-translator-next-major-update/	The Westside Story	t	dO0hB6VEfATYqCMIMu0J9n9uyD2sM	www.thewestsidestory.net	1401356491796
264070	Skype demos live voice translations, coming to Windows 8 this year	http://news.en.softonic.com/skype-live-voice-translation-tool	Softonic EN	t	dO0hB6VEfATYqCMIMu0J9n9uyD2sM	news.en.softonic.com	1401356492050
264071	Microsoft's Skype Universal Speech Translator Looks Like the Next Best Thing to  ...	http://www.geekosystem.com/microsoft-skype-translator/	Geekosystem	t	dO0hB6VEfATYqCMIMu0J9n9uyD2sM	www.geekosystem.com	1401356492290
264072	Microsoft demonstrates Skype translator	http://www.itwire.com/business-it-news/business-technology/64249-microsoft-demonstrates-skype-translator	iTWire	t	dO0hB6VEfATYqCMIMu0J9n9uyD2sM	www.itwire.com	1401356492619
264073	Skype breaks the language barrier	http://www.thetimes.co.uk/tto/technology/internet/article4102776.ece\?CMP=OTH-gnws-standard-2014_05_28	The Times \(subscription\)	t	dO0hB6VEfATYqCMIMu0J9n9uyD2sM	www.thetimes.co.uk	1401356492862
264074	Game Over: Skype Translates Language in Real Time	http://www.geeksugar.com/Skype-Translator-34870730	GeekSugar.com	t	dO0hB6VEfATYqCMIMu0J9n9uyD2sM	www.geeksugar.com	1401356493087
264075	Microsoft launches new voice translator	http://www.sbs.com.au/news/article/2014/05/29/microsoft-launches-new-voice-translator	SBS	t	dO0hB6VEfATYqCMIMu0J9n9uyD2sM	www.sbs.com.au	1401356493523
264076	Nadella Previews Skype Translation Technology for Windows	http://rcpmag.com/articles/2014/05/28/nadella-previews-skype-translation.aspx	Redmond Channel Partner	t	dO0hB6VEfATYqCMIMu0J9n9uyD2sM	rcpmag.com	1401356493790
264077	Microsoft shows off real-time Skype translator (VIDEO)	http://www.themalaymailonline.com/tech-gadgets/article/microsoft-shows-off-real-time-skype-translator	The Malay Mail Online	t	dO0hB6VEfATYqCMIMu0J9n9uyD2sM	www.themalaymailonline.com	1401356494053
264078	Skype "Real-Time" Translator Unveiled	http://en.kioskea.net/news/24947-skype-real-time-translator-unveiled	Kioskea	t	dO0hB6VEfATYqCMIMu0J9n9uyD2sM	en.kioskea.net	1401356494375
264079	Microsoft says Skype will soon translate "on the fly"	http://www.consumeraffairs.com/news/microsoft-says-skype-will-soon-translate-on-the-fly-052814.html	ConsumerAffairs	t	dO0hB6VEfATYqCMIMu0J9n9uyD2sM	www.consumeraffairs.com	1401356494611
264080	Microsoft shows off real-time translator for Skype	http://indianexpress.com/article/business/business-others/microsoft-shows-off-real-time-translator-for-skype/	Indian Express	t	dO0hB6VEfATYqCMIMu0J9n9uyD2sM	indianexpress.com	1401356494837
264081	A major mystery behind Microsoft's 'brain-like' speech-to-speech translator	http://www.networkworld.com/news/2014/052814-microsoft-brain-281981.html	Network World	t	dO0hB6VEfATYqCMIMu0J9n9uyD2sM	www.networkworld.com	1401356495076
264082	Microsoft Demos Skype Translator	http://www.overclockersclub.com/news/36298/	Overclockers Club	t	dO0hB6VEfATYqCMIMu0J9n9uyD2sM	www.overclockersclub.com	1401356495591
264083	Skype unveils 'universal translator'	http://www.news.com.au/technology/microsoft-unveils-skype-translator-service-it-compares-to-star-treks-universal-translator/story-e6frfrnr-1226935267092	NEWS.com.au	t	dO0hB6VEfATYqCMIMu0J9n9uyD2sM	www.news.com.au	1401356495800
264084	Speech-To-Speech Translation Technology to be launched with Skype	http://www.pcquest.com/pcquest/news/215273/speech-to-speech-translation-technology-launched-skype	PCQuest	t	dO0hB6VEfATYqCMIMu0J9n9uyD2sM	www.pcquest.com	1401356496051
264085	Microsoft show off Skype Translator, a real-time translation tool	http://www.taunews.com/microsoft-show-off-skype-translator-a-real-time-translation-tool-96.html	TauNews.com	t	dO0hB6VEfATYqCMIMu0J9n9uyD2sM	www.taunews.com	1401356496568
264086	Nadella touts new opportunities, unveils Skype translation	http://www.business-standard.com/article/international/nadella-touts-new-opportunities-unveils-skype-translation-114052801929_1.html	Business Standard	t	dO0hB6VEfATYqCMIMu0J9n9uyD2sM	www.business-standard.com	1401356496730
264087	Skype To Get Live Translation	http://www.geeksaresexy.net/2014/05/28/skype-to-get-live-translation/	Geeks are Sexy Technology News	t	dO0hB6VEfATYqCMIMu0J9n9uyD2sM	www.geeksaresexy.net	1401356496963
264088	Star Trek-Like Translator Arrives	http://www.trektoday.com/content/2014/05/star-trek-like-translator-arrives/	Trek Today	t	dO0hB6VEfATYqCMIMu0J9n9uyD2sM	www.trektoday.com	1401356497200
264089	Skype Is Getting Real-Time Translation Later This Year Language Barrier?	http://www.taunews.com/skype-is-getting-real-time-translation-later-this-year-language-barrier-89.html	TauNews.com	t	dO0hB6VEfATYqCMIMu0J9n9uyD2sM	www.taunews.com	1401356497610
264090	Skype's awesome real-time language translation feature demoed by Microsoft	http://www.canadianreviewer.com/cr/2014/5/28/skypes-awesome-real-time-language-translation-feature-demoed.html	Canadian Reviewer	t	dO0hB6VEfATYqCMIMu0J9n9uyD2sM	www.canadianreviewer.com	1401356497953
264091	With Skype real-time translator, Star Trek “isn't a galaxy away”	http://mindofthegeek.com/2014/05/28/with-skype-real-time-translator-star-trek-isnt-a-galaxy-away/	Mind Of The Geek	t	dO0hB6VEfATYqCMIMu0J9n9uyD2sM	mindofthegeek.com	1401356498216
264092	Microsoft CEO Willing To Partner With Yahoo, Not Sell	http://www.benzinga.com/news/14/05/4590146/microsoft-ceo-willing-to-partner-with-yahoo-not-sell	Benzinga	t	dO0hB6VEfATYqCMIMu0J9n9uyD2sM	www.benzinga.com	1401356498441
264093	Skype Translator to Break Down Geographic Business Barriers	http://windowsitpro.com/cloud/skype-translator-break-down-geographic-business-barriers	Windows IT Pro	t	dO0hB6VEfATYqCMIMu0J9n9uyD2sM	windowsitpro.com	1401356498656
264094	Skype's New Real-Time Language Translator Is Amazing Whether or Not It Works	http://www.slate.com/blogs/future_tense/2014/05/28/microsoft_s_skype_translator_will_do_multilingual_real_time_language_translation.html\?wpisrc=burger_bar	Slate Magazine \(blog\)	t	dO0hB6VEfATYqCMIMu0J9n9uyD2sM	www.slate.com	1401356498957
264095	Skype to get real-time translation soon	http://thenextdigit.com/7133/skype-real-time-translation-soon/	The Next Digit	t	dO0hB6VEfATYqCMIMu0J9n9uyD2sM	thenextdigit.com	1401356499361
264096	Getting closer: Microsoft unveils Skype Translator	http://www.thehindubusinessline.com/features/smartbuy/laptops/getting-closer-microsoft-unveils-skype-translator/article6058041.ece\?ref=wl_companies	Hindu Business Line	t	dO0hB6VEfATYqCMIMu0J9n9uyD2sM	www.thehindubusinessline.com	1401356499567
264097	Real-time 'Skype Translator' to debut this year	http://www.techienews.co.uk/9712616/real-time-skype-translator-to-debut-this-year/	Techie News	t	dO0hB6VEfATYqCMIMu0J9n9uyD2sM	www.techienews.co.uk	1401356499781
264098	Microsoft demos real-time language translation for Skype	http://www.techspot.com/news/56902-microsoft-demos-real-time-language-translation-for-skype.html	TechSpot	t	dO0hB6VEfATYqCMIMu0J9n9uyD2sM	www.techspot.com	1401356500216
264099	Microsoft debuts Skype real-time language translation	http://vator.tv/news/2014-05-28-microsoft-debuts-skype-real-time-language-translation	VatorNews	t	dO0hB6VEfATYqCMIMu0J9n9uyD2sM	vator.tv	1401356500447
264100	Microsoft's Skype Will Soon Be Able to Translate Voice Calls in Real Time	http://www.thewire.com/technology/2014/05/microsoft-offers-translation-in-real-time-for-skype/371721/	The Wire	t	dO0hB6VEfATYqCMIMu0J9n9uyD2sM	www.thewire.com	1401356500676
