51501	Wall Street dips after GDP data	http://www.iol.co.za/business/international/wall-street-dips-after-gdp-data-1.1667394	Independent Online	b	dP-1PpYiFy6Ez7MKCA5lxmjF9UfQM	www.iol.co.za	1395951072188
51502	US STOCKS-Wall St dips after GDP data, Citigroup shares tumble	http://in.reuters.com/article/2014/03/27/markets-usa-stocks-idINL1N0MO0S720140327	Reuters	b	dP-1PpYiFy6Ez7MKCA5lxmjF9UfQM	in.reuters.com	1395951072432
51503	C Stock Feels the Impact of Citigroup's Failed Stress Test	http://investorplace.com/2014/03/c-stock-feels-impact-citigroups-failed-stress-test/	Investorplace.com	b	dP-1PpYiFy6Ez7MKCA5lxmjF9UfQM	investorplace.com	1395951072626
51504	Why Citigroup (C) Is Falling Today	http://www.thestreet.com/story/12557161/1/why-citigroup-c-is-falling-today.html	TheStreet.com	b	dP-1PpYiFy6Ez7MKCA5lxmjF9UfQM	www.thestreet.com	1395951072816
51505	Fed Stress Tests: The Winners And Losers Of Proposed Capital Plans	http://www.trefis.com/stock/rbs/articles/232436/fed-stress-test-for-banks-the-winners-and-losers-of-proposed-capital-plans/2014-03-27	Trefis	b	dP-1PpYiFy6Ez7MKCA5lxmjF9UfQM	www.trefis.com	1395951073167
51506	Here's What Wall Street's Saying About the Fed's Capital Plan Reviews	http://www.thestreet.com/story/12557120/1/heres-what-wall-streets-saying-about-the-feds-capital-plan-reviews.html	TheStreet.com	b	dP-1PpYiFy6Ez7MKCA5lxmjF9UfQM	www.thestreet.com	1395951073400
51507	US stock indexes show little change in early trading	http://www.foxrio2.com/us-stock-indexes-show-little-change-in-early-trading/	Fox 2 KFXV	b	dP-1PpYiFy6Ez7MKCA5lxmjF9UfQM	www.foxrio2.com	1395951073707
51508	Cramer on Citi: 'They were very cocky'	http://www.cnbc.com/id/101530993	CNBC.com	b	dP-1PpYiFy6Ez7MKCA5lxmjF9UfQM	www.cnbc.com	1395951073950
51509	Five banks fail Fed stress test	http://www.thedeal.com/content/regulatory/five-banks-fail-fed-stress-test.php	The Deal Pipeline	b	dP-1PpYiFy6Ez7MKCA5lxmjF9UfQM	www.thedeal.com	1395951074358
51510	Tech stocks, Citigroup drag hold back market	http://www.postcrescent.com/viewart/20140327/APC03/303270254/Tech-stocks-Citigroup-drag-hold-back-market	Appleton Post Crescent	b	dP-1PpYiFy6Ez7MKCA5lxmjF9UfQM	www.postcrescent.com	1395951074578
51511	Why Most Investors Should Not Fear Higher Rates	http://money.usnews.com/money/blogs/the-smarter-mutual-fund-investor/2014/03/27/why-most-investors-should-not-fear-higher-rates	U.S. News \& World Report \(blog\)	b	dP-1PpYiFy6Ez7MKCA5lxmjF9UfQM	money.usnews.com	1395951074855
51512	The Fed Takes Citigroup Down, Lifts Bank of America	http://www.fool.com/investing/general/2014/03/27/the-fed-takes-citigroup-down-lifts-bank-of-america.aspx	Motley Fool	b	dP-1PpYiFy6Ez7MKCA5lxmjF9UfQM	www.fool.com	1395951075187
51513	Fed Retreat From Mortgages Nears Tipping Point	http://www.moneynews.com/Personal-Finance/Fed-mortgages-Yellen-rate/2014/03/27/id/562069/	Moneynews	b	dP-1PpYiFy6Ez7MKCA5lxmjF9UfQM	www.moneynews.com	1395951075393
51514	Citigroup Inc. (C) Is Down Sharply After Fed Rejected Capital Plan	http://www.rttnews.com/2293391/citigroup-inc-c-is-down-sharply-after-fed-rejected-capital-plan.aspx\?type=sta	RTT News	b	dP-1PpYiFy6Ez7MKCA5lxmjF9UfQM	www.rttnews.com	1395951075576
51515	Fed Bars Shareholder Payouts From Citi, Four Others	http://invests.com/fed-bars-shareholder-payouts-from-citi-four-others/20140326550115068	Invests.com	b	dP-1PpYiFy6Ez7MKCA5lxmjF9UfQM	invests.com	1395951075761
51516	Fed's Retreat From Mortgages Approaching Tipping Point	http://www.bloomberg.com/news/2014-03-26/fed-retreat-from-mortgages-nears-tipping-point-credit-markets.html	Bloomberg	b	dP-1PpYiFy6Ez7MKCA5lxmjF9UfQM	www.bloomberg.com	1395951075954
51517	Citigroup Tumbles on Fed Rejection	http://www.zacks.com/stock/news/127840/citigroup-tumbles-on-fed-rejection	Zacks.com	b	dP-1PpYiFy6Ez7MKCA5lxmjF9UfQM	www.zacks.com	1395951076253
51518	The Third-Largest Bank Isn't Adequately Prepared For A Crisis	http://thinkprogress.org/economy/2014/03/27/3419581/citigroup-stress-test/	ThinkProgress	b	dP-1PpYiFy6Ez7MKCA5lxmjF9UfQM	thinkprogress.org	1395951076437
51519	Senate Joint Economic Committee Committee Hearing	http://insurancenewsnet.com/oarticle/2014/03/27/senate-joint-economic-committee-committee-hearing-a-480736.html	Insurance News Net \(press release\)	b	dP-1PpYiFy6Ez7MKCA5lxmjF9UfQM	insurancenewsnet.com	1395951076614
51520	Tech companies, Citigroup tug US stocks lower - Business, Government Legal  ...	http://www.statejournal.com/story/25088434/stock-futures-point-to-mixed-open-on-wall-street	State Journal	b	dP-1PpYiFy6Ez7MKCA5lxmjF9UfQM	www.statejournal.com	1395951076841
51521	Fed Scraps Citi's Share Repurchase and Dividend Plans After Stress Test	http://www.ibtimes.co.uk/fed-scraps-citis-share-repurchase-dividend-plans-after-stress-test-1442085	International Business Times UK	b	dP-1PpYiFy6Ez7MKCA5lxmjF9UfQM	www.ibtimes.co.uk	1395951077275
51522	Citigroup tumbles as lender fails Fed's 'stress test'	http://www.proactiveinvestors.com/companies/news/53027/citigroup-tumbles-as-lender-fails-feds-stress-test-53027.html	Proactive Investors USA \& Canada	b	dP-1PpYiFy6Ez7MKCA5lxmjF9UfQM	www.proactiveinvestors.com	1395951077580
51523	Stock futures point to mixed open for the US stock market; Citigroup slumps	http://www.newser.com/article/5ec521c269c3440c97a78fbc8f36d72a/stock-futures-point-to-mixed-open-for-the-us-stock-market-citigroup-slumps.html	Newser	b	dP-1PpYiFy6Ez7MKCA5lxmjF9UfQM	www.newser.com	1395951077790
51524	The Biggest Stock Market News Today, March 27, 2014	http://moneymorning.com/2014/03/27/biggest-stock-market-news-today-march-27-2014/	Money Morning	b	dP-1PpYiFy6Ez7MKCA5lxmjF9UfQM	moneymorning.com	1395951078209
51525	Stock Futures Turn Mixed; Winnebago Up, Citigroup Down C SAN	http://news.investors.com/investing-stock-market-today/032714-694816-stock-futures-point-to-mixed-open.htm	Investor's Business Daily	b	dP-1PpYiFy6Ez7MKCA5lxmjF9UfQM	news.investors.com	1395951078435
51526	Rejection of banks' capital plans cancels out improving unemployment data	http://marketintelligencecenter.com/articles/471018	Market Intelligence Center	b	dP-1PpYiFy6Ez7MKCA5lxmjF9UfQM	marketintelligencecenter.com	1395951078662
51527	Citigroup Inc Denied Permission to Raise Dividend (C)	http://www.dividend.com/news/2014/citigroup-inc-denied-permission-to-raise-dividend-c/	Dividend.com \(blog\)	b	dP-1PpYiFy6Ez7MKCA5lxmjF9UfQM	www.dividend.com	1395951078830
51528	Microsoft announces Office for iPad	http://www.arklatexhomepage.com/story/d/story/microsoft-announces-office-for-ipad/77218/nQOB2huJhkCi8leI4jv9Yg	KTAL	b	dUlKgaqxUngrA5MKtr_8lQs0ElRzM	www.arklatexhomepage.com	1395951416900
51529	Microsoft unveils Office for iPad with touch features	http://www.calgaryherald.com/business/Microsoft+unveils+Office+iPad+with+touch+features/9669354/story.html	Calgary Herald	b	dUlKgaqxUngrA5MKtr_8lQs0ElRzM	www.calgaryherald.com	1395951417085
51530	Don't get lost trying to find Office for iPad on the App Store - it's not there	http://tabtimes.com/news/ittech-os-ipad-ios/2014/03/27/don-t-get-lost-trying-find-office-ipad-app-store-it-not-there	TabTimes	b	dUlKgaqxUngrA5MKtr_8lQs0ElRzM	tabtimes.com	1395951417420
51531	Microsoft Office for Android is now free	http://www.androidauthority.com/microsoft-office-for-android-free-362330/	Android Authority	b	dUlKgaqxUngrA5MKtr_8lQs0ElRzM	www.androidauthority.com	1395951417664
51532	Microsoft snubs Surface, touts Office for iPad – but there's a catch	http://www.theregister.co.uk/2014/03/27/microsoft_office_apps_ipad/	Register	b	dUlKgaqxUngrA5MKtr_8lQs0ElRzM	www.theregister.co.uk	1395951417882
51533	Microsoft (MSFT) Brings its Office Suite to Apple's iPad	http://wallstreetpit.com/103176-microsoft-msft-brings-its-office-suite-to-apples-ipad/	Wall Street Pit	b	dUlKgaqxUngrA5MKtr_8lQs0ElRzM	wallstreetpit.com	1395951418309
51534	Microsoft Office for iPad is free (kinda) and ready to download	http://www.ausbt.com.au/microsoft-office-for-ipad-is-free-kinda-and-ready-to-download	Australian Business Traveller	b	dUlKgaqxUngrA5MKtr_8lQs0ElRzM	www.ausbt.com.au	1395951418535
51535	Watch Microsoft CEO Satya Nadella's Office for iPad announcement	http://betanews.com/2014/03/27/watch-microsoft-ceo-satya-nadellas-press-briefing-here-live/	BetaNews	b	dUlKgaqxUngrA5MKtr_8lQs0ElRzM	betanews.com	1395951418761
51536	Microsoft finally launches lucrative Office for iPad app that opens up potential  ...	http://www.itproportal.com/2014/03/27/microsoft-finally-launches-lucrative-office-ipad-app-opens-potential-67b-goldmine/	ITProPortal	b	dUlKgaqxUngrA5MKtr_8lQs0ElRzM	www.itproportal.com	1395951419017
51537	Microsoft launches Office for iPad	http://dfm.times-standard.com/article/microsoft-launches-office-for-ipad/60cb63a375101762288295c16b2ab5dd	Times-Standard	b	dUlKgaqxUngrA5MKtr_8lQs0ElRzM	dfm.times-standard.com	1395951419222
51538	Office for iPad first look: Echoing the desktop with a touch-based twist	http://thenextweb.com/microsoft/2014/03/27/office-ipad-first-look-echoing-desktop-version-touch-twist/\?utm_source=social&amp;utm_medium=feed&amp;utm_campaign=profeed	The Next Web	b	dUlKgaqxUngrA5MKtr_8lQs0ElRzM	thenextweb.com	1395951419380
51539	Microsoft announces new Office for iPad apps including Word, PowerPoint, & Excel	http://9to5mac.com/2014/03/27/microsoft-announces-office-for-ipad/	9 to 5 Mac	b	dUlKgaqxUngrA5MKtr_8lQs0ElRzM	9to5mac.com	1395951419623
51540	Apple CEO Tim Cook welcomes Microsoft CEO Satya Nadella's Office for iPad to  ...	http://9to5mac.com/2014/03/27/apple-ceo-tim-cook-welcomes-microsoft-ceo-satya-nadellas-office-for-ipad-to-app-store/	9 to 5 Mac	b	dUlKgaqxUngrA5MKtr_8lQs0ElRzM	9to5mac.com	1395951419835
51541	First look at iPad edition of Microsoft's Office suite	http://www.bbc.co.uk/news/technology-26778402	BBC News	b	dUlKgaqxUngrA5MKtr_8lQs0ElRzM	www.bbc.co.uk	1395951420221
51542	Nadella unveils mobile managment suite for iPad, and eventually Android	http://www.computerworld.com/s/article/9247244/Nadella_unveils_mobile_managment_suite_for_iPad_and_eventually_Android	Computerworld	b	dUlKgaqxUngrA5MKtr_8lQs0ElRzM	www.computerworld.com	1395951420442
51543	Microsoft unveils Office for iPad	http://news.idg.no/cw/art.cfm\?id=3347EF33-B763-787E-55EB28612E5CCC51	IDG News Service	b	dUlKgaqxUngrA5MKtr_8lQs0ElRzM	news.idg.no	1395951420675
51544	First Take: Nadella makes a good first impression	http://www.stevenspointjournal.com/usatoday/article/6963317	Stevenspointjournal	b	dUlKgaqxUngrA5MKtr_8lQs0ElRzM	www.stevenspointjournal.com	1395951420859
51545	*But an Office 365 subscription is needed to do more than just reading or  ...	http://www.dailytech.com/Microsoft+Office+for+iPad+Available+Today+for+Free/article34606c.htm	DailyTech	b	dUlKgaqxUngrA5MKtr_8lQs0ElRzM	www.dailytech.com	1395951421094
51546	Microsoft Announces Office For IPad [VIDEO]	http://www.forbes.com/sites/wochit/2014/03/27/microsoft-announces-office-for-ipad-video/	Forbes	b	dUlKgaqxUngrA5MKtr_8lQs0ElRzM	www.forbes.com	1395951421312
51547	Office For iPad - Why I Won't Use It	http://www.technobuffalo.com/2014/03/27/office-for-ipad-too-late/	TechnoBuffalo	b	dUlKgaqxUngrA5MKtr_8lQs0ElRzM	www.technobuffalo.com	1395951421503
51548	Microsoft announces Office for iPad apps in move towards cloud growth	http://www.digitalspy.com/tech/news/a560654/microsoft-announces-office-for-ipad-apps-in-move-towards-cloud-growth.html	Digital Spy	b	dUlKgaqxUngrA5MKtr_8lQs0ElRzM	www.digitalspy.com	1395951421766
51549	Microsoft Office for iPad Review	http://winsupersite.com/office/microsoft-office-ipad-review	Paul Thurrott's SuperSite for Windows	b	dUlKgaqxUngrA5MKtr_8lQs0ElRzM	winsupersite.com	1395951422194
51550	Office for iPad: a return to form or a retreat to strength?	http://www.techradar.com/news/software/applications/office-for-ipad-a-return-to-form-or-a-retreat-to-strength--1237783	TechRadar UK	b	dUlKgaqxUngrA5MKtr_8lQs0ElRzM	www.techradar.com	1395951422428
51551	Microsoft brings Office to Apple's iPad	http://www.cnet.com/news/microsoft-office-finally-comes-to-the-ipad/	CNET	b	dUlKgaqxUngrA5MKtr_8lQs0ElRzM	www.cnet.com	1395951422671
51552	Office for iPad: saviour or cannibal?	http://www.crn.com.au/News/381089,office-for-ipad-saviour-or-cannibal.aspx	CRN Australia	b	dUlKgaqxUngrA5MKtr_8lQs0ElRzM	www.crn.com.au	1395951423079
51553	Microsoft delivers Office for rival Apple's iPad	http://www.business-standard.com/article/pti-stories/microsoft-delivers-office-for-rival-apple-s-ipad-114032800045_1.html	Business Standard	b	dUlKgaqxUngrA5MKtr_8lQs0ElRzM	www.business-standard.com	1395951423314
51554	Microsoft finally releases freemium Office for iPad, tools for BYOD	http://siliconangle.com/blog/2014/03/27/microsoft-finally-releases-freemium-office-for-ipad-tools-for-byod/	SiliconANGLE \(blog\)	b	dUlKgaqxUngrA5MKtr_8lQs0ElRzM	siliconangle.com	1395951423491
51555	Microsoft makes big break from tradition with Office for iPad	http://seattletimes.com/html/businesstechnology/2023240253_microsoftnadellaxml.html	The Seattle Times	b	dUlKgaqxUngrA5MKtr_8lQs0ElRzM	seattletimes.com	1395951423659
51556	Microsoft unveils Office software specially tailored for the Apple iPad	http://www.theguardian.com/technology/2014/mar/27/microsoft-announces-office-apple-ipad	The Guardian	b	dUlKgaqxUngrA5MKtr_8lQs0ElRzM	www.theguardian.com	1395951423851
51557	Microsoft Brings A Native Version Of Office To The iPad And iPhone	http://www.fastcodesign.com/3028335/microsoft-brings-a-native-version-of-office-to-the-ipad-and-iphone	Co.Design	b	dUlKgaqxUngrA5MKtr_8lQs0ElRzM	www.fastcodesign.com	1395951424081
51558	Microsoft Launches Office For iPads	https://www.edsurge.com/n/2014-03-27-microsoft-launches-office-for-ipads	EdSurge	b	dUlKgaqxUngrA5MKtr_8lQs0ElRzM	www.edsurge.com	1395951424325
51559	Microsoft rolls out Office for iPad	http://www.inforum.com/event/article/id/430512/	In-Forum	b	dUlKgaqxUngrA5MKtr_8lQs0ElRzM	www.inforum.com	1395951424507
51560	'Announcing the Office you love, now on the iPad'	http://www.osnews.com/story/27642/_Announcing_the_Office_you_love_now_on_the_iPad_	OS News	b	dUlKgaqxUngrA5MKtr_8lQs0ElRzM	www.osnews.com	1395951424708
51561	It's about time: Microsoft launches Office for iPad [Updated]	http://blog.seattlepi.com/techblog/2014/03/27/its-about-time-microsoft-expected-to-launch-office-for-ipad/	seattlepi.com \(blog\)	b	dUlKgaqxUngrA5MKtr_8lQs0ElRzM	blog.seattlepi.com	1395951424954
51562	Microsoft unveils Office for Apple's iPad	http://www.smh.com.au/technology/technology-news/microsoft-unveils-office-for-apples-ipad-20140328-35mds.html	Sydney Morning Herald	b	dUlKgaqxUngrA5MKtr_8lQs0ElRzM	www.smh.com.au	1395951425239
51563	Is it cloud first or mobile first? Microsoft CEO explains	http://www.itworld.com/cloud-computing/411866/it-cloud-first-or-mobile-first-microsoft-ceo-explains	ITworld.com	b	dUlKgaqxUngrA5MKtr_8lQs0ElRzM	www.itworld.com	1395951425466
51564	Microsoft Corp unveils Office for iPad, available on Apple's App store Thursday	http://business.financialpost.com/2014/03/27/microsoft-corp-unveils-office-for-ipad-available-on-apples-app-store-thursday/	Financial Post	b	dUlKgaqxUngrA5MKtr_8lQs0ElRzM	business.financialpost.com	1395951425701
51565	Microsoft corporation unveils Office for iPad	http://www.financialexpress.com/news/microsoft-corporation-unveils-office-for-ipad/1236397	Financial Express	b	dUlKgaqxUngrA5MKtr_8lQs0ElRzM	www.financialexpress.com	1395951425902
51566	Office Is Coming to the iPad, but Microsoft's Stock Is Stuck in Neutral	http://www.fool.com/investing/general/2014/03/27/office-is-coming-to-the-ipad-but-microsofts-stock.aspx	Motley Fool	b	dUlKgaqxUngrA5MKtr_8lQs0ElRzM	www.fool.com	1395951426184
51567	Office for iPad: Is It Too Little, Too Late?	http://www.bloomberg.com/video/office-for-ipad-is-it-too-little-too-late-FaODWxxjQc6qFzusMZHD9Q.html	Bloomberg	b	dUlKgaqxUngrA5MKtr_8lQs0ElRzM	www.bloomberg.com	1395951426369
51568	Photos: Microsoft introduces Office for iPad	http://photos.mercurynews.com/2014/03/27/photos-microsoft-introduces-office-for-ipad/	San Jose Mercury News media center	b	dUlKgaqxUngrA5MKtr_8lQs0ElRzM	photos.mercurynews.com	1395951426562
51569	Microsoft Releases Office for iPad as New CEO Focuses on Boosting Revenue	http://variety.com/2014/digital/news/microsoft-releases-office-for-ipad-as-new-ceo-focuses-on-boosting-revenue-1201148811/	Variety	b	dUlKgaqxUngrA5MKtr_8lQs0ElRzM	variety.com	1395951426784
51570	Microsoft Unveils Office Software for iPad, and More	http://live.wsj.com/video/microsoft-unveils-office-software-for-ipad-and-more/4921B1DD-DE98-49B7-AE72-A9CBEDC586D9.html	Wall Street Journal	b	dUlKgaqxUngrA5MKtr_8lQs0ElRzM	live.wsj.com	1395951427136
51571	Microsoft CEO signals new course with Office for iPad	http://www.samaa.tv/technology/28-Mar-2014/microsoft-ceo-signals-new-course-with-office-for-ipad	SAMAA TV	b	dUlKgaqxUngrA5MKtr_8lQs0ElRzM	www.samaa.tv	1395951427463
51572	Microsoft CEO unveils Office for iPad in mobile-app push	http://www.telegram.com/article/20140327/NEWS/303279702/1237	Worcester Telegram	b	dUlKgaqxUngrA5MKtr_8lQs0ElRzM	www.telegram.com	1395951427656
51573	Satya Nadella's Master Plan For Microsoft	http://www.businessinsider.com/satya-nadella-cloud-mobile-2014-3	Business Insider	b	dUlKgaqxUngrA5MKtr_8lQs0ElRzM	www.businessinsider.com	1395951427849
51574	First look: Hands on with Office for iPad from Microsoft's event in San Francisco	http://appleinsider.com/articles/14/03/27/first-look-hands-on-with-office-for-ipad-from-microsofts-event-in-san-francisco	Apple Insider	b	dUlKgaqxUngrA5MKtr_8lQs0ElRzM	appleinsider.com	1395951428050
51575	Microsoft goes freemium with Office for iPad, requires subscription to create and  ...	http://www.digitaltrends.com/mobile/office-365-for-ipad-news/	Digital Trends	b	dUlKgaqxUngrA5MKtr_8lQs0ElRzM	www.digitaltrends.com	1395951428285
51576	Microsoft unveils Office for iPad - Will hell freeze over next?	http://wraltechwire.com/microsoft-unveils-office-for-ipad-will-hell-freeze-over-next-/13518119/	WRAL Tech Wire	b	dUlKgaqxUngrA5MKtr_8lQs0ElRzM	wraltechwire.com	1395951428520
51577	Microsoft Brings Word, PowerPoint And Excel To iPad	http://www.cultofmac.com/271947/microsoft-brings-word-powerpoint-excel-ipad/	Cult of Mac	b	dUlKgaqxUngrA5MKtr_8lQs0ElRzM	www.cultofmac.com	1395951428845
51578	It's Official: Microsoft Releases Office for iPad	http://windowsitpro.com/paul-thurrotts-wininfo/its-official-microsoft-releases-office-ipad	Windows IT Pro	b	dUlKgaqxUngrA5MKtr_8lQs0ElRzM	windowsitpro.com	1395951429056
51579	Microsoft officially announces Office for iPad	http://www.upi.com/Business_News/2014/03/27/Microsoft-officially-announces-Office-for-iPad/2321395942726/\?spt=fsb&amp;or=ros&amp;n=6	UPI.com	b	dUlKgaqxUngrA5MKtr_8lQs0ElRzM	www.upi.com	1395951429364
51580	Microsoft unvelils Office for iPad	http://www.enca.com/technology/microsoft-unvelils-office-ipad	eNCA	b	dUlKgaqxUngrA5MKtr_8lQs0ElRzM	www.enca.com	1395951429651
51581	Microsoft Office For iPad Is Finally Here	http://appadvice.com/appnn/2014/03/microsoft-office-for-ipad-is-finally-here	AppAdvice	b	dUlKgaqxUngrA5MKtr_8lQs0ElRzM	appadvice.com	1395951429842
51582	Office For iPad Adds Another Reason To Go Office 365	http://www.forbes.com/sites/forrester/2014/03/27/office-for-ipad-adds-another-reason-to-go-office-365/	Forbes	b	dUlKgaqxUngrA5MKtr_8lQs0ElRzM	www.forbes.com	1395951430047
51583	Microsoft's Office Suite Coming to iPad	http://www.neontommy.com/news/2014/03/microsoft-s-office-suite-coming-ipad	Neon Tommy	b	dUlKgaqxUngrA5MKtr_8lQs0ElRzM	www.neontommy.com	1395951430240
51584	Office for iPad establishes the tablet as a true PC	http://www.pcworld.com/article/2114025/office-for-ipad-establishes-the-tablet-as-a-true-pc.html	PCWorld \(blog\)	b	dUlKgaqxUngrA5MKtr_8lQs0ElRzM	www.pcworld.com	1395951430461
51585	Microsoft Office Suite Launches on the iPad--Finally	http://www.franchiseherald.com/articles/5445/20140327/microsoft-office-suite-launches-ipad-finally.htm	Franchise Herald	b	dUlKgaqxUngrA5MKtr_8lQs0ElRzM	www.franchiseherald.com	1395951430740
51586	Microsoft CEO Nadella Pulls the Trigger on Long-Gestating Office Apps for iPad	http://www.businessweek.com/articles/2014-03-27/microsoft-ceo-nadella-pulls-the-trigger-on-long-gestating-office-apps-for-ipad	Businessweek	b	dUlKgaqxUngrA5MKtr_8lQs0ElRzM	www.businessweek.com	1395951430908
51587	Microsoft Brings Its Office Productivity Suite To The iPad	http://www.fastcompany.com/3028338/fast-feed/microsoft-brings-its-office-productivity-suite-to-the-ipad\?partner=rss	Fast Company	b	dUlKgaqxUngrA5MKtr_8lQs0ElRzM	www.fastcompany.com	1395951431094
51588	Microsoft's Nadella Announces Cloud Strategy, Office For iPad, Mobile	http://www.mediapost.com/publications/article/222423/microsofts-nadella-announces-cloud-strategy-offi.html	MediaPost Communications	b	dUlKgaqxUngrA5MKtr_8lQs0ElRzM	www.mediapost.com	1395951431304
51589	Microsoft Releases Word, Excel, and Powerpoint on iPad at Long Last	http://appscout.pcmag.com/apple-ios-iphone-ipad-ipod/322043-microsoft-releases-word-excel-and-powerpoint-on-ipad-at-long-last	PC Magazine	b	dUlKgaqxUngrA5MKtr_8lQs0ElRzM	appscout.pcmag.com	1395951431617
51590	Microsoft announces Office for iPad apps including Word, PowerPoint, & Excel	http://usfinancepost.com/microsoft-announces-office-for-ipad-apps-including-word-powerpoint-excel-15840.html	USFinancePost	b	dUlKgaqxUngrA5MKtr_8lQs0ElRzM	usfinancepost.com	1395951431851
51591	Office for iPad announced that's free to view, pay to use	http://news.en.softonic.com/office-for-ipad-announced-thats-free-to-view-pay-to-use	Softonic EN	b	dUlKgaqxUngrA5MKtr_8lQs0ElRzM	news.en.softonic.com	1395951432053
51592	It's Official: Microsoft Office for iPad Is Alive!	http://investorplace.com/2014/03/microsoft-office-for-ipad-msft/	Investorplace.com	b	dUlKgaqxUngrA5MKtr_8lQs0ElRzM	investorplace.com	1395951432238
51593	Microsoft Office for Android phones to be available for free starting today	http://phandroid.com/2014/03/27/download-microsoft-office-android-free/	Phandroid.com	b	dUlKgaqxUngrA5MKtr_8lQs0ElRzM	phandroid.com	1395951432448
51594	UPDATE 2-Microsoft CEO signals new course with Office for iPad	http://www.reuters.com/article/2014/03/27/microsoft-office-ipad-idUSL1N0MO1EC20140327	Reuters	b	dUlKgaqxUngrA5MKtr_8lQs0ElRzM	www.reuters.com	1395951432758
51595	It's Official: Microsoft Office Meets Apple iPad In Long Overdue Union	http://hothardware.com/News/Its-Official-Microsoft-Office-Meets-Apple-iPad-In-Long-Overdue-Union/	Hot Hardware	b	dUlKgaqxUngrA5MKtr_8lQs0ElRzM	hothardware.com	1395951432951
51596	Microsoft's Office for iPad: It's all about the business users	http://www.zdnet.com/microsofts-office-for-ipad-its-all-about-the-business-users-7000027793/	ZDNet	b	dUlKgaqxUngrA5MKtr_8lQs0ElRzM	www.zdnet.com	1395951433170
51597	Microsoft Announces Office on iPad (Finally!), Available Today	http://www.lifehacker.co.in/technology/Microsoft-Announces-Office-on-iPad-Finally-Available-Today/articleshow/32801552.cms	LifeHacker India	b	dUlKgaqxUngrA5MKtr_8lQs0ElRzM	www.lifehacker.co.in	1395951433379
51598	Office for iPad is here and it's free, mostly	http://tech.uk.msn.com/news/articles.aspx\?cp-documentid=260159519	MSN UK	b	dUlKgaqxUngrA5MKtr_8lQs0ElRzM	tech.uk.msn.com	1395951433757
51599	The Critics Absolutely Love Everything About Office For The iPad Except The Price	http://www.businessinsider.in/The-Critics-Absolutely-Love-Everything-About-Office-For-The-iPad-Except-The-Price/articleshow/32803653.cms	Businessinsider India	b	dUlKgaqxUngrA5MKtr_8lQs0ElRzM	www.businessinsider.in	1395951433991
51600	Microsoft unveils Office app for iPad	http://www.staradvertiser.com/news/breaking/20140327_Microsoft_unveils_Office_app_for_iPad.html	Honolulu Star-Advertiser	b	dUlKgaqxUngrA5MKtr_8lQs0ElRzM	www.staradvertiser.com	1395951434201
