244001	'Godzilla' Director Gareth Edwards to Take Helm of 'Star Wars' Spin-off for 2016  ...	http://www.fashiontimes.com/articles/7427/20140523/godzilla-director-gareth-edwards-to-helm-star-wars-spin-off-for-2016-release.htm	Fashion Times	e	dcYGj32Krj_U_gMH056s3mOjX-RjM	www.fashiontimes.com	1400881253113
244002	Godzilla sans Giggles	http://www.weeklystandard.com/articles/godzilla-sans-giggles_793482.html	The Weekly Standard	e	dcYGj32Krj_U_gMH056s3mOjX-RjM	www.weeklystandard.com	1400881253308
244003	Impressive monster rises above film's flaws	http://www.burlingtoncountytimes.com/life-style/reality/impressive-monster-rises-above-film-s-flaws/article_ed47dd6f-da86-587c-abe7-6d8f7707e978.html	Burlington County Times	e	dcYGj32Krj_U_gMH056s3mOjX-RjM	www.burlingtoncountytimes.com	1400881253541
244004	MOVIE REVIEW: 'Godzilla:' Still Kitschy, after all these years	http://newjerseyhills.com/entertainment/film/movie-review-godzilla-still-kitschy-after-all-these-years/article_0847cc34-e1c0-11e3-bc55-0019bb2963f4.html	New Jersey Hills	e	dcYGj32Krj_U_gMH056s3mOjX-RjM	newjerseyhills.com	1400881253839
244005	GODZILLA director, BOOK OF ELI writer set for first STAR WARS spin-off...	http://www.therockfather.com/news-and-reviews/movie-and-tv/item/2470-godzilla-director-set-for-star-wars-spin-off	The Rock Father	e	dcYGj32Krj_U_gMH056s3mOjX-RjM	www.therockfather.com	1400881254202
244006	Gareth Edwards Will Direct The First 'Star Wars' Spinoff	http://www.huffingtonpost.com/2014/05/22/gareth-edwards-star-wars_n_5376424.html	Huffington Post	e	dcYGj32Krj_U_gMH056s3mOjX-RjM	www.huffingtonpost.com	1400881254562
244007	Film reviews | Godzilla and Ida	http://www.afr.com/p/national/arts_saleroom/film_reviews_godzilla_and_ida_hkxkFJD5WY4AFkFWT6emqO	The Australian Financial Review	e	dcYGj32Krj_U_gMH056s3mOjX-RjM	www.afr.com	1400881255284
244008	Gareth Edwards To Direct Stand-Alone Star Wars Film	http://www.theouthousers.com/index.php/news/127525-gareth-edwards-to-direct-stand-alone-star-wars-film.html	The Outhouse	e	dcYGj32Krj_U_gMH056s3mOjX-RjM	www.theouthousers.com	1400881255563
244009	'Godzilla' director Gareth Edwards to helm 'Star Wars' spinoff movie	http://www.al.com/entertainment/index.ssf/2014/05/godzilla_director_gareth_edwar.html	The Huntsville Times - al.com	e	dcYGj32Krj_U_gMH056s3mOjX-RjM	www.al.com	1400881255941
244010	Gareth Edwards confirmed to direct 'Star Wars' spinoff film	http://www.examiner.com/article/gareth-edwards-confirmed-to-direct-star-wars-spinoff-film	Examiner.com	e	dcYGj32Krj_U_gMH056s3mOjX-RjM	www.examiner.com	1400881256377
244011	GODZILLA Director Gareth Edwards to Helm Upcoming STAR WARS Spinoff Film	http://www.broadwayworld.com/bwwmovies/article/GODZILLA-Director-Gareth-Edwards-to-Helm-Upcoming-STAR-WARS-Spinoff-Film-20140522	Broadway World	e	dcYGj32Krj_U_gMH056s3mOjX-RjM	www.broadwayworld.com	1400881256705
244012	Gareth Edwards & Gary Whitta Board First 'Star Wars' Spinoff	http://sciencefiction.com/2014/05/22/gareth-edwards-gary-whitta-board-first-star-wars-spinoff/	Science Fiction	e	dcYGj32Krj_U_gMH056s3mOjX-RjM	sciencefiction.com	1400881256918
244013	'Godzilla' director tapped for 'Star Wars' spinoff	http://www.usatoday.com/story/life/movies/2014/05/22/gareth-edwards-star-wars-standalone-film/9461431/	USA TODAY	e	dcYGj32Krj_U_gMH056s3mOjX-RjM	www.usatoday.com	1400881257147
244014	Gareth Edwards to Direct First Stand-Alone 'Star Wars' Film	http://blogs.wsj.com/speakeasy/2014/05/22/gareth-edwards-to-direct-first-stand-alone-star-wars-film/	Wall Street Journal \(blog\)	e	dcYGj32Krj_U_gMH056s3mOjX-RjM	blogs.wsj.com	1400881257364
244015	Gareth Edwards Attached To Godzilla 2 & 3	http://movies.cosmicbooknews.com/content/gareth-edwards-attached-godzilla-2-3	Cosmic Book News - Comics	e	dcYGj32Krj_U_gMH056s3mOjX-RjM	movies.cosmicbooknews.com	1400881257756
244016	Legendary Pictures CEO Releases a Statement Regarding Gareth Edwards  ...	http://www.complex.com/pop-culture/2014/05/gareth-edwards-godzilla-future	Complex.com	e	dcYGj32Krj_U_gMH056s3mOjX-RjM	www.complex.com	1400881258004
244017	Godzilla Director Gareth Edwards to Direct the First Star Wars Spinoff	http://gotchamovies.com/news/godzilla-director-gareth-edwards-direct-first-star-wars-spinoff-180354	GotchaMovies	e	dcYGj32Krj_U_gMH056s3mOjX-RjM	gotchamovies.com	1400881258273
244018	Godzilla Producers Still Expect Gareth Edwards To Direct Next Installment After  ...	http://comicbook.com/blog/2014/05/22/godzilla-producers-still-expect-gareth-edwards-to-direct-next-installment-after-star-wars/	Comicbook.com \(blog\)	e	dcYGj32Krj_U_gMH056s3mOjX-RjM	comicbook.com	1400881258647
244019	'Godzilla' director to helm first standalone 'Star Wars'	http://www.cnet.com/news/godzilla-director-to-helm-first-stand-alone-star-wars/	CNET	e	dcYGj32Krj_U_gMH056s3mOjX-RjM	www.cnet.com	1400881258892
244020	Godzilla director tapped for Star Wars	http://www.dailymail.co.uk/wires/aap/article-2636968/Godzilla-director-tapped-Star-Wars.html	Daily Mail	e	dcYGj32Krj_U_gMH056s3mOjX-RjM	www.dailymail.co.uk	1400881259144
244021	Star Wars Saturation Point Begins: Standalone Film Announced For 2016	http://www.escapistmagazine.com/news/view/134740-Star-Wars-Saturation-Point-Begins-Standalone-Film-Announced-For-2016\?utm_source=rss&amp;utm_medium=rss&amp;utm_campaign=news	The Escapist	e	dcYGj32Krj_U_gMH056s3mOjX-RjM	www.escapistmagazine.com	1400881259893
244022	Godzilla Director Gareth Edwards To Take on a Star Wars Spinoff, Due  ...	http://comicbook.com/blog/2014/05/22/godzilla-director-gareth-edwards-to-take-on-a-star-wars-spinoff-due-december-2016/	Comicbook.com \(blog\)	e	dcYGj32Krj_U_gMH056s3mOjX-RjM	comicbook.com	1400881260122
244023	Even More Star Wars Films Are in the Works	http://time.com/109904/star-wars-film-gareth-edwards-2016/	TIME	e	dcYGj32Krj_U_gMH056s3mOjX-RjM	time.com	1400881260314
244024	The First Star Wars Spinoff Movie Gets A Director!	http://mimo.recordingconnection.com/the-first-star-wars-spinoff-movie-gets-a-director/968683/	Music is my Oxygen Weekly	e	dcYGj32Krj_U_gMH056s3mOjX-RjM	mimo.recordingconnection.com	1400881260793
244025	Star Wars Spin-off Gets the Godzilla Treatment	http://moviepilot.com/posts/2014/05/23/star-wars-spin-off-gets-the-godzilla-treatment-1444332	moviepilot.com	e	dcYGj32Krj_U_gMH056s3mOjX-RjM	moviepilot.com	1400881261059
244026	Godzilla's Gareth Edwards to direct a standalone Star Wars spinoff	http://www.avclub.com/article/godzillas-gareth-edwards-direct-standalone-star-wa-204987	A.V. Club DC	e	dcYGj32Krj_U_gMH056s3mOjX-RjM	www.avclub.com	1400881261251
244027	Gareth Edwards to direct, Gary Whitta to write the first Star Wars standalone film  ...	http://theslanted.com/2014/05/15273/gareth-edwards-direct-gary-whitta-write-first-star-wars-standalone-film-disney/	The Slanted	e	dcYGj32Krj_U_gMH056s3mOjX-RjM	theslanted.com	1400881261772
244028	Gareth Edwards and Gary Whitta Join the Star Wars Universe	http://starsentertainment.com/6430/gareth-edwards-and-gary-whitta-join-the-star-wars-universe/	StarsEntertainment.com	e	dcYGj32Krj_U_gMH056s3mOjX-RjM	starsentertainment.com	1400881262024
244029	Boba Fett Movie Will Be Written By The Writer Of The 'Walking Dead' Video  ...	http://www.inquisitr.com/1263433/boba-fett-movie-will-be-written-by-the-writer-of-the-walking-dead-video-game-series/	The Inquisitr	e	dcYGj32Krj_U_gMH056s3mOjX-RjM	www.inquisitr.com	1400881262275
244030	'Godzilla' Director to Helm First 'Star Wars' Standalone Film	http://newsok.com/godzilla-director-to-helm-first-star-wars-standalone-film/article/feed/690627	NewsOK.com	e	dcYGj32Krj_U_gMH056s3mOjX-RjM	newsok.com	1400881262594
244031	'Godzilla' Director Gareth Edwards Will Direct the First 'Star Wars' Spinoff Movie	http://news.moviefone.com/2014/05/22/gareth-edwards-direct-star-wars-spinoff/	Moviefone	e	dcYGj32Krj_U_gMH056s3mOjX-RjM	news.moviefone.com	1400881262859
244032	Gareth Edwards Will Return for Godzilla 2 Despite New Star Wars Gig	http://www.411mania.com/movies/news/323601/Gareth-Edwards-Will-Return-for-Godzilla-2-Despite-New-Star-Wars-Gig.htm	411mania.com	e	dcYGj32Krj_U_gMH056s3mOjX-RjM	www.411mania.com	1400881263087
244033	Which 'Star Wars' Character Makes the Most Sense for a Standalone Movie?	http://www.hollywoodreporter.com/heat-vision/star-wars-character-makes-sense-706695	Hollywood Reporter \(blog\)	e	dcYGj32Krj_U_gMH056s3mOjX-RjM	www.hollywoodreporter.com	1400881263298
244034	Gareth Edwards Gets Untitled 'Star Wars' Standalone Film Director Job	http://www.fandompost.com/2014/05/22/gareth-edwards-gets-untitled-star-wars-standalone-film-director-job/	The Fandom Post	e	dcYGj32Krj_U_gMH056s3mOjX-RjM	www.fandompost.com	1400881263709
244035	Gareth Edwards to direct Star Wars movie	http://moviehole.net/201476539gareth-edwards-to-direct-star-wars-movie	Moviehole	e	dcYGj32Krj_U_gMH056s3mOjX-RjM	moviehole.net	1400881263891
244036	'Godzilla' Director Taking On First 'Star Wars' Stand-Alone Film	http://www.ropeofsilicon.com/godzilla-director-taking-first-star-wars-stand-alone-film/	RopeofSilicon.com	e	dcYGj32Krj_U_gMH056s3mOjX-RjM	www.ropeofsilicon.com	1400881264353
244037	'Godzilla' Director Gareth Edwards Attached to 'Star Wars' Spinoff	http://spinoff.comicbookresources.com/2014/05/22/godzilla-director-gareth-edwards-attached-to-star-wars-spinoff/	Comic Book Resources	e	dcYGj32Krj_U_gMH056s3mOjX-RjM	spinoff.comicbookresources.com	1400881264680
244038	'Star Wars' Spinoff Hires 'Godzilla' Director Gareth Edwards (Exclusive)	http://www.hollywoodreporter.com/heat-vision/star-wars-spinoff-hires-godzilla-706636	Hollywood Reporter \(blog\)	e	dcYGj32Krj_U_gMH056s3mOjX-RjM	www.hollywoodreporter.com	1400881264915
244039	Gareth Edwards to Direct First Star Wars Spin-off; Writer and Release Date  ...	http://www.heyuguys.co.uk/gareth-edwards-direct-first-star-wars-spin-writer-release-date-revealed/\?utm_campaign=news	HeyUGuys	e	dcYGj32Krj_U_gMH056s3mOjX-RjM	www.heyuguys.co.uk	1400881265115
244040	Lucasfilm Officially Announces First Standalone 'Star Wars' Movie with 'Godzilla  ...	http://movies.mxdwn.com/news/lucasfilm-officially-announces-first-standalone-star-wars-movie-with-godzilla-director-at-the-helm/	mxdwn.com	e	dcYGj32Krj_U_gMH056s3mOjX-RjM	movies.mxdwn.com	1400881265307
244041	Gareth Edwards on board for two more Godzilla films!	http://www.joblo.com/horror-movies/news/gareth-edwards-on-board-for-two-more-godzilla-films-977	JoBlo.com	e	dcYGj32Krj_U_gMH056s3mOjX-RjM	www.joblo.com	1400881265678
244042	Gareth Edwards to Direct Mystery "Star Wars" Spin-Off	http://www.complex.com/pop-culture/2014/05/gareth-edwards-to-direct-star-wars-spin-off	Complex.com	e	dcYGj32Krj_U_gMH056s3mOjX-RjM	www.complex.com	1400881265894
244043	The Walking Dead's Gary Whitta writing Star Wars movie	http://www.psu.com/a023386/The-Walking-Deads-Gary-Whitta-writing-Star-Wars-movie	PlayStation Universe	e	dcYGj32Krj_U_gMH056s3mOjX-RjM	www.psu.com	1400881266106
244044	First STAR WARS Spinoff to Be Directed by GODZILLA Helmer Gareth Edwards	http://www.movies.ie/movie_news/1198185/First_STAR_WARS_Spinoff_to_Be_Directed_by_GODZILLA_Helmer_Gareth_Edwards	Movies.ie	e	dcYGj32Krj_U_gMH056s3mOjX-RjM	www.movies.ie	1400881266320
244045	LOL: 'Star Wars' Spin Off Writer Gary Whitta Goes On Hilarious Rant About  ...	http://www.slashfilm.com/gary-whitta-star-wars-jedi-academy/	\/FILM	e	dcYGj32Krj_U_gMH056s3mOjX-RjM	www.slashfilm.com	1400881266824
244046	Legendary Confirms Gareth Edwards Still Attached to Godzilla Sequel	http://www.superherohype.com/news/303239-legendary-confirms-gareth-edwards-still-attached-to-godzilla-sequel	Superherohype.com	e	dcYGj32Krj_U_gMH056s3mOjX-RjM	www.superherohype.com	1400881267069
244047	Official : Gareth Edwards to direct next Star Wars movie in 2016	http://www.filmindustrynetwork.biz/official-gareth-edwards-direct-next-star-wars-movie-2016/24240	Film Industry Network	e	dcYGj32Krj_U_gMH056s3mOjX-RjM	www.filmindustrynetwork.biz	1400881267271
244048	Gareth Edwards to direct first Star Wars spin-off	http://www.3news.co.nz/Gareth-Edwards-to-direct-first-Star-Wars-spin-off/tabid/418/articleID/345471/Default.aspx	3News NZ	e	dcYGj32Krj_U_gMH056s3mOjX-RjM	www.3news.co.nz	1400881267506
244049	Godzilla Guy to Direct Star Wars Spinoff Movie	http://mashable.com/2014/05/22/godzilla-guy-to-direct-star-wars-spinoff-movie/	Mashable	e	dcYGj32Krj_U_gMH056s3mOjX-RjM	mashable.com	1400881267749
244050	Gareth Edwards tapped to direct 'Star Wars' spinoff film	http://thecelebritycafe.com/feature/2014/05/gareth-edwards-tapped-direct-star-wars-spinoff	TheCelebrityCafe.com	e	dcYGj32Krj_U_gMH056s3mOjX-RjM	thecelebritycafe.com	1400881268184
244051	Movie Reviews by Reel People: 'Godzilla'	http://fridayflyer.com/2014/05/23/movie-reviews-by-reel-people-godzilla	The Friday Flyer	e	dcYGj32Krj_U_gMH056s3mOjX-RjM	fridayflyer.com	1400881268413
244052	Walking Dead Writer Tapped to Script 'Star Wars' Feature	http://arcadesushi.com/walking-dead-writer-tapped-to-script-star-wars-feature/	Arcade Sushi	e	dcYGj32Krj_U_gMH056s3mOjX-RjM	arcadesushi.com	1400881268671
244053	'Monsters' & 'Godzilla' Director Gareth Edwards To Helm The First 'Star Wars  ...	http://www.flicksandbits.com/2014/05/23/monsters-godzilla-director-gareth-edwards-to-helm-the-first-star-wars-spinoff-movie/70772/	Flicks and bits	e	dcYGj32Krj_U_gMH056s3mOjX-RjM	www.flicksandbits.com	1400881268879
244054	Director leaps from Godzilla to Star Wars stand-alone movie	http://blogs.post-gazette.com/arts-entertainment/mad-about-the-movies/41552-director-leaps-from-godzilla-to-star-wars-stand-alone-movie	Pittsburgh Post Gazette \(blog\)	e	dcYGj32Krj_U_gMH056s3mOjX-RjM	blogs.post-gazette.com	1400881269273
244055	'Star Wars' Spinoff Movie Will Be Helmed By 'Godzilla' Director Gareth Edwards	http://uproxx.com/gammasquad/2014/05/star-wars-spin-off-gareth-edwards-godzilla/	Uproxx	e	dcYGj32Krj_U_gMH056s3mOjX-RjM	uproxx.com	1400881269516
244056	GODZILLA's Gareth Edwards Attached To STAR WARS Spin-off Movie	http://twitchfilm.com/2014/05/gareth-edwards-attached-to-star-wars-spin-off-movie.html	Twitch	e	dcYGj32Krj_U_gMH056s3mOjX-RjM	twitchfilm.com	1400881269709
244057	'Godzilla' Director to Helm 'Star Wars' Spin-Off for December 2016	http://www.firstshowing.net/2014/godzilla-director-to-helm-star-wars-spin-off-for-december-2016/	First Showing	e	dcYGj32Krj_U_gMH056s3mOjX-RjM	www.firstshowing.net	1400881270083
244058	'Star Wars' Spinoff Hires 'Godzilla' Director Gareth Edwards	https://www.yahoo.com/movies/y-22-2-mins-star-wars-spinoff-hires-godzilla-86543906902.html	Yahoo News	e	dcYGj32Krj_U_gMH056s3mOjX-RjM	www.yahoo.com	1400881270311
244059	Around the Web	http://gamesided.com/2014/05/22/star-wars-2016-standalone-movie-written-walking-dead-game-writer/	GameSided	e	dcYGj32Krj_U_gMH056s3mOjX-RjM	gamesided.com	1400881271056
244060	New 'Star Wars' film coming December 2016 from the director of 'Godzilla'	http://www.theverge.com/2014/5/22/5743160/godzilla-director-gareth-edwards-reportedly-signs-on-for-star-wars-movie	The Verge	e	dcYGj32Krj_U_gMH056s3mOjX-RjM	www.theverge.com	1400881271325
244061	Gareth Edwards to Direct and Gary Whitta to Direct First Star Wars Spinoff Film	http://www.laughingplace.com/w/news/2014/05/22/gareth-edwards-to-direct-and-gary-whitta-to-direct-first-star-wars-spinoff-film/	LaughingPlace.com	e	dcYGj32Krj_U_gMH056s3mOjX-RjM	www.laughingplace.com	1400881271593
244062	Godzilla's Gareth Edwards to Direct the 2016 Star Wars Spinoff Film!	http://www.comingsoon.net/news/movienews.php\?id=118691	ComingSoon.net	e	dcYGj32Krj_U_gMH056s3mOjX-RjM	www.comingsoon.net	1400881271918
244063	'Star Wars: Stand Alone I' Team Announced	http://www.bigshinyrobot.com/57512/star-wars-stand-alone-i-team-announced/	Big Shiny Robot\!	e	dcYGj32Krj_U_gMH056s3mOjX-RjM	www.bigshinyrobot.com	1400881272219
244064	Gareth Edwards Directing First 'Star Wars' Spin Off Film, Due December 16, 2016	http://www.slashfilm.com/gareth-edwards-star-wars-spin-offs/	\/FILM	e	dcYGj32Krj_U_gMH056s3mOjX-RjM	www.slashfilm.com	1400881272387
244065	Godzilla director Gareth Edwards making Star Wars spin-off	http://www.denofgeek.com/movies/star-wars/30654/godzilla-director-gareth-edwards-making-star-wars-spin-off	Den Of Geek	e	dcYGj32Krj_U_gMH056s3mOjX-RjM	www.denofgeek.com	1400881272575
244066	Godzilla remake is supersized fun	http://www.meridianbooster.com/2014/05/22/godzilla-remake-is-supersized-fun	Meridian Booster	e	dcYGj32Krj_U_gMH056s3mOjX-RjM	www.meridianbooster.com	1400881272776
244067	Film Review: Godzilla, a Monstrosity of Scale	http://www.ithaca.com/arts_and_entertainment/film-review-godzilla-a-monstrosity-of-scale/article_b4510878-e1bc-11e3-99c6-0019bb2963f4.html	ithaca.com	e	dcYGj32Krj_U_gMH056s3mOjX-RjM	www.ithaca.com	1400881273147
244068	Candice Swanepoel tops Maxim's Hot 100	http://www.wfmz.com/entertainment/Candice-Swanepoel-tops-Maxim-s-Hot-100/26145620	WFMZ Allentown	e	dNDqsZoRswAXctM72mPKqPeQsuB1M	www.wfmz.com	1400881945787
244069	Maxim's Hot 100 Includes Carrie Underwood, Kacey Musgraves + More	http://tasteofcountry.com/maxims-hot-100-carrie-underwood-kacey-musgraves-country-stars/	Taste of Country	e	dNDqsZoRswAXctM72mPKqPeQsuB1M	tasteofcountry.com	1400881946047
244070	Maxim's Hot 100 List Of 2014 Features Candice Swanepoel, Rihanna, Jennifer  ...	http://www.huffingtonpost.ca/2014/05/23/maxim-hot-100-list-2014_n_5381682.html	Huffington Post Canada	e	dNDqsZoRswAXctM72mPKqPeQsuB1M	www.huffingtonpost.ca	1400881946335
244071	Candice Swanepoel Tops Maxim's Hot 100 List	http://www.webpronews.com/candice-swanepoel-tops-maxims-hot-100-list-2014-05	WebProNews	e	dNDqsZoRswAXctM72mPKqPeQsuB1M	www.webpronews.com	1400881946667
244072	Model Candice Swanepoel tops Maxim's Hot 100 list	http://www.sheknows.com/entertainment/articles/1038289/victorias-secret-model-candice-swanepoel-tops-maxims-hot-100-list	SheKnows.com	e	dNDqsZoRswAXctM72mPKqPeQsuB1M	www.sheknows.com	1400881946975
244073	Victoria's Secret model Candice Swanepoel named Maxim's sexiest woman  ...	http://www.mirror.co.uk/3am/celebrity-news/victorias-secret-model-candice-swanepoel-3595798	Mirror.co.uk	e	dNDqsZoRswAXctM72mPKqPeQsuB1M	www.mirror.co.uk	1400881947294
244074	Candice Swanepoel tops Maxim 2014 Hot 100 list	http://www.masslive.com/entertainment/index.ssf/2014/05/candice_swanepoel_tops_maxim_2.html	MassLive.com	e	dNDqsZoRswAXctM72mPKqPeQsuB1M	www.masslive.com	1400881947615
244075	Candice Swanepoel Takes No. 1 On Maxim Hot 100 List	http://www.inquisitr.com/1264336/candice-swanepoel-takes-no-1-on-maxim-hot-100-list/	The Inquisitr	e	dNDqsZoRswAXctM72mPKqPeQsuB1M	www.inquisitr.com	1400881947959
244076	Candice Swanepoel: 5 Things To Know	http://www.accesshollywood.com/candice-swanepoel-5-things-to-know-about-supermodel-and-maxim-hot-100-queen_article_94649	Access Hollywood	e	dNDqsZoRswAXctM72mPKqPeQsuB1M	www.accesshollywood.com	1400881948201
244077	Candice Swanepoel Tops Maxim's Hot 100 List for 2014	http://archive.firstcoastnews.com/video/default.aspx\?bctid=3584879085001	First Coast News	e	dNDqsZoRswAXctM72mPKqPeQsuB1M	archive.firstcoastnews.com	1400881948444
244078	Candice Swanepoel named hottest woman in world by Maxim: Her diet and  ...	http://www.examiner.com/article/candice-swanepoel-tops-maxim-hot-100-list-her-diet-and-workout-secrets	Examiner.com	e	dNDqsZoRswAXctM72mPKqPeQsuB1M	www.examiner.com	1400881948722
244079	Maxim Hot 100 List Revealed!	http://urbanmecca.net/news/2014/05/23/maxim-hot-100-list-revealed/	UrbanMecca	e	dNDqsZoRswAXctM72mPKqPeQsuB1M	urbanmecca.net	1400881949015
244080	Who's the Hottest Woman in Maxim's Hot 100?	http://www.sodahead.com/entertainment/whos-the-hottest-woman-in-maxims-hot-100/question-4335559/	SodaHead News	e	dNDqsZoRswAXctM72mPKqPeQsuB1M	www.sodahead.com	1400881949259
244081	Maxim picks Victoria's Secret model Candice Swanepoel as No. 1 on Hot 100	http://thecelebritycafe.com/feature/2014/05/maxim-picks-victorias-secret-model-candice-swanepoel-no-1-hot-100	TheCelebrityCafe.com	e	dNDqsZoRswAXctM72mPKqPeQsuB1M	thecelebritycafe.com	1400881949544
244082	Maxim's Hot 100 list is here and, of course, it's filled with babes	http://blog.muchmusic.com/maxims-hot-100-list-is-here-and-of-course-its-filled-with-babes/	MuchMusic.com \(blog\)	e	dNDqsZoRswAXctM72mPKqPeQsuB1M	blog.muchmusic.com	1400881949730
244083	Candice Swanepoel named No. 1 on Maxim's Hot 100 List	http://www.nydailynews.com/entertainment/gossip/candice-swanepoel-named-1-maxim-hot-100-list-article-1.1803116	New York Daily News	e	dNDqsZoRswAXctM72mPKqPeQsuB1M	www.nydailynews.com	1400881950162
244084	Candice Swanepoel is number 1 in Maxim's Hot 100 list	http://www.realitytvworld.com/news/candice-swanepoel-is-number-1-in-maxim-hot-100-list-50129240.php	Reality TV World	e	dNDqsZoRswAXctM72mPKqPeQsuB1M	www.realitytvworld.com	1400881950343
244085	Victoria's Secret Beauty Candice Swanepoel Named as Maxim's No. 1 in the Hot  ...	http://www.travelerstoday.com/articles/10018/20140523/victorias-secret-supermodel-candice-swanepoel-beat-out-other-women-after-being-named-as-maxims-no-1-beauty.htm	TravelersToday	e	dNDqsZoRswAXctM72mPKqPeQsuB1M	www.travelerstoday.com	1400881950581
244086	Victoria Secret's Model Candice Swanepoel Tops the 2014 Maxim Hot 100 List	http://magazine.foxnews.com/celebrity/victoria-secret-model-candice-swanepoel-tops-2014-maxim-hot-100-list	Fox News	e	dNDqsZoRswAXctM72mPKqPeQsuB1M	magazine.foxnews.com	1400881950859
244087	Supermodel Candice Swanepoel shows off her incredible bikini body in sultry  ...	http://www.dailymail.co.uk/tvshowbiz/article-2637249/Candice-Swanepoel-shows-incredible-bikini-body-sultry-shot-lands-spot-Maxims-Hot-100-list.html	Daily Mail	e	dNDqsZoRswAXctM72mPKqPeQsuB1M	www.dailymail.co.uk	1400881951163
244088	Victoria's Secret Angel Candice Swanepoel Grabs No. 1 Spot On Maxim's Hot  ...	http://www.mstarz.com/articles/31007/20140523/victoria-s-secret-angel-candice-swanepoel-grabs-no-1-spot-on-maxims-hot-100-list-instagram-photo.htm	Mstarz	e	dNDqsZoRswAXctM72mPKqPeQsuB1M	www.mstarz.com	1400881951447
244089	2014 Maxim Hot 100 list: Complete list and photos	http://www.orlandosentinel.com/features/blogs/the-list/os-maxim-reveals-hot-100-list-for-2014-20140523,0,6942717.post	Orlando Sentinel \(blog\)	e	dNDqsZoRswAXctM72mPKqPeQsuB1M	www.orlandosentinel.com	1400881951696
244090	Candice Swanepoel Tops The 2014 Maxim Hot 100	http://www.411mania.com/movies/news/323654	411mania.com	e	dNDqsZoRswAXctM72mPKqPeQsuB1M	www.411mania.com	1400881952159
244091	Maxim Hot 100 2014 Revealed!	http://www.accesshollywood.com/maxim-hot-100-candice-swanepoel-tops-list-over-scarlett-katy-mila-and-more_article_94626	Access Hollywood	e	dNDqsZoRswAXctM72mPKqPeQsuB1M	www.accesshollywood.com	1400881952385
244092	Maxim's 2014 Hot 100 List Is Here And Candice Swanepoel Is At The Top	http://www.huffingtonpost.com/2014/05/23/maxim-2014-hot-100-list_n_5378093.html	Huffington Post	e	dNDqsZoRswAXctM72mPKqPeQsuB1M	www.huffingtonpost.com	1400881952583
244093	Maxim's 2014 Hot 100 List Is Here -- Find Out Who Placed First!	http://www.toofab.com/2014/05/23/maxim-2014-hot-100-list-photos/	TooFab.com	e	dNDqsZoRswAXctM72mPKqPeQsuB1M	www.toofab.com	1400881952981
244094	Candice Swanepoel Instagram 2014 Debuts Top Spot on Maxim Hot 100 List  ...	http://www.beautyworldnews.com/articles/9431/20140523/candice-swanepoel-instagram-2014-debuts-top-spot-on-maxim-hot-100-list-herman-nicolis-supermodel-girlfriend-steals-crown-from-miley-cyrus-and-beats-out-jennifer-lawrence-and-more-for-number-1.htm	Beauty World News	e	dNDqsZoRswAXctM72mPKqPeQsuB1M	www.beautyworldnews.com	1400881953272
244095	Here are Maxim's hottest women of 2014	http://www.sheknows.ca/entertainment/articles/961871/here-are-maxims-hottest-women-of-2014	SheKnows Canada	e	dNDqsZoRswAXctM72mPKqPeQsuB1M	www.sheknows.ca	1400881953608
244096	Smokin'! This year's Maxim's Hot 100 List is here and it is chock-full of sexy women.	http://www.usmagazine.com/celebrity-body/news/candice-swanepoel-tops-maxims-hot-100-list-bikini-photo-top-picks-2014235	Us Magazine	e	dNDqsZoRswAXctM72mPKqPeQsuB1M	www.usmagazine.com	1400881954032
244097	Maxim Crowns Candice Swanepoel the Hottest Woman in the World	https://ca.celebrity.yahoo.com/blogs/celebrity-news/maxim-crowns-candice-swanepoel-the-hottest-woman-in-the-world-131003877.html	OMG\! Canada \(blog\)	e	dNDqsZoRswAXctM72mPKqPeQsuB1M	ca.celebrity.yahoo.com	1400881954294
244098	SA beauty tops Maxim's Hot 100 list!	http://www.channel24.co.za/Gossip/SA-beauty-tops-Maxims-Hot-100-list-20140523	Channel 24	e	dNDqsZoRswAXctM72mPKqPeQsuB1M	www.channel24.co.za	1400881954569
244099	'Maxim' actually gets it right with their Hot 100, with the pics to prove it	http://guyism.com/celebrities/maxim-hot-100-pics-top-10.html	Guyism	e	dNDqsZoRswAXctM72mPKqPeQsuB1M	guyism.com	1400881954855
244100	Victoria's Secret Angel Tops "Maxim's" 'Hot 100' List for 2014	http://www.wjbdradio.com/Entertainment/Victoria-s-Secret-Angel-Tops--Maxim-s---Hot-100--List-for-2014	WJBD Online	e	dNDqsZoRswAXctM72mPKqPeQsuB1M	www.wjbdradio.com	1400881955134
