52601	New photo features in updated Twitter iOS app	http://thefadaily.com/technology-22/new-photo-features-in-updated-twitter-ios-app-72.html	The FA Daily	t	dT-uJfg7nY3iriMx5f0DQVutyyBWM	thefadaily.com	1395955922249
52602	Twitter updates smartphone app adds photo tagging feature	http://post.jagran.com/twitter-updates-smartphone-app-adds-photo-tagging-feature-1395912726	Jagran Post	t	dT-uJfg7nY3iriMx5f0DQVutyyBWM	post.jagran.com	1395955922508
52603	New on Twitter: Tag people, add upto 4 photos	http://www.delhidailynews.com/news/New-on-Twitter--Tag-People--Add-4-Photos-to-a-Tweet-1395908363/	Delhi Daily News	t	dT-uJfg7nY3iriMx5f0DQVutyyBWM	www.delhidailynews.com	1395955922690
52604	Twitter overhauls photo system to compete with Instagram – a huge benefit for  ...	http://www.eventindustrynews.co.uk/2014/03/27/twitter-overhauls-photo-system-compete-instagram-huge-benefit-events/	Event Industry News	t	dT-uJfg7nY3iriMx5f0DQVutyyBWM	www.eventindustrynews.co.uk	1395955922892
52605	Twitter upgrades its photo sharing	http://www.htxt.co.za/2014/03/27/twitter-upgrades-its-photo-sharing/	htxt.africa	t	dT-uJfg7nY3iriMx5f0DQVutyyBWM	www.htxt.co.za	1395955923043
52606	Twitter now lets you stick multiple photos in a tweet and tag people	http://memeburn.com/2014/03/twitter-now-lets-you-stick-multiple-photos-in-a-tweet-and-tag-people/	Memeburn	t	dT-uJfg7nY3iriMx5f0DQVutyyBWM	memeburn.com	1395955923273
52607	Twitter Android And iOS Apps Get Photo Tagging	http://www.geeky-gadgets.com/twitter-android-and-ios-apps-get-photo-tagging-27-03-2014/	Geeky gadgets	t	dT-uJfg7nY3iriMx5f0DQVutyyBWM	www.geeky-gadgets.com	1395955923600
52608	Twitter adds Facebook-style tagging	http://www.iol.co.za/scitech/technology/internet/twitter-adds-facebook-style-tagging-1.1667040	Independent Online	t	dT-uJfg7nY3iriMx5f0DQVutyyBWM	www.iol.co.za	1395955923782
52609	Twitter ramps up photo sharing	http://www.news24.com/Technology/News/Twitter-ramps-up-photo-sharing-20140327	News24	t	dT-uJfg7nY3iriMx5f0DQVutyyBWM	www.news24.com	1395955923958
52610	Twitter rolls out photo-tagging and multiple picture functionality on mobile	http://www.thedrum.com/news/2014/03/27/twitter-rolls-out-photo-tagging-and-multiple-picture-functionality-mobile	The Drum	t	dT-uJfg7nY3iriMx5f0DQVutyyBWM	www.thedrum.com	1395955924171
52611	Twitter Gets 'Photo Tagging' And 'Multiple Photo Sharing' Ability	http://au.ibtimes.com/articles/545296/20140327/twitter-photo-tagging-face-people-iphone-android.htm	International Business Times AU	t	dT-uJfg7nY3iriMx5f0DQVutyyBWM	au.ibtimes.com	1395955924821
52612	Twitter Turning into 'Mini-Facebook': New Features Allow Tagging Photos  ...	http://www.fashiontimes.com/articles/4139/20140327/twitter-turning-mini-facebook-new-features-allow-tagging-photos-creation.htm	Fashion Times	t	dT-uJfg7nY3iriMx5f0DQVutyyBWM	www.fashiontimes.com	1395955925006
52613	Twitter apes Facebook, rolls out photo tagging	http://timesofindia.indiatimes.com/tech/social/Twitter-apes-Facebook-rolls-out-photo-tagging/articleshow/32770121.cms	Times of India	t	dT-uJfg7nY3iriMx5f0DQVutyyBWM	timesofindia.indiatimes.com	1395955925174
52614	Photo Tagging Now Comes to Twitter	http://www.indiatimes.com/technology/internet/photo-tagging-now-comes-to-twitter-137394.html	Indiatimes.com	t	dT-uJfg7nY3iriMx5f0DQVutyyBWM	www.indiatimes.com	1395955925509
52615	Twitter Allows Four Photos Per Tweet, Ten Free Tags	http://www.cultofmac.com/271848/twitter-allows-four-photos-per-tweet-ten-free-tags/	Cult of Mac	t	dT-uJfg7nY3iriMx5f0DQVutyyBWM	www.cultofmac.com	1395955925702
52616	Now you can tag people in pics using Twitter mobile apps	http://thefootballexaminer.com/technology-22/now-you-can-tag-people-in-pics-using-twitter-mobile-apps-524.html	The Football Examiner	t	dT-uJfg7nY3iriMx5f0DQVutyyBWM	thefootballexaminer.com	1395955925929
52617	Twitter adds photo tagging in tweets – plus share up to four photos per tweet	http://www.siliconrepublic.com/new-media/item/36283-twitter-adds-photo-tagging/	Siliconrepublic.com	t	dT-uJfg7nY3iriMx5f0DQVutyyBWM	www.siliconrepublic.com	1395955926125
52618	A Case of Competition Imitation? Twitter adds PhotoTagging and Multiple Photo  ...	http://www.industryleadersmagazine.com/a-case-of-competition-imitation-twitter-adds-phototagging-and-multiple-photo-sharing-to-tweets-similar-to-rival-facebook/	Industry Leaders Magazine	t	dT-uJfg7nY3iriMx5f0DQVutyyBWM	www.industryleadersmagazine.com	1395955926810
52619	New Twitter for Android Update Delivers Multiple Photo Uploads, Photo Tagging	http://www.androidheadlines.com/2014/03/new-twitter-android-update-delivers-multiple-photo-uploads-photo-tagging.html	Android Headlines - Android News	t	dT-uJfg7nY3iriMx5f0DQVutyyBWM	www.androidheadlines.com	1395955927003
52620	Twitter lets users tag friends in a photo, upload multiple photos	http://www.bgr.in/news/twitter-lets-users-tag-friends-in-a-photo-upload-multiple-photos/	BGR India	t	dT-uJfg7nY3iriMx5f0DQVutyyBWM	www.bgr.in	1395955927197
52621	Twitter now lets you add 4 photos to a tweet, tag up to 10 people in a photo	http://ibnlive.in.com/news/twitter-now-lets-you-add-4-photos-to-a-tweet-tag-up-to-10-people-in-a-photo/460567-11.html	IBNLive	t	dT-uJfg7nY3iriMx5f0DQVutyyBWM	ibnlive.in.com	1395955927398
52622	Twitter adds Facebook-style photo “tagging,” increases images per post	http://www.capitalfm.co.ke/lifestyle/2014/03/27/twitter-adds-facebook-style-photo-tagging-increases-images-per-post/	Capital FM Kenya	t	dT-uJfg7nY3iriMx5f0DQVutyyBWM	www.capitalfm.co.ke	1395955927592
52623	Twitter testing profile redesign on its iOS app	http://gadgets.ndtv.com/apps/news/twitter-testing-profile-redesign-on-its-ios-app-500821	NDTV	t	dT-uJfg7nY3iriMx5f0DQVutyyBWM	gadgets.ndtv.com	1395955928099
52624	Twitter iOS app updated with new photo features	http://www.technologytell.com/apple/132493/twitter-ios-app-updated-with-photo-tagging-feature-and-multiple-photo-upload/	TechnologyTell	t	dT-uJfg7nY3iriMx5f0DQVutyyBWM	www.technologytell.com	1395955928312
52625	Twitter apps for Android and iOS get photo tagging feature and more	http://gadgets.ndtv.com/social-networking/news/twitter-apps-for-android-and-ios-get-photo-tagging-feature-and-more-500790	NDTV	t	dT-uJfg7nY3iriMx5f0DQVutyyBWM	gadgets.ndtv.com	1395955928530
52626	Twitter adds photo-tagging and '4 photos in a tweet'-sharing	http://www.thebitbag.com/pending-review-33/72206	Bitbag	t	dT-uJfg7nY3iriMx5f0DQVutyyBWM	www.thebitbag.com	1395955928720
52627	Twitter For iOS Updated With Photo Tagging And Multiple Photo Sharing	http://appadvice.com/appnn/2014/03/twitter-for-ios-updated-with-photo-tagging-and-multiple-photo-sharing	AppAdvice	t	dT-uJfg7nY3iriMx5f0DQVutyyBWM	appadvice.com	1395955929050
52628	iPhone users can now tag photos on Twitter	http://www.emirates247.com/business/technology/iphone-users-can-now-tag-photos-on-twitter-2014-03-26-1.543213	Emirates 24\/7	t	dT-uJfg7nY3iriMx5f0DQVutyyBWM	www.emirates247.com	1395955929247
52629	Twitter unveils new photo tagging features	http://www.examiner.com/article/twitter-unveils-new-photo-tagging-features	Examiner.com	t	dT-uJfg7nY3iriMx5f0DQVutyyBWM	www.examiner.com	1395955929462
52630	Twitter Adds Photo Tagging, Increases Photos Limit to 4 Per Tweet	http://www.technewsplus.com/twitter-adds-photo-tagging-increases-photos-limit-4-per-tweet/1837/	Tech News Plus	t	dT-uJfg7nY3iriMx5f0DQVutyyBWM	www.technewsplus.com	1395955929980
52631	Twitter adds photo tagging, ability to have 4 photos in one post	http://www.afterdawn.com/news/article.cfm/2014/03/27/twitter_photo_tagging_mobile\?utm_source=adeng_news&amp;utm_medium=tickerbar&amp;utm_campaign=englishNews	Afterdawn.com	t	dT-uJfg7nY3iriMx5f0DQVutyyBWM	www.afterdawn.com	1395955930212
52632	Twitter Testing Dramatic Profile Redesign On Mobile	http://www.business2community.com/social-buzz/twitter-testing-dramatic-profile-redesign-mobile-0825345	Business 2 Community	t	dT-uJfg7nY3iriMx5f0DQVutyyBWM	www.business2community.com	1395955930389
52633	Now, tag photos on your mobile Twitter app	http://www.deccanchronicle.com/140327/technology-mobiles-and-tabs/article/now-tag-your-photos-twitter	Deccan Chronicle	t	dT-uJfg7nY3iriMx5f0DQVutyyBWM	www.deccanchronicle.com	1395955930599
52634	Twitter introduces photo tagging	http://www.marketing-interactive.com/twitter-photos-just-got-social/	Marketing Interactive	t	dT-uJfg7nY3iriMx5f0DQVutyyBWM	www.marketing-interactive.com	1395955931026
52635	Twitter just got more social	http://www.news.com.au/technology/online/twitter-updates-photos-to-make-it-more-social/story-fnjwnhzf-1226866356079	NEWS.com.au	t	dT-uJfg7nY3iriMx5f0DQVutyyBWM	www.news.com.au	1395955931194
52636	Twitter App Update Brings Photo Tagging, Ability to Share 4 Photos in a Tweet	http://www.iclarified.com/39431/twitter-app-update-brings-photo-tagging-ability-to-share-4-photos-in-a-tweet	iClarified	t	dT-uJfg7nY3iriMx5f0DQVutyyBWM	www.iclarified.com	1395955931387
52637	Twitter and live TV go hand-in-hand	http://www.pfhub.com/twitter-and-live-tv-go-hand-in-hand-453/	PFhub	t	dT-uJfg7nY3iriMx5f0DQVutyyBWM	www.pfhub.com	1395955931562
52638	Twitter Testing Dramatically Redesigned Profiles On Mobile	http://socialnewsdaily.com/32580/twitter-testing-dramatically-redesigned-profiles-on-mobile/	Social News Daily	t	dT-uJfg7nY3iriMx5f0DQVutyyBWM	socialnewsdaily.com	1395955931768
52639	Bing makes a visual splash with new Product Ads for search	http://www.marketingpilgrim.com/2014/03/bing-makes-a-visual-splash-with-new-product-ads-for-search.html	Marketing Pilgrim	t	dT-uJfg7nY3iriMx5f0DQVutyyBWM	www.marketingpilgrim.com	1395955932036
52640	Twitter Wants You to Tag Your Pals in Pictures	http://bostinno.streetwise.co/2014/03/26/twitter-photo-tagging-twitter-lets-you-add-four-photos-in-tweets-and-tag-ten-friends-in-photos/	BostInno	t	dT-uJfg7nY3iriMx5f0DQVutyyBWM	bostinno.streetwise.co	1395955932289
52641	Twitter adds ability to post multiple photos, tag friends	http://www.latimes.com/business/technology/la-fi-tn-twitter-post-multiple-photos-tag-friends-20140326,0,4646735.story\?track=rss&amp;utm_source=feedburner&amp;utm_medium=feed&amp;utm_campaign=Feed%3A+latimes%2Fmostviewed+(L.A.+Times+-+Most+Viewed+Stories)	Los Angeles Times	t	dT-uJfg7nY3iriMx5f0DQVutyyBWM	www.latimes.com	1395955932492
52642	Tweets: now with four times the photo sharing	http://www.poynter.org/latest-news/mediawire/245021/tweets-now-with-four-times-the-photo-sharing/	Poynter.org	t	dT-uJfg7nY3iriMx5f0DQVutyyBWM	www.poynter.org	1395955932723
52643	Twitter rolls out image tagging and support for embedding multiple images	http://haverzine.com/2014/03/26/twitter-roles-out-image-tagging-and-support-for-embedding-multiple-images/	Haverzine	t	dT-uJfg7nY3iriMx5f0DQVutyyBWM	haverzine.com	1395955933052
52644	Twitter Lets You Add 4 Photos to Tweets, Tag Anyone in Them	http://mashable.com/2014/03/26/twitter-photos-social/	Mashable	t	dT-uJfg7nY3iriMx5f0DQVutyyBWM	mashable.com	1395955933237
52645	Twitter mobile scores multi-image tweets and photo tagging	http://www.slashgear.com/twitter-mobile-scores-multi-image-tweets-and-photo-tagging-26322282/	SlashGear	t	dT-uJfg7nY3iriMx5f0DQVutyyBWM	www.slashgear.com	1395955933420
52646	Twitter Tests More Inviting Profile Designs On Mobile	http://techcrunch.com/2014/03/26/twitter-tests-more-inviting-profile-designs-on-mobile/	TechCrunch	t	dT-uJfg7nY3iriMx5f0DQVutyyBWM	techcrunch.com	1395955933616
52647	Twitter Tests Profile Redesign for its iOS App	http://thenextweb.com/twitter/2014/03/26/testing-profile-redesign-web-twitter-ios-app/	The Next Web	t	dT-uJfg7nY3iriMx5f0DQVutyyBWM	thenextweb.com	1395955933933
52648	Is Twitter Right For Your Business? A Closer Look At The Recent Changes	http://imsoup.com/10974/is-twitter-right-for-your-business-a-closer-look-at-the-recent-changes/	IMSoup	t	dT-uJfg7nY3iriMx5f0DQVutyyBWM	imsoup.com	1395955934128
52649	Intel Backs Cloudera for Apache Hadoop Data Management	http://www.convergedigest.com/2014/03/intel-backs-cloudera-for-apache-hadoop.html	Converge Network Digest	t	dAs_gIN75MSUNsMfhdzm4Dz4FVtqM	www.convergedigest.com	1395956247096
52650	UPDATE 2-Intel takes 'significant' stake in Big Data startup Cloudera	http://www.reuters.com/article/2014/03/27/intel-cloudera-idUSL1N0MO17M20140327	Reuters	t	dAs_gIN75MSUNsMfhdzm4Dz4FVtqM	www.reuters.com	1395956247589
52651	Intel Teams with Cloudera on Hadoop for Big Data	http://www.eweek.com/database/intel-teams-with-cloudera-on-hadoop-for-big-data.html/	eWeek	t	dAs_gIN75MSUNsMfhdzm4Dz4FVtqM	www.eweek.com	1395956247824
52652	Intel Corporation (INTC) Announces Equity Investment In Cloudera	http://www.valuewalk.com/2014/03/intel-corporation-intc-announces-equity-investment-in-cloudera/	ValueWalk	t	dAs_gIN75MSUNsMfhdzm4Dz4FVtqM	www.valuewalk.com	1395956248052
52653	Intel Plays Kingmaker for Cloudera Analytics	http://www.itbusinessedge.com/blogs/unfiltered-opinion/intel-plays-kingmaker-for-cloudera-analytics.html	IT Business Edge \(blog\)	t	dAs_gIN75MSUNsMfhdzm4Dz4FVtqM	www.itbusinessedge.com	1395956248253
52654	Intel and Cloudera partner on Hadoop for big data	http://www.v3.co.uk/v3-uk/news/2336759/intel-and-cloudera-partner-on-hadoop-for-big-data	V3.co.uk	t	dAs_gIN75MSUNsMfhdzm4Dz4FVtqM	www.v3.co.uk	1395956248443
52655	Intel Announces Strategic Tie-Up With Cloudera	http://recode.net/2014/03/27/intel-announces-strategic-tie-up-with-cloudera-including-investment/	Re\/code	t	dAs_gIN75MSUNsMfhdzm4Dz4FVtqM	recode.net	1395956248639
52656	Intel makes major big data play, partners with Cloudera	http://finance.fortune.cnn.com/2014/03/27/intel-makes-major-big-data-play-partners-with-cloudera/\?section=magazines_fortune	Fortune	t	dAs_gIN75MSUNsMfhdzm4Dz4FVtqM	finance.fortune.cnn.com	1395956248824
52657	Concurrent, Inc Enhances Mass Enterprise Big Data Adoption With Intel(R) Data  ...	http://networking.itbusinessnet.com/article/Concurrent-Inc-Enhances-Mass-Enterprise-Big-Data-Adoption-With-Intel(R)-Data-Platform--3144535	IT Business Net	t	dAs_gIN75MSUNsMfhdzm4Dz4FVtqM	networking.itbusinessnet.com	1395956249051
52658	Prairie chicken listed as threatened	http://www.wkrn.com/story/25093086/prairie-chicken-listed-as-threatened	WKRN	t	d-kf0XmELVtg5SM6lSfO6FwtaFhPM	www.wkrn.com	1395956607577
52659	Lesser prairie chicken listed as threatened species, 5 states affected	http://www.usnews.com/news/politics/articles/2014/03/27/apnewsbreak-prairie-chicken-listed-as-threatened	U.S. News \& World Report	t	d-kf0XmELVtg5SM6lSfO6FwtaFhPM	www.usnews.com	1395956607838
52660	Lesser prairie chicken listed as threatened species, 5 states affected | The  ...	http://www.tribtown.com/view/story/e3a381d45f60411ea883c1b66672888f/US--Endangered-Grouse	The Tribune	t	d-kf0XmELVtg5SM6lSfO6FwtaFhPM	www.tribtown.com	1395956608064
52661	APNewsBreak: Prairie chicken listed as threatened	http://www.wral.com/apnewsbreak-prairie-chicken-listed-as-threatened/13518128/	WRAL.com	t	d-kf0XmELVtg5SM6lSfO6FwtaFhPM	www.wral.com	1395956608366
52662	Wild Prairie Chicken Affects Energy Interests in Five States	http://www.latinpost.com/articles/9628/20140327/wild-prairie-chicken-affects-energy-interests-in-five-states.htm	Latin Post	t	d-kf0XmELVtg5SM6lSfO6FwtaFhPM	www.latinpost.com	1395956608592
52663	OK Governor Responds To Prairie Chicken Listed As Threatened	http://www.news9.com/story/25093882/prairie-chicken-listed-as-threatened	news9.com KWTV	t	d-kf0XmELVtg5SM6lSfO6FwtaFhPM	www.news9.com	1395956608810
52664	Lesser Prairie Chicken Is Listed as 'Threatened'	http://blogs.wsj.com/washwire/2014/03/27/lesser-prairie-chicken-is-listed-as-threatened/	Wall Street Journal \(blog\)	t	d-kf0XmELVtg5SM6lSfO6FwtaFhPM	blogs.wsj.com	1395956609003
52665	Prairie chicken to go on threatened list	http://www.abqjournal.com/375026/abqnewsseeker/375026.html	Albuquerque Journal	t	d-kf0XmELVtg5SM6lSfO6FwtaFhPM	www.abqjournal.com	1395956609194
52666	Obama Administration Puts Lesser Prairie Chicken on Threatened List	http://www.nbcdfw.com/news/local/Obama-Administration-Puts-Lesser-Prairie-Chicken-on-Threatened-List-252746481.html	NBC 5 Dallas-Fort Worth	t	d-kf0XmELVtg5SM6lSfO6FwtaFhPM	www.nbcdfw.com	1395956609491
52667	Obama places lesser prairie chicken on threatened species list, affecting Kansas	http://www.kansascity.com/2014/03/27/4919586/obama-places-lesser-prairie-chicken.html	Kansas City Star	t	d-kf0XmELVtg5SM6lSfO6FwtaFhPM	www.kansascity.com	1395956609776
52668	US proposes downlisting arroyo toad from endangered to threatened	http://www.latimes.com/science/sciencenow/la-sci-sn-endangered-arroyo-toad-20140327,0,7937905.story	Los Angeles Times	t	d-kf0XmELVtg5SM6lSfO6FwtaFhPM	www.latimes.com	1395956610002
52669	Prairie chicken listed as 'threatened'	http://www.upstreamonline.com/live/article1356705.ece	Upstream Online	t	d-kf0XmELVtg5SM6lSfO6FwtaFhPM	www.upstreamonline.com	1395956610256
52670	Prairie chicken listed as threatened by Obama administration	http://gazette.com/prairie-chicken-listed-as-threatened-by-obama-administration/article/1517202	Colorado Springs Gazette	t	d-kf0XmELVtg5SM6lSfO6FwtaFhPM	gazette.com	1395956610483
52671	Lesser prairie chickens placed on threatened species list	http://www.kansas.com/2014/03/27/3370862/lesser-prairie-chickens-placed.html	Kansas.com	t	d-kf0XmELVtg5SM6lSfO6FwtaFhPM	www.kansas.com	1395956610743
52672	Sen. Cornyn 'disappointed' by Obama's lesser prairie-chicken decision	http://amarillo.com/news/latest-news/2014-03-27/breaking-lesser-prairie-chicken-listed-threatened	Amarillo.com	t	d-kf0XmELVtg5SM6lSfO6FwtaFhPM	amarillo.com	1395956610927
52673	APNewsBreak: Lesser prairie chicken listed as threatened species, 5 states  ...	http://www.newser.com/article/aa96d6e29ac840158e4cc92711a177ea/apnewsbreak-lesser-prairie-chicken-listed-as-threatened-species-5-states-affected.html	Newser	t	d-kf0XmELVtg5SM6lSfO6FwtaFhPM	www.newser.com	1395956611129
52674	Moran, Brownback on listing of lesser prairie chicken as threatened species	http://www.hayspost.com/2014/03/27/moran-statement-on-listing-of-lesser-prairie-chicken-as-threatened-species/	hays Post	t	d-kf0XmELVtg5SM6lSfO6FwtaFhPM	www.hayspost.com	1395956611339
52675	US Fish and Wildlife Service lists lesser prairie chickens as threatened	http://blogs.kansas.com/outdoors/2014/03/27/u-s-fish-and-wildlife-service-lists-lesser-prairie-chickens-as-threatened/	Kansas.com \(blog\)	t	d-kf0XmELVtg5SM6lSfO6FwtaFhPM	blogs.kansas.com	1395956611531
52676	Cornyn Statement on Decision to List Lesser Prairie Chicken as Threatened	http://www.newschannel10.com/story/25093005/cornyn-statement-on-decision-to-list-lesser-prairie-chicken-as-threatened	KFDA	t	d-kf0XmELVtg5SM6lSfO6FwtaFhPM	www.newschannel10.com	1395956611758
52677	Lesser prairie chicken listed as threatened species	http://thehill.com/blogs/e2-wire/e2-wire/201979-lesser-prairie-chicken-listed-as-threatened-species	The Hill \(blog\)	t	d-kf0XmELVtg5SM6lSfO6FwtaFhPM	thehill.com	1395956611940
52678	Unprecedented Loopholes Undermine Endangered Species Act Protections for	http://www.biologicaldiversity.org/news/press_releases/2014/lesser-prairie-chicken-03-27-2014.html	Center for Biological Diversity \(press release\)	t	d-kf0XmELVtg5SM6lSfO6FwtaFhPM	www.biologicaldiversity.org	1395956612161
52679	Lesser prairie chicken declared threatened under Endangered Species Act by  ...	http://www.currentargus.com/carlsbad-news/ci_25433458/lesser-prairie-chicken-declared-threatened	Carlsbad Current Argus	t	d-kf0XmELVtg5SM6lSfO6FwtaFhPM	www.currentargus.com	1395956612343
52680	Feds give threatened status to prairie chicken	http://www.myfoxlubbock.com/news/local/story/Feds-give-threatened-status-to-prairie-chicken/5IJqW629gkus3MoBhVhZGw.cspx	MYfoxLUBBOCK.COM	t	d-kf0XmELVtg5SM6lSfO6FwtaFhPM	www.myfoxlubbock.com	1395956612606
52681	Prairie chicken listed as threatened; will impact Texas, Oklahoma, Kansas  ...	http://www.deseretnews.com/article/765650679/APNewsBreak-Prairie-chicken-listed-as-threatened.html	Deseret News	t	d-kf0XmELVtg5SM6lSfO6FwtaFhPM	www.deseretnews.com	1395956612850
52682	Lesser Prairie Chicken listed as threatened species, Inhofe aide says	http://newsok.com/lesser-prairie-chicken-listed-as-threatened-species-inhofe-aide-says/article/3947546	NewsOK.com	t	d-kf0XmELVtg5SM6lSfO6FwtaFhPM	newsok.com	1395956613160
52683	Obama is giving Putin a tough time but there's great news for the arroyo toad! Ah  ...	http://www.nydailynews.com/blogs/dc/obama-giving-putin-tough-time-great-news-arroyo-toad-ah-blog-entry-1.1736778	New York Daily News \(blog\)	t	d-kf0XmELVtg5SM6lSfO6FwtaFhPM	www.nydailynews.com	1395956613358
52684	State will meet in Hays to review threatened/endangered species	http://www.hayspost.com/2014/03/27/task-force-will-meet-in-hays-to-review-threatenedendangered-species/	hays Post	t	d-kf0XmELVtg5SM6lSfO6FwtaFhPM	www.hayspost.com	1395956613551
52685	US Wildlife officials conduct status reviews of 33 Southeastern species	http://www.greenfieldreporter.com/view/story/3e54911d88ae472184cb79139e410152/TN--Wildlife-Reviews	Greenfield Daily Reporter	t	d-kf0XmELVtg5SM6lSfO6FwtaFhPM	www.greenfieldreporter.com	1395956613790
52686	Feds propose to change protection for arroyo toad	http://www.mynews4.com/news/story/Feds-propose-to-change-protection-for-arroyo-toad/tBTvu9mqp0iibPlbPb5w6Q.cspx	KRNV My News 4	t	d-kf0XmELVtg5SM6lSfO6FwtaFhPM	www.mynews4.com	1395956613981
52687	Feds propose to change protection for arroyo toad from endangered to threatened	http://www.tribtown.com/view/story/ce539dbdff5449c29bb5bd4633ce84e2/CA--Arroyo-Toad	The Tribune	t	d-kf0XmELVtg5SM6lSfO6FwtaFhPM	www.tribtown.com	1395956614193
52688	PLF prompts Fish and Wildlife Service to downlist arroyo toad	http://blog.pacificlegal.org/2014/plf-prompts-fish-wildlife-service-downlist-arroyo-toad/\?utm_source=rss&amp;utm_medium=rss&amp;utm_campaign=plf-prompts-fish-wildlife-service-downlist-arroyo-toad	Pacific Legal Foundation \(PLF\) \(press release\) \(blog\)	t	d-kf0XmELVtg5SM6lSfO6FwtaFhPM	blog.pacificlegal.org	1395956614370
52689	Fish And Wildlife Service Conducts 5-Year Status Reviews Of 33 Southeastern  ...	http://www.chattanoogan.com/2014/3/25/272695/Fish-And-Wildlife-Service-Conducts.aspx	The Chattanoogan	t	d-kf0XmELVtg5SM6lSfO6FwtaFhPM	www.chattanoogan.com	1395956614640
52690	Apple iPhone 6 Release Date: Mobile Device Could Come in September	http://www.franchiseherald.com/articles/5453/20140327/apple-iphone-6-release-date-mobile-device-expected-to-launch-in-september.htm	Franchise Herald	t	dzkNak-6LbDsW4MeyxUY_D6VI-LuM	www.franchiseherald.com	1395956706686
52691	More Reports Tip Phablet-Sized iPhones	http://www.pcmag.com/article2/0,2817,2455563,00.asp	PC Magazine	t	dzkNak-6LbDsW4MeyxUY_D6VI-LuM	www.pcmag.com	1395956706841
52692	4.7-inch and 5.5-inch iPhone 6 Launching as Soon as September, Report Says	http://www.technobuffalo.com/2014/03/27/iphone-6-release-date-rumor/	TechnoBuffalo	t	dzkNak-6LbDsW4MeyxUY_D6VI-LuM	www.technobuffalo.com	1395956707093
52693	iPhone 6 launching in September, in two sizes according to latest rumor	http://www.todaysiphone.com/2014/03/iphone-6-launching-september-two-sizes-according-latest-rumor/	Today's iPhone	t	dzkNak-6LbDsW4MeyxUY_D6VI-LuM	www.todaysiphone.com	1395956707266
52694	Apple iPhone 6 release 'as early as September,' in two sizes -- report	http://www.cnet.com/news/apple-iphone-6-to-arrive-as-early-as-september-nikkei/	CNET	t	dzkNak-6LbDsW4MeyxUY_D6VI-LuM	www.cnet.com	1395956707488
52695	Apple to Release 4.7-inch and 5.5-inch iPhone 'As Early As September'	http://www.iclarified.com/39457/apple-to-release-47inch-and-55inch-iphone-as-early-as-september	iClarified	t	dzkNak-6LbDsW4MeyxUY_D6VI-LuM	www.iclarified.com	1395956707932
52696	iPhone 6 Release Date Possibly In September With 2 Sizes	http://www.valuewalk.com/2014/03/iphone-6-release-date-with-2-size/	ValueWalk	t	dzkNak-6LbDsW4MeyxUY_D6VI-LuM	www.valuewalk.com	1395956708138
52697	Japanese newspaper repeats persistent 'iPhone 6' rumors: 2 screen sizes, Sept  ...	http://appleinsider.com/articles/14/03/27/japanese-newspaper-repeats-persistent-iphone-6-rumors-2-screen-sizes-sept-launch	Apple Insider	t	dzkNak-6LbDsW4MeyxUY_D6VI-LuM	appleinsider.com	1395956708335
52698	New iPhones Being Released This September [Report]	http://www.ubergizmo.com/2014/03/new-iphones-being-released-this-september-report/	Ubergizmo	t	dzkNak-6LbDsW4MeyxUY_D6VI-LuM	www.ubergizmo.com	1395956708670
52699	New Report Claims Apple (AAPL) to Launch iPhone 6 As Early As September	http://wallstreetpit.com/103169-new-report-claims-apple-aapl-to-launch-iphone-6-as-early-as-september/	Wall Street Pit	t	dzkNak-6LbDsW4MeyxUY_D6VI-LuM	wallstreetpit.com	1395956709034
52700	Apple Releasing Larger iPhones Because of Donald Trump, Trump Believes	http://www.minyanville.com/sectors/technology/articles/Apple-Releasing-Larger-iPhones-Because-of/3/27/2014/id/54361	Minyanville.com	t	dzkNak-6LbDsW4MeyxUY_D6VI-LuM	www.minyanville.com	1395956709253
