93601	Weather Channel back on DirecTV after three-month drought	http://www.dailynews.com/business/20140408/weather-channel-back-on-directv-after-three-month-drought	Los Angeles Daily News	e	dq0_OpA5qfPkX-MjyHRxAGnjJrTWM	www.dailynews.com	1396996993540
93602	The Weather Channel to return to DirecTV, promises to concentrate more on  ...	http://www.syracuse.com/news/index.ssf/2014/04/the_weather_channel_to_return_to_directv_promises_to_concentrate_more_on_weather.html	The Post-Standard	e	dq0_OpA5qfPkX-MjyHRxAGnjJrTWM	www.syracuse.com	1396996994002
93603	The Weather Channel back on DirecTV April 9 after three-month dispute	http://radiotvtalk.blog.ajc.com/2014/04/08/weather-channel-back-on-directv-april-9-after-three-month-dispute/	Atlanta Journal Constitution \(blog\)	e	dq0_OpA5qfPkX-MjyHRxAGnjJrTWM	radiotvtalk.blog.ajc.com	1396996994204
93604	HBO's 'Game of Thrones' renewed for 2 more seasons	http://www.postbulletin.com/entertainment/tv/hbo-s-game-of-thrones-renewed-for-more-seasons/article_02830c42-9bec-59fc-a14d-3774b7b416f5.html	Post-Bulletin	e	dq0_OpA5qfPkX-MjyHRxAGnjJrTWM	www.postbulletin.com	1396996994512
93605	The Weather Channel to return to DirecTV	http://www.inforum.com/event/article/id/431551/group/homepage/	In-Forum	e	dq0_OpA5qfPkX-MjyHRxAGnjJrTWM	www.inforum.com	1396996994882
93606	Weather Channel Cuts Reality Shows, Adds More Weather News	http://www.huffingtonpost.com/2014/04/08/weather-channel-reality-shows-directv-deal_n_5112847.html	Huffington Post	e	dq0_OpA5qfPkX-MjyHRxAGnjJrTWM	www.huffingtonpost.com	1396996995091
93607	Weather Channel returning to DirecTV after two sides reach deal	http://thecelebritycafe.com/feature/2014/04/weather-channel-returning-directv-after-two-sides-reach-deal	TheCelebrityCafe.com	e	dq0_OpA5qfPkX-MjyHRxAGnjJrTWM	thecelebritycafe.com	1396996995316
93608	Weather Channel to Return to DirecTV, With Fewer Reality TV Shows For All	http://www.mediabistro.com/tvnewser/weather-channel-to-return-to-directv_b220756	mediabistro.com	e	dq0_OpA5qfPkX-MjyHRxAGnjJrTWM	www.mediabistro.com	1396996995519
93609	Why DirecTV (DTV) Stock Is Higher On Tuesday	http://www.thestreet.com/story/12633375/1/why-directv-dtv-stock-is-higher-on-tuesday.html	TheStreet.com	e	dq0_OpA5qfPkX-MjyHRxAGnjJrTWM	www.thestreet.com	1396996995901
93610	The Weather Channel returning to DirecTV	http://insidetv.ew.com/2014/04/08/the-weather-channel-returning-to-directv/	Entertainment Weekly	e	dq0_OpA5qfPkX-MjyHRxAGnjJrTWM	insidetv.ew.com	1396996996110
93611	DIRECTV, WeatherNation Ink Deal	http://www.zacks.com/stock/news/129119/directv-weathernation-ink-deal	Zacks.com	e	dq0_OpA5qfPkX-MjyHRxAGnjJrTWM	www.zacks.com	1396996996475
93612	Weather Channel Revamps Schedule to Get Back on DirecTV	http://adage.com/article/media/weather-channel-revamps-schedule-directv-deal/292553/	AdAge.com	e	dq0_OpA5qfPkX-MjyHRxAGnjJrTWM	adage.com	1396996996717
93613	The Weather Channel Returns to DIRECTV	http://tvbythenumbers.zap2it.com/2014/04/08/the-weather-channel-returns-to-directv/252392/	TVbytheNumbers	e	dq0_OpA5qfPkX-MjyHRxAGnjJrTWM	tvbythenumbers.zap2it.com	1396996996945
93614	DirecTV Reaches Deal with Weather Channel--2nd Update	http://www.nasdaq.com/article/directv-reaches-deal-with-weather-channel2nd-update-20140408-00971	NASDAQ	e	dq0_OpA5qfPkX-MjyHRxAGnjJrTWM	www.nasdaq.com	1396996997146
93615	US tells Iran that UN envoy pick is 'not viable'	http://www.postbulletin.com/news/politics/us-tells-iran-that-un-envoy-pick-is-not-viable/article_ce681644-db57-57b8-93f9-9cc9538f61c5.html	Post-Bulletin	e	dq0_OpA5qfPkX-MjyHRxAGnjJrTWM	www.postbulletin.com	1396996997388
93616	DirecTV Close to Deal with Weather Channel--Update	http://www.nasdaq.com/article/directv-close-to-deal-with-weather-channelupdate-20140408-00939	NASDAQ	e	dq0_OpA5qfPkX-MjyHRxAGnjJrTWM	www.nasdaq.com	1396996997632
93617	Eldridge files 6000 signatures for Congress run	http://poststar.com/news/state-and-regional/eldridge-files-signatures-for-congress-run/article_f13feb01-5c91-52de-9359-3cd145cf9ed0.html	Glens Falls Post-Star	e	dq0_OpA5qfPkX-MjyHRxAGnjJrTWM	poststar.com	1396996998021
93618	'Beyond pain': Peaches Geldof, Paula Yates and one family's epic suffering	http://www.theguardian.com/culture/2014/apr/08/peaches-geldof-paula-yates-mythic-suffering	The Guardian	e	dVcLyu7MZ2lvOuM8psiqi0ay7A2GM	www.theguardian.com	1396997374882
93619	Peaches Geldof, daughter of Bob Geldof and Paula Yates, dies at 25	http://www.straight.com/blogra/621131/peaches-geldof-daughter-bob-geldof-and-paula-yates-dies-25	Straight.com \(blog\)	e	dVcLyu7MZ2lvOuM8psiqi0ay7A2GM	www.straight.com	1396997375109
93620	Peaches Geldof's last-ever column hits the news stands 24 hours after her tragic  ...	http://www.ok.co.uk/celebrity-news/peaches-geldof-final-words-published	OK\! Magazine	e	dVcLyu7MZ2lvOuM8psiqi0ay7A2GM	www.ok.co.uk	1396997375325
93621	Post-mortem set for Geldof's daughter	http://entertainment.msn.co.nz/article.aspx\?id=8827121	MSN NZ News	e	dVcLyu7MZ2lvOuM8psiqi0ay7A2GM	entertainment.msn.co.nz	1396997375643
93622	Peaches Geldof Death: Pixie Geldof Arrives At Her Father Sir Bob's House In  ...	http://www.entertainmentwise.com/news/146036/Peaches-Geldof-Death-Pixie-Geldof-Arrives-At-Her-Father-Sir-Bobs-House-In-Battersea-Following-Death-Of-Sister	Entertainmentwise	e	dVcLyu7MZ2lvOuM8psiqi0ay7A2GM	www.entertainmentwise.com	1396997375869
93623	Geldof post-mortem examination set for tomorrow	http://www.rte.ie/news/2014/0408/607476-peaches-geldof-post-mortem-in-next-few-days/	RTE.ie	e	dVcLyu7MZ2lvOuM8psiqi0ay7A2GM	www.rte.ie	1396997376220
93624	UK police probing unexplained Peaches Geldof death	http://www.news-sentinel.com/apps/pbcs.dll/article\?AID=/20140408/ENT/140409723/1009/LIVING	News Sentinel	e	dVcLyu7MZ2lvOuM8psiqi0ay7A2GM	www.news-sentinel.com	1396997376439
93625	Peaches Geldof: Writer and TV presenter dies aged 25	http://www.bbc.co.uk/news/uk-26931337	BBC News	e	dVcLyu7MZ2lvOuM8psiqi0ay7A2GM	www.bbc.co.uk	1396997376648
93626	Tiger Lily must deal with her tragic past without the support of her loving half  ...	http://www.smh.com.au/lifestyle/celebrity/tiger-lily-must-deal-with-her-tragic-past-without-the-support-of-her-loving-halfsister-peaches-20140409-36bpb.html	Sydney Morning Herald	e	dVcLyu7MZ2lvOuM8psiqi0ay7A2GM	www.smh.com.au	1396997376842
93627	Peaches post-mortem date set	http://www.belfasttelegraph.co.uk/entertainment/news/peaches-postmortem-date-set-30167103.html	Belfast Telegraph	e	dVcLyu7MZ2lvOuM8psiqi0ay7A2GM	www.belfasttelegraph.co.uk	1396997377119
93628	Peaches Geldof post-mortem date set	http://www.crosbyherald.co.uk/news/uk-world-news/2014/04/08/peaches-geldof-post-mortem-date-set-68459-34478633/	Crosby Herald	e	dVcLyu7MZ2lvOuM8psiqi0ay7A2GM	www.crosbyherald.co.uk	1396997377329
93629	Sister's tribute to Peaches Geldof	http://www.crosbyherald.co.uk/news/uk-world-news/2014/04/08/sister-s-tribute-to-peaches-geldof-68459-34478408/	Crosby Herald	e	dVcLyu7MZ2lvOuM8psiqi0ay7A2GM	www.crosbyherald.co.uk	1396997377563
93630	Peaches Geldof remembered by sister Fifi: 'You're gone but not forgotten'	http://www.digitalspy.com/celebrity/news/a563278/peaches-geldof-remembered-by-sister-fifi-youre-gone-but-not-forgotten.html	Digital Spy	e	dVcLyu7MZ2lvOuM8psiqi0ay7A2GM	www.digitalspy.com	1396997377773
93631	Peaches Geldof: her Telegraph columns	http://www.telegraph.co.uk/culture/culturenews/10751712/Peaches-Geldof-her-Telegraph-columns.html	Telegraph.co.uk	e	dVcLyu7MZ2lvOuM8psiqi0ay7A2GM	www.telegraph.co.uk	1396997378049
93632	Peaches Geldof Dead — Model Dies At 25	http://hollywoodlife.com/2014/04/07/peaches-geldof-dead-model-dies-25/	Hollywood Life	e	dVcLyu7MZ2lvOuM8psiqi0ay7A2GM	hollywoodlife.com	1396997378214
93633	Peaches Geldof Death: Father, Husband, Sister "Beyond Pain"	http://www.thehollywoodgossip.com/2014/04/peaches-geldof-death-father-husband-beyond-pain/	The Hollywood Gossip	e	dVcLyu7MZ2lvOuM8psiqi0ay7A2GM	www.thehollywoodgossip.com	1396997378407
93634	Fifi pays tribute to 'beautiful' sister Peaches Geldof	http://www.independent.ie/woman/celeb-news/fifi-pays-tribute-to-beautiful-sister-peaches-geldof-30166826.html	Irish Independent	e	dVcLyu7MZ2lvOuM8psiqi0ay7A2GM	www.independent.ie	1396997378592
93635	Peaches' death 'sudden' and 'unexplained'	http://media.watoday.com.au/entertainment/entertainment-news/peaches-death-sudden-and-unexplained-5331210.html	WA today	e	dVcLyu7MZ2lvOuM8psiqi0ay7A2GM	media.watoday.com.au	1396997378897
93636	10 things to know for today	http://www.rrstar.com/article/20140408/NEWS/140409401	Rockford Register Star	e	dVcLyu7MZ2lvOuM8psiqi0ay7A2GM	www.rrstar.com	1396997379242
93637	Peaches Geldof Posted Photos Of Her Sons In Just 19 Minutes Before Dying	http://hollywoodlife.com/2014/04/08/peaches-geldof-sons-photos-instagram-before-death/	Hollybaby	e	dVcLyu7MZ2lvOuM8psiqi0ay7A2GM	hollywoodlife.com	1396997379466
93638	Peaches Geldof death: Police probing shocking unexplained case	http://www.financialexpress.com/news/peaches-geldof-death-police-probing-shocking-unexplained-case/1239300	Financial Express	e	dVcLyu7MZ2lvOuM8psiqi0ay7A2GM	www.financialexpress.com	1396997379749
93639	Fifi Geldof Memorializes Her 'Beautiful Baby Sister' Peaches Geldof	http://abcnews.go.com/Entertainment/fifi-geldof-memorializes-beautiful-baby-sister-peaches-geldof/story\?id=23236271	ABC News	e	dVcLyu7MZ2lvOuM8psiqi0ay7A2GM	abcnews.go.com	1396997380067
93640	Peaches at 20 on life, love and careers	http://www.bbc.co.uk/news/entertainment-arts-26924433	BBC News	e	dVcLyu7MZ2lvOuM8psiqi0ay7A2GM	www.bbc.co.uk	1396997380269
93641	Peaches Geldof dead: 'Sick' eBay users sell her dresses just minutes after death	https://uk.news.yahoo.com/peaches-geldof-dies-sellers-on-ebay-cash-in-on-death-094339681.html	Yahoo News UK	e	dVcLyu7MZ2lvOuM8psiqi0ay7A2GM	uk.news.yahoo.com	1396997380483
93642	Peaches Geldof, daughter of Live Aid concert organizer Bob Geldof, dies  ...	http://www.leaderpost.com/entertainment/Peaches+Geldof+daughter+entertainer+Geldof+dies/9710046/story.html	Regina Leader-Post	e	dVcLyu7MZ2lvOuM8psiqi0ay7A2GM	www.leaderpost.com	1396997380717
93643	UK police investigating 'sudden, unexplained' death of media personality  ...	http://www.windsorstar.com/entertainment/police+investigating+sudden+unexplained+death+media+personality/9713246/story.html	Windsor Star	e	dVcLyu7MZ2lvOuM8psiqi0ay7A2GM	www.windsorstar.com	1396997380915
93644	Peaches post mortem 'in few days'	http://www.thisislancashire.co.uk/leisure/showbiz/11133480.Peaches_post_mortem__in_few_days_/	This Is Lancashire	e	dVcLyu7MZ2lvOuM8psiqi0ay7A2GM	www.thisislancashire.co.uk	1396997381247
93645	Stars around the world pay tribute to tragic Peaches Geldof	http://www.independent.ie/woman/celeb-news/international-stars-pay-tribute-to-peaches-geldof-who-died-at-25-30164426.html	Irish Independent	e	dVcLyu7MZ2lvOuM8psiqi0ay7A2GM	www.independent.ie	1396997381596
93646	Peaches Geldof Dead at Age 25	http://newsok.com/peaches-geldof-dead-at-age-25/article/3953036	NewsOK.com	e	dVcLyu7MZ2lvOuM8psiqi0ay7A2GM	newsok.com	1396997381816
93647	Peaches Geldof Found Dead at Age 25	http://www.fashiontimes.com/articles/4636/20140407/peaches-geldof-found-dead-age-25.htm	Fashion Times	e	dVcLyu7MZ2lvOuM8psiqi0ay7A2GM	www.fashiontimes.com	1396997382118
93648	Who Was Peaches Geldof? Daughter of Music Legend Bob Geldof Dead at 25	http://www.latinpost.com/articles/10195/20140407/who-was-peaches-geldof-daughter-of-music-legend-bob-geldof-dead-at-25.htm	Latin Post	e	dVcLyu7MZ2lvOuM8psiqi0ay7A2GM	www.latinpost.com	1396997382429
93649	Peaches Geldof death: Family 'beyond pain'	http://www.bbc.co.uk/news/uk-26934007	BBC News	e	dVcLyu7MZ2lvOuM8psiqi0ay7A2GM	www.bbc.co.uk	1396997382646
93650	Peaches Geldof's big sister Fifi posts poignant tribute	http://www.parentdish.co.uk/2014/04/08/fifi-geldof-pays-touching-tribute-to-sister-peaches/	Parentdish	e	dVcLyu7MZ2lvOuM8psiqi0ay7A2GM	www.parentdish.co.uk	1396997382845
93651	Peaches Geldof post-mortem tomorrow	http://www.expressandstar.com/news/uk-news/2014/04/08/geldof-family-beyond-pain/	expressandstar.com	e	dVcLyu7MZ2lvOuM8psiqi0ay7A2GM	www.expressandstar.com	1396997383132
93652	Peaches Geldof's death still surrounded by mystery	http://www.thestar.com/entertainment/2014/04/08/peaches_geldofs_death_still_surrounded_by_mystery.html	Toronto Star	e	dVcLyu7MZ2lvOuM8psiqi0ay7A2GM	www.thestar.com	1396997383325
93653	Peaches Geldof's Juice Diet Death Due To Starvation - Extreme Weight Loss  ...	http://www.celebdirtylaundry.com/2014/peaches-geldof-death-cardiac-arrest-starvation-juice-dieting-diet-weight-loss/	Celebrity Dirty Laundry	e	dVcLyu7MZ2lvOuM8psiqi0ay7A2GM	www.celebdirtylaundry.com	1396997383544
93654	Peaches Geldof: Last tweet was pic with late mum Paula Yates	http://www.belfasttelegraph.co.uk/news/local-national/uk/peaches-geldof-last-tweet-was-pic-with-late-mum-paula-yates-30166631.html	Belfast Telegraph	e	dVcLyu7MZ2lvOuM8psiqi0ay7A2GM	www.belfasttelegraph.co.uk	1396997383863
93655	UK police investigating 'sudden, unexplained' death of Peaches Geldof	http://www.tbnewswatch.com/entertainment/332843/UK-police-investigating-&#39;sudden,-unexplained&#39;-death-of-Peaches-Geldof	TbNewsWatch.com	e	dVcLyu7MZ2lvOuM8psiqi0ay7A2GM	www.tbnewswatch.com	1396997384157
93656	Fifi Geldof pays tribute to sister Peaches	http://blog.chron.com/celebritybuzz/2014/04/fifi-geldof-pays-tribute-to-sister-peaches/\?cmpid=staffblogshcat	Chron.com \(blog\)	e	dVcLyu7MZ2lvOuM8psiqi0ay7A2GM	blog.chron.com	1396997384366
93657	Peaches Geldof Found Dead at 25	http://millis.wickedlocal.com/article/20140407/NEWS/304079942/2052/ENTERTAINMENT	Wicked Local Millis	e	dVcLyu7MZ2lvOuM8psiqi0ay7A2GM	millis.wickedlocal.com	1396997384684
93658	One Of Peaches Geldof's Last Interviews Will Break Your Heart As She Shares  ...	http://perezhilton.com/2014-04-08-peaches-geldof-interview-last-wanted-to-make-sons-proud	PerezHilton.com	e	dVcLyu7MZ2lvOuM8psiqi0ay7A2GM	perezhilton.com	1396997384886
93659	Lindsay Lohan Hopped Off the Wagon Just That Once, No Big Deal	http://www.thewire.com/entertainment/2014/04/lindsay-lohan-hopped-off-the-wagon-just-that-once-no-big-deal/360314/	The Wire	e	dVcLyu7MZ2lvOuM8psiqi0ay7A2GM	www.thewire.com	1396997385337
93660	Peaches Geldof was captivating company, and like any tragic death, hers makes  ...	http://www.independent.co.uk/voices/comment/peaches-geldof-was-captivating-company-and-like-any-tragic-death-hers-makes-you-cling-all-the-more-tenaciously-to-what-you-hold-precious-9246357.html	The Independent	e	dVcLyu7MZ2lvOuM8psiqi0ay7A2GM	www.independent.co.uk	1396997385673
93661	Peaches Geldof: "Life is good, and being a mum is the best part of it"	http://www.heatworld.com/Celeb-News/2014/04/Peaches-Geldof-Life-is-good-and-being-a-mum-is-the-best-part-of-it/	heatworld	e	dVcLyu7MZ2lvOuM8psiqi0ay7A2GM	www.heatworld.com	1396997385962
93662	Peaches Geldof: Examining the sadness that can come from wealth	http://www.theglobeandmail.com/life/celebrity-news/peaches-geldof-examining-the-sadness-that-can-come-from-wealth/article17875879/	The Globe and Mail	e	dVcLyu7MZ2lvOuM8psiqi0ay7A2GM	www.theglobeandmail.com	1396997386226
93663	A community's tribute to Peaches Geldof	http://www.itv.com/news/meridian/update/2014-04-08/a-communitys-tribute-to-peaches-geldof/	ITV News	e	dVcLyu7MZ2lvOuM8psiqi0ay7A2GM	www.itv.com	1396997386659
93664	Pixie arrives at father Bob Geldof's home as family mourn the tragic death of  ...	http://www.mirror.co.uk/3am/celebrity-news/pixie-arrives-father-bob-geldofs-3389536	Mirror.co.uk	e	dVcLyu7MZ2lvOuM8psiqi0ay7A2GM	www.mirror.co.uk	1396997386976
93665	Post-mortem Wednesday for Geldof's daughter Peaches	http://www.theborneopost.com/2014/04/09/post-mortem-wednesday-for-geldofs-daughter-peaches/	The Borneo Post	e	dVcLyu7MZ2lvOuM8psiqi0ay7A2GM	www.theborneopost.com	1396997387323
93666	Peaches Geldof remembered by younger sister Fifi Geldof, autopsy scheduled  ...	http://thecelebritycafe.com/feature/2014/04/peaches-geldof-remembered-younger-sister-fifi-geldof-autopsy-scheduled-wednesday	TheCelebrityCafe.com	e	dVcLyu7MZ2lvOuM8psiqi0ay7A2GM	thecelebritycafe.com	1396997387681
93667	Peaches Geldof remembered by sister Fifi Geldof, autopsy Wednesday	http://www.nydailynews.com/entertainment/gossip/peaches-geldof-remembered-sister-fifi-geldof-article-1.1749473	New York Daily News	e	dVcLyu7MZ2lvOuM8psiqi0ay7A2GM	www.nydailynews.com	1396997387868
93668	Peaches Geldof dies at the age of 25	http://www.dailystar.co.uk/news/latest-news/373319/Peaches-Geldof-dies-at-the-age-of-25	Daily Star	e	dVcLyu7MZ2lvOuM8psiqi0ay7A2GM	www.dailystar.co.uk	1396997388069
93669	Prayers for Peaches Geldof and Sir Bob in Davington Church	http://www.canterburytimes.co.uk/Prayers-Peaches-Davington-Church/story-20929175-detail/story.html	Canterbury Times	e	dVcLyu7MZ2lvOuM8psiqi0ay7A2GM	www.canterburytimes.co.uk	1396997388425
93670	Peaches Geldof tributes: Sinead O'Connor, President Higgins and Holly  ...	http://www.belfasttelegraph.co.uk/news/local-national/uk/peaches-geldof-tributes-sinead-oconnor-president-higgins-and-holly-willoughby-join-chorus-of-condolences-30166799.html	Belfast Telegraph	e	dVcLyu7MZ2lvOuM8psiqi0ay7A2GM	www.belfasttelegraph.co.uk	1396997388698
93671	Peaches Geldof Death Still a Mystery, Family Reacts	http://newsok.com/peaches-geldof-death-still-a-mystery-family-reacts/article/feed/671419	NewsOK.com	e	dVcLyu7MZ2lvOuM8psiqi0ay7A2GM	newsok.com	1396997388916
93672	Midge Ure speaks of 'disbelief and horror' following death of Peaches Geldof	http://www.bathchronicle.co.uk/Midge-Ure-s-heartfelt-Tweet-following-death/story-20928139-detail/story.html	Bath Chronicle	e	dVcLyu7MZ2lvOuM8psiqi0ay7A2GM	www.bathchronicle.co.uk	1396997389084
93673	Peaches Geldof Was Desperate For a Daughter	http://www.showbizspy.com/article/270426/peaches-geldof-was-desperate-for-a-daughter.html	Showbiz Spy	e	dVcLyu7MZ2lvOuM8psiqi0ay7A2GM	www.showbizspy.com	1396997389294
93674	Peaches Geldof Dies at 25: Police Find No Drugs or Suicide Note at the Scene	http://www.latinospost.com/articles/35757/20140408/peaches-geldof-dies-at-25-police-did-not-find-drugs-or-suicide-note-at-the-scene.htm	Latinos Post	e	dVcLyu7MZ2lvOuM8psiqi0ay7A2GM	www.latinospost.com	1396997389488
93675	British police probing Peaches Geldof's death	http://www.3news.co.nz/British-police-probing-Peaches-Geldofs-death/tabid/418/articleID/339335/Default.aspx	3News NZ	e	dVcLyu7MZ2lvOuM8psiqi0ay7A2GM	www.3news.co.nz	1396997389855
93676	Peaches Geldof was 'sweet and deeply intellectual'	http://www.telegraph.co.uk/news/newsvideo/celebrity-news-video/10752557/Peaches-Geldof-was-sweet-and-deeply-intellectual.html	Telegraph.co.uk	e	dVcLyu7MZ2lvOuM8psiqi0ay7A2GM	www.telegraph.co.uk	1396997390056
93677	Peaches Geldof's Mystery Death: New Theory Offers Clues	http://www.extratv.com/2014/04/08/peaches-geldof-s-mystery-death-theory-offers-clues-about-extreme-juicing-diet/	Extra	e	dVcLyu7MZ2lvOuM8psiqi0ay7A2GM	www.extratv.com	1396997390242
93678	Peaches Geldof's Sister Posts Heartbreaking Tribute On Instagram	http://hollywoodlife.com/2014/04/08/fifi-geldof-peaches-geldof-tribute-pic-death-sister/	Hollywood Life	e	dVcLyu7MZ2lvOuM8psiqi0ay7A2GM	hollywoodlife.com	1396997390452
93679	'RIP Peaches Geldof': Police Probing Unexplained Death	http://www.theepochtimes.com/n3/608756-rip-peaches-geldof-police-probing-unexplained-death/	The Epoch Times	e	dVcLyu7MZ2lvOuM8psiqi0ay7A2GM	www.theepochtimes.com	1396997390787
93680	Peaches Geldof's Post-Mortem Date Announced To Confirm Cause Of Death	https://uk.celebrity.yahoo.com/gossip/omg/peaches-geldof-post-mortem-date-announced-confirm-cause-of-death-163146891.html	Yahoo Celebrity UK	e	dVcLyu7MZ2lvOuM8psiqi0ay7A2GM	uk.celebrity.yahoo.com	1396997391022
93681	Peaches Geldof - Police didn't find suicide note from Peaches Geldolf	http://www.contactmusic.com/story/police-didn-t-find-suicide-note-from-peaches-geldolf_4144616	Contactmusic.com	e	dVcLyu7MZ2lvOuM8psiqi0ay7A2GM	www.contactmusic.com	1396997391231
93682	Peaches Geldof Looked Thin in One of Her Final Appearances	http://www.tmz.com/2014/04/08/peaches-geldof-final-video/	TMZ.com	e	dVcLyu7MZ2lvOuM8psiqi0ay7A2GM	www.tmz.com	1396997391422
93683	Peaches Geldof Dies at 25	http://www.tvweek.com/blogs/tvbizwire/2014/04/peaches-geldof-dies-at-25.php	Television Week \(blog\)	e	dVcLyu7MZ2lvOuM8psiqi0ay7A2GM	www.tvweek.com	1396997391760
93684	Tributes pour in as cops probe Peaches's death	http://www.bangaloremirror.com/news/world/Tributes-pour-in-as-cops-probe-Peachess-death/articleshow/33461301.cms	Bangalore Mirror	e	dVcLyu7MZ2lvOuM8psiqi0ay7A2GM	www.bangaloremirror.com	1396997391952
93685	Police didn't find suicide note from Peaches Geldolf	http://www.azcentral.com/story/entertainment/people/2014/04/08/police-didnt-find-suicide-note-from-peaches-geldolf/7463467/	azcentral.com	e	dVcLyu7MZ2lvOuM8psiqi0ay7A2GM	www.azcentral.com	1396997392154
93686	Updated: Peaches Geldof dies, aged 25	http://www.digitalspy.com/celebrity/news/a563004/peaches-geldof-dies-aged-25.html	Digital Spy	e	dVcLyu7MZ2lvOuM8psiqi0ay7A2GM	www.digitalspy.com	1396997392347
93687	Peaches Geldof's Heartbreaking Final Interview: I Am Not Going To Let My  ...	https://ca.celebrity.yahoo.com/blogs/celebrity-news/peaches-geldof-s-heartbreaking-final-interview--i-am-not-going-to-let-my-children-down-163339422.html	OMG\! Canada \(blog\)	e	dVcLyu7MZ2lvOuM8psiqi0ay7A2GM	ca.celebrity.yahoo.com	1396997392933
93688	Get UK Newsletters:	http://www.huffingtonpost.co.uk/2014/04/08/peaches-geldof-metro-anger_n_5108898.html	Huffington Post UK	e	dVcLyu7MZ2lvOuM8psiqi0ay7A2GM	www.huffingtonpost.co.uk	1396997393176
93689	Peaches Geldof Dead: Post-Mortem To Take Place On Wednesday	http://www.huffingtonpost.co.uk/2014/04/08/peaches-geldof_n_5111799.html\?utm_hp_ref=uk	Huffington Post UK	e	dVcLyu7MZ2lvOuM8psiqi0ay7A2GM	www.huffingtonpost.co.uk	1396997393628
93690	Nude Photos, Rumors Circulate After Peaches Geldof Death	http://socialnewsdaily.com/34731/nude-photos-rumors-circulate-after-peaches-geldof-death/	Social News Daily	e	dVcLyu7MZ2lvOuM8psiqi0ay7A2GM	socialnewsdaily.com	1396997393861
93691	Peaches Geldof's haunting final column: 'I had the perfect life. It was and is bliss'	http://metro.co.uk/2014/04/08/peaches-geldofs-haunting-final-column-i-had-the-perfect-life-it-was-and-is-bliss-4692579/\?ITO=news-sitemap	Metro	e	dVcLyu7MZ2lvOuM8psiqi0ay7A2GM	metro.co.uk	1396997394067
93692	Coroner to perform Peaches Geldof post mortem tomorrow	http://www.breakingnews.ie/world/coroner-to-perform-peaches-geldof-post-mortem-tomorrow-627320.html	BreakingNews.ie	e	dVcLyu7MZ2lvOuM8psiqi0ay7A2GM	www.breakingnews.ie	1396997394256
93693	Details of Peaches Geldof's final interview	http://jam.canoe.ca/Celebrities/2014/04/08/21589546-wenn-story.html\?cid=rssentertainment	CANOE	e	dVcLyu7MZ2lvOuM8psiqi0ay7A2GM	jam.canoe.ca	1396997394860
93694	Peaches Geldof's Big Sister Fifi Posts Heart-Breaking Tribute Message	https://ca.celebrity.yahoo.com/blogs/celebrity-news/peaches-geldof-s-big-sister-fifi-posts-heart-breaking-tribute-message-162002930.html	OMG\! Canada \(blog\)	e	dVcLyu7MZ2lvOuM8psiqi0ay7A2GM	ca.celebrity.yahoo.com	1396997395078
93695	Peaches Geldof Cause Of Death: Could Dangerous Diet Be To Blame?	http://www.huffingtonpost.ca/2014/04/08/peaches-geldof-cause-of-death_n_5111066.html	Huffington Post Canada	e	dVcLyu7MZ2lvOuM8psiqi0ay7A2GM	www.huffingtonpost.ca	1396997395287
93696	Peaches wrote of exhaustion and increasing interest in paranormal	http://www.thetimes.co.uk/tto/news/uk/article4057819.ece	The Times \(subscription\)	e	dVcLyu7MZ2lvOuM8psiqi0ay7A2GM	www.thetimes.co.uk	1396997395686
93697	Peaches Geldof's death: post-mortem to take place Wednesday, 9 April	http://www.reveal.co.uk/real-life-stories/news/a563366/peaches-geldofs-death-post-mortem-to-take-place-wednesday-9-april.html	Reveal	e	dVcLyu7MZ2lvOuM8psiqi0ay7A2GM	www.reveal.co.uk	1396997395994
93698	Peaches Geldof Dead at 25	http://www.showbizspy.com/article/270322/peaches-geldof-dead-at-25.html	Showbiz Spy	e	dVcLyu7MZ2lvOuM8psiqi0ay7A2GM	www.showbizspy.com	1396997396180
93699	Peaches Geldof Remembered By Lily Allen, Sharon Osbourne, Ellie Goulding  ...	http://www.popstoptv.com/celebrity-411/peaches-geldof-remembered-lily-allen-sharon-osbourne-ellie-goulding-34747.html	PopStop TV	e	dVcLyu7MZ2lvOuM8psiqi0ay7A2GM	www.popstoptv.com	1396997396356
93700	Simon Cowell and Sharon Osbourne join the growing number of celebrities to  ...	http://www.ok.co.uk/celebrity-news/lily-allen-ellie-goulding-tribute-peaches-geldof-tragic-death	OK\! Magazine	e	dVcLyu7MZ2lvOuM8psiqi0ay7A2GM	www.ok.co.uk	1396997396596
