167701	Driverless cars are mastering city streets: Google	http://www.deccanchronicle.com/140429/technology-latest/article/driverless-cars-are-mastering-city-streets-google	Deccan Chronicle	t	dFhGhx4AH67_c7MxkJlxvmftdXvTM	www.deccanchronicle.com	1398783336283
167702	Google says driverless cars are mastering city streets	http://www.herald-dispatch.com/business/x571851448/Google-says-driverless-cars-are-mastering-city-streets	Huntington Herald Dispatch	t	dFhGhx4AH67_c7MxkJlxvmftdXvTM	www.herald-dispatch.com	1398783336511
167703	Google's driverless cars mastering city streets	http://www.theleafchronicle.com/viewart/20140428/NEWS01/304280034/Google-s-driverless-cars-mastering-city-streets	Clarksville Leaf Chronicle	t	dFhGhx4AH67_c7MxkJlxvmftdXvTM	www.theleafchronicle.com	1398783336881
167704	Google's autonomous cars moving closer to reality (VIDEO)	http://www.themalaymailonline.com/drive/article/googles-autonomous-cars-moving-closer-to-reality	The Malay Mail Online	t	dFhGhx4AH67_c7MxkJlxvmftdXvTM	www.themalaymailonline.com	1398783337147
167705	Google's self-driving cars are trying to master the streets: some things you  ...	http://www.thebitbag.com/googles-self-driving-cars-are-trying-to-master-the-streets-some-things-you-should-know/74716	Bitbag	t	dFhGhx4AH67_c7MxkJlxvmftdXvTM	www.thebitbag.com	1398783337384
167706	Google's self-driving cars learning to master city streets	http://www.japantimes.co.jp/news/2014/04/29/business/tech/googles-self-driving-cars-learning-to-master-city-streets/	The Japan Times	t	dFhGhx4AH67_c7MxkJlxvmftdXvTM	www.japantimes.co.jp	1398783337708
167707	Google says self-driving car tests now focused on city driving	http://in.reuters.com/article/2014/04/28/us-google-autos-idINKBN0DE1T520140428	Reuters India	t	dFhGhx4AH67_c7MxkJlxvmftdXvTM	in.reuters.com	1398783338094
167708	Google says driverless cars nearly street-ready	http://www.houstonchronicle.com/business/technology/article/Google-says-driverless-cars-nearly-street-ready-5436845.php	Houston Chronicle	t	dFhGhx4AH67_c7MxkJlxvmftdXvTM	www.houstonchronicle.com	1398783338306
167709	Google Self-Driving Cars Now Focusing on Learning Big City Driving	http://www.eweek.com/mobile/google-self-driving-cars-now-focusing-on-learning-big-city-driving.html	eWeek	t	dFhGhx4AH67_c7MxkJlxvmftdXvTM	www.eweek.com	1398783338989
167710	Google's self-driving car gets better at navigating city streets	http://www.autoblog.com/2014/04/28/googles-self-driving-car-better-navigating-city-streets/	Autoblog \(blog\)	t	dFhGhx4AH67_c7MxkJlxvmftdXvTM	www.autoblog.com	1398783339228
167711	Driverless cars have started to master city street driving: Google	http://tech.firstpost.com/news-analysis/driverless-cars-started-master-city-street-driving-google-222697.html	Firstpost	t	dFhGhx4AH67_c7MxkJlxvmftdXvTM	tech.firstpost.com	1398783339475
167712	Google says its driverless cars mastering city streets	http://globalnews.ca/news/1297487/google-says-its-driverless-cars-mastering-city-streets/	Globalnews.ca	t	dFhGhx4AH67_c7MxkJlxvmftdXvTM	globalnews.ca	1398783339654
167713	Google announces improvements in self-driving cars	http://www.nationmultimedia.com/breakingnews/Google-announces-improvements-in-self-driving-cars-30232471.html	The Nation	t	dFhGhx4AH67_c7MxkJlxvmftdXvTM	www.nationmultimedia.com	1398783340112
167714	Google offers news on progress for self-driven cars	http://newsok.com/google-offers-news-on-progress-for-self-driven-cars/article/4569143	NewsOK.com	t	dFhGhx4AH67_c7MxkJlxvmftdXvTM	newsok.com	1398783340349
167715	Google says driving forward on autonomous car	http://www.bangkokpost.com/tech/gadget/407187/google-says-driving-forward-on-autonomous-car	Bangkok Post	t	dFhGhx4AH67_c7MxkJlxvmftdXvTM	www.bangkokpost.com	1398783340575
167716	Google says self-driving cars are mastering city streets	http://www.foxnews.com/tech/2014/04/28/google-says-self-driving-cars-are-mastering-city-streets/	Fox News	t	dFhGhx4AH67_c7MxkJlxvmftdXvTM	www.foxnews.com	1398783341111
167717	Google self driving car now recognizes cyclists' hand signals	http://www.gizmag.com/google-self-driving-car-video-cyclists/31821/	Gizmag	t	dFhGhx4AH67_c7MxkJlxvmftdXvTM	www.gizmag.com	1398783341332
167718	Google says its driverless cars are mastering city streets	http://www.thetelegram.com/Business/2014-04-28/article-3705141/Google-says-its-driverless-cars-are-mastering-city-streets/1	The Telegram	t	dFhGhx4AH67_c7MxkJlxvmftdXvTM	www.thetelegram.com	1398783341573
167719	Google self-driving cars gain new city features – bicycle avoidance, railway  ...	http://www.caradvice.com.au/283045/google-self-driving-cars-now-smarter/	CarAdvice	t	dFhGhx4AH67_c7MxkJlxvmftdXvTM	www.caradvice.com.au	1398783341971
167720	Self-driving car technology still a few years down the road	http://seattletimes.com/html/businesstechnology/2023482592_googledriverlesscarsxml.html	The Seattle Times	t	dFhGhx4AH67_c7MxkJlxvmftdXvTM	seattletimes.com	1398783342217
167721	Google's self-driving cars hit city streets	http://www.businessspectator.com.au/news/2014/4/29/technology/googles-self-driving-cars-hit-city-streets	Business Spectator	t	dFhGhx4AH67_c7MxkJlxvmftdXvTM	www.businessspectator.com.au	1398783342475
167722	Jaywalkers, cyclists, blind corners _ Google says its driverless cars mastering  ...	http://www.newser.com/article/ce5c9fb971cf48909d97bceb524ade47/jaywalkers-cyclists-blind-corners-google-says-its-driverless-cars-mastering-city-streets.html	Newser	t	dFhGhx4AH67_c7MxkJlxvmftdXvTM	www.newser.com	1398783342862
167723	1. MEAN STREETS	http://azstarnet.com/news/national/mean-streets/article_8b6bb00e-cf31-11e3-b5ef-0019bb2963f4.html	Arizona Daily Star	t	dFhGhx4AH67_c7MxkJlxvmftdXvTM	azstarnet.com	1398783343223
167724	Google: Road Ahead Looks Good for Its Self-Driving Cars	http://atlantablackstar.com/2014/04/28/will-self-driving-cars-near-future/	Atlanta Black Star	t	dFhGhx4AH67_c7MxkJlxvmftdXvTM	atlantablackstar.com	1398783343498
167725	Driverless cars mastering city streets	http://www.stuff.co.nz/southland-times/technology/60047664/Driverless-cars-mastering-city-streets	Southland Times	t	dFhGhx4AH67_c7MxkJlxvmftdXvTM	www.stuff.co.nz	1398783343826
167726	Google's Driverless Car Technology is Reaching its Potential	http://www.designntrend.com/articles/13267/20140428/googles-driverless-car-technology-is-reaching-its-potential.htm	Design \& Trend	t	dFhGhx4AH67_c7MxkJlxvmftdXvTM	www.designntrend.com	1398783344093
167727	Google's Self-Driving Car Project Takes On City Streets | News	http://stupiddope.com/2014/04/28/googles-self-driving-car-project-takes-on-city-streets/	stupidDOPE	t	dFhGhx4AH67_c7MxkJlxvmftdXvTM	stupiddope.com	1398783344320
167728	Google's driverless cars learning how to manage cities' issues	http://www.mercurynews.com/business/ci_25652101/google-driverless-cars-are-mastering-city-streets	San Jose Mercury News	t	dFhGhx4AH67_c7MxkJlxvmftdXvTM	www.mercurynews.com	1398783344555
167729	Google's driverless cars log 700000 miles	http://www.allvoices.com/contributed-news/16973108-the-future-googles-driverless-cars-log-700000-miles	allvoices	t	dFhGhx4AH67_c7MxkJlxvmftdXvTM	www.allvoices.com	1398783344947
167730	Google self-driving car tests now focused on city driving	http://www.gulf-times.com/us-latin%20america/182/details/390158/google-self-driving-car-tests-now-focused-on-city-driving	Gulf Times	t	dFhGhx4AH67_c7MxkJlxvmftdXvTM	www.gulf-times.com	1398783345366
167731	Self-Driving Cars Are Ridiculously Polite to Bicyclists and Pedestrians. Watch.	http://www.slate.com/blogs/future_tense/2014/04/28/google_self_driving_car_safety_first_with_city_streets_bicyclists_pedestrians.html\?wpisrc=burger_bar	Slate Magazine \(blog\)	t	dFhGhx4AH67_c7MxkJlxvmftdXvTM	www.slate.com	1398783345618
167732	Google Hits the Gas on Self-Driving Cars	http://www.industryweek.com/innovation/google-hits-gas-self-driving-cars	IndustryWeek	t	dFhGhx4AH67_c7MxkJlxvmftdXvTM	www.industryweek.com	1398783346429
167733	Google's Self-Driving Cars Log 700000 Miles	http://www.cruxialcio.com/googles-self-driving-cars-log-700000-miles-6881	CruxialCIO	t	dFhGhx4AH67_c7MxkJlxvmftdXvTM	www.cruxialcio.com	1398783346776
167734	Google's self-driving car getting smarter in the city	http://mynorthwest.com/108/2509157/Googles-selfdriving-car-getting-smarter-in-the-city	MyNorthwest.com	t	dFhGhx4AH67_c7MxkJlxvmftdXvTM	mynorthwest.com	1398783347007
167735	Google's Self-Driving Cars Have Gotten Good At Not Hitting Jaywalkers	http://www.huffingtonpost.com/2014/04/28/google-self-driving-cars_n_5225465.html\?utm_hp_ref=technology&amp;ir=Technology	Huffington Post	t	dFhGhx4AH67_c7MxkJlxvmftdXvTM	www.huffingtonpost.com	1398783347226
167736	Google self-driving car clocks 700000 miles, new updates to AI	http://usfinancepost.com/google-self-driving-car-clocks-700000-miles-new-updates-to-ai-17735.html	USFinancePost	t	dFhGhx4AH67_c7MxkJlxvmftdXvTM	usfinancepost.com	1398783347555
167737	Google's self-driving cars get improved city driving capabilities	https://ca.news.yahoo.com/blogs/right-click/google-self-driving-cars-improved-city-driving-capabilities-152845282.html\?vp=1	Yahoo News Canada \(blog\)	t	dFhGhx4AH67_c7MxkJlxvmftdXvTM	ca.news.yahoo.com	1398783347754
167738	Google Says Its Self-Driving Cars Can Tackle City Streets Now	http://blogs.wsj.com/digits/2014/04/28/google-says-its-self-driving-cars-can-tackle-city-streets-now/	Wall Street Journal \(blog\)	t	dFhGhx4AH67_c7MxkJlxvmftdXvTM	blogs.wsj.com	1398783348045
167739	Google's self-driving cars now cruise through the neighborhood	http://www.pcadvisor.co.uk/news/digital-home/3513971/googles-self-driving-cars-now-cruise-through-the-neighborhood/	PC Advisor	t	dFhGhx4AH67_c7MxkJlxvmftdXvTM	www.pcadvisor.co.uk	1398783348260
167740	Watch: How Google's self-driving cars see the world	http://www.leaderpost.com/technology/Watch+Google+self+driving+cars+world/9784022/story.html	Regina Leader-Post	t	dFhGhx4AH67_c7MxkJlxvmftdXvTM	www.leaderpost.com	1398783348601
167741	Google's Driverless Cars Are Already Better Motorists Than Most Humans	http://www.minyanville.com/sectors/technology/articles/Google-Driverless-Cars-Are-Already-Better/4/28/2014/id/54759\?camp=syndication&amp;medium=portals&amp;from=Fool	Minyanville.com	t	dFhGhx4AH67_c7MxkJlxvmftdXvTM	www.minyanville.com	1398783348835
167742	Driverless cars mastering cities	http://fftimes.com/node/268942	Fort Frances Times	t	dFhGhx4AH67_c7MxkJlxvmftdXvTM	fftimes.com	1398783349087
167743	Google's autonomous vehicles master the streets of Mountain View	http://www.examiner.com/article/google-s-autonomous-vehicles-master-the-streets-of-mountain-view	Examiner.com	t	dFhGhx4AH67_c7MxkJlxvmftdXvTM	www.examiner.com	1398783349339
167744	Google's self-driving cars at a new crossroads	http://www.vancouversun.com/business/Google+self+driving+cars+crossroads/9784234/story.html	Vancouver Sun	t	dFhGhx4AH67_c7MxkJlxvmftdXvTM	www.vancouversun.com	1398783349743
167745	Google Shows Off the Street Smarts of its Self-Driving Cars	http://www.cio.com/article/752063/Google_Shows_Off_the_Street_Smarts_of_its_Self_Driving_Cars\?taxonomyId=1375	CIO	t	dFhGhx4AH67_c7MxkJlxvmftdXvTM	www.cio.com	1398783350559
167746	Ok Google Self-Driving Car. Drive to Starbucks Post Haste	http://www.newsledge.com/ok-google-self-driving-car-starbucks-post-haste-6283	The News Ledge	t	dFhGhx4AH67_c7MxkJlxvmftdXvTM	www.newsledge.com	1398783350802
167747	Google Self Driving Cars Clock 700000 Miles	http://www.coated.com/google-self-driving-cars-clock-700000-miles-04281401/	Coolest Gadget Reviews	t	dFhGhx4AH67_c7MxkJlxvmftdXvTM	www.coated.com	1398783351067
167748	Google self-driving car is coming in 2017	http://www.thewestsidestory.net/2014/04/28/google-self-driving-car-coming-2017/	The Westside Story	t	dFhGhx4AH67_c7MxkJlxvmftdXvTM	www.thewestsidestory.net	1398783351289
167749	'Driverless cars mastering streets'	http://www.iol.co.za/business/companies/driverless-cars-mastering-streets-1.1681278	Independent Online	t	dFhGhx4AH67_c7MxkJlxvmftdXvTM	www.iol.co.za	1398783351544
167750	Google's Self-Driving Car Hits The City Streets With Incredible Success [VIDEO]	http://dailycaller.com/2014/04/28/googles-self-driving-car-hits-the-city-streets-with-incredible-success-video/	Daily Caller	t	dFhGhx4AH67_c7MxkJlxvmftdXvTM	dailycaller.com	1398783351737
167751	Driverless cars smarter, learning city streets: Google	http://www.nydailynews.com/autos/driverless-cars-smarter-learning-city-streets-google-article-1.1771564	New York Daily News	t	dFhGhx4AH67_c7MxkJlxvmftdXvTM	www.nydailynews.com	1398783351978
167752	Self-driving cars are mastering city streets	http://www.wcti12.com/news/technology/Self-driving-cars-are-mastering-city-streets/25696236	WCTI12.com	t	dFhGhx4AH67_c7MxkJlxvmftdXvTM	www.wcti12.com	1398783352228
167753	Google: Our Self-Driving Cars Are Getting Better	http://investorplace.com/2014/04/google-self-driving-cars-getting-better/	Investorplace.com	t	dFhGhx4AH67_c7MxkJlxvmftdXvTM	investorplace.com	1398783352711
167754	Driverless Cars Master City Streets	http://www.kwtx.com/news/offbeat/headlines/Driverless-Cars-Master-City-Streets-257036361.html	KWTX	t	dFhGhx4AH67_c7MxkJlxvmftdXvTM	www.kwtx.com	1398783353007
167755	Google Inc (GOOG) Continues on Self-Driving Odyssey	http://www.bibeypost.com/google-inc-goog-continues-on-self-driving-odyssey-210/	The Bibey Post	t	dFhGhx4AH67_c7MxkJlxvmftdXvTM	www.bibeypost.com	1398783353265
167756	Driverless Cars 2 (4-28)	http://mdjonline.com/bookmark/25004457-Driverless-Cars-2-4-28-	Marietta Daily Journal	t	dFhGhx4AH67_c7MxkJlxvmftdXvTM	mdjonline.com	1398783353761
167757	Lexus RX450h	http://blogs.wsj.com/digits/tag/lexus-rx450h/	Wall Street Journal \(blog\)	t	dFhGhx4AH67_c7MxkJlxvmftdXvTM	blogs.wsj.com	1398783353998
167758	Google self driving car now intelligent enough for busy city streets	http://www.expertreviews.co.uk/car-tech/1307872/google-self-driving-car-now-intelligent-enough-for-busy-city-streets	Expert Reviews	t	dFhGhx4AH67_c7MxkJlxvmftdXvTM	www.expertreviews.co.uk	1398783354330
167759	Google's Self-Driving Cars Are Smarter Than You Are -- By A Lot	http://www.huffingtonpost.com/2014/04/28/google-car-city-streets-video_n_5227172.html	Huffington Post	t	dFhGhx4AH67_c7MxkJlxvmftdXvTM	www.huffingtonpost.com	1398783354772
167760	Google's Self Driving Cars Learning New Tricks	http://www.beyond.ca/googles-self-driving-cars-learning-new-tricks/35498.html	Beyond.ca	t	dFhGhx4AH67_c7MxkJlxvmftdXvTM	www.beyond.ca	1398783355003
167761	Google says their driverless cars are mastering city streets	http://www.wptv.com/news/science-tech/google-says-their-driverless-cars-are-mastering-city-streets	WPTV	t	dFhGhx4AH67_c7MxkJlxvmftdXvTM	www.wptv.com	1398783355247
167762	Google moves a step closer to...	http://www.thedrum.com/news/2014/04/28/google-moves-step-closer-creating-fully-functioning-driverless-cars	The Drum	t	dFhGhx4AH67_c7MxkJlxvmftdXvTM	www.thedrum.com	1398783355819
167763	Would you trust a self-driving car?	http://www.theguardian.com/commentisfree/poll/2014/apr/28/google-self-driving-car-poll	The Guardian	t	dFhGhx4AH67_c7MxkJlxvmftdXvTM	www.theguardian.com	1398783356239
167764	Could Google's Self-Driving Car Handle Boston's Busy Streets?	http://bostinno.streetwise.co/2014/04/28/googles-self-driving-car-project-focuses-on-city-streets/	BostInno	t	dFhGhx4AH67_c7MxkJlxvmftdXvTM	bostinno.streetwise.co	1398783356449
167765	Google's Self-Driving Car Can Navigate Suburban Streets (VIDEO)	http://www.autoworldnews.com/articles/7191/20140428/googles-self-driving-car-can-navigate-suburban-streets.htm	Auto World News	t	dFhGhx4AH67_c7MxkJlxvmftdXvTM	www.autoworldnews.com	1398783356677
167766	Autonomous cars are better city drivers than humans, Google says	http://www.computerworld.com/s/article/9247957/Autonomous_cars_are_better_city_drivers_than_humans_Google_says\?source=rss_latest_content	Computerworld	t	dFhGhx4AH67_c7MxkJlxvmftdXvTM	www.computerworld.com	1398783356912
167767	Google Says Self-Driving Cars Will Run Over Fewer Pedestrians	http://www.forbes.com/sites/ericmack/2014/04/28/google-says-self-driving-cars-would-run-over-fewer-pedestrians/	Forbes	t	dFhGhx4AH67_c7MxkJlxvmftdXvTM	www.forbes.com	1398783357128
167768	Google's self-driving car project tackles city streets	http://www.zdnet.com/googles-self-driving-car-project-tackles-city-streets-7000028836/	ZDNet	t	dFhGhx4AH67_c7MxkJlxvmftdXvTM	www.zdnet.com	1398783357529
167769	Google Self-Driving Cars: City Streets Now Supported, Find Out Which Cities  ...	http://www.idigitaltimes.com/articles/22809/20140428/google-self-driving-cars-youtube-driverless-video.htm	iDigitalTimes.com	t	dFhGhx4AH67_c7MxkJlxvmftdXvTM	www.idigitaltimes.com	1398783357726
167770	Google self-driving car project makes progress	http://www.detroitnews.com/article/20140428/AUTO01/304280063/1121/auto01/Google-self-driving-car-project-makes-progress	The Detroit News	t	dFhGhx4AH67_c7MxkJlxvmftdXvTM	www.detroitnews.com	1398783357920
167771	Google self-driving cars can now spot cyclist signals, level crossings and more	http://www.pocket-lint.com/news/128636-google-self-driving-cars-can-now-spot-cyclist-signals-level-crossings-and-more	Pocket-lint.com	t	dFhGhx4AH67_c7MxkJlxvmftdXvTM	www.pocket-lint.com	1398783358206
167772	Self-driving cars are mastering city streets	http://www.kxly.com/news/technology/Self-driving-cars-are-mastering-city-streets/25696236	KXLY Spokane	t	dFhGhx4AH67_c7MxkJlxvmftdXvTM	www.kxly.com	1398783358596
167773	Google's self-driving car takes on Mountain View streets	http://www.slashgear.com/googles-self-driving-car-takes-on-mountain-view-streets-28326686/	SlashGear	t	dFhGhx4AH67_c7MxkJlxvmftdXvTM	www.slashgear.com	1398783358848
167774	Google's self-driving car now smart enough to conquer the suburbs	http://www.itproportal.com/2014/04/28/googles-smart-self-driving-car-just-got-smarter/	ITProPortal	t	dFhGhx4AH67_c7MxkJlxvmftdXvTM	www.itproportal.com	1398783359096
167775	Driverless Cars 1 (4-28)	http://mdjonline.com/bookmark/25003701-Driverless-Cars-1-4-28-	Marietta Daily Journal	t	dFhGhx4AH67_c7MxkJlxvmftdXvTM	mdjonline.com	1398783359553
167776	Google: Driverless cars now 'mastering' the urban sprawl	http://www.financialexpress.com/news/google-driverless-cars-now-mastering-city-streets/1244974	Financial Express	t	dFhGhx4AH67_c7MxkJlxvmftdXvTM	www.financialexpress.com	1398783359730
167777	Google's Driverless Cars are Becoming Urbanites	http://www.laboratoryequipment.com/news/2014/04/googles-driverless-cars-are-becoming-urbanites	Laboratory Equipment	t	dFhGhx4AH67_c7MxkJlxvmftdXvTM	www.laboratoryequipment.com	1398783359931
167778	Will Google's driverless cars be on streets by 2017?	https://uk.news.yahoo.com/google-driverless-cars-streets-2017-154500817.html	Yahoo News UK	t	dFhGhx4AH67_c7MxkJlxvmftdXvTM	uk.news.yahoo.com	1398783360161
167779	Watch: Google's Self-Driving Cars Head to the City	http://time.com/79315/google-car-city-streets/	TIME	t	dFhGhx4AH67_c7MxkJlxvmftdXvTM	time.com	1398783360482
167780	Google says its driverless cars are mastering California's city streets and could  ...	http://www.dailymail.co.uk/sciencetech/article-2614891/Google-Driverless-cars-mastering-city-streets.html	Daily Mail	t	dFhGhx4AH67_c7MxkJlxvmftdXvTM	www.dailymail.co.uk	1398783360709
167781	Google's autonomous cars moving closer to reality	https://ph.celebrity.yahoo.com/news/googles-autonomous-cars-moving-closer-reality-144032020.html	Yahoo Philippines News	t	dFhGhx4AH67_c7MxkJlxvmftdXvTM	ph.celebrity.yahoo.com	1398783361326
167782	Google's driverless cars can now dodge cyclists	http://www.wired.co.uk/news/archive/2014-04/28/google-cars-city-driving	Wired.co.uk	t	dFhGhx4AH67_c7MxkJlxvmftdXvTM	www.wired.co.uk	1398783361563
167783	Google Clocks Up 700k Self-Driven Miles	http://www.clickonline.com/tech/google-clocks-up-700k-self-driven-miles/25368/	Clickonline.com	t	dFhGhx4AH67_c7MxkJlxvmftdXvTM	www.clickonline.com	1398783361781
167784	Google says its self-driving cars are better than people	http://www.theinquirer.net/inquirer/news/2341906/google-says-its-self-driving-cars-are-better-than-people	Inquirer	t	dFhGhx4AH67_c7MxkJlxvmftdXvTM	www.theinquirer.net	1398783362207
167785	VIDEO: Driverless cars are mastering city streets, Google says	http://www.tylerpaper.com/TP-News+National/198926/video-driverless-cars-are-mastering-city-streets-google-says	Tyler Morning Telegraph	t	dFhGhx4AH67_c7MxkJlxvmftdXvTM	www.tylerpaper.com	1398783362603
167786	Sit back and relax. This car can handle even tough city traffic all by itself.	http://www.dailyfreeman.com/lifestyle/20140428/sit-back-and-relax-this-car-can-handle-even-tough-city-traffic-all-by-itself	Kingston Daily Freeman	t	dFhGhx4AH67_c7MxkJlxvmftdXvTM	www.dailyfreeman.com	1398783362815
167787	Google says it is moving forward on autonomous cars	http://www.timeslive.co.za/scitech/2014/04/28/google-says-it-is-moving-forward-on-autonomous-cars	Times LIVE	t	dFhGhx4AH67_c7MxkJlxvmftdXvTM	www.timeslive.co.za	1398783363338
167788	Google: driverless cars now have better understanding of city driving	http://www.theguardian.com/technology/2014/apr/28/google-driverless-cars-city-driving	The Guardian	t	dFhGhx4AH67_c7MxkJlxvmftdXvTM	www.theguardian.com	1398783363581
167789	Google's Self-Driving Car Is Even Better At Driving Than You Think	http://jalopnik.com/googles-self-driving-car-is-even-better-at-driving-than-1568701372	Jalopnik	t	dFhGhx4AH67_c7MxkJlxvmftdXvTM	jalopnik.com	1398783363829
167790	Google X Lab: Driverless Cars Mastering City Streets	http://www.scientificcomputing.com/news/2014/04/google-x-lab-driverless-cars-mastering-city-streets	Scientific Computing	t	dFhGhx4AH67_c7MxkJlxvmftdXvTM	www.scientificcomputing.com	1398783364050
167791	Google says its driverless cars are getting smarter	http://www.newsday.com/business/technology/google-says-its-driverless-cars-are-getting-smarter-1.7846512	Newsday	t	dFhGhx4AH67_c7MxkJlxvmftdXvTM	www.newsday.com	1398783364435
167792	Google's self-driving cars hit 700K miles driven; here's how they don't hit you	http://www.bizjournals.com/sanjose/news/2014/04/28/googles-self-driving-cars-hit-700k-miles-driven.html	Silicon Valley Business Journal	t	dFhGhx4AH67_c7MxkJlxvmftdXvTM	www.bizjournals.com	1398783364686
167793	Google's self-driving car gets much better at navigating cities	https://gigaom.com/2014/04/28/google-car-gets-much-better-at-city-driving/	GigaOM	t	dFhGhx4AH67_c7MxkJlxvmftdXvTM	gigaom.com	1398783364898
167794	Google gets closer to develop a driverless car	http://businesstoday.intoday.in/story/google-gets-closer-to-develop-driverless-cars/1/205645.html	Business Today	t	dFhGhx4AH67_c7MxkJlxvmftdXvTM	businesstoday.intoday.in	1398783365107
167795	Google's driverless car masters city streets	http://nypost.com/2014/04/28/googles-driverless-car-masters-city-driving/	New York Post	t	dFhGhx4AH67_c7MxkJlxvmftdXvTM	nypost.com	1398783365491
167796	Why New Studies May Mean 'Game Over for the Climate Deniers'	http://www.thestreet.com/story/12684261/1/why-new-studies-may-mean-game-over-for-the-climate-deniers.html	TheStreet.com	t	dPyW40fqlB9x6DMbhQIg2JRnfqZvM	www.thestreet.com	1398784429649
167797	Ed Davey: Climate Group speech in full	http://www.businessgreen.com/bg/opinion/2342088/ed-davey-climate-group-speech-in-full	Business Green	t	dPyW40fqlB9x6DMbhQIg2JRnfqZvM	www.businessgreen.com	1398784429933
167798	Study: It is "Very Likely" That Scientists Are Confusing Us About Global Warming	http://www.motherjones.com/environment/2014/04/ipcc-global-warming-doubt-psychology	Mother Jones	t	dPyW40fqlB9x6DMbhQIg2JRnfqZvM	www.motherjones.com	1398784430260
167799	Alex Salmond: Scotland will lead on climate change	http://www.rtcc.org/2014/04/29/alex-salmond-scotland-will-lead-on-climate-change/	Responding to Climate Change	t	dPyW40fqlB9x6DMbhQIg2JRnfqZvM	www.rtcc.org	1398784430528
167800	Climate adaptation advice for cities in global South	http://www.preventionweb.net/english/professional/news/v.php\?id=37303	PreventionWeb \(press release\)	t	dPyW40fqlB9x6DMbhQIg2JRnfqZvM	www.preventionweb.net	1398784430843
