171901	10 other '80s items in the Atari ET landfill	http://saugus.wickedlocal.com/article/20140428/BLOGS/140426892/12434/ENTERTAINMENT	Wicked Local Saugus \(blog\)	t	dLCWVil0r5CAAJM8iAzlsDjV-RWMM	saugus.wickedlocal.com	1398852038659
171902	New Mexico dig uncovers 'ET' video games buried after 1980s flop	http://bangordailynews.com/2014/04/28/living/new-mexico-dig-uncovers-e-t-video-games-buried-after-1980s-flop/\?ref=LivingBox	Bangor Daily News	t	dLCWVil0r5CAAJM8iAzlsDjV-RWMM	bangordailynews.com	1398852038925
171903	Film crew unearths long-lost Atari game "E.T." in New Mexico landfill	http://www.whas11.com/news/Searchers-unearth-grave-of-ET-the-video-game-Atari-wanted-us-to-forget-257003811.html	WHAS 11.com \(subscription\)	t	dLCWVil0r5CAAJM8iAzlsDjV-RWMM	www.whas11.com	1398852039328
171904	Dig for ET Atari Cartridges Was a Success	http://www.actiontrip.com/news/dig-for-et-atari-cartridges-was-a-success/042814_5	Action Trip	t	dLCWVil0r5CAAJM8iAzlsDjV-RWMM	www.actiontrip.com	1398852039559
171905	In pictures: Unearthing Atari's legendary ET graveyard in the New Mexico desert	http://www.techhive.com/article/2148665/they-dug-up-e-t-s-grave-this-weekend-in-new-mexico.html	TechHive	t	dLCWVil0r5CAAJM8iAzlsDjV-RWMM	www.techhive.com	1398852039802
171906	Atari ET games dug up by Xbox documentary makers in New Mexico	http://www.cbronline.com/news/social/atari-et-games-dug-up-by-xbox-documentary-makers-in-new-mexico-desert-4253828	Computer Business Review	t	dLCWVil0r5CAAJM8iAzlsDjV-RWMM	www.cbronline.com	1398852040243
171907	ET's Home Is Found: Trove Of Atari Games Unearthed At Landfill	http://www.ktoo.org/2014/04/28/e-t-s-home-found-trove-atari-games-unearthed-landfill/	Ktoo	t	dLCWVil0r5CAAJM8iAzlsDjV-RWMM	www.ktoo.org	1398852040470
171908	Diggers find hundreds of old video games buried in landfill	http://www.khou.com/entertainment/Diggers-find-hundreds-of-old-video-games-buried-in-landfill-256999661.html	KHOU	t	dLCWVil0r5CAAJM8iAzlsDjV-RWMM	www.khou.com	1398852040707
171909	M4d Ski11z: Digging up “ET” games is a waste	http://blog.chron.com/houstongamer/2014/04/m4d-ski11z-digging-up-e-t-games-is-a-waste/	Chron.com \(blog\)	t	dLCWVil0r5CAAJM8iAzlsDjV-RWMM	blog.chron.com	1398852040983
171910	Awesome Photos From The Atari Landfill	http://kotaku.com/awesome-photos-from-the-atari-landfill-1568711945	Kotaku	t	dLCWVil0r5CAAJM8iAzlsDjV-RWMM	kotaku.com	1398852041353
171911	Watch, Hear, and Re-live the Big Atari Dig as it Happened	http://www.hardwareheaven.com/news.php\?newsid=6816	HardwareHeaven.com	t	dLCWVil0r5CAAJM8iAzlsDjV-RWMM	www.hardwareheaven.com	1398852041584
171912	E.T. Atari 2600 cartridges finally unearthed in New Mexico landfill	http://www.gaming-age.com/2014/04/e-t-atari-2600-cartridges-finally-unearthed-new-mexico-landfill/	Gaming Age	t	dLCWVil0r5CAAJM8iAzlsDjV-RWMM	www.gaming-age.com	1398852041798
171913	Hundreds of copies of the "Worst Video Game Ever" found in landfill	http://www.kliv.com/Hundreds-of-copies-of-the-Worst-Video-Game-Ever-fo/18898951	1590 KLIV Silicon Valley News	t	dLCWVil0r5CAAJM8iAzlsDjV-RWMM	www.kliv.com	1398852042083
171914	Microsoft unearths long-buried Atari “ET” game cartridges — part of Xbox TV  ...	http://blogs.seattletimes.com/microsoftpri0/2014/04/28/microsoft-unearths-long-buried-atari-e-t-game-cartridges-part-of-new-xbox-tv-series-launching-this-year/	The Seattle Times \(blog\)	t	dLCWVil0r5CAAJM8iAzlsDjV-RWMM	blogs.seattletimes.com	1398852042318
171915	Searchers unearth grave of 'E.T.'	http://q13fox.com/2014/04/28/searchers-unearth-grave-of-e-t/	Q13 FOX	t	dLCWVil0r5CAAJM8iAzlsDjV-RWMM	q13fox.com	1398852042578
171916	Diggers find Atari games in landfill	http://www.cdispatch.com/news/article.asp\?aid=32953	The Commercial Dispatch	t	dLCWVil0r5CAAJM8iAzlsDjV-RWMM	www.cdispatch.com	1398852042821
171917	Crews unearth decades-old Atari games underneath Alamogordo landfill	http://www.koat.com/news/crews-unearth-decadesold-atari-games-underneath-alamogordo-landfill/25693310	KOAT Albuquerque	t	dLCWVil0r5CAAJM8iAzlsDjV-RWMM	www.koat.com	1398852043140
171918	Atari's ET: which video games deserve to be buried in the desert?	http://www.theguardian.com/technology/2014/apr/28/ataris-et-what-video-games-deserve-to-be-buried-in-the-desert	The Guardian	t	dLCWVil0r5CAAJM8iAzlsDjV-RWMM	www.theguardian.com	1398852043417
171919	Phone home? Landfill dig uncovers legendarily bad 'E.T.' Atari video games	http://www.bizjournals.com/washington/blog/techflash/2014/04/phone-home-landfill-dig-uncovers-legendarily-bade.html	Washington Business Journal \(blog\)	t	dLCWVil0r5CAAJM8iAzlsDjV-RWMM	www.bizjournals.com	1398852043828
171920	See Atari's Buried Treasure: ET Among 30 Retro Games Unearthed In The Desert	http://readwrite.com/2014/04/28/atari-et-dig-alamogordo-game-list	ReadWrite	t	dLCWVil0r5CAAJM8iAzlsDjV-RWMM	readwrite.com	1398852044166
171921	Legendary E.T. Games Found in Landfill	http://www.pddnet.com/news/2014/04/legendary-et-games-found-landfill	Product Design \& Development	t	dLCWVil0r5CAAJM8iAzlsDjV-RWMM	www.pddnet.com	1398852044476
171922	Buried Video Games Discovered	http://www.cbs2iowa.com/news/features/top-stories/stories/buried-video-games-discovered-26401.shtml	KGAN TV	t	dLCWVil0r5CAAJM8iAzlsDjV-RWMM	www.cbs2iowa.com	1398852044716
171923	Atari graveyard found in landfill	http://www.wkyc.com/story/news/features/2014/04/28/atari-mystery-unearthed-in-landfill/8381521/	WKYC-TV	t	dLCWVil0r5CAAJM8iAzlsDjV-RWMM	www.wkyc.com	1398852045079
171924	ET 'Urban Legend' Discovered To Be True	http://news.sky.com/story/1250694/et-urban-legend-discovered-to-be-true	Sky News	t	dLCWVil0r5CAAJM8iAzlsDjV-RWMM	news.sky.com	1398852045520
171925	Infamous urban legend turns out to be true	http://www.beaumontenterprise.com/news/article/Infamous-urban-legend-turns-out-to-be-true-5434750.php	Beaumont Enterprise	t	dLCWVil0r5CAAJM8iAzlsDjV-RWMM	www.beaumontenterprise.com	1398852045880
171926	Atari ET Game Graveyard Unearthed in New Mexico Desert	http://www.gamepolitics.com/2014/04/28/atari-et-game-graveyard-unearthed-new-mexico-desert	Game Politics	t	dLCWVil0r5CAAJM8iAzlsDjV-RWMM	www.gamepolitics.com	1398852046147
171927	Atari's ET game cartridges really were in a desert landfill	http://www.theinquirer.net/inquirer/news/2341774/ataris-et-game-cartridges-really-were-in-a-desert-landfill	Inquirer	t	dLCWVil0r5CAAJM8iAzlsDjV-RWMM	www.theinquirer.net	1398852046383
171928	Documentary filmmakers find 'E.T.' Atari cartridges in New Mexico: Why this is a  ...	http://www.techtimes.com/articles/6198/20140428/documentary-filmmakers-find-e-t-atari-cartridges-in-new-mexico-why-this-is-a-big-find.htm	Tech Times	t	dLCWVil0r5CAAJM8iAzlsDjV-RWMM	www.techtimes.com	1398852046651
171929	'ET' video games found buried in New Mexico after '80s flop	http://wbco.com/news/030030-e-t-video-games-found-buried-in-new-mexico-after-80s-flop/	WBCO	t	dLCWVil0r5CAAJM8iAzlsDjV-RWMM	wbco.com	1398852046979
171930	Long-lost Atari ET game cartridges dug up from the desert	http://www.v3.co.uk/v3-uk/the-frontline-blog/2341877/long-lost-atari-et-game-cartridges-dug-up-from-the-desert	V3.co.uk \(blog\)	t	dLCWVil0r5CAAJM8iAzlsDjV-RWMM	www.v3.co.uk	1398852047179
171931	Atari 2600 E.T. game cartridges unearthed in landfill dig, known as the 'worst  ...	http://www.kshb.com/news/local-news/water-cooler/atari-2600-et-game-cartridges-unearthed-in-landfill-dig-known-as-the-worst-game-ever-by-many	KSHB	t	dLCWVil0r5CAAJM8iAzlsDjV-RWMM	www.kshb.com	1398852047416
171932	Diggers Find ET Atari Games In Landfill	http://www.manufacturing.net/news/2014/04/diggers-find-et-atari-games-in-landfill	Manufacturing.net	t	dLCWVil0r5CAAJM8iAzlsDjV-RWMM	www.manufacturing.net	1398852047642
171933	Atari landfill dig in New Mexico Desert solves 'ET' mystery	http://kxan.com/2014/04/28/atari-landfill-dig-in-new-mexico-desert-solves-e-t-mystery/	KXAN.com	t	dLCWVil0r5CAAJM8iAzlsDjV-RWMM	kxan.com	1398852047969
171934	5 Things You Need to Know Before You Go	http://blogs.krqe.com/2014/04/28/5-things-you-need-to-know-before-you-go-50/	KRQE News 13 \(blog\)	t	dLCWVil0r5CAAJM8iAzlsDjV-RWMM	blogs.krqe.com	1398852048171
171935	Old Atari Games Found In N.M. Landfill	http://www.opb.org/news/article/npr-old-atari-games-found-in-nm-landfill/	OPB News	t	dLCWVil0r5CAAJM8iAzlsDjV-RWMM	www.opb.org	1398852048398
171936	Atari's 'E.T' Game Found in New Mexico Landfill, Proving Conspiracy Theories	http://www.contactmusic.com/article/atari-e-t-game-buried-new-mexico-landfill_4171875	Contactmusic.com	t	dLCWVil0r5CAAJM8iAzlsDjV-RWMM	www.contactmusic.com	1398852048616
171937	Worst video game ever? Diggers find Atari's 'E.T.' in landfill	http://www.greenbaypressgazette.com/viewart/20140427/GPG04/304270320/Worst-video-game-ever-Diggers-find-Atari-s-E-T-landfill	Green Bay Press Gazette	t	dLCWVil0r5CAAJM8iAzlsDjV-RWMM	www.greenbaypressgazette.com	1398852049151
171938	Rubbish gaming: Atari relics discovered in New Mexico dump	http://www.itproportal.com/2014/04/28/rubbish-gaming-atari-relics-found-new-mexico-landfill/	ITProPortal	t	dLCWVil0r5CAAJM8iAzlsDjV-RWMM	www.itproportal.com	1398852049427
171939	The Legend Is Real: Atari and ET cartridges uncovered at fabled New Mexico  ...	http://www.el33tonline.com/post/2014/04/28/legends-real-atari-et-cartridges-uncovered-fabled-new-mexico-dumpsite/	KwaZulu-Natal	t	dLCWVil0r5CAAJM8iAzlsDjV-RWMM	www.el33tonline.com	1398852049646
171940	Excavation Locates Unsold Atari 2600 Video Games In New Mexico Desert	http://www.redorbit.com/news/technology/1113131061/atari-2600-video-games-unearthed-in-new-mexico-042814/	RedOrbit	t	dLCWVil0r5CAAJM8iAzlsDjV-RWMM	www.redorbit.com	1398852050023
171941	Unearthing Atari ET: why we need to dig up an old video game	http://www.theguardian.com/technology/2014/apr/28/atari-et-video-game\?CMP=twt_gu	The Guardian	t	dLCWVil0r5CAAJM8iAzlsDjV-RWMM	www.theguardian.com	1398852050283
171942	Video: First footage of ET game excavation	http://www.computerandvideogames.com/460874/video-first-footage-of-et-game-excavation/	Computerandvideogames.com	t	dLCWVil0r5CAAJM8iAzlsDjV-RWMM	www.computerandvideogames.com	1398852050502
171943	Desert dig uncovers huge Atari games dump	http://www.bbc.co.uk/news/technology-27187609	BBC News	t	dLCWVil0r5CAAJM8iAzlsDjV-RWMM	www.bbc.co.uk	1398852050897
171944	Atari E.T. Game Cartridges Dug Up	http://www.kristv.com/news/atari-e-t-game-cartridges-dug-up/	KRIS Corpus Christi News	t	dLCWVil0r5CAAJM8iAzlsDjV-RWMM	www.kristv.com	1398852051088
171945	See Microsoft dig up landfilled ET Atari cartridges – video	http://www.vg247.com/2014/04/28/at-least-one-e-t-game-cartridge-dug-up-from-landfill/	VG247	t	dLCWVil0r5CAAJM8iAzlsDjV-RWMM	www.vg247.com	1398852051315
171946	ET 'The Worst Video Game Ever Made' Discovered In New Mexico  ...	http://www.thepoke.co.uk/2014/04/27/e-t-the-worst-video-game-ever-made-discovered-in-new-mexico-archaeological-dig/	The Poke	t	dLCWVil0r5CAAJM8iAzlsDjV-RWMM	www.thepoke.co.uk	1398852051533
171947	Landfill Of Atari Video Games Found	http://www.carbonated.tv/technology/digital-mystery-solved-after-copies-of-atari-2600-et-the-extra-terrestrial-found-buried-in-desert	Carbonated.tv	t	dLCWVil0r5CAAJM8iAzlsDjV-RWMM	www.carbonated.tv	1398852051926
171948	ET cartridges unearthed 30 years on at legendary Atari dump site	https://www.develop-online.net/news/e-t-cartridges-unearthed-30-years-on-at-legendary-atari-dump-site/0192218	Develop	t	dLCWVil0r5CAAJM8iAzlsDjV-RWMM	www.develop-online.net	1398852052129
171949	E.T. dig hits Atari 2600 cartridge gold	http://www.bit-tech.net/news/gaming/2014/04/28/et-dig-gold/1	bit-tech.net	t	dLCWVil0r5CAAJM8iAzlsDjV-RWMM	www.bit-tech.net	1398852052346
171950	Diggers Begin Quest to Unearth Atari's ET Games	http://www.wtvy.com/news/nation/headlines/Diggers-Begin-Quest-to-Unearth-Ataris-ET-Games-256952201.html	WTVY, Dothan	t	dLCWVil0r5CAAJM8iAzlsDjV-RWMM	www.wtvy.com	1398852052565
171951	Atari ET carts found in New Mexico landfill	http://www.denofgeek.us/games/et/235107/atari-et-carts-found-in-new-mexico-landfill	Den of Geek \(US\)	t	dLCWVil0r5CAAJM8iAzlsDjV-RWMM	www.denofgeek.us	1398852053435
171952	Atari games dug up from 'grave' after 30 years	http://timesofindia.indiatimes.com/tech/gaming/Atari-games-dug-up-from-grave-after-30-years/articleshow/34320713.cms	Times of India	t	dLCWVil0r5CAAJM8iAzlsDjV-RWMM	timesofindia.indiatimes.com	1398852053960
171953	Crews unearth what has been called Atari's worst game ever in a New Mexico  ...	http://khon2.com/2014/04/27/crews-unearth-what-has-been-called-ataris-worst-game-ever-in-a-new-mexico-landfill/	khon2.com	t	dLCWVil0r5CAAJM8iAzlsDjV-RWMM	khon2.com	1398852054191
171954	Long-lost legendarily bad 'ET' video game found in landfill	http://nypost.com/2014/04/28/long-lost-legendarily-bad-e-t-video-game-found-in-landfill/	New York Post	t	dLCWVil0r5CAAJM8iAzlsDjV-RWMM	nypost.com	1398852054415
171955	ET Cartridges Found In New Mexico Landfill	http://www.gamerheadlines.com/2014/04/et-cartridges-found-in-new-mexico-landfill/	The Gamer Headlines	t	dLCWVil0r5CAAJM8iAzlsDjV-RWMM	www.gamerheadlines.com	1398852054992
171956	Diggers find Atari's 'ET' games in landfill	http://www.telegram.com/article/20140427/NEWS/304279627/-1/NEWS07	Worcester Telegram	t	dLCWVil0r5CAAJM8iAzlsDjV-RWMM	www.telegram.com	1398852055319
171957	Legendary discarded ET games found in desert dump	http://www.trustedreviews.com/news/legendary-discarded-et-games-found-in-desert-dump	TrustedReviews	t	dLCWVil0r5CAAJM8iAzlsDjV-RWMM	www.trustedreviews.com	1398852055553
171958	'E.T.' Found in New Mexico; Lost Atari Cartridges Unearthed	http://www.latinospost.com/articles/36442/20140428/e-t-found-new-mexico-lost-atari-cartridges-unearthed.htm	Latinos Post	t	dLCWVil0r5CAAJM8iAzlsDjV-RWMM	www.latinospost.com	1398852055950
171959	E.T. discovered in New Mexico	http://www.statecolumn.com/2014/04/e-t-discovered-in-new-mexico/	State Column	t	dLCWVil0r5CAAJM8iAzlsDjV-RWMM	www.statecolumn.com	1398852056352
171960	'ET' video games uncovered in New Mexico landfill	http://www.wsoctv.com/news/news/national/et-video-games-uncovered-new-mexico-landfill/nfjPq/\?icmp=cmgcontent_internallink_relatedcontent_2014_partners5	WSOC Charlotte	t	dLCWVil0r5CAAJM8iAzlsDjV-RWMM	www.wsoctv.com	1398852056623
171961	The video game that sunk the industry back in the picture	http://www.businessspectator.com.au/news/2014/4/28/technology/video-game-sunk-industry-back-picture	Business Spectator	t	dLCWVil0r5CAAJM8iAzlsDjV-RWMM	www.businessspectator.com.au	1398852056886
171962	Video: Ars talks to the experts on Atari's dump at yesterday's big dig	http://arstechnica.com/gaming/2014/04/video-ars-talks-to-the-experts-on-ataris-dump-at-yesterdays-big-dig/	Ars Technica	t	dLCWVil0r5CAAJM8iAzlsDjV-RWMM	arstechnica.com	1398852057133
171963	Lost treasure of Atari REVEALED	http://www.theregister.co.uk/2014/04/27/lost_treasure_of_atari_revealed/	Register	t	dLCWVil0r5CAAJM8iAzlsDjV-RWMM	www.theregister.co.uk	1398852057487
171964	Hundreds poised to search landfill in search of decades-old Atari 'ET' game  ...	http://www.edmontonjournal.com/Hundreds+poised+search+landfill+search+decades+Atari+game+cartridges/9776874/story.html	Edmonton Journal	t	dLCWVil0r5CAAJM8iAzlsDjV-RWMM	www.edmontonjournal.com	1398852057715
171965	Hundreds of 'E.T.' games unearthed in N.M. dump	http://articles.chicagotribune.com/2014-04-27/news/chi-buried-et-games-discovered-20140427_1_atari-video-game-industry-cartridges	Chicago Tribune	t	dLCWVil0r5CAAJM8iAzlsDjV-RWMM	articles.chicagotribune.com	1398852057966
171966	Google: Driverless cars are mastering city streets	http://www.dawn.com/news/1103057/google-driverless-cars-are-mastering-city-streets	DAWN.com	t	dG9ekvLf9IN8oyMU4RWcTHk6Wjd-M	www.dawn.com	1398852669471
171967	How Google's autonomous car navigates city streets	http://www.autoweek.com/article/20140429/CARNEWS/140429851	AutoWeek	t	dG9ekvLf9IN8oyMU4RWcTHk6Wjd-M	www.autoweek.com	1398852670053
171968	Google Self-Driving Cars Get Smarter	http://www.informationweek.com/mobile/mobile-devices/google-self-driving-cars-get-smarter/d/d-id/1234906	InformationWeek	t	dG9ekvLf9IN8oyMU4RWcTHk6Wjd-M	www.informationweek.com	1398852670324
171969	Google says driverless cars are mastering city streets	http://www.trivalleycentral.com/casa_grande_dispatch/national_news/google-says-driverless-cars-are-mastering-city-streets/article_2d0e8f0c-cfba-11e3-8016-0019bb2963f4.html	TriValley Central	t	dG9ekvLf9IN8oyMU4RWcTHk6Wjd-M	www.trivalleycentral.com	1398852670670
171970	How Google's self-driving cars avoid plowing into cyclists	http://www.digitaltrends.com/cars/google-atonomous-car-learning-real-world-situations/	Digital Trends	t	dG9ekvLf9IN8oyMU4RWcTHk6Wjd-M	www.digitaltrends.com	1398852670912
171971	Google, Volvo Test Drive Autonomous Cars on City Streets	http://www.automotive.com/news/1404-google-volvo-test-drive-autonomous-cars-on-city-streets/	automotive.com	t	dG9ekvLf9IN8oyMU4RWcTHk6Wjd-M	www.automotive.com	1398852671220
171972	Volvo begins testing autonomous cars on city streets	http://driving.ca/volvo/auto-news/news/volvo-begins-testing-autonomous-cars-on-city-streets	Driving	t	dG9ekvLf9IN8oyMU4RWcTHk6Wjd-M	driving.ca	1398852671473
171973	Google's Self-Driving Car Takes to City Streets	http://tidbits.com/article/14717	TidBITS	t	dG9ekvLf9IN8oyMU4RWcTHk6Wjd-M	tidbits.com	1398852671787
171974	A closer look at Google's self-driving car, and how it's shaping up	http://www.itproportal.com/2014/04/29/a-closer-look-at-googles-self-driving-car-and-how-its-shaping-up/	ITProPortal	t	dG9ekvLf9IN8oyMU4RWcTHk6Wjd-M	www.itproportal.com	1398852671986
171975	Google Self-Driving Car Completes Test Drive in Mountain View, Ready to  ...	http://www.hngn.com/articles/29969/20140429/google-self-driving-car-completes-test-drive-in-mountain-view-ready-to-cruise-city-streets.htm	Headlines \& Global News	t	dG9ekvLf9IN8oyMU4RWcTHk6Wjd-M	www.hngn.com	1398852672155
171976	Watch Google's Self-Driving Car in Action. Would You Let It Steer for You?	http://www.ryot.org/video-googles-self-driving-car-cruises-the-city-with-ease/660273	RYOT	t	dG9ekvLf9IN8oyMU4RWcTHk6Wjd-M	www.ryot.org	1398852672332
171977	Red lights , cyclists, Google's driverless car copes with them all!	http://www.thedrum.com/news/2014/04/29/red-lights-cyclists-googles-driverless-car-copes-them-all	The Drum	t	dG9ekvLf9IN8oyMU4RWcTHk6Wjd-M	www.thedrum.com	1398852672665
171978	Google's self-driving car passes 700000 accident-free miles, can now avoid  ...	http://www.extremetech.com/extreme/181508-googles-self-driving-car-passes-700000-accident-free-miles-can-now-avoid-cyclists-stop-for-trains	ExtremeTech	t	dG9ekvLf9IN8oyMU4RWcTHk6Wjd-M	www.extremetech.com	1398852672919
171979	Video: First footage of Google's self-driving CARS shows how vehicles read  ...	http://www.mirror.co.uk/news/technology-science/video-googles-self-driving-cars-revealed-3474375	Mirror.co.uk	t	dG9ekvLf9IN8oyMU4RWcTHk6Wjd-M	www.mirror.co.uk	1398852673187
171980	Google's Self-Driving Car Is Self-Driving Around DC	http://dcist.com/2014/04/googles_self-driving_car_is_self-dr.php	DCist.com	t	dG9ekvLf9IN8oyMU4RWcTHk6Wjd-M	dcist.com	1398852673428
171981	City Streets? Google's Self-Driving Car Project Says, "Yeah, We Got This"	http://www.thecarconnection.com/news/1091776_city-streets-googles-self-driving-car-project-says-yeah-we-got-this	The Car Connection	t	dG9ekvLf9IN8oyMU4RWcTHk6Wjd-M	www.thecarconnection.com	1398852673839
171982	Google Showing Off New Self-Driving Cars Advanced Features [Video]	http://www.autoevolution.com/news/google-showing-off-new-self-driving-cars-advanced-features-video-80598.html	autoevolution	t	dG9ekvLf9IN8oyMU4RWcTHk6Wjd-M	www.autoevolution.com	1398852674065
171983	Google self-driving car road-tested on the streets of California	http://www.news.com.au/technology/design/google-selfdriving-car-roadtested-on-the-streets-of-california/story-fnjwucvh-1226900273771	NEWS.com.au	t	dG9ekvLf9IN8oyMU4RWcTHk6Wjd-M	www.news.com.au	1398852674313
171984	Google testing self-driving cars on city streets	http://bluesky.chicagotribune.com/chi-google-self-driving-cars-bsi-news,0,0.story	Chicago Tribune	t	dG9ekvLf9IN8oyMU4RWcTHk6Wjd-M	bluesky.chicagotribune.com	1398852674666
171985	Self-driving cars 'not far away' says internet giant Google	http://www.westernmorningnews.co.uk/Self-driving-cars-far-away-says-internet-giant/story-21028445-detail/story.html	Western Morning News	t	dG9ekvLf9IN8oyMU4RWcTHk6Wjd-M	www.westernmorningnews.co.uk	1398852675118
171986	5 things to know about Google's self-driving cars	http://www.wtop.com/256/3611970/5-things-to-know-about-Googles-self-driving-cars	WTOP	t	dG9ekvLf9IN8oyMU4RWcTHk6Wjd-M	www.wtop.com	1398852675364
171987	Google's self-driving car tests focused on city driving	http://www.solarnews.ph/lifestyle/motoring/2014/04/29/google-s-self-driving-car-tests-focused-on-city-driving	Solar News PH	t	dG9ekvLf9IN8oyMU4RWcTHk6Wjd-M	www.solarnews.ph	1398852675739
171988	Google's self-driving car navigates city roads	http://www.emirates247.com/offbeat/this-is-life/google-s-self-driving-car-navigates-city-roads-2014-04-29-1.547349	Emirates 24\/7	t	dG9ekvLf9IN8oyMU4RWcTHk6Wjd-M	www.emirates247.com	1398852676003
171989	Google Says Driverless Cars Mastering City Streets	http://www.nbcbayarea.com/news/local/Google-Says-Driverless-Cars-Mastering-City-Streets-257091921.html	NBC Bay Area	t	dG9ekvLf9IN8oyMU4RWcTHk6Wjd-M	www.nbcbayarea.com	1398852676293
171990	Google's search for driverless car serves up SUV that goes it alone	http://www.irishexaminer.com/ireland/googles-search-for-driverless-car-serves-up-suv-that-goes-it-alone-266873.html	Irish Examiner	t	dG9ekvLf9IN8oyMU4RWcTHk6Wjd-M	www.irishexaminer.com	1398852676796
171991	Video: Here's What A Google Robot Car Sees Right Before It Decides Not To  ...	http://sfist.com/2014/04/28/heres_what_a_google_robot_car_sees.php	SFist	t	dG9ekvLf9IN8oyMU4RWcTHk6Wjd-M	sfist.com	1398852677083
171992	Driverless cars are mastering navigation of city streets: Google	http://economictimes.indiatimes.com/tech/internet/driverless-cars-are-mastering-navigation-of-city-streets-google/articleshow/34345536.cms	Economic Times	t	dG9ekvLf9IN8oyMU4RWcTHk6Wjd-M	economictimes.indiatimes.com	1398852677275
171993	Google says driving forward on autonomous car	http://english.astroawani.com/news/show/google-says-driving-forward-on-autonomous-car-34890	Astro Awani	t	dG9ekvLf9IN8oyMU4RWcTHk6Wjd-M	english.astroawani.com	1398852677471
171994	Google's driverless cars take a ride on city streets	http://rt.com/usa/155468-google-driverless-cars-2017/	RT	t	dG9ekvLf9IN8oyMU4RWcTHk6Wjd-M	rt.com	1398852677738
171995	Google's self-driving car boss improves on the abilities of the human eye	http://upstart.bizjournals.com/news/technology/2014/04/28/chris-urmson-on-google-self-driving-car.html	Upstart	t	dG9ekvLf9IN8oyMU4RWcTHk6Wjd-M	upstart.bizjournals.com	1398852677965
171996	Driverless cars hitting fast lane? Google now test-driving on city streets	http://www.techtimes.com/articles/6212/20140428/driverless-cars-hitting-fast-lane-google-now-test-driving-city.htm	Tech Times	t	dG9ekvLf9IN8oyMU4RWcTHk6Wjd-M	www.techtimes.com	1398852678174
171997	Google's self-driving cars are cruising through neighborhoods	http://www.infoworld.com/d/consumerization-of-it/googles-self-driving-cars-are-cruising-through-neighborhoods-241468	InfoWorld	t	dG9ekvLf9IN8oyMU4RWcTHk6Wjd-M	www.infoworld.com	1398852678366
171998	Google Tips Improvements in Self-Driving Car Software	http://www.ecoustics.com/news/google-tips-improvements-self-driving-car/	eCoustics.com	t	dG9ekvLf9IN8oyMU4RWcTHk6Wjd-M	www.ecoustics.com	1398852678929
171999	Google's driverless cars learning how to manage cities' issues	http://www.contracostatimes.com/news/ci_25652102/google-driverless-cars-are-mastering-city-streets	Contra Costa Times	t	dG9ekvLf9IN8oyMU4RWcTHk6Wjd-M	www.contracostatimes.com	1398852679171
172000	Self-driving cars slick on city streets - Google	http://www.enca.com/technology/self-driving-cars-slick-city-streets-google	eNCA	t	dG9ekvLf9IN8oyMU4RWcTHk6Wjd-M	www.enca.com	1398852679396
