274001	NASA to test giant Mars parachute in skies off the Hawaiian island of Kauai	http://www.wptv.com/news/science-tech/nasa-to-test-giant-mars-parachute-in-skies-off-the-hawaiian-island-of-kauai	WPTV	t	d3IC45rGXdSSgVMDEDleCgMojpjjM	www.wptv.com	1401895140039
274002	NASA to test giant saucer on earth for Mars landing	http://www.indiatvnews.com/news/world/nasa-to-test-giant-saucer-on-earth-for-mars-landing-17416.html	indiatvnews.com	t	d3IC45rGXdSSgVMDEDleCgMojpjjM	www.indiatvnews.com	1401895140339
274003	NASA 'Flying Saucer' Launch to Test Mars Landing Parachute Tech	http://news.yahoo.com/nasa-flying-saucer-launch-test-mars-landing-parachute-130648361.html	Yahoo News	t	d3IC45rGXdSSgVMDEDleCgMojpjjM	news.yahoo.com	1401895140598
274004	NASA Plans to Test Flying Saucer Over Hawaii	http://blogs.discovermagazine.com/d-brief/2014/06/03/nasa-plans-to-test-flying-saucer-over-hawaii/	Discover Magazine \(blog\)	t	d3IC45rGXdSSgVMDEDleCgMojpjjM	blogs.discovermagazine.com	1401895140878
274005	NASA Prepares to Test 'Flying Saucer'-Shaped Aircraft	http://www.foxbaltimore.com/news/features/top-stories/stories/nasa-prepares-test-flying-saucershaped-aircraft-28620.shtml	Fox Baltimore	t	d3IC45rGXdSSgVMDEDleCgMojpjjM	www.foxbaltimore.com	1401895141339
274006	Image of the Day: NASA Readies Flying Saucer Test for Mars' Mission	http://www.dailygalaxy.com/my_weblog/2014/06/image-of-the-day-nasa-readies-flying-saucer-test-for-mars-mission.html	The Daily Galaxy \(blog\)	t	d3IC45rGXdSSgVMDEDleCgMojpjjM	www.dailygalaxy.com	1401895141699
274007	NASA set to blast Mars “Flying Saucer” over the Pacific	http://www.networkworld.com/article/2357768/security0/nasa-set-to-blast-mars-flying-saucer-over-the-pacific.html	Network World	t	d3IC45rGXdSSgVMDEDleCgMojpjjM	www.networkworld.com	1401895141964
274008	NASA testing 'flying saucer' to land heavy payloads on Mars	http://www.sen.com/news/nasa-testing-flying-saucer-land-mars	Sen - Space exploration network	t	d3IC45rGXdSSgVMDEDleCgMojpjjM	www.sen.com	1401895142323
274009	NASA plans test launch of new 'flying saucer' spacecraft	http://www.wnem.com/story/25669342/nasa-plans-test-launch-of-new-flying-saucer-spacecraft	WNEM Saginaw	t	d3IC45rGXdSSgVMDEDleCgMojpjjM	www.wnem.com	1401895142581
274010	NASA launching 'flying saucer' Mars test from Hawaii	http://kxan.com/2014/06/03/nasa-launching-flying-saucer-mars-test-from-hawaii/	KXAN.com	t	d3IC45rGXdSSgVMDEDleCgMojpjjM	kxan.com	1401895142906
274011	NASA's “Flying Saucer” Ready For Flight Tests	http://ottawacitizen.com/news/national/defence-watch/nasas-flying-saucer-ready-for-flight-tests	Ottawa Citizen	t	d3IC45rGXdSSgVMDEDleCgMojpjjM	ottawacitizen.com	1401895143189
274012	NASA Prepares Flying Saucer for Test Flight	http://www.hngn.com/articles/32868/20140603/nasa-prepares-flying-saucer-for-test-flight.htm	Headlines \& Global News	t	d3IC45rGXdSSgVMDEDleCgMojpjjM	www.hngn.com	1401895143447
274013	NASA may Test Saucer-Shaped Vehicle on Tuesday	http://frenchtribune.com/teneur/1422706-nasa-may-test-saucer-shaped-vehicle-tuesday	French Tribune	t	d3IC45rGXdSSgVMDEDleCgMojpjjM	frenchtribune.com	1401895143785
274014	NASA—Flying Saucer To Take To The Skies Over Hawai'i (Spacecraft—Launch)	http://www.satnews.com/story.php\?number=2097656363	SatNews Publishers	t	d3IC45rGXdSSgVMDEDleCgMojpjjM	www.satnews.com	1401895144005
274015	Alien over Hawaii? No. It's NASA's Mars flying saucer testing it's parachute	http://www.techtimes.com/articles/7888/20140603/alien-over-hawaii-no-its-nasas-mars-flying-saucer-testing-its-parachute.htm	Tech Times	t	d3IC45rGXdSSgVMDEDleCgMojpjjM	www.techtimes.com	1401895144220
274016	NASA To Test Giant Mars Parachute	http://www.sci-tech-today.com/story.xhtml\?story_id=0030002DWE36	Sci-Tech Today	t	d3IC45rGXdSSgVMDEDleCgMojpjjM	www.sci-tech-today.com	1401895144709
274017	Comcast to encrypt emails after Google report calls them out	http://www.upi.com/Business_News/2014/06/04/Comcast-to-encrypt-emails-after-Google-report-calls-them-out/5891401887487/	UPI.com	t	dFDC8c6BeyPTAaMYtO9S7h62-K8gM	www.upi.com	1401895542279
274018	Google, 'End-to-End' encryption: Company testing super-secure email	http://www.wptv.com/news/science-tech/google-end-to-end-encryption-company-testing-super-secure-email	WPTV	t	dFDC8c6BeyPTAaMYtO9S7h62-K8gM	www.wptv.com	1401895542508
274019	Google to provide end-to-end email encryption with Chrome extension	http://www.upi.com/Business_News/2014/06/04/Google-to-provide-end-to-end-email-encryption-with-Chrome-extension/2751401885614/	UPI.com	t	dFDC8c6BeyPTAaMYtO9S7h62-K8gM	www.upi.com	1401895542727
274020	Google tries to block NSA spies with new encryption tool	http://www.bizjournals.com/sanjose/news/2014/06/04/google-tries-to-block-nsa-spies-with-new.html	Silicon Valley Business Journal	t	dFDC8c6BeyPTAaMYtO9S7h62-K8gM	www.bizjournals.com	1401895542947
274021	Google Reveals Encryption Add-On, Calls Out Insecure Services	http://www.pcmag.com/article2/0,2817,2458948,00.asp	PC Magazine	t	dFDC8c6BeyPTAaMYtO9S7h62-K8gM	www.pcmag.com	1401895543236
274022	Google Joins Reset the Net Campaign	http://www.autoworldnews.com/articles/7682/20140604/google-joins-reset-the-net-campaign.htm	Auto World News	t	dFDC8c6BeyPTAaMYtO9S7h62-K8gM	www.autoworldnews.com	1401895543627
274023	Gmail reveals how much of your email is secret	http://www.slashgear.com/gmail-reveals-how-much-of-your-email-is-secret-04332025/	SlashGear	t	dFDC8c6BeyPTAaMYtO9S7h62-K8gM	www.slashgear.com	1401895543882
274024	Google to Release End-to-End Encryption for Chrome	http://www.hngn.com/articles/32926/20140604/google-to-release-end-to-end-encryption-for-chrome.htm	Headlines \& Global News	t	dFDC8c6BeyPTAaMYtO9S7h62-K8gM	www.hngn.com	1401895544193
274025	Encrypted Email Rising Amid Spying Fears	http://dfw.cbslocal.com/2014/06/04/encrypted-email-rising-amid-spying-fears/	CBS Local	t	dFDC8c6BeyPTAaMYtO9S7h62-K8gM	dfw.cbslocal.com	1401895544474
274026	Comcast wants to encrypt email for security	http://fansided.com/2014/06/04/comcast-wants-encrypt-email-security/	FanSided	t	dFDC8c6BeyPTAaMYtO9S7h62-K8gM	fansided.com	1401895544750
274027	Comcast to encrypt customers' emails for security	http://www.marketwatch.com/story/comcast-to-encrypt-customers-emails-for-security-2014-06-04\?reflink=MW_news_stmp	MarketWatch	t	dFDC8c6BeyPTAaMYtO9S7h62-K8gM	www.marketwatch.com	1401895545014
274028	Volume of encrypted email rising amid spying fears	http://www.dailyherald.com/article/20140604/business/140609418/	Chicago Daily Herald	t	dFDC8c6BeyPTAaMYtO9S7h62-K8gM	www.dailyherald.com	1401895545254
274029	Volume of encrypted e-mail rises among Google, Facebook and Yahoo	http://www.scmp.com/news/world/article/1525334/volume-encrypted-e-mail-rises-among-google-facebook-and-yahoo	South China Morning Post	t	dFDC8c6BeyPTAaMYtO9S7h62-K8gM	www.scmp.com	1401895545602
274030	Google unveils source code for Chrome encryption extension	http://www.net-security.org/secworld.php\?id=16958	Help Net Security	t	dFDC8c6BeyPTAaMYtO9S7h62-K8gM	www.net-security.org	1401895545856
274031	Google testing super-secure email	http://www.wcvb.com/money/Google-testing-super-secure-email/26311090	WCVB Boston	t	dFDC8c6BeyPTAaMYtO9S7h62-K8gM	www.wcvb.com	1401895546493
274032	Comcast answers Google's call for end-to-end email encryption	http://www.delhidailynews.com/news/Comcast-answers-Googles-call-for-end-to-end-email-encryption-1401885649/	Delhi Daily News	t	dFDC8c6BeyPTAaMYtO9S7h62-K8gM	www.delhidailynews.com	1401895546775
274033	Google Releases End-to-End Encryption Extension	http://threatpost.com/google-releases-end-to-end-encryption-extension	Threatpost	t	dFDC8c6BeyPTAaMYtO9S7h62-K8gM	threatpost.com	1401895547015
274034	Google joins Reset the Net, offers end-to-end mail encryption	http://www.theinquirer.net/inquirer/news/2348144/google-joins-reset-the-net-offers-end-to-end-mail-encryption	Inquirer	t	dFDC8c6BeyPTAaMYtO9S7h62-K8gM	www.theinquirer.net	1401895547257
274035	Google just released an end-to-end mail encryption tool for Chrome	http://www.theregister.co.uk/2014/06/03/google_unveils_end_to_end_for_email_encryption/	Register	t	dFDC8c6BeyPTAaMYtO9S7h62-K8gM	www.theregister.co.uk	1401895547602
274036	End to end encryption now available on Chrome	http://thefootballexaminer.com/technology-22/end-to-end-encryption-now-available-on-chrome-2357.html	The Football Examiner	t	dFDC8c6BeyPTAaMYtO9S7h62-K8gM	thefootballexaminer.com	1401895547860
274037	PGP Made Easy: Google Promising End-to-End Encryption for Email	http://www.ibtimes.co.uk/pgp-made-easy-google-promising-end-end-encryption-email-1451254	International Business Times UK	t	dFDC8c6BeyPTAaMYtO9S7h62-K8gM	www.ibtimes.co.uk	1401895548113
274038	Who sends e-mail securely in SA?	http://mybroadband.co.za/news/security/103633-who-sends-e-mail-securely-in-sa.html	MyBroadband	t	dFDC8c6BeyPTAaMYtO9S7h62-K8gM	mybroadband.co.za	1401895548462
274039	Google, in promoting encryption, calls out Microsoft and Comcast	http://www.infoworld.com/d/security/google-in-promoting-encryption-calls-out-microsoft-and-comcast-243697	InfoWorld	t	dFDC8c6BeyPTAaMYtO9S7h62-K8gM	www.infoworld.com	1401895548715
274040	Google Data Shows That Around 50% Of Email Exchanges Aren't Encrypted	http://www.businessinsider.in/Google-Data-Shows-That-Around-50-Of-Email-Exchanges-Arent-Encrypted/articleshow/36029256.cms	Businessinsider India	t	dFDC8c6BeyPTAaMYtO9S7h62-K8gM	www.businessinsider.in	1401895548967
274041	Google analysis says encryption technology is shielding more email amid  ...	http://www.montrealgazette.com/business/Google+analysis+says+encryption+technology+shielding+more/9903992/story.html	Montreal Gazette	t	dFDC8c6BeyPTAaMYtO9S7h62-K8gM	www.montrealgazette.com	1401895549172
274042	Google boosts Chrome encryption amid email warning	http://www.zdnet.com/google-boosts-chrome-encryption-amid-email-warning-7000030181/	ZDNet \(blog\)	t	dFDC8c6BeyPTAaMYtO9S7h62-K8gM	www.zdnet.com	1401895549589
274043	Google Open Sources End-To-End Email Encryption	http://www.techweekeurope.co.uk/news/google-end-to-end-email-encryption-nsa-146732	TechWeekEurope UK	t	dFDC8c6BeyPTAaMYtO9S7h62-K8gM	www.techweekeurope.co.uk	1401895549813
274044	Email encryption becoming widespread, says Google	http://eandt.theiet.org/news/2014/jun/google-encruption-email.cfm	E\&T magazine	t	dFDC8c6BeyPTAaMYtO9S7h62-K8gM	eandt.theiet.org	1401895550075
274045	Google Launches End-to-End Chrome Extension for Encrypted Emails	http://gadgets.ndtv.com/internet/news/google-launches-end-to-end-chrome-extension-for-encrypted-emails-535957	NDTV	t	dFDC8c6BeyPTAaMYtO9S7h62-K8gM	gadgets.ndtv.com	1401895550444
274046	Google goads users to use encryption	http://www.freep.com/article/20140604/FEATURES01/306040071/Google-encryption-Web-safety	Detroit Free Press	t	dFDC8c6BeyPTAaMYtO9S7h62-K8gM	www.freep.com	1401895550675
274047	Google pushes encryption on mail	http://www.fudzilla.com/home/item/34909-google-pushes-encryption-on-mail	Fudzilla	t	dFDC8c6BeyPTAaMYtO9S7h62-K8gM	www.fudzilla.com	1401895550929
274048	Google Chrome bags new data encryption extension	http://www.itpro.co.uk/web-browsers/22393/google-chrome-bags-new-data-encryption-extension	IT PRO	t	dFDC8c6BeyPTAaMYtO9S7h62-K8gM	www.itpro.co.uk	1401895551166
274049	Google to offer end-to-end email encryption to hide data from spying eyes	http://www.v3.co.uk/v3-uk/news/2348160/google-to-offer-end-to-end-email-encryption-to-hide-data-from-spying-eyes	V3.co.uk	t	dFDC8c6BeyPTAaMYtO9S7h62-K8gM	www.v3.co.uk	1401895551560
274050	Email Encryption by Comcast	http://kashgartimes.com/technology-22/email-encryption-by-comcast-443.html	Kashgar Times	t	dFDC8c6BeyPTAaMYtO9S7h62-K8gM	kashgartimes.com	1401895551873
274051	Google reveals free tool for easily encrypting e-mails	http://www.myce.com/news/google-reveals-free-tool-for-easily-encrypting-e-mails-71734/	myce.com	t	dFDC8c6BeyPTAaMYtO9S7h62-K8gM	www.myce.com	1401895552477
274052	Volume of encrypted email rising amid spying fears: survey	http://www.deccanchronicle.com/140604/technology-latest/article/volume-encrypted-email-rising-amid-spying-fears-survey	Deccan Chronicle	t	dFDC8c6BeyPTAaMYtO9S7h62-K8gM	www.deccanchronicle.com	1401895552953
274053	Google will now name and shame e-mail providers that don't support encryption	http://www.washingtonpost.com/blogs/the-switch/wp/2014/06/03/google-will-now-name-and-shame-e-mail-providers-that-dont-support-encryption/\?tid=pm_business_pop	Washington Post \(blog\)	t	dFDC8c6BeyPTAaMYtO9S7h62-K8gM	www.washingtonpost.com	1401895553248
274054	Google Encrypted Gmail–The Official Announcement	http://247wallst.com/apps-software/2014/06/04/google-encrypted-gmail-the-official-announcement/	24\/7 Wall St.	t	dFDC8c6BeyPTAaMYtO9S7h62-K8gM	247wallst.com	1401895553453
274055	Google unveils end-to-end Chrome encryption	http://www.pcpro.co.uk/news/security/389119/google-unveils-end-to-end-chrome-encryption	PC Pro	t	dFDC8c6BeyPTAaMYtO9S7h62-K8gM	www.pcpro.co.uk	1401895553699
274056	Google offers mail encryption tool for paranoid Chrome users	http://memeburn.com/2014/06/google-offers-mail-encryption-tool-for-its-online-paranoid/	Memeburn	t	dFDC8c6BeyPTAaMYtO9S7h62-K8gM	memeburn.com	1401895553935
274057	Google, Facebook, Yahoo Automatically Encrypting All Emails	http://www.indiatimes.com/technology/internet/google-facebook-yahoo-automatically-encrypting-all-emails-152726.html	Indiatimes.com	t	dFDC8c6BeyPTAaMYtO9S7h62-K8gM	www.indiatimes.com	1401895554388
274058	Google Brings End-to-End Encryption to Email	http://www.gizmodo.co.uk/2014/06/google-brings-end-to-end-encryption-to-email/	Gizmodo UK	t	dFDC8c6BeyPTAaMYtO9S7h62-K8gM	www.gizmodo.co.uk	1401895554634
274059	Google Now Offers End-to-End Encryption on Email	http://www.gizmodo.in/news/Google-Now-Offers-End-to-End-Encryption-on-Email/articleshow/36043833.cms	Gizmodo India	t	dFDC8c6BeyPTAaMYtO9S7h62-K8gM	www.gizmodo.in	1401895554886
274060	Volume of encrypted email rising amid spying fears (Update 2)	http://phys.org/news/2014-06-volume-encrypted-email-spying.html	Phys.Org	t	dFDC8c6BeyPTAaMYtO9S7h62-K8gM	phys.org	1401895555240
274061	Google analysis shows that volume of encrypted emails is increasing rapidly	http://newsmaine.net/19443-google-analysis-shows-volume-encrypted-emails-increasing-rapidly	Maine News	t	dFDC8c6BeyPTAaMYtO9S7h62-K8gM	newsmaine.net	1401895555524
274062	Google to secure e-mail with End-to-End encryption extension for Chrome	http://www.afterdawn.com/news/article.cfm/2014/06/04/google_to_secure_e-mail_with_end-to-end_encryption_extension_for_chrome	Afterdawn.com	t	dFDC8c6BeyPTAaMYtO9S7h62-K8gM	www.afterdawn.com	1401895555797
274063	Google to make it easier for Chrome users to encrypt their email End-to-End	http://www.siliconrepublic.com/enterprise/item/37128-google-to-make-it-easier-fo/	Siliconrepublic.com	t	dFDC8c6BeyPTAaMYtO9S7h62-K8gM	www.siliconrepublic.com	1401895556028
274064	Google to bring End-to-End email encryption to Chrome	http://www.techienews.co.uk/9712952/google-bring-end-end-email-encryption-chrome/	Techie News	t	dFDC8c6BeyPTAaMYtO9S7h62-K8gM	www.techienews.co.uk	1401895556363
274065	Google calls out for email encryption, 69% emails are easy to hack	http://www.thewestsidestory.net/2014/06/04/12210/google-calls-email-encryption-69-emails-easy-hack/	The Westside Story	t	dFDC8c6BeyPTAaMYtO9S7h62-K8gM	www.thewestsidestory.net	1401895556798
274066	Google, Facebook, Yahoo and others automatically encrypting all emails	http://timesofindia.indiatimes.com/tech/tech-news/Google-Facebook-Yahoo-and-others-automatically-encrypting-all-emails/articleshow/36037151.cms	Times of India	t	dFDC8c6BeyPTAaMYtO9S7h62-K8gM	timesofindia.indiatimes.com	1401895557063
274067	Google, Facebook and others encrypting email amid rising spying fears	http://tech.firstpost.com/news-analysis/google-facebook-and-others-encrypting-email-amid-rising-spying-fears-225118.html	Firstpost	t	dFDC8c6BeyPTAaMYtO9S7h62-K8gM	tech.firstpost.com	1401895557377
274068	Google Unveils Tool to Encrypt Email Messages	http://www.technewsplus.com/google-unveils-tool-encrypt-email-messages/2127/	Tech News Plus	t	dFDC8c6BeyPTAaMYtO9S7h62-K8gM	www.technewsplus.com	1401895557649
274069	More emails encrypted to beat spies	http://news.uk.msn.com/more-emails-encrypted-to-beat-spies	MSN UK	t	dFDC8c6BeyPTAaMYtO9S7h62-K8gM	news.uk.msn.com	1401895558006
274070	Encrypted Email Volume Rising Amid Spying Fears	http://gadgets.ndtv.com/internet/news/encrypted-email-volume-rising-amid-spying-fears-535699	NDTV	t	dFDC8c6BeyPTAaMYtO9S7h62-K8gM	gadgets.ndtv.com	1401895558359
274071	Google launches Chrome extension End-to-End for sending and receiving  ...	http://thenextweb.com/google/2014/06/03/google-launches-chrome-extension-end-end-sending-receiving-encrypted-emails-browser/\?utm_source=social&amp;utm_medium=feed&amp;utm_campaign=profeed	The Next Web	t	dFDC8c6BeyPTAaMYtO9S7h62-K8gM	thenextweb.com	1401895558585
274072	Volume of Encrypted Email Rising Amid Spying Fears: Google Report	http://www.ndtv.com/article/world/volume-of-encrypted-email-rising-amid-spying-fears-google-report-535681	NDTV	t	dFDC8c6BeyPTAaMYtO9S7h62-K8gM	www.ndtv.com	1401895558841
274073	Gmail And Other Email Providers Encrypt Email For User Privacy	http://www.hngn.com/articles/32929/20140603/gmail-and-other-email-providers-encrypt-email-for-user-privacy.htm	Headlines \& Global News	t	dFDC8c6BeyPTAaMYtO9S7h62-K8gM	www.hngn.com	1401895559066
274074	Volume of encrypted email rises amid spying fears	http://newsok.com/volume-of-encrypted-email-rises-amid-spying-fears/article/4880004	NewsOK.com	t	dFDC8c6BeyPTAaMYtO9S7h62-K8gM	newsok.com	1401895559391
274075	Volume of encryption email rising amid spying fears	http://www.thenewage.co.za/127234-1026-53-Volume_of_encryption_email_rising_amid_spying_fears	The New Age Online	t	dFDC8c6BeyPTAaMYtO9S7h62-K8gM	www.thenewage.co.za	1401895559774
274076	Google Renews Battle With the NSA by Open Sourcing Email Encryption Tool	http://www.wired.com/2014/06/end-to-end/	Wired	t	dFDC8c6BeyPTAaMYtO9S7h62-K8gM	www.wired.com	1401895560038
274077	Google plans end-to-end encryption tool for additional email privacy	http://www.pcworld.com/article/2359400/google-plans-end-to-end-encryption-tool-for-additional-email-privacy.html	PCWorld \(blog\)	t	dFDC8c6BeyPTAaMYtO9S7h62-K8gM	www.pcworld.com	1401895560447
274078	Google offers End-To-End encryption with new alpha Chrome extension	http://betanews.com/2014/06/03/google-offers-end-to-end-encryption-with-new-alpha-chrome-extension/	BetaNews	t	dFDC8c6BeyPTAaMYtO9S7h62-K8gM	betanews.com	1401895560712
274079	How Google's New “End-To-End” Email Privacy Push Will Protect You — Even  ...	http://marketingland.com/how-google-privacy-protect-86129	Marketing Land	t	dFDC8c6BeyPTAaMYtO9S7h62-K8gM	marketingland.com	1401895560961
274080	More turn to encrypted email amid spying fears	http://www.mercurynews.com/business/ci_25889438/more-turn-encrypted-email-amid-spying-fears	San Jose Mercury News	t	dFDC8c6BeyPTAaMYtO9S7h62-K8gM	www.mercurynews.com	1401895561363
274081	Google: Lack of Email Encryption By Comcast, Verizon Make It Easy For  ...	http://washington.cbslocal.com/2014/06/03/google-only-half-of-emails-sent-to-gmail-users-are-shielded-from-government-spying/	CBS Local	t	dFDC8c6BeyPTAaMYtO9S7h62-K8gM	washington.cbslocal.com	1401895561598
274082	Google ups the ante on email encryption	https://gigaom.com/2014/06/03/google-ups-the-ante-on-email-encryption/	GigaOM	t	dFDC8c6BeyPTAaMYtO9S7h62-K8gM	gigaom.com	1401895561876
274083	Google-released Chrome extension allows easy in-browser Webmail encryption	http://arstechnica.com/security/2014/06/google-released-chrome-extension-allows-easy-in-browser-webmail-encryption/	Ars Technica	t	dFDC8c6BeyPTAaMYtO9S7h62-K8gM	arstechnica.com	1401895562332
274084	Google's new Chrome add-on secures your email every step of the way	http://www.engadget.com/2014/06/03/chrome-end-to-end/	Engadget	t	dFDC8c6BeyPTAaMYtO9S7h62-K8gM	www.engadget.com	1401895562691
274085	New Chrome Extension To Demystify Encryption	http://www.techsonia.com/new-chrome-extension-to-demystify-encryption/1912277/	Techsonia	t	dFDC8c6BeyPTAaMYtO9S7h62-K8gM	www.techsonia.com	1401895562889
274086	Google to enable end-to-end encryption for user emails	https://www.accessnow.org/blog/2014/06/03/google-to-enable-users-to-encrypt-all-emails	Access \(blog\)	t	dFDC8c6BeyPTAaMYtO9S7h62-K8gM	www.accessnow.org	1401895563139
274087	New Gmail Safer Email in Transparency report	http://www.onlinesocialmedia.net/20140604/new-gmail-safer-email-in-transparency-report/	Online Social Media	t	dFDC8c6BeyPTAaMYtO9S7h62-K8gM	www.onlinesocialmedia.net	1401895563728
274088	Encryption technology provides shield amid cyberspying fears: Google analysis	http://www.ctvnews.ca/sci-tech/encryption-technology-provides-shield-amid-cyberspying-fears-google-analysis-1.1851451	CTV News	t	dFDC8c6BeyPTAaMYtO9S7h62-K8gM	www.ctvnews.ca	1401895563963
274089	New Chrome extension hopes to demystify encryption	http://www.cnet.com/news/new-chrome-extension-hopes-to-de-mystify-encryption/	CNET	t	dFDC8c6BeyPTAaMYtO9S7h62-K8gM	www.cnet.com	1401895564220
274090	Google Says 65% Of Outgoing Gmail Is Encrypted	http://news.investors.com/technology/060314-703190-google-updates-transparency-report.htm	Investor's Business Daily	t	dFDC8c6BeyPTAaMYtO9S7h62-K8gM	news.investors.com	1401895564448
274091	Google Plans To Launch An Easy-To-Use Chrome Plug-In For Email Encryption  ...	http://techcrunch.com/2014/06/03/google-plans-to-launch-an-easy-to-use-chrome-plug-in-for-email-encryption-soon/\?ncid=rss	TechCrunch	t	dFDC8c6BeyPTAaMYtO9S7h62-K8gM	techcrunch.com	1401895564667
274092	End to End from Google will offer encrypted exchanges, now looking for testers	http://theslanted.com/2014/06/15412/end-end-google-will-offer-encrypted-exchanges-now-looking-testers/	The Slanted	t	dFDC8c6BeyPTAaMYtO9S7h62-K8gM	theslanted.com	1401895565025
274093	Google, Inc. (GOOG) Updates on Security Features in Gmail	http://www.streetinsider.com/Insiders+Blog/Google,+Inc.+(GOOG)+Updates+on+Security+Features+in+Gmail/9550809.html	StreetInsider.com \(subscription\) \(blog\)	t	dFDC8c6BeyPTAaMYtO9S7h62-K8gM	www.streetinsider.com	1401895565278
274094	Google begins detailing email encryption rates in its Transparency Report	http://thenextweb.com/google/2014/06/03/google-begins-detailing-email-encryption-rates-transparency-report/	The Next Web	t	dFDC8c6BeyPTAaMYtO9S7h62-K8gM	thenextweb.com	1401895565510
274095	Google analysis concludes encryption technology is shielding a rapidly rising  ...	http://www.startribune.com/lifestyle/261719681.html\?src=news-stmp	Minneapolis Star Tribune	t	dFDC8c6BeyPTAaMYtO9S7h62-K8gM	www.startribune.com	1401895565693
274096	China State Media Demands 'Severe Punishment' for Google, Apple, US Tech  ...	http://www.moneynews.com/Economy/china-google-apple-tech-firms/2014/06/04/id/575073/	Moneynews	t	dFTldqd7DXojIWM8LWdREzKO_YaTM	www.moneynews.com	1401895726381
274097	Chinese media urge resistance against "naked internet hegemony" of U.S. tech  ...	http://gigaom.com/2014/06/04/chinese-media-urge-resistance-against-naked-internet-hegemony-of-u-s-tech-firms/	GigaOM	t	dFTldqd7DXojIWM8LWdREzKO_YaTM	gigaom.com	1401895726834
274098	China calls for 'severe punishment' for US tech	http://www.cnbc.com/id/101730095	CNBC.com	t	dFTldqd7DXojIWM8LWdREzKO_YaTM	www.cnbc.com	1401895727149
274099	Chinese media attack U.S. 'pawns,' aka Google, Yahoo et al.	http://www.bizjournals.com/sanjose/news/2014/06/04/chinese-media-attack-u-s-pawns-akagoogle-yahoo-et.html	Silicon Valley Business Journal	t	dFTldqd7DXojIWM8LWdREzKO_YaTM	www.bizjournals.com	1401895727419
274100	Foreign tech firms pose threat on Internet	http://usa.chinadaily.com.cn/2014-06/04/content_17560495.htm	Chinadaily USA	t	dFTldqd7DXojIWM8LWdREzKO_YaTM	usa.chinadaily.com.cn	1401895727635
