701	Will banana prices slip on merger?	http://www.marketwatch.com/story/will-banana-prices-slip-on-merger-2014-03-10	MarketWatch	b	d2OyTeAXDFQpb3M9Cr_Ftde6Ig0aM	www.marketwatch.com	1394487579031
702	World has new top banana: Fruit giants Chiquita and Fyffes merge	http://www.therecord.com/news-story/4405766-world-has-new-top-banana-fruit-giants-chiquita-and-fyffes-merge/	Waterloo Record	b	d2OyTeAXDFQpb3M9Cr_Ftde6Ig0aM	www.therecord.com	1394487579241
703	Chiquita to Acquire Fyffes Creating Biggest Banana Supplier (4)	http://www.businessweek.com/news/2014-03-10/chiquita-brands-to-merge-with-fyffes-to-create-banana-leader	Businessweek	b	d2OyTeAXDFQpb3M9Cr_Ftde6Ig0aM	www.businessweek.com	1394487579409
704	No second banana: Fruit giants Chiquita and Fyffes merge	http://www.csmonitor.com/Business/The-Bite/2014/0310/No-second-banana-Fruit-giants-Chiquita-and-Fyffes-merge	Christian Science Monitor	b	d2OyTeAXDFQpb3M9Cr_Ftde6Ig0aM	www.csmonitor.com	1394487579601
705	Chiquita and Fyffes hope to become top banana in global market	http://www.theguardian.com/business/nils-pratley-on-finance/2014/mar/10/chiquita-fyffes-merger-banana-global-market	The Guardian	b	d2OyTeAXDFQpb3M9Cr_Ftde6Ig0aM	www.theguardian.com	1394487579844
706	Chiquita to merge with Ireland's Fyffes	http://www.bellinghamherald.com/2014/03/10/3521077/chiquita-to-merge-with-irelands.html	Bellingham Herald	b	d2OyTeAXDFQpb3M9Cr_Ftde6Ig0aM	www.bellinghamherald.com	1394487580054
707	Merger Means Charlotte Will Share Chiquita With Dublin	http://wfae.org/post/merger-means-charlotte-will-share-chiquita-dublin	WFAE	b	d2OyTeAXDFQpb3M9Cr_Ftde6Ig0aM	wfae.org	1394487580239
708	TIMELINE: Chiquita Brands	http://www.wsoctv.com/news/news/local/timeline-chiquita-brands/nd9KG/	WSOC Charlotte	b	d2OyTeAXDFQpb3M9Cr_Ftde6Ig0aM	www.wsoctv.com	1394487580407
709	Big Merger Creates the World's Largest Banana Company	http://www.thewire.com/business/2014/03/big-merger-creates-worlds-largest-banana-company/359003/	The Wire	b	d2OyTeAXDFQpb3M9Cr_Ftde6Ig0aM	www.thewire.com	1394487580583
710	Chiquita To Become Top Banana With $526M Fyffes Merger	http://www.law360.com/articles/516719/chiquita-to-become-top-banana-with-526m-fyffes-merger	Law360 \(subscription\)	b	d2OyTeAXDFQpb3M9Cr_Ftde6Ig0aM	www.law360.com	1394487580852
711	Chiquita and Fyffes join to make world's biggest banana firm	http://www.euronews.com/business-newswires/2394004-chiquita-and-fyffes-join-to-make-worlds-biggest-banana-firm/	euronews	b	d2OyTeAXDFQpb3M9Cr_Ftde6Ig0aM	www.euronews.com	1394487581044
712	Chiquita, the banana seller with NJ roots, to buy Irish rival Fyffes in deal that  ...	http://www.nj.com/business/index.ssf/2014/03/chiquita_the_banana_seller_with_nj_roots_to_buy_irish_rival_fyffes_in_deal_that_appeals.html	The Star-Ledger	b	d2OyTeAXDFQpb3M9Cr_Ftde6Ig0aM	www.nj.com	1394487581220
713	With Chiquita-Fyffes Merger, Dole Will No Longer Be Top Banana	http://www.businessweek.com/articles/2014-03-10/with-chiquita-fyffes-merger-dole-will-no-longer-be-top-banana	Businessweek	b	d2OyTeAXDFQpb3M9Cr_Ftde6Ig0aM	www.businessweek.com	1394487581422
714	UPDATE: Chiquita, Fyffes outline benefits of scale	http://www.just-food.com/news/chiquita-fyffes-outline-benefits-of-scale_id126182.aspx	just-food.com \(subscription\)	b	d2OyTeAXDFQpb3M9Cr_Ftde6Ig0aM	www.just-food.com	1394487581599
715	Fyffes merger creates banana behemoth	http://www.scotsman.com/business/food-drink-agriculture/fyffes-merger-creates-banana-behemoth-1-3334485	Scotsman \(blog\)	b	d2OyTeAXDFQpb3M9Cr_Ftde6Ig0aM	www.scotsman.com	1394487581843
716	Why Shares of Chiquita Brands International, Inc. Were Shining Today	http://www.fool.com/investing/general/2014/03/10/why-shares-of-chiquita-brands-international-inc-we.aspx	Motley Fool	b	d2OyTeAXDFQpb3M9Cr_Ftde6Ig0aM	www.fool.com	1394487582018
717	Chiquita to buy Fyffes to create world's biggest banana supplier brand	http://www.financialexpress.com/news/chiquita-to-buy-fyffes-to-create-world-s-biggest-banana-supplier-brand/1232533	Financial Express	b	d2OyTeAXDFQpb3M9Cr_Ftde6Ig0aM	www.financialexpress.com	1394487582203
718	Banana Giants Chiquita, Fyffes Agree to $1.07B Merger	http://www.foxbusiness.com/industries/2014/03/10/banana-giants-chiquita-fyffes-agree-to-107b-merger/	Fox Business	b	d2OyTeAXDFQpb3M9Cr_Ftde6Ig0aM	www.foxbusiness.com	1394487582388
719	Chiquita to merge with Irish produce company	http://www.charlotteobserver.com/2014/03/10/4755499/chiquita-to-merge-with-irish-produce.html	Charlotte Observer	b	d2OyTeAXDFQpb3M9Cr_Ftde6Ig0aM	www.charlotteobserver.com	1394487582566
720	Chiquita Brands International Rating Lowered to Underperform at Zacks (CQB)	http://www.wkrb13.com/markets/276750/chiquita-brands-international-rating-lowered-to-underperform-at-zacks-cqb/	WKRB News	b	d2OyTeAXDFQpb3M9Cr_Ftde6Ig0aM	www.wkrb13.com	1394487582893
721	Chiquita Brands acquires Fyffes to create world's biggest banana seller	http://latino.foxnews.com/latino/news/2014/03/10/chiquita-brands-acquires-fyffes-to-create-world-biggest-banana-seller/	Fox News Latino	b	d2OyTeAXDFQpb3M9Cr_Ftde6Ig0aM	latino.foxnews.com	1394487583051
722	World has new top banana as fruit giants Chiquita of US and Fyffes of Europe  ...	http://www.timescolonist.com/world-has-new-top-banana-as-fruit-giants-chiquita-of-us-and-fyffes-of-europe-merge-1.887685	Times Colonist	b	d2OyTeAXDFQpb3M9Cr_Ftde6Ig0aM	www.timescolonist.com	1394487583211
723	World has new top banana	http://www.montereyherald.com/agriculture/ci_25312738/world-has-new-top-banana	Monterey County Herald	b	d2OyTeAXDFQpb3M9Cr_Ftde6Ig0aM	www.montereyherald.com	1394487583371
724	Monday Afternoon Business Brief	http://www.keloland.com/newsdetail.cfm/monday-afternoon-business-brief/\?id=161338	KELOLAND TV	b	d2OyTeAXDFQpb3M9Cr_Ftde6Ig0aM	www.keloland.com	1394487583547
725	Top Banana: Chiquita And Fyffes To Merge	http://www.manufacturing.net/news/2014/03/top-banana-chiquita-and-fyffes-to-merge	Manufacturing.net	b	d2OyTeAXDFQpb3M9Cr_Ftde6Ig0aM	www.manufacturing.net	1394487583707
726	Chrysler Recalls 25000 Vehicles, Loosening Russia's Energy Grip, Fyffes to  ...	http://spendmatters.com/2014/03/10/chrysler-recalls-25000-vehicles-loosening-russias-energy-grip-fyffes-merge-chiquita/	Spend Matters	b	d2OyTeAXDFQpb3M9Cr_Ftde6Ig0aM	spendmatters.com	1394487583909
727	Charlotte-based Chiquita to merge with Irish fruit company	http://www.thestate.com/2014/03/10/3317128/charlotte-based-chiquita-to-merge.html	The State	b	d2OyTeAXDFQpb3M9Cr_Ftde6Ig0aM	www.thestate.com	1394487584068
728	Chiquita merges with Fyffes of Ireland to become world's largest banana supplier	http://www.wcpo.com/money/local-business-news/chiquita-merges-with-fyffes-of-ireland-to-become-worlds-largest-banana-supplier	WCPO	b	d2OyTeAXDFQpb3M9Cr_Ftde6Ig0aM	www.wcpo.com	1394487584228
729	UPDATE 4-Chiquita and Fyffes join to make world's biggest banana firm	http://www.reuters.com/article/2014/03/10/fyffes-chiquita-brands-idUSL3N0M724Y20140310	Reuters	b	d2OyTeAXDFQpb3M9Cr_Ftde6Ig0aM	www.reuters.com	1394487584412
730	Chiquita, Fyffes to create world's largest banana company	http://en.europeonline-magazine.eu/chiquita-fyffes-to-create-worlds-largest-banana-company_325047.html	Europe Online Magazine	b	d2OyTeAXDFQpb3M9Cr_Ftde6Ig0aM	en.europeonline-magazine.eu	1394487584615
731	24m supply chain savings from banana merger	http://www.supplychainstandard.com/Articles/4889/24m+supply+chain+savings+from+banana+merger.html	Supply Chain Standard	b	d2OyTeAXDFQpb3M9Cr_Ftde6Ig0aM	www.supplychainstandard.com	1394487584842
732	Chiquita and Fyffes to create world's biggest banana group	http://www.telegraph.co.uk/finance/commodities/10688380/Chiquita-and-Fyffes-to-create-worlds-biggest-banana-group.html	Telegraph.co.uk	b	d2OyTeAXDFQpb3M9Cr_Ftde6Ig0aM	www.telegraph.co.uk	1394487584994
733	New deal makes Chiquita world's top banana company	http://thecelebritycafe.com/feature/2014/03/new-deal-makes-chiquita-world-s-top-banana-company	TheCelebrityCafe.com	b	d2OyTeAXDFQpb3M9Cr_Ftde6Ig0aM	thecelebritycafe.com	1394487585178
734	Chiquita/Fyffes merger creates world's biggest banana supplier	http://metronews.ca/news/world/967041/chiquitafyffes-merger-creates-worlds-biggest-banana-supplier/	MetroNews Canada	b	d2OyTeAXDFQpb3M9Cr_Ftde6Ig0aM	metronews.ca	1394487585363
735	Fyffes to be Acquired by Chiquita Brands	http://tickerreport.com/goods-commodities/159634/fyffes-acquired-chiquita-brands/	Ticker Report	b	d2OyTeAXDFQpb3M9Cr_Ftde6Ig0aM	tickerreport.com	1394487585523
736	Chiquita, Fyffes merger to create top banana company	http://au.news.yahoo.com/thewest/business/world/a/21908835/chiquita-fyffes-merger-to-create-top-banana-company/	The West Australian	b	d2OyTeAXDFQpb3M9Cr_Ftde6Ig0aM	au.news.yahoo.com	1394487585723
737	Does Chiquita merger mean it will violate Charlotte incentives agreement?	http://www.bizjournals.com/charlotte/blog/outside_the_loop/2014/03/does-chiquita-merger-mean-it-will-violate.html	Charlotte Business Journal \(blog\)	b	d2OyTeAXDFQpb3M9Cr_Ftde6Ig0aM	www.bizjournals.com	1394487586017
738	Chiquita, Fyffes Merger Creates World's Largest Banana Company	http://www.franchiseherald.com/articles/5206/20140310/chiquita-fyffes-merger-creates-worlds-largest-banana-company.htm	Franchise Herald	b	d2OyTeAXDFQpb3M9Cr_Ftde6Ig0aM	www.franchiseherald.com	1394487586210
739	Chiquita (CQB) and Fyffes (FYFFF) merge to become world's largest banana  ...	http://www.stockhouse.com/news/natural-resources/2014/03/10/chiquita-cqb-and-fyffes-fyfff-merge-to-become-world-s-largest-banana-supplier	Stockhouse	b	d2OyTeAXDFQpb3M9Cr_Ftde6Ig0aM	www.stockhouse.com	1394487586387
740	Fruit rivals to merge and form world's largest banana company	http://www.irishmirror.ie/news/irish-news/banana-companies-fyffes-chiquita-merging-3227397	Irish Mirror	b	d2OyTeAXDFQpb3M9Cr_Ftde6Ig0aM	www.irishmirror.ie	1394487586538
741	Meet the New $1 Billion Banana Empire	http://247wallst.com/commodities-metals/2014/03/10/meet-the-new-1-billion-banana-empire/	24\/7 Wall St.	b	d2OyTeAXDFQpb3M9Cr_Ftde6Ig0aM	247wallst.com	1394487586706
742	Chiquita Deal Births World's Biggest Banana Firm	http://www.newser.com/story/183545/chiquita-deal-births-worlds-biggest-banana-firm.html	Newser	b	d2OyTeAXDFQpb3M9Cr_Ftde6Ig0aM	www.newser.com	1394487586882
743	Chiquita Shares Climb as Fyffes Merger Makes New Company Top Banana	http://www.thestreet.com/story/12523305/1/chiquita-shares-climb-as-fyffes-merger-makes-new-company-top-banana.html	TheStreet.com	b	d2OyTeAXDFQpb3M9Cr_Ftde6Ig0aM	www.thestreet.com	1394487587168
744	Business news and markets: as it happened - March 10, 2014	http://www.telegraph.co.uk/finance/business-news-markets-live/10687061/Business-news-and-markets-as-it-happened-March-10-2014.html	Telegraph.co.uk	b	d2OyTeAXDFQpb3M9Cr_Ftde6Ig0aM	www.telegraph.co.uk	1394487587361
745	Chiquita-Fyffes: How to make Ireland a banana republic	http://blogs.marketwatch.com/thetell/2014/03/10/chiquita-fyffes-how-to-make-ireland-a-banana-republic/	MarketWatch \(blog\)	b	d2OyTeAXDFQpb3M9Cr_Ftde6Ig0aM	blogs.marketwatch.com	1394487587571
746	Merger creates world's biggest banana supplier	http://thechronicleherald.ca/business/1192444-merger-creates-world-s-biggest-banana-supplier	TheChronicleHerald.ca	b	d2OyTeAXDFQpb3M9Cr_Ftde6Ig0aM	thechronicleherald.ca	1394487587756
747	ChiquitaFyffes merger to save millions through logistics and procurement	http://www.supplymanagement.com/news/2014/chiquitafyffes-merger-to-save-millions-through-logistics-and-procurement	Supply Management	b	d2OyTeAXDFQpb3M9Cr_Ftde6Ig0aM	www.supplymanagement.com	1394487587932
748	Chiquita, Fyffes Agree to $1.07 Billion Merger Deal -- 4th Update	http://online.wsj.com/article/BT-CO-20140310-707916.html	Wall Street Journal	b	d2OyTeAXDFQpb3M9Cr_Ftde6Ig0aM	online.wsj.com	1394487588160
749	Chiquita to Merge with Fyffes	http://consumergoods.edgl.com/news/Chiquita-to-Merge-with-Fyffes91587	Consumer Goods Technology	b	d2OyTeAXDFQpb3M9Cr_Ftde6Ig0aM	consumergoods.edgl.com	1394487588412
750	Chiquita Brands International Inc. (NYSE:CCQB) Acquires Fyffes Plc (FFY)	http://wallstreetpr.com/chiquita-brands-international-inc-nyseccqb-acquires-fyffes-plc-ffy-16962	WallStreetPR	b	d2OyTeAXDFQpb3M9Cr_Ftde6Ig0aM	wallstreetpr.com	1394487588587
751	Fyffes and Chiquita are getting hitched	http://www.cityindex.co.uk/market-analysis/market-news/25717362014/fyffes-and-chiquita-are-getting-hitched/	City Index	b	d2OyTeAXDFQpb3M9Cr_Ftde6Ig0aM	www.cityindex.co.uk	1394487588822
752	Chiquita share price rallies, acquires Fyffes Plc to create the largest banana  ...	http://www.binarytribune.com/2014/03/10/chiquita-share-price-rallies-acquires-fyffes-plc-to-create-the-largest-banana-company-worldwide/	Binary Tribune	b	d2OyTeAXDFQpb3M9Cr_Ftde6Ig0aM	www.binarytribune.com	1394487589056
753	Chiquita, Ireland's Fyffes merge, become top banana supplier	http://www.hurriyetdailynews.com/chiquita-irelands-fyffes-merge-become-top-banana-supplier.aspx\?pageID=238&amp;nID=63380&amp;NewsCatID=345	Hurriyet Daily News	b	d2OyTeAXDFQpb3M9Cr_Ftde6Ig0aM	www.hurriyetdailynews.com	1394487589224
754	Chiquita combines with Dutch based company	http://www.knoe.com/story/24932123/chiquita-combines-with-dutch-based-company	Knoe.com	b	d2OyTeAXDFQpb3M9Cr_Ftde6Ig0aM	www.knoe.com	1394487589375
755	Chiquita and Fyffes Merge to Create World's Largest Banana Company	http://www.entrepreneur.com/article/232081	Entrepreneur	b	d2OyTeAXDFQpb3M9Cr_Ftde6Ig0aM	www.entrepreneur.com	1394487589553
756	Chiquita OKs Fyffes merger creating world's largest banana supplier	http://www.theindychannel.com/news/daily-extras/chiquita-oks-fyffes-merger-creating-worlds-largest-banana-supplier	WRTV Indianapolis	b	d2OyTeAXDFQpb3M9Cr_Ftde6Ig0aM	www.theindychannel.com	1394487589737
757	Chiquita to Buy Fyffes Creating Biggest Banana Supplier	http://www.bloomberg.com/news/2014-03-10/chiquita-brands-to-merge-with-fyffes-to-create-banana-leader.html	Bloomberg	b	d2OyTeAXDFQpb3M9Cr_Ftde6Ig0aM	www.bloomberg.com	1394487590198
758	Chiquita, Fyffes Merge To Form World's Largest Banana Supplier	http://consumerist.com/2014/03/10/chiquita-fyffes-merge-to-form-worlds-largest-banana-supplier/	The Consumerist	b	d2OyTeAXDFQpb3M9Cr_Ftde6Ig0aM	consumerist.com	1394487590390
759	Fyffes shares soar as investors go bananas for Chiquita deal	http://www.irishtimes.com/business/sectors/agribusiness-and-food/fyffes-shares-soar-as-investors-go-bananas-for-chiquita-deal-1.1718908	Irish Times	b	d2OyTeAXDFQpb3M9Cr_Ftde6Ig0aM	www.irishtimes.com	1394487590585
760	Markets: Ireland's Fyffes to merge with Chiquita of original 'Banana Republic' fame	http://www.finfacts.ie/irishfinancenews/article_1027399.shtml	FinFacts Ireland	b	d2OyTeAXDFQpb3M9Cr_Ftde6Ig0aM	www.finfacts.ie	1394487590802
761	Chiquita, Fyffes to blend, to create top banana	http://www.bellinghamherald.com/2014/03/10/3520776/chiquita-fyffes-to-blend-to-create.html	Bellingham Herald	b	d2OyTeAXDFQpb3M9Cr_Ftde6Ig0aM	www.bellinghamherald.com	1394487591095
762	Charlotte-based Chiquita set to become world's largest banana supplier	http://myfox8.com/2014/03/10/charlotte-based-chiquita-set-to-become-worlds-largest-banana-supplier/	myfox8.com	b	d2OyTeAXDFQpb3M9Cr_Ftde6Ig0aM	myfox8.com	1394487591272
763	Will Chiquita-Fyffes Merger Fly With Regulators?	http://live.wsj.com/video/will-chiquita-fyffes-merger-fly-with-regulators/84567F3C-6C7B-4DA5-B942-D97C79D27783.html	Wall Street Journal	b	d2OyTeAXDFQpb3M9Cr_Ftde6Ig0aM	live.wsj.com	1394487591423
764	Merger to make Chiquita world's biggest banana company	http://www.hartfordbusiness.com/article/20140310/NEWS02/303109982	Hartford Business	b	d2OyTeAXDFQpb3M9Cr_Ftde6Ig0aM	www.hartfordbusiness.com	1394487591591
765	Banana business Fyffes announces merger with rival Chiquita	http://www.belfasttelegraph.co.uk/business/news/banana-business-fyffes-announces-merger-with-rival-chiquita-30078382.html	Belfast Telegraph	b	d2OyTeAXDFQpb3M9Cr_Ftde6Ig0aM	www.belfasttelegraph.co.uk	1394487591759
766	Chiquita Merges With Fyffes To Form World's Top Banana Firm	http://www.huffingtonpost.ca/2014/03/10/chiquita-fyffes-merger_n_4933674.html\?utm_hp_ref=canada-business	Huffington Post Canada	b	d2OyTeAXDFQpb3M9Cr_Ftde6Ig0aM	www.huffingtonpost.ca	1394487591919
767	Top Banana: Chiquita And Fyffe Announce Merger	http://www.benzinga.com/news/14/03/4377746/top-banana-chiquita-and-fyffe-announce-merger\?utm_source=feedburner&amp;utm_medium=feed&amp;utm_campaign=Feed%3A+benzinga%2Fnews%2Fglobal+(Channels+-+News+-+Global)	Benzinga	b	d2OyTeAXDFQpb3M9Cr_Ftde6Ig0aM	www.benzinga.com	1394487592163
768	Chiquita and Fyffes merge in $1 billion deal	http://www.theproducenews.com/index.php/news-dep-menu/test-featured/12473-chiquita-and-fyffes-merge-in-1-billion-deal	TheProduceNews.com	b	d2OyTeAXDFQpb3M9Cr_Ftde6Ig0aM	www.theproducenews.com	1394487592356
769	Top banana - Chiquita buys Fyffes	http://www.usatoday.com/videos/money/business/2014/03/10/6252067/	USA TODAY	b	d2OyTeAXDFQpb3M9Cr_Ftde6Ig0aM	www.usatoday.com	1394487592516
770	Irish firm becomes biggest banana supplier	http://www.u.tv/News/Irish-firm-becomes-biggest-banana-supplier/1ce66d5e-137b-4f53-b2b3-719c0fe103a2	U.TV	b	d2OyTeAXDFQpb3M9Cr_Ftde6Ig0aM	www.u.tv	1394487592675
771	Chiquita, Fyffes merge to form world's biggest banana company	http://www.cbc.ca/news/business/chiquita-fyffes-merge-to-form-world-s-biggest-banana-company-1.2566648	CBC.ca	b	d2OyTeAXDFQpb3M9Cr_Ftde6Ig0aM	www.cbc.ca	1394487592877
772	And then there were 3: Chiquita buys Fyffes	http://www.thepacker.com/fruit-vegetable-news/And-then-there-were-3-Chiquita-buys-Fyffes-249278901.html\?ref=901	The Packer	b	d2OyTeAXDFQpb3M9Cr_Ftde6Ig0aM	www.thepacker.com	1394487593121
773	Top banana as Fyffes and Chiquita merge	http://www.euronews.com/2014/03/10/top-banana-as-fyffes-and-chiquita-merge/	euronews	b	d2OyTeAXDFQpb3M9Cr_Ftde6Ig0aM	www.euronews.com	1394487593305
774	Chiquita now part of top banana company	http://www.newsday.com/business/chiquita-now-part-of-top-banana-company-1.7340616	Newsday	b	d2OyTeAXDFQpb3M9Cr_Ftde6Ig0aM	www.newsday.com	1394487593506
775	Why Chiquita (CQB) Is Up Today	http://www.thestreet.com/story/12523019/1/why-chiquita-cqb-is-up-today.html	TheStreet.com	b	d2OyTeAXDFQpb3M9Cr_Ftde6Ig0aM	www.thestreet.com	1394487593691
776	Chiquita Brands International (CQB) Is Up Sharply After Merger Announcement	http://www.rttnews.com/2283408/chiquita-brands-international-cqb-is-up-sharply-after-merger-announcement.aspx	RTT News	b	d2OyTeAXDFQpb3M9Cr_Ftde6Ig0aM	www.rttnews.com	1394487593895
777	CQB Stock: Chiquita, Fyffes to Create World's Biggest Banana Firm	http://investorplace.com/2014/03/cqb-stock-chiquita-fyffes-banana-firm/	Investorplace.com	b	d2OyTeAXDFQpb3M9Cr_Ftde6Ig0aM	investorplace.com	1394487594154
778	Chiquita Brands to Buy Fyffes to Form Biggest Banana Company	http://www.sfgate.com/business/bloomberg/article/Chiquita-Brands-to-Buy-Fyffes-to-Form-Biggest-5303191.php	San Francisco Chronicle	b	d2OyTeAXDFQpb3M9Cr_Ftde6Ig0aM	www.sfgate.com	1394487594346
779	Fyffes to merge with US rival	http://www.portsmouth.co.uk/news/business/local-business/fyffes-to-merge-with-us-rival-1-5925790	Portsmouth News	b	d2OyTeAXDFQpb3M9Cr_Ftde6Ig0aM	www.portsmouth.co.uk	1394487594548
780	Merger makes ChiquitaFyffes top banana	http://eatocracy.cnn.com/2014/03/10/merger-makes-chiquitafyffes-top-banana/	CNN	b	d2OyTeAXDFQpb3M9Cr_Ftde6Ig0aM	eatocracy.cnn.com	1394487594724
781	Share this on:	http://eatocracy.cnn.com/2014/03/10/merger-makes-chiquitafyffes-top-banana/\?hpt=ea_mid	CNN	b	d2OyTeAXDFQpb3M9Cr_Ftde6Ig0aM	eatocracy.cnn.com	1394487594909
782	Chiquita Brands and Fyffes Announce Merger to Create Banana Behemoth	http://www.bidnessetc.com/21214-chiquita-brands-international-inc-cqb-fyffes-plc-ffy-news-analysis-chiquita-brands-and-fyffes-announce-merger-to-create-banana-behemoth/	Bidness Etc	b	d2OyTeAXDFQpb3M9Cr_Ftde6Ig0aM	www.bidnessetc.com	1394487595229
783	Fyffes and Chiquita to create biggest banana firm	http://www.bbc.co.uk/news/business-26511507	BBC News	b	d2OyTeAXDFQpb3M9Cr_Ftde6Ig0aM	www.bbc.co.uk	1394487595388
784	World's Largest Banana Company Is Born	http://www.huffingtonpost.com/2014/03/10/largest-banana-company_n_4933389.html\?utm_hp_ref=food&amp;ir=Food	Huffington Post	b	d2OyTeAXDFQpb3M9Cr_Ftde6Ig0aM	www.huffingtonpost.com	1394487595574
785	Chiquita, Fyffes Agree to $1.07 Billion Merger Deal -- 3rd Update	http://online.wsj.com/article/BT-CO-20140310-704499.html	Wall Street Journal	b	d2OyTeAXDFQpb3M9Cr_Ftde6Ig0aM	online.wsj.com	1394487595800
786	Fyffes Agrees to Merger With Chiquita	http://www.nasdaq.com/article/fyffes-agrees-to-merger-with-chiquita-20140310-00352	NASDAQ	b	d2OyTeAXDFQpb3M9Cr_Ftde6Ig0aM	www.nasdaq.com	1394487596100
787	Chiquita, Ireland's Fyffes merge to form top banana supplier	http://au.finance.yahoo.com/news/chiquita-irelands-fyffes-merge-form-015340744.html	Yahoo\!7 News	b	d2OyTeAXDFQpb3M9Cr_Ftde6Ig0aM	au.finance.yahoo.com	1394487596370
788	Fyffes and Chiquita merger to create world's largest banana company	http://money.aol.co.uk/2014/03/10/fyffes-and-chiquita-merger-to-create-worlds-largest-banana-comp/	Aol Money	b	d2OyTeAXDFQpb3M9Cr_Ftde6Ig0aM	money.aol.co.uk	1394487596563
789	Chiquita combines with Dublin-based Fyffes to create world's top banana  ...	http://www.tribtown.com/view/story/b42aba730e274e2d9a18df9560851915/EU--Britain-US-Bananas	The Tribune	b	d2OyTeAXDFQpb3M9Cr_Ftde6Ig0aM	www.tribtown.com	1394487596748
790	World's Largest Banana Company Is Born	http://www.huffingtonpost.com/2014/03/10/largest-banana-company_n_4933389.html\?utm_hp_ref=business	Huffington Post	b	d2OyTeAXDFQpb3M9Cr_Ftde6Ig0aM	www.huffingtonpost.com	1394487596933
791	Chiquita merging with Fyffes; HQ will be in Dublin	http://www.bizjournals.com/charlotte/blog/outside_the_loop/2014/03/new-chiquitafyffes-headquarters-will-be-in-dublin.html	Charlotte Business Journal \(blog\)	b	d2OyTeAXDFQpb3M9Cr_Ftde6Ig0aM	www.bizjournals.com	1394487597193
792	Chiquita Brands to Merge With Fyffes to Create Banana Leader	http://www.sfgate.com/business/bloomberg/article/Chiquita-Brands-to-Merge-With-Fyffes-to-Create-5303132.php	San Francisco Chronicle	b	d2OyTeAXDFQpb3M9Cr_Ftde6Ig0aM	www.sfgate.com	1394487597501
793	Chiquita and Fyffes to create world's leading banana company	http://www.freshfruitportal.com/2014/03/10/chiquita-and-fyffes-to-create-worlds-leading-banana-company/\?country=others	Fresh Fruit Portal	b	d2OyTeAXDFQpb3M9Cr_Ftde6Ig0aM	www.freshfruitportal.com	1394487597702
794	Chiquita Brands To Buy Irish Rival	http://wvasfm.org/post/chiquita-brands-buy-irish-rival	WVAS	b	d2OyTeAXDFQpb3M9Cr_Ftde6Ig0aM	wvasfm.org	1394487597870
795	Hampshire fruit importer in merger to become top banana	http://www.dailyecho.co.uk/news/11064869.Hampshire_fruit_importer_in_merger_to_become_top_banana/	Daily Echo	b	d2OyTeAXDFQpb3M9Cr_Ftde6Ig0aM	www.dailyecho.co.uk	1394487598015
796	Top Banana! World's Biggest Producer Created	http://www.klfm967.co.uk/news/world-news/1226454/top-banana-worlds-biggest-producer-created/	KL.FM 96.7	b	d2OyTeAXDFQpb3M9Cr_Ftde6Ig0aM	www.klfm967.co.uk	1394487598190
797	An appealing offer: Chiquita merges with Fyffes to make world's largest banana  ...	http://www.washingtontimes.com/news/2014/mar/10/chiquita-merges-fyffes-make-worlds-largest-banana-/	Washington Times	b	d2OyTeAXDFQpb3M9Cr_Ftde6Ig0aM	www.washingtontimes.com	1394487598392
798	Chiquita Brands International Inc (CQB) news: Chiquita to buy Fyffes to create  ...	http://seekingalpha.com/news/1616083-chiquita-to-buy-fyffes-to-create-worlds-biggest-banana-firm	Seeking Alpha	b	d2OyTeAXDFQpb3M9Cr_Ftde6Ig0aM	seekingalpha.com	1394487598577
799	IRELAND: Fyffes Agrees Merger With Chiquita	http://www.kamcity.com/namnews/asp/newsarticle.asp\?newsid=74330	Namnews	b	d2OyTeAXDFQpb3M9Cr_Ftde6Ig0aM	www.kamcity.com	1394487598770
800	Chiquita buys Fyffes to create world's biggest banana supplier	http://au.news.yahoo.com/thewest/business/world/a/21908464/chiquita-buys-fyffes-to-create-worlds-biggest-banana-supplier/	The West Australian	b	d2OyTeAXDFQpb3M9Cr_Ftde6Ig0aM	au.news.yahoo.com	1394487598921
